Round,Speaker,Utterance
1,Moderator,"Debate Topic: In-depth discussion based on the following mission context, ROT idea, GOT idea, and LOT idea. Mission Context: Instruction: Write a friendly email to my teacher asking her to postpone our quiz schedule for tomorrow to next week because our basketball team is in the championship game tonight and all students will be out late celebrating our schools victory with pride! Initial Core Idea from GOT: Subject: Quiz Postponement Request - Go [School Name]!  Dear [Teacher's Name],  I hope you're having a wonderful day!  I'm writing to respectfully request a postponement of our quiz scheduled for tomorrow. Our school's basketball team is in the championship game tonight, and we're all incredibly excited! We anticipate a late night celebrating a potential victory, and I'm sure many of us will be out late celebrating our school's pride.  Given the circumstances, I'm concerned that we might not be in the best condition to focus on the quiz tomorrow. Would it be possible to reschedule it for sometime next week? I'm confident that we'll be able to prepare much better after we've had a chance to rest and recover from the excitement.  Thank you so much for your understanding and consideration. We really appreciate your flexibility!  Sincerely,  [Your Name] [Your Class/Period] Initial Core Idea from GOT: Subject: Request to Postpone Quiz - [Your Class Name] - Basketball Championship Celebration!  Dear [Teacher's Name],  I hope you're having a wonderful day!  Our school's basketball team is in the championship game tonight, and we're all incredibly excited! We're anticipating a late night celebrating a hopefully victorious game, and the whole school will be involved. Therefore, I was hoping, along with the rest of the class, that we could respectfully request if it would be possible to postpone our [Quiz Name] quiz scheduled for tomorrow to sometime next week?  We understand this is short notice and that rescheduling can be an inconvenience. We're all committed to doing well in your class, and we're happy to help in any way to make the quiz process smooth. Perhaps we could offer to help collect materials, summarize key concepts for classmates who might miss the review session, or assist with any other tasks that would make the transition easier for you.  Thank you so much for your understanding and consideration. We truly appreciate you!  Sincerely,  [Your Name] [Your Class]  Initial Detailed Plan from LOT: Aggregated result from layer 111 (Concept: 'Generate and present the answer...') using strategy 'all_content_ranked': - (Criterion: 'Criterion A (Level 1): Determine the specific quiz subject (e.g., ""History"", ""Math"").', Level: 1):   Okay, here's the beginning of the email, focusing on the quiz subject:  Subject: Request to Postpone [Quiz Subject] Quiz - [Your School Name] Basketball Championship!  Dear [Teacher's Name],  I hope this email finds you well. I'm writing to respectfully request a postponement of the [Quiz Subject] quiz scheduled for tomorrow.  - (Criterion: 'Criterion B (Level 1): Insert the correct date (tomorrow's date) for the quiz.', Level: 1):   Okay, here's the beginning of the email, including the date of the quiz as tomorrow's date:  Subject: Request to Postpone Quiz - [Your Class Name] - [Your Name]  Dear [Teacher's Name],  I hope you are having a good day!  I'm writing to respectfully request a postponement of the quiz scheduled for tomorrow, [Tomorrow's Date].  - (Criterion: 'Criterion C (Level 1): Identify the expected day of the week for the rescheduled quiz next week (e.g., Tuesday).', Level: 1):   Okay, the quiz is currently scheduled for tomorrow. Since tomorrow is [Insert current day of the week - e.g., Thursday], I'm asking to reschedule it to sometime next week. A good option would be the same day of the week, so that would be [Insert the day of the week next week - e.g., Thursday] next week. That gives us some time to recover from the celebration and prepare properly.  - (Criterion: 'Criterion D (Level 1): Choose a suitable salutation for the teacher (e.g., ""Dear Mr./Ms. [Last Name]"").', Level: 1):   Dear Ms. [Teacher's Last Name],  - (Criterion: 'Criterion E (Level 2): Select a phrase expressing enthusiasm about the basketball game (e.g., ""We're all incredibly excited!"").', Level: 1):   Here's a partial solution focusing on expressing enthusiasm for the basketball game:  ""We're all incredibly excited about the championship game tonight!""  - (Criterion: 'Criterion F (Level 2): Choose a closing and gratitude phrase (e.g., ""Thank you for your understanding."").', Level: 1):   Okay, here are a few options for a closing and gratitude phrase, suitable for the email:  *   **Option 1 (Simple and Direct):** ""Thank you for your understanding, [Teacher's Name].""  *   **Option 2 (Slightly more formal):** ""I would be very grateful if you would consider this request. Thank you for your time and consideration, [Teacher's Name].""  *   **Option 3 (Emphasizing Excitement):** ""Thank you so much for your understanding! We're all so excited, and we'll definitely be ready to ace the quiz next week. Best, [Teacher's Name].""  *   **Option 4 (Concise and Friendly):** ""Thanks so much! Sincerely, [Teacher's Name].""  - (Criterion: 'Criterion G (Level 2): Determine the specific class name or period.', Level: 1):   Okay, let's figure out the specific class name or period. Since I need to address my teacher directly, I need to know which class I'm writing about. I'll need to include this information in the email so she knows which class I'm referring to. I'll need to know:  *   **The subject of the class:** For example, ""Math,"" ""History,"" ""English,"" etc. *   **The period of the class:** For example, ""Period 3,"" ""Period 5,"" etc.  I'll insert placeholders for this information in my email draft, so I can personalize it later. My email will look something like this (with the placeholders):  ""...I'm writing to you regarding our [Class Subject] class, period [Period Number] quiz scheduled for tomorrow...""  - (Criterion: 'Criterion H (Level 3): Formulate a sentence explaining why a postponement is needed (e.g., celebrating a late-night victory).', Level: 1):   ...because we'll all be celebrating our team's victory in the championship game tonight, which will likely keep us out late and make it difficult to focus on a quiz tomorrow.  - (Criterion: 'Criterion I (Level 3): Decide on the level of formality for the email (e.g., friendly vs. slightly more formal).', Level: 1):   Okay, since the prompt specifies ""friendly email,"" the tone should be informal and warm. We'll use a conversational style with some enthusiasm and a touch of respect for the teacher. We can use phrases like ""Hope you're doing well!"" and ""Would it be possible...?"" to convey friendliness and politeness without being overly formal. The email should sound like it's coming from a student who is genuinely excited about the basketball team's success and is hoping for a small favor.  - (Criterion: 'Criterion J (Level 3): Consider and subtly address any school policies, if known, without directly mentioning them.', Level: 1):   Okay, here's the beginning of the email, incorporating a subtle nod to potential school policies regarding rescheduling, without directly mentioning them:  Subject: Request to Reschedule Quiz - [Your Class Name]  Dear [Teacher's Name],  I hope you're having a wonderful week!  I'm writing to respectfully request a postponement of our scheduled quiz for tomorrow. Our school's basketball team has made it to the championship game tonight, and the entire student body is incredibly excited! We anticipate a late night celebrating a potential victory, and the school spirit is truly infectious.  Knowing that everyone's focus will be on the game and the celebrations afterward, and understanding the importance of being well-prepared for assessments, I was hoping we could reschedule the quiz for sometime next week. Perhaps [Suggest a specific day or a timeframe, e.g., ""Monday or Tuesday""?]. I'm confident that having a bit more time to review the material would allow us to perform our best.  Thank you so much for considering my request. I truly appreciate your understanding and flexibility. We're all so proud of our team!  Sincerely,  [Your Name] [Your Grade/Class]  - (Criterion: 'Criterion K (Level 3): Add the student's name and class information to the email's closing.', Level: 1):   Okay, here's the beginning of the email, incorporating the student's name and class information in the closing:  Subject: Request to Postpone Quiz - [Your Class Name]  Dear [Teacher's Name],  I am writing to respectfully request a postponement of tomorrow's quiz. Our school's basketball team is in the championship game tonight, and we are all incredibly excited! We anticipate a late night celebrating our school's victory with pride, and I'm concerned that we won't be in the best condition to focus on the quiz tomorrow.  Would it be possible to reschedule the quiz for sometime next week?  Thank you for your understanding and consideration.  Sincerely,  [Your Name] [Your Class - e.g., 10th Grade English, Period 3]   The debate will now commence."
2,ROT_Representative,"As the ROT Representative, my core idea revolves around a simple yet effective strategy: **explicitly linking the quiz postponement request to the school's basketball team's championship game and the anticipated late-night celebration.** This approach leverages the shared excitement and school spirit to create a relatable and persuasive argument.  Here's how my idea addresses the core problem and its key strengths:  *   **Core Problem:** The core problem is convincing the teacher to reschedule the quiz. *   **My Solution:** Frame the request as a matter of student well-being and academic performance, directly tied to the championship game. The anticipation of a late night and potential fatigue naturally leads to the conclusion that students might not be at their best for the quiz. *   **Key Strengths:**     *   **Relevance:** It directly addresses the teacher's potential concerns about student focus and preparedness.     *   **Relatability:** The shared experience of school pride and excitement makes it easy for the teacher to empathize.     *   **Clarity:** It is straightforward and easy to understand, avoiding unnecessary complexities.     *   **Positivity:** The emphasis on celebration and school spirit creates a positive tone, making the request more palatable.     *   **Conciseness:** The message is delivered efficiently without being overly verbose.  Now, let's critically evaluate the GOT and LOT ideas:  **GOT (Graph of Thoughts) Evaluation:**  *   **Subject: Request to Postpone Quiz - [Your Class Name] - Basketball Championship Celebration!**     *   **Strengths:**         *   Clear subject line that immediately conveys the reason for the email.         *   Expresses enthusiasm and excitement.         *   Acknowledges the short notice and offers potential solutions (collecting materials, summarizing concepts).         *   Includes a polite and appreciative tone.     *   **Weaknesses:**         *   **Overly Proactive/Potentially Appeasing:** While offering to help is commendable, it might inadvertently suggest a lack of confidence in the students' ability to handle the quiz. It could also come across as slightly desperate.         *   **Lengthy:** The email is a bit longer than necessary, which could dilute the core message.         *   **Redundancy:** The email repeats the same points multiple times.     *   **Limitations:** The GOT idea provides a good initial draft, but it can be improved by directly addressing the core issue.  **LOT (Layer of Thoughts) Evaluation:**  *   **Aggregated Result from layer 111 (Concept: 'Generate and present the answer...') using strategy 'all_content_ranked':**     *   **Strengths:**         *   Breaks down the email composition into smaller, manageable steps (criteria).         *   Provides multiple options for phrases and closings.         *   Emphasizes the importance of including the class name and student's name.     *   **Weaknesses:**         *   **Fragmented:** The LOT approach feels disjointed, as it is broken into too many individual steps.         *   **Lack of Cohesion:** The individual criteria don't always flow together seamlessly to create a cohesive whole.         *   **Mechanical:** The process seems overly mechanical, potentially leading to a less natural and heartfelt email.         *   **Over-Optimization:** Some criteria seem like they might add unnecessary complexity.     *   **Limitations:** The LOT idea focuses on breaking the problem into steps without a central idea.  **Why My Approach Is Preferable:**  My approach is preferable because it prioritizes **simplicity, relevance, and emotional connection**. It directly addresses the teacher's potential concerns and leverages the shared excitement surrounding the basketball game to create a compelling argument. The GOT and LOT ideas, while containing useful elements, introduce unnecessary complexity and might inadvertently weaken the core message. My idea is more direct, easier to understand, and more likely to resonate with the teacher, ultimately increasing the chances of a successful quiz postponement."
3,GOT_Representative,"Okay, here's a breakdown of the GOT Representative's perspective on the task, analyzing the core idea, the ROT and LOT ideas, and explaining why the core idea is superior:  **GOT Representative's Core Idea: 'Subject: Request to Postpone Quiz - [Your Class Name] - Basketball Championship Celebration!'**  The core idea is a well-structured, friendly email designed to persuade a teacher to postpone a quiz. It directly addresses the problem by:  *   **Clear and Concise Subject Line:** Immediately informs the teacher of the email's purpose. *   **Polite and Respectful Tone:** Uses phrases like ""Dear [Teacher's Name],"" ""I hope you're having a wonderful day!"", and ""Thank you so much for your understanding and consideration."" *   **Explicit Reason for the Request:** Clearly states the basketball championship as the reason for needing a postponement. *   **Acknowledges Potential Inconvenience:** Recognizes that rescheduling can be difficult for the teacher. *   **Offers Solutions and Assistance:** Proactively offers help (collecting materials, summarizing key concepts) to ease the transition. This demonstrates responsibility and a willingness to mitigate any burden on the teacher. *   **Emphasizes Enthusiasm and School Spirit:** Highlights the excitement surrounding the game and the shared experience of the class. *   **Specific and Actionable Request:** Asks for the quiz to be postponed to ""sometime next week"" (leaving room for negotiation but also setting a clear expectation). *   **Includes Essential Information:** Provides the student's name and class information for clarity.  **Key Strengths:**  *   **Persuasive:** The combination of politeness, a clear explanation, and offers of help makes the email more likely to be successful. *   **Empathetic:** Shows understanding of the teacher's perspective. *   **Proactive:** Demonstrates responsibility and a willingness to contribute. *   **Concise:** Gets to the point without being overly verbose. *   **Positive Tone:** Maintains a friendly and enthusiastic attitude.  **Critical Evaluation of ROT (Reversal Of Thought) Idea:**  The ROT idea, ""Subject: Quiz Postponement Request - Go [School Name]!"" presents a less effective approach:  *   **Subject Line:** While the ""Go [School Name]!"" adds school spirit, it's less informative than the core idea's subject line. *   **Concerns vs. Solutions:** The ROT focuses primarily on the *concern* of not being in the best condition for the quiz, rather than offering *solutions* or acknowledging the teacher's potential inconvenience. *   **Less Proactive:** The ROT doesn't offer any assistance to the teacher, which weakens the persuasive argument. *   **Less Detailed:** The ROT is shorter and less elaborative regarding the reasons for the request. *   **Over-reliance on ""Concern"":** The ROT relies heavily on the student's *concern* about being unprepared. While this is understandable, it doesn't offer as compelling a reason for postponement as the core idea, which highlights the shared celebratory experience and the class's commitment to doing well.  **Weaknesses of the ROT:**  *   Less persuasive because it focuses on the student's potential problem without offering solutions. *   Lacks the proactive and helpful elements of the core idea.  **Critical Evaluation of LOT (Layer Of Thoughts) Idea:**  The LOT idea is a collection of fragmented steps and criteria, rather than a cohesive whole. It's a good starting point for breaking down the task, but as an email itself, it's not as polished or effective as the core idea.  *   **Fragmented Approach:** The LOT presents individual criteria (e.g., ""Determine the specific quiz subject,"" ""Choose a suitable salutation"") rather than a unified email. *   **Lack of Cohesion:** The individual steps don't flow together seamlessly to create a well-written email. *   **Iterative, Not Final:** The LOT is a process of building an email, not the finished product. *   **Less Persuasive:** While the LOT incorporates important elements, the final product is not as persuasive because it lacks the smooth flow and thoughtful considerations of the core idea.  **Weaknesses of the LOT:**  *   Not a ready-to-use email; requires significant assembly. *   Less persuasive due to its fragmented nature.  **Why the Core Idea is Preferable:**  The core idea is superior because it provides a complete, polished, and persuasive email. It directly addresses the teacher, clearly states the reason for the request, acknowledges potential inconvenience, and offers proactive solutions. The ROT and LOT ideas, while containing useful components, lack the overall effectiveness and persuasive power of the core idea. The core idea is a well-crafted communication designed to achieve the desired outcome: quiz postponement."
4,LOT_Representative,"Okay, as the LOT Representative, I will elaborate on the core idea of generating a friendly email requesting a quiz postponement, focusing on the ""all_content_ranked"" strategy for layer 111.  **Core Idea: Aggregated Result from Layer 111 (Concept: 'Generate and present the answer...') using strategy 'all_content_ranked'**  My core idea is to construct a friendly and effective email to a teacher, requesting a postponement of a quiz due to the school's basketball team's championship game. This involves several key considerations:  *   **Subject Line:** Clear and concise, immediately conveying the purpose of the email. *   **Salutation:** Appropriate and respectful. *   **Enthusiasm:** Expressing excitement for the basketball game. *   **Reasoning:** Clearly explaining why a postponement is necessary (late-night celebrations). *   **Proposed Solution:** Suggesting a specific timeframe for rescheduling. *   **Acknowledgement:** Recognizing the teacher's time and consideration. *   **Closing:** A polite and appreciative closing, including the student's name and class information. *   **Tone:** Friendly, respectful, and understanding.  This approach addresses the core problem of requesting a favor while maintaining a positive and respectful tone. It considers the teacher's perspective and proposes a solution that minimizes inconvenience. It also subtly acknowledges any potential school policies without directly mentioning them and provides the teacher with enough information to make a decision.  **Key Strengths of My Approach:**  *   **Comprehensive:** It addresses all the criteria outlined, ensuring a well-rounded and persuasive email. *   **Considerate:** It demonstrates understanding of the teacher's position and the importance of proper preparation for the quiz. *   **Proactive:** It suggests a solution (rescheduling) rather than just stating the problem. *   **Friendly and Respectful:** The tone is crucial for a positive outcome. *   **Clear and Concise:** The email is easy to understand and gets straight to the point. *   **Customizable:** The use of placeholders allows for easy personalization.  **Critical Evaluation of GOT and ROT Ideas**  Now, let's analyze the provided Graph of Thoughts (GOT) and Reversal of Thought (ROT) ideas:  **GOT Idea:**  ``` Subject: Request to Postpone Quiz - [Your Class Name] - Basketball Championship Celebration!  Dear [Teacher's Name],  I hope you're having a wonderful day!  Our school's basketball team is in the championship game tonight, and we're all incredibly excited! We're anticipating a late night celebrating a hopefully victorious game, and the whole school will be involved. Therefore, I was hoping, along with the rest of the class, that we could respectfully request if it would be possible to postpone our [Quiz Name] quiz scheduled for tomorrow to sometime next week?  We understand this is short notice and that rescheduling can be an inconvenience. We're all committed to doing well in your class, and we're happy to help in any way to make the quiz process smooth. Perhaps we could offer to help collect materials, summarize key concepts for classmates who might miss the review session, or assist with any other tasks that would make the transition easier for you.  Thank you so much for your understanding and consideration. We truly appreciate you!  Sincerely,  [Your Name] [Your Class] ```  *   **Strengths:** The GOT idea is well-written, friendly, and respectful. It clearly states the reason for the request and offers helpful solutions to mitigate any inconvenience. *   **Weaknesses:** It could be improved by including the date and a more specific suggestion for rescheduling. It also uses a slightly more formal tone than is strictly necessary for a friendly email. The offer to help is good, but might be overkill. The email is a little long.  **ROT Idea:**  ``` Subject: Quiz Postponement Request - Go [School Name]!  Dear [Teacher's Name],  I hope you're having a wonderful day!  I'm writing to respectfully request a postponement of our quiz scheduled for tomorrow. Our school's basketball team is in the championship game tonight, and we're all incredibly excited! We anticipate a late night celebrating a potential victory, and I'm sure many of us will be out late celebrating our school's pride.  Given the circumstances, I'm concerned that we might not be in the best condition to focus on the quiz tomorrow. Would it be possible to reschedule it for sometime next week? I'm confident that we'll be able to prepare much better after we've had a chance to rest and recover from the excitement.  Thank you so much for your understanding and consideration. We really appreciate your flexibility!  Sincerely,  [Your Name] [Your Class/Period] ```  *   **Strengths:** The ROT idea is concise, friendly, and directly addresses the core issue. It clearly states the reason for the request and asks for a postponement. *   **Weaknesses:** It could be improved by being more specific about the timing of the rescheduling. The subject line, while enthusiastic, could be slightly more informative.  **Why My Approach is Preferable**  My approach prioritizes a combination of strengths:  *   **Specificity:** My email draft provides a framework with placeholders for crucial details, allowing for easy personalization to the specific class, quiz, and date. This is more practical than the GOT and ROT ideas, which require more adaptation. *   **Balance of Enthusiasm and Respect:** My tone strikes a good balance between expressing excitement and being respectful of the teacher's time and effort. *   **Actionable:** It clearly states the problem, offers a solution (rescheduling), and is written in a manner that is most likely to garner a positive response. *   **Conciseness:** While comprehensive, my approach aims for clarity and efficiency in communication.  In essence, while both the GOT and ROT ideas are acceptable, my approach offers a more structured, adaptable, and potentially more persuasive email, optimized for a positive outcome while addressing all the requirements. My approach achieves the desired result in a clear, concise, and friendly manner, demonstrating a strong understanding of the prompt's requirements. It ensures a high probability of a successful outcome: quiz postponement!"
