Round,Speaker,Utterance
1,Moderator,"Debate Topic: In-depth discussion based on the following mission context, ROT idea, GOT idea, and LOT idea. Mission Context: Instruction: John buys cans of soup for buy 1 get one free.  He gets 30 cans with a normal price of $0.60.  How much does he pay? Initial Core Idea from GOT: Okay, based on the problem description and the previously defined task, let's calculate the total cost John pays.  We are given:  *   Number of cans (C) = 30 *   Price per can (P) = $0.60  Using the formula derived earlier:  `Cost(C, P) = CEILING(C / 2) * P`  1.  Calculate the number of cans John pays for: `CEILING(30 / 2) = CEILING(15) = 15` 2.  Calculate the total cost: `15 * 0.60 = 9.00`  Therefore, John pays $9.00.  **Answer:**  9.00 Initial Core Idea from GOT: **1. Determine the number of cans John pays for:**  *   With the ""buy one get one free"" deal, John only pays for half the number of cans he receives. Since he gets 30 cans, he pays for 30 cans / 2 = 15 cans.  **2. Calculate the total cost:**  *   The normal price per can is $0.60. *   John pays for 15 cans, so the total cost is 15 cans * $0.60/can = $9.00  **Answer:** John pays $9.00.  Initial Detailed Plan from LOT: Aggregated result from layer 187 (Concept: 'Generate and present the answer...') using strategy 'all_content_ranked': - (Criterion: 'Re-state the core calculation in different ways', Level: 1):   Here are different ways to express the core calculation of the problem:  *   **Cost per pair:** Since it's buy-one-get-one-free, each pair of cans effectively costs $0.60. *   **Number of pairs:** John gets 30 cans, which is 30 / 2 = 15 pairs. *   **Total cost:** The total cost is 15 pairs * $0.60/pair = $9.00.  Alternatively:  *   **Number of cans paid for:** John pays for half the cans, so he pays for 30 / 2 = 15 cans. *   **Total cost:** The total cost is 15 cans * $0.60/can = $9.00.  - (Criterion: 'Consider alternative phrasing for the final answer', Level: 1):   Here are a few alternative phrasings for the final answer, all equivalent to ""$9.00"":  *   John's total cost is $9.00. *   The total amount John pays is $9.00. *   John spends $9.00 on the soup. *   The cost for the soup is $9.00. *   The total bill for the soup is $9.00.  - (Criterion: 'Explore different rounding approaches (if necessary) and justify the choice', Level: 1):   The calculation results in $9.00 exactly, so no rounding is necessary. The number of cans John pays for (15) multiplied by the price per can ($0.60) equals $9.00. Since there are no fractional cents, rounding is not applicable.  - (Criterion: 'Check the answer using a slightly different method (e.g., total cost without discount minus the discount amount)', Level: 1):   Okay, let's verify the $9.00 answer using a different approach.  1. **Total cost without discount:** 30 cans * $0.60/can = $18.00  2. **Number of free cans:** Since it's buy one get one free, John gets half the cans for free. 30 cans / 2 = 15 free cans.  3. **Value of free cans (the discount):** 15 cans * $0.60/can = $9.00  4. **Final cost:** Total cost without discount - discount = $18.00 - $9.00 = $9.00  This confirms the original answer.  - (Criterion: 'Explicitly address potential edge cases or ambiguities not fully covered in previous assumptions (e.g., what if the store only allows buying in even numbers?)', Level: 1):   The problem states John *gets* 30 cans with a buy-one-get-one-free deal. This implies he *bought* 15 cans and received 15 free. The calculation from previous steps (30/2 * $0.60) is based on this assumption.  However, let's consider some edge cases:  *   **Odd Number of Cans Available:** What if John wanted 31 cans? He would still only pay for 16 cans (15 pairs + 1 single). The problem doesn't specify a limit on the number of cans he can buy. We assume he can buy any number of cans.  *   **Store Policy on Odd Numbers:** Some stores might require buying in even numbers to take advantage of the BOGO deal. If the store *requires* buying in even numbers, and John wanted 30 cans, he would need to buy exactly 30 cans (15 pairs). If he wanted 31 cans, he might be forced to buy 32 (16 pairs) to get the deal, or purchase the 31st can at full price. The problem doesn't state such a restriction, so we assume no such restriction exists.  *   **Cans Not Available:** What if the store only had 25 cans available? In this case, John could only get a maximum of 25 cans. He would pay for 13 cans and get 12 free. This is outside the scope of the problem, which states he *gets* 30 cans.  *   **Tax:** The problem doesn't mention sales tax, so we assume it is not included.  Since the problem states John *gets* 30 cans, and doesn't specify any restrictions, we assume the buy-one-get-one-free deal applies perfectly, and he only pays for half the cans. The potential edge cases don't change the final answer given the problem statement.  - (Criterion: 'Present the answer with varying levels of detail in the explanation', Level: 1):   Okay, here are a few ways to present the answer with varying levels of detail, building upon the previous answer of $9.00:  **Level 1: Simplest Answer**  *   John pays $9.00.  **Level 2: Slightly More Detail**  *   John pays $9.00 because he only pays for half of the 30 cans due to the buy-one-get-one-free deal.  **Level 3: More Detailed Explanation**  *   Since it's a buy-one-get-one-free deal, John only pays for half of the 30 cans, which is 15 cans. Each can costs $0.60, so he pays 15 * $0.60 = $9.00.  **Level 4: Most Detailed Explanation (Reiterating the Problem)**  *   John is buying cans of soup with a buy-one-get-one-free offer. He gets 30 cans in total. Because of the deal, he only pays for half of the cans. Half of 30 is 15. Each can normally costs $0.60. Therefore, John pays 15 cans * $0.60/can = $9.00.  - (Criterion: 'Vary the level of technical language used in the explanation', Level: 1):   Okay, let's rephrase the explanation with varying levels of technical language, all arriving at the same answer:  **Option 1 (Simple Language):**  John gets 30 cans of soup, but only pays for half because of the deal. That means he pays for 30 / 2 = 15 cans. Each can costs $0.60, so he pays 15 * $0.60 = $9.00.  **Option 2 (Slightly More Technical):**  Due to the ""buy one get one free"" promotion, John effectively pays for half the cans he receives. Therefore, he is charged for 30 cans / 2 = 15 cans.  The total cost is then calculated as 15 cans * $0.60/can = $9.00.  **Option 3 (Most Technical/Mathematical):**  Let *n* be the number of cans John buys, which is 30.  Since it's a buy-one-get-one-free deal, the number of cans he pays for is *n*/2 = 30/2 = 15. Let *p* be the price per can, which is $0.60.  The total cost, *C*, is given by *C* = (*n*/2) * *p* = 15 * $0.60 = $9.00. Therefore, John pays $9.00.  - (Criterion: 'Consider the perspective of someone who might not understand the problem and adjust the explanation accordingly', Level: 1):   Okay, let's break this down for someone who might find it confusing.  * **The Deal:**  John is getting a ""buy one, get one free"" deal on soup. This means for every can he pays for, he gets another one for free.  * **Total Cans:** He ends up with 30 cans of soup.  * **Pairs:** Since it's buy one get one free, we need to figure out how many *pairs* of soup cans he got.  To do that, we divide the total number of cans (30) by 2: 30 / 2 = 15 pairs.  * **Cans He Pays For:**  He only pays for one can in each pair. So he only pays for 15 cans.  * **Price Per Can:** Each can normally costs $0.60.  * **Total Cost:** To find the total cost, we multiply the number of cans he pays for (15) by the price per can ($0.60): 15 * $0.60 = $9.00  * **Answer:** John pays $9.00.  - (Criterion: 'Present the solution with and without a concluding statement', Level: 1):   **With a concluding statement:**  John pays $9.00. Therefore, the total cost is $9.00.  **Without a concluding statement:**  John pays $9.00.  - (Criterion: 'Format the answer in multiple currency formats (if applicable, but here it's just USD)', Level: 1):   Here's the answer formatted to show different ways to represent the USD amount:  *   **USD:** $9.00 *   **US Dollars:** 9.00 US Dollars *   **USD (written out):** Nine US Dollars   The debate will now commence."
2,ROT_Representative,"Okay, as the ROT (Reversal Of Thought) Representative, let's elaborate on my core idea and compare it to the GOT and LOT approaches.  **Core Idea Elaboration:**  My core idea, ""Okay, based on the problem description and the previously defined task, let's calculate the total cost John pays,"" is essentially a directive to directly address the problem's objective. It's a call to action to perform the necessary calculation. I then provided a formula `Cost(C, P) = CEILING(C / 2) * P` which can be used to solve similar problems. The subsequent steps are simply applying this formula with the given values.  **Strengths of My Idea:**  *   **Directness:** It immediately focuses on the goal: finding the total cost. There's no unnecessary preamble or abstraction. *   **Efficiency:** It proceeds directly to the calculation without dwelling on unnecessary details. *   **Clarity:** The steps are easy to follow and understand. *   **Generalizability:** The formula I provide can be used to solve similar problems.  **Critical Evaluation of GOT (Graph Of Thoughts):**  The GOT idea breaks down the problem into two steps:  1.  Determine the number of cans John pays for. 2.  Calculate the total cost.  **Strengths of GOT:**  *   **Structured Approach:** It provides a clear, step-by-step solution. *   **Easy to Understand:** The steps are logical and easy to follow.  **Weaknesses of GOT:**  *   **Redundancy:** The ""Determine the number of cans John pays for"" step is somewhat redundant. It's already implied by the problem's condition (buy-one-get-one-free). *   **Lacks Generalizability:** The solution is tailored to this specific problem and doesn't offer a broader framework for similar problems. *   **Less Efficient:** While clear, it takes an extra step compared to a more direct approach.  **Critical Evaluation of LOT (Layer Of Thoughts):**  The LOT idea presents a much more detailed and extensive exploration of the problem, covering various aspects like alternative phrasing, rounding (though unnecessary), edge cases, and different levels of explanation.  **Strengths of LOT:**  *   **Comprehensive:** It considers various aspects of the problem, including potential ambiguities and edge cases. *   **Detailed Explanation:** It provides explanations at varying levels of detail, catering to different audiences. *   **Thorough Verification:** It checks the answer using different methods.  **Weaknesses of LOT:**  *   **Overkill:** The level of detail is excessive for such a simple problem. It introduces unnecessary complexity. *   **Distraction:** The exploration of edge cases (e.g., odd number of cans available, store policies) distracts from the core problem. *   **Inefficiency:** The extensive analysis is time-consuming and inefficient for a straightforward calculation. *   **Lacks Focus:** While thorough, it loses focus on the primary objective, which is to simply calculate the cost. It spends too much effort exploring peripheral issues.  **Why My Approach is Preferable:**  My ROT approach is preferable because it provides the most direct and efficient solution while maintaining clarity. The GOT is helpful but adds a redundant step. The LOT, while thorough, is overkill for this problem. My approach is more focused on the core task, avoiding unnecessary complexity and potential distractions. My inclusion of the formula `Cost(C, P) = CEILING(C / 2) * P` also allows for generalizability.  *   **Efficiency:** My approach gets straight to the point and provides the answer quickly. *   **Clarity:** The steps are easy to understand and follow. *   **Focus:** My approach keeps the focus on the core objective of calculating the total cost.  In summary, while the GOT and LOT approaches have their merits, my ROT approach provides the most balanced and efficient solution for this specific problem, prioritizing directness, clarity, and focus on the primary objective, and generalizability. The GOT adds a redundant step and the LOT is an overkill."
3,GOT_Representative,"Okay, as the GOT Representative, let me elaborate on my core idea and critically evaluate the ROT and LOT ideas.  **My Core Idea: Direct and Efficient Calculation**  My core idea is straightforward:  1.  **Determine the number of cans John pays for:** Since it's a ""buy one get one free"" deal, John pays for half the number of cans he receives. With 30 cans, he pays for 30 / 2 = 15 cans. 2.  **Calculate the total cost:** The cost per can is $0.60, so the total cost is 15 cans * $0.60/can = $9.00.  **Strengths:**  *   **Simplicity:** It's easy to understand and follow, directly addressing the core problem without unnecessary complexity. *   **Efficiency:** It arrives at the solution in two clear steps, minimizing cognitive load. *   **Accuracy:** It accurately reflects the buy-one-get-one-free scenario.  **Evaluation of the ROT Idea:**  The ROT idea uses the formula `Cost(C, P) = CEILING(C / 2) * P`. While it arrives at the correct answer, it introduces unnecessary complexity with the `CEILING` function.  **Weaknesses:**  *   **Unnecessary Complexity:** The `CEILING` function is redundant in this specific case because 30/2 is already a whole number (15). The `CEILING` function is intended to round up a decimal number to the nearest integer, but it's unnecessary here. It adds a layer of abstraction that doesn't improve clarity or accuracy. It's better to use a simpler calculation when possible.  **Why My Approach is Preferable:**  My approach is more direct and easier to understand. It avoids introducing unnecessary functions like `CEILING` when a simple division works perfectly. Simplicity leads to fewer opportunities for errors and better maintainability of the thought process.  **Evaluation of the LOT Idea:**  The LOT idea, specifically the aggregated result from layer 187, presents a comprehensive exploration of alternative calculations, phrasing, edge cases, and levels of detail. While valuable, it also has its drawbacks.  **Weaknesses:**  *   **Overkill:** While exploring alternative phrasing and rounding approaches is good practice in general, it's excessive for this simple problem. The core calculation is straightforward, and the answer is already precise. Over-analyzing can obscure the simplicity of the solution. *   **Edge Case Distractions:** While considering edge cases like ""odd number of cans available"" or ""store policy on odd numbers"" is commendable for robustness, they are not relevant to the problem statement, which explicitly states John *gets* 30 cans. Focusing on these hypothetical scenarios can distract from the core problem. *   **Redundancy:** Many of the variations in explanation (different levels of detail, technical language, perspectives) ultimately repeat the same core calculation. While demonstrating flexibility, it doesn't add significant value in this specific instance. *   **Potential for Confusion:** The sheer volume of information and alternative approaches could potentially confuse someone unfamiliar with the problem, rather than clarifying it.  **Why My Approach is Preferable:**  My approach focuses on the *essential* steps to solve the problem. It's concise, efficient, and directly addresses the question without getting bogged down in unnecessary details or hypothetical scenarios. While the LOT idea demonstrates thoroughness, my approach prioritizes clarity and efficiency, making it easier to understand and apply in this specific context. The LOT idea is better suited for complex problems with genuine ambiguities or edge cases. For this simple problem, less is more."
4,LOT_Representative,"Okay, I'm LOT_Representative, and I'll elaborate on my core idea and compare it to the GOT and ROT ideas.  **Elaboration on the LOT Core Idea**  My core idea, ""Aggregated result from layer 187 (Concept: 'Generate and present the answer...') using strategy 'all_content_ranked',"" focuses on exhaustively exploring various ways to represent the solution to the problem. This involves:  1.  **Re-stating the core calculation:**  Presenting the underlying math in different, but equivalent, ways to ensure understanding. 2.  **Alternative phrasing:**  Varying the wording of the final answer for clarity and impact. 3.  **Rounding considerations:**  Addressing whether rounding is necessary (and justifying why or why not). 4.  **Verification:**  Checking the answer with an alternative method to confirm accuracy. 5.  **Edge case analysis:**  Exploring potential ambiguities or unstated assumptions. 6.  **Varying detail levels:**  Offering the answer with different levels of explanation to cater to different audiences. 7.  **Varying technical language:** Adjusting the technicality of the explanation. 8.  **Considering different perspectives:** Framing the solution for someone who might struggle with the problem. 9.  **Including/excluding concluding statements:**  Providing the answer with and without a concluding remark. 10. **Formatting the answer:** Presenting the answer in different currency formats.  **How the LOT Idea Addresses the Core Problem**  The core problem is a simple calculation, but the LOT approach elevates it beyond just finding the numerical answer. It ensures a *deep* understanding of the problem and its solution by rigorously exploring all facets of it. It emphasizes clarity, accuracy, and accessibility for a broad audience.  **Key Strengths of the LOT Idea**  *   **Comprehensive Understanding:**  It fosters a thorough understanding of the problem, not just a superficial one. *   **Error Prevention:**  The verification step helps catch calculation errors. *   **Clarity and Communication:**  The varying levels of detail and technical language allow for effective communication to diverse audiences. *   **Robustness:** The edge case analysis highlights the assumptions and limitations of the solution. *   **Accessibility:** The explanation tailored for someone who might not understand the problem ensures inclusivity.  **Critical Evaluation of the GOT Idea**  The GOT (Graph Of Thoughts) idea is:  **1. Determine the number of cans John pays for:**  *   With the ""buy one get one free"" deal, John only pays for half the number of cans he receives. Since he gets 30 cans, he pays for 30 cans / 2 = 15 cans.  **2. Calculate the total cost:**  *   The normal price per can is $0.60. *   John pays for 15 cans, so the total cost is 15 cans * $0.60/can = $9.00  **Answer:** John pays $9.00.  **Weaknesses of the GOT Idea:**  *   **Lack of Depth:**  It's a straightforward calculation with minimal explanation. It doesn't explore alternative approaches, edge cases, or different levels of detail. *   **Limited Audience:**  It assumes the reader understands the buy-one-get-one-free concept and doesn't cater to those who might struggle with it. *   **No Verification:** There's no check to ensure the answer is correct.  **Critical Evaluation of the ROT Idea**  The ROT (Reversal Of Thought) idea is:  Okay, based on the problem description and the previously defined task, let's calculate the total cost John pays.  We are given:  *   Number of cans (C) = 30 *   Price per can (P) = $0.60  Using the formula derived earlier:  `Cost(C, P) = CEILING(C / 2) * P`  1.  Calculate the number of cans John pays for: `CEILING(30 / 2) = CEILING(15) = 15` 2.  Calculate the total cost: `15 * 0.60 = 9.00`  Therefore, John pays $9.00.  **Answer:**  9.00  **Weaknesses of the ROT Idea:**  *   **Unnecessary Complexity:** The introduction of the `CEILING` function is not needed since 30/2 is already an integer. This adds unnecessary complexity. *   **Limited Explanation:** While slightly more structured than the GOT, it still lacks the depth of the LOT approach. It doesn't explore alternative approaches, edge cases, or varying levels of detail extensively. *   **Lack of Edge-Case Analysis:** The ROT idea doesn't address any edge cases or alternative scenarios. *   **Limited Audience:** It doesn't consider someone who might not understand the problem initially.  **Why the LOT Approach is Preferable**  The LOT approach is preferable because it's significantly more comprehensive and robust. While the GOT and ROT ideas provide a correct answer, they lack the depth of understanding, the verification steps, the audience consideration, and the exploration of edge cases that the LOT approach offers. The LOT approach isn't just about getting the answer; it's about *understanding* the problem and communicating the solution effectively to everyone. The GOT and ROT provide the *what*, whereas the LOT provides the *why* and the *how* along with the *what*. The LOT's exhaustive approach ensures a more complete and reliable solution, which is critical when dealing with complex problems or when explaining solutions to others."
5,Critical_Analyst,"Okay, let's analyze the solutions from ROT and GOT, focusing on their correctness, completeness, potential weaknesses, and areas for improvement.  **ROT's Solution:**  *   **Correctness:** The calculation and final answer are correct. *   **Completeness:** The solution presents the calculation steps clearly. *   **Potential Weaknesses:** The use of the `CEILING` function is unnecessary in this specific case. While mathematically correct, it introduces a level of complexity that isn't required since 30/2 results in a whole number. It might confuse someone less mathematically inclined. The reliance on a ""formula derived earlier"" (which isn't present here) makes the solution less self-contained. *   **Overlooked Aspects:** It doesn't explicitly state the reasoning behind dividing by 2 (the ""buy one get one free"" aspect). *   **Improvements:** Remove the `CEILING` function for simplicity. Explicitly state why 30 is divided by 2.  **GOT's Solution (First statement):**  *   **Correctness:** The calculation and final answer are correct. *   **Completeness:** The solution presents the calculation steps clearly and provides adequate explanation. *   **Potential Weaknesses:** None significant. *   **Overlooked Aspects:** None significant. *   **Improvements:** None needed; it's a solid, straightforward solution.  **GOT's Solution (Second statement - Aggregated Result):**  *   **Correctness:** The core answer remains correct. The aggregated result explores various aspects of the problem in depth. *   **Completeness:** This is extremely comprehensive, covering alternative phrasing, rounding (although not needed), edge cases, varying levels of explanation, technical language variations, addressing potential misunderstandings, and different presentation formats. *   **Potential Weaknesses:** The sheer volume of information could be overwhelming. Some of the edge cases, while interesting, are not directly relevant to solving the core problem as stated. For instance, the edge cases about ""odd number of cans available"" and ""store policy on odd numbers"" are only relevant if the problem stated that John wanted to buy *up to* 30 cans, or that the store had certain restrictions. *   **Overlooked Aspects:** None. This is incredibly thorough. *   **Improvements:** While thoroughness is good, a more concise summary of the key elements relevant to solving the specific problem might be helpful. Perhaps a ""Key Takeaways"" section after the detailed analysis.  **Overall Critique:**  *   Both ROT and GOT (first statement) arrive at the correct answer using valid reasoning. GOT's initial solution is slightly better due to its clarity and directness. *   GOT's aggregated result is extremely thorough and demonstrates a deep understanding of the problem and potential variations. However, its comprehensiveness could be overwhelming for someone simply seeking a solution. It borders on over-engineering. *   ROT's solution is slightly less clear due to the unnecessary `CEILING` function and the reference to a previous formula that isn't included.  **Specific Improvements/Points of Caution:**  *   **ROT:** Simplify the formula by removing `CEILING`. Add a sentence explicitly stating that John pays for half the cans due to the ""buy one get one free"" deal. *   **GOT (First Statement):** No improvements needed. *   **GOT (Second Statement):** Consider adding a concise summary or ""Key Takeaways"" section to highlight the most important aspects for solving the core problem. Be cautious about introducing edge cases that aren't directly implied by the problem statement, as they can distract from the core solution.  ### Synthesized Accurate Answer: John pays for half of the 30 cans because of the buy-one-get-one-free deal, which is 15 cans. Since each can costs $0.60, John pays 15 * $0.60 = $9.00."
