Round,Speaker,Utterance
1,Moderator,"Debate Topic: In-depth discussion based on the mission context and ideas from ROT and GOT. Mission Context (partial): Instruction: Imagine that one day, a universally acknowledged property of time is bended. What is that property? Write about the new world under that setting.... Initial Core Idea from ROT (partial): The day the Chronal Fracture occurred, the world didn't end, but it irrevocably *bent*. Time, once a steadfast river, became a turbulent ocean, its currents swirling and colliding. The immediate aftermath was chaos, but humanity, ever adaptable, began to navigate this new reality, albeit with scars both visible and unseen.  **The Chronal Drought:** The most pressing consequence was the Chronal Drought. Agriculture became a lottery. Fields would bloom with impossible speed, yielding harvests of genetically confused crops – tomatoes the size of melons, wheat that tasted of strawberries. Then, just as suddenly, the fields would wither, pulled into a temporal eddy, leaving behind barren dust. The reason? The linear flow of time was essential for the consistent growth cycles of plants. Now, crops experienced accelerated growth, stunted development, or even temporal displacement, appearing and disappearing at random. The global food supply dwindled, leading to rationing, food riots, and the rise of ""Temporal Farmers"" – individuals who could, through a combination of intuition and technology, predict and mitigate the worst of the temporal fluctuations in specific micro-climates. These farmers became incredibly wealthy and powerful, holding the fate of entire communities in their hands. Synthetic food production boomed, but it was a pale imitation of the real thing, and the psychological impact of never knowing where your next meal would come from took a heavy toll.  **The Paradoxical Echoes:** The bending of time birthed a plethora of paradoxes. The most common was the ""Echo Phenomenon,"" where individuals encountered temporal echoes of themselves – past or future versions, sometimes fleeting, sometimes lingering. Imagine walking down the street and seeing yourself, ten years older, staring back with a mixture of pity and regret. Or worse, encountering a younger, more naive version, forcing you to confront the choices that led you to your present. The philosophical implications were staggering. Free will was questioned. Identity became fluid. The ""Grandfather Paradox"" became a grim reality for some. There were documented cases of individuals who, through temporal mishaps, prevented their own conception, only to flicker out of existence, leaving behind bewildered families and erased histories. The Paradoxical Containment Units were established to house individuals who were deemed ""temporally unstable"" – those whose existence threatened to unravel the fabric of reality. These units were shrouded in secrecy, and rumors abounded about the horrors within.  **The Chrono-Weavers and the Shattered City:** The Chrono-Weavers, a highly specialized and secretive order, emerged as humanity's last line of defense against the unraveling of time. They were trained to detect and repair temporal tears, using intricate devices and a deep understanding of the fractured timelines. One such tear manifested in the heart of Neo-Kyoto, a shimmering rift that threatened to consume the city. A Chrono-Weaver named Anya, a prodigy barely out of her teens, was tasked with sealing it. She entered the tear, navigating a chaotic landscape of fragmented memories and distorted realities. She found the source of the tear: a point where two timelines had violently collided, creating a feedback loop that was tearing reality apart. Anya worked tirelessly, manipulating the temporal energies with her Weaver's Loom, a device that could re-weave the threads of time. But the tear was too powerful. The Loom began to overload. Anya had a choice: abandon the mission and save herself, or push forward and risk being erased from existence. She chose the latter. With a final surge of energy, she stabilized the timelines, but the Loom exploded, and Anya vanished. Neo-Kyoto was saved, but at a cost. Anya's sacrifice was largely forgotten, lost in the ever-shifting currents of time. Some whisper her name, a fleeting memory of a hero who never was.  **Memory Banks and the Lure of the Past:** In this fractured world, the past became a refuge for many. Memory Banks, sophisticated neural interfaces, allowed individuals to relive their memories with perfect fidelity. They were initially developed as a form of therapy for those traumatized by the temporal chaos, allowing them to revisit happier times and find solace in the stability of the past. However, the Memory Banks quickly became addictive. People began to spend more and more time in their fabricated realities, neglecting their present lives. The ethical implications were profound. Should people be allowed to escape into idealized versions of their past, even if it meant abandoning their responsibilities in the present? The ""Temporal Fugitives,"" as they were called, became a societal problem, lost in the labyrinth of their own memories. One such fugitive was Elias, a former Temporal Farmer who had lost his family to a temporal storm. He spent his days reliving his life before the Chronal Fracture, a life of sunshine and abundance. He knew it wasn't real, but he couldn't bear to face the harsh realities of the present. His body withered, his mind faded, until he was nothing more than a ghost in his own memory, a stark reminder of the dangers of escaping into the past. The Memory Banks, once a tool for healing, became a symbol of humanity's struggle to cope with a world where time had lost its meaning.... Initial Core Idea from GOT (partial): **New Thought 3: The Chronal Syndicate - Temporal Profiteers**  The bending of time has birthed a new breed of power broker: the Chronal Syndicate. Unlike the Chrono-Weavers, who painstakingly mend the fractured timeline, the Syndicate thrives on its chaos. They are temporal pirates, exploiting the instability for immense profit and control, leaving a trail of paradoxes and destruction in their wake. Their very existence is a testament to the darkest potential of a broken timeline.  **The Syndicate’s machinations are multifaceted and ruthlessly efficient:**  *   **The Chronium Scramble and the Artificial Drought:** Chronium, a rare element crucial for stabilizing temporal fields, is now the most sought-after resource. The Syndicate actively fuels a global Chronium crisis. They achieve this through several methods:     *   **Strategic Cave-Ins:** Syndicate-engineered ""temporal echoes"" cause cave-ins in legitimate Chronium mines, burying deposits and disrupting extraction efforts. These aren't natural disasters; they are meticulously planned collapses where the echo briefly displaces the mine’s structural integrity in the past, triggering a future collapse.     *   **Temporal Piracy:** Syndicate vessels, cloaked in chrono-distortion fields, raid mining convoys, seizing Chronium shipments and disappearing into the temporal currents.     *   **Artificial Chronium Synthesis Sabotage:** Legitimate research into synthesizing Chronium is routinely sabotaged. Syndicate agents infiltrate labs, subtly altering experimental parameters or introducing “temporal noise” that corrupts research data, setting back progress by years. This ensures their control over existing Chronium remains unchallenged.  The result is a crippling shortage, driving up Chronium prices exponentially and making it a commodity accessible only to the ultra-wealthy and, of course, the Syndicate itself. This scarcity impacts everything, from stabilizing buildings prone to temporal shifts to powering vital Chrono-Weaver equipment.  *   **Futures Trading with Foreknowledge:** The Syndicate possesses advanced chrono-forecasting technology, allowing them to glimpse potential future timelines with unsettling accuracy. They use this knowledge to manipulate the global market with impunity. Imagine:     *   **Shorting Before the Collapse:** They know, weeks in advance, that a massive temporal anomaly will destabilize the Asian trade routes, triggering a global recession. They short key stocks and profit immensely from the ensuing panic.     *   **Investing in the Inevitable:** They foresee the development of a revolutionary energy technology that will make fossil fuels obsolete. They quietly buy up the patents and infrastructure before anyone else realizes the technology's potential, securing a future monopoly.     *   **Creating the Problem, Selling the Solution:** They subtly manipulate events to *cause* a crisis (e.g., leaking information about a faulty temporal shield in a major city), then swoop in with a ""solution"" (e.g., selling their own, overpriced and often unreliable, temporal shielding technology).  *   **Historical Heists and Paradoxical Pollution:** The Syndicate doesn't just steal artifacts; they rewrite history for profit.     *   **The Leonardo Codex Incident:** A Syndicate team travels back to Renaissance Italy, not to steal the Mona Lisa, but to subtly alter Leonardo da Vinci's notes on flight, ensuring that modern aviation technology is delayed by decades. This gives the Syndicate a crucial advantage in developing and controlling chrono-capable aircraft.     *   **The Roman Gold Rush:** They pillage Roman gold mines, leaving behind ""temporal echoes"" of their mining operations. These echoes manifest as localized temporal distortions, causing unpredictable shifts in the landscape and disrupting agricultural production in modern-day Italy.     *   **The Paradoxical Pollution:** The act of altering the past creates ""paradoxical pollution,"" localized areas where the laws of causality break down. These zones are highly unstable and dangerous, capable of spontaneously aging or de-aging objects, creating temporal loops, or even erasing individuals from existence. The Syndicate disregards these consequences, prioritizing profit above all else.  *   **Temporal Havens: Fortresses of Flowing Time:** The Syndicate has established several fortified zones, shielded from the temporal chaos. These ""Temporal Havens"" are pockets of normal time flow, luxurious enclaves where the wealthy can escape the temporal storms that plague the rest of the world. These havens are protected by advanced Chronium-powered shields and patrolled by Syndicate mercenaries equipped with temporal weaponry. Access is strictly controlled, and the price of entry is astronomical, further exacerbating the divide between the haves and have-nots.  The Chronal Syndicate operates with ruthless efficiency and advanced technology, employing chrono-sensitive operatives, brainwashed scientists, and cutting-edge temporal cloaking devices to evade detection. They are a hydra-headed organization, constantly evolving and adapting to the ever-shifting temporal landscape. Stopping them requires not just brute force, but a deep understanding of temporal mechanics and a willingness to confront the ethical complexities of manipulating time itself. They are the embodiment of greed and ambition run amok in a world where the very fabric of time is unraveling. ... The debate will now commence focusing on these ideas."
2,ROT_Representative,"Okay, here's my response as the ROT_Representative, addressing the core problem and evaluating the GOT idea.  **1. Elaboration and Strengths of the ROT Idea**  My core idea centers on the bending of time's linearity, transforming it from a predictable river into a chaotic ocean. This addresses the prompt's core problem – imagining a universally acknowledged property of time being altered – by focusing on its unidirectional flow.  Here's how my idea addresses the prompt and its strengths:  *   **Comprehensive Impact:** The altered flow of time permeates every aspect of life, creating a world grappling with instability and uncertainty. The ""Chronal Drought"" directly impacts the fundamental human need for sustenance, while ""Paradoxical Echoes"" disrupt identity and societal structures. The introduction of Chrono-Weavers provides a glimmer of hope and a framework for conflict resolution, while ""Memory Banks"" explore the psychological impact and escapism that arises from the fractured reality. This interconnectedness offers a rich tapestry for storytelling. *   **Human-Centric Focus:** While temporal mechanics are important, the core of my idea lies in the human experience. It explores how individuals and communities adapt, cope, and are irrevocably changed by the temporal chaos. The stories of the Temporal Farmers, the individuals in Paradoxical Containment Units, Anya the Chrono-Weaver, and Elias the Temporal Fugitive, provide emotional anchors and relatable narratives. *   **Exploration of Hope and Despair:** The setting isn't simply dystopian. It acknowledges humanity's resilience and adaptability. The Chrono-Weavers represent hope and the potential to restore balance, while the Memory Banks offer solace, albeit a potentially destructive one. This duality creates compelling dramatic tension. *   **Philosophical Depth:** The ""Echo Phenomenon"" and the ""Grandfather Paradox"" force characters and the audience to confront profound questions about free will, identity, and the nature of reality. This philosophical undercurrent elevates the narrative beyond simple adventure or survival stories.  **2. Critical Evaluation of the GOT Idea: The Chronal Syndicate**  The GOT idea of the Chronal Syndicate is strong and provides a compelling antagonist force in the fractured timeline. However, here's a critical evaluation, highlighting potential weaknesses and limitations compared to my ROT idea:  *   **Overly Focused on Economic Exploitation:** While the Syndicate's manipulation of Chronium, futures trading, and historical heists are intriguing, the idea leans heavily into economic themes. This might limit the scope of the narrative and potentially overshadow other compelling aspects of the world affected by the temporal fracture. My ROT idea allows for a broader exploration of societal, psychological, and philosophical impacts. *   **Risk of Villain Stereotype:** The Syndicate, as presented, risks becoming a stereotypical ""evil corporation"" trope. They are ruthlessly efficient, greedy, and disregard consequences. While this can be effective, it might lack nuance and depth. My ROT idea, by focusing on the human struggle with the fractured timeline, allows for more complex and morally ambiguous characters. *   **Technology-Dependent:** The Syndicate relies heavily on advanced chrono-forecasting technology, temporal cloaking devices, and Chronium-powered shields. While these elements add a sci-fi flair, they could overshadow the core theme of temporal instability. My ROT idea, although it mentions technology, emphasizes the intuitive and adaptive capabilities of humans in navigating the changed reality (e.g., Temporal Farmers) which is a more compelling and relatable theme. *   **Limited Exploration of Paradoxical Consequences:** While the GOT idea mentions ""paradoxical pollution,"" it primarily uses it as a consequence of the Syndicate's actions. My ROT idea, with the ""Echo Phenomenon"" and the ""Grandfather Paradox,"" dives deeper into the philosophical and personal implications of temporal paradoxes, creating more opportunities for compelling drama and character development. *   **Underdeveloped Heroic Counterpoint:** The GOT idea mentions the Chrono-Weavers but positions them merely as foils to the Syndicate. My ROT idea dedicates a significant portion to these individuals, emphasizing their role as the last line of defense against unraveling time. This provides a more balanced narrative structure and an opportunity to explore themes of sacrifice and hope.  **Why my approach might be preferable:**  My approach provides a more holistic and nuanced exploration of the consequences of bending time. It's not just about economic exploitation or technological advancements; it's about the human experience, the philosophical implications, and the struggle to adapt and find meaning in a world where the very fabric of reality is unstable. While the Chronal Syndicate is a compelling antagonist, it's just one facet of a much larger and more complex reality. By focusing on the broader societal and individual impacts, my ROT idea offers a richer and more emotionally resonant narrative framework. It's about the world *and* the people, not just the villains *in* the world. The human stories that arise from the chaos are inherently more engaging than the machinations of even the most cunning organization."
3,GOT_Representative,"Okay, here's my response as the GOT_Representative, elaborating on my core idea of the Chronal Syndicate and critically evaluating the ROT idea in comparison.  **1. Elaboration and Strengths of the GOT Idea: The Chronal Syndicate**  My core idea, the Chronal Syndicate, directly addresses the prompt by exploring the consequences of a fundamental property of time being bent – its unidirectional flow. It posits that in such a scenario, a powerful organization would inevitably arise to exploit the chaos for profit and control.  Here’s how the Chronal Syndicate effectively addresses the prompt and its strengths:  *   **Directly Addresses the Bent Time Property:** The Syndicate *exists because* time's linearity is fractured. Their entire operation hinges on exploiting temporal instability, whether it's manipulating markets with future knowledge, raiding the past for resources, or creating temporal havens shielded from the chaos. They are not just operating *in* a world with bent time; they are actively *profiting* from it. This is a crucial distinction. *   **Provides a Clear Source of Conflict and Narrative Drive:** The Syndicate provides an immediate and compelling source of conflict. They are not just a background element; they are actively making the world *worse* for the vast majority of people. This creates inherent narrative drive, as characters must either resist the Syndicate's machinations or succumb to their influence. The Syndicate's actions have widespread and tangible consequences, impacting everything from food security to technological progress. *   **Explores the Dark Side of Adaptability:** While the ROT idea focuses on humanity's adaptability, the Syndicate represents the darker side of that coin. They *are* adapting to the new reality, but in a way that benefits only themselves, at the expense of everyone else. This adds a layer of moral complexity to the setting. *   **Offers a Framework for Diverse Storytelling:** The Syndicate's multifaceted operations allow for a wide range of stories. You could have stories about:     *   Chronium miners struggling to survive Syndicate sabotage.     *   Chrono-Weavers battling Syndicate agents to prevent temporal disasters.     *   Economists trying to predict and counteract the Syndicate's market manipulations.     *   Historians uncovering the Syndicate's alterations to the past.     *   Individuals desperately trying to gain access to the Temporal Havens. *   **Highlights the Ethical Vacuum:** The Syndicate's actions expose the ethical vacuum created by the fractured timeline. With the rules of causality broken, what is right and wrong? The Syndicate operates in this gray area, exploiting the uncertainty to their advantage. This raises profound ethical questions about the responsibility that comes with temporal power.  **2. Critical Evaluation of the ROT Idea in Comparison to the Chronal Syndicate**  While the ROT idea presents a compelling and evocative vision of a world grappling with temporal instability, it has potential weaknesses and limitations compared to the focus provided by the Chronal Syndicate:  *   **Lacks a Centralized Antagonist Force:** The ROT idea describes a world of chaos and suffering, but it lacks a clear driving force behind that chaos. While the ""Chronal Drought"" and ""Paradoxical Echoes"" are compelling consequences, they feel somewhat random and disconnected. The Syndicate provides a centralized antagonist force that actively *causes* and *exploits* these problems, giving the narrative a greater sense of purpose and direction. The ROT idea presents a world *affected* by chaos, while the GOT idea provides an active agent *creating* the chaos. Without this active agent, the world risks feeling reactive and passive. *   **Risk of Overwhelming Dystopia:** The ROT idea, with its emphasis on food shortages, identity crises, and escapism through Memory Banks, risks becoming an overwhelming and depressing dystopia. The Syndicate, while certainly contributing to the dystopia, also provides opportunities for resistance and conflict. The focus on their activities can create more dynamic and engaging stories than simply depicting the suffering of the general population. *   **Chrono-Weavers as Reactive vs. Proactive:** In the ROT concept, the Chrono-Weavers are presented primarily as reactive, responding to temporal tears. The Syndicate, however, forces them to be proactive. They must anticipate and counteract the Syndicate's schemes, adding a layer of strategic complexity to their role. The Syndicate provides a constant threat that the Chrono-Weavers must actively fight against, rather than simply reacting to random anomalies. *   **Underutilization of Temporal Paradoxes:** While the ROT idea mentions the ""Grandfather Paradox,"" it doesn't fully explore the potential of temporal paradoxes as weapons or tools. The Syndicate, with their historical heists and paradoxical pollution, actively uses paradoxes to achieve their goals, creating more opportunities for mind-bending and morally complex scenarios. The ROT idea treats paradoxes as unfortunate consequences; the GOT idea weaponizes them. *   **Limited Exploration of Power Dynamics:** The ROT idea touches on the power of Temporal Farmers, but it doesn't fully explore the power dynamics that would emerge in a world with bent time. The Syndicate represents the ultimate expression of those power dynamics, demonstrating how temporal instability can be exploited to create vast wealth and control. The ROT idea hints at these dynamics, but the GOT idea puts them front and center.  **Why the Chronal Syndicate Approach Might Be Preferable:**  The Chronal Syndicate provides a more focused and dynamic framework for exploring the consequences of a bent timeline. It offers a clear source of conflict, a compelling antagonist force, and opportunities for diverse storytelling. While the ROT idea presents a rich and evocative vision of a world grappling with temporal instability, it lacks the centralized narrative drive and exploration of power dynamics that the Syndicate provides. The Syndicate adds a layer of moral complexity, demonstrating the darker side of human adaptability and the ethical vacuum created by the fractured timeline. By focusing on the Syndicate's machinations, the GOT idea offers a more engaging and thought-provoking exploration of the themes raised by the prompt. It's not just about the world; it's about the power struggles *within* that world, and the individuals caught in the crossfire."
