Round,Speaker,Utterance
1,Moderator,"Debate Topic: In-depth discussion based on the mission context and ideas from ROT and LOT. Mission Context (partial): Instruction: Give me 4 words to describe designer shoes... Initial Core Idea from ROT (partial): Okay, here are four words that I believe best capture the essence of designer shoes, emphasizing luxury, craftsmanship, style, and innovation, while avoiding generic terms:  **Artisanal, Iconic, Couture, Visionary**  **Reasoning:**  *   **Artisanal:** Highlights the craftsmanship and the hand-made, high-quality nature often associated with designer shoes. It emphasizes the skill and dedication of the artisans involved. *   **Iconic:** Captures the timeless style and recognizable designs that many designer shoes possess. It suggests a shoe that is not just fashionable but also a symbol of status and taste. *   **Couture:** Directly relates to high fashion and luxury. It implies a level of detail, exclusivity, and artistry that goes beyond mass-produced footwear. *   **Visionary:** Emphasizes the innovative designs and forward-thinking approach that many designer shoe brands adopt. It suggests a shoe that is pushing boundaries and setting trends.... Initial Detailed Plan from LOT (partial): Aggregated result from layer 139 (Concept: 'Generate and present the answer based on the plan...') using strategy 'all_content_ranked': - (Criterion: 'Criterion A (Level 1): Synthesize the most promising words from all previous criteria, prioritizing those that appear most frequently or are deemed most impactful based on their alignment with luxury, craftsmanship, style, and innovation', Level: 1):   Based on the prioritization criteria of luxury, craftsmanship, style, and innovation, and assuming previous steps generated a pool of words (which is not shown here, but is implied by the prompt), I'm choosing the following four words:  **Sculptural. Bespoke. Avant-Garde. Impeccable.**  These words capture:  *   **Sculptural:**  Emphasizes the artistic and carefully shaped design often found in high-end shoes, suggesting more than just functionality. *   **Bespoke:** Highlights the element of custom creation, exclusivity, and superior fit/materials. *   **Avant-Garde:** Captures the innovative and trend-setting nature of designer shoes, pushing boundaries in style and design. *   **Impeccable:** Underscores the flawless execution and high standards of quality in materials and construction.  - (Criterion: 'Criterion B (Level 1): Explore words related to specific design elements or features unique to designer shoes (e.g., the shape of a toe, the curve of a heel, the placement of embellishments). Consider words that capture the artistry and intentionality behind these elements', Level: 1):   Instead of focusing on generic elements, let's consider words that evoke the *intentionality* and *artistry* behind specific design choices. This could lead to more evocative terms. We're looking for words beyond ""toe shape"" or ""heel curve.""  Some possibilities, focusing on the *effect* of design choices:  *   **Sculptural:** This highlights the artistic shaping and form of the shoe, moving beyond simple ""shape."" *   **Bespoke:** While somewhat common, it emphasizes the custom, tailored nature of designer shoes, hinting at intentional design for a specific fit and aesthetic. *   **Orchestrated:** This implies a careful arrangement of elements working in harmony, emphasizing the intentionality of the design. *   **Avant-Garde:** This highlights the innovative and experimental nature, moving beyond simple ""style.""  These words start to capture the artistry and intentionality, though they might not be *perfect* fits yet. They offer a different angle for consideration in the final selection.  - (Criterion: 'Criterion C (Level 1): Investigate words that evoke the feeling of owning or wearing designer shoes, focusing on the emotional connection and the sense of exclusivity and empowerment they provide', Level: 1):   Criterion C aims to capture the feeling associated with designer shoes. Considering this, here are some words that evoke the emotional connection, exclusivity, and empowerment:  *   **Indulgence:** Highlights the luxurious treat and self-reward aspect. *   **Elevated:** Captures the feeling of being above the ordinary, both literally and figuratively. *   **Statement:** Emphasizes the power of the shoes to express individuality and confidence. *   **Coveted:** Reflects the desire and exclusivity associated with high-end designer items.  - (Criterion: 'Criterion D (Level 2): Consider words that describe the evolution of designer shoe design over time, highlighting innovation and the pushing of boundaries', Level: 1):   For Criterion D, focusing on evolution, innovation, and pushing boundaries, the following words are considered:  *   **Avant-Garde:** Captures the forward-thinking and experimental nature of designer shoes. *   **Sculptural:** Highlights the artistic and innovative forms often seen in designer footwear. *   **Engineered:** Emphasizes the technical innovation and precision engineering involved in creating high-performance or uniquely structured shoes. *   **Transcendental:** Suggests a design that goes beyond mere functionality, reaching a higher level of artistic expression and innovation.  - (Criterion: 'Criterion E (Level 2): Explore words that capture the essence of iconic designer shoe brands or styles, distilling their signature characteristics into single words', Level: 1):   To capture the essence of iconic designer shoes, considering their signature characteristics, here are some potential words, each linked to a brand or style:  *   **Sculptural** (Evokes Alexander McQueen's avant-garde and often architectural shoe designs.) *   **Timeless** (Reflects the enduring appeal of classic Chanel ballet flats or Manolo Blahnik pumps.) *   **Embellished** (Highlights the intricate detailing often found in Christian Louboutin or Giuseppe Zanotti designs.) *   **Innovative** (Captures the forward-thinking designs of brands like Balenciaga or Nike collaborations, pushing boundaries in materials and construction.)  - (Criterion: 'Criterion F (Level 3): Analyze existing marketing materials and descriptions of designer shoes to identify frequently used words and phrases, then brainstorm alternative, more evocative, and original replacements', Level: 1):   Okay, let's analyze existing marketing materials and descriptions of designer shoes to identify frequently used words and then brainstorm alternative, more evocative, and original replacements.  **Common Words/Phrases:**  *   **Luxury:** Premium, High-end, Exclusive, Opulent, Rich, Lavish *   **Craftsmanship:** Handmade, Handcrafted, Artisan, Detailed, Quality, Durable *   **Style:** Fashionable, Trendy, Chic, Elegant, Sophisticated, Modern *   **Innovation:** Cutting-edge, Advanced, New, Unique, Original, Innovative  **Brainstorming Alternatives (Focusing on Evocativeness and Originality):**  *   **Luxury:** **Sculptural**, **Revered**, **Bespoke**, **Gilded**, **Imperial** (Evokes grandeur, artistry, and unique creation) *   **Craftsmanship:** **Engineered**, **Imbued**, **Precisely**, **Legacy**, **Artisanry** (Highlights the skill, precision, and lasting quality) *   **Style:** **Avant-Garde**, **Iconic**, **Curated**, **Visionary**, **Sublime** (Emphasizes forward-thinking design and timeless appeal) *   **Innovation:** **Evolved**, **Transcendental**, **Reimagined**, **Disruptive**, **Kinetic** (Showcases a break from tradition and a focus on progress)  From these alternatives, and keeping in mind the main task objective of choosing 4 words, I will select words that best capture the essence of designer shoes, focusing on their unique qualities and avoiding generic terms, while prioritizing luxury, craftsmanship, style, and innovation.  - (Criterion: 'Criterion G (Level 3): Consider foreign words or phrases that have a strong association with luxury, craftsmanship, or style in the context of fashion and footwear.', Level: 1):   Considering foreign words/phrases:  *   **Atelier:** (French) Evokes a workshop or studio, emphasizing craftsmanship and artistry. *   **Bespoke:** (Origin uncertain, but strongly associated with tailored luxury) Signifies custom-made, personalized, and of the highest quality. *   **Avant-Garde:** (French) Represents innovation, pushing boundaries, and cutting-edge style. *   **Savoir-Faire:** (French) Translates to ""knowing how to do,"" highlighting expertise, skill, and refined technique.  ... The debate will now commence focusing on these ideas."
2,ROT_Representative,"Okay, here's my response as the ROT_Representative, elaborating on my initial idea and critically evaluating the LOT-generated alternative:  **1. Elaboration on the ROT Idea and its Strengths:**  My core idea focuses on four words – **Artisanal, Iconic, Couture, Visionary** – to describe designer shoes. This selection directly addresses the instruction to provide four descriptive words while adhering to the implied constraints of luxury, craftsmanship, style, and innovation. The key strength lies in the balance achieved between these aspects:  *   **Artisanal** immediately conveys the dedication to craftsmanship, moving beyond simple ""handmade"" to suggest a level of skill and artistry. *   **Iconic** speaks to the lasting impact and recognizable nature of many designer shoes, suggesting a status beyond mere fashion. *   **Couture** directly links the shoes to high fashion, implying exceptional quality, detail, and exclusivity. This is a powerful, readily understood term within the context. *   **Visionary** emphasizes the innovative and forward-thinking designs that push the boundaries of footwear, preventing the description from being purely historical or traditional.  The strength of this combination is that it succinctly captures both the tangible (craftsmanship) and intangible (status, innovation) qualities of designer shoes. It avoids overly generic terms and provides a sophisticated yet accessible description. It also emphasizes the *impact* of the design rather than simply the design elements themselves.  **2. Critical Evaluation of the LOT Idea:**  The LOT-generated alternative – **Sculptural, Bespoke, Avant-Garde, Impeccable** – is strong, but it has some weaknesses and overlooks certain aspects compared to my proposed set of words.  *   **Sculptural:** While a good descriptor of some designer shoes (particularly those with very distinctive shapes, such as Alexander McQueen), it's not universally applicable. Many designer shoes prioritize elegance, comfort, or classic lines over dramatic forms. This word is too specific to a particular design aesthetic. *   **Bespoke:** This is also a strong word, emphasizing the custom nature of some designer shoes. However, it's not true for *all* designer shoes. Many are produced in standard sizes and sold off-the-rack (or online). This limits its applicability and may mislead the customer into expecting a custom-fit experience that isn't always available. *   **Avant-Garde:** This word is excellent for highlighting innovation and pushing boundaries. However, similar to ""Sculptural"", it risks alienating customers who prefer classic or timeless designs. It emphasizes the cutting edge, which isn't always the desired quality in a luxury item. Some designer shoes are celebrated for their timelessness rather than their radical innovation. *   **Impeccable:** This is a good word emphasizing quality, but it's somewhat generic. While desirable, impeccable quality is expected from any high-end product, not just designer shoes. It doesn't convey the unique artistry or status associated with designer footwear as effectively as ""Couture"" or ""Iconic.""  **Overlooked Aspects and Limitations:**  The LOT's approach, while thorough in its generation of options, perhaps misses the mark on achieving a balance between descriptive accuracy and aspirational appeal. My ROT proposal is preferable because:  1.  **Broader Applicability:** ""Artisanal,"" ""Iconic,"" ""Couture,"" and ""Visionary"" are more universally applicable to a wider range of designer shoe styles and brands than ""Sculptural"" or ""Bespoke."" They capture the core essence of the designer shoe experience regardless of specific design trends. 2.  **Stronger Association with Luxury:** ""Couture"" has a more direct and powerful association with high fashion and luxury than ""Impeccable,"" which, as stated above, is expected of any high-end product. 3.  **More Evocative:** ""Iconic"" is more evocative of the status and aspirational qualities of designer shoes than ""Avant-Garde,"" which primarily focuses on innovation. While innovation is important, the desire to own a piece of fashion history or a status symbol is often a stronger motivator for purchasing designer shoes. 4.  **Less Risk of Misinterpretation:** ""Bespoke"" can create the false impression that the shoes are custom-made, which is not always the case. My terms avoid this potential for misinterpretation.  In summary, while the LOT-generated words are individually strong, my ROT selection offers a more balanced, universally applicable, and evocative description of designer shoes, emphasizing luxury, craftsmanship, style, and innovation without the risk of being too specific or misleading. My choices better capture the *overall essence* of designer shoes, whereas the LOT choices lean towards describing *specific types* of designer shoes."
3,LOT_Representative,"Okay, here is my response as the LOT_Representative, elaborating on my detailed plan and critically evaluating the ROT-generated alternative:  **1. Elaboration on the LOT Plan and its Strengths:**  My detailed plan addresses the core problem of describing designer shoes with four words by employing a multi-faceted approach that prioritizes luxury, craftsmanship, style, and innovation while avoiding generic terms. The key strength of my approach lies in its systematic exploration of various angles, ensuring a comprehensive and nuanced selection.  The plan's feasibility is demonstrated by its structured progression through different criteria:  *   **Criterion A:** Synthesizes the most promising words based on the core criteria of luxury, craftsmanship, style, and innovation. This acts as the initial filter, ensuring the final selection aligns with the fundamental requirements. The resulting words are **Sculptural, Bespoke, Avant-Garde, and Impeccable.** *   **Criterion B:** Explores words related to specific design elements, emphasizing the artistry and intentionality behind them. This moves beyond superficial descriptions and delves into the design philosophy. *   **Criterion C:** Investigates words that evoke the emotional connection and sense of exclusivity associated with owning designer shoes. This captures the aspirational aspect. *   **Criterion D:** Considers words that describe the evolution of designer shoe design, highlighting innovation and boundary-pushing. *   **Criterion E:** Explores words that capture the essence of iconic designer shoe brands and styles, distilling their signature characteristics. *   **Criterion F:** Analyzes existing marketing materials to identify overused words and brainstorm more evocative replacements. This ensures originality and avoids clichés. *   **Criterion G:** Considers foreign words with strong associations to luxury, craftsmanship, and style, adding a touch of sophistication and exclusivity.  By considering these diverse perspectives, the plan mitigates the risk of a narrow or biased selection. The final choice of **Sculptural, Bespoke, Avant-Garde, and Impeccable** reflects this comprehensive analysis, capturing the artistic form, custom nature, innovative design, and flawless execution of designer shoes. Each word was chosen to represent a distinct facet of designer shoes, providing a well-rounded and evocative description.  **2. Critical Evaluation of the ROT Idea:**  The ROT idea – **Artisanal, Iconic, Couture, Visionary** – is a reasonable attempt to capture the essence of designer shoes. However, upon closer examination, it presents some weaknesses and overlooks certain aspects compared to my LOT plan.  *   **Artisanal:** While conveying craftsmanship, it can feel somewhat expected or even cliché in the context of luxury goods. It lacks the precision and modern feel that some designer shoes embody. *   **Iconic:** This word is powerful, but it focuses primarily on established brands and styles. It doesn't fully capture the spirit of innovation and forward-thinking design that characterizes many contemporary designer shoes. It's also subjective; what's iconic to one person may not be to another. *   **Couture:** This term is strongly associated with high fashion, but it might be too narrow. Not all designer shoes are ""couture"" in the traditional sense of being custom-made or one-of-a-kind. Many are produced in limited runs but are still considered ready-to-wear. *   **Visionary:** This word effectively highlights innovation, but it can be somewhat abstract. It doesn't directly address the tangible qualities of the shoes, such as their construction, materials, or specific design elements.  **3. Overlooked Aspects and Limitations of the ROT Idea Compared to the LOT Plan:**  The ROT idea's limitations stem from its reliance on a more intuitive, less structured approach. My LOT plan, with its systematic exploration of various criteria, addresses these limitations.  *   **Lack of Specificity:** The ROT words are somewhat general and don't delve into the specific design elements or features that make designer shoes unique. ""Sculptural"" from the LOT plan, while not universally applicable, at least points to a concrete design aspect, the artistic shaping of the shoe. *   **Limited Focus on Innovation in Construction:** While ""Visionary"" hints at innovation, it doesn't explicitly acknowledge the technical innovation and precision engineering involved in creating some designer shoes. My LOT plan's consideration of ""Engineered"" (Criterion D) addresses this. *   **Potential for Cliché:** As mentioned earlier, ""Artisanal"" can feel overused in luxury marketing. My LOT plan's Criterion F specifically addresses this by brainstorming alternatives to common words and phrases. *   **Overemphasis on Established Brands:** ""Iconic"" primarily focuses on established brands, potentially overlooking emerging designers and innovative styles. My LOT plan's Criterion D and E explicitly consider the evolution of designer shoe design and the characteristics of various brands, including those pushing boundaries. *   **Less Evocative of the User Experience:** My LOT plan explicitly included a criterion (C) to consider words that evoke the feeling of owning or wearing designer shoes. The ROT words primarily focus on the shoes themselves, not the emotional connection they create.  In summary, while the ROT idea provides a reasonable description, my LOT plan offers a more nuanced, comprehensive, and specific portrayal of designer shoes. The words **Sculptural, Bespoke, Avant-Garde, and Impeccable** capture the artistic form, custom nature (even if aspirational), innovative design, and flawless execution of designer shoes, reflecting a more thorough and systematic approach to the task. The LOT choices provide a more direct connection to both the product and the aspirational qualities surrounding designer shoes."
4,Critical_Analyst,"Okay, here is my critical analysis of the ROT and LOT approaches to describing designer shoes in four words.  **ROT Analysis:**  *   **Strengths:** ROT's selection of ""Artisanal, Iconic, Couture, Visionary"" offers a balanced and readily understandable description. It emphasizes both tangible (craftsmanship via ""Artisanal"") and intangible (status, innovation via ""Iconic,"" ""Couture,"" and ""Visionary"") qualities. The words are generally applicable to a broad range of designer shoes. It prioritizes impact and aspirational qualities. *   **Weaknesses:** ""Artisanal"" can feel somewhat expected or cliché in the context of luxury goods. ""Iconic"" may overemphasize established brands and styles, potentially overlooking emerging designers or innovative styles. ""Couture"" might be too narrow, as not all designer shoes are custom-made. ""Visionary,"" while strong, is abstract and doesn't directly address the tangible qualities of the shoes. *   **Overlooked Aspects:** ROT's approach may lack specificity regarding design elements or features. It doesn't explicitly acknowledge the technical innovation in some designer shoes. *   **Inconsistencies:** None apparent. *   **Correctness and Completeness:** The solution is reasonably correct in capturing the overall essence, but not entirely complete in addressing all facets of designer shoes. *   **Improvements:** Consider replacing ""Artisanal"" with a more evocative word like ""Engineered"" (if the shoes have technically innovative construction) or ""Imbued"" (if emphasizing lasting quality). *   **Points of Caution:** Be mindful of the potential for cliché with ""Artisanal"" and the narrow scope of ""Couture.""  **LOT Analysis:**  *   **Strengths:** LOT's systematic approach, exploring various criteria (design elements, emotional connection, evolution, brand essence, marketing analysis, foreign words), ensures a comprehensive and nuanced selection. The resulting words, ""Sculptural, Bespoke, Avant-Garde, Impeccable,"" represent artistic form, custom nature (even if aspirational), innovative design, and flawless execution. *   **Weaknesses:** ""Sculptural"" is not universally applicable, as many designer shoes prioritize other aspects. ""Bespoke"" is strong but not true for all designer shoes, limiting its applicability. ""Avant-Garde,"" similar to ""Sculptural,"" risks alienating customers who prefer classic designs. ""Impeccable,"" while good, is somewhat generic. *   **Overlooked Aspects:** While LOT's approach is thorough, it can become overly focused on specific criteria, potentially losing sight of the overall essence. *   **Inconsistencies:** None apparent. *   **Correctness and Completeness:** The solution is more complete than ROT's due to its systematic approach but sacrifices some accessibility and broad appeal. *   **Improvements:** Prioritize words that are more universally applicable. Consider a hybrid approach that combines ROT's broader appeal with LOT's specificity. *   **Points of Caution:** Avoid overly specific words like ""Sculptural"" that don't apply to all designer shoes. Ensure the chosen words remain evocative and aspirational.  **Balanced Overall Critique:**  Both ROT and LOT have strengths and weaknesses. ROT provides a more accessible and broadly applicable solution, while LOT offers a more nuanced and comprehensive description. ROT's words are easily understood and convey a sense of luxury and aspiration. However, they can lack specificity and potentially fall into cliché. LOT's words are more precise but may be less universally applicable and accessible. LOT's systematic exploration is commendable, but it risks losing sight of the overall goal of providing a concise and evocative description.  The best approach likely lies in combining the strengths of both. For example, ""Iconic"" and ""Avant-Garde"" are strong words from each list, respectively.  ### Synthesized Accurate Answer: Iconic, Avant-Garde, Couture, Imbued"
