Round,Speaker,Utterance
1,Moderator,"Debate Topic: In-depth discussion based on the following mission context, ROT idea, GOT idea, and LOT idea. Mission Context: Instruction: The price of buying a wooden toy at the new Craftee And Best store is $20, and the cost of buying a hat is $10. If Kendra went to the shop with a $100 bill and bought two wooden toys and three hats, calculate the change she received. Initial Core Idea from GOT: Here's how to solve the problem:  1. **Cost of wooden toys:** Kendra bought two wooden toys at $20 each, so the total cost is 2 * $20 = $40.  2. **Cost of hats:** She bought three hats at $10 each, so the total cost is 3 * $10 = $30.  3. **Total cost:** The total cost of her purchase is $40 + $30 = $70.  4. **Change received:** Kendra paid with a $100 bill, so her change is $100 - $70 = $30.  **Answer:** Kendra received $30 in change. Initial Core Idea from GOT: **Refined Thought:**  *   **Base Calculation:**     *   **Cost of Wooden Toys:** 2 toys * $20/toy = $40     *   **Cost of Hats:** 3 hats * $10/hat = $30     *   **Total Cost:** $40 + $30 = $70     *   **Change from $100:** $100 - $70 = $30  *   **Alternative Scenarios:**      *   **Card Payment with Cash Back:**         *   If Kendra paid with a debit card and received $20 cash back, the net cash she received would be $20 (cash back) + $30 (change from purchase) = $50.  The card would have been charged $70.      *   **Sales Tax:**         *   **Total Cost Before Tax:** $70         *   **Sales Tax Amount:** $70 * 0.07 = $4.90         *   **Total Cost with Tax:** $70 + $4.90 = $74.90         *   **Change from $100 (with tax):** $100 - $74.90 = $25.10      *   **Combined Payment:**         *   **Cash Payment:** $50         *   **Amount Paid by Card:** $70 (total cost) - $50 = $20         *   **Change from $50 Bill:** $50 - ($70 total cost - $20 paid by card) = $50 - $50 = $0  **Final Answer:**  *   **Base Scenario:** Kendra received $30 in change. *   **Card with Cash Back:** Kendra received a net of $50 cash ($20 cash back + $30 change). *   **With Sales Tax:** Kendra received $25.10 in change. *   **Combined Payment:** Kendra received $0 in change.  Initial Detailed Plan from LOT: Aggregated result from layer 175 (Concept: 'Generate and present the answer...') using strategy 'all_content_ranked': - (Criterion: 'Calculate the cost of the wooden toys', Level: 1):   The price of one wooden toy is $20, and Kendra bought two. So, the cost of the wooden toys is 2 * $20 = $40.  - (Criterion: 'Calculate the cost of the hats', Level: 1):   The cost of three hats is 3 * $10 = $30.  - (Criterion: 'Calculate the total cost of the purchase', Level: 1):   Okay, let's calculate the total cost. Two wooden toys cost 2 * $20 = $40. Three hats cost 3 * $10 = $30. Therefore, the total cost is $40 + $30 = $70.  - (Criterion: 'Calculate the change received', Level: 1):   Okay, so Kendra spent (2 * $20) + (3 * $10) = $40 + $30 = $70.  She paid with a $100 bill, so her change is $100 - $70 = $30.  - (Criterion: 'Present the solution in a step-by-step format', Level: 1):   Okay, here's the solution presented step-by-step:  1. **Cost of two wooden toys:** 2 toys * $20/toy = $40 2. **Cost of three hats:** 3 hats * $10/hat = $30 3. **Total cost of purchase:** $40 + $30 = $70 4. **Change received:** $100 - $70 = $30  Therefore, Kendra received $30 in change.  - (Criterion: 'Present the solution in a paragraph format', Level: 1):   Kendra spent $20 * 2 = $40 on wooden toys and $10 * 3 = $30 on hats. Her total spending was $40 + $30 = $70. Therefore, her change from the $100 bill was $100 - $70 = $30. Kendra received $30 in change.  - (Criterion: 'Verify the correctness of each calculation', Level: 1):   Okay, let's verify the calculations:  *   **Cost of wooden toys:** 2 toys * $20/toy = $40. This is correct. *   **Cost of hats:** 3 hats * $10/hat = $30. This is correct. *   **Total cost:** $40 + $30 = $70. This is correct. *   **Change:** $100 - $70 = $30. This is correct.  - (Criterion: 'Acknowledge any assumptions made in the problem (e.g., no sales tax)', Level: 1):   Okay, the problem assumes there is no sales tax involved. Therefore, the change Kendra received is calculated solely based on the prices of the items and the amount she paid with.  - (Criterion: 'State the final answer clearly', Level: 1):   Kendra received $30 in change.  - (Criterion: 'Consider alternative phrasing for the final answer', Level: 1):   Here are a few alternative phrasings for the final answer, building upon the understanding that Kendra's change is $30:  *   ""Therefore, Kendra received $30 in change."" *   ""Kendra's change from her $100 bill was $30."" *   ""She received $30 back after her purchase."" *   ""After buying the toys and hats, Kendra had $30 left."" *   ""The change Kendra received is $30.""  - (Criterion: 'Identify potential sources of error in the calculation', Level: 1):   Here's a breakdown of potential error sources in the change calculation, relevant to the main task:  *   **Incorrect Toy Cost:** Mistaking the price of a wooden toy (e.g., using a different price or forgetting it's $20). *   **Incorrect Hat Cost:** Mistaking the price of a hat (e.g., using a different price or forgetting it's $10). *   **Incorrect Quantity of Toys:** Misremembering how many toys Kendra bought (e.g., using 1 toy instead of 2). *   **Incorrect Quantity of Hats:** Misremembering how many hats Kendra bought (e.g., using 2 hats instead of 3). *   **Incorrect Total Cost Calculation:** Errors in multiplying the individual prices by the quantities and then summing them. This includes basic arithmetic mistakes. *   **Incorrect Change Calculation:** Error in subtracting the total cost from the initial amount ($100). This could be a simple subtraction error. *   **Misinterpreting the Problem:** Misunderstanding what the problem is asking for (e.g., calculating the total cost instead of the change). *   **Units:** Forgetting to use the correct units (dollars). While not a calculation error per se, it can lead to misinterpretations. *   **Order of Operations:** Incorrectly applying the order of operations (though this is less likely in this simple problem, it's still a possibility).  - (Criterion: 'Explore how the problem could be modified to increase its complexity', Level: 1):   Here are a few ways the problem could be modified to increase its complexity, along with explanations of why they add complexity:  1. **Introduce Discounts:**  ""The price of a wooden toy is $20, and a hat is $10. However, if you buy more than two items, you get a 10% discount on the total purchase. Kendra bought two wooden toys and three hats. Calculate her change.""  This adds a percentage calculation and requires the student to determine if the discount applies.  2. **Add Sales Tax:** ""The price of a wooden toy is $20, and a hat is $10.  Sales tax is 7%. Kendra bought two wooden toys and three hats. Calculate her change."" This introduces another percentage calculation that must be applied to the subtotal *before* calculating the change.  3. **Vary the Number of Items with a Variable:** ""The price of a wooden toy is $20, and the price of a hat is $10. Kendra bought *x* wooden toys and *y* hats. If x = 2 and y = 3, and she paid with a $100 bill, calculate her change."" This introduces algebraic thinking, even if the values of x and y are provided.  It sets the stage for more complex problems where x and y need to be solved for.  4. **Introduce Quantity Discounts:** ""The price of a wooden toy is $20 each, but if you buy 3 or more, they are $18 each. Hats are $10 each. Kendra bought 3 wooden toys and 2 hats. Calculate her change from a $100 bill."" This requires determining which price applies based on the quantity purchased.  5. **Include a 'Buy One Get One Free' Offer:** ""The price of a wooden toy is $20, and the price of a hat is $10. There is a 'Buy One Get One Free' offer on wooden toys. Kendra bought three wooden toys and two hats. Calculate her change from a $100 bill."" This introduces a conditional discount that requires careful calculation of the actual cost of the toys.  6. **Multi-Step Discount:** ""The price of a wooden toy is $20, and the price of a hat is $10. If you spend over $50, you get 5% off your entire purchase. Kendra also has a $5 off coupon. Kendra bought two wooden toys and three hats. Calculate her change from a $100 bill."" This requires multiple steps to calculate the final price after discounts.  These modifications introduce concepts like percentages, conditional logic, and algebraic thinking, making the problem more challenging and requiring more complex calculations.  - (Criterion: 'Present the solution with units (e.g., $)', Level: 1):   Kendra received $30 in change.  - (Criterion: 'Present the solution without units', Level: 1):   40  - (Criterion: 'Present the solution showing all working', Level: 1):   Here's how to calculate Kendra's change:  1. **Cost of wooden toys:** 2 toys * $20/toy = $40 2. **Cost of hats:** 3 hats * $10/hat = $30 3. **Total cost:** $40 + $30 = $70 4. **Change received:** $100 - $70 = $30  Therefore, Kendra received $30 in change.  - (Criterion: 'Present the solution showing minimal working', Level: 1):   Cost of toys: 2 * $20 = $40 Cost of hats: 3 * $10 = $30 Total cost: $40 + $30 = $70 Change: $100 - $70 = $30  Answer: Kendra received $30 in change.   The debate will now commence."
2,ROT_Representative,"Okay, here's my assessment as the ROT Representative:  **Core Idea (ROT) Explanation:**  My core idea breaks down the problem into four simple, sequential steps: calculating the cost of the wooden toys, calculating the cost of the hats, adding those costs to get the total cost, and then subtracting the total cost from the amount paid to find the change.  *   **Addressing the Problem:** It directly and efficiently answers the problem by focusing on the necessary calculations in a logical order. *   **Key Strengths:**     *   **Simplicity:** Easy to understand and follow, even for someone with basic math skills.     *   **Directness:** Goes straight to the solution without unnecessary distractions.     *   **Accuracy:** Minimizes the risk of errors by breaking the problem into small, manageable steps.  **Critical Evaluation of GOT Idea:**  The GOT (Graph of Thoughts) idea is interesting because it explores alternative scenarios. However, it suffers from several weaknesses compared to my ROT approach:  *   **Overcomplication:** The alternative scenarios (card payment with cashback, sales tax, combined payment) are irrelevant to the original problem, which explicitly asks for the change received when Kendra pays with a $100 bill. This adds unnecessary complexity and could confuse the user. The original problem does not mention sales tax, card payment, or combined payment, so those scenarios are not needed to answer the question. *   **Loss of Focus:** By introducing these scenarios, the GOT distracts from the core task of solving the initial problem. *   **Potential for Errors:** Introducing more calculations (like sales tax) increases the chance of making a mistake. *   **Inappropriate Scope:** While exploring ""what if"" scenarios can be valuable, it's not appropriate here. The task is to solve a specific problem, not to explore hypothetical variations. *   **Weakness Summary:** The GOT idea is trying to be comprehensive, but it sacrifices clarity and directness for irrelevant information.  **Critical Evaluation of LOT Idea:**  The LOT (Layer of Thoughts) idea is very detailed, but also less efficient than my ROT approach.  *   **Repetitive:** The LOT idea features multiple criteria that are ultimately repetitive. For example, it calculates the cost of the wooden toys and hats multiple times, in different formats (step-by-step, paragraph, etc.). This is redundant and doesn't add value. *   **Unnecessary Detail:** Some criteria, like ""Consider alternative phrasing for the final answer"" or ""Identify potential sources of error in the calculation,"" are overkill for this simple problem. While these are good practices in general, they are not necessary to arrive at the correct answer. *   **Inefficient:** The LOT approach spends too much time on aspects that don't directly contribute to solving the problem. It's less efficient than the ROT approach, which focuses solely on the essential calculations. *   **Weakness Summary:** The LOT idea is too detailed and repetitive, leading to a less efficient and more complex solution.  **Why ROT is Preferable:**  My ROT approach is preferable because it is:  *   **Concise:** It provides the most direct path to the solution. *   **Clear:** It's easy to understand and follow. *   **Efficient:** It avoids unnecessary calculations and distractions. *   **Accurate:** It minimizes the risk of errors by focusing on the essential steps. *   **Focused:** It directly answers the question asked without adding extraneous information.  In short, the ROT approach prioritizes clarity, simplicity, and efficiency, making it the ideal solution for this problem. The GOT and LOT ideas, while interesting in their own ways, overcomplicate the problem and ultimately detract from the core task of finding the correct answer."
3,GOT_Representative,"Okay, here's an elaboration on my GOT (Graph Of Thoughts) idea, a comparative analysis against the ROT (Reversal Of Thought) and LOT (Layer Of Thoughts) ideas, focusing on their weaknesses and strengths, and justifying the preference for my approach.  **Elaboration on the GOT (Refined Thought) Idea**  My GOT idea, ""Refined Thought,"" centers around not just solving the base problem but also exploring alternative scenarios and potential real-world complexities. It aims to provide a more complete and robust understanding of the situation.  *   **Core Idea:** The ""Refined Thought"" approach expands beyond simply calculating the change. It considers factors like cash back options, sales tax, and combined payment methods. This provides a more comprehensive and realistic view of possible transactions.  *   **Addressing the Core Problem:** It directly addresses the core problem by first calculating the base scenario change, then builds upon that foundation by exploring other potential situations. This ensures a thorough understanding of how different factors influence the final outcome.  *   **Key Strengths:**     *   **Comprehensive:** It doesn't stop at the basic answer but investigates multiple possibilities.     *   **Real-World Relevance:** It incorporates realistic scenarios like sales tax and cash back, making the solution more practical.     *   **Flexibility:**  It demonstrates how the answer changes under different conditions.     *   **Proactive Problem Solving:** It anticipates potential variations in the transaction process.  **Critical Evaluation of ROT (Reversal Of Thought) Idea**  The ROT idea presents a straightforward, step-by-step solution to the base problem.  *   **Strengths:**     *   **Clear and Concise:** Easy to understand and follow.     *   **Direct:** Efficiently arrives at the correct answer for the base scenario.  *   **Weaknesses:**     *   **Limited Scope:** Only addresses the basic scenario and doesn't consider any other possibilities.     *   **Lack of Real-World Context:** Fails to account for common elements like sales tax or cash back.     *   **Inflexible:**  Doesn't offer insights into how the answer would change under different circumstances.     *   **Overly Simplistic:** May not prepare the user for more complex real-world situations.  **Critical Evaluation of LOT (Layer Of Thoughts) Idea**  The LOT idea provides a highly detailed, multi-faceted approach to solving the base problem, including verification and alternative presentations.  *   **Strengths:**     *   **Thorough Verification:** Ensures the accuracy of calculations.     *   **Multiple Presentation Formats:** Offers solutions in different styles (step-by-step, paragraph, etc.).     *   **Identifies Potential Errors:** Highlights possible mistakes in the calculation process.     *   **Explores Problem Modifications:** Suggests ways to increase the complexity of the problem.  *   **Weaknesses:**     *   **Overly Focused on the Base Case:** While it explores variations in presentation and potential errors, it remains centered on the single, uncomplicated scenario.     *   **Lacks Scenario Diversity:** It doesn't extend the problem to include real-world complexities like sales tax, cash back, or combined payment methods.     *   **Potential for Information Overload:** The sheer volume of detail might be overwhelming for some users.     *   **Inefficient for Simple Problems:** The extensive analysis might be overkill for a basic calculation.  **Why the GOT (Refined Thought) Approach is Preferable**  The ""Refined Thought"" approach is preferable because it strikes a balance between providing a clear solution and exploring relevant real-world complexities.  *   **Addresses the Core Problem More Holistically:** While ROT and LOT focus almost exclusively on the base calculation, GOT expands the understanding to include other common transaction scenarios. *   **Greater Practical Value:** By considering sales tax, cash back, and combined payments, GOT offers a more realistic and useful solution. *   **Promotes Deeper Understanding:** It encourages thinking beyond the basic calculation and considering the different factors that can influence the final outcome. *   **Avoids Information Overload:** Unlike LOT, it doesn't delve into excessive detail about the base calculation but instead focuses on expanding the scope of the problem. *   **More Adaptable:** It provides a framework for understanding how the answer changes under different conditions, making it more adaptable to various situations.  In summary, while ROT provides a clear and concise solution to the base problem, and LOT offers a meticulously detailed analysis, the ""Refined Thought"" approach offers a more comprehensive, realistic, and adaptable solution by exploring alternative scenarios and real-world complexities. This makes it the most preferable approach for fostering a deeper and more practical understanding of the problem."
4,LOT_Representative,"Okay, as the LOT Representative, let's break down the problem and evaluate the proposed solutions.  **Core Idea and Addressing the Problem:**  My core idea, represented by the aggregated result from layer 175, directly addresses the problem by systematically calculating the cost of the items Kendra purchased and then subtracting that cost from the amount she paid. The strength of this approach lies in its comprehensive nature. It not only calculates the correct answer but also explores various aspects of the problem, including:  *   **Step-by-step and Paragraph Formats:** Provides solutions in different formats for easier understanding. *   **Verification:** Checks the correctness of each step. *   **Assumptions:** Explicitly acknowledges the assumption of no sales tax. *   **Alternative Phrasing:** Offers varied ways to present the final answer. *   **Error Identification:** Identifies potential errors in the calculations. *   **Complexity Modification:** Suggests ways to increase the problem's difficulty. *   **Presentation with and without units:** Considers different ways to write the answer. *   **Working Shown:** Offers solutions with varying levels of detail.  The strength is its ability to generate various perspectives and solutions, covering all relevant aspects from calculation to presentation and potential errors.  **Critical Evaluation of the GOT (Graph Of Thoughts) Idea:**  The GOT idea expands on the basic calculation by introducing alternative scenarios: card payment with cash back, sales tax, and combined payment methods.  *   **Strengths:** The GOT expands on the original problem by introducing real-world scenarios like sales tax and cash back, making it more relevant and engaging. It encourages a broader understanding of financial transactions. *   **Weaknesses:** While the alternative scenarios are interesting, they deviate from the original problem's core question, which is simply calculating the change received. It might confuse the user if the goal is to solve the original problem. The ""Combined Payment"" scenario is also slightly confusing in its explanation. The core problem is not to find the amount paid by card, but the change received, which it then correctly calculates as $0. *   **Overlooked Aspects:** The GOT doesn't explicitly address potential sources of error in the original calculation (like misremembering prices or quantities), which is a valuable aspect of my LOT representation. *   **Limitations:** The GOT focuses on adding complexity through alternative scenarios, but doesn't deeply analyze the core calculation process itself (e.g., different ways to present the working, acknowledging assumptions, etc.).  **Why My Approach is Preferable (in the context of the original problem):**  In this specific case, my LOT approach is preferable because it provides a more thorough analysis of the *original* problem. While the GOT's alternative scenarios are valuable for broader understanding, they dilute the focus on the core task. My approach prioritizes a complete and robust solution to the initial problem, covering all necessary aspects from calculation to presentation and potential pitfalls. It ensures a strong foundation before exploring more complex variations. The GOT feels like it's solving related, but different problems.  **Critical Evaluation of the ROT (Reversal Of Thought) Idea:**  The ROT idea presents a straightforward, step-by-step solution to the problem.  *   **Strengths:** The ROT's strength lies in its simplicity and clarity. It provides a direct and easy-to-follow solution. *   **Weaknesses:** The ROT lacks depth and doesn't explore the problem beyond the basic calculation. It doesn't consider potential errors, alternative presentations, or modifications to increase complexity. It's a very narrow solution. *   **Overlooked Aspects:** The ROT overlooks almost all the aspects covered by my LOT representation, such as assumptions, error identification, and alternative presentations. *   **Limitations:** The ROT is limited by its simplicity. It's a good starting point, but it doesn't offer a comprehensive understanding of the problem.  **Why My Approach is Preferable (compared to the ROT):**  My LOT approach is far more comprehensive than the ROT. While the ROT provides a correct answer, it lacks the depth and breadth of analysis offered by my approach. My approach ensures a complete understanding of the problem, not just a solution. It's more robust, more informative, and more valuable for learning.  **In Summary:**  While the GOT introduces valuable real-world scenarios, it slightly deviates from the original problem's core. The ROT provides a basic solution but lacks depth. My LOT representation offers the most thorough and comprehensive solution to the original problem, covering all relevant aspects and ensuring a strong foundation for further exploration. Therefore, my approach is preferable for understanding and solving the core problem effectively."
