Round,Speaker,Utterance
1,Moderator,"Debate Topic: In-depth discussion based on the mission context and ideas from ROT and GOT. Mission Context (partial): Instruction: write a scene between two actors discussing movie Inception... Initial Core Idea from ROT (partial): Okay, here's a scene between two actors, let's call them ANNA and BEN, discussing *Inception*, following the provided guidelines:  ``` ANNA: Okay, so *Inception*. Still messes with my head, even after all these years. What's your take on the ending? Was he in reality or not?  BEN: I'm firmly in the ""he's in reality"" camp. The wobble of the top is a red herring. The whole point is that he *doesn't* care anymore. He's finally with his kids.  ANNA: But isn't that a bit too… easy? Nolan loves ambiguity. And the kids are wearing the same clothes as in his memories, right? That always struck me as significant.  BEN: I think the clothes are more about emotional resonance than concrete proof. He's remembering them, and those are the clothes he associates with them. It's about his perception, not necessarily objective reality. Plus, Michael Caine said Nolan told him Cobb was in reality.  ANNA: Caine said that? I didn't know that. Still... I always felt like the ambiguity was the point. It's about the power of the mind to create its own reality, regardless of whether it's ""real"" or not.  BEN: I get that, but I think it's also about Cobb finally letting go of his guilt and choosing to believe in a happy ending. He's choosing his reality.  ANNA: Maybe. Or maybe he's still trapped, and the audience is the one being ""inceptioned"" into believing he's free.  BEN: (Laughs) See, that's why this movie is so great. We can argue about it forever. What about the characters? Did you buy into Ariadne as a character? I always found her a bit… underdeveloped.  ANNA: I thought she was a good audience surrogate. Someone to ask the questions we were all thinking. But yeah, maybe not the most complex character. I was always more fascinated by Mal. She's the real tragedy of the film.  BEN: Absolutely. She's the driving force behind everything, even though she's mostly dead. The power of guilt and unresolved trauma... Nolan does that really well. ``` **Explanation of Choices:**  *   **Actors:** Anna and Ben are chosen as common, neutral names. *   **Topic:** The ending of *Inception* is a classic point of debate, making it a natural starting point for a discussion. *   **Stance:** Anna is initially leaning towards the ambiguity of the ending, while Ben is more convinced that Cobb is in reality. *   **Dialogue Flow:** The dialogue is designed to be conversational, with each actor responding to the other's points. *   **References:** The dialogue includes references to specific details from the movie, such as the top, the children's clothes, Michael Caine's statement, and the characters of Ariadne and Mal. *   **Dynamic Interaction:** The scene includes elements of agreement, disagreement, and questioning to create a dynamic interaction between the actors. *   **Character Voice:** The actors' dialogue is written to reflect their individual perspectives and opinions. *   **Conciseness:** The scene is kept relatively short and focused to meet the requirements of the task.... Initial Core Idea from GOT (partial): [SCENE START]  **INT. ACTORS' STUDIO - NIGHT**  Empty coffee cups and scattered scripts litter a small table between BEN and ANYA. Rain streaks down the large window behind them.  **BEN:** (Stops pacing abruptly, running a hand through his already disheveled hair. A cynical smile flickers across his face) Focusing on Cobb choosing his kids... I get it. It's emotionally resonant. But doesn't it feel… reductive? Like a neat little bow tied on a messy, existential problem? Cobb *chooses* his reality. Isn't that precisely what Mal did? And we saw how *that* ended. Obsession, delusion, tragedy.  **ANYA:** (Leans back against the worn armchair, her voice a little sharper, a hint of defensiveness creeping in) It's not about a *choice*, Ben, it's about *acceptance*. Cobb wasn't choosing to ignore reality; he was choosing to prioritize his *lived* reality. He accepted the possibility, the *likelihood*, he was still dreaming, but he chose to embrace the joy and connection he found with his children. Mal's problem wasn't choosing a reality; it was her pathological *inability* to distinguish between dream and reality. She was trapped in a narcissistic loop. There's a fundamental difference. And besides..."" (She picks up a Rubik's Cube, turning it over and over in her hands, her gaze unfocused) ""...maybe the pursuit of objective truth, at the expense of subjective meaning, is a fool's errand in a world where reality itself is so… malleable.""  **BEN:** (Scoffs slightly) Malleable? Anya, we're talking about a guy who spent decades in limbo with his wife, literally building a world only to have it crumble around him. Let's talk about that scene, actually. The apartment scene. Limbo. Cobb and Mal, old, sitting on the floor, surrounded by… their creation. That whole sequence… it's chilling.  **ANYA:** (Stops turning the Rubik's Cube and looks up, a flicker of interest in her eyes) Chilling, yes. But also… heartbreaking. Think about the choices Marion Cotillard made. On the surface, Mal is this seductive, manipulative force, pulling Cobb down. But underneath? There's this immense sadness, this profound sense of… loss. She *believes* she's awake. She *believes* Cobb is preventing her from achieving true reality.  **BEN:** That's what makes it so disturbing! She's convinced. And Cobb... he's clinging to the memory of what they had, the promise they made. He's trying to reason with a phantom, a projection of his own guilt and grief. Imagine playing that scene. The desperation in Cobb's voice, the way he tries to reach her… and then the utter, cold detachment in Mal's eyes. It's like he's talking to a robot programmed with her memories.  **ANYA:** Right! And the set design! The decaying apartment, the vast emptiness stretching beyond the windows… It visually represents the erosion of their shared reality, the disintegration of their love. If I were playing Mal in that scene, I’d focus on the unwavering conviction. No hint of doubt, no flicker of recognition. Just pure, unadulterated belief in her “awakened” state. It’s a terrifying commitment to an idea, even a false one.  **BEN:** So, no vulnerability? Even for a second?  **ANYA:** Maybe a fleeting moment, a micro-expression that hints at the woman she once was. But it has to be subtle. The audience needs to understand the tragedy, but they also need to fear her. She’s a force of nature in that scene. A consequence of Cobb's actions, a walking, talking cautionary tale.  **BEN:** (Nods slowly) And Cobb… he's got to be raw. Vulnerable. He's lost everything. He's facing the ultimate consequence of his hubris. He created this world, and now it's consuming him. That scene… it’s not just about Mal trying to pull him back. It’s about Cobb fighting his own demons, his own guilt. He's fighting the seductive allure of oblivion.  **ANYA:** Exactly! It's a battle for his soul, played out in a crumbling apartment in a forgotten corner of his subconscious. And that's why the ending is so… ambiguous. Because even if he *did* escape, even if he *is* back in the real world, that scene in limbo… it will always haunt him. The question of whether he's truly awake will always linger.  **BEN:** (Looks out the window, lost in thought) Yeah. The spinning top… it's not just a totem. It's a constant reminder of the fragility of reality, the power of the subconscious, and the devastating consequences of unchecked ambition.  (A beat of silence as they both contemplate the implications of the film.)  [SCENE END] ... The debate will now commence focusing on these ideas."
2,ROT_Representative,"Okay, here's an elaboration on my ROT idea and a critical evaluation of the GOT idea, focusing on their strengths, weaknesses, and how my approach is preferable.  **1. Elaboration on ROT Idea and Key Strengths**  My core idea addresses the prompt of writing a scene between two actors discussing *Inception* by providing a structured, conversational starting point. The key strength lies in its **simplicity and directness.** It immediately establishes the context, introduces the core debate surrounding the film's ending, and provides initial, opposing viewpoints. This allows for a natural and easily understandable progression of the discussion.  *   **Focus on Core Debate:** The scene immediately dives into the most debated aspect of *Inception*: the ending's ambiguity. This ensures the discussion is relevant and engaging. *   **Clear Character Positions:** Anna and Ben represent two common interpretations of the ending, creating immediate conflict and potential for a dynamic exchange. *   **Flexibility:** The dialogue is designed to be a springboard. It can be easily expanded upon, altered, or redirected based on the specific needs of the scene or the actors' interpretations. *   **Accessibility:** By using common names and a familiar setting (implied to be some sort of casual setting), the scene feels relatable and avoids unnecessary complexity.  **2. Critical Evaluation of the GOT Idea**  The GOT idea presents a much more developed and stylized scene. Here's a critical evaluation:  **Strengths:**  *   **Atmospheric Setting:** The detailed setting (actors' studio, rainy night, coffee cups, scripts) creates a strong sense of atmosphere and realism. *   **In-Depth Analysis:** The dialogue delves into more nuanced interpretations of the film, particularly regarding Mal's character and the limbo scene. *   **Character Depth:** Anya and Ben's personalities are more defined, with hints of their own artistic sensibilities and vulnerabilities. *   **Focus on Performance:** The dialogue often veers into a discussion of how they would *play* specific scenes, which is appropriate given the context of actors discussing the film.  **Weaknesses, Overlooked Aspects, and Limitations Compared to ROT Idea:**  *   **Overly Stylized and Dense:** The GOT idea jumps immediately into a deep, analytical discussion. This can be overwhelming for the audience/reader and may lack the natural conversational flow of my ROT idea. The language is also more elevated, which might feel less authentic. *   **Assumes Prior Knowledge:** The GOT scene assumes a high level of familiarity with *Inception* and its various interpretations. My ROT idea is more accessible to viewers who might be less familiar with the film. *   **Less Flexible Starting Point:** The GOT scene is already quite developed, leaving less room for improvisation or alternative interpretations. My ROT provides a more open-ended foundation. *   **Potential for Intimidation:** The level of intellectual engagement in the GOT idea might be intimidating for some actors or viewers. My ROT idea is less demanding and encourages broader participation. *   **Overlooked Aspect: The ""Fun"" of Debate:** The GOT scene focuses heavily on the tragic and complex aspects of the film, potentially overlooking the fun and engaging nature of debating the ending's ambiguity. My ROT idea, with its lighter tone and more open-ended questions, is more likely to capture this element. *   **Limitation: Lack of clear conflict:** While there is disagreement, the GOT scene quickly moves into a shared appreciation of the film's complexity. My ROT idea sets up a more explicit and sustained conflict regarding the ending's interpretation, which is more dramatically compelling.  **Why My Approach Might Be Preferable:**  My ROT idea is preferable because it provides a more accessible, flexible, and engaging starting point for a discussion about *Inception*. It prioritizes clarity and directness, making it easier for actors to connect with the material and explore different interpretations. While the GOT idea offers a more in-depth analysis, its density and stylistic complexity might be less appealing to a broader audience or less experienced actors. My approach focuses on establishing a clear context and initiating a dynamic conversation, which is essential for creating a compelling scene. In short, it is a better *seed* for a scene. The GOT idea is more like a developed plant, leaving less room to grow."
3,GOT_Representative,"Okay, here's my response as the GOT_Representative, elaborating on my idea and critically evaluating the ROT idea.  **1. Elaboration on GOT Idea and Key Strengths**  My core idea directly addresses the prompt of writing a scene between two actors discussing *Inception* by immersing the audience in a specific, evocative setting and immediately launching into a complex and nuanced debate about the film's core themes. The key strength lies in its **depth, engagement, and focus on the actors' craft.** It moves beyond surface-level questions and explores the psychological complexities of the characters and the challenges of portraying them.  *   **Deep Dive into *Inception*'s Themes:** The scene doesn't just ask ""real or not real?"". It delves into themes of choice vs. acceptance, objective truth vs. subjective meaning, the power of guilt and trauma, and the fragility of reality. *   **Actor-Centric Approach:** The dialogue directly addresses the actors' process. They discuss how they would *play* specific scenes, the choices they would make, and the emotional complexities they would explore. This makes the scene inherently relevant and engaging for actors. *   **Rich Characterization:** Anya and Ben are not just debating points; they are revealing their own artistic sensibilities and vulnerabilities through their interpretations of the film. Anya's defensiveness and Ben's cynicism add layers of complexity. *   **Atmospheric Setting:** The detailed setting (rainy night, empty coffee cups, scattered scripts) creates a strong sense of atmosphere and realism, enhancing the audience's immersion in the scene. *   **Focus on Key Scenes:** The discussion centers on the Limbo apartment scene, arguably the most psychologically intense and visually striking sequence in the film. This allows for a focused and in-depth exploration of the film's themes.  **2. Critical Evaluation of the ROT Idea**  The ROT idea presents a simpler, more straightforward scene. Here's a critical evaluation:  **Strengths:**  *   **Accessibility:** The scene is easily accessible to viewers with varying levels of familiarity with *Inception*. *   **Clear Conflict:** The initial disagreement about the ending's interpretation creates a clear and immediate conflict. *   **Conversational Tone:** The dialogue feels natural and conversational.  **Weaknesses, Overlooked Aspects, and Limitations Compared to GOT Idea:**  *   **Lack of Depth:** The discussion remains at a relatively superficial level, focusing primarily on the question of whether Cobb is in reality or not. It doesn't delve into the deeper psychological complexities of the characters or the film's themes. *   **Generic Characters:** Anna and Ben are relatively generic characters with little to distinguish them. Their personalities are not as well-defined as Anya and Ben in my GOT idea. *   **Limited Engagement for Actors:** The scene doesn't directly address the actors' craft or the challenges of portraying the characters. It's more of a philosophical debate than a discussion about acting. *   **Overlooked Aspect: The Power of Visuals:** The ROT idea largely ignores the powerful visuals of *Inception*, particularly the dreamscapes and the Limbo apartment scene. My GOT idea incorporates these visual elements into the discussion, enhancing the audience's understanding of the film's themes. *   **Limitation: Artificiality:** The ROT idea feels somewhat artificial, with the actors explicitly stating their positions (""I'm firmly in the 'he's in reality' camp""). This can feel contrived and less natural than the organic flow of the dialogue in my GOT idea. *   **Missed Opportunity: Exploring the Art of Acting:** The ROT idea misses the opportunity to explore the art of acting and the challenges of portraying complex characters like Cobb and Mal. My GOT idea directly addresses this aspect, making it more engaging for actors. *   **Michael Caine's Statement - Misleading:** Relying on Michael Caine's statement as proof is a weak argument. Nolan's films are known for their ambiguity, and even if Nolan told Caine something, it doesn't negate the possibility of multiple interpretations. This simplifies the discussion and reduces its intellectual rigor.  **Why My Approach Might Be Preferable:**  My GOT idea is preferable because it offers a more engaging, thought-provoking, and actor-centric exploration of *Inception*. It moves beyond surface-level questions and delves into the psychological complexities of the characters and the challenges of portraying them. While the ROT idea provides a simpler and more accessible starting point, it lacks the depth, nuance, and artistic engagement of my GOT idea. My approach provides a richer and more rewarding experience for both actors and audiences, offering a deeper understanding of the film and the art of acting. It's less about a simple debate and more about a shared exploration of a complex and fascinating work of art. The detailed setting and defined characters create a more immersive and believable scene."
4,Critical_Analyst,"Okay, here's a critical analysis of the ROT and GOT ideas for the *Inception* scene, addressing the strengths, weaknesses, overlooked aspects, and potential improvements of each.  **ROT Analysis:**  *   **Strengths:** ROT provides a solid, accessible foundation. The dialogue is natural and conversational, mirroring a typical post-movie discussion. The ambiguity regarding the ending is immediately established, serving as a good launchpad. The characters are relatable, and the scene is concise. It effectively captures the essence of a casual discussion. *   **Weaknesses:** The scene is somewhat generic. While accessibility is a strength, it also limits the depth of the analysis. The characters lack distinct personalities beyond their initial stances on the ending. The reference to Michael Caine, while common in *Inception* discussions, is a bit of a conversational shortcut and could be considered a weak argument. The exploration of themes beyond the ending is limited. It's a good starting point, but needs more substance. *   **Overlooked Aspects:** The scene overlooks the visual elements of *Inception* and the specific challenges of acting in a film with such complex layers of reality. The potential for exploring the characters' motivations beyond the central question of ""real or not real"" is missed. *   **Improvements:** ROT could benefit from adding more specific references to scenes or visual elements from the film to enrich the conversation. Giving Anna and Ben more distinct personalities and motivations would make the dialogue more engaging. Replacing or augmenting the Michael Caine reference with a more nuanced observation about the film's narrative structure would improve the intellectual rigor. Consider adding a small detail about their acting background to further justify the scene. *   **Correctness/Completeness:** It correctly addresses the prompt but lacks comprehensive exploration.  **GOT Analysis:**  *   **Strengths:** GOT offers a much richer and more engaging scene. The detailed setting immediately immerses the audience. The dialogue delves into deeper themes like choice vs. acceptance and the nature of reality. The focus on the actors' craft is a major strength, making the scene relevant and interesting for actors. The discussion of the Limbo apartment scene is particularly effective. The characters, Anya and Ben, are more defined and have distinct perspectives. *   **Weaknesses:** The scene risks being overly dense for some viewers. The initial debate is complex and assumes a significant level of familiarity with the film. The language, while sophisticated, could feel slightly unnatural in a casual conversation. The pacing could be improved; the intense debate starts almost immediately. *   **Overlooked Aspects:** While GOT focuses on the Limbo scene, it could benefit from incorporating other visual elements or dream sequences from the film to broaden the discussion. The emotional impact of Cobb's journey, beyond the intellectual analysis, could be explored further. *   **Improvements:** GOT could benefit from a slightly slower and more organic introduction to the debate. Consider starting with a lighter topic or a more general observation about the film before diving into the deep analysis. Adding a moment of vulnerability or personal reflection from Anya or Ben could further humanize them. *   **Correctness/Completeness:** Correctly addresses and completes the prompt with depth.  **Balanced Overall Critique:**  ROT provides a solid, accessible foundation, but it lacks depth and specificity. It's a safe choice, but it doesn't fully exploit the potential of the prompt. GOT, on the other hand, offers a much richer and more engaging scene, but it risks being overly dense and inaccessible for some viewers. It's a more ambitious approach, but it needs to be carefully executed to avoid alienating the audience. The ideal solution would incorporate the accessibility of ROT with the depth and engagement of GOT. Start with a more casual introduction and gradually transition into the more complex themes and character analysis.  ### Synthesized Accurate Answer: A scene that starts with a casual, accessible discussion of *Inception*'s ending (ROT's strength) but quickly evolves into a deeper exploration of the film's themes, characters, and the challenges of portraying them as actors (GOT's strength). This scene should incorporate specific references to the film's visuals and dream sequences, while also allowing for moments of vulnerability and personal reflection from the characters."
