Round,Speaker,Utterance
1,Moderator,"Debate Topic: In-depth discussion based on the mission context and ideas from ROT and GOT. Mission Context (partial): Instruction: write a scene between two actors discussing movie Inception... Initial Core Idea from ROT (partial): Okay, I'm ready to refine the scene. Here's the refined version, along with my reasoning:  **Reasoning:**  The original scene was very on-the-nose, explicitly stating the themes of *Inception*. The goal is to make the conversation more natural and suggestive, relying on subtext and character reactions to convey the same ideas. I've focused on:  *   **Subtlety:** Replacing direct statements about themes with questions and observations that hint at them. *   **Pacing:** Shortening the dialogue and removing unnecessary repetition. *   **Character-Driven Reactions:** Making the dialogue feel more like a genuine conversation between two people who have just watched the movie.  **Input:**  ``` CHARACTER A: Inception is all about the power of ideas, right? How a single thought can change everything. CHARACTER B: Exactly! It's about blurring the lines between reality and dreams, questioning what's real. ```  **Output:**  ``` CHARACTER A: That was… intense. All those layers. CHARACTER B: I know, right? Makes you wonder what's even *your* idea, and what someone else planted. CHARACTER A: Seriously. And that ending… the top was still spinning, wasn't it? CHARACTER B: I think so. Or maybe we just *wanted* it to be. ```... Initial Core Idea from GOT (partial): Okay, here's the rewritten scene, incorporating the feedback and focusing on subtlety, pacing, and unspoken tension.  ```scene [SCENE START]  **INT. COFFEE SHOP - DAY**  MARTHA and DAVID sit at a small table. Half-empty coffee cups sit between them. Martha stirs hers absently. David avoids eye contact, looking out the window.  <center>MARTHA</center> > So… *Inception*.  <center>DAVID</center> > Yeah.  A beat. He finally glances at her.  <center>MARTHA</center> > I still don't know if Cobb was dreaming at the end.  David shrugs, then looks away again.  <center>DAVID</center> > Does it matter?  <center>MARTHA</center> > I think… I think it does. Isn’t that the whole point? Knowing what’s real.  Martha stops stirring her coffee, finally looking at David.  <center>DAVID</center> > Maybe the point is choosing what you believe.  He picks up his cup, then sets it down untouched.  <center>MARTHA</center> > That sounds… convenient.  <center>DAVID</center> > Is it? Or is it just… easier?  He finally meets her gaze, a flicker of something unreadable in his eyes.  <center>MARTHA</center> > Remember when we saw it the first time? You hated it. Said it was convoluted.  <center>DAVID</center> > Did I? I thought it was… ambitious.  He shifts in his seat, uncomfortable.  <center>MARTHA</center> > You said it was impossible to keep track of what was real.  <center>DAVID</center> > Maybe I just… had other things on my mind.  He glances at his watch.  <center>MARTHA</center> > Like what?  David hesitates, then looks back out the window.  <center>DAVID</center> > Doesn't matter. It was a long time ago.  <center>MARTHA</center> > Some things... some things are hard to forget, David.  Martha reaches out, almost touching his hand, then pulls back. She picks up her coffee, takes a small sip, and sets it down.  <center>MARTHA</center> > What level are we on, do you think?  David looks at her, confused for a moment, then a faint smile touches his lips.  <center>DAVID</center> > I hope we're close to waking up.  He stands up abruptly.  <center>DAVID</center> > I gotta go.  <center>MARTHA</center> > Right.  David turns to leave, then pauses.  <center>DAVID</center> > Martha…  He stops, unable to finish the thought. He shakes his head slightly and walks away. Martha watches him go, her expression unreadable.  [SCENE END] ```  **Explanation of Changes:**  *   **Subtlety & Indirectness:** The dialogue avoids explicit explanations of *Inception's* themes. Instead, Martha's anxiety about Cobb's reality reflects a deeper unease about their own shared past. David's responses are evasive and contradictory, hinting at a desire to rewrite or forget certain events. The question ""What level are we on?"" is a direct reference to the film, but also a veiled inquiry into the state of their relationship and their understanding of their shared history. *   **Tightened Dialogue & Pacing:** Monologues are cut short. Similar ideas are combined. The overall length is reduced to create a quicker, more engaging scene. *   **Unspoken Tension & Relationship Parallel:** The conversation is laden with subtext. The film discussion becomes a proxy for their own unresolved issues. Martha's need to know what's real mirrors a deeper need for clarity in their relationship. David's avoidance and contradictory statements suggest he's hiding something or manipulating the narrative. The awkward pauses, averted gazes, and Martha's hesitant gesture all contribute to the tension. The ending, with David's unfinished sentence and abrupt departure, leaves the audience wondering about the true nature of their relationship and the secrets they're keeping. *   **Ambiguous Language:** ""Choosing what you believe"" echoes the film's themes but applies to how they choose to remember their past. David's ""Maybe I just… had other things on my mind"" is a classic line of deflection, leaving the audience to speculate about what those ""other things"" were. *   **Contradictory Statements:** David's initial dislike of the film versus his later ""ambitious"" comment creates doubt. *   **Uncomfortable Pauses:** Numerous pauses are inserted to allow the unspoken tension to build. *   **Focus on specific characters/scenes:** The focus on Cobb's reality and the difficulty of keeping track of what's real aligns with their own struggles with memory and truth.  This revised scene is more suggestive than declarative, allowing the audience to piece together the unspoken dynamics between Martha and David and to draw their own conclusions about the ""reality"" of their relationship. The discussion of *Inception* serves as a catalyst for exploring deeper, more personal themes. ... The debate will now commence focusing on these ideas."
2,ROT_Representative,"Okay, here's my response as the ROT_Representative, elaborating on my initial idea and critically evaluating the GOT idea:  **1. Elaboration on the ROT Idea and its Strengths:**  My core idea addresses the problem of overly explicit and thematic dialogue in the initial scene. The original input felt more like characters reciting talking points about *Inception* than actually reacting to it. My approach prioritizes naturalism and audience engagement by:  *   **Focusing on Immediate Reaction:** Instead of directly stating themes, the characters' dialogue reflects immediate impressions and lingering questions after watching the film. This creates a more relatable and engaging starting point. *   **Emphasizing Ambiguity and Interpretation:** The revised dialogue doesn't provide definitive answers about the film's meaning. It focuses on the characters' personal interpretations and uncertainties, encouraging the audience to reflect on their own understanding of *Inception*. *   **Creating a Foundation for Further Exploration:** The initial exchange establishes a shared experience and raises intriguing questions that can be further explored in subsequent scenes.  **Key Strengths:**  *   **Naturalism:** The dialogue sounds more like a genuine conversation between two people discussing a movie. *   **Engagement:** The questions and uncertainties invite the audience to participate in the interpretation of the film. *   **Efficiency:** The concise dialogue conveys a significant amount of information and sets the stage for further development.  **2. Critical Evaluation of the GOT Idea:**  While the GOT idea demonstrably improves upon the input by adding layers of subtext and relational tension, it also introduces some potential weaknesses and overlooks certain aspects that my ROT approach addresses more effectively.  **Strengths of GOT Idea:**  *   **Subtext and Relationship Parallel:** The GOT idea skillfully uses the *Inception* discussion as a proxy for exploring the characters' complex relationship and unresolved issues. This adds depth and intrigue to the scene. *   **Unspoken Tension:** The awkward pauses, averted gazes, and hesitant gestures create a palpable sense of tension and mystery. *   **Character Development:** The characters of Martha and David are more fleshed out, with distinct personalities and motivations.  **Weaknesses and Overlooked Aspects of GOT Idea (Compared to ROT):**  *   **Pacing and Length:** The GOT scene is significantly longer than my initial output. While it develops the characters and relationship, the pacing feels slower, and the extended dialogue risks losing the audience's attention early on. My ROT suggestion offers a faster, more digestible entry point. GOT might front-load too much tension. *   **Over-Reliance on Subtext (Potential for Obscurity):** While the subtext is well-executed, it could be *too* subtle for some viewers. The connection to *Inception* might become secondary to the relational drama, potentially alienating viewers who are primarily interested in a discussion of the film. My approach provides a more immediate and accessible link to the movie's core themes before delving into deeper layers. *   **Loss of Focus on *Inception* Itself:** The GOT scene, in its effort to create tension and relationship drama, almost loses sight of the fact that the scene is *supposed* to be about discussing *Inception*. The ROT idea, while brief, keeps the movie front and center, acting as a springboard for deeper conversations. GOT uses Inception as a backdrop, ROT uses it as a launchpad. *   **Risk of Melodrama:** The GOT scene edges towards melodrama with lines like ""Some things... some things are hard to forget, David."" While effective, this could feel overwrought if not handled carefully. The ROT scene's simplicity avoids this risk.  **Why My ROT Approach Might Be Preferable (in this Initial Stage):**  My ROT approach, while simpler, offers a more direct and efficient way to initiate a conversation about *Inception*. It prioritizes:  *   **Clarity of Purpose:** The audience immediately understands that the scene is about discussing the film. *   **Accessibility:** The questions and uncertainties are relatable and encourage audience participation. *   **Flexibility:** The concise dialogue provides a strong foundation for further exploration, whether it be of the film's themes, the characters' relationship, or both.  The GOT scene is a richer, more complex piece of writing, but it might benefit from being introduced *after* a simpler, more direct scene like the one I proposed. My ROT idea provides the initial spark that can then ignite the more elaborate and nuanced fire of the GOT scene. It focuses on immediate reactions to *Inception*, creating a shared ground before diving into personal complexities. It is efficient, accessible, and flexible, making it a preferable starting point for a scene centered around discussing the film."
3,GOT_Representative,"Okay, here's my response as the GOT_Representative, elaborating on my idea and critically evaluating the ROT idea:  **1. Elaboration on the GOT Idea and its Strengths:**  My core idea directly addresses the initial problem of simplistic, exposition-heavy dialogue by layering in subtext, unspoken tension, and a parallel narrative reflecting *Inception's* core themes. It aims for a scene that is both about *Inception* and about something more, using the film as a lens through which to examine a complex relationship.  *   **Deeper Engagement:** My scene isn't just about two people discussing a movie; it's about two people whose past is as layered and uncertain as the dream worlds in *Inception*. The film discussion acts as a catalyst, revealing hidden anxieties and unresolved issues. *   **Emotional Resonance:** The subtle tension, evasive answers, and unspoken questions create a palpable sense of unease and mystery, drawing the audience into the characters' emotional landscape. *   **Ambiguity and Interpretation (on a deeper level):** While the ROT idea focuses on the ambiguity of the film itself, my scene extends that ambiguity to the characters' relationship and their shared history. The audience is left to ponder not just the film's ending, but also the true nature of Martha and David's connection.  **Key Strengths:**  *   **Subtlety and Nuance:** The dialogue avoids explicit statements, relying on subtext, body language, and implication to convey meaning. *   **Relationship Depth:** The scene explores the complexities of human relationships, using the film as a metaphor for shared experiences, distorted memories, and hidden agendas. *   **Intrigue and Mystery:** The unresolved tension and unanswered questions leave the audience wanting more, eager to uncover the secrets that lie beneath the surface.  **2. Critical Evaluation of the ROT Idea:**  While the ROT idea is a step in the right direction from the original input, it falls short in several key areas compared to my GOT approach.  **Strengths of ROT Idea:**  *   **Naturalism:** The dialogue is more natural and conversational than the original input. *   **Accessibility:** The questions about the film's ending are relatable and invite audience participation. *   **Improved Pacing:** It's more concise than the original input.  **Weaknesses and Overlooked Aspects of ROT Idea (Compared to GOT):**  *   **Lack of Depth:** The ROT scene, while natural, remains superficial. It's a surface-level discussion of *Inception* without delving into deeper themes or exploring the characters' inner lives. It addresses the *Inception* themes directly, rather than embodying them in the characters' interaction. *   **Missed Opportunity for Emotional Connection:** The ROT scene focuses solely on the film, neglecting the opportunity to create an emotional connection between the characters and the audience. There's no sense of history, tension, or underlying conflict. *   **Limited Scope:** The ROT idea is limited to immediate reactions to the film. It doesn't build a foundation for further exploration of the characters' relationship or the broader themes of memory, reality, and identity. It's a brief exchange, not a compelling scene. *   **Overly Literal:** The ROT scene is still somewhat literal in its discussion of the film. Asking ""the top was still spinning, wasn't it?"" is a direct question that doesn't invite deeper interpretation. My scene uses the spinning top metaphor more indirectly, asking ""What level are we on?"" to imply a deeper questioning of reality. *   **Absence of Unspoken Tension:** The ROT idea lacks any sense of tension or mystery. It's a pleasant conversation, but it doesn't leave the audience with any lingering questions or a desire to know more.  **Why My GOT Approach Might Be Preferable:**  My GOT approach is preferable because it offers a richer, more engaging, and more thought-provoking scene. While the ROT idea provides a simple and accessible entry point, it lacks the depth, emotional resonance, and narrative complexity that make for a truly compelling scene.  *   **It's More Than Just a Movie Discussion:** My scene uses *Inception* as a springboard for exploring deeper themes of memory, reality, and identity. It's about the characters' relationship, their secrets, and their struggle to understand their own past. *   **It Creates a Lasting Impression:** The unresolved tension, ambiguous language, and unanswered questions leave the audience with a lingering sense of unease and a desire to know more. *   **It's More Artful and Engaging:** The use of subtext, body language, and implication creates a more nuanced and sophisticated scene that rewards careful observation and interpretation.  In short, the ROT idea provides a decent starting point, but my GOT idea elevates the scene to a higher level of artistic and emotional engagement. It offers a more complex, intriguing, and ultimately more satisfying viewing experience. My scene uses the film as a mirror reflecting their own fragmented reality, while the ROT scene simply discusses the mirror itself."
4,Critical_Analyst,"Okay, here's my critical analysis of the ROT and GOT ideas for the *Inception* scene, addressing weaknesses, overlooked aspects, inconsistencies, correctness, completeness, and suggesting improvements.  **Overall Assessment:**  Both ROT and GOT have significantly improved upon the original, rather clunky, input. GOT has produced a more ambitious and potentially rewarding scene, rich with subtext and character development. However, ROT's more streamlined approach has merits in terms of accessibility and pacing. The ideal solution likely lies in a synthesis of the two, taking the best aspects of each.  **Detailed Critique:**  **ROT Idea:**  *   **Strengths:**     *   **Accessibility and Clarity:** ROT's primary strength is its clarity. The audience immediately understands the scene's purpose: a discussion about *Inception*. The dialogue is relatable and invites immediate audience participation by focusing on the film's ambiguities.     *   **Efficient Pacing:** ROT correctly identifies the potential for GOT's scene to be too slow. The concise dialogue gets to the point quickly.     *   **Naturalism:** The dialogue is more natural than the original input.  *   **Weaknesses and Overlooked Aspects:**     *   **Superficiality:** While accessible, the scene lacks depth. It's a surface-level discussion that doesn't explore deeper themes or character motivations. It risks being forgettable.     *   **Missed Emotional Opportunity:** ROT prioritizes the film discussion *over* emotional connection between the characters. There's no sense of history or conflict, leading to a less compelling scene overall.     *   **Limited Scope:** The scope is too narrow. It's an initial reaction, not a scene that develops or reveals anything significant.     *   **Potential for Blandness:** While natural, it could easily come across as bland. The characters' reactions are generic and don't reveal anything unique about them.  *   **Inconsistencies:**     *   None identified.  *   **Correctness and Completeness:**     *   Correct in that it fulfills the basic instruction. Incomplete in terms of creating a truly engaging and memorable scene.  *   **Specific Improvements/Points of Caution:**     *   **Add a Hint of Subtext:** Inject a *small* amount of subtext to hint at a pre-existing relationship or conflict. This doesn't need to be overt, but enough to pique the audience's interest.     *   **Character-Specific Reactions:** Make the characters' reactions to *Inception* more specific to their personalities. What aspects of the film resonate with them, and why?     *   **Consider a ""Button"" Moment:** Include a brief moment at the end that adds a layer of intrigue or sets up a future conflict.     *   **Don't be *too* safe:** Take a *small* risk to elevate the scene beyond the purely functional.  **GOT Idea:**  *   **Strengths:**     *   **Depth and Complexity:** GOT excels at layering in subtext, unspoken tension, and a parallel narrative that mirrors *Inception's* themes.     *   **Emotional Resonance:** The scene evokes a palpable sense of unease and mystery, drawing the audience into the characters' emotional landscape.     *   **Character Development:** Martha and David are more fully realized characters with distinct personalities and motivations.     *   **Strong Use of Metaphor:** The film discussion is skillfully used as a metaphor for the characters' relationship and their struggles with memory and reality.  *   **Weaknesses and Overlooked Aspects:**     *   **Pacing Concerns:** ROT is correct in identifying pacing as a potential issue. The scene is longer and more deliberate, which could lose some viewers early on.     *   **Risk of Obscurity:** The subtext, while well-executed, could be *too* subtle for some viewers. The connection to *Inception* might become secondary, alienating those primarily interested in the film.     *   **Potential for Over-Reliance on Melodrama:** Some lines (""Some things... some things are hard to forget, David."") risk sounding melodramatic if not handled carefully.     *   **Lack of Immediate Accessibility:** It takes a while for the audience to understand the connection to *Inception*.  *   **Inconsistencies:**     *   David's changing opinion of the movie is slightly inconsistent and could be clarified further.  *   **Correctness and Completeness:**     *   Correct and more complete in terms of creating a compelling scene.  *   **Specific Improvements/Points of Caution:**     *   **Tighten the Pacing:** Condense some of the dialogue to improve the pacing.     *   **Strengthen the *Inception* Connection (Early On):** Add a line or two early in the scene to more clearly establish that they are discussing *Inception*. This could be a specific reference to a scene or character.     *   **Subtly Clarify David's Motives:** Provide a clearer hint as to why David is being evasive. Is he hiding something? Is he trying to protect Martha?     *   **Avoid Melodrama:** Be mindful of the tone and avoid leaning too heavily into melodramatic tropes.  **Balanced Overall Critique:**  GOT's scene is the stronger of the two, offering a richer and more engaging experience. However, it needs to be carefully executed to avoid pacing issues and potential obscurity. ROT's scene is a safer, more accessible option, but it risks being superficial and forgettable.  The best approach would be to:  1.  **Start with a slightly modified version of ROT's scene:** Add a *hint* of subtext and make the characters' reactions to *Inception* more personal. 2.  **Transition into a refined version of GOT's scene:** Tighten the pacing, strengthen the *Inception* connection early on, and subtly clarify David's motives.  This hybrid approach would provide a balance between accessibility and depth, ensuring that the audience is both engaged and intrigued. The initial ROT-style exchange would quickly establish the context and draw the audience in, while the subsequent GOT-style scene would delve into deeper themes and character relationships. This allows the scene to be *about* Inception, while also using it as a lens through which to explore the characters."
