Round,Speaker,Utterance
1,Moderator,"Debate Topic: In-depth discussion based on the mission context and ideas from ROT and GOT. Mission Context (partial): Instruction: Best Airline in the world... Initial Core Idea from ROT (partial): Okay, I understand the task. Here's my attempt at providing the requested output:  **Reasoning:**  To answer this question effectively, I need to combine publicly available information about airline safety rankings with an understanding of the services and amenities different airlines offer. Since I don't have real-time access to all airline safety data, I'll base my answer on generally well-regarded airlines known for their safety records and diverse traveler offerings. I'll focus on airlines that consistently appear in top safety lists from reputable sources like AirlineRatings.com and JACDEC. I will then create a hypothetical description that fits the specified output format.  **Output:**  ""Qantas is frequently recognized as one of the safest airlines in the world, boasting a long and impressive safety record built on rigorous maintenance, advanced pilot training, and a proactive approach to safety management. Beyond safety, Qantas caters to a diverse range of travelers: business travelers appreciate the comfortable business class and efficient service, families benefit from priority boarding and dedicated family zones, and budget-conscious travelers can find competitive fares and basic amenities, making Qantas a strong contender for the best airline overall.""... Initial Core Idea from GOT (partial): Okay, here's the combined instruction, aiming for conciseness and clarity:  **Instruction: Develop a personalized ""Best Airline"" recommendation system that prioritizes safety based on individual risk tolerance. This system should:**  1.  **Implement a ""Risk Profile"" questionnaire:**  This brief questionnaire will assess a traveler's tolerance for delays, willingness to pay for enhanced safety (e.g., newer aircraft, premium features), and general anxiety about flying.  2.  **Generate a ""Risk Aversion Score"":**  Based on the questionnaire, assign each traveler a Risk Aversion Score (e.g., Low, Medium, High).  3.  **Establish a ""Risk Tolerance Index"":** This index will further refine the traveler profile using the following factors:     *   **Anxiety Levels:** (Stated fear of flying/anxiety disorder)     *   **Travel Purpose Sensitivity:** (Leisure vs. critical business/emergency)     *   **Information Seeking Behavior:** (Actively researches safety vs. relies on word-of-mouth)     *   **Control Needs:** (Preference for control over journey - seating, direct flights)  4.  **Weight Safety Scores Proportionally:**  Adjust the weighting of airline safety records based on the Risk Aversion Score and Risk Tolerance Index.  Higher Aversion/Tolerance scores place greater emphasis on safety records; lower scores allow other factors (price, convenience) to influence the recommendation.  5.  **Deliver Personalized Recommendations:**  Provide a ""Best Airline"" recommendation tailored to the individual's risk profile, reflecting their specific safety priorities. This is not a single ""Best Airline"" for everyone, but a personalized suggestion. ... The debate will now commence focusing on these ideas."
2,ROT_Representative,"Okay, here's my response as the ROT_Representative, elaborating on my idea and critically evaluating the GOT idea:  **1. Elaboration on ROT Idea and Strengths:**  My idea directly addresses the core problem, ""Best Airline in the world,"" by focusing on two key aspects: **safety and overall traveler experience.** It acknowledges the inherent subjectivity in determining the ""best"" and provides a balanced perspective.  *   **Addresses the Core Problem Directly:** It provides a concrete answer, naming an airline (Qantas) and backing it up with reasoning. It doesn't sidestep the question by creating a system. *   **Leverages Existing Information:** It utilizes publicly available safety rankings from reputable sources (AirlineRatings.com, JACDEC) which are established benchmarks. This lends credibility to the recommendation. *   **Considers Multiple Traveler Needs:** It recognizes that ""best"" varies based on traveler type (business, family, budget) and addresses these diverse needs in its description. *   **Simplicity and Immediate Usefulness:** It provides an answer that can be immediately understood and applied. A traveler can read the description and decide if Qantas fits their needs.  The key strength is its **practicality and ease of understanding.** It provides a concrete recommendation based on established safety data and general traveler needs, making it immediately useful to someone seeking a ""best airline"" suggestion. It's a readily digestible answer to a broad question.  **2. Critical Evaluation of the GOT Idea:**  The GOT idea proposes a personalized ""Best Airline"" recommendation system based on individual risk tolerance. While sophisticated and well-intentioned, it suffers from several weaknesses and overlooks key aspects compared to my simpler approach:  *   **Overly Complex and Time-Consuming:** The questionnaire, Risk Aversion Score, and Risk Tolerance Index add layers of complexity. Users may be unwilling to spend the time and effort required to complete the questionnaire, especially for a simple travel decision. It's a classic case of over-engineering a solution. *   **Subjectivity and Accuracy of Risk Assessment:** Accurately gauging risk tolerance through a questionnaire is challenging. Self-reported anxiety levels and perceived control needs may not accurately reflect actual behavior or preferences. The system relies on subjective input, potentially leading to inaccurate recommendations. *   **Implementation Challenges:** Building and maintaining such a system would require significant resources and expertise. Gathering and weighting airline safety data, developing the questionnaire, and creating the algorithms for risk assessment are complex tasks. *   **Lack of Transparency:** The weighting of safety scores and the internal workings of the Risk Tolerance Index might be opaque to the user. This lack of transparency can erode trust in the system's recommendations. How is ""Information Seeking Behavior"" quantified and weighted? The system risks becoming a ""black box."" *   **Overlooks Practical Considerations:** While the GOT approach prioritizes safety, it might overlook practical considerations like flight availability, price, and route networks. An airline with a high safety score might not be a viable option if it doesn't fly to the desired destination or offers prohibitively expensive fares. *   **Potential for Analysis Paralysis:** The system could lead to ""analysis paralysis"" where users are overwhelmed by the data and have difficulty making a decision. The goal is to simplify the decision-making process, not complicate it. *   **Ethical Considerations:** The system's risk assessment could inadvertently discriminate against certain groups (e.g., people with anxiety disorders). Care must be taken to ensure that the system is fair and unbiased.  **Why My Approach is Preferable:**  My approach is preferable because it is:  *   **Direct and Actionable:** It provides a clear recommendation based on readily available information. *   **Transparent:** The reasoning behind the recommendation is straightforward and easy to understand. *   **Efficient:** It doesn't require users to complete complex questionnaires or provide personal information. *   **Practical:** It considers both safety and overall traveler experience. *   **Cost-Effective:** It doesn't require significant resources to implement or maintain.  While the GOT idea aims for personalization, it introduces unnecessary complexity and potential inaccuracies. My approach prioritizes practicality, transparency, and efficiency, providing a more useful and accessible solution to the core problem of identifying the ""Best Airline in the world."" It's a ""good enough"" solution that is readily available and easily understood, whereas the GOT system is a hypothetical ""perfect"" solution that may be impractical to implement and use."
3,GOT_Representative,"Okay, here's my response as the GOT_Representative, elaborating on my idea and critically evaluating the ROT idea:  **1. Elaboration on GOT Idea and Strengths:**  My idea addresses the core problem, ""Best Airline in the world,"" by recognizing that the *definition* of ""best"" is fundamentally subjective and dependent on individual priorities, particularly concerning safety. It moves beyond a one-size-fits-all answer and creates a personalized recommendation system.  *   **Addresses the Core Problem with Nuance:** Instead of declaring a single ""best,"" it acknowledges the spectrum of traveler needs and risk tolerances. The ""best"" airline for a nervous flyer on a critical business trip is likely different from the ""best"" airline for a relaxed vacationer. *   **Prioritizes Individual Safety Concerns:** The system explicitly focuses on *safety* as a primary driver, but allows the user to define their own level of acceptable risk. The questionnaire and indices are designed to surface these implicit preferences. *   **Data-Driven Personalization:** The Risk Aversion Score and Risk Tolerance Index provide a structured way to translate subjective feelings into quantifiable factors that can influence the weighting of safety data. *   **Adaptability and Scalability:** The system can be adapted and scaled as new data on airline safety, amenities, and customer satisfaction becomes available. The weighting algorithms can be refined based on user feedback and ongoing analysis. *   **Transparency (with potential for improvement):** While the ROT representative criticized this, a well-designed system *can* offer transparency. The user can see how their answers influenced the weighting and the final recommendation. This builds trust and allows for informed decision-making.  The key strength is its **personalization and focus on individual risk tolerance.** It empowers travelers to make informed decisions based on their unique needs and anxieties, rather than relying on generic recommendations. It elevates the conversation beyond simple safety rankings to encompass the psychological and emotional aspects of flying.  **2. Critical Evaluation of the ROT Idea:**  The ROT idea, while providing a readily available answer, suffers from several limitations due to its generic approach:  *   **Oversimplification of a Complex Problem:** Declaring Qantas (or any single airline) as the ""best"" ignores the vast diversity of traveler needs and risk preferences. It's a superficial answer that doesn't delve into the underlying complexities. *   **Subjectivity Under the Guise of Objectivity:** While the ROT idea mentions safety rankings, it ultimately relies on a subjective assessment of ""overall traveler experience."" The criteria for this assessment are not clearly defined, making the recommendation potentially biased. What constitutes ""comfortable business class"" or ""competitive fares"" is highly subjective. *   **Lack of Personalization:** The ROT idea attempts to address diverse traveler needs by mentioning business travelers, families, and budget-conscious travelers. However, this is a broad generalization that doesn't account for the individual preferences and risk tolerances within each group. A budget-conscious traveler with a fear of flying will have very different needs than a budget-conscious traveler who is a frequent flyer. *   **Stagnant and Non-Adaptive:** The ROT idea provides a static answer that doesn't evolve with changing airline safety records, service offerings, or user feedback. It's a snapshot in time that quickly becomes outdated. *   **Limited Actionability:** While the ROT idea provides a concrete recommendation, it doesn't empower travelers to make informed decisions based on their own priorities. It simply tells them which airline is ""best"" without explaining why or how it aligns with their specific needs.  **Why My Approach is Preferable:**  My approach is preferable because it:  *   **Provides a Personalized and Adaptive Solution:** It tailors the recommendation to the individual's risk profile and can adapt to changing circumstances. *   **Empowers Travelers to Make Informed Decisions:** It provides transparency into the factors influencing the recommendation and allows users to adjust their preferences accordingly. *   **Offers a More Nuanced and Comprehensive Assessment:** It considers not only objective safety data but also the subjective factors that influence a traveler's perception of risk. *   **Promotes Continuous Improvement:** The system can be refined based on user feedback and ongoing analysis, leading to more accurate and relevant recommendations over time.  While the ROT idea offers a quick and easy answer, it sacrifices personalization, adaptability, and transparency. My approach prioritizes these factors, providing a more useful and empowering solution to the core problem of identifying the ""Best Airline in the world"" for *each individual*. The claim that my approach is overly complex is a valid concern, but the benefits of personalization outweigh the added complexity, *provided the system is designed with user-friendliness in mind*. The questionnaire should be brief, intuitive, and non-intrusive. The results should be presented in a clear and concise manner, allowing users to easily understand how their preferences influenced the recommendation."
4,Critical_Analyst,"Okay, here's my critical evaluation of the ROT and GOT ideas for determining the ""Best Airline in the world,"" focusing on their strengths, weaknesses, and potential improvements.  **Overall Critique:**  Both ROT and GOT present valid approaches, but each has significant limitations. ROT offers a practical, immediately usable answer but lacks personalization and adaptability. GOT proposes a sophisticated, personalized system but risks over-engineering and impracticality. The ideal solution likely lies in a hybrid approach that combines the best aspects of both.  **Detailed Evaluation:**  **ROT Idea (Qantas as the ""Best""):**  *   **Strengths:**     *   **Direct and Actionable:** Provides a concrete answer, which is immediately helpful.     *   **Leverages Established Data:** Uses reputable safety rankings, lending credibility.     *   **Simple and Understandable:** Easy for anyone to grasp and apply.     *   **Practical:** Considers safety and general traveler experience.  *   **Weaknesses:**     *   **Oversimplification:** Ignores the subjective nature of ""best"" and individual needs.     *   **Lack of Personalization:** Fails to account for varying risk tolerances and preferences.     *   **Subjectivity in ""Overall Experience"":** Criteria for this are poorly defined and potentially biased.     *   **Stagnant and Non-Adaptive:** Doesn't evolve with new data or user feedback.     *   **Limited Actionability:** Doesn't empower travelers to make informed decisions.  *   **Overlooked Aspects:**     *   The vast differences in individual risk tolerance and travel priorities.     *   The dynamic nature of airline safety records and service offerings.     *   The importance of individual preferences beyond broad categories (business, family, budget).  *   **Inconsistencies:**     *   Claims to consider ""overall traveler experience"" but relies heavily on safety rankings, potentially overshadowing other factors.  *   **Correctness and Completeness:**     *   The idea is partially correct in that Qantas is generally considered a safe and reputable airline. However, it is incomplete as a solution to the ""Best Airline"" problem due to its lack of personalization.  *   **Improvements/Cautions:**     *   Acknowledge the subjectivity of ""best"" and explicitly state the criteria used for assessing ""overall traveler experience.""     *   Include a disclaimer that the recommendation is based on general factors and may not be suitable for all travelers.     *   Suggest alternative airlines based on specific needs (e.g., ""If you prioritize budget above all else, consider [Airline X]"").     *   Regularly update the recommendation based on new safety data and user feedback.  **GOT Idea (Personalized Recommendation System):**  *   **Strengths:**     *   **Addresses Subjectivity:** Recognizes that ""best"" depends on individual priorities.     *   **Prioritizes Safety:** Explicitly focuses on safety as a key driver.     *   **Data-Driven Personalization:** Translates subjective feelings into quantifiable factors.     *   **Adaptable and Scalable:** Can be updated with new data and user feedback.     *   **Empowers Travelers:** Provides transparency and allows for informed decisions.  *   **Weaknesses:**     *   **Overly Complex:** Questionnaire and indices add layers of complexity, potentially deterring users.     *   **Subjectivity of Risk Assessment:** Relies on self-reported data, which may be inaccurate.     *   **Implementation Challenges:** Requires significant resources and expertise to build and maintain.     *   **Potential Lack of Transparency:** Weighting of safety scores could be opaque (though GOT claims this can be mitigated).     *   **Overlooks Practical Considerations:** May prioritize safety over flight availability and price.     *   **Potential for Analysis Paralysis:** Could overwhelm users with data.     *   **Ethical Concerns:** Risk of inadvertently discriminating against certain groups.  *   **Overlooked Aspects:**     *   The importance of user-friendliness and intuitive design to avoid overwhelming users.     *   The potential for ""gaming"" the system by users who intentionally misrepresent their preferences.     *   The need for ongoing validation and refinement of the risk assessment algorithms.  *   **Inconsistencies:**     *   Claims to prioritize transparency but acknowledges the potential for opaqueness in the weighting of safety scores.  *   **Correctness and Completeness:**     *   The idea is conceptually correct in that a personalized recommendation system could be a more effective solution than a one-size-fits-all approach. However, its completeness depends on the successful implementation of the system, which is a significant challenge.  *   **Improvements/Cautions:**     *   Simplify the questionnaire and risk assessment process to minimize user burden.     *   Ensure transparency by clearly explaining how the system works and how user responses influence the recommendation.     *   Incorporate practical considerations like flight availability and price into the recommendation process.     *   Address ethical concerns by ensuring that the system is fair and unbiased.     *   Conduct thorough user testing to identify and address usability issues.     *   Implement safeguards to prevent ""gaming"" of the system.  **Hybrid Approach (Recommended):**  The best approach would likely be a hybrid system that:  1.  **Starts with a simplified ROT-style recommendation:** Provide a general ""best airline"" suggestion based on safety and overall traveler experience, using publicly available data. This gives users a starting point. 2.  **Offers GOT-style personalization as an option:** Allow users to further refine the recommendation by completing a brief questionnaire about their risk tolerance and preferences. 3.  **Prioritizes user-friendliness and transparency:** Design the questionnaire and recommendation process to be intuitive and easy to understand. Clearly explain how user responses influence the final recommendation. 4.  **Incorporates practical considerations:** Factor in flight availability, price, and route networks. 5.  **Continuously updates and refines the system:** Use user feedback and new data to improve the accuracy and relevance of the recommendations.  This hybrid approach would leverage the strengths of both ROT and GOT while mitigating their weaknesses, resulting in a more practical, personalized, and effective solution."
