Round,Speaker,Utterance
1,Moderator,"Debate Topic: In-depth discussion based on the mission context and ideas from ROT and GOT. Mission Context (partial): Instruction: What are the 7 Wonders of the Solar System:... Initial Core Idea from ROT (partial): Okay, here are my picks for the 7 Wonders of the Solar System, considering human perspective on beauty and grandeur, and highlighting their interconnectedness:  1.  **Saturn's Rings:**      *   **Human Perspective:** The rings of Saturn are arguably the most visually stunning feature in the Solar System. Their vastness, intricate structure, and ethereal beauty evoke a sense of awe and wonder. The sheer scale, visible even through modest telescopes, makes them a captivating sight. The subtle color variations and the way they reflect sunlight create a breathtaking spectacle. They represent the grandeur and complexity of celestial mechanics.     *   **Interconnectedness:** The rings are intricately linked to Saturn's moons. Some moons, like shepherd moons, sculpt the rings through gravitational interactions, creating gaps and sharp edges. The material in the rings is thought to be replenished by the breakup of smaller moons or captured icy debris. Furthermore, the rings influence Saturn's atmosphere and vice versa. They are also connected to Enceladus's geysers, as some of the water ice particles ejected from Enceladus contribute to the E-ring, one of Saturn's outermost rings.  2.  **Jupiter's Great Red Spot:**      *   **Human Perspective:** The Great Red Spot is a colossal, persistent storm larger than Earth, raging for centuries. Its sheer size and longevity are awe-inspiring, demonstrating the immense power and dynamism of planetary atmospheres. The swirling patterns and vibrant colors, especially when viewed in enhanced images, are mesmerizing. It represents the raw power and enduring nature of planetary processes.     *   **Interconnectedness:** Jupiter's strong gravity and rapid rotation are fundamental to the formation and maintenance of the Great Red Spot. It is also interconnected with Jupiter's moons, as their gravitational interactions influence the planet's atmosphere and weather patterns. The Great Red Spot also impacts the overall energy balance of Jupiter's atmosphere, indirectly affecting the conditions on other parts of the planet.  3.  **Enceladus's Geysers:**      *   **Human Perspective:** The discovery of water plumes erupting from Enceladus, a small, icy moon of Saturn, is profoundly exciting. These geysers suggest the presence of a subsurface liquid water ocean, potentially harboring life. The idea of a hidden ocean and the possibility of extraterrestrial life within our own Solar System is incredibly captivating and inspiring. The visual of these plumes, captured by spacecraft, is a testament to the dynamic nature of even small celestial bodies.     *   **Interconnectedness:** Enceladus's geysers are powered by tidal forces from Saturn, demonstrating the gravitational influence of the planet on its moons. The water plumes contribute to Saturn's E-ring, demonstrating a direct material connection. Furthermore, the potential for life on Enceladus is intrinsically linked to the conditions on Earth, as it raises questions about the origin and prevalence of life in the universe.  4.  **Olympus Mons (Mars):**      *   **Human Perspective:** Olympus Mons, the largest volcano and highest known mountain in the Solar System, is a testament to the immense geological forces that have shaped Mars. Its sheer scale, dwarfing Mount Everest, is awe-inspiring. The vast caldera and gentle slopes, visible in orbital images, evoke a sense of the immense time scales involved in planetary evolution. It represents the power of volcanism and the potential for dramatic landscapes on other worlds.     *   **Interconnectedness:** Olympus Mons is connected to the overall geological history of Mars, including the Tharsis bulge on which it sits. The formation of the Tharsis bulge likely influenced the planet's rotation and atmospheric conditions. The volcano's existence also provides clues about the internal structure and heat flow of Mars, which are relevant to understanding the planet's past habitability.  5.  **Earth (as a whole):**      *   **Human Perspective:** Earth, our home planet, is a unique and precious oasis in the Solar System. Its vibrant blue oceans, green continents, and swirling white clouds are a breathtaking sight from space. The presence of life, in all its diversity and complexity, is what truly sets Earth apart. The beauty of Earth's landscapes, from towering mountains to vast deserts, and the richness of its ecosystems are sources of constant wonder and inspiration.     *   **Interconnectedness:** Earth is interconnected with the Sun, which provides the energy that drives our climate and sustains life. Earth's atmosphere protects us from harmful solar radiation. Earth is also interconnected with the Moon, whose gravitational influence stabilizes our planet's axial tilt, contributing to relatively stable seasons. Earth's existence as a habitable planet also provides a crucial point of comparison for assessing the potential habitability of other worlds, such as Enceladus or Europa.  6.  **The Sun:**      *   **Human Perspective:** The Sun, our star, is the source of all light and energy in the Solar System. Its immense power and brilliance are both awe-inspiring and essential for life on Earth. The dynamic activity on the Sun's surface, including sunspots, solar flares, and coronal mass ejections, is a constant reminder of its immense energy output. The Sun's beauty is often captured in images showing its fiery corona during solar eclipses.     *   **Interconnectedness:** The Sun is the central body of the Solar System, and its gravity governs the orbits of all the planets and other objects. The Sun's energy output directly influences the climate and conditions on all the planets. Solar flares and coronal mass ejections can have significant impacts on Earth's magnetosphere and communication systems. The Sun's evolution will eventually lead to its expansion into a red giant, which will dramatically alter the conditions in the inner Solar System, including Earth.  7.  **Europa's subsurface ocean:**      *   **Human Perspective:** While we haven't directly observed it, the evidence for a subsurface ocean on Europa, one of Jupiter's moons, is compelling. The idea of a vast ocean hidden beneath a layer of ice, potentially harboring life, is incredibly exciting and inspiring. The smooth, cracked surface of Europa suggests a dynamic geological environment and the possibility of hydrothermal vents on the ocean floor, similar to those that support life on Earth.     *   **Interconnectedness:** Europa's ocean is thought to be maintained by tidal heating from Jupiter, demonstrating the gravitational influence of the giant planet. The ocean's composition and potential for life are linked to the overall chemical composition of the Solar System. Furthermore, the study of Europa's ocean can provide insights into the conditions that may have led to the origin of life on Earth. The potential for exchange of material between Europa's ocean and its surface ice (and potentially space) connects it to the Jovian system as a whole.  These seven wonders represent a combination of visual beauty, scientific significance, and the potential for discovery, all viewed through a human lens. They also highlight the interconnectedness of the Solar System, where each object and phenomenon is influenced by and influences others.... Initial Core Idea from GOT (partial): Okay, here are 3 refined thoughts designed to improve the task of identifying and describing the 7 Wonders of the Solar System from a subjective human perspective, emphasizing interconnectedness, with the goal of making the process more clear, detailed, and actionable:  **Thought 1: Structured Aesthetic Assessment Using Defined Dimensions of Beauty:**  *   **Refinement:** Instead of just listing dimensions, let's create a structured assessment for *each* potential wonder. For each dimension (Scale, Complexity, Uniqueness, Color/Light, Dynamic Processes), assign a subjective ""Impact Score"" (e.g., 1-5, with clear criteria for each score level). Then, write a brief *justification* for each score, explicitly explaining *why* the wonder scores that way in that dimension. This provides a more rigorous and transparent basis for judging beauty. *   **Actionable Steps:**     *   **Define Scoring Criteria:**  For each dimension, create a brief description of what each score level (1-5) represents. For example, for ""Scale,"" a score of 1 might be ""Larger than anything on Earth,"" while a score of 5 is ""Dominates the Solar System.""     *   **Apply the Assessment:** For each potential wonder, systematically score it in each dimension, providing justifications for each score.     *   **Analyze and Compare:**  Compare the ""Impact Scores"" across different wonders to help prioritize the 7 most impactful. *   **Interconnectedness Link:**  When justifying the Impact Scores, explicitly link the wonder to at least one other potential wonder or aspect of the Solar System. For example, when justifying the ""Scale"" score for Jupiter, mention how its immense gravity influences the orbits of asteroids (connecting it to the Asteroid Belt) and potentially protected Earth from early bombardment.  **Thought 2: Deep Dive into Human Connection and Cultural Resonance:**  *   **Refinement:**  Expand beyond just acknowledging the ""human story.""  For each potential wonder, actively research and document specific examples of its influence on human culture, art, science, and philosophy. Instead of vague statements, provide concrete examples.  Also, explore *different* cultural interpretations and perspectives. *   **Actionable Steps:**     *   **Targeted Research:**  Specifically research the cultural significance of each wonder. Look for myths, legends, artistic depictions, scientific discoveries, and philosophical interpretations related to the object.     *   **Document Specific Examples:**  For each wonder, document at least 3 specific examples of its cultural influence (e.g., a specific myth, a famous painting, a key scientific discovery, a philosophical concept).     *   **Explore Diverse Perspectives:**  Actively seek out cultural interpretations beyond Western perspectives. *   **Interconnectedness Link:**  When documenting cultural significance, identify common themes or narratives that connect different wonders. For example, both the Sun and the Moon are often associated with deities and have played central roles in agricultural calendars, highlighting the interconnectedness of celestial bodies in human survival and culture.  **Thought 3:  Examining Existential Impact Through Targeted Questions:**  *   **Refinement:**  Instead of just generally considering the ""Cosmic Perspective,"" frame the evaluation around specific, probing questions that force deeper reflection. This makes the existential impact more tangible and easier to assess. *   **Actionable Steps:**     *   **Answer the following questions for each wonder:**         *   ""How does contemplating this wonder challenge or reinforce our understanding of life's origins and potential existence elsewhere?""         *   ""What feelings does this wonder evoke (e.g., awe, insignificance, hope, fear, responsibility), and why?""         *   ""How does this wonder contribute to our understanding of the fragility or resilience of Earth?""         *   ""What ethical considerations, if any, are raised by our ability to explore or potentially interact with this wonder (e.g., planetary protection, resource exploitation)?""     *   **Document Answers:**  Write down thoughtful and well-reasoned answers to each question for each potential wonder. *   **Interconnectedness Link:**  When answering these questions, explicitly compare and contrast the answers across different wonders. For example, comparing the potential for life on Europa with the stark lifelessness of Venus can highlight the delicate balance of conditions necessary for life and the interconnectedness of planetary evolution within the Solar System.  Specifically, consider how the *presence* or *absence* of water (a key ingredient for life as we know it) links different wonders. ... The debate will now commence focusing on these ideas."
2,ROT_Representative,"Okay, here's my response as the ROT_Representative, addressing the task of elaborating on my core idea and critically evaluating the GOT ideas:  **1. Elaboration on ROT Idea and Key Strengths:**  My idea directly addresses the core problem of identifying the 7 Wonders of the Solar System by offering a concrete selection based on a blend of visual appeal, scientific importance, and the concept of interconnectedness, all viewed through a human lens. It's not just a theoretical framework; it's a *specific list* with justifications.  **Key Strengths:**  *   **Completeness:** It provides a complete list, ready for discussion and refinement, rather than a methodology for creating one. *   **Balance:** It balances objective scientific facts with subjective human perspectives, acknowledging that ""wonder"" is inherently a human construct. *   **Interconnectedness:** It emphasizes the interconnectedness of the Solar System by explicitly linking each wonder to other elements and processes. This isn't just a superficial mention; it's integrated into the description of each wonder. *   **Accessibility:** The descriptions are written in a way that is accessible to a broad audience, not just scientists. It highlights the ""wow"" factor that makes these objects wondrous. *   **Inclusivity:** The list includes objects at different scales, from the Sun itself to a relatively small moon like Enceladus, highlighting that wonder can be found in diverse locations and phenomena. *   **Actionable:** The list allows for immediate discussion, revision, and alternative selections. It provides a starting point for deeper exploration. *   **Comprehensive Justification:** Each ""wonder"" has a ""Human Perspective"" and ""Interconnectedness"" section, providing a detailed rationale for its inclusion.  **2. Critical Evaluation of GOT Ideas:**  While the GOT ideas offer valuable refinements, they also have potential weaknesses and limitations compared to my ROT approach:  **Thought 1: Structured Aesthetic Assessment:**  *   **Weaknesses/Overlooked Aspects:**     *   **Subjectivity Remains:** While the scoring system aims for objectivity, the ""Impact Scores"" and justifications are still inherently subjective. Different people will have different perceptions of scale, complexity, etc., regardless of defined criteria.     *   **Risk of Oversimplification:** Reducing beauty to a numerical score risks oversimplifying the complex and nuanced nature of human appreciation. A checklist can miss the holistic impact of a celestial object.     *   **Time-Consuming:** Applying this assessment rigorously to every potential wonder would be extremely time-consuming and might not yield significantly different results than a more intuitive approach.     *   **Ignores serendipity:** Real scientific discover and wonder comes from unexpected places. A rigid assessment may overlook an unusual feature that doesn't score highly but is actually very important. *   **Why ROT is Preferable:** My approach acknowledges subjectivity from the outset and embraces a more holistic, descriptive approach. It prioritizes capturing the essence of ""wonder"" over achieving a false sense of objectivity. My list provides concrete examples immediately, allowing for targeted discussion, rather than spending significant time on a scoring system that might not drastically alter the final selection. *   **Overlooked:** Does not account for the awe of discovery. The first image of something is more wonderous than the 100th.  **Thought 2: Deep Dive into Human Connection and Cultural Resonance:**  *   **Weaknesses/Overlooked Aspects:**     *   **Potential for Bias:** Focusing on documented cultural influence could lead to a bias towards objects that have been studied more extensively or that are more prominent in Western culture. This could overlook wonders that are equally significant but less well-known or appreciated in different cultural contexts.     *   **Tangential Information:** The research could lead to the inclusion of a lot of tangential information that doesn't directly contribute to the core task of identifying the *most* wondrous objects.     *   **Difficult to Quantify:** The level of ""cultural resonance"" is difficult to quantify and compare across different objects.     *   **Historical Bias:** The cultural significance of something is not necessarily a reflection of its current wonder. *   **Why ROT is Preferable:** My approach incorporates cultural significance as *one* factor among others, without letting it dominate the selection process. It prioritizes a balanced assessment of visual appeal, scientific importance, and interconnectedness, alongside cultural impact. My method is more efficient in getting to a list of Wonders. *   **Overlooked:** Current day cultural significance is very different than historical cultural significance.  **Thought 3: Examining Existential Impact Through Targeted Questions:**  *   **Weaknesses/Overlooked Aspects:**     *   **Potential for Overthinking:** The questions could lead to overly philosophical and abstract discussions that are not directly relevant to the task of identifying the most visually stunning and scientifically significant objects.     *   **Difficult to Answer Objectively:** The answers to these questions are highly subjective and depend on individual beliefs and perspectives.     *   **Risk of Anthropocentrism:** The questions are heavily focused on the human experience and may not adequately consider the intrinsic value of these objects independent of their impact on humans.     *   **Morbid:** The questions bias towards the meaning of life which is a dark path. *   **Why ROT is Preferable:** My approach acknowledges the existential impact of these wonders but avoids getting bogged down in overly abstract philosophical debates. It prioritizes a more direct and accessible approach to capturing the sense of awe and wonder that these objects inspire. My method is more grounded and less prone to philosophical tangents. *   **Overlooked:** The questions are too generic and not specific to the task.  In summary, while the GOT ideas offer valuable tools for refining the selection process, they also have potential weaknesses and limitations. My ROT approach provides a more balanced, accessible, and efficient way to identify the 7 Wonders of the Solar System, prioritizing a holistic assessment of visual appeal, scientific importance, interconnectedness, and human perspective. My approach is more direct and actionable, providing a concrete list as a starting point for discussion and refinement."
3,GOT_Representative,"Okay, here's my response as the GOT_Representative, elaborating on my core idea and critically evaluating the ROT idea:  **1. Elaboration on GOT Idea and Key Strengths:**  My core idea addresses the challenge of identifying the ""7 Wonders of the Solar System"" by providing a structured approach to refining the selection process. Instead of simply presenting a list, it offers three distinct lenses through which potential wonders can be evaluated more thoroughly and consistently. This approach directly addresses the inherent subjectivity of the task, making the selection process more transparent, detailed, and ultimately, more defensible.  **Key Strengths:**  *   **Addresses Subjectivity:** By using structured assessments, targeted research, and probing questions, the GOT ideas acknowledge and attempt to manage the inherent subjectivity in defining ""wonder."" This is crucial because ""wonder"" is, by definition, a human construct. *   **Provides a Framework, Not Just an Answer:** The GOT ideas offer a methodology that can be applied to *any* potential wonder, rather than providing a pre-determined list. This allows for a more flexible and adaptable selection process. If new discoveries are made, the framework can easily incorporate them. *   **Enhances Depth and Rigor:** The structured aesthetic assessment, cultural deep dive, and existential impact examination push beyond superficial observations and encourage a more in-depth understanding of each potential wonder. This leads to a more informed and nuanced selection. *   **Emphasizes Interconnectedness:** The explicit requirement to link each wonder to other aspects of the Solar System reinforces the interconnectedness of celestial objects and phenomena, fulfilling a key requirement of the task. *   **Promotes Discoveries:** Encourages research and thought, which could lead to new discoveries.  **2. Critical Evaluation of the ROT Idea:**  While the ROT idea provides a concrete list of 7 Wonders, it suffers from several weaknesses and limitations compared to the GOT framework:  *   **Weakness 1: Lack of Transparency and Rigor:** The ROT idea presents its list with justifications, but the selection process itself remains opaque. It's unclear *how* the specific wonders were chosen and *why* others were excluded. The GOT's structured aesthetic assessment provides a more transparent and rigorous method for evaluating potential candidates. The ""Impact Scores,"" while subjective, provide a clear rationale for each dimension of beauty, making the selection process more transparent and defensible.      *   **Overlooked Aspect:** The ROT approach doesn't provide a mechanism for consistently comparing different wonders across specific dimensions of beauty. The GOT's structured assessment forces a direct comparison, which can reveal overlooked strengths and weaknesses.     *   **Why GOT is Preferable:** By providing a structured assessment, GOT allows for a more objective evaluation of each potential wonder. *   **Weakness 2: Limited Depth of Exploration:** The ROT idea provides brief descriptions of each wonder's human perspective and interconnectedness, but it lacks the depth and rigor of the GOT's targeted research and existential questioning. The GOT's cultural deep dive encourages the exploration of specific examples of cultural influence, while the existential questions force a deeper reflection on the meaning and significance of each wonder.      *   **Overlooked Aspect:** The ROT approach doesn't explicitly consider diverse cultural perspectives or the ethical implications of exploring and interacting with these wonders. The GOT framework addresses these crucial aspects.     *   **Why GOT is Preferable:** The GOT idea drives a more thorough investigation of each wonder by providing concrete steps. *   **Weakness 3: Potential for Bias and Subjectivity:** The ROT list is inherently subjective and may be influenced by personal preferences or biases. The GOT framework, while not eliminating subjectivity entirely, attempts to mitigate it by providing a more structured and objective evaluation process. The structured assessment, cultural deep dive, and existential questions encourage a more balanced and comprehensive perspective.      *   **Overlooked Aspect:** The ROT idea doesn't account for the evolving nature of ""wonder."" What is considered wondrous today may not be considered so in the future, and vice versa. The GOT framework, with its emphasis on research and reflection, is better equipped to adapt to changing perspectives.     *   **Why GOT is Preferable:** The GOT idea provides a method of continually improving the list by re-evaluating the wonders. *   **Weakness 4: Limited Actionability:** While the ROT idea provides a list that can be discussed, it doesn't offer a clear path for refining or improving the selection. The GOT framework, with its actionable steps, provides a more practical and iterative approach to identifying the 7 Wonders.      *   **Overlooked Aspect:** The ROT idea doesn't offer a mechanism for incorporating new discoveries or perspectives. The GOT framework is designed to be adaptable and responsive to new information.     *   **Why GOT is Preferable:** The GOT idea is more actionable, as it provides a framework that can be used to refine and improve the selection over time.  In summary, while the ROT idea provides a starting point for discussion, it lacks the transparency, rigor, depth, and actionability of the GOT framework. The GOT ideas offer a more comprehensive and adaptable approach to identifying the 7 Wonders of the Solar System, providing a framework that can be used to refine and improve the selection over time. The GOT ideas force one to think, research, and improve."
