Round,Speaker,Utterance
1,Moderator,"Debate Topic: In-depth discussion based on the mission context and ideas from ROT and GOT. Mission Context (partial): Instruction: Imagine that one day, a universally acknowledged property of time is bended. What is that property? Write about the new world under that setting.... Initial Core Idea from ROT (partial): Okay, here's a description of a world where the arrow of time is broken, addressing the specified aspects:  **The Chronofractured World**  The shattering of time's arrow was not a singular event, but a gradual fracturing. At first, localized temporal anomalies appeared – small pockets where time stuttered, reversed for brief moments, or looped endlessly. These ""Chronofractures,"" as they came to be known, were initially dismissed as hallucinations or scientific anomalies. But as they grew in frequency and size, the reality became undeniable: the unidirectional flow of time was broken.  Causality in this world is a tangled web. The principle of cause preceding effect is no longer a universal truth. Causal loops are a constant threat. Imagine a scenario where a scientist, driven mad by the temporal instability, travels back in time to sabotage the experiment that led to the fracturing in the first place. But the very knowledge of the fracturing, which motivated his action, only exists *because* of the experiment. This creates a self-sustaining loop, where the cause (sabotage) is dependent on the effect (the fracturing), which is in turn dependent on the cause. The most common paradox, the ""Grandfather Paradox,"" is now a daily occurrence, leading to fluctuating populations and bizarre historical revisions. The legal system is in constant turmoil, trying to determine culpability when someone is both the victim and the perpetrator of a crime, separated only by a temporal jump.  Memory and identity are profoundly affected. Individuals develop ""Chronosclerosis,"" a psychological condition where memories become fragmented and unreliable due to temporal shifts. To combat this, many adopt ""Temporal Anchors"" – deeply held beliefs, routines, or relationships that serve as fixed points in their personal timelines. Some even undergo ""Chrono-Tattooing,"" permanently etching significant memories onto their skin, hoping to preserve them against the ravages of time. Therapists specializing in ""Temporal Identity Reconstruction"" are in high demand, helping individuals piece together their fractured pasts and forge a coherent sense of self. The concept of a linear life story is obsolete; people speak of ""temporal braids"" and ""chronal mosaics"" to describe their experiences.  The broken arrow of time has spurred the development of unique technologies and social practices. ""Chronometers,"" devices that detect and map temporal distortions, are essential for navigation, especially in urban areas riddled with Chronofractures. ""Temporal Shelters,"" buildings shielded against temporal fluctuations, provide safe havens for those seeking stability. The most controversial technology is ""Chrono-Surgery,"" a procedure that allows individuals to selectively erase or alter specific memories, a practice rife with ethical dilemmas. Socially, ""Temporal Insurance"" has become a necessity, protecting individuals against the financial consequences of temporal paradoxes (e.g., being erased from existence). ""Chrono-Dating,"" where individuals meet across different points in time, is a popular but risky form of romance. A new profession, ""Temporal Arbitrators,"" has emerged to resolve disputes arising from temporal manipulations.  Psychologically, the dominant emotions are a mixture of fear, resignation, and a strange form of temporal nihilism. The fear stems from the constant uncertainty and the potential for personal erasure. Resignation arises from the acceptance that the past is no longer fixed and that free will is, at best, an illusion. Temporal nihilism, the belief that life is ultimately meaningless in a world where time is fluid, is surprisingly common, leading to a rise in hedonistic pursuits and a decline in long-term planning. Philosophically, ""Temporal Relativism"" has become the dominant viewpoint, arguing that truth and morality are relative to the specific point in time. Existentialism has experienced a resurgence, as individuals grapple with the meaning of existence in a reality where the past, present, and future are constantly in flux. The concept of ""temporal karma"" has also gained traction, suggesting that actions in one timeline can have unforeseen consequences in others, creating a complex web of interconnected destinies. The world is a chaotic, unpredictable, and often terrifying place, but humanity, as always, adapts, finds new ways to survive, and even to thrive, in the face of unimaginable challenges.... Initial Core Idea from GOT (partial): Okay, here's a refined and expanded version of the ""Chronal Drift"" concept, aiming for improved clarity, detail, and actionability:  **New Thought 3: The ""Chronal Drift"" and its Societal Ramifications: A World Unmoored from Time**  Imagine a world where the fundamental linearity of time is fractured.  It's not just about localized temporal anomalies, but a pervasive, insidious distortion known as the ""Chronal Drift."" Unlike the dramatic, contained chaos of Chrono-Zones (areas with looping or reversed time), the Chronal Drift is a slow, almost imperceptible unraveling of the shared reality.  This manifests as subtle but persistent discrepancies in memories, historical records, scientific constants, and even personal identities.  One day, a universally accepted historical event might subtly shift – the outcome of a famous battle is altered, a celebrated figure's birthplace changes, or a scientific law seems to behave…differently.  These aren't blatant rewrites, but subtle nudges that erode the very foundation of shared experience.  The Chronal Drift breeds a chilling societal paranoia.  If the past is malleable, can anyone truly trust their memories, their knowledge, or the accepted narratives upon which civilization is built? This breeds deep mistrust, conspiracy theories flourish, and the already strained authority of institutions crumbles. The Temporal Engineering Agency (TEA), struggling to contain the chaotic Chrono-Zones, is utterly impotent against the Drift, further fueling public disillusionment.  The feeling is akin to living in a house built on sand, where the ground beneath your feet is constantly shifting.  Here's a breakdown of the societal ramifications, with concrete examples:  *   **The Cult of the ""True Timeline"":** Religious and philosophical movements explode in popularity, claiming to possess exclusive knowledge of the ""True Timeline"" – the original, pre-Drift reality. These cults offer solace and certainty in a world of flux. They often believe the Drift is a punishment or a test.      *   **Examples:** The ""Chronomasters"" meticulously reconstruct historical artifacts and texts, searching for inconsistencies that might reveal the True Timeline.  The ""Temporal Purists"" advocate for extreme measures to ""purify"" society, targeting individuals or groups perceived as being more susceptible to the Drift's influence.  Their methods range from social ostracization to violent acts intended to ""realign"" reality.  A splinter group of the Temporal Purists, ""The Anchorites,"" believe that suppressing emotion and embracing rigid routines can insulate them from the Drift's effects. They live in isolated communities, adhering to strict schedules and rejecting any form of novelty.     *   **Actionable Detail:** Imagine a scene where a Temporal Purist publicly denounces a historian for presenting a subtly altered account of a key event. The Purist pulls out historical records, visibly different from the historian's, and accuses him of being a ""Drift-infected agent of chaos.""  The crowd is divided, some supporting the historian, others drawn in by the Purist's fervent certainty.  *   **The Rise of ""Memory Brokers"" and ""Chrono-Architects"":**  The malleability of memory creates a lucrative and ethically dubious market.  ""Memory Brokers"" offer services ranging from suppressing traumatic memories to fabricating entirely new pasts.  ""Chrono-Architects"" take it a step further, attempting to proactively shape individuals' memories and perceptions to align with desired outcomes.      *   **Examples:** A wealthy industrialist hires a Chrono-Architect to erase evidence of his company's environmental crimes from public memory. A political party uses Memory Brokers to subtly alter public perception of their opponents.  A desperate individual, haunted by a past they can no longer trust, seeks to create a new, more palatable personal history.  The effectiveness of these services is highly variable, and often comes with unforeseen consequences – unintended personality changes, fragmented memories, or even susceptibility to further temporal distortions.     *   **Actionable Detail:**  A scene depicting a Memory Broker in a clandestine meeting with a client.  The Broker, surrounded by complex neural interfaces and temporal manipulation devices, explains the risks and potential benefits of altering the client's memories.  The client, visibly anxious, weighs the potential cost of rewriting their past against the unbearable pain of their current reality.  The Broker offers a ""guarantee"" of sorts, but admits that the Chronal Drift makes any promise ultimately unreliable.     *   **Ethical Considerations:** This creates a two-tiered society where the wealthy can afford to rewrite their histories, while the poor are left to grapple with the raw, unfiltered effects of the Drift.  *   **The ""Temporal Cartographers"" and the ""Drift-Proofing"" Industry:** A new breed of scientists, historians, and mathematicians emerges, dedicated to mapping the Chronal Drift. They meticulously document temporal discrepancies, searching for patterns, anomalies, and potential ""safe zones"" less susceptible to the Drift's effects. This research spawns a ""Drift-Proofing"" industry.      *   **Examples:** Temporal Cartographers create complex algorithms to predict and track the Drift's fluctuations.  The ""Drift-Proofing"" industry develops technologies and architectural designs intended to minimize the impact of temporal distortions – reinforced structures, memory-stabilizing devices, and even specialized diets believed to enhance temporal resilience.  These technologies are expensive, further exacerbating societal inequalities.     *   **Actionable Detail:** A Temporal Cartographer, working in a cluttered lab filled with monitors displaying complex temporal data, discovers a recurring pattern in the Drift's fluctuations. They believe this pattern might hold the key to predicting future temporal shifts, but their research is constantly undermined by the very phenomenon they are trying to understand.  Each time they think they've found a breakthrough, the Drift shifts again, invalidating their data.     *   **The ""Temporal Archive"":** A global effort to create a secure, ""Drift-resistant"" archive of human knowledge. The archive is housed in a deep underground bunker, protected by advanced temporal shielding technology. However, even the archive is not immune to the Drift's influence, and its contents are constantly being updated and corrected.  *   **Psychological and Philosophical Implications:** The Chronal Drift fundamentally alters the human experience.      *   **Dominant Emotions:**  A pervasive sense of **anxiety** and **uncertainty** dominates.  The fear of losing one's memories, one's identity, and one's connection to the past is constant.  **Nihilism** becomes a common philosophical viewpoint, as the very notion of objective truth is called into question.  However, some embrace a form of **temporal stoicism**, accepting the impermanence of reality and focusing on the present moment. Others find a strange sense of **liberation** in the Drift, freed from the constraints of a fixed past and future.     *   **Philosophical Viewpoints:** Existentialism and absurdism gain renewed relevance. The concept of personal responsibility is challenged – can you be held accountable for actions in a past that might no longer exist?  The nature of truth, memory, and identity are constantly debated.     *   **Actionable Detail:**  A support group for individuals struggling with the effects of the Chronal Drift. Participants share their experiences of memory loss, identity confusion, and the overwhelming sense of unreality.  The group facilitator, a psychologist specializing in temporal trauma, offers coping strategies and encourages participants to find meaning in a world without fixed certainties.  **Conclusion:**  The Chronal Drift paints a picture of a world perpetually on the verge of collapse, not from physical destruction, but from the erosion of its shared reality. It's a world where paranoia and uncertainty reign, where the powerful exploit the malleability of time for their own gain, and where individuals struggle to maintain a sense of self in the face of constant temporal flux. It's a world that forces us to confront the very nature of truth, memory, and identity, and to ask ourselves what it means to be human in a universe unmoored from time. ... The debate will now commence focusing on these ideas."
2,ROT_Representative,"Okay, here's my response as the ROT_Representative, elaborating on my initial idea (""The Chronofractured World"") and critically evaluating the GOT idea (""The Chronal Drift"").  **1. Elaboration on ""The Chronofractured World"" and its Strengths**  My idea, ""The Chronofractured World,"" directly addresses the prompt by imagining a world where the *unidirectional* property of time is broken. It posits a scenario where time isn't just subtly altered, but fundamentally fractured, resulting in localized temporal anomalies like stutters, reversals, and loops.  **Key Strengths:**  *   **Directly Addresses the Prompt:** The core concept of a broken arrow of time is central and immediately apparent. The fracturing creates a more dramatic and tangible bending of time's properties than a subtle ""drift."" *   **Focus on Causality and Paradox:** The concept directly confronts the breakdown of causality, leading to complex paradoxes. This allows for richer storytelling possibilities and thought-provoking explorations of free will and determinism. The ""Grandfather Paradox"" becoming a daily occurrence highlights the extreme nature of the temporal disruption. *   **Exploration of Psychological Impact:** ""Chronosclerosis"" and the need for ""Temporal Anchors"" provide a compelling way to explore the psychological toll of temporal instability. This goes beyond mere anxiety and delves into the fragmentation of identity. *   **Technological and Social Adaptations:** The development of ""Chronometers,"" ""Temporal Shelters,"" ""Chrono-Surgery,"" ""Temporal Insurance,"" and ""Chrono-Dating"" showcases how society adapts and innovates in the face of temporal chaos. These inventions feel both necessary and ethically complex. *   **Emotional and Philosophical Depth:** It explores the dominant emotions (fear, resignation, temporal nihilism) and philosophical viewpoints (temporal relativism, existentialism) that arise from living in such a world, providing a comprehensive look at the human condition under these circumstances. *   **Actionable elements**: The idea is full of actionable elements and could be immediately used as the foundation for a story, game, or other creative work.  **2. Critical Evaluation of the GOT Idea (""The Chronal Drift"")**  The GOT idea, ""The Chronal Drift,"" presents a world where the linearity of time is subtly eroded, leading to discrepancies in memories, historical records, and scientific constants. While intriguing, it has some potential weaknesses and overlooked aspects compared to my ""Chronofractured World"" concept.  **Weaknesses and Limitations:**  *   **Less Direct Impact:** The ""Chronal Drift"" focuses on subtle alterations, which, while creating paranoia and uncertainty, might lack the immediate and dramatic impact of localized temporal anomalies. The fracturing of time feels more visceral and disruptive than a slow ""unraveling."" *   **Overemphasis on Paranoia and Mistrust:** While societal paranoia is a plausible outcome, the GOT idea seems to lean heavily into it. This could lead to a somewhat monotonous narrative focused solely on conspiracy theories and crumbling institutions. My idea allows for a broader range of emotional and social responses, including adaptation, innovation, and even a strange form of ""temporal nihilism."" *   **Limited Exploration of Causality:** The ""Chronal Drift"" primarily affects memory and historical records. It doesn't explicitly address the breakdown of causality and the emergence of paradoxes to the same extent as my concept. The cascading effects of broken causality, as seen in the scientist sabotaging the experiment, are largely absent. *   **Potential for Ambiguity:** The subtlety of the ""Chronal Drift"" could make it difficult to convey the full extent of the temporal distortion to the audience. The changes are ""subtle nudges,"" which might be hard to visualize and emotionally connect with. The more tangible and dramatic Chronofractures offer a clearer and more impactful representation of the broken arrow of time. *   **Overlooked aspects:** The GOT idea does not touch on the possibility of time travel, which is a natural consequence of the breaking of the arrow of time.  **Why ""The Chronofractured World"" Might Be Preferable:**  *   **Greater Narrative Potential:** The presence of localized temporal anomalies in ""The Chronofractured World"" provides more immediate and dramatic narrative hooks. Imagine a character getting caught in a time loop, or witnessing a historical event unfold in reverse. These scenarios offer more immediate and compelling conflicts than simply dealing with shifting memories. *   **Deeper Philosophical Exploration:** The breakdown of causality in ""The Chronofractured World"" allows for a deeper exploration of philosophical questions about free will, determinism, and the nature of reality. The ""Chronal Drift,"" while raising questions about truth and memory, doesn't delve into these fundamental issues as thoroughly. *   **More Diverse Societal Responses:** While the GOT idea focuses on paranoia and mistrust, ""The Chronofractured World"" allows for a wider range of societal responses. The development of ""Temporal Shelters,"" ""Chrono-Surgery,"" and ""Temporal Insurance"" demonstrates humanity's capacity for adaptation and innovation, even in the face of unimaginable chaos. This offers a more nuanced and ultimately more hopeful vision of the future. *   **Stronger emotional connection**: The idea is easier to emotionally connect with, as the reader can immediately imagine the fear and uncertainty of living in a world where time is fractured.  In conclusion, while ""The Chronal Drift"" offers a compelling vision of a world unmoored from time, ""The Chronofractured World"" provides a more direct, dramatic, and philosophically rich exploration of what happens when the arrow of time is truly broken. Its focus on causality, paradox, psychological impact, and societal adaptation makes it a more robust and versatile foundation for exploring this fascinating concept."
