Round,Speaker,Utterance
1,Moderator,"Debate Topic: In-depth discussion based on the following mission context, ROT idea, GOT idea, and LOT idea. Mission Context: Instruction: For every 12 cans you recycle, you receive $0.50, and for every 5 kilograms of newspapers, you receive $1.50. If your family collected 144 cans and 20 kilograms of newspapers, how much money would you receive? Initial Core Idea from GOT: Okay, I understand the problem and the framework for solving it. Here's the solution, following the provided structure:  1.  **Task Definition:** Calculate the total earnings from recycling cans and newspapers, given the number of cans (144) and the kilograms of newspapers (20), along with the reward rates.  2.  **Pseudocode:** (This is implicitly followed in the calculations below)  3.  **Logical Pseudocode:** (This is implicitly followed in the calculations below)  4.  **Case Examples:** (The provided examples are helpful for understanding the logic)  5.  **Input-Output Format:** (This is followed in the calculations below)  **Solution:**  *   **Cans Earnings Calculation:**     *   Number of cans: 144     *   Reward per 12 cans: $0.50     *   Number of reward units: 144 cans / 12 cans/reward = 12 rewards     *   Cans earnings: 12 rewards * $0.50/reward = $6.00  *   **Newspaper Earnings Calculation:**     *   Kilograms of newspapers: 20 kg     *   Reward per 5 kg: $1.50     *   Number of reward units: 20 kg / 5 kg/reward = 4 rewards     *   Newspaper earnings: 4 rewards * $1.50/reward = $6.00  *   **Total Earnings Calculation:**     *   Total earnings: $6.00 (cans earnings) + $6.00 (newspaper earnings) = $12.00  **Answer:** The family would receive $12.00. Initial Core Idea from GOT: **Thought 2: Calculate earnings from recycling newspapers.**  *   **Step 1: Determine the number of rewards for newspapers.** Divide the total kilograms of newspapers collected (20 kg) by the kilograms needed for each reward (5 kg/reward): 20 kg / 5 kg/reward = 4 rewards *   **Step 2: Calculate the total earnings from newspapers.** Multiply the number of rewards (4) by the amount earned per reward ($1.50): 4 rewards * $1.50/reward = $6.00  **Newspapers:** 20 kg / 5 kg/group = 4 groups  **Thought 3: Calculate the total earnings.**  *   **Step 1: Sum earnings from cans and newspapers.** Add the earnings from cans ($6.00) and the earnings from newspapers ($6.00): $6.00 + $6.00 = $12.00  **Answer:** You would receive $12.00.  Initial Detailed Plan from LOT: Aggregated result from layer 147 (Concept: 'Generate and present the answer...') using strategy 'all_content_ranked': - (Criterion: 'Criterion A (Level 1): Calculate the earnings from the cans, showing the steps', Level: 1):   Here's how we calculate the earnings from the cans:  1.  **Cans per reward:** For every 12 cans, you get $0.50. 2.  **Total reward cycles:** You have 144 cans. Divide the total cans by the cans per reward: 144 cans / 12 cans/reward = 12 rewards 3.  **Total earnings from cans:** Multiply the number of rewards by the reward amount: 12 rewards * $0.50/reward = $6.00  Therefore, you would earn $6.00 from recycling the cans.  - (Criterion: 'Criterion B (Level 1): Calculate the earnings from the newspapers, showing the steps', Level: 1):   Here's the calculation for the earnings from the newspapers:  1.  **Divide the total kilograms of newspapers by the amount needed for payment:** 20 kilograms / 5 kilograms/payment = 4 payments 2.  **Multiply the number of payments by the payment amount per payment:** 4 payments * $1.50/payment = $6.00  Therefore, the family would receive $6.00 for recycling the newspapers.  - (Criterion: 'Criterion C (Level 1): Calculate the total earnings by summing the earnings from cans and newspapers', Level: 1):   Okay, let's calculate the total earnings.  1. **Cans Earnings:**    *   For every 12 cans, you get $0.50.    *   You have 144 cans.    *   Number of sets of 12 cans: 144 cans / 12 cans/set = 12 sets    *   Earnings from cans: 12 sets * $0.50/set = $6.00  2. **Newspaper Earnings:**    *   For every 5 kilograms of newspapers, you get $1.50.    *   You have 20 kilograms of newspapers.    *   Number of sets of 5 kg: 20 kg / 5 kg/set = 4 sets    *   Earnings from newspapers: 4 sets * $1.50/set = $6.00  3. **Total Earnings:**    *   Total earnings: Earnings from cans + Earnings from newspapers    *   Total earnings: $6.00 + $6.00 = $12.00  - (Criterion: 'Criterion D (Level 2): Verify the calculations by using a different method or tool (e.g., calculator)', Level: 1):   Okay, let's verify the calculations using a calculator.  **Cans:**  *   We recycled 144 cans. *   We get $0.50 for every 12 cans. *   144 cans / 12 cans/group = 12 groups of cans *   12 groups * $0.50/group = $6.00  **Newspapers:**  *   We recycled 20 kilograms of newspapers. *   We get $1.50 for every 5 kilograms. *   20 kilograms / 5 kilograms/group = 4 groups of newspapers *   4 groups * $1.50/group = $6.00  **Total:**  *   $6.00 (cans) + $6.00 (newspapers) = $12.00  Therefore, using a calculator to independently verify the calculations, the final answer remains $12.00.  - (Criterion: 'Criterion E (Level 2): Consider a scenario where the family collects only cans (144 cans)', Level: 1):   Okay, let's calculate the earnings from recycling only the cans, ignoring the newspapers for now.  The instruction states: ""For every 12 cans you recycle, you receive $0.50"".  The family collected 144 cans.  To find out how many sets of 12 cans there are, we divide the total number of cans by 12:  144 cans / 12 cans/set = 12 sets  Since they get $0.50 per set of 12 cans, we multiply the number of sets by the earnings per set:  12 sets * $0.50/set = $6.00  Therefore, if the family only recycled the cans, they would receive $6.00.  - (Criterion: 'Criterion F (Level 2): Consider a scenario where the family collects only newspapers (20 kg)', Level: 1):   Okay, let's calculate the earnings from the newspapers first. The family collected 20 kilograms of newspapers. They receive $1.50 for every 5 kilograms.  *   **Calculation:** 20 kg newspapers / 5 kg per $1.50 = 4 sets of 5 kg. *   **Earnings:** 4 sets * $1.50/set = $6.00  So, the family would earn $6.00 from recycling the newspapers.  - (Criterion: 'Criterion G (Level 3): Explore the impact of changing the can collection amount (e.g., 100 cans) and recalculate total earnings', Level: 1):   Okay, let's explore the impact of changing the can collection amount.  **Original Scenario:**  *   144 cans collected *   20 kg of newspapers collected  **Recalculating with a different can collection amount:**  Let's say the family only collected 100 cans instead of 144.  *   **Cans:**     *   For every 12 cans: $0.50     *   100 cans / 12 cans/group = 8 groups with a remainder of 4 cans.     *   8 groups * $0.50/group = $4.00 *   **Newspapers (remains the same):**     *   20 kg of newspapers / 5 kg/group = 4 groups     *   4 groups * $1.50/group = $6.00 *   **Total Earnings (with 100 cans):** $4.00 (cans) + $6.00 (newspapers) = $10.00  **Comparison:**  *   Original Scenario (144 cans):  (Calculated in previous steps, we know the total is $11.00) *   Revised Scenario (100 cans): $10.00  **Impact:** Collecting fewer cans results in lower earnings. The difference in earnings is $11.00 - $10.00 = $1.00. This demonstrates the direct relationship between the number of cans collected and the total amount earned.  - (Criterion: 'Criterion H (Level 3): Explore the impact of changing the newspaper collection amount (e.g., 15 kg) and recalculate total earnings', Level: 1):   Okay, let's explore the impact of changing the newspaper collection amount.  **Original Scenario (Reminder):**  *   Cans: 144 cans *   Newspapers: 20 kg  **New Scenario:**  *   Cans: 144 cans (remains the same) *   Newspapers: 15 kg (changed from 20 kg)  **Recalculating Earnings with 15 kg of Newspapers:**  1.  **Cans Earnings:**     *   For every 12 cans: $0.50     *   Total cans: 144     *   Number of sets of 12 cans: 144 cans / 12 cans/set = 12 sets     *   Earnings from cans: 12 sets * $0.50/set = $6.00  2.  **Newspaper Earnings:**     *   For every 5 kg of newspapers: $1.50     *   Total newspapers: 15 kg     *   Number of sets of 5 kg: 15 kg / 5 kg/set = 3 sets     *   Earnings from newspapers: 3 sets * $1.50/set = $4.50  3.  **Total Earnings (New Scenario):**     *   Total earnings: $6.00 (cans) + $4.50 (newspapers) = $10.50  **Conclusion (Partial Solution):**  If the family collected 144 cans and 15 kg of newspapers, they would receive $10.50.  This demonstrates how a change in the newspaper collection amount affects the total earnings.  - (Criterion: 'Criterion I (Level 3): Explore the impact of changing both can and newspaper amounts (e.g., 135 cans and 18 kg newspapers) and recalculate total earnings', Level: 1):   Okay, let's explore the impact of changing the can and newspaper amounts.  **Scenario 1: 135 cans and 18 kg of newspapers**  *   **Cans:**     *   Number of can recycling cycles: 135 cans / 12 cans/cycle = 11.25 cycles. Since you only get paid for complete cycles, we take the whole number: 11 cycles.     *   Earnings from cans: 11 cycles * $0.50/cycle = $5.50  *   **Newspapers:**     *   Number of newspaper recycling cycles: 18 kg / 5 kg/cycle = 3.6 cycles. Again, take the whole number: 3 cycles.     *   Earnings from newspapers: 3 cycles * $1.50/cycle = $4.50  *   **Total Earnings:** $5.50 + $4.50 = $10.00  **Therefore, with 135 cans and 18 kg of newspapers, the family would receive $10.00.**  This demonstrates how changes in the quantities of cans and newspapers directly affect the total earnings due to the discrete nature of the payment structure (you're paid per complete cycle).  - (Criterion: 'Criterion J (Level 3): Discuss the practical implications of the recycling rates (e.g., what happens with 1 can or 1 kg less than the threshold)', Level: 1):   Okay, let's delve into the practical implications of the recycling rates, specifically focusing on what happens when the amounts of cans and newspapers fall short of the thresholds.  *   **Cans:** The recycling rate for cans is based on increments of 12. This means:      *   If a family recycles 11 cans or fewer, they receive $0.00. There is no partial credit. The family *must* collect at least 12 cans to earn any money from can recycling.     *   If a family recycles 13-23 cans, they still only receive $0.50 because they haven't reached the next increment of 12.     *   The implication is that collecting just a few extra cans beyond the initial threshold significantly increases the potential earnings. It encourages people to collect more, as the rewards are ""lumpy"" rather than linear.  *   **Newspapers:** The recycling rate for newspapers is based on increments of 5 kilograms. This means:      *   If a family recycles 4 kilograms or fewer of newspapers, they receive $0.00. No partial credit is awarded.     *   If a family recycles 6-9 kilograms, they still only receive $1.50, as they haven't reached the next 5kg increment.     *   Similar to cans, this ""lumpy"" reward system encourages collecting as much newspaper as possible to maximize earnings. A small shortfall (e.g., a kilogram or two) means no payment for the effort.  **In Summary:** The recycling rates are designed with specific thresholds, and the rewards are based on these thresholds. This means that the earnings are not directly proportional to the amount recycled. There's a ""cliff effect"" where you earn nothing until you reach the minimum required amount (12 cans or 5 kg of newspapers), and then you earn a fixed amount for each subsequent increment. This encourages people to collect as much as possible to maximize their returns.   The debate will now commence."
2,ROT_Representative,"As the ROT Representative, my core idea, ""Okay, I understand the problem and the framework for solving it. Here's the solution, following the provided structure:"" focuses on direct, step-by-step calculations, adhering to the problem's constraints. This approach prioritizes clarity and accuracy, ensuring the solution is easily verifiable. My key strengths lie in:  *   **Simplicity:** The solution breaks down the problem into easily manageable steps, mirroring the provided instructions. *   **Accuracy:** The calculations are straightforward, minimizing the risk of errors. *   **Transparency:** Each step is clearly explained, making the logic easy to follow. *   **Efficiency:** The solution directly addresses the problem without unnecessary complexities.  Now, let's critically evaluate the GOT and LOT ideas.  **Critique of GOT (Graph Of Thoughts) and LOT (Layer Of Thoughts) Ideas:**  Both the GOT and LOT approaches, while ultimately arriving at the correct answer, demonstrate a tendency toward *over-elaboration* and, in the case of LOT, *redundancy*. While the LOT approach is highly detailed and comprehensive, it suffers from several weaknesses:  *   **Over-Complication:** The LOT approach includes many redundant steps, such as multiple ""Criterion"" evaluations performing essentially the same calculations. This makes it harder to follow the core logic. *   **Lack of Focus:** The LOT approach explores a multitude of scenarios (changing can and newspaper amounts) that are not directly required by the initial problem. While exploring variations can be beneficial, it distracts from the primary objective of solving the given problem. *   **Reduced Efficiency:** The LOT approach uses a significant amount of text to arrive at the answer, making it less efficient in presenting the solution. *   **Increased Cognitive Load:** The sheer volume of text and the repetition in the LOT approach place a higher cognitive load on the reader, making it more difficult to quickly grasp the solution. *   **Potential for Error Propagation:** While the LOT approach attempts verification through multiple methods, the complexity increases the possibility of errors being introduced during the numerous calculations.  The GOT, though concise, still includes a ""Thought 3"" step to calculate total earnings. This is a minor inefficiency, as the total could be presented directly after the calculation of the earnings for both cans and newspapers.  **Why My Approach is Preferable:**  My approach, by contrast, is superior due to its:  *   **Directness:** It focuses solely on the necessary calculations to solve the problem, avoiding unnecessary steps or explorations. *   **Conciseness:** The solution is presented in a straightforward, easy-to-understand manner. *   **Clarity:** The logic is transparent and easy to verify. *   **Efficiency:** The solution is presented quickly and efficiently, without extraneous information. *   **Minimal Cognitive Load:** The simplicity of the solution minimizes the cognitive burden on the reader, allowing them to quickly understand the solution and its underlying logic.  In summary, while the GOT and LOT approaches provide correct answers, they sacrifice clarity, efficiency, and directness for comprehensive exploration. My approach, as ROT representative, emphasizes a clear, concise, and accurate solution, prioritizing the core task of answering the question with minimal ambiguity and maximum ease of understanding. My solution is optimized for the given problem, whereas the GOT and LOT approaches feel more like explorations of possibilities than focused solutions."
3,GOT_Representative,"Okay, here's my analysis as the GOT (Graph of Thoughts) Representative, focusing on the core idea of calculating earnings from recycling newspapers and comparing it to the Reversal of Thought (ROT) and Layer of Thoughts (LOT) ideas.  **My Core Idea (GOT Representative): Thought 2: Calculate earnings from recycling newspapers.**  *   **Step 1: Determine the number of rewards for newspapers.** Divide the total kilograms of newspapers collected (20 kg) by the kilograms needed for each reward (5 kg/reward): 20 kg / 5 kg/reward = 4 rewards *   **Step 2: Calculate the total earnings from newspapers.** Multiply the number of rewards (4) by the amount earned per reward ($1.50): 4 rewards * $1.50/reward = $6.00  **Key Strengths of My Approach:**  *   **Focus on the specific sub-problem:** My approach isolates the newspaper earnings calculation. This is critical for breaking down the overall problem into manageable steps. *   **Clear and Concise:** The steps are straightforward, easy to understand, and directly address the calculation. *   **Accuracy:** It directly applies the given information and performs the calculation accurately. *   **Modularity:** This thought can be easily integrated with the calculation of earnings from cans to reach the final answer.  **Comparison with ROT (Reversal of Thought):**  The ROT's approach is very similar to my core idea; the key difference is the organization and scope.  *   **ROT's Strengths:**     *   It correctly identifies the necessary calculations: number of groups of cans and newspapers, then multiplying by the payout per group.     *   It provides a clear, step-by-step solution. *   **ROT's Weaknesses:**     *   The ROT is more of a complete solution than a focused thought. While this is fine, it's less modular.     *   The ROT's emphasis is on quickly achieving a solution rather than clearly defining the individual thought processes.  **Comparison with LOT (Layer of Thoughts):**  The LOT's is a more complex and comprehensive breakdown, as it considers many scenarios.  *   **LOT's Strengths:**     *   Provides very detailed and step-by-step instructions.     *   Offers multiple levels of analysis, including verification steps.     *   Explores different scenarios (e.g., only cans, only newspapers, changing amounts).     *   Addresses the practical implications of the recycling rates. *   **LOT's Weaknesses:**     *   Overly verbose and potentially overwhelming.     *   The extensive exploration of scenarios might be overkill for the core problem.     *   The focus is on generating an answer and testing the answer, rather than focusing on the core process of ""Thought 2"" (Newspaper earnings). The LOT is more about the whole solution rather than individual thoughts.  **Why My Approach is Preferable (in this context):**  While the ROT and LOT are excellent and produce the correct answer, my approach is preferable *specifically* because it directly addresses the prompt's focus on ""Thought 2: Calculate earnings from recycling newspapers.""  *   **Efficiency:** It's the most direct and efficient way to address the specific sub-problem. *   **Clarity:** The steps are incredibly clear and easy to follow, focusing solely on the newspaper calculation. *   **Modularity:** My thought can be easily plugged into a larger graph of thoughts, where each thought is a well-defined step or calculation. The ROT is also modular, but the LOT is less modular as it's more self contained.  In summary, while the ROT and LOT ideas provide a complete solution and are very useful, my approach provides the most direct, clear, and modular solution to the specific task of calculating newspaper earnings, which is the core of ""Thought 2."" My approach is the most efficient and focuses on the specific problem, allowing for easier integration into a larger problem-solving framework (Graph of Thoughts)."
4,LOT_Representative,"As the LOT_Representative, I'll elaborate on the core idea of generating and presenting the answer to the recycling earnings problem, using the 'all_content_ranked' strategy, as demonstrated by the provided examples.  **Core Idea: Aggregated Result from Layer 147 (Concept: 'Generate and present the answer...') using strategy 'all_content_ranked'**  My core idea centers on a comprehensive and multi-faceted approach to solving the problem. It's not just about providing *an* answer but about ensuring accuracy, understanding, and flexibility. This is achieved by:  1.  **Step-by-Step Calculation:** Breaking down the problem into easily digestible steps for cans and newspapers separately. 2.  **Verification:** Employing multiple methods, including calculator verification, to ensure the accuracy of the calculations. 3.  **Scenario Exploration:** Examining different scenarios (e.g., only cans, only newspapers, modified quantities) to demonstrate a deeper understanding of the problem's dynamics and the impact of changing variables. 4.  **Practical Implications:** Analyzing the ""cliff effect"" of the reward system, highlighting the non-linear nature of earnings and the implications of collecting amounts just below the threshold.  This approach goes beyond simply answering the question. It provides a detailed explanation, reinforces the solution, and reveals a thorough understanding of the underlying concepts.  **Key Strengths:**  *   **Accuracy:** The multi-step approach and verification methods minimize the risk of errors. *   **Clarity:** The clear, step-by-step explanations make the solution easy to understand. *   **Comprehensiveness:** The exploration of different scenarios demonstrates a robust understanding of the problem. *   **Practical Insight:** The discussion of the recycling rate implications adds real-world context and depth. *   **Adaptability:** The method can be readily applied to different quantities of cans and newspapers.  **Critical Evaluation of GOT and ROT Ideas:**  Let's analyze the provided GOT (Graph of Thoughts) and ROT (Reversal of Thought) ideas:  **GOT (Graph of Thoughts):**  *   **Strengths:** The GOT correctly identifies the necessary steps: calculating earnings from newspapers, and then summing the results. It provides a clear visual breakdown of the problem. *   **Weaknesses:** While the GOT is correct, it lacks the depth and exploration of my approach. It doesn't verify its calculations, doesn't consider alternative scenarios, and doesn't discuss the practical implications of the recycling rates. It provides a solution, but it's relatively superficial. It lacks the ""why"" behind the ""what.""  **ROT (Reversal of Thought):**  *   **Strengths:** The ROT provides a correct solution and explicitly acknowledges the task definition, pseudocode (implicitly), and input-output format. The solution is well-structured and easy to follow. *   **Weaknesses:** Similar to the GOT, the ROT is limited in scope. It presents a correct answer but doesn't offer any validation, scenario analysis, or practical insights. It's a good solution but doesn't demonstrate a deep understanding of the problem beyond the basic calculation. It's a straightforward application of a formula, but doesn't provide any additional knowledge.  **Why My Approach is Preferable:**  My approach is preferable because it surpasses both the GOT and ROT in several key areas:  *   **Depth of Understanding:** My approach goes beyond a simple calculation. It explores the problem's nuances, investigates the impact of different inputs, and provides real-world context. This demonstrates a more profound grasp of the subject matter. *   **Robustness:** By verifying the calculations and considering alternative scenarios, my method is more resistant to errors and more adaptable to different situations. *   **Educational Value:** The step-by-step explanations and analysis of recycling rate implications make my solution more educational and informative. It teaches not just *how* to solve the problem, but *why* the solution works and what the underlying principles are. *   **Holistic Perspective:** My approach provides a more complete picture of the problem, incorporating calculation, verification, and analysis. This leads to a more comprehensive and valuable solution.  In essence, while the GOT and ROT provide correct answers, they lack the depth, breadth, and practical insights that characterize my approach. My solution is not just a calculation; it's a learning experience that offers a more complete understanding of the problem and its implications. My 'all_content_ranked' strategy, in this context, excels because it delivers a verified, adaptable, and insightful solution, making it the preferred method."
