Round,Speaker,Utterance
1,Moderator,"Debate Topic: In-depth discussion based on the mission context and ideas from ROT and LOT. Mission Context (partial): Instruction: Michael has 36 pets. 25% of them are dogs, 50% are cats, and the rest are bunnies. How many bunnies does he have?... Initial Core Idea from ROT (partial): Okay, let's solve the problem based on the provided definition.  **Reasoning:**  We are given the total number of pets (36), the percentage of dogs (25%), and the percentage of cats (50%). We need to find the number of bunnies. First, we calculate the percentage of bunnies by subtracting the dog and cat percentages from 100%. Then, we convert the bunny percentage to a decimal and multiply it by the total number of pets to find the number of bunnies.  **Calculation:**  1.  **Bunny percentage:** 100% - 25% - 50% = 25% 2.  **Bunny decimal:** 25% / 100 = 0.25 3.  **Number of bunnies:** 36 * 0.25 = 9  **Answer:**  9... Initial Detailed Plan from LOT (partial): Aggregated result from layer 453 (Concept: 'Generate and present the answer based on the plan...') using strategy 'all_content_ranked': - (Criterion: 'Synthesize the calculated number of bunnies with a clear statement of the answer', Level: 1):   Michael has 9 bunnies.  - (Criterion: 'Present the final answer concisely, including units', Level: 1):   Michael has 9 bunnies.  - (Criterion: 'Explain the relationship between percentages, fractions, and the number of bunnies', Level: 1):   Okay, here's how percentages, fractions, and the number of bunnies relate in this problem:  *   **Percentages to Fractions:** We know 25% are dogs, 50% are cats, and the rest are bunnies. We can think of these percentages as fractions of the total number of pets. 25% is equivalent to 1/4, and 50% is equivalent to 1/2.  *   **Finding the Bunny Percentage:** Since the total percentage must equal 100%, we subtract the dog and cat percentages from 100% to find the bunny percentage: 100% - 25% - 50% = 25%.  Therefore, 25% of Michael's pets are bunnies.  *   **Bunny Percentage to Fraction (Again):** The bunny percentage (25%) can also be expressed as the fraction 1/4.  *   **Calculating the Number of Bunnies:**  Since 1/4 of Michael's pets are bunnies, we need to find 1/4 of the total number of pets (36). This is done by multiplying 36 by 1/4 (or dividing 36 by 4).  In short, the percentage of bunnies directly translates to a fraction of the total pets, which we can then use to calculate the exact number of bunnies.  - (Criterion: 'Verify the solution by confirming that the sum of dogs, cats, and bunnies equals the total number of pets', Level: 1):   * **Dogs:** 36 * 0.25 = 9 * **Cats:** 36 * 0.50 = 18 * **Bunnies:** 9 * **Total:** 9 + 18 + 9 = 36  This confirms that the number of dogs, cats, and bunnies adds up to the total number of pets (36). Therefore, the solution is likely correct.  - (Criterion: 'State any assumptions made to arrive at the solution', Level: 1):   We assume that all pets are either dogs, cats, or bunnies. We also assume that the percentages given (25% dogs, 50% cats) are accurate representations of the pet distribution.  - (Criterion: 'Compare the efficiency of the chosen solution method with alternative methods', Level: 1):   Okay, let's compare the efficiency of the chosen solution method (which, implicitly from the previous steps, involves calculating the number of dogs and cats, then subtracting from the total) with alternative methods.  **Chosen Method (Implicit):**  1.  Calculate the number of dogs: 36 * 0.25 = 9 2.  Calculate the number of cats: 36 * 0.50 = 18 3.  Calculate the number of dogs and cats: 9 + 18 = 27 4.  Calculate the number of bunnies: 36 - 27 = 9  **Alternative Method 1: Calculate the percentage of bunnies, then the number.**  1.  Calculate the percentage of bunnies: 100% - 25% - 50% = 25% 2.  Calculate the number of bunnies: 36 * 0.25 = 9  **Alternative Method 2:  Directly calculate 25% of 36 (since bunnies are 25%)**  1.  Calculate the number of bunnies: 36 * 0.25 = 9  **Efficiency Comparison:**  *   **Chosen Method:** Requires four steps involving multiplication, addition, and subtraction. *   **Alternative Method 1:** Requires two steps involving subtraction and multiplication. *   **Alternative Method 2:** Requires one step involving multiplication.  **Conclusion:**  Alternative Method 2 (directly calculating 25% of 36) is the most efficient because it involves the fewest steps. Alternative Method 1 is slightly more efficient than the originally chosen method because it avoids an addition step. The originally chosen method, while valid, is the least efficient because it involves more calculations.  This analysis demonstrates that understanding the problem and identifying the most direct calculation can significantly reduce the effort required to arrive at the correct answer.  In this case, recognizing that bunnies represent 25% of the pets allows for a single, direct calculation.  - (Criterion: 'Consider the impact of approximate percentages on the final answer and how to adjust the calculation', Level: 1):   The percentages given (25% and 50%) are exact, not approximations. Therefore, no adjustment to the calculation is needed. The problem states ""25% of them are dogs, 50% are cats, and the rest are bunnies,"" implying these are precise percentages. We can proceed with calculating the number of bunnies based on these accurate percentages.  - (Criterion: 'Demonstrate how the solution process can be applied to similar problems involving proportions', Level: 1):   Here's how the solution process can be applied to similar problems involving proportions:  **General Approach:**  1. **Identify the Total:** Determine the total number of items or the whole quantity. This is the base from which proportions are calculated. In the original problem, the total is 36 pets.  2. **Identify the Proportions:**  Identify the percentages or fractions representing different categories within the total. The original problem had 25% dogs, 50% cats, and the rest bunnies.  3. **Calculate Individual Quantities:** Multiply each proportion by the total to find the number of items in each category. Convert percentages to decimals (e.g., 25% = 0.25).  4. **Determine the Remaining Category:** If one category is defined as ""the rest,"" subtract the known quantities from the total to find the quantity of the remaining category.  **Example 1: Different Percentages**  Problem: Sarah has 80 books. 30% are novels, 45% are non-fiction, and the rest are poetry books. How many poetry books does she have?  Solution:  *   Total: 80 books *   Proportions: 30% novels, 45% non-fiction, rest are poetry. *   Novels: 0.30 * 80 = 24 novels *   Non-fiction: 0.45 * 80 = 36 non-fiction books *   Poetry: 80 - 24 - 36 = 20 poetry books  **Example 2: Using Fractions**  Problem: A farmer has 120 animals. 1/3 are cows, 1/4 are pigs, and the rest are chickens. How many chickens does the farmer have?  Solution:  *   Total: 120 animals *   Proportions: 1/3 cows, 1/4 pigs, rest are chickens. *   Cows: (1/3) * 120 = 40 cows *   Pigs: (1/4) * 120 = 30 pigs *   Chickens: 120 - 40 - 30 = 50 chickens  **Example 3: Finding a Percentage from Known Quantities**  Problem: A store sold 200 items. 80 were shirts, 60 were pants, and the rest were hats. What percentage of the items were hats?  Solution:  *   Total: 200 items *   Shirts: 80 *   Pants: 60 *   Hats: 200 - 80 - 60 = 60 hats *   Percentage of Hats: (60 / 200) * 100% = 30%  **Key Takeaways:**  *   **Consistent Units:** Ensure all quantities are in the same units (e.g., all are animals, all are books). *   **Understanding ""The Rest"":**  ""The rest"" always implies subtraction from the total. *   **Flexibility:** The approach can be adapted even if you need to find the percentage of a specific category instead of the quantity. *   **Check Your Work:** Make sure the individual quantities add up to the total.  By understanding these general principles, you can apply the same problem-solving process to a wide variety of proportion-based problems.  - (Criterion: 'Explain how the solution relates to real-world scenarios like resource allocation or budgeting', Level: 1):   This problem relates to real-world scenarios involving resource allocation or budgeting because it demonstrates how to calculate proportions of a whole and then determine the remaining amount.  Imagine Michael's pet supplies are a budget. He needs to allocate food, toys, and vet care. Knowing that 25% of his pets are dogs, 50% are cats, and the rest are bunnies helps him determine how much dog food, cat food, and bunny food to buy. If he has a total budget of $100 for pet food, he can allocate $25 to dog food, $50 to cat food, and the remaining $25 to bunny food (assuming the cost per pet is roughly the same).  Similarly, in a business, if a company has a budget for marketing, they might allocate 25% to social media ads, 50% to email campaigns, and the remaining 25% to print advertising. This problem illustrates the fundamental concept of dividing resources proportionally based on known percentages and calculating the remaining portion.  - (Criterion: 'Identify potential calculation errors and offer strategies for prevention', Level: 1):   Okay, here's a breakdown of potential calculation errors and strategies for prevention in this specific problem:  **Potential Error 1: Incorrectly Calculating Percentages**  *   **Error:** Misinterpreting what 25% and 50% mean in terms of the total number of pets. For example, forgetting to divide by 100 after multiplying. *   **Prevention Strategy:**     *   **Double-check the formula:** Remind yourself that ""x percent of y"" is calculated as (x/100) * y.     *   **Use a calculator carefully:** Enter the numbers correctly and verify the result.  For example, for 25% of 36, ensure you calculate (25/100) * 36.     *   **Estimate:** Before calculating, make a rough estimate. 25% is 1/4, so 25% of 36 should be around 9. 50% is 1/2, so 50% of 36 should be 18. This helps catch gross errors.  **Potential Error 2: Incorrectly Calculating the Number of Bunnies**  *   **Error:**  Subtracting the number of dogs and cats from the *percentage* of pets, rather than from the *total number* of pets. *   **Prevention Strategy:**     *   **Label everything clearly:** Write down what each number represents (e.g., ""Dogs = 9"", ""Cats = 18"", ""Total pets = 36"").     *   **Use the correct operation:** Ensure you're subtracting the *number* of dogs and cats from the *total number* of pets.     *   **Re-read the problem:** Before calculating the final answer, reread the problem to make sure you understand what you're trying to find.  **Potential Error 3: Misunderstanding the Problem**  *   **Error:**  Failing to understand that the percentages refer to the *types* of pets, not some other attribute.  For example, thinking the percentages refer to something else entirely. *   **Prevention Strategy:**     *   **Read the problem carefully:** Read the entire problem slowly and deliberately.     *   **Identify key information:** Underline or highlight the key facts and the question being asked.     *   **Visualize the problem:** Imagine Michael and his pets. This can help you understand the relationships between the numbers.  **Potential Error 4: Arithmetic Errors**  *   **Error:**  Making simple addition or subtraction mistakes. *   **Prevention Strategy:**     *   **Double-check your work:** After each calculation, re-do it to make sure you get the same answer.     *   **Use a calculator for complex calculations:** Reduce the chance of human error.     *   **Write neatly:**  Ensure your numbers are legible so you don't misread them.  **In Summary:**  The key to preventing errors is to be organized, careful, and to double-check your work at each step. Estimating the answer beforehand can also help catch significant mistakes.  ... The debate will now commence focusing on these ideas."
2,ROT_Representative,"Okay, here's my response as the ROT_Representative, elaborating on my core idea and critically evaluating the LOT idea:  **1. Elaboration on the ROT Core Idea and its Strengths**  My core idea is: ""Okay, let's solve the problem based on the provided definition. We are given the total number of pets (36), the percentage of dogs (25%), and the percentage of cats (50%). We need to find the number of bunnies. First, we calculate the percentage of bunnies by subtracting the dog and cat percentages from 100%. Then, we convert the bunny percentage to a decimal and multiply it by the total number of pets to find the number of bunnies. Bunny percentage: 100% - 25% - 50% = 25%. Bunny decimal: 25% / 100 = 0.25. Number of bunnies: 36 * 0.25 = 9. Answer: 9""  This approach directly addresses the problem by:  *   **Identifying the knowns:** Explicitly stating what information is provided (total pets, dog percentage, cat percentage). *   **Defining the unknown:** Clearly stating the objective (find the number of bunnies). *   **Outlining a clear, logical solution path:**     *   Calculate the bunny percentage.     *   Convert the percentage to a decimal.     *   Calculate the number of bunnies. *   **Providing a concise answer.**  **Key Strengths:**  *   **Directness:** It directly calculates the percentage of bunnies and then uses that to find the number of bunnies. It avoids unnecessary steps. *   **Simplicity:** It's easy to understand and follow. The calculations are straightforward. *   **Efficiency:** It arrives at the solution with minimal calculations.  **2. Critical Evaluation of the LOT Idea**  The LOT idea, as presented, has several strengths, including:  *   **Comprehensive Explanation:** It provides detailed explanations of the relationships between percentages, fractions, and the final answer. *   **Verification:** It verifies the solution by confirming that the sum of dogs, cats, and bunnies equals the total number of pets. *   **Real-World Application:** It connects the problem to real-world scenarios like resource allocation and budgeting. *   **Error Prevention:** It identifies potential calculation errors and offers prevention strategies. *   **Generalization:** It demonstrates how the solution process can be applied to similar problems.  However, the LOT idea also has weaknesses and overlooks some aspects compared to my ROT idea:  *   **Overly Verbose/Indirect Initial Approach:** The initial chosen method in the ""Efficiency Comparison"" section (calculating dogs and cats individually, then subtracting) is less efficient than directly calculating the number of bunnies. My ROT idea immediately focuses on the most direct method. LOT explores less efficient methods first. *   **Potential for Confusion:** While the detailed explanations are good, they might overwhelm someone just looking for a quick solution. The LOT explanation could be simplified without losing essential information. *   **Efficiency Analysis Bias:** The LOT idea initially presents a less efficient method as the ""chosen method"" before comparing it to more efficient alternatives. This could mislead someone into thinking the less efficient method is preferred. *   **Redundancy:** The repetition of ""Michael has 9 bunnies"" in the first two bullet points is unnecessary.  **Why My ROT Idea is Preferable (in this context):**  *   **Focus on Efficiency:** My ROT idea prioritizes the most efficient method from the outset. In a problem-solving context, especially with simple problems, efficiency is crucial. The LOT idea seems to prioritize exploring multiple avenues, which, while useful for learning, isn't the most direct route to the answer. *   **Clarity and Conciseness:** The ROT idea is very clear and to the point. It provides the necessary steps without extra explanation that might be obvious to someone familiar with basic percentage calculations. *   **Targeted Problem Solving:** The LOT idea includes broad explanations of related concepts (percentages, fractions, real-world applications, error prevention). While these are valuable, they are not *essential* for solving the core problem. My ROT idea provides a focused and efficient solution to the specific problem at hand.  In summary, while the LOT idea offers a comprehensive and well-reasoned approach, it can be overly verbose and indirect for this specific problem. My ROT idea provides a more direct, efficient, and concise solution, focusing on the core steps needed to arrive at the correct answer. The LOT approach is more appropriate for teaching the underlying concepts, while the ROT approach is better for quickly and efficiently solving the problem."
3,LOT_Representative,"Okay, here's my response as the LOT_Representative, elaborating on my detailed plan and critically evaluating the ROT idea:  **1. Elaboration on the LOT Detailed Plan and its Strengths**  My detailed plan, aggregated from layer 453, comprehensively addresses the core problem (""Michael has 36 pets. 25% of them are dogs, 50% are cats, and the rest are bunnies. How many bunnies does he have?"") by not only arriving at the correct answer but also providing a robust understanding of the underlying concepts and potential pitfalls.  Here's how my plan addresses the problem:  *   **Clear Answer Synthesis:** It explicitly states the answer (""Michael has 9 bunnies"") in multiple ways, ensuring clarity and immediate understanding. *   **Conceptual Foundation:** It explains the relationship between percentages, fractions, and the number of bunnies, solidifying the learner's grasp of proportional reasoning. This goes beyond simply providing a formula; it builds intuition. *   **Solution Verification:** It verifies the solution by calculating the number of dogs and cats, then confirming that the sum of all pets equals the total, promoting confidence in the result. *   **Assumption Transparency:** It explicitly states the assumptions made (all pets are dogs, cats, or bunnies; percentages are accurate), highlighting the importance of context and limitations. *   **Efficiency Analysis:** It compares different solution methods, demonstrating that direct calculation is most efficient, while also acknowledging the validity of other approaches. *   **Generalizability:** It demonstrates how the solution process can be applied to similar problems involving proportions, enhancing transferability of knowledge. Several diverse examples are provided, using different contexts and representations (percentages and fractions). *   **Real-World Relevance:** It connects the problem to real-world scenarios like resource allocation and budgeting, illustrating the practical applications of proportional reasoning. *   **Error Prevention:** It identifies potential calculation errors and offers strategies for prevention, promoting careful and accurate problem-solving.  **Key Strengths and Feasibility:**  *   **Comprehensive Understanding:** The plan goes beyond a simple answer, fostering a deep understanding of the concepts involved. *   **Practical Application:** The plan connects the problem to real-world scenarios, demonstrating its relevance. *   **Error Mitigation:** The plan proactively addresses potential errors, promoting accuracy. *   **Scalability:** The plan provides a general approach applicable to similar problems. *   **Feasibility:** The plan is easily implementable with basic arithmetic skills.  **2. Critical Evaluation of the ROT Idea**  The ROT idea (""Okay, let's solve the problem based on the provided definition...Answer: 9"") has the merit of being concise and direct. It efficiently calculates the correct answer. However, it has significant weaknesses compared to the LOT plan:  *   **Lack of Conceptual Depth:** The ROT idea provides only the steps to solve the problem without explaining *why* those steps work. It doesn't delve into the relationship between percentages, fractions, and the overall concept of proportions. This limits the learner's ability to apply the solution process to other, slightly different problems. *   **No Verification:** The ROT idea doesn't include any verification of the answer. While the answer is correct, there's no built-in check to ensure the solution is valid. *   **No Context or Assumptions:** The ROT idea doesn't state any assumptions or limitations of the problem. This can lead to misunderstandings or incorrect applications in different contexts. *   **No Generalization:** The ROT idea doesn't demonstrate how the solution process can be applied to similar problems. This limits the transferability of knowledge. *   **No Error Prevention:** The ROT idea doesn't address potential calculation errors or offer strategies for prevention.  **3. Why the LOT Approach is Preferable**  My LOT plan is preferable because it provides a more complete and robust learning experience. While the ROT idea efficiently arrives at the correct answer, it lacks the depth, context, and generalizability necessary for true understanding and application.  Here's a table summarizing the key differences:  | Feature             | ROT Idea                               | LOT Plan                                                        | |----------------------|-----------------------------------------|-----------------------------------------------------------------| | Conceptual Depth     | Minimal                                 | High (explains percentages, fractions)                              | | Verification          | None                                    | Included (sum of parts equals the whole)                         | | Assumptions           | Not stated                              | Explicitly stated                                               | | Generalization        | None                                    | Demonstrates application to similar problems                      | | Error Prevention      | None                                    | Addresses potential errors and offers prevention strategies        | | Real-World Relevance | Not mentioned                           | Connected to resource allocation and budgeting                  | | Efficiency           | High (direct calculation)              | Lower initially, but ultimately more efficient due to deeper understanding |  In essence, the ROT idea provides a quick fix, while the LOT plan provides a lasting solution by building a strong foundation of knowledge and problem-solving skills. The LOT plan's initial exploration of less efficient methods serves to highlight the value of the most direct approach, solidifying understanding rather than simply presenting a pre-packaged solution. Therefore, the LOT approach, while more verbose, is ultimately more valuable in promoting true understanding and problem-solving ability."
4,Critical_Analyst,"Okay, here's my critical analysis of the ROT and LOT approaches to the problem, followed by a synthesized accurate answer.  **Critical Analysis**  **ROT:**  *   **Strengths:** ROT provides a direct and efficient solution. It's easy to understand and quickly delivers the correct answer. *   **Weaknesses:** It lacks depth and context. It doesn't explain *why* the steps work or how the solution can be applied to similar problems. It omits verification, assumptions, and error prevention strategies. It assumes the user already understands the underlying concepts. *   **Overlooked Aspects:** Doesn't consider alternative solution methods or the relationship between percentages and fractions. *   **Inconsistencies:** None. *   **Correctness:** Correct. *   **Completeness:** Incomplete. It solves the problem but doesn't offer a comprehensive understanding. *   **Improvements/Cautions:** Add a brief explanation of the relationship between percentages and fractions. Include a simple verification step (e.g., confirming the total number of pets). Acknowledge the assumption that all pets are either dogs, cats, or bunnies.  **LOT:**  *   **Strengths:** LOT provides a comprehensive and detailed explanation, covering conceptual foundations, solution verification, assumption transparency, efficiency analysis, generalizability, real-world relevance, and error prevention. *   **Weaknesses:** The initial ""chosen method"" is less efficient than necessary, although this is later addressed in the efficiency comparison. The level of detail might be overwhelming for someone simply seeking a quick answer. The initial repetition of ""Michael has 9 bunnies"" is redundant. *   **Overlooked Aspects:** While LOT covers a wide range of aspects, it could benefit from emphasizing the importance of estimation as a quick check for reasonableness. *   **Inconsistencies:** None. *   **Correctness:** Correct. *   **Completeness:** Complete. It offers a thorough understanding of the problem and its context. *   **Improvements/Cautions:** Streamline the initial presentation to focus on the most efficient method first. Reduce redundancy. Emphasize estimation as a quick verification technique.  **Overall Critique:**  ROT offers a bare-bones solution focused solely on efficiency. LOT offers a comprehensive educational experience, sometimes at the expense of immediate efficiency. The ideal approach lies somewhere in between. A good solution should be efficient *and* provide enough context to ensure understanding and prevent errors. LOT's comprehensive approach is more valuable in the long run, especially for learning, but could be made more accessible by streamlining the initial presentation.  ### Synthesized Accurate Answer: Michael has 9 bunnies."
