Round,Speaker,Utterance
1,Moderator,"Debate Topic: In-depth discussion based on the mission context and ideas from ROT and LOT. Mission Context (partial): Instruction: James is trying to create a new breed of kittens with extra-long tails. Each generation of kittens he breeds has a tail 25% longer than the last generation. If the first generation has tails 16 cm long, how long are the third generation's tails?... Initial Core Idea from ROT (partial): Okay, based on the problem description and the previous analysis, here's the solution:  The problem states that the first generation of kittens has tails 16 cm long.  Each subsequent generation's tails are 25% longer than the previous generation. We need to find the length of the third generation's tails.  *   **Generation 1:** 16 cm *   **Generation 2:** 16 cm * (1 + 0.25) = 16 cm * 1.25 = 20 cm *   **Generation 3:** 20 cm * (1 + 0.25) = 20 cm * 1.25 = 25 cm  Therefore, the third generation's tails are 25 cm long.  **Answer:** 25... Initial Detailed Plan from LOT (partial): Aggregated result from layer 441 (Concept: 'Generate and present the answer based on the plan...') using strategy 'all_content_ranked': - (Criterion: 'Criterion A (Level 1): Present the final answer (tail length of the third generation) based on the selected method (iterative) with clear units', Level: 1):   The first generation's tails are 16 cm long. The second generation's tails are 16 cm + (0.25 * 16 cm) = 16 cm + 4 cm = 20 cm long. The third generation's tails are 20 cm + (0.25 * 20 cm) = 20 cm + 5 cm = 25 cm long.  Therefore, the third generation's tails are 25 cm long.  - (Criterion: 'Criterion B (Level 1): Explicitly state the assumptions made during the calculation (e.g., constant percentage increase, no rounding until the final step)', Level: 1):   Assumptions:  1.  The tail length increases by a constant 25% with each generation. 2.  We will not round the tail length after calculating each generation's tail length; we will only round the final answer.  - (Criterion: 'Criterion C (Level 2): Calculate the percentage increase in tail length from the first to the third generation', Level: 1):   To calculate the tail length of the third generation, we need to apply the 25% increase twice (once for the second generation and again for the third). Instead of calculating each generation separately, we can find the overall multiplier for the increase over two generations.  Each generation's tail length is 1.25 times the previous generation's length (1 + 0.25 = 1.25). So, after two generations, the tail length will be 1.25 * 1.25 = 1.5625 times the original length. This represents a 56.25% increase from the first generation to the third.  - (Criterion: 'Criterion D (Level 2): Show the calculation using the generalized formula derived earlier and compare the result with the iterative method's result', Level: 1):   Okay, let's show the calculation using the generalized formula and compare it with the iterative method's result.  The generalized formula we derived (implicitly in the iterative approach) is:  Tail Length (generation *n*) = Initial Tail Length * (1 + Growth Rate)^*n*  In this case:  *   Initial Tail Length = 16 cm *   Growth Rate = 25% = 0.25 *   n = 2 (since we want the *third* generation and the first is already given, we need to apply the growth twice)  Therefore:  Tail Length (3rd generation) = 16 * (1 + 0.25)^2 Tail Length (3rd generation) = 16 * (1.25)^2 Tail Length (3rd generation) = 16 * 1.5625 Tail Length (3rd generation) = 25 cm  **Comparison with the Iterative Method:**  The iterative method yielded the same result: *   Generation 1: 16 cm *   Generation 2: 16 * 1.25 = 20 cm *   Generation 3: 20 * 1.25 = 25 cm  The results are identical. Both approaches confirm that the third generation of kittens will have tails 25 cm long.  - (Criterion: 'Criterion E (Level 3): Discuss the potential impact of rounding errors if intermediate results were rounded to the nearest integer at each step', Level: 1):   Okay, let's discuss the potential impact of rounding errors if intermediate results were rounded to the nearest integer at each step.  *   **Generation 1:** Tail length = 16 cm (Given)  *   **Generation 2:** Tail length = 16 * 1.25 = 20 cm.  Rounding to the nearest integer would give 20 cm.  In this case, there's no rounding error.  *   **Generation 3:** Tail length = 20 * 1.25 = 25 cm. Rounding to the nearest integer would give 25 cm. Again, no rounding error.  Now, let's consider a slightly different scenario where the initial tail length or the growth factor results in non-integer values at intermediate steps. Let's say, for the sake of demonstration, that we're trying to increase the tail length by 25.5% each generation, and the first generation has tails of 16 cm.  *   **Generation 2:** Tail length = 16 * 1.255 = 20.08 cm. Rounding to the nearest integer would give 20 cm.  The actual value is 20.08 cm, so the error introduced by rounding is 0.08 cm.  *   **Generation 3 (Using the rounded value from Generation 2):** Tail length = 20 * 1.255 = 25.1 cm. Rounding to the nearest integer would give 25 cm.  *   **Generation 3 (Without rounding):** Tail length = 20.08 * 1.255 = 25.2004 cm.  Comparing the two results for Generation 3:  *   Rounded: 25 cm *   Unrounded: 25.2004 cm  The difference is 0.2004 cm.  **Impact:** Rounding to the nearest integer at each step can introduce a small error in each generation. These errors can accumulate over multiple generations, leading to a more significant difference between the calculated tail length with rounding and the actual tail length without rounding. In this specific case, after two generations, the accumulated error is 0.2004 cm which is not significant. However, if the percentage increase was smaller or the initial tail length was smaller, the rounding error would be more significant. For example, if the increase was 10.3% and the initial length was 5, the rounding errors would cause a larger percentage change.  **Conclusion:** While rounding to the nearest integer might seem insignificant for single calculations, it can lead to noticeable discrepancies when repeated over multiple generations. For applications requiring high precision, it's best to avoid rounding intermediate results and only round the final answer if necessary.  If rounding is necessary at each step, consider using more decimal places to minimize the impact of rounding errors.  - (Criterion: 'Criterion F (Level 3): Present a concise summary of the entire calculation process, highlighting the key steps and the reasoning behind them', Level: 1):   Here's a concise summary of the calculation process to determine the tail length of the third generation kittens:  1. **Calculate the tail length increase for each generation:**  Each generation's tail is 25% longer than the previous one. This means we need to calculate 25% of the previous generation's tail length.  2. **Calculate the tail length of the second generation:**  The first generation has tails of 16 cm.  We calculate 25% of 16 cm (0.25 * 16 = 4 cm).  Then, we add this increase to the first generation's tail length: 16 cm + 4 cm = 20 cm. The second generation's tails are 20 cm long.  3. **Calculate the tail length of the third generation:**  We calculate 25% of the second generation's tail length (0.25 * 20 cm = 5 cm).  Then, we add this increase to the second generation's tail length: 20 cm + 5 cm = 25 cm. The third generation's tails are 25 cm long.  Therefore, the third generation of kittens has tails that are 25 cm long.  - (Criterion: 'Criterion G (Level 4): Imagine a scenario where the initial tail length is uncertain (e.g., 16 cm +/- 0.5 cm). Calculate the range of possible tail lengths for the third generation and discuss the implications for the breeding program.', Level: 1):   Okay, let's address the ""what if the initial tail length is uncertain"" scenario.  **Scenario:** The first generation's tail length is 16 cm +/- 0.5 cm. This means the tail length could be anywhere between 15.5 cm and 16.5 cm.  **Calculation of Range for the Third Generation:**  We need to calculate the third generation's tail length for both the minimum and maximum initial tail lengths.  The formula is: Tail Length (Generation n) = Initial Tail Length * (1.25)^n, where n is the generation number.  *   **Minimum Tail Length:**     *   Initial Tail Length = 15.5 cm     *   Tail Length (Generation 3) = 15.5 * (1.25)^2 = 15.5 * 1.5625 = 24.22 cm (rounded to two decimal places)  *   **Maximum Tail Length:**     *   Initial Tail Length = 16.5 cm     *   Tail Length (Generation 3) = 16.5 * (1.25)^2 = 16.5 * 1.5625 = 25.78 cm (rounded to two decimal places)  Therefore, the range of possible tail lengths for the third generation is approximately 24.22 cm to 25.78 cm.  **Implications for the Breeding Program:**  1.  **Variability:** The uncertainty in the initial tail length creates a range of possible outcomes in later generations. This highlights the importance of accurate measurement and record-keeping. Even a small initial variation can amplify over multiple generations.  2.  **Selection Strategy:** James needs to consider this variability when selecting kittens for breeding. He might want to select kittens with tail lengths closer to the *average* of the predicted range (around 25 cm).  He might also want to prioritize kittens whose parents had consistently long tails in previous generations, reducing the influence of initial measurement error.  3.  **Statistical Analysis:** To better understand the impact of the initial uncertainty, James could perform a more sophisticated statistical analysis, such as a Monte Carlo simulation. This would involve repeatedly simulating the breeding process with randomly sampled initial tail lengths within the +/- 0.5 cm range and observing the distribution of tail lengths in the third generation.  4.  **Measurement Accuracy:** This scenario underscores the need for precise measurements. James should use a consistent and reliable method for measuring tail length in each generation to minimize measurement error.  5. **Breeding Strategy adjustment:** James may need to breed more kittens in each generation to account for the variability and increase the chance of producing kittens with tails closer to his desired length.  In summary, even a small uncertainty in the initial conditions can lead to a significant range of outcomes in subsequent generations. This highlights the importance of careful measurement, record-keeping, and a well-defined selection strategy in James's breeding program.  ... The debate will now commence focusing on these ideas."
2,ROT_Representative,"Okay, here's my response as the ROT Representative:  **1. Elaboration on the ROT Idea and its Strengths**  My core idea is a straightforward, iterative solution to the problem:  *   **Generation 1:** 16 cm *   **Generation 2:** 16 cm * (1 + 0.25) = 16 cm * 1.25 = 20 cm *   **Generation 3:** 20 cm * (1 + 0.25) = 20 cm * 1.25 = 25 cm  Therefore, the third generation's tails are 25 cm long.  **Answer: 25 cm**  This approach directly addresses the problem by calculating the tail length for each generation sequentially based on the given 25% increase.  **Key Strengths:**  *   **Simplicity:** It's easy to understand and implement. The calculations are basic and require no advanced mathematical knowledge. *   **Directness:** It directly translates the problem statement into a step-by-step solution. *   **Accuracy:** It provides the correct answer without unnecessary complexity. It avoids potential errors that might arise from more complex formulas or rounding.  **2. Critical Evaluation of the LOT Idea**  The LOT idea provides a much more comprehensive analysis, breaking down the problem into several criteria. While thorough, it also introduces potential weaknesses compared to the ROT approach.  **Weaknesses, Overlooked Aspects, and Limitations of LOT:**  *   **Over-Engineering:** The LOT approach, particularly criteria C, D, E, F, and G, goes beyond the core requirement of the problem. While the additional analysis (percentage increase calculation, generalized formula, rounding error discussion, uncertainty analysis) is interesting and potentially useful in a real-world breeding program, it's not strictly necessary to answer the question ""how long are the third generation's tails?"". This adds complexity without a proportional increase in the value of the *answer* to the stated problem. *   **Potential for Confusion:** The multiple criteria and different calculation methods (iterative vs. generalized formula) could potentially confuse someone just looking for a simple answer. The problem statement is very clear and doesn't require such extensive analysis. *   **Time Consumption:** The detailed analysis in the LOT approach would take significantly longer than the ROT approach. In a time-constrained situation, the ROT approach is much more efficient. *   **""Criterion E"" Misdirection:** While discussing rounding errors is generally good practice, the initial example (25% increase) doesn't actually *have* any rounding errors until much later when the LOT idea introduces a hypothetical 25.5% increase. This creates an unnecessary tangent. *   **""Criterion G"" Overreach:** The uncertainty analysis (16 cm +/- 0.5 cm) introduces a completely new scenario that wasn't part of the original problem statement. While relevant to a real-world breeding program, it's a distraction from the core task. It's a ""what if"" scenario that unnecessarily complicates the solution. *   **Lack of Conciseness:** The LOT's final answer is buried within a large amount of explanatory text. The ROT idea immediately presents the answer clearly and concisely.  **Why the ROT Approach is Preferable:**  The ROT approach is preferable because it directly and efficiently answers the question asked in the problem statement. It prioritizes simplicity, clarity, and accuracy. While the LOT approach offers a more in-depth analysis, it does so at the cost of increased complexity, potential confusion, and time consumption, without necessarily improving the *answer* to the core problem. The added analysis is valuable *if* the goal is to develop a comprehensive breeding strategy, but not if the goal is simply to calculate the tail length of the third generation. The ROT idea is more focused and directly responsive to the prompt."
3,LOT_Representative,"Okay, here's my response as the LOT Representative, defending the LOT approach and critiquing the ROT approach:  **1. Elaboration on the LOT Idea and its Strengths**  The LOT plan directly addresses the core problem (""how long are the third generation's tails?"") through Criterion A, providing a clear and accurate answer of 25 cm using an iterative method. However, it goes *beyond* simply providing the answer to offer a more comprehensive understanding and robust solution.  **Key Strengths and Feasibility:**  *   **Comprehensive Understanding:** The LOT plan doesn't just calculate the answer; it explores the underlying mathematical principles (Criterion C & D), potential sources of error (Criterion E), and the practical implications of the problem in a real-world scenario (Criterion G). This demonstrates a deeper understanding of the problem and its context. *   **Error Mitigation:** Criterion B explicitly states the assumptions made (constant percentage increase, no intermediate rounding). Criterion E then analyzes the impact of rounding errors, highlighting the importance of precision, especially in iterative calculations. This is crucial for ensuring reliable results, particularly if the breeding program continues for many generations or involves smaller percentage increases. *   **Generalizability:** Criterion D derives a generalized formula for calculating tail length in any generation. This allows for quick calculations for future generations without needing to perform iterative steps. It also provides a more abstract and powerful understanding of the problem. *   **Real-World Relevance:** Criterion G tackles the potential uncertainty in the initial tail length. This is a very realistic consideration in a real-world breeding program, where precise measurements might be difficult to obtain. By calculating the range of possible outcomes, the plan provides valuable insights for informed decision-making. It forces a consideration of how robust the calculated result is to variations in the initial input. *   **Thoroughness:** The plan provides a concise summary of the calculation process (Criterion F) to ensure clarity and facilitate understanding. *   **Iterative Method and Formula Comparison:** By including both the iterative method and the generalized formula, we provide a means for verification and cross-checking, increasing confidence in the final result.  The feasibility of the LOT approach is high. Each criterion is built upon the previous one, creating a logical progression. The calculations are straightforward and require only basic arithmetic and algebraic skills. The additional analysis, while more in-depth, is still accessible and practical.  **2. Critical Evaluation of the ROT Idea**  The ROT idea provides a correct answer to the problem, but it suffers from significant limitations in its scope and robustness.  **Weaknesses, Overlooked Aspects, and Limitations of ROT:**  *   **Lack of Context and Understanding:** The ROT approach focuses solely on calculating the answer without exploring the broader context of the problem. It provides no insight into the underlying mathematical principles, potential sources of error, or practical implications. It treats the problem as a purely abstract exercise. *   **Brittle Solution:** The ROT approach is highly specific to the given initial conditions (16 cm, 25% increase). If any of these parameters change, the entire calculation needs to be repeated from scratch. There is no generalizable method provided. *   **Oversimplification:** By focusing solely on the iterative calculation, the ROT approach misses opportunities to gain a deeper understanding of the problem. For example, it doesn't identify the overall percentage increase from the first to the third generation or provide a formula for calculating tail length in any generation. *   **Ignoring Potential Errors:** The ROT approach completely ignores the potential for rounding errors or measurement uncertainties. In a real-world breeding program, these factors could significantly impact the results. *   **Limited Applicability:** The ROT approach provides a limited solution to a very specific problem. It does not equip the user with the knowledge or tools to address similar problems with different parameters or in different contexts.  **3. Why the LOT Approach is Preferable**  The LOT approach is preferable because it provides a more comprehensive, robust, and generalizable solution to the problem. While the ROT approach may be sufficient for simply answering the question ""how long are the third generation's tails?"", the LOT approach equips the user with a deeper understanding of the problem, the ability to mitigate potential errors, and the tools to address similar problems in different contexts.  The ROT representative criticizes the LOT approach for ""over-engineering,"" ""potential for confusion,"" ""time consumption,"" and introducing unnecessary hypotheticals. However, these criticisms miss the point. The LOT approach is not simply about finding the answer; it's about understanding the problem and its implications.  *   **Over-engineering?** The additional analysis is not unnecessary complexity; it's about building a more robust and reliable solution. In a real-world breeding program, these considerations are crucial. *   **Potential for confusion?** The LOT approach is structured in a logical progression, starting with the basic calculation and then building upon it with additional analysis. This allows the user to understand the problem at their own pace and level of understanding. *   **Time consumption?** While the LOT approach may take slightly longer initially, the time investment is worthwhile because it provides a more comprehensive and generalizable solution. Furthermore, the generalized formula derived in Criterion D allows for faster calculations in the future. *   **Unnecessary hypotheticals?** The ""what if"" scenarios (rounding errors, initial uncertainty) are not distractions; they are crucial considerations in a real-world breeding program. Ignoring these factors could lead to inaccurate results and poor decision-making.  In conclusion, while the ROT approach provides a quick and simple answer, the LOT approach provides a more comprehensive, robust, and generalizable solution that is better suited for addressing the problem in a real-world context. The LOT approach prioritizes understanding and reliability over mere speed."
4,Critical_Analyst,"Okay, here's my critical analysis of the ROT and LOT approaches to the kitten tail length problem:  **ROT Analysis:**  *   **Strengths:** The ROT approach is undeniably simple, direct, and provides the correct numerical answer quickly. It's easy to understand and requires minimal effort. *   **Weaknesses:** ROT's primary weakness is its lack of depth. It treats the problem as a purely mathematical exercise, ignoring potentially relevant practical considerations. It's a brittle solution; any change to the initial conditions requires re-calculation from scratch. It offers no insight into the underlying principles or potential error sources. It also doesn't account for real-world variability. *   **Overlooked Aspects:** ROT overlooks the potential for rounding errors, the general formula for calculating tail length in any generation, the overall percentage increase, and the impact of uncertainty in the initial tail length. *   **Inconsistencies:** There are no inherent inconsistencies within the ROT approach itself, but its simplicity makes it inadequate for a more comprehensive understanding. *   **Correctness and Completeness:** ROT is numerically correct but incomplete in its scope. It only addresses the specific question asked without exploring its broader context. *   **Improvements/Cautions:** ROT should acknowledge its limitations and perhaps suggest further analysis for a more robust solution. It should also be cautious about assuming perfect initial conditions in a real-world scenario.  **LOT Analysis:**  *   **Strengths:** The LOT approach offers a far more comprehensive understanding of the problem. It explicitly states assumptions, derives a generalized formula, analyzes the impact of rounding errors, and considers the effect of uncertainty in the initial tail length. It's more robust and adaptable to different scenarios. *   **Weaknesses:** The LOT approach can be perceived as ""over-engineered"" for the simple question asked. The additional analysis might be unnecessary for someone only seeking the numerical answer. It's more time-consuming than ROT. *   **Overlooked Aspects:** Although comprehensive, LOT could benefit from a more explicit discussion of the limitations of its uncertainty analysis. For example, the +/- 0.5 cm is an arbitrary range. A real-world scenario might have a different uncertainty. Also, while it mentions Monte Carlo simulation, it doesn't elaborate on the practical steps James would need to take to implement that. *   **Inconsistencies:** There are no major inconsistencies within the LOT approach. *   **Correctness and Completeness:** LOT is both numerically correct and more complete in its scope than ROT. It addresses the core question and explores its broader implications. *   **Improvements/Cautions:** LOT should acknowledge that its level of detail may be unnecessary for all users. It could suggest focusing on specific criteria based on the user's needs and the complexity of the problem. LOT should also be careful about introducing hypothetical scenarios (like the 25.5% increase) without clearly explaining why they are relevant and how they inform the original problem. It would be beneficial to include a section on how to choose the right level of precision for measurements given the breeding context.  **Balanced Overall Critique:**  Both ROT and LOT have their merits and drawbacks. ROT is ideal for a quick and simple solution, while LOT is better suited for a deeper understanding and a more robust approach. The choice between the two depends on the specific needs and goals of the user. For a simple calculation, ROT is sufficient. For a real-world breeding program, LOT's comprehensive analysis is invaluable. Ideally, a hybrid approach would be best: start with the simple calculation provided by ROT, and then expand upon it with the additional analysis provided by LOT, as needed. LOT's detailed exploration of error mitigation and real-world relevance provides significant added value.  ### Synthesized Accurate Answer: 25 cm"
