Round,Speaker,Utterance
1,Moderator,"Debate Topic: In-depth discussion based on the mission context and ideas from ROT and LOT. Mission Context (partial): Instruction: Give me a list of things that could be found on a desk... Initial Core Idea from ROT (partial): Okay, I understand. Based on the established task definition, here's the output:  Pen, Paper, Computer, Lamp, Stapler, Notebook, Mouse, Keyboard, Monitor, Calendar, Phone, Sticky Notes, Coffee Cup, Picture Frame, Desk Organizer, Water Bottle, Headphones, Books, Calculator, Paperclips, Ruler, Scissors, Tape Dispenser, Business Cards, Plant, Tablet, Desk Lamp, Pen Holder, File Folders, External Hard Drive, Smartphone, Coffee Mug, Coasters, Hand Sanitizer... Initial Detailed Plan from LOT (partial): Aggregated result from layer 159 (Concept: 'Generate and present the answer based on the plan...') using strategy 'all_content_ranked': - (Criterion: 'Consider items related to desk organization systems (e.g., modular organizers, drawer dividers, cable management solutions)', Level: 1):   Okay, here's a list of things related to desk organization systems that could be found on a desk, contributing to the overall list of things found on a desk:  *   **Modular Desk Organizers:** Small containers or trays that can be combined and rearranged to hold pens, paperclips, sticky notes, etc. *   **Drawer Dividers:** Inserts for desk drawers to separate and organize items like pens, pencils, paper, and other supplies. *   **Cable Management Clips/Ties:** Devices used to bundle and route cables, preventing tangles and keeping the desk surface clear. *   **Monitor Stand with Storage:** A stand that elevates the monitor and provides storage space underneath for items like keyboards, documents, or small accessories. *   **Desk Organizer with Charging Station:** A combination organizer that holds office supplies and includes a built-in charging station for electronic devices. *   **Pen Holders/Cups:** Containers specifically designed to hold pens, pencils, markers, and other writing utensils. *   **Letter Trays:** Stackable trays used to organize incoming and outgoing documents. *   **File Folders:** Used inside drawers or on the desk to keep documents organized by topic or project. *   **Sticky Note Holders:** Small dispensers or containers designed to hold sticky notes for easy access. *   **Desk Mats with Built-in Organization:** Desk mats that have pockets or loops for holding pens, cards, or other small items. *   **Under-Desk Cable Trays:** Metal or plastic trays mounted underneath the desk to conceal and organize cables. *   **Headphone Stands:** Stands to keep headphones off the desk surface and prevent them from getting tangled.  - (Criterion: 'Consider items related to specific hobbies or interests pursued at the desk (e.g., miniature painting supplies, electronics repair tools, crafting materials)', Level: 1):   Okay, considering hobbies and interests, here's a list of potential desk items, broken down by hobby type:  **Miniature Painting:**  *   Paint brushes (various sizes) *   Paints (acrylic, enamel, etc.) *   Palette (wet palette, dry palette) *   Miniature figures (unpainted or partially painted) *   Hobby knife/Exacto knife *   Cutting mat *   Glue (super glue, plastic glue) *   Primer *   Varnish *   Water pot *   Tweezers *   Magnifying glass/lamp  **Electronics Repair/Building:**  *   Soldering iron *   Solder *   Multimeter *   Wire strippers *   Helping hands *   Small screwdrivers (Phillips, flathead, Torx) *   Components (resistors, capacitors, LEDs, etc.) *   Breadboard *   Wire *   Magnifying lamp *   Desoldering pump/wick  **Crafting (General):**  *   Scissors *   Glue gun *   Craft knives *   Rulers *   Cutting mat *   Yarn/Thread *   Needles *   Fabric scraps *   Beads *   Buttons *   Markers/Colored Pencils *   Sketchbook  **Drawing/Art:**  *   Sketchbook *   Pencils (various grades) *   Erasers *   Pencil sharpener *   Drawing pens (fineliners, brush pens) *   Colored pencils *   Markers *   Paintbrushes *   Paints (watercolor, acrylic) *   Palette *   Blending stumps *   Rulers *   Set squares  These items are directly related to hobbies and interests and could realistically be found on a desk used for those activities. This adds a layer of specificity beyond basic desk essentials.  - (Criterion: 'Consider items related to the aesthetic or decorative aspects of the desk (e.g., plants, figurines, artwork, motivational posters)', Level: 1):   Okay, focusing on the aesthetic and decorative aspects of a desk, here's a list of items that could be found:  *   **Small potted plant:** Adds a touch of nature and vibrancy. *   **Picture frame:** Holding a personal photo or artwork. *   **Figurine or collectible:** A small decorative object reflecting a hobby or interest. *   **Motivational poster or print:** Providing inspiration. *   **Desk lamp with a stylish design:** Serving both function and aesthetics. *   **Candle or diffuser:** Contributing to the ambiance and scent. *   **String lights:** Adding a soft, ambient glow. *   **Artwork (small canvas or framed print):** A piece of art to personalize the space. *   **Paperweight (decorative):** Both functional and visually appealing. *   **Vase (with or without flowers):** Adding elegance and color.  - (Criterion: 'Consider items related to health and wellness at the desk (e.g., ergonomic accessories, stress balls, essential oil diffuser)', Level: 1):   Okay, considering health and wellness items for a desk, here's a list of things that could be found:  *   **Ergonomic Keyboard:** Designed for comfortable typing and reduced strain. *   **Ergonomic Mouse:** Similar to the keyboard, promotes better wrist posture. *   **Wrist Rest:** Supports the wrist and prevents strain during mouse or keyboard use. *   **Footrest:** Improves posture and reduces leg fatigue. *   **Lumbar Support Pillow:** Supports the lower back and promotes good posture. *   **Blue Light Blocking Glasses:** Reduces eye strain from prolonged screen time. *   **Stress Ball/Fidget Toy:** Provides a physical outlet for stress and anxiety. *   **Essential Oil Diffuser:** Creates a calming and pleasant atmosphere. *   **Hand Sanitizer:** Promotes hygiene and prevents the spread of germs. *   **Water Bottle:** Encourages hydration throughout the day. *   **Healthy Snacks (e.g., nuts, fruit):** Provides energy and promotes healthy eating habits. *   **Small Plant:** Adds a touch of nature and improves air quality. *   **Eye Drops:** Relieves dry or irritated eyes. *   **Heating Pad/Cooling Pad:** For pain relief or temperature regulation. *   **Standing Desk Converter:** Allows for alternating between sitting and standing.  - (Criterion: 'Consider items related to communication (e.g., phone, headset, video conferencing equipment)', Level: 1):   Okay, considering items related to communication that might be found on a desk, here's a list:  *   **Phone:** (Landline or desk phone) *   **Headset:** (Wired or wireless, for calls or video conferencing) *   **Webcam:** (For video calls and meetings) *   **Microphone:** (Standalone or built into a headset, for clearer audio) *   **Speakerphone:** (For hands-free calls and meetings) *   **Call log book/notepad:** (For tracking calls) *   **Voicemail instructions/sticky note:** (Quick reminder for accessing voicemail) *   **Contact list/Rolodex:** (Physical or printed list of important contacts)  - (Criterion: 'Consider items related to data storage (e.g., external hard drives, USB drives, SD cards)', Level: 1):   Okay, considering items related to data storage that could be found on a desk, here's a list:  *   **External Hard Drive:** For backing up files or storing large amounts of data. *   **USB Flash Drive (Thumb Drive):** For portable file transfer. *   **SD Card:** Commonly used in cameras and other devices, often kept on a desk for transferring photos or data. *   **MicroSD Card Adapter:** If the desk user frequently uses microSD cards, they might have an adapter to use them in a standard SD card slot. *   **Card Reader:** A device to read various types of memory cards (SD, microSD, CompactFlash, etc.). *   **CD/DVD/Blu-ray Discs:** While less common now, some people still use optical media for storage or software. *   **CD/DVD/Blu-ray Cases:** To store the discs mentioned above.  - (Criterion: 'Consider items related to cleaning and maintenance of the desk itself (e.g., cleaning wipes, screen cleaner, dusting cloth)', Level: 1):   Okay, focusing on cleaning and maintenance items found on or near a desk, here's a list:  *   **Cleaning Wipes:** For wiping down the desk surface. *   **Screen Cleaner:** Spray and cloth specifically for cleaning monitors. *   **Dusting Cloth:** For removing dust from the desk and surrounding areas. *   **Keyboard Cleaner/Air Duster:** To remove dust and debris from keyboards. *   **Microfiber Cloth:** A general-purpose cleaning cloth. *   **Desk Vacuum (Mini):** A small vacuum specifically for cleaning up crumbs and debris on the desk. *   **Rubbing Alcohol/Isopropyl Alcohol:** For disinfecting surfaces. *   **Hand Sanitizer:** While not strictly for desk cleaning, often kept on desks for personal hygiene.  - (Criterion: 'Consider items related to audio (e.g., speakers, headphones, microphone)', Level: 1):   Okay, considering items related to audio that could be found on a desk, here's a list:  *   **Speakers:** Desktop speakers (small, medium, or large) for playing audio. *   **Headphones:** Wired or wireless headphones for private listening. *   **Headphone Stand:** A stand to hold headphones when not in use. *   **Microphone:** A standalone microphone for recording audio or voice calls (e.g., USB microphone, XLR microphone with interface). *   **Microphone Stand/Arm:** A stand or articulating arm to position the microphone. *   **Audio Interface:** (If using an XLR microphone) A device to connect the microphone to the computer and provide phantom power. *   **Earbuds:** Wireless or wired earbuds for listening to audio. *   **Volume Control Knob:** A dedicated physical volume control knob connected to the computer.  - (Criterion: 'Consider items that serve multiple purposes (e.g., a lamp with a built-in charger, a monitor stand with storage)', Level: 1):   Okay, considering items that serve multiple purposes, here's how I'll refine the desk item list:  Instead of just ""Lamp,"" I'll add ""Lamp with USB Charger"" or ""Smart Lamp with Wireless Charging Base."" This highlights the dual functionality.  Instead of just ""Monitor Stand,"" I'll add ""Monitor Stand with Drawer Storage"" or ""Monitor Stand with Cable Management."" Again, emphasizing the extra utility.  This approach will lead to a more comprehensive and modern list of desk items.  - (Criterion: 'Consider items related to the power and connectivity (e.g., power strip, USB hub, ethernet cable)', Level: 1):   Okay, considering items related to power and connectivity that could be found on a desk, here's a list of examples that could be added to the overall list of things found on a desk:  *   **Power strip:** Provides multiple outlets for powering devices. *   **USB hub:** Expands the number of available USB ports. *   **Ethernet cable:** Connects the computer to a wired network. *   **Charging cables (phone, tablet, etc.):** Used to charge mobile devices. *   **Laptop charger:** Powers and charges a laptop. *   **Wireless charger pad:** For wirelessly charging compatible devices. *   **Extension cord:** Extends the reach of power outlets. *   **Cable organizers/clips:** To manage and tidy up cables. *   **Docking station (laptop):** Provides connections to peripherals and power with a single connection.  ... The debate will now commence focusing on these ideas."
2,ROT_Representative,"Okay, I'm ready to analyze the task and the LOT's output from the perspective of the ROT Representative.  **1. Elaboration on the ROT Idea's Strengths and How It Addresses the Core Problem**  My core idea, ""Pen, Paper, Computer, Lamp, Stapler, Notebook, Mouse, Keyboard, Monitor, Calendar, Phone, Sticky Notes, Coffee Cup, Picture Frame, Desk Organizer, Water Bottle, Headphones, Books, Calculator, Paperclips, Ruler, Scissors, Tape Dispenser, Business Cards, Plant, Tablet, Desk Lamp, Pen Holder, File Folders, External Hard Drive, Smartphone, Coffee Mug, Coasters, Hand Sanitizer,"" directly addresses the instruction ""Give me a list of things that could be found on a desk"" by providing a foundational and comprehensive list of common desk items.  **Key Strengths:**  *   **Directness and Simplicity:** It offers a straightforward answer without overcomplicating the prompt. It gets to the point quickly. *   **Comprehensiveness (Basic Level):** It covers a wide range of items likely to be found on *most* desks, regardless of profession or hobby. It hits the core items first. *   **Accessibility:** The list is easily understood and relatable to a broad audience. Anyone can quickly grasp what a ""desk"" generally contains. *   **Foundation for Expansion:** It serves as a solid base upon which more specific or niche items can be added.  The ROT list is strong because it immediately satisfies the basic requirement of the prompt by offering a generalized, accessible, and easily understood answer. It acknowledges that a desk, at its core, has certain essential items that are universally applicable.  **2. Critical Evaluation of the LOT Idea and Why the ROT Approach Might Be Preferable**  The LOT idea, while demonstrating a commendable depth of analysis and a commendable effort to provide comprehensive coverage, suffers from several potential weaknesses compared to the ROT approach:  **Weaknesses of LOT's Approach:**  *   **Overly Specific and Potentially Irrelevant:** The LOT dives immediately into highly specific categories like miniature painting supplies or electronics repair tools. While these items *could* be on a desk, they are not universally present and might be irrelevant to many users. The ROT approach prioritizes the universally relevant items *first*. *   **Loss of Focus:** By immediately branching into niche categories, the LOT risks losing sight of the core question. The prompt asks for things ""that could be found on a desk,"" not for a detailed inventory of every possible desk configuration. *   **Cognitive Overload:** The sheer volume of items generated by the LOT approach, especially when categorized by hobby, could be overwhelming and less helpful to the user. The ROT approach offers a manageable and easily digestible starting point. *   **Reduced Accessibility:** The LOT's specialized lists might be less accessible to a general audience. Someone unfamiliar with miniature painting, for example, might find that section of the list unhelpful. *   **Prioritization Issues:** The LOT approach treats all categories equally, regardless of their likelihood of being present on a typical desk. This lack of prioritization diminishes the usefulness of the list. A power strip is far more common than a soldering iron, but the LOT presents them at the same level. *   **Potential for Redundancy:** Some items could appear in multiple categories (e.g., ""Scissors"" in Crafting and General Office Supplies), leading to redundancy. *   **Risk of Analysis Paralysis:** The user might be overwhelmed by the options and struggle to identify the most relevant items.  **Overlooked Aspects/Limitations of LOT:**  *   **Contextual Awareness:** The LOT doesn't seem to consider the *primary* function of the desk. Is it a work desk? A gaming desk? An art desk? Without context, the specialization is less useful. The ROT approach provides a baseline suitable for *any* desk. *   **""Normal"" vs. ""Possible"":** The LOT focuses on what *could* be on a desk, potentially including very unusual items. The ROT approach aims for what is *normally* found on a desk. *   **User Intent:** What does the user *need* the list for? If they're setting up a basic office, the LOT's hobby supplies are irrelevant.  **Why the ROT Approach is Preferable:**  *   **Efficiency:** It provides the most common and essential items first, allowing the user to quickly identify what they need. *   **General Applicability:** It's relevant to a wider audience, regardless of their profession or hobbies. *   **Clarity:** It's easy to understand and use. *   **Scalability:** It can be expanded upon with more specific items as needed, but it starts with a solid foundation. *   **Avoids Overwhelm:** It presents a manageable amount of information, preventing cognitive overload.  In summary, while the LOT approach demonstrates thoroughness, it sacrifices efficiency, clarity, and general applicability. The ROT approach, by focusing on the core, universally relevant items, provides a more effective and user-friendly solution to the prompt. The ROT list is a better starting point, and the LOT's more specialized items can be added later as needed."
3,LOT_Representative,"Okay, I'm ready to defend the LOT approach.  **1. Elaboration on the LOT Idea's Strengths and How It Addresses the Core Problem**  The LOT plan directly addresses the prompt ""Give me a list of things that could be found on a desk"" by systematically exploring various criteria and generating comprehensive lists within each. The key strength lies in its structured and multifaceted approach.  **Key Strengths:**  *   **Comprehensive Coverage:** Unlike the ROT's basic list, the LOT covers a much wider range of potential desk items by considering organization, hobbies, aesthetics, health, communication, data storage, cleaning, audio, multi-purpose items, and power/connectivity. *   **Contextual Nuance:** The LOT acknowledges that ""a desk"" is not a monolithic entity. It attempts to anticipate different desk setups based on user needs and interests, leading to a more relevant and helpful response. *   **Organization and Clarity:** The LOT organizes items into logical categories, making it easier for the user to find what they are looking for. This is far more helpful than a single, undifferentiated list. *   **Modernity and Relevance:** The LOT includes items relevant to modern desk setups, such as wireless charging pads, ergonomic accessories, and video conferencing equipment, which may be absent from a more basic list. *   **Inspiration and Idea Generation:** The detailed lists can spark ideas for users who are looking to optimize their desk setup or personalize their workspace.  The LOT's approach is highly feasible because it breaks down the problem into smaller, manageable chunks. Each criterion acts as a filter, generating a specific subset of desk items. This systematic approach ensures that no major category is overlooked.  **2. Critical Evaluation of the ROT Idea**  The ROT idea, while providing a basic starting point, suffers from several significant weaknesses compared to the LOT plan.  **Weaknesses of the ROT Approach:**  *   **Lack of Depth and Specificity:** The ROT list is overly generic and lacks the depth needed to be truly helpful. It provides a superficial overview without considering the nuances of different desk setups. For example, simply listing ""lamp"" ignores the possibility of a ""smart lamp with wireless charging base,"" which is a more modern and functional item. *   **Limited Relevance:** The ROT list may not be relevant to users with specific needs or interests. A miniature painter, for example, would find little value in a list that only includes ""pen"" and ""paper."" *   **Poor Organization:** The ROT list is presented as a single, undifferentiated block of items, making it difficult for users to quickly find what they are looking for. *   **Outdated Perspective:** The ROT list may be based on an outdated view of what constitutes a modern desk setup. It may omit essential items such as USB hubs, ergonomic accessories, and video conferencing equipment. *   **Passive and Uninspired:** The ROT list provides a static overview without inspiring users to think creatively about their desk setup or explore new possibilities.  **Overlooked Aspects/Limitations of ROT:**  *   **User Needs:** The ROT approach fails to consider the user's specific needs or interests. It assumes that all desks are the same, which is simply not true. *   **Context:** The ROT approach ignores the context in which the desk is being used. Is it a home office, a gaming station, or an art studio? The appropriate items will vary depending on the context. *   **Functionality:** The ROT approach focuses on basic functionality without considering the potential for multi-purpose items or ergonomic accessories.  **3. Why the LOT Approach is Preferable**  The LOT approach is preferable because it offers a more comprehensive, nuanced, and relevant solution to the prompt. While the ROT approach provides a basic starting point, it lacks the depth, specificity, and organization needed to be truly helpful. The LOT approach, by contrast, provides a structured and multifaceted overview of potential desk items, taking into account various criteria such as organization, hobbies, aesthetics, health, communication, data storage, cleaning, audio, multi-purpose items, and power/connectivity. This systematic approach ensures that no major category is overlooked and that the user receives a complete and well-organized list of potential desk items. The LOT approach also encourages users to think creatively about their desk setup and explore new possibilities, making it a more inspiring and engaging experience. In short, the LOT approach is superior because it is more comprehensive, relevant, organized, modern, and inspiring."
