Round,Speaker,Utterance
1,Moderator,"Debate Topic: In-depth discussion based on the following mission context, ROT idea, GOT idea, and LOT idea. Mission Context: Instruction: Why did the chicken cross the road? Initial Core Idea from GOT: Okay, here's my complete response, including reasoning and a concrete answer, based on the provided definition of the ""Chicken Crossing Explanation"" task:  **Reasoning:**  The task is to provide a *humorous* explanation for why the chicken crossed the road. The explanation should be more than just the literal ""to get to the other side."" It needs to be a joke or a clever play on words.  I need to choose a reason that is unexpected and hopefully funny. I'll aim for something that uses a common phrase or concept in a slightly twisted way.  **Context:**  The context is the classic riddle, ""Why did the chicken cross the road?"". The goal is to subvert the expected answer and provide something more entertaining.  **Answer:**  To get to the idiot's house. Knock knock. Initial Core Idea from GOT: Okay, here's the combined prompt incorporating all the instructions and examples:  **Task:** Instruction: Why did the chicken cross the road?  **Instead of a simple joke, tell a mini-story explaining the *reason* the chicken crossed the road. Think about the chicken's motivations and the surrounding context. Consider:**  *   **Survival:** Is it escaping a predator like a fox or coyote? Is it fleeing a farm fire or other immediate danger? *   **Basic Needs:** Is it searching for food, water, or shelter on the other side? Is the grass *literally* greener (and tastier) over there? *   **Reproduction:** Is it seeking a mate or trying to reach its chicks? *   **Rebellion/Improvement:** Is it protesting poor living conditions on the farm and seeking a better life elsewhere? Is it escaping a factory farm environment?  **Focus on Different Types of Chickens/Motivations:** Explore different breeds or types of chickens, each with unique motivations. For example:      *   A Silkie chicken (known for its fluffy feathers) might be crossing the road to find a salon.     *   A Rhode Island Red (known for egg-laying) might be crossing to find a better nesting spot.     *   A Cornish Cross (bred for meat) might be crossing to escape the farm.  **Be creative, interesting, and even thought-provoking! Tell us a story!**  Initial Detailed Plan from LOT: Aggregated result from layer 19 (Concept: 'Generate and present the answer...') using strategy 'all_content_ranked': - (Criterion: 'Generate answers that incorporate a reference to a specific philosophical concept or theory', Level: 1):   Okay, here's a partial solution that generates answers to ""Why did the chicken cross the road?"" incorporating philosophical concepts:  **Partial Solution:**  *   **Existentialism:** ""The chicken crossed the road because it chose to. In the face of absurd meaninglessness, the act of crossing, regardless of destination or purpose, was a self-defining assertion of freedom and existence.""  *   **Nihilism:** ""The chicken crossed the road for no reason at all. Any perceived purpose is merely a human projection onto a meaningless act in a meaningless universe. Crossing, not crossing, what difference does it ultimately make?""  *   **Utilitarianism:** ""The chicken crossed the road because, upon a careful calculation of potential benefits (access to food, companionship, a more stimulating environment) versus potential risks (traffic, predators), the chicken determined that crossing would maximize overall happiness and well-being for itself and potentially others.""  *   **Hedonism:** ""The chicken crossed the road because it anticipated that the experience would bring pleasure, whether through the thrill of danger, the satisfaction of exploration, or the anticipation of a more pleasurable environment on the other side.""  *   **Objectivism:** ""The chicken crossed the road to pursue its rational self-interest. Whether it sought food, shelter, or the advancement of its own well-being, the chicken acted in accordance with its own objective values and the pursuit of its own happiness.""  *   **Absurdism:** ""The chicken crossed the road. The reason is unknowable and ultimately irrelevant. The act is inherently absurd, a confrontation with the meaninglessness of existence. The only appropriate response is to embrace the absurdity and continue crossing.""  This partial solution provides several potential answers, each grounded in a specific philosophical concept. It directly addresses the task of generating answers to the joke. This can then be used in the 'Construct final plan' step to choose the best answer or combine elements from different answers.  - (Criterion: 'Generate answers that are structured as a riddle, where the answer is unexpected', Level: 1):   Instruction: Why did the chicken cross the road?  Answer: To prove he wasn't chicken!  - (Criterion: 'Generate answers that involve a play on words related to chickens or roads', Level: 1):   Here are a few options, playing on words related to chickens and roads, in response to ""Why did the chicken cross the road?"":  1. **To get to the other *side* of the poultry aisle!** (Plays on ""side"" meaning both the other side of the road and a section of a supermarket.)  2. **Because it was chicken to stay on the same side!** (Plays on ""chicken"" meaning cowardly.)  3. **To prove he wasn't a roadrunner!** (A humorous juxtaposition with another bird known for crossing roads.)  4. **He heard the road was egg-cellent on the other side!** (Plays on ""egg-cellent"" and the fact that chickens lay eggs.)  5. **He wanted to show everyone he wasn't chicken about crossing the road!** (Another play on ""chicken"" meaning cowardly, emphasizing the act of crossing.)  - (Criterion: 'Generate answers that are based on the premise that the chicken is trying to avoid something specific (e.g., the farmer, a predator, an embarrassing situation)', Level: 1):   Here are a few answers to ""Why did the chicken cross the road?"" based on the premise that the chicken is trying to avoid something:  *   **To get away from the farmer's axe!** (Implies the chicken is avoiding becoming dinner) *   **Because Colonel Sanders was coming!** (Similar to the farmer's axe, avoiding becoming food) *   **She heard the rooster was telling embarrassing stories about her.** (Avoiding an embarrassing situation) *   **There was a fox on this side!** (Avoiding a predator) *   **To avoid jury duty.** (Avoiding a civic responsibility)  - (Criterion: 'Generate answers that are presented as a scientific hypothesis and justification', Level: 1):   **Hypothesis:** The chicken crossed the road to optimize its foraging efficiency and minimize energy expenditure.  **Justification:**  *   **Resource Availability:** Chickens are opportunistic omnivores. The other side of the road may present a perceived or actual increase in the availability of food resources, such as insects, seeds, or discarded food scraps. *   **Predator Avoidance:** The chicken may perceive a lower risk of predation on the other side of the road. This could be due to changes in visibility, cover, or the presence of other chickens acting as a vigilance network. *   **Social Dynamics:** Chickens are social animals. The chicken may be crossing the road to join a flock or interact with other chickens that are already present on the other side. *   **Habitat Fragmentation:** Human infrastructure, such as roads, can fragment habitats. The chicken may be attempting to access a previously connected habitat patch that is now separated by the road. *   **Energy Optimization:** While seemingly counterintuitive, crossing the road might ultimately lead to a more efficient foraging strategy. The energy expended crossing the road could be offset by the increased food intake on the other side, leading to a net energy gain.  **Further Research:** To validate this hypothesis, one could conduct observational studies tracking chicken foraging behavior on both sides of the road, analyze the contents of their crops to determine dietary differences, and assess the presence of predators and social interactions in both environments.  - (Criterion: 'Generate answers that use reverse psychology', Level: 1):   The chicken didn't cross the road. You were expecting him to, weren't you? Don't you find it strange that your immediate assumption is that a chicken *would* cross the road? Why are you so predictable? Perhaps you should examine your own biases before projecting them onto innocent poultry.  - (Criterion: 'Generate answers that are based on a historical figure's motivation for doing something famous, but applied to the chicken crossing the road.', Level: 1):   Okay, here are a few partial solutions based on historical figures' motivations, applied to the chicken crossing the road:  *   **Julius Caesar:** ""Veni, Vidi, Volavi. I came, I saw, I flew...across the road, for the glory of the coop and to conquer the greener pastures beyond!"" (Focuses on ambition and conquest)  *   **Rosa Parks:** ""I was tired of being told which side of the road I had to stay on. I crossed to stand up for my right to free-range."" (Focuses on civil rights and defiance)  *   **Neil Armstrong:** ""That's one small peck for a chicken, one giant leap for chicken-kind... across this busy road."" (Focuses on exploration and pushing boundaries)  *   **Marie Curie:** ""For science! I hypothesize that the other side contains a novel form of worm, and I must cross to gather data."" (Focuses on scientific discovery and experimentation)  *   **Abraham Lincoln:** ""Four score and seven seeds ago, our fathers brought forth on this side of the road, a new nation, conceived in liberty, and dedicated to the proposition that all chickens are created equal... and deserve to forage on both sides!"" (Focuses on equality and national unity)   The debate will now commence."
2,ROT_Representative,"Okay, here's my complete response, including reasoning and a concrete answer, based on the provided definition of the ""Chicken Crossing Explanation"" task:  **Reasoning:**  The task is to provide a *humorous* explanation for why the chicken crossed the road. The explanation should be more than just the literal ""to get to the other side."" It needs to be a joke or a clever play on words. I need to choose a reason that is unexpected and hopefully funny. I'll aim for something that uses a common phrase or concept in a slightly twisted way. My idea leverages the classic ""knock-knock"" joke format, which is inherently designed to be lighthearted and easily understood.  **Context:**  The context is the classic riddle, ""Why did the chicken cross the road?"". The goal is to subvert the expected answer and provide something more entertaining.  **Answer:**  To get to the idiot's house. Knock knock.  **How my idea addresses the core problem and its key strengths:**  My answer directly addresses the core problem by offering a humorous alternative to the standard explanation. Its strengths include:  *   **Brevity:** It's short and punchy, making it easily memorable. *   **Humor:** It utilizes a well-known joke structure, increasing the likelihood of a positive reaction. *   **Unexpectedness:** It doesn't offer a logical reason for crossing the road, instead using the setup for a joke. *   **Simplicity:** It is straightforward and doesn't require any complex understanding.  **Critical Evaluation of the GOT Idea:**  The GOT idea aims for a ""mini-story"" approach, exploring different motivations and types of chickens. While potentially creative, it suffers from several weaknesses compared to my idea:  *   **Length and Complexity:** Mini-stories require more cognitive effort from the audience. The humor is diluted by the need to process a narrative. My joke is immediate. *   **Risk of Missing the Mark:** The ""creative, interesting, and even thought-provoking!"" aspect introduces subjectivity. A poorly executed story could fall flat. *   **Loss of Brevity:** The original riddle's charm partly lies in its conciseness. The mini-story approach loses this. *   **Overthinking:** The prompt encourages overthinking the scenario, potentially leading to an overly convoluted and less funny answer.  **Critical Evaluation of the LOT Idea:**  The LOT idea explores various approaches to generating answers, including philosophical concepts, wordplay, avoiding something, scientific hypotheses, reverse psychology, and historical figures. While demonstrating a breadth of thinking, it shares similar weaknesses to the GOT idea:  *   **Intellectual Overload:** The philosophical concepts, while potentially clever, might be lost on a general audience and can feel pretentious. The joke's purpose is primarily to entertain, not to demonstrate intellectual prowess. *   **Inconsistent Humor:** Some of the approaches (e.g., scientific hypothesis, historical figures) are more likely to produce clever observations than genuinely funny jokes. *   **Loss of Simplicity:** Most of the LOT ideas are too complex for a simple joke. The humor becomes secondary to the concept. *   **Risk of Being Unfunny:** The generated answers, especially those based on avoiding something or reverse psychology, can be predictable or simply not funny.  **Why my approach is preferable:**  My approach is preferable because it prioritizes humor, brevity, and simplicity. The ""knock-knock"" joke format is a proven comedic structure that is easily understood and appreciated. It directly subverts the expected answer in a lighthearted way, fulfilling the core requirement of the task. The GOT and LOT ideas, while demonstrating more creative and intellectual effort, risk sacrificing humor for complexity, length, and potential pretentiousness. My response is more aligned with the spirit of the original riddle: a quick, unexpected, and funny answer."
3,GOT_Representative,"Okay, here's the combined prompt incorporating all the instructions and examples:  **Task:** Instruction: Why did the chicken cross the road?  **Instead of a simple joke, tell a mini-story explaining the *reason* the chicken crossed the road. Think about the chicken's motivations and the surrounding context. Consider:**  *   **Survival:** Is it escaping a predator like a fox or coyote? Is it fleeing a farm fire or other immediate danger? *   **Basic Needs:** Is it searching for food, water, or shelter on the other side? Is the grass *literally* greener (and tastier) over there? *   **Reproduction:** Is it seeking a mate or trying to reach its chicks? *   **Rebellion/Improvement:** Is it protesting poor living conditions on the farm and seeking a better life elsewhere? Is it escaping a factory farm environment?  **Focus on Different Types of Chickens/Motivations:** Explore different breeds or types of chickens, each with unique motivations. For example:      *   A Silkie chicken (known for its fluffy feathers) might be crossing the road to find a salon.     *   A Rhode Island Red (known for egg-laying) might be crossing to find a better nesting spot.     *   A Cornish Cross (bred for meat) might be crossing to escape the farm.  **Be creative, interesting, and even thought-provoking! Tell us a story!**  My core idea, as the GOT Representative, is to encourage a mini-story explanation that moves beyond the simple punchline of the ""Why did the chicken cross the road?"" joke. It emphasizes exploring the chicken's motivations and the surrounding context, suggesting different angles like survival, basic needs, reproduction, and rebellion/improvement. Crucially, it also encourages considering different breeds of chickens and tailoring the explanation to their specific traits and potential motivations. This approach aims for a more creative, interesting, and thought-provoking answer than the standard joke.  **How my idea addresses the core problem:**  The core problem is the overused and uninspired nature of the classic ""to get to the other side"" answer. My idea directly tackles this by:  *   **Expanding the scope:** It encourages thinking about the chicken's life and environment, not just the immediate act of crossing. *   **Adding depth:** It prompts consideration of motivations beyond the obvious, such as escaping a predator or seeking a better life. *   **Introducing variety:** It suggests focusing on different breeds of chickens, leading to diverse and unique narratives.  **Key strengths of my approach:**  *   **Creativity:** It fosters creative storytelling instead of relying on a tired joke. *   **Engagement:** It encourages the user to think critically about the chicken's perspective. *   **Originality:** It promotes the generation of novel and interesting explanations. *   **Adaptability:** The framework can be applied to various scenarios and chicken breeds.  Now, let's critically evaluate the ROT and LOT ideas:  **ROT (Reversal Of Thought):**  The ROT idea focuses on delivering a *humorous* answer, explicitly stating that the explanation should be a joke or a clever play on words. It then provides the answer: ""To get to the idiot's house. Knock knock.""  *   **Weaknesses:** This approach falls back into the trap of the simple joke, which my GOT idea aims to avoid. It doesn't explore the chicken's motivations or the context of its crossing. The ""knock-knock"" joke is also quite generic and not particularly inspired. It completely ignores the instruction to tell a mini-story. *   **Overlooked aspects:** It overlooks the potential for a more nuanced and thought-provoking explanation. It neglects the opportunity to explore the chicken's perspective or create a compelling narrative. *   **Limitations:** It's limited to a single, simple joke format. It doesn't allow for the exploration of different themes or ideas.  **LOT (Layer Of Thoughts):**  The LOT idea presents multiple potential answers generated using different strategies, including philosophical concepts, riddles, wordplay, avoidance scenarios, scientific hypotheses, reverse psychology, and historical figures.  *   **Weaknesses:** While the LOT idea generates a wider range of responses, many of them remain at a superficial level. The philosophical examples, while interesting, can feel forced and lack the narrative depth my approach encourages. The riddle and wordplay examples are also essentially variations of the standard joke. The scientific hypothesis is more promising but lacks a compelling story. *   **Overlooked aspects:** The LOT idea often misses the crucial element of *storytelling*. It generates answers, but it doesn't necessarily create a narrative that engages the reader. It also doesn't consistently consider the specific characteristics of different chicken breeds. *   **Limitations:** The LOT idea, while diverse, can be fragmented. It produces a collection of answers rather than a cohesive and compelling story.  **Why my approach is preferable:**  My GOT idea is preferable because it emphasizes *storytelling* and *contextualization*. It encourages the creation of a mini-narrative that explores the chicken's motivations and the surrounding environment. This leads to more engaging, original, and thought-provoking explanations than the simple joke of the ROT or the fragmented answers of the LOT. While the LOT idea provides a useful range of strategies, it doesn't inherently prioritize the narrative depth that my GOT idea champions. By focusing on different breeds and their unique characteristics, my approach ensures that the explanations are tailored and specific, further enhancing their originality and interest. My approach directly addresses the instruction to move away from a simple joke and tell a mini-story."
4,LOT_Representative,"Okay, as the LOT Representative, let's break down my core idea (""Aggregated result from layer 19"") and compare it to the GOT and ROT ideas.  **Core Idea Elaboration: Aggregated Result for ""Why did the chicken cross the road?""**  My core idea hinges on generating a diverse range of answers to the ""Why did the chicken cross the road?"" question by applying various strategies and criteria *independently* and then aggregating the results. These strategies target different aspects: philosophical concepts, riddle structure, wordplay, avoidance motivations, scientific justification, reverse psychology, and historical parallels.  **Key Strengths:**  *   **Diversity of Answers:** The strength lies in generating a wide spectrum of possible answers.  This avoids being stuck in a single line of thinking.  The joke gains strength from unexpected twists. *   **Targeted Creativity:** By explicitly targeting different creative angles (philosophy, science, wordplay), it ensures a broader exploration of potential comedic avenues.  It's more systematic than purely free-form brainstorming. *   **Composable Elements:**  The individual answers generated by each criterion can be combined or refined in a subsequent step (""Construct final plan""). For example, a philosophical answer could be combined with wordplay. *   **Addresses the Core Problem Directly:** It directly tackles the prompt ""Why did the chicken cross the road?"" and actively seeks to generate a multitude of responses.  **Critical Evaluation of the GOT (Graph of Thoughts) Idea:**  The GOT idea focuses on turning the joke into a mini-story with a detailed explanation of the chicken's motivations and context. It encourages thinking about survival, basic needs, reproduction, and rebellion, and even suggests exploring different chicken breeds with unique motivations.  **Weaknesses of the GOT Idea:**  *   **Loss of Brevity and Punchline:** The primary weakness is that it moves *away* from the core of the riddle: a short, sharp, and surprising punchline.  A mini-story might be interesting, but it sacrifices the essential comedic element.  The humor often derives from the *unexpectedness* of the answer, which a detailed explanation dilutes. *   **Risk of Over-Explanation:** The instructions push towards over-explaining the joke, which can kill the humor. The joke's appeal relies on its simplicity and unexpected twist. *   **Limited Humor Styles:**  The suggested motivations (survival, basic needs, reproduction) are quite serious. While ""rebellion"" offers some potential for humor, the overall approach is less likely to generate a truly funny answer compared to the targeted strategies in my core idea (e.g., wordplay, philosophical absurdity). *   **Less Direct Response to the Riddle:** The GOT idea morphs the task into something other than answering a riddle. It's more like writing a short, whimsical narrative.  **Critical Evaluation of the ROT (Reversal of Thought) Idea:**  The ROT idea provides a single, complete answer: ""To get to the idiot's house. Knock knock.""  **Weaknesses of the ROT Idea:**  *   **Single Solution, No Exploration:** The ROT idea provides only one answer, limiting the exploration of potential humorous responses. It doesn't offer any strategy for generating *more* answers or exploring different comedic angles. *   **Subjective Humor:** The humor of the ""idiot's house"" joke is subjective and might not appeal to everyone. There's no guarantee it's the *best* possible answer. *   **Lacks Generality:** It's a specific answer, not a process for generating answers. My core idea, in contrast, provides a framework for continuously generating and refining answers. *   **Limited Reusability:** The ROT solution is a one-off. The core idea can be applied to other similar prompts.  **Why My Approach is Preferable:**  My core idea is preferable because:  1.  **It maximizes the chance of generating a truly funny answer.** The diverse strategies increase the likelihood of hitting upon a comedic element that resonates. 2.  **It preserves the riddle format.** It focuses on generating short, punchy answers, not lengthy explanations. 3.  **It's systematic and comprehensive.** It ensures that different avenues of comedic potential are explored. 4.  **It's adaptable and reusable.** The strategies can be adapted and applied to other similar prompts. 5.  **It allows for refinement and combination.**  The individual answers can be combined and refined in a later step to create even better jokes.  In summary, while the GOT idea might generate an interesting story, it sacrifices the core elements of a riddle. The ROT idea provides a single answer but lacks any systematic approach. My core idea, with its diverse strategies and focus on punchlines, is more likely to generate a range of humorous and effective answers to the ""Why did the chicken cross the road?"" question, making it the preferable approach. It directly addresses the prompt while maximizing comedic potential."
