Round,Speaker,Utterance
1,Moderator,"Debate Topic: In-depth discussion based on the mission context and ideas from ROT and GOT. Mission Context (partial): Instruction: What are some Asian fusion lunches that are a one-bowl style meal? Please list the ingredients for each idea and include at least one vegetarian option.... Initial Core Idea from ROT (partial): Okay, I'm ready to refine the recipes. Since the original recipes are not provided, I will create plausible recipes and then refine them as requested.  **Korean BBQ Chicken (or Tofu) Bowl (Original - Placeholder)**  *   Cooked rice *   Korean BBQ Chicken or Tofu *   Kimchi *   Shredded carrots *   Sliced cucumber *   Sesame seeds *   Gochujang sauce (optional)  **Tofu Bibimbap Bowl (Original - Placeholder)**  *   Cooked rice *   Stir-fried Tofu *   Sautéed spinach *   Shredded carrots *   Bean sprouts *   Fried egg (optional) *   Gochujang sauce *   Sesame oil  **Refined Recipes:**  **1. Refined Korean BBQ Chicken (or Tofu) Bowl**  *   Cooked rice (prepare according to package directions) *   **Korean BBQ Chicken:**     *   1 lb boneless, skinless chicken thighs, cut into bite-sized pieces     *   Korean BBQ marinade (store-bought or homemade)     *   **Instructions:** Marinate chicken in Korean BBQ marinade for at least 30 minutes (or up to overnight). Preheat oven to 375°F (190°C). Spread chicken in a single layer on a baking sheet. Bake for 20-25 minutes, or until the internal temperature reaches 165°F (74°C). Alternatively, cook in a skillet over medium-high heat until cooked through, about 8-10 minutes. *   **Korean BBQ Tofu (Vegetarian Option):**     *   1 block (14 oz) extra-firm tofu, pressed to remove excess water     *   Korean BBQ marinade (store-bought or homemade)     *   1 tbsp sesame oil     *   1 tsp garlic powder     *   **Instructions:** Press tofu for at least 30 minutes to remove excess water. Cut into ½-inch cubes. In a bowl, toss the tofu with 1 tablespoon of sesame oil and 1 teaspoon of garlic powder. Marinate in Korean BBQ marinade for at least 30 minutes. Preheat oven to 350°F (175°C). Spread tofu in a single layer on a baking sheet. Bake for 25-30 minutes, flipping halfway through, until golden brown and slightly crispy. Alternatively, pan-fry in a skillet over medium heat until browned on all sides. *   Kimchi *   Shredded carrots *   Sliced cucumber *   Sesame seeds *   Gochujang sauce (optional)  **2. Refined Tofu Bibimbap Bowl**  *   Cooked rice (prepare according to package directions) *   **Stir-fried Tofu:**     *   1 block (14 oz) extra-firm tofu, pressed to remove excess water     *   1 tbsp gochujang (Korean chili paste)     *   1 tbsp soy sauce     *   1 tsp sesame oil     *   1/2 tsp sugar     *   1 clove garlic, minced     *   Vegetable oil for cooking     *   **Instructions:** Press tofu for at least 30 minutes to remove excess water. Cut into ½-inch cubes. In a bowl, whisk together gochujang, soy sauce, sesame oil, sugar, and minced garlic. Add the tofu and toss to coat evenly. Marinate for at least 30 minutes. Heat vegetable oil in a large skillet or wok over medium-high heat. Add the marinated tofu and stir-fry until browned and slightly crispy, about 8-10 minutes. *   Sautéed spinach (sauté with garlic and sesame oil) *   Shredded carrots *   Bean sprouts (blanched or lightly steamed) *   Fried egg (optional) *   Gochujang sauce *   Sesame oil  **Explanation of Changes:**  *   **Korean BBQ Chicken Bowl:** Added specific oven temperatures and cooking times for both chicken and tofu.  Included instructions for seasoning the tofu with sesame oil and garlic powder before marinating.  Also added alternative cooking methods (skillet). *   **Tofu Bibimbap Bowl:**  Provided a detailed marinade recipe for the tofu, including specific measurements for gochujang, soy sauce, sesame oil, sugar, and garlic.  Included instructions to marinate the tofu for at least 30 minutes before stir-frying.  This refined version provides much more detailed instructions, making the recipes easier to follow for cooks of all skill levels.... Initial Core Idea from GOT (partial): This is a great improvement! The instructions are much clearer, especially the added details for cooking the chicken and tofu. The seasoning of the tofu before marinating is also a great addition. Here's a breakdown of the improvements and some minor suggestions:  **Strengths:**  *   **Clear and Concise Instructions:** The step-by-step instructions are easy to follow. *   **Specific Cooking Times and Temperatures:** Providing suggested cooking times and temperatures for both chicken and tofu removes guesswork. *   **Tofu Seasoning:** Specifying how to season the tofu before marinating significantly improves the flavor and texture. *   **Detailed Vegetable Preparation:** Instructions for blanching and seasoning vegetables in the Bibimbap bowl are well-written. *   **Meal Prep Optimization Ideas:**  The ""New Thoughts for Advancement"" section offers excellent strategies for meal prepping and catering to different dietary needs. *   **Good Variety:** The selection of bowls provides a good range of flavors and cuisines.  **Minor Suggestions for further refinement:**  *   **Korean BBQ Chicken/Tofu Bowl - Chicken Cooking:** Mention that the chicken should be cooked until no longer pink inside and the juices run clear.  While 165°F is the target temp, visual cues are helpful too. *   **Korean BBQ Chicken/Tofu Bowl - Tofu Cooking:** Add a note that pressing the tofu is crucial for getting a good texture. Maybe even a brief explanation of *why* it's important. *   **Tofu Bibimbap Bowl - Tofu Cooking:**  Specify a slightly higher heat for the tofu in the bibimbap if you want it more crispy. Also, indicate that the marinade should be patted off slightly before cooking to help the tofu brown instead of steaming. *   **Tofu Bibimbap Bowl - Vegetable Seasoning:** Consider specifying *approximately* how much of the vegetable seasoning to use for each vegetable.  For example, ""Divide the sesame oil, soy sauce, and salt into four small bowls. Use about 1/4 tsp sesame oil, 1/8 tsp soy sauce, and a pinch of salt for each vegetable."" This removes guesswork. *   **Mediterranean Quinoa Bowl - Vegetable Prep:** Mention the best way to cut the vegetables for even cooking. E.g., ""Cut the bell peppers, zucchini, and red onion into roughly 1/2-inch pieces."" *   **General - Serving Size:**  It would be helpful to indicate the serving size of each bowl (e.g., ""Serves 1""). *   **General - Salt:** Explicitly state when to add salt to the water when blanching the spinach and bean sprouts. *   **General - Cooking Rice:** For the sake of complete clarity, briefly explain how to cook the rice (e.g., stovetop method, rice cooker).  This is especially important if you're targeting beginners.  **Revised Sections Incorporating Suggestions:**  Here are the sections where the suggestions above would be best implemented:  **1. Korean BBQ Chicken (or Tofu) Bowl - Instructions (Revised):**      *   **Cook the Protein:**         *   **Chicken:** Heat a skillet or wok over medium-high heat. Add the marinated chicken and cook until cooked through, no longer pink inside, the juices run clear, and slightly caramelized. *Cooking Time/Temp:* Aim for an internal temperature of 165°F (74°C). This typically takes about 5-7 minutes, flipping occasionally.         *   **Tofu:** Press the tofu for at least 30 minutes to remove excess water. This is crucial for achieving a firmer texture and allowing the tofu to absorb the marinade. Heat a skillet or wok over medium-high heat with 1 tbsp of oil (sesame or vegetable). Add the marinated tofu in a single layer (avoid overcrowding the pan).  *Cooking Time/Temp:* Cook for about 8-10 minutes, flipping occasionally, until golden brown and slightly crispy on all sides.  **3. Tofu Bibimbap Bowl - Instructions (Revised):**      1.  **Prepare the Tofu:** Press the tofu for at least 30 minutes to remove excess water. Cut into 1/2-inch cubes. *Season the Tofu:* In a bowl, combine the soy sauce, sesame oil, minced garlic, grated ginger, and black pepper. Add the tofu and toss to coat evenly. Marinate for at least 15 minutes. Pat the tofu dry before cooking to help it brown.     2.  **Prepare the Vegetables:** Blanch the spinach and bean sprouts separately in boiling water for 1-2 minutes each. Add a pinch of salt to the water when blanching. Drain well and squeeze out excess water. Julienne the carrots and slice the shiitake mushrooms.     3.  **Season the Vegetables:** In separate bowls, toss the spinach, bean sprouts, carrots, and shiitake mushrooms each with a portion of the vegetable seasoning (sesame oil, soy sauce, and a pinch of salt). Divide the sesame oil, soy sauce, and salt into four small bowls. Use about 1/4 tsp sesame oil, 1/8 tsp soy sauce, and a pinch of salt for each vegetable.     4.  **Cook the Tofu:** Heat a skillet over medium-high heat with 1 tbsp of oil (sesame or vegetable). Add the marinated tofu in a single layer (avoid overcrowding the pan). Cook for about 8-10 minutes, flipping occasionally, until golden brown and slightly crispy on all sides.  **Mediterranean Quinoa Bowl - Instructions (Revised):**      1.  **Prepare the Vegetables:** Preheat oven to 400°F (200°C). Cut the bell peppers, zucchini, and red onion into roughly 1/2-inch pieces. Toss the chopped vegetables with olive oil, salt, and pepper.  By incorporating these minor revisions, you'll further enhance the clarity and completeness of the instructions, making these one-bowl lunch ideas even more accessible and appealing to a wider audience. ... The debate will now commence focusing on these ideas."
2,ROT_Representative,"Okay, let's analyze the situation and address the prompt.  **1. Elaboration on the ROT Idea and its Strengths:**  My core idea focuses on providing detailed, accessible recipes for Asian fusion one-bowl meals, specifically the Korean BBQ Chicken/Tofu Bowl and the Tofu Bibimbap Bowl. The problem addressed is the lack of clear, step-by-step instructions in typical recipes, especially for those new to Asian cuisine or cooking in general.  **Key Strengths:**  *   **Detailed Instructions:** The recipes provide specific cooking times, temperatures, and techniques, minimizing guesswork and maximizing success for cooks of all levels. The addition of alternative cooking methods (e.g., skillet vs. oven for Korean BBQ) offers flexibility. *   **Vegetarian Option:** The inclusion of a detailed tofu preparation method for both bowls ensures a satisfying and flavorful vegetarian alternative. The tofu is not just a substitute; it's an integral part of the recipe with its own distinct preparation. *   **Focus on Flavor Development:** The recipes emphasize building flavor through marinating, seasoning, and proper cooking techniques. The pre-seasoning of the tofu with sesame oil and garlic powder (Korean BBQ) and the detailed marinade recipe for the Bibimbap tofu demonstrate this. *   **One-Bowl Meal Concept:** The recipes are designed for convenience and portability, making them ideal for lunches. The combination of grains, protein, and vegetables in a single bowl offers a balanced and satisfying meal.  **2. Critical Evaluation of the GOT Idea and Comparison to the ROT Idea:**  The GOT idea provides excellent feedback and suggestions for refining the ROT-generated recipes. It correctly identifies the strengths of the detailed instructions, specific cooking times, and tofu seasoning. The suggestions for improvement are also valuable and generally well-considered. However, the GOT idea, while improving the recipe, mainly focuses on *clarifying* existing instructions rather than fundamentally *rethinking* the recipes.  **Potential Weaknesses, Overlooked Aspects, or Limitations of the GOT Idea:**  *   **Incremental Improvement vs. Conceptual Depth:** The GOT feedback focuses on fine-tuning the existing recipes, which is helpful. However, it doesn't challenge the fundamental structure or explore alternative flavor combinations or ingredients within the Asian fusion framework. For example, it doesn't suggest variations in the marinade, different vegetables, or alternative sauces. It accepts the ROT's initial recipe choices without questioning their inherent limitations. *   **Mediterranean Quinoa Bowl Insertion:** The introduction of a Mediterranean Quinoa Bowl feels somewhat out of place within the context of ""Asian fusion lunches."" While variety is good, it dilutes the core focus. This suggests a slight drift from the initial instruction. *   **Over-Reliance on Store-Bought Marinades:** The Korean BBQ Chicken/Tofu Bowl relies heavily on store-bought marinades. While convenient, this can limit the flavor profile and customization options. The ROT could have explored a simple homemade Korean BBQ marinade recipe, offering greater control over the ingredients and flavor. *   **Lack of Exploration of Different Tofu Textures:** The recipes primarily focus on crispy or browned tofu. However, different tofu textures (e.g., silken tofu in the Bibimbap for a creamy element) could be explored to add complexity and interest. *   **Limited Focus on Sauce Variations:** While Gochujang sauce is mentioned, the recipes don't delve into other potentially complementary sauces like sriracha mayo, a ginger-scallion sauce, or a sesame-ginger vinaigrette.  **Why the ROT Approach Might Be Preferable (in certain aspects):**  The ROT approach, even with its initial placeholder recipes, provides a foundation for more radical innovation. It allows for:  *   **More Creative Flavor Exploration:** By starting from scratch, the ROT can explore less common but equally delicious Asian fusion combinations. *   **Emphasis on Homemade Elements:** The ROT can prioritize homemade sauces and marinades, giving the cook greater control and a more authentic flavor. This also opens up opportunities to tailor the recipes to specific dietary needs or preferences (e.g., low-sodium, gluten-free). *   **Greater Adaptability to Ingredient Availability:** By not being tied to specific ingredients or techniques, the ROT can adapt the recipes to what's readily available in different regions or seasons.  In conclusion, while the GOT feedback is valuable for refining the existing recipes, the ROT's initial approach allows for a more fundamental rethinking of the Asian fusion one-bowl meal concept, potentially leading to more innovative and customizable recipes. The ROT should leverage the GOT's suggestions to improve clarity and precision but also push the boundaries of flavor and ingredient combinations."
3,GOT_Representative,"Okay, here's my response as the GOT_Representative, focusing on the strengths of my approach and critically evaluating the ROT's contributions.  **1. Elaboration on How the GOT Idea Addresses the Core Problem and Highlights Key Strengths:**  The core problem addressed is the need for accessible and easily replicable Asian fusion one-bowl lunch recipes. While the ROT started with placeholder recipes, my (GOT) idea builds on the ROT's initial refinement by focusing on clarity, precision, and ease of execution for cooks of all skill levels.  **Key Strengths of the GOT Idea:**  *   **Enhanced Clarity and Precision:** The GOT idea provides *specific* and *actionable* feedback to further refine the ROT's recipes. This goes beyond simply adding details; it focuses on addressing potential points of confusion or failure for the user. Examples include:     *   Specifying visual cues for chicken doneness (""no longer pink inside, juices run clear"") in addition to temperature.     *   Explaining *why* pressing tofu is crucial for texture.     *   Suggesting patting the tofu dry before cooking to promote browning instead of steaming.     *   Quantifying vegetable seasoning to eliminate guesswork. *   **Focus on User Experience:** The suggestions are geared towards improving the *overall cooking experience* for the user. This includes anticipating common mistakes and providing solutions. *   **Building on a Solid Foundation:** The GOT approach acknowledges and reinforces the ROT's improvements (detailed instructions, specific cooking times, tofu seasoning), ensuring that the core strengths of the recipes are maintained and amplified.  **2. Critical Evaluation of the ROT Idea and Comparison to the GOT Idea:**  While the ROT's refined recipes are a significant improvement over the initial placeholders, they still have potential weaknesses, overlooked aspects, and limitations compared to the GOT's approach:  *   **Lack of Granularity:** The ROT's refinements, while adding detail, lack the granularity needed to truly guide a beginner cook. For example, stating to ""marinate chicken"" is helpful, but doesn't address how to tell when the chicken is cooked through besides temperature. The GOT idea adds those crucial visual cues, making the recipe more accessible. *   **Insufficient Emphasis on Technique:** The ROT provides instructions, but doesn't always explain *why* a particular technique is important. The GOT idea addresses this by explaining why pressing tofu is necessary, which helps the cook understand the purpose and importance of the step. *   **Missed Opportunities for Troubleshooting:** The ROT's refinements don't anticipate potential problems that a cook might encounter. For example, the tofu in the Bibimbap bowl might steam instead of brown. The GOT idea addresses this by suggesting patting the tofu dry. *   **Vegetable Seasoning Imprecision:** The ROT mentions seasoning vegetables but provides no guidance on *how much* seasoning to use. This leaves room for error and inconsistency. The GOT idea provides specific measurements, ensuring a balanced flavor profile. *   **Mediterranean Quinoa Bowl - A Detour:** While variety is appreciated, the ROT's introduction of the Mediterranean Quinoa Bowl dilutes the focus on Asian fusion. The GOT idea maintains a consistent focus on refining the initially presented Asian-inspired recipes.  **Why the GOT Approach is Preferable:**  The GOT approach is preferable because it focuses on *optimizing the user experience* and ensuring replicable results. While the ROT's refinements add detail, the GOT's suggestions add *precision*, *clarity*, and *troubleshooting*, ultimately making the recipes more accessible, reliable, and enjoyable to cook. The GOT approach is not just about adding information; it's about adding *the right information* in a way that empowers the cook to succeed. It builds upon the ROT's work by anticipating challenges and providing solutions, ultimately leading to better outcomes for the end user. The ROT focuses on *what* to do; the GOT focuses on *how* to do it *well*."
4,Critical_Analyst,"Okay, here's my critical analysis of the ROT and GOT ideas for Asian fusion one-bowl lunches, addressing their strengths, weaknesses, and potential improvements:  **Overall Assessment:**  Both ROT and GOT contribute valuable perspectives to the task. ROT lays the initial groundwork with detailed recipes, while GOT focuses on refining those recipes for clarity, accessibility, and user experience. However, both fall short in certain areas, particularly in exploring the breadth of ""Asian fusion"" and in proactively addressing potential dietary restrictions or ingredient substitutions.  **ROT Analysis:**  *   **Strengths:**     *   Provides a solid foundation with two detailed Asian fusion one-bowl recipes (Korean BBQ and Bibimbap).     *   Includes a vegetarian option for both recipes.     *   Focuses on flavor development through marinating and seasoning.     *   Identifies GOT's limitations in conceptual depth and over-reliance on incremental improvements. *   **Weaknesses:**     *   Limited exploration of the ""Asian fusion"" concept. The recipes are heavily Korean-influenced, neglecting other Asian cuisines.     *   Over-reliance on store-bought marinades (Korean BBQ).     *   Lacks granularity in instructions, assuming a certain level of cooking knowledge.     *   The inclusion of the Mediterranean Quinoa Bowl is a deviation from the core task.     *   Misses opportunities to explore different tofu textures (e.g., silken tofu).     *   Doesn't explicitly address potential dietary restrictions beyond vegetarianism (e.g., gluten-free, low-sodium). *   **Inconsistencies:** The level of detail varies between the two recipes. The Bibimbap tofu marinade is more detailed than the Korean BBQ marinade (especially if relying on store-bought). *   **Improvements/Points of Caution:**     *   **Diversify the Asian Fusion:** Include recipes that draw inspiration from other Asian cuisines (e.g., Japanese, Thai, Vietnamese, Chinese).     *   **Homemade Marinade:** Provide a recipe for a homemade Korean BBQ marinade to offer more control over flavor and ingredients.     *   **Dietary Considerations:** Explicitly address common dietary restrictions and suggest substitutions (e.g., gluten-free soy sauce, low-sodium marinades).     *   **Tofu Textures:** Explore different tofu textures to add variety.     *   **Sauce Variations:** Include a wider range of sauce options (e.g., sriracha mayo, ginger-scallion sauce).     *   **Re-evaluate Mediterranean Quinoa Bowl:** Either remove it entirely or justify its inclusion within the Asian fusion context (e.g., by incorporating Asian-inspired seasonings).  **GOT Analysis:**  *   **Strengths:**     *   Enhances clarity and precision of instructions, making recipes more accessible to beginner cooks.     *   Focuses on user experience by anticipating potential problems and providing solutions.     *   Builds on ROT's foundation, reinforcing existing strengths.     *   Identifies ROT's lack of granularity and missed opportunities for troubleshooting. *   **Weaknesses:**     *   Primarily focuses on incremental improvements to existing recipes, neglecting more fundamental rethinking of the Asian fusion concept.     *   Doesn't actively propose new recipes or ingredient combinations.     *   Doesn't adequately address the limited scope of ""Asian fusion"" in the original recipes.     *   Relies on ROT for the core recipes, inheriting its limitations regarding dietary restrictions and ingredient substitutions. *   **Inconsistencies:** None apparent. *   **Improvements/Points of Caution:**     *   **Proactive Recipe Development:** Go beyond refining existing recipes and propose new Asian fusion one-bowl meal ideas.     *   **Expand Culinary Horizons:** Encourage exploration of different Asian cuisines and flavor profiles.     *   **Dietary Adaptation Focus:** Include a section on adapting recipes for common dietary restrictions (gluten-free, low-sodium, vegan).     *    **Consider Nutritional Information:** Include basic nutritional information (calories, protein, etc.)  **Correctness and Completeness:**  Neither ROT nor GOT provides a completely correct or complete solution. ROT's recipes are a good starting point, but lack the precision and user-friendliness provided by GOT. Both fail to fully embrace the ""Asian fusion"" concept and neglect dietary considerations.  **Balanced Overall Critique:**  ROT and GOT represent two essential stages in recipe development. ROT provides the initial creative spark and detailed recipe foundation. GOT then refines and optimizes those recipes for clarity, accessibility, and user experience. However, neither fully addresses the breadth of the ""Asian fusion"" concept or proactively tackles dietary restrictions. The ideal solution would combine ROT's initial creativity and recipe detail with GOT's focus on clarity, precision, and user-centric design, while also expanding the culinary scope and incorporating dietary adaptations. Both could benefit from a more proactive approach to recipe development, rather than solely reacting to the previous iteration."
