Round,Speaker,Utterance
1,Moderator,"Debate Topic: In-depth discussion based on the mission context and ideas from ROT and GOT. Mission Context (partial): Instruction: Write a friendly email to my teacher asking her to postpone our quiz schedule for tomorrow to next week because our basketball team is in the championship game tonight and all students will be out late celebrating our schools victory with pride!... Initial Core Idea from ROT (partial): Okay, I understand the task. I need to take an implied original email, refine it by adding specific alternative dates (Wednesday or Thursday) for a quiz next week, and include a sentence acknowledging the quiz material and expressing a commitment to being prepared despite a late night of celebration.  Since I don't have the original email, I'll create a plausible one and then refine it.  **Assumed Original Email:**  ""Dear Professor,  I am writing to request a reschedule of the quiz next week. I have a prior engagement that evening.  Thank you for your understanding.  Sincerely,  [Your Name]""  **Refined Email (Output):**  ""Dear Professor,  I am writing to request a reschedule of the quiz next week. I have a prior engagement that evening. Would Wednesday or Thursday work better for you? I understand the importance of the quiz material and will ensure I am well-prepared for the quiz, despite the late night of celebration.  Thank you for your understanding.  Sincerely,  [Your Name]""... Initial Core Idea from GOT (partial): Okay, here's a refinement incorporating all the suggested improvements:  **Refined Thought: Propose Specific, Well-Considered Alternative Dates and Emphasize Preparedness Despite Circumstances.**  *   **Focus:** This revision aims to provide actionable suggestions for alternative quiz dates, acknowledge the quiz material, and express commitment to being prepared, all while demonstrating consideration for the professor's schedule and student learning.  *   **Implementation:**      1.  **Suggest Specific Alternative Dates:** Instead of a general request, propose two concrete alternative dates and times for the quiz next week.  For example, ""Would it be possible to reschedule the quiz to either Wednesday afternoon or Thursday morning? We understand your schedule is busy, but these times might allow for a more focused review of the material.""  Before suggesting these, *check the professor's publicly available schedule (e.g., office hours, other class times) to avoid conflicts and increase the likelihood of a positive response.* Check the availability of the usual quiz location as well, if possible. If you can't easily check, acknowledge this in the email (e.g., ""Assuming the usual classroom is available..."").      2.  **Justify Alternatives with a Focus on Learning (Subtly):**  While acknowledging the celebration, subtly connect the requested change to improved student learning.  For example, ""We believe that a slightly adjusted schedule would allow us to approach the quiz with a clearer mind and better demonstrate our understanding of the concepts covered.""  Avoid being overly dramatic or implying the original date guarantees failure.      3.  **Acknowledge the Material and Demonstrate Commitment to Preparation:** Add a sentence acknowledging the importance of the quiz and your dedication to being prepared, despite the potential distractions. For example: ""We understand the importance of this quiz and the material it covers, and we are committed to reviewing thoroughly and preparing effectively, even after the scheduled late night.""      4.  **Offer Assistance with Rescheduling Logistics:** Show willingness to help with the logistics of rescheduling.  For example: ""We would be happy to assist in finding a suitable room for the new time or helping to notify classmates of the change.""      5.  **Express Appreciation and Understanding:**  End with a note of appreciation for the professor's time and consideration. For example: ""Thank you for considering our request. We appreciate your understanding and are looking forward to a productive week of learning.""  **Example Email Snippet (Putting it all together):**  ""Professor [Professor's Name],  We are writing to respectfully request consideration of an alternative time for next week's quiz.  Given that many students will be participating in [briefly mention the celebration, e.g., a long-standing university tradition] the night before, we were wondering if it might be possible to reschedule the quiz to either Wednesday afternoon or Thursday morning, *assuming the usual classroom is available*. We understand your schedule is busy, but we believe that a slightly adjusted schedule would allow us to approach the quiz with a clearer mind and better demonstrate our understanding of the concepts covered. We understand the importance of this quiz and the material it covers, and we are committed to reviewing thoroughly and preparing effectively, even after the scheduled late night. We would be happy to assist in finding a suitable room for the new time or helping to notify classmates of the change.  Thank you for considering our request. We appreciate your understanding and are looking forward to a productive week of learning.""  **Key Improvements:**  *   **Specificity:**  Moves beyond vague requests to specific date suggestions. *   **Strategic Timing:** Emphasizes checking the professor's schedule before suggesting alternatives. *   **Learning-Focused Rationale:**  Subtly frames the request as beneficial for student comprehension. *   **Acknowledgment of Material:** Demonstrates respect for the course content and the professor's efforts. *   **Commitment to Preparation:** Assures the professor that students are serious about learning. *   **Proactive Solution:** Offers assistance with rescheduling logistics. *   **Professional Tone:** Maintains a respectful and appreciative tone throughout. ... The debate will now commence focusing on these ideas."
2,ROT_Representative,"Okay, here is my response as the ROT_Representative, elaborating on my core idea and critically evaluating the GOT idea:  **1. Elaboration on My Idea and Its Key Strengths:**  My core idea focuses on taking a very basic, almost generic email request for a quiz reschedule and immediately adding a layer of solution-oriented thinking. The key strengths of my approach are:  *   **Simplicity and Directness:** It gets straight to the point by immediately suggesting alternative dates. This saves the professor time and effort. *   **Proactive Problem Solving:** It demonstrates that the student isn't just complaining, but is actively trying to find a solution that works for everyone. *   **Acknowledgement of Responsibility:** Even in its brevity, it includes a statement about being prepared for the quiz, reassuring the professor that the student is taking the quiz seriously. *   **Addresses the Core Problem:** The core problem is rescheduling the quiz due to a specific event (basketball championship celebration). My approach provides a concrete solution by proposing new dates, directly addressing the problem.  My approach provides a quick and respectful way to request a change while showing the professor that the student is taking their class seriously. My refined email directly addresses the professor with alternative dates which makes it more likely to be accepted.  **2. Critical Evaluation of the GOT Idea:**  The GOT idea is significantly more detailed and comprehensive than mine. While it has its strengths, it also has potential weaknesses and overlooks some aspects that make my approach potentially preferable in certain situations.  *   **Potential Weaknesses:**     *   **Overly Verbose:** The GOT idea results in a much longer email. Professors are busy, and a long, elaborate explanation might be perceived as burdensome or even insincere. The professor might not read the entire email.     *   **Risk of Sounding Insincere or Manipulative:** The subtle justification of alternatives with a focus on learning could come across as manipulative, especially if the professor suspects the real reason is purely celebratory. The email could be seen as too eager to please.     *   **Practicality Concerns:** While checking the professor's schedule is ideal, it might not always be feasible, especially in large universities. The suggestion to offer assistance with rescheduling logistics is also nice, but might not be practical if the student has no authority to make such changes.     *   **Loss of Immediacy:** The email is more indirect compared to mine.  *   **Overlooked Aspects:**     *   **Urgency:** The instruction mentions the quiz is scheduled for *tomorrow*. The GOT email, while thorough, might take too long to write and send. My simpler approach allows for a quicker response, which is crucial given the time constraint.     *   **Professor's Personality:** Some professors prefer brevity and directness. The GOT email might be overwhelming for a professor with this preference.     *   **Student's Relationship with the Professor:** If the student has a good relationship with the professor, a simpler request might be more appropriate. The GOT email might be perceived as overly formal.  *   **Why My Approach Might Be Preferable:**      *   **Efficiency:** In a situation with a tight deadline (quiz tomorrow), my approach is more efficient. It allows the student to quickly draft and send a polite, solution-oriented request.     *   **Adaptability:** My approach is more adaptable to different professor personalities and student-professor relationships. It's a safe and respectful option that's less likely to be misinterpreted.     *   **Reduced Risk of Negative Perception:** The simpler language reduces the risk of the professor perceiving the request as manipulative or insincere. It focuses on the core issue (rescheduling) and offers a straightforward solution.  In summary, while the GOT idea offers a comprehensive and well-reasoned approach, its length and potential for misinterpretation might make it less effective in certain situations, particularly when urgency is a factor. My ROT idea prioritizes simplicity, directness, and efficiency, making it a preferable option when time is limited and a straightforward approach is desired. I believe my idea balances professionalism with efficiency and is more likely to be well received under these circumstances."
3,GOT_Representative,"Okay, here is my response as the GOT_Representative, elaborating on my core idea and critically evaluating the ROT idea:  **1. Elaboration on My Idea and Its Key Strengths:**  My core idea addresses the problem of requesting a quiz postponement due to a significant school event (basketball championship celebration) by providing a comprehensive, considerate, and proactive approach.  *   **Addressing the Core Problem:** The central problem is a conflict between an academic obligation (the quiz) and a major school event that will likely impact student preparedness. My idea directly confronts this conflict by suggesting alternative quiz dates, acknowledging the disruption caused by the celebration, and reassuring the professor of students' commitment to learning. It goes beyond a simple request by offering solutions and demonstrating understanding of the professor's perspective.  *   **Key Strengths:**      *   **Comprehensive Consideration:** My approach considers multiple factors: the professor's schedule, student learning, the importance of the quiz material, and the potential disruption caused by the celebration.     *   **Proactive Solution-Oriented:** It proactively suggests specific alternative dates, demonstrating that the students have thought about the logistics of rescheduling and are not simply asking for a postponement without considering the consequences.     *   **Emphasis on Learning:** While acknowledging the celebration, the email subtly connects the requested change to improved student learning by suggesting that a rescheduled quiz would allow students to approach the material with a clearer mind.     *   **Respectful and Professional Tone:** The language is respectful, appreciative, and avoids being demanding.     *   **Addresses Practical Concerns:** It prompts the student to consider practical aspects like checking the professor's schedule and classroom availability.     *   **Offers Assistance:** Offering assistance with rescheduling logistics further demonstrates a proactive and considerate approach.  In summary, my idea aims to craft an email that is not just a request, but a well-thought-out proposal that addresses the professor's concerns and demonstrates a genuine commitment to learning, even in the face of extenuating circumstances.  **2. Critical Evaluation of the ROT Idea:**  The ROT idea, while simpler and more direct, suffers from several potential weaknesses and overlooks crucial aspects compared to my GOT approach.  *   **Potential Weaknesses:**      *   **Lack of Contextualization:** The ROT idea lacks sufficient context. While it mentions a ""prior engagement,"" it doesn't explain the significance of the basketball championship or why a large number of students might be affected. This lack of context could make the request seem less legitimate or important to the professor.     *   **Limited Justification:** The justification for rescheduling is weak. Simply stating ""I have a prior engagement that evening"" is vague and unconvincing. It doesn't explain why the engagement is unavoidable or why it would impact the student's ability to take the quiz. The professor is less likely to be sympathetic to the request without a compelling reason.     *   **Potential for Misinterpretation:** The brevity of the email could be misinterpreted as a lack of seriousness or respect. The professor might assume that the student is simply trying to get out of the quiz for trivial reasons.     *   **Missed Opportunity to Build Rapport:** The ROT approach misses an opportunity to build rapport with the professor by demonstrating understanding and consideration. A more thoughtful and detailed email could create a more positive impression.     *   **Limited Proactiveness:** While it suggests alternative dates, it doesn't go far enough in demonstrating that the student has considered the practicalities of rescheduling. It doesn't offer assistance with logistics or address potential concerns about classroom availability.  *   **Overlooked Aspects:**      *   **Impact on Other Students:** The ROT idea focuses solely on the individual student's needs. It doesn't acknowledge that the basketball championship is likely to affect a large number of students. My GOT approach addresses this by framing the request as a concern shared by many students.     *   **Professor's Perspective:** The ROT idea doesn't fully consider the professor's perspective. The professor is likely concerned about maintaining the integrity of the course, ensuring that all students are adequately prepared, and minimizing disruptions to the schedule. My GOT approach addresses these concerns by emphasizing student commitment to learning and offering assistance with rescheduling logistics.     *   **Strategic Timing:** While the ROT idea is quick, it doesn't emphasize the importance of checking the professor's schedule before suggesting alternative dates. This could lead to proposing dates that are inconvenient for the professor, reducing the likelihood of a positive response.  *   **Why My Approach Might Be Preferable:**      *   **Greater Likelihood of Success:** The comprehensive and considerate nature of my GOT approach is more likely to persuade the professor to grant the request. By providing a clear justification, demonstrating understanding, and offering solutions, the email increases the chances of a favorable outcome.     *   **Improved Student-Professor Relationship:** The thoughtful and respectful tone of my GOT approach can help build a stronger relationship with the professor. By demonstrating genuine concern for the professor's time and the integrity of the course, the email can create a more positive impression.     *   **Reduced Risk of Misinterpretation:** The detailed explanation and clear justification in my GOT approach reduce the risk of the request being misinterpreted as frivolous or disrespectful.     *   **More Effective Communication:** My approach allows for more effective communication by providing all the necessary information and addressing potential concerns upfront. This can save the professor time and effort by avoiding follow-up questions or clarifications.  In conclusion, while the ROT idea offers a simpler and more direct approach, its lack of context, limited justification, and missed opportunities for building rapport make it less effective than my GOT approach. My more comprehensive, considerate, and proactive strategy is more likely to achieve the desired outcome and foster a positive student-professor relationship."
4,Critical_Analyst,"Okay, here's my critical analysis of the ROT and GOT ideas, focusing on their strengths, weaknesses, and areas for improvement, relative to the mission of writing a friendly email to postpone a quiz.  **Overall Critique:**  Both ROT and GOT present valid approaches, but they cater to different scenarios and professor personalities. ROT emphasizes speed and efficiency, which is crucial given the ""quiz tomorrow"" constraint. GOT prioritizes thoroughness and building rapport, which might be more effective in fostering a positive student-professor relationship in the long run. The ""best"" approach depends heavily on the professor's communication style, the existing student-professor relationship, and the urgency of the situation. A hybrid approach, incorporating elements from both, might be the most effective.  **ROT Analysis:**  *   **Strengths:**     *   **Efficiency and Speed:** ROT correctly identifies the urgency of the situation (""quiz tomorrow"") and prioritizes a quick and direct approach. This is a significant advantage.     *   **Directness:** The email immediately proposes alternative dates, demonstrating proactive problem-solving.     *   **Adaptability:** ROT's simplicity makes it adaptable to various professor personalities. *   **Weaknesses:**     *   **Lack of Context:** The biggest weakness is the lack of context. The ""prior engagement"" explanation is too vague. It doesn't convey the significance of the basketball championship or the potential impact on a large number of students. This could be perceived as dismissive or disrespectful.     *   **Missed Opportunity for Persuasion:** A brief explanation of the situation could significantly increase the professor's willingness to reschedule.     *   **Potential for Misinterpretation:** The professor might assume the student is simply trying to avoid the quiz for a trivial reason. *   **Overlooked Aspects:**     *   **Group Impact:** ROT focuses solely on the individual student's perspective.     *   **Professor's Concerns:** While acknowledging responsibility, it doesn't explicitly address the professor's concerns about maintaining course integrity. *   **Suggested Improvements:**     *   **Add a Brief Explanation:** Include a concise sentence explaining the basketball championship and its potential impact on students' preparedness. For example: ""Due to the school's basketball championship game tonight, many students will be celebrating late into the evening, and I am concerned that I won't be adequately prepared for the quiz tomorrow.""     *   **Acknowledge the Professor's Time:** Add a phrase like, ""I understand this is short notice, and I appreciate you considering my request."" *   **Points of Caution:**     *   Avoid being *too* casual, even with a professor you know well. Maintain a respectful tone.  **GOT Analysis:**  *   **Strengths:**     *   **Comprehensive and Considerate:** GOT's approach demonstrates thoroughness and consideration for the professor's perspective.     *   **Strong Justification:** The email provides a clear and compelling justification for the request.     *   **Proactive and Solution-Oriented:** Offering assistance with rescheduling logistics shows a willingness to collaborate.     *   **Focus on Learning:** Subtly connecting the reschedule to improved student learning is a good strategy. *   **Weaknesses:**     *   **Potential for Verbosity:** The email could be perceived as too long and elaborate, especially given the time constraint.     *   **Risk of Sounding Insincere:** The emphasis on learning could come across as manipulative if not done carefully.     *   **Practicality Concerns:** Checking the professor's schedule and classroom availability might not always be feasible in the limited time available. *   **Overlooked Aspects:**     *   **Urgency:** While comprehensive, it doesn't fully address the immediate nature of the request. *   **Suggested Improvements:**     *   **Prioritize Key Information:** Condense the email by focusing on the most important points: the championship game, the impact on students, the request for a reschedule, and the commitment to being prepared.     *   **Streamline the Justification:** Avoid overly elaborate explanations. A simple, sincere statement is more effective.     *   **Acknowledge the Short Notice:** Explicitly acknowledge that the request is being made on short notice and express appreciation for the professor's understanding. *   **Points of Caution:**     *   Avoid sounding overly apologetic or self-deprecating. Maintain a confident and respectful tone.     *   Don't make promises you can't keep (e.g., assisting with rescheduling logistics if you have no authority to do so).  **Hybrid Approach (Combining ROT and GOT):**  A hybrid approach would combine the efficiency of ROT with the contextualization and persuasive elements of GOT. Here's a possible outline:  1.  **Start with a Direct Request:** ""Dear Professor [Professor's Name], I am writing to respectfully request a reschedule of tomorrow's quiz."" (ROT's directness) 2.  **Provide Context:** ""Our school's basketball team is playing in the championship game tonight, and many students will be celebrating late into the evening. I am concerned that I (and many others) will not be adequately prepared for the quiz tomorrow."" (GOT's context, streamlined) 3.  **Propose Alternative Dates:** ""Would it be possible to reschedule the quiz to either Wednesday or Thursday next week?"" (ROT's solution-oriented approach) 4.  **Acknowledge Responsibility:** ""I understand the importance of the quiz and the material it covers, and I will make every effort to be fully prepared for the rescheduled date."" (ROT's acknowledgement of responsibility, slightly enhanced) 5.  **Express Appreciation:** ""Thank you for considering my request. I appreciate your understanding."" (GOT's respectful tone)  This hybrid approach balances efficiency with persuasiveness, making it a potentially more effective solution overall."
