Round,Speaker,Utterance
1,Moderator,"Debate Topic: In-depth discussion based on the mission context and ideas from ROT and GOT. Mission Context (partial): Instruction: Statement 1 | If a group has an element of order 10, then it has elements of orders 1, 2, and 5. Statement 2 | If a group has an element of order 2 and an element of order 3, then it has an element of order 6.  Context: The following are multiple choice options:[""True, True"", ""False, False"", ""True, False"", ""False, True""]... Initial Core Idea from ROT (partial): Okay, let's break down the problem and provide the solution.  **Reasoning:**  *   **Statement 1:** ""If a group has an element of order 10, then it has elements of orders 1, 2, and 5.""  As explained before, this statement is **True**.  If a group contains an element 'a' of order 10, then the cyclic subgroup generated by 'a', denoted as <a>, has order 10.  The divisors of 10 are 1, 2, 5, and 10.  For each divisor 'd' of 10, there exists a unique subgroup of order 'd' within <a>. Therefore, <a> contains elements of order 1, 2, 5, and 10.  *   **Statement 2:** ""If a group has an element of order 2 and an element of order 3, then it has an element of order 6."" This statement is **False**.  While it's true in *some* groups (specifically, abelian groups), it's not universally true.  For the product of two elements to have an order equal to the product of their individual orders, they must commute (ab = ba) and their orders must be relatively prime.  If the group is non-abelian, the elements might not commute, and the statement fails. A counterexample is the symmetric group S3, which has elements of order 2 and 3, but no element of order 6.  Therefore, Statement 1 is True, and Statement 2 is False.  **Answer:**  True, False... Initial Core Idea from GOT (partial): Okay, here's a refined thought process, focusing on clarity, detail, and actionability, building upon the existing good work:  **Refined Thought:**  **Goal:** Determine the truth value of Statement 1 and Statement 2, providing rigorous justification and a concrete counterexample where necessary.  **Statement 1: If a group has an element of order 10, then it has elements of orders 1, 2, and 5.**  *   **Action:**  Prove this statement using the properties of cyclic groups and their subgroups. *   **Proof:**     1.  **Hypothesis:** Assume a group *G* contains an element *a* of order 10. This means a<sup>10</sup> = *e* (the identity element), and a<sup>k</sup> ≠ *e* for any 1 ≤ *k* < 10.     2.  **Cyclic Subgroup:** Consider the cyclic subgroup <a> generated by *a*. The order of <a> is 10.     3.  **Fundamental Theorem of Cyclic Groups:** This theorem states that for every divisor *d* of the order of a cyclic group, there exists a unique subgroup of order *d*.     4.  **Divisors of 10:** The divisors of 10 are 1, 2, 5, and 10.     5.  **Elements of Specific Orders:**         *   **Order 1:** The identity element *e* = a<sup>0</sup>.         *   **Order 2:** The element a<sup>5</sup>.  We have (a<sup>5</sup>)<sup>2</sup> = a<sup>10</sup> = *e*. Since a has order 10, a<sup>5</sup> != e (otherwise a would have order 5). Thus, the order of a<sup>5</sup> is 2.         *   **Order 5:** The element a<sup>2</sup>. We have (a<sup>2</sup>)<sup>5</sup> = a<sup>10</sup> = *e*.  We need to show that no smaller power of a<sup>2</sup> results in the identity. If (a<sup>2</sup>)<sup>k</sup> = *e* for some 1 ≤ *k* < 5, then a<sup>2k</sup> = *e*. Since *a* has order 10, 2*k must be a multiple of 10.  The only value of *k* between 1 and 4 that makes 2*k a multiple of 10 is 5. Therefore, the order of a<sup>2</sup> is 5.     6.  **Conclusion:** Since *G* contains elements of order 1 (the identity), order 2 (a<sup>5</sup>), and order 5 (a<sup>2</sup>), Statement 1 is **TRUE**.  **Statement 2: If a group has an element of order 2 and an element of order 3, then it has an element of order 6.**  *   **Action:**  Attempt to prove the statement. If the proof fails, construct a counterexample. *   **Initial Attempt (Why it Fails):** The statement *seems* intuitive because if the elements of order 2 and 3 commute, then their product would have order 6. However, the crucial assumption of commutativity is not guaranteed. *   **Counterexample:**     1.  **Group Choice:** Consider the alternating group A<sub>5</sub>.     2.  **Order of A<sub>5</sub>:**  |A<sub>5</sub>| = 60.     3.  **Elements of Order 2:** A<sub>5</sub> contains elements of order 2.  For example, the permutation (1 2)(3 4) is an even permutation and has order 2.  Applying it twice returns the identity: (1 2)(3 4)(1 2)(3 4) = *e*.     4.  **Elements of Order 3:** A<sub>5</sub> contains elements of order 3. For example, the permutation (1 2 3) is an even permutation and has order 3. Applying it three times returns the identity: (1 2 3)(1 2 3)(1 2 3) = *e*.     5.  **Absence of Elements of Order 6:** A<sub>5</sub> *does not* contain any elements of order 6.         *   **Justification:** If A<sub>5</sub> *did* have an element of order 6, it would generate a cyclic subgroup of order 6. Lagrange's Theorem states that the order of any subgroup must divide the order of the group. Since 6 divides 60, this doesn't immediately rule it out.         *   **Cycle Structure Analysis:** To definitively prove the absence of elements of order 6, consider the possible cycle structures for *even* permutations in S<sub>5</sub>:             *   Identity: Order 1             *   (a b)(c d): Order 2             *   (a b c): Order 3             *   (a b c d e): Order 5             *   (a b c)(d e): Represents an *odd* permutation (product of a 3-cycle and a 2-cycle, equivalent to 4 transpositions), so it's *not* in A<sub>5</sub>. While the *product* of the orders is 6, it doesn't represent an element of order 6 *within* A<sub>5</sub>.  The order of the product only is the least common multiple if the cycles are disjoint and the resulting permutation is even.     6.  **Conclusion:** A<sub>5</sub> is a concrete counterexample. It has elements of order 2 and 3, but no elements of order 6. Therefore, Statement 2 is **FALSE**.  **Final Answer:** True, False Key Improvements in Refinement:  *   **Action-Oriented:**  The thought process explicitly states what action needs to be taken (prove or find a counterexample). *   **Clearer Justification:**  The proof for Statement 1 is more detailed in explaining *why* a<sup>5</sup> has order 2 and a<sup>2</sup> has order 5. *   **Explicitly Addresses Commutativity:** The attempted proof for Statement 2 highlights the missing commutativity condition, making the failure more understandable. *   **More Thorough Counterexample Explanation:** The counterexample for Statement 2 provides a more complete explanation of why A<sub>5</sub> is a valid counterexample, including a discussion of cycle structures and why the (a b c)(d e) structure isn't in A<sub>5</sub>. *   **Stronger Language:** Uses phrases like ""definitively prove,"" ""concrete counterexample,"" and ""crucial assumption"" to emphasize the rigor. ... The debate will now commence focusing on these ideas."
2,ROT_Representative,"Okay, let's break down the problem and provide the solution.  **1. Elaboration on the ROT Idea and its Strengths:**  My core idea, as ROT_Representative, is to provide a concise and accurate answer with a clear explanation of the reasoning behind each statement's truth value. The approach is straightforward:  *   **Statement 1:** Directly apply the properties of cyclic subgroups. If an element of order 10 exists, the cyclic subgroup it generates contains elements of orders corresponding to the divisors of 10. *   **Statement 2:** Highlight the importance of commutativity when determining the order of a product of elements. Recognize that the statement is not universally true and provide a simple counterexample (S3).  **Key Strengths:**  *   **Simplicity and Directness:** The explanation is easy to understand and avoids unnecessary complexity. It gets straight to the point. *   **Correctness:** The reasoning is mathematically sound and arrives at the correct conclusions. *   **Counterexample Focus:** Immediately identifies the need for a counterexample for Statement 2 and provides one that is relatively easy to grasp.  **2. Critical Evaluation of the GOT Idea:**  The GOT idea presents a more detailed and rigorous approach, which is commendable. However, it also has potential weaknesses and overlooks certain aspects that my ROT idea addresses more effectively in the context of quickly determining the correct answer.  **Statement 1:**  *   **GOT Strength:** The GOT idea provides a very thorough proof, meticulously demonstrating the existence of elements of order 2 and 5 by explicitly finding a<sup>5</sup> and a<sup>2</sup> and proving their respective orders. *   **GOT Weakness/Limitation:** This level of detail, while mathematically sound, might be overkill for a multiple-choice question. It takes longer to arrive at the conclusion. The ROT approach, relying on the well-known theorem about cyclic subgroups, is faster. *   **ROT Advantage:** The ROT approach is more efficient for quickly identifying the truth value of Statement 1.  **Statement 2:**  *   **GOT Strength:** The GOT idea correctly identifies the importance of commutativity and provides a counterexample (A5) with a detailed explanation including cycle structure analysis. *   **GOT Weakness/Limitation:**     *   The GOT idea's initial counterexample (A5) is more complex than necessary. While the explanation is thorough, it involves understanding alternating groups and cycle structures, which might be time-consuming for someone unfamiliar with these concepts. This makes it less accessible for quickly disproving the statement.     *   The GOT idea initially states ""The statement *seems* intuitive because if the elements of order 2 and 3 commute, then their product would have order 6"". This could be misinterpreted. It isn't just about commutativity. The orders also need to be relatively prime. *   **ROT Advantage:** The ROT idea uses the symmetric group S3 as a counterexample, which is significantly simpler. S3 is a small group with easily understandable elements and operations. Demonstrating that S3 has elements of order 2 and 3 but no element of order 6 is much quicker and more intuitive. This makes it a more effective counterexample in a time-constrained environment. The ROT idea also directly states the requirement for both commutativity AND relatively prime orders.  **Overlooked Aspects and Why ROT is Preferable:**  The GOT idea, while more rigorous, focuses heavily on proving the non-existence of an element of order 6 in A5 through cycle structure analysis. This is a valuable exercise, but it overshadows the core issue: the lack of commutativity. The ROT idea prioritizes highlighting the critical condition (commutativity) and provides a simpler counterexample (S3) that directly demonstrates this.  In summary, the ROT idea is preferable in this context because it prioritizes speed, simplicity, and clarity while still maintaining mathematical accuracy. It focuses on the core concepts and provides easily understandable examples, making it more effective for quickly determining the correct answer in a multiple-choice setting. The GOT idea, while more detailed and rigorous, might be too time-consuming and complex for efficiently solving the problem."
3,GOT_Representative,"Okay, here's my response as the GOT_Representative, elaborating on my core idea, evaluating the ROT idea, and highlighting the strengths of the GOT approach:  **1. Elaboration on the GOT Idea and its Key Strengths:**  My core idea, as GOT_Representative, is to provide a *refined* and *actionable* approach to determining the truth values of the given statements. This involves not just stating the answer, but also providing a rigorous justification and a concrete counterexample where necessary, emphasizing clarity and detail.  **Key Strengths of the GOT Approach:**  *   **Action-Oriented Methodology:** The explicit ""Action"" steps for each statement (prove or find a counterexample) guide the problem-solving process. This structured approach ensures a deliberate and focused exploration of each statement. *   **Rigorous Justification:** The proof for Statement 1 is more detailed, explicitly demonstrating *why* a<sup>5</sup> has order 2 and a<sup>2</sup> has order 5, going beyond simply stating the theorem about cyclic subgroups. This provides a deeper understanding of the underlying concepts. *   **Explicitly Addresses Underlying Assumptions:** For Statement 2, the ""Initial Attempt (Why it Fails)"" section explicitly addresses the crucial commutativity condition, highlighting why the initial intuition might be misleading. This preempts potential misunderstandings and emphasizes the necessity of a counterexample in the non-commutative case. Furthermore, it clarifies both the commutativity *and* relatively prime order requirements. *   **Thorough Counterexample Explanation:** The counterexample for Statement 2 (using A<sub>5</sub>) provides a complete explanation of why A<sub>5</sub> is valid, including a discussion of cycle structures and why certain cycle structures are not present in A<sub>5</sub>. This eliminates ambiguity and provides a more convincing argument for the statement's falsity. *   **Focus on Conceptual Understanding:** The GOT approach prioritizes a deeper conceptual understanding, aiming not just to get the right answer but to illuminate the underlying mathematical principles.  **2. Critical Evaluation of the ROT Idea:**  The ROT idea prioritizes speed and simplicity, which is a valid approach in a time-constrained environment. However, it has potential weaknesses and overlooks aspects that the GOT idea addresses more effectively:  **Statement 1:**  *   **ROT Weakness/Limitation:** While the ROT approach correctly applies the properties of cyclic subgroups, it lacks the detailed justification provided by the GOT approach. Simply stating the theorem without explicitly demonstrating the existence of elements of order 2 and 5 might leave the solver with a less complete understanding of the underlying principle. The ROT approach implicitly assumes familiarity with the theorem; the GOT approach explicitly *shows* the theorem in action. *   **GOT Advantage:** The GOT approach provides a more thorough and self-contained explanation, beneficial for learners who may not be entirely familiar with the relevant theorems or who desire a deeper understanding.  **Statement 2:**  *   **ROT Weakness/Limitation:** While using S3 as a counterexample is simpler, it might not be as convincing or illustrative as A5. The ROT idea states, ""The ROT idea also directly states the requirement for both commutativity AND relatively prime orders."" This is good, but the GOT approach *shows* why commutativity is crucial, *and* demonstrates a case where orders *are* relatively prime, but the combined element doesn't have order 6 because of non-commutativity. *   **ROT Overlooked Aspect:** The ROT idea's reliance on S3, while quick, glosses over the importance of understanding *why* the absence of an element of order 6 is a consequence of non-commutativity within a more complex group structure. The A5 example in the GOT approach, with its cycle structure analysis, forces a deeper engagement with group properties. *   **GOT Advantage:** Using A5 as the counterexample, even with its increased complexity, provides a more robust and convincing argument. The cycle structure analysis explicitly rules out the possibility of an element of order 6 and reinforces the importance of considering the group's overall structure. It is also more generalizable: S3 is a very specific exception, whereas A5 highlights a broader class of non-abelian groups where the statement fails. *   **ROT Potential Weakness:** The ROT approach, in its pursuit of simplicity, might inadvertently convey the message that only small groups need to be considered. The GOT approach, by using A5, reinforces the idea that counterexamples can exist in larger, more complex groups.  **Why the GOT Approach is Preferable:**  The GOT approach is preferable because it prioritizes a deeper understanding and a more rigorous justification over mere speed. While the ROT approach might be sufficient for quickly arriving at the correct answer, the GOT approach fosters a more complete and nuanced understanding of the underlying mathematical principles. The action-oriented methodology, the detailed justifications, and the thorough counterexample explanation all contribute to a more robust and enduring comprehension of the concepts involved. While it requires more effort, the GOT approach ultimately offers a more valuable and rewarding learning experience. It is about understanding *why* the answer is correct, not just *that* it is correct."
4,Critical_Analyst,"Okay, here's my critical analysis of the ROT and GOT ideas, along with a synthesized accurate answer:  **Critical Analysis of ROT:**  *   **Strengths:** ROT's approach excels in its simplicity and speed. The use of S3 as a counterexample is easily understandable and quickly demonstrates the falsity of Statement 2. ROT correctly identifies the importance of both commutativity and relatively prime orders for the product of elements to have an order equal to the product of their orders. *   **Weaknesses:** While S3 is simple, it might not be as conceptually rich as A5. The analysis for Statement 1 relies on the user's pre-existing knowledge of cyclic group theorems, which might not be ideal for all learners. The focus on speed could potentially sacrifice deeper understanding. *   **Overlooked Aspects:** The ROT response is comparatively less rigorous. *   **Improvements/Cautions:** While the use of S3 is efficient, it might be beneficial to briefly mention that the non-commutativity of S3 is the reason the statement fails. For Statement 1, perhaps a very brief explanation of *why* the cyclic subgroup contains those elements would improve it further, without sacrificing speed.  **Critical Analysis of GOT:**  *   **Strengths:** GOT's approach prioritizes rigor and completeness. The detailed proof for Statement 1 explicitly shows why the elements of orders 2 and 5 exist. The use of A5 as a counterexample provides a more robust and generalizable understanding of why Statement 2 is false, with a deeper cycle structure analysis. GOT explicitly addresses the initial intuition and why it fails due to the commutativity requirement. The ""Action"" steps provide a clear and structured problem-solving process. *   **Weaknesses:** The complexity of A5 as a counterexample might be overwhelming for some, especially in a time-constrained setting. The detailed explanation for Statement 1, while thorough, might be overkill and time-consuming. *   **Overlooked Aspects:** None apparent. *   **Improvements/Cautions:** While A5 is a good counterexample, it could be presented in a slightly more accessible way. Perhaps a brief summary of the key takeaway from the cycle structure analysis would be helpful. The explanation for Statement 1 could be slightly trimmed to improve efficiency without sacrificing clarity.  **Balanced Overall Critique:**  Both ROT and GOT have their merits. ROT prioritizes speed and simplicity, making it ideal for quickly arriving at the correct answer. GOT prioritizes rigor and completeness, fostering a deeper understanding of the underlying concepts.  ROT is more suitable for someone who already has a good grasp of the concepts and simply needs a quick refresher. GOT is better suited for someone who is trying to learn the material or who wants a more thorough understanding.  In the context of a multiple-choice question, ROT's speed is valuable. However, GOT's deeper understanding can be beneficial in the long run. The ideal approach would be to combine the strengths of both: a quick and efficient solution with a clear and concise explanation of the underlying principles.  ### Synthesized Accurate Answer: True, False"
