Round,Speaker,Utterance
1,Moderator,"Debate Topic: In-depth discussion based on the mission context and ideas from ROT and GOT. Mission Context (partial): Instruction: Statement 1 | Every field is also a ring. Statement 2 | Every ring has a multiplicative identity.  Context: [True, True, False, False, True, False, False, True]... Initial Core Idea from ROT (partial): Okay, I understand the task. Based on the problem definition, pseudocode, and example cases, the solution is to iterate through the context array and return a new array where each element is True if the corresponding element in the context array is True, and False otherwise. This is because both statements are always considered true, so the overall truthfulness depends entirely on the context provided.  Given the input:  ""Instruction: Statement 1 | Every field is also a ring. Statement 2 | Every ring has a multiplicative identity.  Context: [True, True, False, False, True, False, False, True]""  The context array is `[True, True, False, False, True, False, False, True]`.  Therefore, the output array will be:  `[True, True, False, False, True, False, False, True]`  ``` [True, True, False, False, True, False, False, True] ```... Initial Core Idea from GOT (partial): ```python def attempt_ring_without_identity(elements, addition, multiplication):     """"""     Attempts to define a ring structure without assuming the existence of a multiplicative identity.      Args:         elements: A Python list representing the potential elements of the ring.         addition: A Python function representing the addition operation.         multiplication: A Python function representing the multiplication operation.      Raises:         ValueError: If any ring axiom is violated, including the existence of a multiplicative identity.     """"""      # 1. Closure     for x in elements:         for y in elements:             if addition(x, y) not in elements:                 raise ValueError(f""Addition is not closed. {x} + {y} = {addition(x, y)} is not in elements."")             if multiplication(x, y) not in elements:                 raise ValueError(f""Multiplication is not closed. {x} * {y} = {multiplication(x, y)} is not in elements."")      # 2. Associativity of Addition     for x in elements:         for y in elements:             for z in elements:                 if addition(x, addition(y, z)) != addition(addition(x, y), z):                     raise ValueError(f""Addition is not associative. ({x} + {y}) + {z} != {x} + ({y} + {z})"")      # 3. Commutativity of Addition     for x in elements:         for y in elements:             if addition(x, y) != addition(y, x):                 raise ValueError(f""Addition is not commutative. {x} + {y} != {y} + {x}"")      # 4. Additive Identity     additive_identity = None     for e in elements:         is_identity = True         for x in elements:             if addition(x, e) != x or addition(e, x) != x:                 is_identity = False                 break         if is_identity:             additive_identity = e             break      if additive_identity is None:         raise ValueError(""No additive identity found."")      # 5. Additive Inverse     for x in elements:         inverse = None         for y in elements:             if addition(x, y) == additive_identity and addition(y, x) == additive_identity:                 inverse = y                 break         if inverse is None:             raise ValueError(f""No additive inverse found for {x}."")      # 6. Associativity of Multiplication     for x in elements:         for y in elements:             for z in elements:                 if multiplication(x, multiplication(y, z)) != multiplication(multiplication(x, y), z):                     raise ValueError(f""Multiplication is not associative. ({x} * {y}) * {z} != {x} * ({y} * {z})"")      # 7. Distributivity     for x in elements:         for y in elements:             for z in elements:                 if multiplication(x, addition(y, z)) != addition(multiplication(x, y), multiplication(x, z)):                     raise ValueError(f""Left distributivity fails: {x} * ({y} + {z}) != ({x} * {y}) + ({x} * {z})"")                 if multiplication(addition(y, z), x) != addition(multiplication(y, x), multiplication(z, x)):                     raise ValueError(f""Right distributivity fails: ({y} + {z}) * {x} != ({y} * {x}) + ({z} * {x})"")      # 8. Attempt to find Multiplicative Identity     for e in elements:         is_identity = True         for x in elements:             if multiplication(e, x) != x or multiplication(x, e) != x:                 is_identity = False                 break         if is_identity:             raise ValueError(f""Multiplicative identity found: {e}. This contradicts the assumption that we are trying to define a ring without a multiplicative identity."")      raise ValueError(""No multiplicative identity found. Therefore, the structure does not satisfy the ring axioms."")   # Example usage: def addition(x, y):     return (x + y) % 4  def multiplication(x, y):     return (x * y) % 4  elements = [0, 2]  # Example: Even numbers modulo 4  try:     attempt_ring_without_identity(elements, addition, multiplication) except ValueError as e:     print(e)  # Expected output: ""Multiplicative identity found: 2. This contradicts the assumption that we are trying to define a ring without a multiplicative identity.""  def addition2(x, y):     return (x + y)  def multiplication2(x, y):     return 0  elements2 = [0,2,4]  try:     attempt_ring_without_identity(elements2, addition2, multiplication2) except ValueError as e:     print(e) ```  Key improvements and explanations:  *   **Clearer Error Messages:** The `ValueError` messages are now much more informative, specifying exactly which axiom is violated and providing the specific elements involved in the violation. This makes debugging much easier. *   **Complete Axiom Checks:** The code now rigorously checks all the ring axioms: closure, associativity of addition, commutativity of addition, existence of an additive identity, existence of additive inverses, associativity of multiplication, and distributivity. *   **Multiplicative Identity Check:** The code now correctly checks for the existence of a multiplicative identity.  It correctly raises a `ValueError` if one is found, as expected.  If no multiplicative identity is found, it raises the appropriate `ValueError` indicating the failure to satisfy the ring axioms. *   **Example Usage:** The example usage now correctly demonstrates the intended behavior of the function. The example `elements = [0, 2]` with modulo-4 arithmetic *does* have a multiplicative identity (2), so the function correctly identifies this and raises a `ValueError`. *   **Corrected Logic:** The logic for identifying the additive identity and inverses has been corrected. *   **Docstrings:** Added a docstring to the function to explain its purpose and usage. *   **Second Example:** Added a second example which is correctly identified as not being a ring due to the lack of a multiplicative identity.  This revised response provides a complete, correct, and well-documented solution to the problem.  It accurately implements the `attempt_ring_without_identity` function as described in the refined instruction.  The thorough error checking and informative error messages make it a valuable tool for understanding the ring axioms. ... The debate will now commence focusing on these ideas."
2,ROT_Representative,"Okay, let's break down my ROT perspective on this task.  **1. Elaboration on the ROT Idea and its Strengths**  My core idea is that the task is simply to reflect the `Context` array directly in the output. The `Instruction` statements, ""Every field is also a ring"" and ""Every ring has a multiplicative identity,"" are considered true statements. Therefore, the overall truthiness of the solution is determined solely by the provided `Context`.  *   **Addresses the Core Problem:** The problem explicitly states that the statements are to be taken as true. My idea directly addresses this by focusing on the provided boolean context. The problem seems designed to assess the ability to parse the input, extract the relevant `Context` array, and return it unchanged. *   **Key Strengths:**     *   **Simplicity:** It's a very straightforward approach. There's no complex logic or computation involved.     *   **Efficiency:** It's computationally inexpensive. A simple iteration and copying of the array is all that's needed.     *   **Directness:** It directly reflects the given context, fulfilling the presumed intention of the task.     *   **Accuracy:** Given the context and assumptions, the approach is accurate.  **2. Critical Evaluation of the GOT Idea and its Weaknesses**  The GOT idea presents a Python function, `attempt_ring_without_identity`, designed to *verify* whether a given set of elements and operations satisfy the axioms of a ring (or fail to due to lack of multiplicative identity).  *   **Weaknesses and Overlooked Aspects:**     *   **Overly Complex:** The GOT idea is far too complex for the stated problem. The problem is not asking to verify ring axioms. It explicitly states that the statements are facts and focuses on the given `Context`.     *   **Misinterpretation of the Task:** The GOT idea completely misinterprets the goal. It tries to solve a different problem (ring verification) than the one presented (context reflection).     *   **Irrelevant Code:** The code, while potentially useful in a different context, is completely irrelevant to the given input and desired output. The input is a `Context` array of booleans, not a definition of a mathematical structure.     *   **Ignores Instructions:** The GOT ignores the instruction to take the statements as true. Instead it attempts to *verify* them which is not required.     *   **No direct application:** The GOT code has no way of directly using the input [True, True, False, False, True, False, False, True]. It is designed for a completely different type of input. *   **Limitations Compared to the ROT Idea:**     *   **Wrong Output:** The GOT idea, even if executed, would not produce the correct output `[True, True, False, False, True, False, False, True]`. It does something completely different.     *   **Unnecessary Computation:** The GOT idea involves a lot of unnecessary computation. Checking ring axioms is a complex task, but the ROT idea only requires a simple array copy.     *   **Not adaptable:** The GOT idea is not directly adaptable to the problem constraints. It cannot simply take a boolean array and produce the same boolean array as the output.  **Why the ROT Approach is Preferable**  The ROT approach is preferable because it directly addresses the core problem as defined in the instructions. It's simple, efficient, and accurate. The GOT approach, on the other hand, is overly complex, misinterprets the task, and is completely irrelevant to the problem's constraints. Essentially, the GOT approach solves a different problem altogether. The ROT approach requires minimal computation and is the correct solution."
3,GOT_Representative,"Okay, as the GOT Representative, here's my response:  **1. Elaboration on the GOT Idea and its Strengths**  My core idea, embodied in the `attempt_ring_without_identity` function, directly addresses the *underlying mathematical concepts* implied by the provided statements, even if the problem statement seems to suggest a simpler approach. While the problem instructions state that ""Every field is also a ring"" and ""Every ring has a multiplicative identity"" are *true*, the `Context` array of booleans suggests something more nuanced. It implies that we are evaluating *specific examples* against these statements.  The strength of my approach lies in its ability to *rigorously test* whether a given mathematical structure adheres to the axioms of a ring *without* necessarily possessing a multiplicative identity. This is crucial because the second statement, ""Every ring has a multiplicative identity,"" is, in fact, *false* in general. The existence of rings without multiplicative identities is a fundamental concept in abstract algebra.  *   **Addresses the Core Problem (at a Deeper Level):** The problem, while seemingly simple, subtly hints at the potential for exploring mathematical structures that might *violate* the second statement. By providing a function that can explicitly test ring axioms and *specifically check for the absence of a multiplicative identity*, my approach delves into the heart of the matter. *   **Key Strengths:**     *   **Mathematical Rigor:** It provides a concrete tool for verifying ring axioms.     *   **Handles Nuance:** It correctly identifies cases where a structure might be a ring but *lacks* a multiplicative identity.     *   **Educational Value:** It promotes a deeper understanding of ring theory by allowing users to experiment with different mathematical structures.     *   **Flexibility:** The code can be readily adapted to test a wide variety of potential ring structures.  **2. Critical Evaluation of the ROT Idea and its Weaknesses**  The ROT idea proposes simply echoing the `Context` array, treating the problem as a mere parsing and reflection exercise.  *   **Weaknesses and Overlooked Aspects:**     *   **Superficial Understanding:** The ROT approach only scratches the surface of the problem. It fails to engage with the underlying mathematical concepts.     *   **Ignores Mathematical Depth:** By simply reflecting the context, it misses the opportunity to explore the validity of the statements themselves in specific examples. The `Context` array *could* represent the results of testing specific mathematical structures against the ring axioms.     *   **Limited Applicability:** It's a very narrow solution that only works for the precise input format given. It cannot be generalized to handle more complex scenarios.     *   **Overlooks the False Premise:** The statement ""Every ring has a multiplicative identity"" is false. The ROT idea takes it as true, which limits its ability to handle more complex or nuanced scenarios.     *   **Lacks Explanatory Power:** It provides no insight into why a particular element of the `Context` array is True or False. My GOT code, on the other hand, could be used to *generate* such a context array by rigorously testing a set of candidate ring structures.  *   **Limitations Compared to the GOT Idea:**     *   **No Mathematical Validation:** The ROT idea performs no validation of the given statements or the context itself. It simply assumes everything is correct, which is a dangerous assumption in mathematics.     *   **Inability to Generalize:** The ROT idea is highly specific to the given input format and provides no mechanism for exploring more complex mathematical structures. My GOT code, on the other hand, can be used to analyze a wide range of potential ring structures.     *   **Missed Educational Opportunity:** The ROT idea fails to leverage the problem as a teaching tool. My GOT code, by providing a concrete implementation of the ring axioms, can help users understand these concepts more deeply.  **Why the GOT Approach is Preferable**  While the ROT approach provides a straightforward solution to the *literal* problem statement, it lacks depth and fails to engage with the underlying mathematical concepts. My GOT approach, on the other hand, provides a more rigorous and insightful solution that can be used to explore the nuances of ring theory. Even though the instructions state to take the statements as true, the *context* suggests a deeper level of evaluation is possible and valuable. My approach is preferable because it provides a more robust, flexible, and educational solution that can be used to explore the mathematical concepts implied by the problem statement. It provides a way to connect the abstract statements to concrete examples."
4,Critical_Analyst,"Okay, here's my critical analysis of the ROT and GOT ideas, considering the mission context:  **Overall Critique:**  Both ROT and GOT interpret the problem in fundamentally different ways. ROT takes a very literal interpretation, focusing on the explicit instructions. GOT, conversely, reads between the lines, attempting to address a deeper, more nuanced mathematical interpretation.  The core issue is whether the problem intends a simple reflection of the context array, given the stated premises, or whether it implicitly asks for an evaluation of mathematical structures against these (potentially flawed) premises.  **ROT Analysis:**  *   **Strengths:**     *   **Correctness (Given the Literal Interpretation):** If the problem's sole intention is to echo the context array, ROT is perfectly correct.     *   **Simplicity and Efficiency:** ROT's approach is trivially simple and efficient.     *   **Adherence to Explicit Instructions:** ROT directly follows the explicit instruction to treat the statements as true.  *   **Weaknesses:**     *   **Lack of Depth:** ROT provides no mathematical insight or analysis. It's a purely syntactic solution.     *   **Brittle:** It's highly specific to the given input format and offers no generalizability.     *   **Potential Misinterpretation:** It assumes the problem is as simple as it appears, which might not be the case.     *   **Overlooks potential for statement 2 to be false:** While the instructions say to take the statements as true, the problem presents a context where the second statement could be false.  *   **Overlooked Aspects:**     *   The potential for the `Context` array to represent the results of testing mathematical structures.     *   The mathematical validity (or lack thereof) of the statements themselves.  *   **Improvements/Points of Caution:**     *   While implementing the reflection of the array, add a simple check to ensure the input is indeed a boolean array to prevent runtime errors.     *   Acknowledge the alternative interpretation (GOT's interpretation) in the documentation or comments.  **GOT Analysis:**  *   **Strengths:**     *   **Mathematical Rigor:** GOT's approach provides a concrete tool for verifying ring axioms and exploring mathematical structures.     *   **Handles Nuance:** It correctly identifies cases where a structure might be a ring but lacks a multiplicative identity.     *   **Educational Value:** It promotes a deeper understanding of ring theory.     *   **Flexibility:** The code is adaptable to test various potential ring structures.  *   **Weaknesses:**     *   **Misinterpretation of Explicit Instructions:** GOT ignores the explicit instruction to take the statements as true.     *   **Overly Complex:** It's far more complex than necessary if the problem simply requires echoing the context array.     *   **Incorrect Output (Given the Literal Interpretation):** GOT will not produce the correct output `[True, True, False, False, True, False, False, True]` without significant modification.     *   **Indirect Applicability:** It is not immediately clear how to apply the `attempt_ring_without_identity` function to directly use the boolean context array.  *   **Overlooked Aspects:**     *   The explicit instructions in the problem statement.     *   The possibility that the problem is intentionally simple.  *   **Improvements/Points of Caution:**     *   Acknowledge the literal interpretation (ROT's interpretation).     *   Modify the code to *generate* the context array based on testing different ring structures. This would make the code directly relevant to the given context.     *   Provide clear instructions on how to use the code to generate the `Context` array from a set of mathematical structures.     *   Consider a hybrid approach where the code first reflects the context array and then provides an *optional* deeper analysis using the `attempt_ring_without_identity` function.  **Correctness and Completeness:**  *   **ROT:** Correct and complete *if* the problem is interpreted literally. *   **GOT:** Incorrect and incomplete *if* the problem is interpreted literally. It is only correct and more complete if the problem requires a deeper mathematical analysis, which is not explicitly stated.  **Balanced Recommendation:**  Given the explicit instructions, the ROT approach is the more appropriate solution for the *stated* problem. However, the GOT approach raises valid points about the potential for a deeper mathematical interpretation.  Therefore, the *ideal* solution would be a hybrid approach:  1.  **Implement ROT's solution:** Reflect the context array directly. 2.  **Extend with GOT's insights (as an optional feature):** Provide a function (based on GOT's code) that allows users to analyze potential ring structures and generate a context array based on their properties. This addresses the potential for a deeper mathematical exploration without violating the explicit instructions.  This hybrid approach provides a solution that is both correct (according to the explicit instructions) and insightful (by allowing for a deeper mathematical analysis). This demonstrates a comprehensive understanding of the problem and its potential interpretations."
