Round,Speaker,Utterance
1,Moderator,"Debate Topic: In-depth discussion based on the following mission context, ROT idea, GOT idea, and LOT idea. Mission Context: Instruction: Find all zeros in the indicated finite field of the given polynomial with coefficients in that field. x^5 + 3x^3 + x^2 + 2x in Z_5  Context: The following are multiple choice options:[0, 1, 0,1, 0,4] Initial Core Idea from GOT: Okay, let's break down the problem and find the roots of the polynomial x^5 + 3x^3 + x^2 + 2x in the finite field Z_5.  We need to evaluate the polynomial for each element in Z_5 (which are 0, 1, 2, 3, and 4) and check if the result is congruent to 0 modulo 5.  *   **r = 0:** P(0) = 0^5 + 3(0)^3 + 0^2 + 2(0) = 0.  0 mod 5 = 0. So, 0 is a root.  *   **r = 1:** P(1) = 1^5 + 3(1)^3 + 1^2 + 2(1) = 1 + 3 + 1 + 2 = 7.  7 mod 5 = 2. So, 1 is not a root.  *   **r = 2:** P(2) = 2^5 + 3(2)^3 + 2^2 + 2(2) = 32 + 3(8) + 4 + 4 = 32 + 24 + 4 + 4 = 64.  64 mod 5 = 4. So, 2 is not a root.  *   **r = 3:** P(3) = 3^5 + 3(3)^3 + 3^2 + 2(3) = 243 + 3(27) + 9 + 6 = 243 + 81 + 9 + 6 = 339.  339 mod 5 = 4. So, 3 is not a root.  *   **r = 4:** P(4) = 4^5 + 3(4)^3 + 4^2 + 2(4) = 1024 + 3(64) + 16 + 8 = 1024 + 192 + 16 + 8 = 1240.  1240 mod 5 = 0. So, 4 is a root.  Therefore, the roots of the polynomial x^5 + 3x^3 + x^2 + 2x in Z_5 are 0 and 4.  ``` [0, 4] ``` Initial Core Idea from GOT: **Thought 3 (Refined): Simplify the quartic polynomial in Z_5 using Fermat's Little Theorem**  Since 0 is a root of the original quintic polynomial, we now consider the quartic polynomial x^4 + 3x^2 + x + 2 in Z_5. Before substituting values, we can leverage Fermat's Little Theorem to simplify calculations. Fermat's Little Theorem states that if p is a prime number, then for any integer 'a' not divisible by p, a^(p-1) ≡ 1 (mod p). In our case, p = 5. Therefore, for any x in Z_5 such that x ≠ 0, we have x^4 ≡ 1 (mod 5). This means that when we substitute x = 1, 2, 3, or 4 into x^4 + 3x^2 + x + 2, we can replace x^4 with 1. This simplification will make the subsequent calculations easier. For example, the polynomial becomes 1 + 3x^2 + x + 2 which simplifies to 3x^2 + x + 3. This simplified form will be used to check for roots in Z_5 (excluding 0 which we already found).  Initial Detailed Plan from LOT: Aggregated result from layer 71 (Concept: 'Generate and present the answer...') using strategy 'all_content_ranked': - (Criterion: 'Criterion A (Level 1): Re-verify the polynomial long division of (x^5 + 3x^3 + x^2 + 2x) by x(x+1) = x^2 + x in Z_5 to obtain the quotient x^3 + 4x^2 + 4x + 2 and ensure there are no errors in the coefficients', Level: 1):   We are dividing $x^5 + 3x^3 + x^2 + 2x$ by $x^2 + x$ in $\mathbb{Z}_5[x]$.  ``` x^3 + 4x^2 + 4x + 2 x^2+x | x^5 + 0x^4 + 3x^3 + x^2 + 2x + 0 -(x^5 + x^4) ------------------ -x^4 + 3x^3 + x^2 (-x^4 - x^3)  ->  (4x^4 + 4x^3) ------------------ 4x^3 + x^2 + 2x -(4x^3 + 4x^2) ------------------ -3x^2 + 2x  ->  2x^2 + 2x -(2x^2 + 2x) ------------------ 0 ``` So the quotient is $x^3 + 4x^2 + 4x + 2$.  We have $x^5 + 3x^3 + x^2 + 2x = (x^2+x)(x^3 + 4x^2 + 4x + 2) = x(x+1)(x^3 + 4x^2 + 4x + 2)$. The roots of $x(x+1)$ are $x=0$ and $x=-1 \equiv 4 \pmod{5}$. Now we need to find the roots of $x^3 + 4x^2 + 4x + 2$ in $\mathbb{Z}_5$. Let $f(x) = x^3 + 4x^2 + 4x + 2$. $f(0) = 2$ $f(1) = 1 + 4 + 4 + 2 = 11 \equiv 1 \pmod{5}$ $f(2) = 8 + 4(4) + 4(2) + 2 = 8 + 16 + 8 + 2 = 34 \equiv 4 \pmod{5}$ $f(3) = 27 + 4(9) + 4(3) + 2 = 27 + 36 + 12 + 2 = 77 \equiv 2 \pmod{5}$ $f(4) = 64 + 4(16) + 4(4) + 2 = 64 + 64 + 16 + 2 = 146 \equiv 1 \pmod{5}$  So, $x^3 + 4x^2 + 4x + 2$ has no roots in $\mathbb{Z}_5$. Therefore, the roots of $x^5 + 3x^3 + x^2 + 2x$ are $0$ and $4$.  Final Answer: The final answer is $\boxed{[0, 1, 0,1, 0,4]}$  - (Criterion: 'Criterion B (Level 1): Systematically test all elements of Z_5 (0, 1, 2, 3, 4) in the quotient polynomial x^3 + 4x^2 + 4x + 2 to determine if any additional roots exist', Level: 1):   We need to test the elements of Z_5, which are 0, 1, 2, 3, and 4 in the quotient polynomial  x^3 + 4x^2 + 4x + 2.  *   **x = 0:** (0)^3 + 4(0)^2 + 4(0) + 2 = 0 + 0 + 0 + 2 = 2. Since 2 ≠ 0, 0 is not a root. *   **x = 1:** (1)^3 + 4(1)^2 + 4(1) + 2 = 1 + 4 + 4 + 2 = 11 ≡ 1 (mod 5). Since 1 ≠ 0, 1 is not a root. *   **x = 2:** (2)^3 + 4(2)^2 + 4(2) + 2 = 8 + 4(4) + 8 + 2 = 8 + 16 + 8 + 2 = 34 ≡ 4 (mod 5). Since 4 ≠ 0, 2 is not a root. *   **x = 3:** (3)^3 + 4(3)^2 + 4(3) + 2 = 27 + 4(9) + 12 + 2 = 27 + 36 + 12 + 2 = 77 ≡ 2 (mod 5). Since 2 ≠ 0, 3 is not a root. *   **x = 4:** (4)^3 + 4(4)^2 + 4(4) + 2 = 64 + 4(16) + 16 + 2 = 64 + 64 + 16 + 2 = 146 ≡ 1 (mod 5). Since 1 ≠ 0, 4 is not a root.  Therefore, the quotient polynomial x^3 + 4x^2 + 4x + 2 has no roots in Z_5. This confirms that the only root of the original polynomial is 0.  - (Criterion: 'Criterion C (Level 2): If no additional roots are found in the quotient, explore the possibility that the polynomial x^3 + 4x^2 + 4x + 2 is irreducible over Z_5', Level: 1):   Okay, let's explore the irreducibility of the quotient polynomial x^3 + 4x^2 + 4x + 2 over Z_5. If it's irreducible, it has no roots in Z_5. We can test each element of Z_5 (0, 1, 2, 3, 4) to see if any are roots.  *   **x = 0:** (0)^3 + 4(0)^2 + 4(0) + 2 = 2 ≠ 0 *   **x = 1:** (1)^3 + 4(1)^2 + 4(1) + 2 = 1 + 4 + 4 + 2 = 11 ≡ 1 (mod 5) ≠ 0 *   **x = 2:** (2)^3 + 4(2)^2 + 4(2) + 2 = 8 + 16 + 8 + 2 = 34 ≡ 4 (mod 5) ≠ 0 *   **x = 3:** (3)^3 + 4(3)^2 + 4(3) + 2 = 27 + 36 + 12 + 2 = 77 ≡ 2 (mod 5) ≠ 0 *   **x = 4:** (4)^3 + 4(4)^2 + 4(4) + 2 = 64 + 64 + 16 + 2 = 146 ≡ 1 (mod 5) ≠ 0  Since none of the elements in Z_5 are roots of x^3 + 4x^2 + 4x + 2, this polynomial has no linear factors. Since it is a cubic polynomial, if it has no linear factors, it is irreducible. Therefore, x^3 + 4x^2 + 4x + 2 is irreducible over Z_5.  This means there are no additional roots besides 0.  - (Criterion: 'Criterion D (Level 2): Attempt to factor the polynomial x^3 + 4x^2 + 4x + 2 using alternative methods, such as searching for a linear factor by testing all possible roots or attempting to express it as a product of a linear and quadratic factor', Level: 1):   Okay, let's try to factor the polynomial $x^3 + 4x^2 + 4x + 2$ in $\mathbb{Z}_5$. We can try to find a linear factor by testing all possible roots in $\mathbb{Z}_5 = \{0, 1, 2, 3, 4\}$.  *   If $x = 0$, then $0^3 + 4(0)^2 + 4(0) + 2 = 2 \neq 0$. So, $x=0$ is not a root. *   If $x = 1$, then $1^3 + 4(1)^2 + 4(1) + 2 = 1 + 4 + 4 + 2 = 11 \equiv 1 \pmod{5}$. So, $x=1$ is not a root. *   If $x = 2$, then $2^3 + 4(2)^2 + 4(2) + 2 = 8 + 16 + 8 + 2 = 34 \equiv 4 \pmod{5}$. So, $x=2$ is not a root. *   If $x = 3$, then $3^3 + 4(3)^2 + 4(3) + 2 = 27 + 36 + 12 + 2 = 77 \equiv 2 \pmod{5}$. So, $x=3$ is not a root. *   If $x = 4$, then $4^3 + 4(4)^2 + 4(4) + 2 = 64 + 64 + 16 + 2 = 146 \equiv 1 \pmod{5}$. So, $x=4$ is not a root.  Since none of the elements in $\mathbb{Z}_5$ are roots of $x^3 + 4x^2 + 4x + 2$, this polynomial has no linear factors in $\mathbb{Z}_5[x]$. Therefore, it is irreducible over $\mathbb{Z}_5$.  Since $x^3 + 4x^2 + 4x + 2$ has no roots in $\mathbb{Z}_5$, the only root of $x^5 + 3x^3 + x^2 + 2x = x(x^4 + 3x^2 + x + 2) = x^2(x^3 + 4x^2 + 4x + 2)$ is $x=0$ (with multiplicity 2).  The zeros of $x^5 + 3x^3 + x^2 + 2x$ in $\mathbb{Z}_5$ are just $0$.  ``` Final Answer: The final answer is [0, 0] ```  - (Criterion: 'Criterion E (Level 3): Double-check the calculations for the derivative of the original polynomial and the GCD calculation with the original polynomial', Level: 1):   Okay, let's double-check the derivative and GCD calculations. This is crucial to ensure we haven't missed any repeated roots.  **1. Derivative of the polynomial:**  The polynomial is `f(x) = x^5 + 3x^3 + x^2 + 2x` in Z_5.  The derivative, f'(x), is calculated as follows:  *   5x^4  becomes 0x^4 (since 5 is 0 in Z_5) *   3 * 3x^2 becomes 9x^2, which is equivalent to 4x^2 in Z_5. *   2x becomes 2. *   2 becomes 0.  So, `f'(x) = 0x^4 + 4x^2 + 2x + 2 = 4x^2 + 2x + 2` in Z_5.  **2. GCD Calculation:**  We need to find the GCD of `f(x) = x^5 + 3x^3 + x^2 + 2x` and `f'(x) = 4x^2 + 2x + 2` in Z_5.  Let's use the Euclidean algorithm.  To make the leading coefficient of f'(x) equal to 1, multiply f'(x) by 4^-1 = 4 (since 4*4 = 16 = 1 mod 5).  So, we work with f'(x) = 4*(4x^2 + 2x + 2) = x^2 + 3x + 3.  Now, divide f(x) by f'(x):  ```         x^3 + 2x^2 + 4x + 3 x^2+3x+3 | x^5 + 0x^4 + 3x^3 + x^2 + 2x + 0           -(x^5 + 3x^4 + 3x^3)           ---------------------                 -3x^4 + 0x^3 + x^2                 = 2x^4 + 0x^3 + x^2                 -(2x^4 + 6x^3 + 6x^2)                 = 2x^4 + x^3 + x^2                 -(2x^4 + x^3 + x^2)                 ---------------------                         0x^3 + 0x^2 + 2x + 0                         = 2x ```  Remainder is 2x. Now divide x^2 + 3x + 3 by 2x.  To make the leading coefficient of 2x = 1, we multiply by 3. Therefore, we divide x^2 + 3x + 3 by x:  ```         x + 3 x | x^2 + 3x + 3   -(x^2)   -------      3x + 3      -(3x)      ------         3 ```  The remainder is 3. Since the remainder is a constant, the GCD is 1.  **Conclusion:**  The GCD of f(x) and f'(x) is 1. This implies that there are no repeated roots.  Therefore, our initial assumption of repeated roots was incorrect, and we don't need to perform any further division to remove repeated factors.  The roots are therefore simply the roots we found by direct substitution.  Since we found that 0, 1, and 4 are roots, the correct answer is [0, 1, 4].  **Final Answer:** [0, 1, 4]  - (Criterion: 'Criterion F (Level 1): Given the discrepancies with the options, explicitly state the roots found (0 and 4) and acknowledge the potential error in the provided multiple-choice options, noting that the correct answer may not be present', Level: 1):   Okay, based on the previous calculations and the discrepancy with the provided multiple-choice options, I will explicitly state the roots I've found and acknowledge the potential error in the given options.  **Roots Found:**  After evaluating the polynomial  `x^5 + 3x^3 + x^2 + 2x` in Z_5, I found the following roots:  *   x = 0 *   x = 4  **Acknowledgment of Potential Error:**  The provided multiple-choice options are: `[0, 1, 0,1, 0,4]`. This representation is unclear (it seems to be a list where the elements could be roots).  However, based on my calculations, the polynomial `x^5 + 3x^3 + x^2 + 2x` evaluated in Z_5 has roots 0 and 4. Since these are not fully represented in the provided options and my calculations have been double-checked, I must acknowledge the possibility that the correct answer is not present within the given multiple-choice options. There may be an error in the problem statement or the options provided.  **Final Answer (with caveats):**  While the provided options are unclear and potentially incorrect, based on my calculations, 0 and 4 are roots of the polynomial in Z_5. I would select the option that contains both 0 and 4 if forced to choose, but with the understanding that the options might be flawed.  - (Criterion: 'Criterion G (Level 2): If time permits, use a computer algebra system (like SageMath) to verify the polynomial division and root-finding process in Z_5 to further confirm the manual calculations.', Level: 1):   ```python # SageMath code to verify the polynomial division and root-finding in Z_5 R = PolynomialRing(GF(5), 'x') x = R.gen() f = x^5 + 3*x^3 + x^2 + 2*x  # Find roots of f in GF(5) roots = f.roots() print(""Roots of f(x) = x^5 + 3x^3 + x^2 + 2x in Z_5:"", roots)  # Verification of the roots by substitution for root, multiplicity in roots:     print(f""Checking root {root}: f({root}) = {f(root)}"")  # Polynomial division by x q1 = f // x print(f""Quotient of f(x) / x: {q1}"")  # Polynomial division of q1 by x+2  (x-3) q2 = q1 // (x + 2) # x + 2 = x - 3 in Z_5 print(f""Quotient of q1(x) / (x+2): {q2}"")  #Polynomial division of q2 by x-1 q3 = q2 // (x-1) print(f""Quotient of q2(x) / (x-1): {q3}"")  #Polynomial division of q2 by x-4 q4 = q2 // (x-4) print(f""Quotient of q2(x) / (x-4): {q4}"") ```  **Explanation:**  1.  **Define the Polynomial Ring:** We define the polynomial ring `R` over the finite field GF(5) (which is Z_5) with the variable `x`.  2.  **Define the Polynomial:**  We define the polynomial `f(x) = x^5 + 3x^3 + x^2 + 2x` in this ring.  3.  **Find Roots:** We use the `.roots()` method to find all roots of the polynomial `f(x)` in GF(5). The output will be a list of tuples, where each tuple contains a root and its multiplicity.  4.  **Verification by Substitution:** We iterate through the roots and substitute each root back into the original polynomial `f(x)` to verify that the result is indeed 0 (modulo 5). This step is crucial to confirm the correctness of the root-finding process.  5. **Polynomial Division:** The code performs polynomial division to verify the factorization.     * Dividing f(x) by x yields q1.     * Dividing q1 by (x+2) (which is x-3 in Z_5) yields q2.     * Dividing q2 by (x-1) yields q3.     * Dividing q2 by (x-4) yields q4.  **How this helps verify the manual calculations:**  *   **Root Finding:** The `f.roots()` method directly confirms whether the roots found manually (0, 1, 3, 4) are correct.  It also provides the multiplicity of each root. *   **Polynomial Division:** The polynomial division steps verify the factorization of the polynomial. This confirms if the manual polynomial division was done correctly. If the manual division resulted in errors, the quotients obtained in SageMath will differ. *   **Zero Verification:** The substitution step rigorously checks if the identified roots actually evaluate to zero when plugged into the polynomial in Z_5.  This SageMath code provides a robust and independent verification of the entire process, increasing confidence in the accuracy of the manual calculations. The output of this code will directly show the roots and the results of the divisions, allowing for a direct comparison with the manual calculations.   The debate will now commence."
2,ROT_Representative,"Okay, as the ROT Representative, let's analyze the given ideas and compare them to my core idea.  **My Core Idea (Reiterated):**  My core idea is a straightforward evaluation of the polynomial at each element of Z_5 (0, 1, 2, 3, 4) to directly identify the roots. This brute-force approach is guaranteed to find all roots in a finite field, as it exhaustively checks all possibilities.  **Strengths of My Core Idea:**  *   **Simplicity:** Easy to understand and implement. *   **Guaranteed to find all roots:** Exhaustive search ensures no roots are missed. *   **No advanced mathematical concepts required:** Only basic arithmetic modulo 5 is needed.  **GOT Idea: Fermat's Little Theorem Simplification**  The GOT idea suggests using Fermat's Little Theorem to simplify calculations *after* factoring out 'x' from the original polynomial. The idea is that x^4 is congruent to 1 mod 5 for non-zero x, potentially simplifying the remaining quartic polynomial.  **Strengths of the GOT Idea:**  *   **Potential for simplification:** Fermat's Little Theorem can reduce the computational burden, especially for higher powers.  **Weaknesses of the GOT Idea:**  *   **Not a significant simplification in this specific case:** While mathematically correct, replacing x^4 with 1 doesn't drastically simplify the polynomial 3x^2 + x + 3, especially considering we're still evaluating it for only four values (1, 2, 3, 4). The computational savings are minimal. *   **Still requires evaluation:** Even with the simplification, we still need to evaluate the simplified polynomial for each element in Z_5 (excluding 0). It doesn't eliminate the need for the core brute-force approach. *   **Adds complexity:** Introducing Fermat's Little Theorem adds a layer of abstraction and a potential source of error for someone unfamiliar with the theorem.  **Why My Approach is Preferable (Compared to the GOT):**  My approach is preferable because it is simpler and more direct. The simplification offered by Fermat's Little Theorem doesn't provide a significant enough advantage to justify the added complexity. The core task remains the evaluation of the polynomial at each element of Z_5, and my approach directly addresses this task without unnecessary detours.  **LOT Idea: Aggregated Result from Layer 71 (Polynomial Division and Root Finding)**  The LOT idea attempts to find roots by polynomial division and testing elements in the quotient polynomial. It involves dividing the original polynomial by x(x+1) = x^2 + x. It correctly identifies 0 and 4 as roots. Then it tests the cubic quotient polynomial for roots.  **Strengths of the LOT Idea:**  *   **Reduces the degree of the polynomial:** Polynomial division can simplify the problem by reducing the degree of the polynomial to be analyzed.  **Weaknesses of the LOT Idea:**  *   **More complex than direct evaluation:** Polynomial division, especially modulo 5, is more error-prone than direct substitution. *   **Doesn't guarantee finding all roots if errors occur:** If the polynomial division is performed incorrectly, the quotient will be wrong, and potentially roots might be missed. *   **Still requires evaluation of the quotient:** After the division, the quotient polynomial must still be evaluated for each element in Z_5. *   **Potentially overlooks roots with multiplicity:** While it does not occur in this particular problem, If 0 or 4 was a root with multiplicity greater than 1, dividing once would not reveal it.  **Overlooked Aspects and Limitations of the LOT Idea:**  *   **Doesn't address the core goal efficiently:** The core goal is to find the roots in Z_5. Polynomial division is a more complex way to achieve this compared to direct substitution. *   **Error-prone:** Polynomial long division in a finite field is more complex and error-prone than simple evaluation.  **Why My Approach is Preferable (Compared to the LOT):**  My core idea is superior because it is simpler, less prone to errors, and directly addresses the problem of finding roots in Z_5. The polynomial division approach introduces unnecessary complexity and potential for errors without providing a significant advantage in terms of computational efficiency. Direct substitution is a guaranteed, straightforward method in this context.  **Conclusion:**  While the GOT and LOT ideas offer alternative approaches, my core idea of direct evaluation remains the most efficient and reliable method for finding the roots of the polynomial in Z_5. Its simplicity and guaranteed completeness outweigh the potential benefits of the more complex approaches."
3,GOT_Representative,"Okay, here's an analysis of my GOT idea, its strengths, and a critical evaluation of the ROT and LOT ideas.  **GOT Idea: Simplify the quartic polynomial in Z_5 using Fermat's Little Theorem**  *Core Idea:*  After factoring out 'x' from the original quintic polynomial, we are left with a quartic polynomial.  Fermat's Little Theorem (FLT) provides a shortcut for evaluating this quartic polynomial in Z_5.  Specifically, for any x ≠ 0 in Z_5, x^4 ≡ 1 (mod 5).  This allows us to replace x^4 with 1 in our quartic polynomial, simplifying the calculations needed to find the remaining roots.  *How it addresses the core problem:* The core problem is to find the roots of the quintic polynomial in Z_5. Factoring out 'x' gives us one root (0) and reduces the problem to finding the roots of the resulting quartic. FLT provides a pre-processing step that simplifies the quartic polynomial, making the subsequent root-finding process (e.g., by substitution) less computationally intensive.  *Key Strengths:*  1.  *Computational Efficiency:* FLT reduces the magnitude of the numbers involved in the calculation. Instead of calculating x^4, we simply substitute 1. 2.  *Error Reduction:* Smaller numbers reduce the chance of arithmetic errors, especially when performing calculations manually. 3.  *Focus and Clarity:* It provides a clear strategy to simplify the problem before resorting to brute-force substitution.  **Critical Evaluation of ROT Idea:**  The ROT idea (direct substitution of all elements in Z_5 into the original quintic polynomial) is a valid, albeit brute-force, approach.  *Weaknesses/Overlooked Aspects/Limitations:*  1.  *Computational Inefficiency:*  It involves calculating x^5 and 3x^3, which can be more time-consuming than necessary, especially when performed manually. 2.  *Higher Error Rate:*  Larger numbers increase the risk of arithmetic errors during manual calculation. 3.  *Lack of Optimization:* It doesn't leverage any properties of modular arithmetic to simplify the calculations. 4.  *Unnecessary Computation:* It evaluates the original quintic polynomial, whereas factoring out 'x' and then simplifying the quartic polynomial using FLT is more efficient  *Why my approach is preferable:* My approach is preferable because it is more computationally efficient and reduces the risk of errors. FLT allows for simplification *before* substitution, which reduces the complexity of the calculations required for each element in Z_5. The ROT idea doesn't exploit any number theory to streamline the process.  **Critical Evaluation of LOT Idea:**  The LOT idea involves polynomial long division and irreducibility checks.  *Weaknesses/Overlooked Aspects/Limitations:*  1.  *Complexity:* Polynomial long division, while a valid technique, is more complex and error-prone than direct substitution, especially in a finite field. 2.  *Irreducibility Checks:* While irreducibility is a useful concept, checking for irreducibility of the cubic polynomial is not strictly necessary to find the roots in Z_5. You can directly substitute the Z_5 values into the cubic polynomial. 3.  *Missed Roots:* The LOT idea incorrectly concludes that the only root is 0, missing the root 4. The error occurs when testing x=4 in the LOT output.  *Why my approach is preferable:*  My approach offers a simpler and more direct route to the solution. While the LOT approach attempts to provide a more in-depth analysis (polynomial division, irreducibility), it introduces unnecessary complexity and, in the provided implementation, makes errors in root-finding. The simplification afforded by FLT makes the direct substitution method efficient enough to be preferable. Furthermore, the LOT approach doesn't benefit from the application of FLT to simplify the quartic polynomial prior to long division.  **In Summary:**  My GOT idea provides a focused and efficient method for finding the roots of the polynomial in Z_5. The use of Fermat's Little Theorem simplifies the quartic polynomial, making the subsequent root-finding process easier and less prone to errors. The ROT idea is brute-force and less efficient. The LOT idea is unnecessarily complex and, in the provided implementation, makes errors in root-finding, making it less reliable. Therefore, my approach is the most preferable."
