Round,Speaker,Utterance
1,Moderator,"Debate Topic: In-depth discussion based on the following mission context, ROT idea, GOT idea, and LOT idea. Mission Context: Instruction: The teacher divided the students into four groups. One group had 5 students, another 8 students, and the third 7 students. If there were 24 total students, how many students were in the fourth group? Initial Core Idea from GOT: Here's how to solve the problem:  1. **Find the total number of students in the first three groups:** 5 + 8 + 7 = 20 students  2. **Subtract the number of students in the first three groups from the total number of students to find the number of students in the fourth group:** 24 - 20 = 4 students  **Answer:** There were 4 students in the fourth group. Initial Core Idea from GOT: Okay, here's the revised task, combining the instructions and focusing on the unknown:  **Task:**  Instruction: The teacher divided the students into four groups. One group had 5 students, another 8 students, and the third 7 students. If there were 24 total students, how many students were in the fourth group? Let 'x' represent the number of students in the fourth group.  Instruction: Calculate the total number of students in the first three groups by adding the number of students in each of those groups: 5 + 8 + 7.  Initial Detailed Plan from LOT: Aggregated result from layer 11 (Concept: 'Generate and present the answer...') using strategy 'all_content_ranked': - (Criterion: 'State the final answer in a complete sentence', Level: 1):   The fourth group had 4 students.  - (Criterion: 'State the final answer numerically', Level: 1):   The number of students in the fourth group is 4.  - (Criterion: 'State the final answer with units', Level: 1):   The fourth group had 4 students.  - (Criterion: 'Express the answer as part of a ratio (e.g., ""The fourth group represents x/24 of the total students"")', Level: 1):   First, we need to determine how many students are in the fourth group. We know the total number of students is 24, and we know the sizes of the first three groups are 5, 8, and 7.  From the previous steps, we know the number of students in the fourth group is 4.  Now, to express this as a ratio: The fourth group has 4 students out of a total of 24 students. Therefore, the ratio is 4/24. We can simplify this fraction to 1/6.  So, the fourth group represents 4/24 (or 1/6) of the total students.  - (Criterion: 'Express the answer as a percentage of the total students (round to the nearest percent)', Level: 1):   First, we know there are 4 students in the fourth group. The total number of students is 24. To find the percentage, we divide the number of students in the fourth group by the total number of students and multiply by 100: (4/24) * 100 = 16.666... Rounding to the nearest percent, we get 17%.  - (Criterion: 'Present the answer in a box for emphasis', Level: 1):   The number of students in the fourth group is 4.  ``` 4 ```  - (Criterion: 'State the answer in words (e.g., ""Four students"")', Level: 1):   Four students were in the fourth group.  - (Criterion: 'Provide a brief explanation of how the answer was derived (one sentence)', Level: 1):   The number of students in the fourth group was found by subtracting the sum of the students in the first three groups (5 + 8 + 7 = 20) from the total number of students (24), resulting in 4 students.  - (Criterion: 'Refer back to the original problem and restate the answer in the context of the problem', Level: 1):   The fourth group has 4 students. This is because the total number of students in the first three groups (5 + 8 + 7 = 20) subtracted from the total number of students (24) leaves 4 students.  - (Criterion: 'State any assumptions made in arriving at the answer (e.g., ""Assuming no students are absent..."")', Level: 1):   Assumption: All 24 students were present and accounted for in one of the four groups. There are no students who are not assigned to a group, and no students assigned to multiple groups.  - (Criterion: 'Present the solution using different visual aids (e.g., number line)', Level: 1):   Here's how we can visualize the solution using a number line:  1. **Represent the total number of students:** Draw a number line from 0 to 24.  2. **Mark the first group:** Start at 0 and mark off 5 units. This represents the first group of 5 students.  3. **Mark the second group:** From the end of the first group (at 5), mark off another 8 units. This represents the second group of 8 students. We are now at 5 + 8 = 13 on the number line.  4. **Mark the third group:** From the end of the second group (at 13), mark off another 7 units. This represents the third group of 7 students. We are now at 13 + 7 = 20 on the number line.  5. **The remaining distance:** The distance remaining on the number line between 20 and 24 represents the number of students in the fourth group.  This distance is 24 - 20 = 4.  Therefore, there are 4 students in the fourth group.   The debate will now commence."
2,ROT_Representative,"Okay, here's my evaluation as the ROT (Reversal Of Thought) Representative.  **Core Idea (ROT): My Simple Subtraction**  My core idea is:  1.  **Find the total number of students in the first three groups:** 5 + 8 + 7 = 20 students 2.  **Subtract the number of students in the first three groups from the total number of students to find the number of students in the fourth group:** 24 - 20 = 4 students  **Answer:** There were 4 students in the fourth group.  **How it Addresses the Problem and Strengths:**  This approach directly addresses the problem by using the given information (number of students in each of the first three groups and the total number of students) to calculate the unknown (number of students in the fourth group). Its key strengths are:  *   **Simplicity:** It involves only two basic arithmetic operations (addition and subtraction), making it easy to understand and execute. *   **Efficiency:** It provides a direct and quick solution without unnecessary steps. *   **Clarity:** The logic is straightforward and easy to follow. *   **Accuracy:** It correctly applies the principle of subtraction to find the missing value.  **Critical Evaluation of GOT Idea:**  The GOT idea focuses on setting up the problem with an unknown variable 'x' and explicitly stating the calculation of the sum of the first three groups. While this is not incorrect, it adds an unnecessary layer of formality for such a simple problem.  *   **Weaknesses:** Introducing the variable 'x' doesn't fundamentally change how the problem is solved. It can be seen as overcomplicating a straightforward arithmetic task. *   **Overlooked Aspects:** It doesn't overlook anything, but the added notation doesn't contribute to understanding. *   **Limitations:** It's not *limited* in its ability to solve the problem, but it's less direct than my simple subtraction approach.  **Why My Approach is Preferable to the GOT Idea:**  My approach is preferable because it is more direct, efficient, and easier to understand. The GOT idea introduces unnecessary formalism that doesn't enhance the problem-solving process. For a problem of this simplicity, direct arithmetic is the most effective strategy. It avoids introducing algebraic notation which is unnecessary and could make it less accessible to some learners.  **Critical Evaluation of LOT Idea:**  The LOT idea is incredibly thorough in presenting the answer in multiple ways and providing context, explanations, and visual aids. However, this level of detail is overkill for such a basic problem.  *   **Weaknesses:** The LOT idea spends excessive time and effort on aspects that are not necessary for a simple problem. Providing ratios, percentages, number lines, and detailed explanations for a problem that can be solved in two steps is inefficient. The multiple presentations of the answer, while not inherently wrong, are redundant and can be confusing. *   **Overlooked Aspects:** It doesn't overlook anything in terms of explaining the answer, but it overlooks the importance of efficiency and simplicity in problem-solving. *   **Limitations:** The LOT approach, while comprehensive, can obscure the core understanding of the problem by burying it under layers of explanation and different representations.  **Why My Approach is Preferable to the LOT Idea:**  My approach is preferable because it prioritizes efficiency and clarity. While the LOT idea aims for complete understanding, it does so at the expense of simplicity. For basic arithmetic problems, over-explanation can be counterproductive. My approach focuses on directly solving the problem with minimal steps, making it easier for learners to grasp the core concept without getting lost in unnecessary details. The LOT idea is suited to more complex problems where different representations and detailed explanations are needed to truly comprehend the solution. For this problem, my approach is much more efficient and direct.  In summary, while the GOT and LOT ideas are not incorrect, my simple subtraction approach is superior because it's more direct, efficient, and easier to understand for this particular problem. It avoids unnecessary complexity and focuses on the core arithmetic principles involved."
3,GOT_Representative,"Okay, as the GOT Representative, let me elaborate on my core idea and compare it to the ROT and LOT solutions.  **My Core Idea (GOT): Focusing on the Unknown**  My core idea emphasizes a structured, problem-solving approach that explicitly defines the unknown variable and then uses the given information to create an equation that can be solved. It's about formalizing the process.  **Task:**  Instruction: The teacher divided the students into four groups. One group had 5 students, another 8 students, and the third 7 students. If there were 24 total students, how many students were in the fourth group? Let 'x' represent the number of students in the fourth group.  Instruction: Calculate the total number of students in the first three groups by adding the number of students in each of those groups: 5 + 8 + 7.  **How it addresses the core problem:**  1.  **Explicitly Define the Unknown:** The problem statement *already* does this, which is beneficial. My approach reinforces this by continually referring to 'x' as the number of students in the fourth group. 2.  **Formulate an Equation:** The core is to understand that the sum of students in all four groups must equal the total number of students. This is expressed as:  5 + 8 + 7 + x = 24 3.  **Solve for the Unknown:** The goal is to isolate 'x' on one side of the equation by performing the same operations on both sides.  **Key Strengths:**  *   **Clarity and Structure:** It breaks down the problem into distinct steps, making it easier to understand and follow. *   **Generalizability:** This method can be applied to a wide range of similar word problems, even those with more complex relationships. *   **Reduces Errors:** By explicitly stating the equation, it minimizes the chance of making arithmetic or logical errors. *   **Emphasis on Algebraic Thinking:** It introduces the concept of variables and equations early on, fostering algebraic thinking.  **Critical Evaluation of ROT (Reversal of Thought):**  The ROT solution is:  1.  **Find the total number of students in the first three groups:** 5 + 8 + 7 = 20 students 2.  **Subtract the number of students in the first three groups from the total number of students to find the number of students in the fourth group:** 24 - 20 = 4 students  **Answer:** There were 4 students in the fourth group.  **Weaknesses of ROT:**  *   **Lacks Formalism:** While it arrives at the correct answer, it doesn't explicitly define a variable or create an equation. This makes it less adaptable to more complex problems. *   **Hidden Assumption:** It assumes the reader understands the relationship between the parts (groups) and the whole (total students) without explicitly stating it. *   **Limited Explanation:** It provides a straightforward calculation but lacks a deeper explanation of the underlying mathematical principles.  **Critical Evaluation of LOT (Layer of Thoughts):**  The LOT solution is an overly detailed and convoluted presentation of the answer.  **Weaknesses of LOT:**  *   **Overkill:** It presents the answer in numerous ways (ratio, percentage, number line, etc.), which is unnecessary for such a simple problem. While this might be useful in some contexts, it obscures the core solution. *   **Inefficient:** It wastes time and resources generating redundant information. *   **Distraction:** The excessive detail can distract from the main objective of solving the problem. *   **Lack of Focus:** While it addresses various criteria, it loses sight of the core problem-solving process. The number line and percentage calculations, while potentially helpful visualization techniques, are not central to *solving* for the unknown.  **Why My GOT Approach is Preferable:**  My GOT approach strikes a balance between simplicity and rigor. It's more structured than ROT, making it easier to understand and apply to other problems.  It avoids the excessive detail of LOT, focusing on the core problem-solving steps.  *   **Emphasis on Understanding:** It emphasizes understanding the relationship between the parts and the whole and translating that into a mathematical equation. *   **Adaptability:** It provides a framework that can be easily adapted to more complex problems involving multiple variables and constraints. *   **Foundation for Algebra:** It lays a solid foundation for future algebraic concepts.  While ROT gets to the answer quickly, it doesn't provide the robust understanding and skills that my GOT approach offers. LOT, while comprehensive, is needlessly complex for this specific problem. My approach is preferable because it focuses on the core problem-solving steps, promotes algebraic thinking, and is adaptable to a wider range of problems. The explicit definition of the unknown and the formulation of the equation are the key differentiators."
4,LOT_Representative,"Okay, as the LOT Representative, here's an elaboration on the aggregated result from Layer 11, a critical evaluation of the GOT and ROT ideas, and a justification for the Layer 11 approach.  **Core Idea Elaboration (Layer 11: Aggregated Result with 'all_content_ranked' strategy)**  The core idea is to comprehensively address the question ""How many students were in the fourth group?"" by not only providing the numerical answer but also contextualizing it in various ways to enhance understanding. This is achieved by applying multiple criteria, each designed to present the answer from a different angle. This includes:  *   **Direct Statement:** Stating the answer in a complete sentence, numerically, and with units. *   **Contextualization:** Expressing the answer as a ratio and a percentage, relating it to the total number of students. *   **Presentation:**  Emphasizing the answer visually (box), stating it in words, and providing a brief explanation of the derivation. *   **Problem Connection:** Referring back to the original problem and restating the answer within that context. *   **Assumptions & Visualization:** Explicitly stating assumptions made and presenting the solution visually using a number line.  **Key Strengths:**  *   **Comprehensive Understanding:** By presenting the answer in multiple formats (numerical, ratio, percentage, visual), it caters to diverse learning styles and ensures a deeper understanding. *   **Thoroughness:** It covers all aspects of answering the question, including the calculation, its context, and the underlying assumptions. *   **Clarity:** The use of clear language and visual aids makes the solution easy to follow and understand. *   **Error Prevention:** Explicitly stating assumptions helps avoid misinterpretations or overlooking potential constraints.  **Critical Evaluation of GOT (Graph of Thoughts) Idea:**  **GOT Idea:**  *   Instruction: The teacher divided the students into four groups. One group had 5 students, another 8 students, and the third 7 students. If there were 24 total students, how many students were in the fourth group? Let 'x' represent the number of students in the fourth group. *   Instruction: Calculate the total number of students in the first three groups by adding the number of students in each of those groups: 5 + 8 + 7.  **Weaknesses and Overlooked Aspects:**  *   **Incomplete Solution:** The GOT idea only sets up the problem and provides a single step towards the solution. It doesn't actually calculate the final answer or provide any context. *   **Lack of Explanation:** It doesn't explain *why* adding the first three groups' sizes is necessary or how it leads to the final answer. *   **No Contextualization:**  It misses opportunities to express the answer as a fraction, percentage, or with visual aids, failing to provide a complete understanding. *   **Overly Simplistic:** While setting up the problem with 'x' is helpful, it doesn't go far enough in actually solving and explaining the solution.  **Critical Evaluation of ROT (Reversal of Thought) Idea:**  **ROT Idea:**  *   Find the total number of students in the first three groups: 5 + 8 + 7 = 20 students *   Subtract the number of students in the first three groups from the total number of students to find the number of students in the fourth group: 24 - 20 = 4 students *   **Answer:** There were 4 students in the fourth group.  **Weaknesses and Overlooked Aspects:**  *   **Limited Context:** While it provides the correct answer and the steps to get there, it lacks broader context. *   **Missing Rationale:** It doesn't explicitly connect the subtraction step to the original problem's context; it doesn't explain why subtracting gives you the number of students in the fourth group. *   **No Alternative Representations:**  It doesn't explore expressing the answer as a ratio, percentage, or using visual aids. *   **No Assumption Statement:** It doesn't state the assumption that all 24 students are accounted for.  **Why Layer 11's Approach is Preferable:**  The Layer 11 approach is preferable because it provides a significantly more complete and nuanced understanding of the problem and its solution. While the GOT and ROT ideas offer some steps toward solving the problem, they lack the comprehensive explanation, contextualization, and diverse representation that the Layer 11 approach provides.  Specifically:  *   **Completeness:** Layer 11 provides a complete answer with various supporting information. *   **Context:** Layer 11 puts the answer in context through ratios, percentages, and relating it back to the original problem. *   **Clarity:** Layer 11 uses visual aids and clear language to ensure the solution is easily understood. *   **Nuance:** Layer 11 addresses assumptions, which is critical for problem-solving in general.  In essence, Layer 11 goes beyond just finding the answer; it aims to *teach* the concept thoroughly. The GOT and ROT ideas are merely steps in the calculation process, while Layer 11 provides a holistic and educational solution."
5,Critical_Analyst,"Okay, let's analyze the approaches of ROT and GOT to solve the student group problem.  **ROT's Statement/Idea:**  *   **Correctness:** ROT's solution is arithmetically correct. 5 + 8 + 7 = 20, and 24 - 20 = 4. *   **Completeness:** The solution is complete in terms of arriving at the numerical answer. *   **Weaknesses:** ROT's explanation is minimal. It doesn't explicitly define variables or provide context beyond the arithmetic steps. *   **Overlooked Aspects:** It doesn't include any checks or validations of the answer (e.g., verifying that all groups add up to 24). *   **Improvements:** A more detailed explanation, including a restatement of the problem's context in the answer, would be beneficial. Mentioning the assumption that all students are accounted for is also important. *   **Caution:** While correct, the brevity might make it less helpful for someone who struggles with word problems.  **GOT's Statement/Idea (Multiple Parts):**  *   **First Part (Setting up the task):** This part is good for problem understanding. Defining 'x' helps in formalizing the problem. The instruction to calculate the sum of the first three groups is also helpful for guiding the solution process. *   **Correctness:** The arithmetic instruction is correct. *   **Completeness:** Incomplete by itself, as it only sets up the initial steps. *   **Weaknesses:** It doesn't yet complete the solution. *   **Improvements:** Needs to be followed by the subtraction step to find 'x'.  *   **Second Part (Aggregated Result from Layer 11):** This section provides a much more comprehensive analysis and presentation of the solution.     *   **Correctness:** Mostly correct. The calculations are accurate.     *   **Completeness:** Very complete. It covers various aspects, including stating the answer in different formats (numerical, words, ratio, percentage), providing an explanation, restating the problem, stating assumptions, and using a visual aid.     *   **Weaknesses:** The ratio and percentage calculations, while correct, might be overkill for a simple problem like this. Overexplaining can sometimes obscure the core concept. The number line visualization is basic but functional.     *   **Overlooked Aspects:** None significant.     *   **Improvements:** While the thoroughness is appreciated, streamlining the presentation might be beneficial for clarity.  **Overall Critique:**  *   ROT provides a correct but basic solution. It's concise but lacks detail and context. *   GOT provides a more complete and detailed solution. The initial setup is good, and the aggregated result covers various aspects of problem-solving. However, it could be streamlined for better clarity. *   Both arrive at the correct numerical answer.  **Improvements and Points of Caution:**  *   For both, explicitly stating the assumption that all 24 students are accounted for in the four groups is crucial for a complete understanding of the problem's constraints. *   GOT's detailed approach is generally good, but consider the target audience. For a simple problem, excessive detail might be distracting. *   ROT could benefit from adopting GOT's practice of restating the answer in the context of the problem.  ### Synthesized Accurate Answer: The total number of students in the first three groups is 5 + 8 + 7 = 20. Subtracting this from the total number of students (24) gives the number of students in the fourth group: 24 - 20 = 4. Therefore, there are 4 students in the fourth group. We assume that all 24 students are accounted for in one of the four groups."
