Round,Speaker,Utterance
1,Moderator,"Debate Topic: In-depth discussion based on the following mission context, ROT idea, GOT idea, and LOT idea. Mission Context: Instruction: Statement 1 | Every homomorphic image of a group G is isomorphic to a factor group of G. Statement 2 | The homomorphic images of a group G are the same (up to isomorphism) as the factor groups of G.  Context: The following are multiple choice options:[""True, True"", ""False, False"", ""True, False"",""False, True""] Initial Core Idea from GOT: Based on the task definition and the Fundamental Homomorphism Theorem, both statements are true. The Fundamental Homomorphism Theorem directly implies that every homomorphic image of a group G is isomorphic to a factor group of G. Furthermore, it establishes a one-to-one correspondence (up to isomorphism) between homomorphic images and factor groups.  Therefore, the correct answer is ""True, True"". Initial Core Idea from GOT: The analysis is correct.  *   **Statement 1:** The Fundamental Homomorphism Theorem directly supports this statement. If $H$ is a homomorphic image of $G$ under $\phi$, then $G/\ker(\phi) \cong H$, meaning $H$ is isomorphic to a factor group of $G$. Therefore, the statement is true.  *   **Statement 2:** This statement claims that the *set* of all homomorphic images (up to isomorphism) is the *same* as the set of all factor groups (up to isomorphism). We've already established that every homomorphic image is isomorphic to a factor group. Now, we need to show the converse: every factor group is isomorphic to a homomorphic image. Let $G/N$ be a factor group of $G$. The canonical projection $\pi: G \to G/N$ defined by $\pi(g) = gN$ is a homomorphism, and its image is $G/N$. Therefore, every factor group is the homomorphic image of G under this projection. So, the statement is true.  Thus, both statements are true. Final Answer: The final answer is $\boxed{True, True}$  Initial Detailed Plan from LOT: Aggregated result from layer 155 (Concept: 'Generate and present the answer...') using strategy 'all_content_ranked': - (Criterion: 'Criterion A (Level 1): Directly answer the multiple-choice question based on the accumulated evidence', Level: 1):   Statement 1 is the First Isomorphism Theorem, which is a fundamental theorem in group theory and is true.  Statement 2 is a rephrasing of Statement 1. Saying that every homomorphic image is *isomorphic* to a factor group is the same as saying that the homomorphic images are the same (up to isomorphism) as the factor groups. Therefore, Statement 2 is also true.  Therefore, the answer is ""True, True"".  - (Criterion: 'Criterion B (Level 2): Briefly summarize the reasoning behind the chosen answer, referencing the First Isomorphism Theorem', Level: 1):   The First Isomorphism Theorem states that for any group homomorphism φ: G → H, the quotient group G/ker(φ) is isomorphic to the image of φ, denoted im(φ). This directly implies that every homomorphic image of G is isomorphic to a factor group of G (specifically, G/ker(φ)). Therefore, statement 1 is true. Statement 2 essentially rephrases statement 1, emphasizing the one-to-one correspondence (up to isomorphism) between homomorphic images and factor groups. Therefore, statement 2 is also true. The First Isomorphism Theorem provides the fundamental justification for these statements.  - (Criterion: 'Criterion C (Level 3): Acknowledge any potential nuances or alternative interpretations that might exist, even if they don't change the final answer', Level: 1):   While Statements 1 and 2 both convey the same core concept – the equivalence between homomorphic images and factor groups of a group G – there's a subtle difference in their phrasing that warrants acknowledgment.  Statement 1 explicitly states that every homomorphic image *is isomorphic to* a factor group. This is a precise and accurate mathematical statement.  Statement 2 uses the phrase ""are the same (up to isomorphism)."" While generally understood to mean the same thing in this context, it's slightly less formal. One could argue, pedantically, that ""the same"" implies a direct identity, whereas isomorphism only guarantees a structure-preserving bijection.  However, in the standard interpretation of group theory, ""the same up to isomorphism"" is considered equivalent to saying the structures are indistinguishable from a group-theoretic perspective. Therefore, the nuance doesn't change the overall truth value of the statement. Both statements are true. The difference is merely in the degree of formality and potential for overly literal interpretation.  - (Criterion: 'Criterion D (Level 1): Reiterate the definitions of ""homomorphic image"" and ""factor group"" to ensure clarity in the context of the answer', Level: 1):   A homomorphic image of a group G is the image of G under a homomorphism. If φ: G -> H is a homomorphism, then φ(G) is a subgroup of H, and φ(G) is called a homomorphic image of G.  A factor group (or quotient group) of a group G is a group formed by taking a normal subgroup N of G and defining a group operation on the cosets of N in G. The factor group is denoted G/N. The elements of G/N are the cosets gN, where g ∈ G, and the group operation is (gN)(hN) = (gh)N.  The First Isomorphism Theorem states that if φ: G -> H is a homomorphism with kernel K, then G/K is isomorphic to φ(G). In other words, the homomorphic image of G under φ is isomorphic to the factor group G/K.  - (Criterion: 'Criterion E (Level 4): Discuss how the answer would be different if we were considering rings instead of groups, highlighting the similarities and differences in the First Isomorphism Theorem for rings.', Level: 1):   The main task focuses on the First Isomorphism Theorem for groups and its implications for homomorphic images and factor groups. Criterion E asks us to consider the analogous situation for rings. While the main objective doesn't *require* a deep dive into rings, understanding the similarities and differences helps solidify the understanding of the group case. Here's how the ring analogue differs:  * **First Isomorphism Theorem for Rings:**  If φ: R → S is a ring homomorphism, then R/ker(φ) is isomorphic to im(φ).  The *structure* is exactly the same: take a ring, map it homomorphically to another ring, and you get an isomorphism between the quotient ring of the original ring by the kernel of the homomorphism and the image of the homomorphism.  * **Homomorphic Images and Factor Rings:** Just as every homomorphic image of a group is isomorphic to a factor group, every homomorphic image of a ring R is isomorphic to a factor ring R/I, where I is an ideal of R.  This is the direct analogue.  * **Key Difference: Normal Subgroups vs. Ideals:** The crucial difference lies in the structure we're ""modding out"" by. In groups, we quotient by *normal subgroups*. In rings, we quotient by *ideals*. Ideals are special subrings that absorb multiplication from the larger ring. This difference arises because rings have *two* operations (addition and multiplication), and ideals are required to behave well with respect to both. Normal subgroups are needed in the group case to ensure that the quotient group is well-defined.  * **Statement 1 and 2 Analogues for Rings:** Statement 1, ""Every homomorphic image of a ring R is isomorphic to a factor ring of R,"" is TRUE. Statement 2, ""The homomorphic images of a ring R are the same (up to isomorphism) as the factor rings of R,"" is also TRUE.  * **Impact on the Main Task:**  Understanding the ring analogue reinforces the idea that the First Isomorphism Theorem is a fundamental result that connects homomorphisms and quotients in algebraic structures. The core concept – that homomorphic images are essentially the same as quotients – holds true in both cases. Knowing that the statement is also true for rings strengthens the understanding of its validity for groups.  Therefore, even though the question is about groups, understanding the ring analogue reinforces the core concepts and highlights the fundamental nature of the First Isomorphism Theorem.   The debate will now commence."
2,ROT_Representative,"Okay, here's an analysis of the different approaches, including my own (ROT_Representative), and a justification for why my approach is preferable in this specific context.  **My Idea (ROT_Representative):**  *   **Core Idea:** ""Based on the task definition and the Fundamental Homomorphism Theorem, both statements are true. The Fundamental Homomorphism Theorem directly implies that every homomorphic image of a group G is isomorphic to a factor group of G. Furthermore, it establishes a one-to-one correspondence (up to isomorphism) between homomorphic images and factor groups. Therefore, the correct answer is ""True, True"".""  *   **How it Addresses the Problem:** It directly states the answer (""True, True"") and immediately justifies it by invoking the Fundamental Homomorphism Theorem (FHT). It succinctly connects the theorem to the truth of both statements, emphasizing the correspondence between homomorphic images and factor groups.  *   **Strengths:**     *   **Directness:** Gets straight to the point without unnecessary elaboration.     *   **Conciseness:** Efficiently explains the reasoning.     *   **Accuracy:** Correctly applies the FHT.     *   **Focus:** Stays focused on the task at hand (choosing the correct multiple-choice answer).  **GOT (Graph of Thoughts) Idea:**  *   **Core Idea:** Provides a step-by-step breakdown, proving the truth of each statement individually. It explains the mapping from a group to its factor group via the canonical projection.  *   **How it Addresses the Problem:** It systematically verifies each statement using the FHT and canonical projections.  *   **Strengths:**     *   **Thoroughness:** More detailed explanation than my idea.     *   **Clarity:** Easy to follow the logic.     *   **Correctness:** Accurate application of the FHT and the concept of canonical projections.  *   **Weaknesses:**     *   **Length:** More verbose than necessary for a multiple-choice question.     *   **Overkill:** The level of detail is excessive for simply selecting ""True, True.""     *   **Efficiency:** Less efficient in arriving at the answer compared to my approach.  **LOT (Layer of Thoughts) Idea:**  *   **Core Idea:** Explores various aspects, including nuances in phrasing, definitions, and the ring analogue.  *   **How it Addresses the Problem:** It provides a comprehensive analysis, considering alternative interpretations and related concepts.  *   **Strengths:**     *   **Comprehensive:** Covers a wide range of related topics.     *   **Insightful:** Addresses potential ambiguities and alternative perspectives.     *   **Educational:** Offers a broader understanding of the FHT and related concepts.  *   **Weaknesses:**     *   **Off-topic:** The ring analogue, while interesting, is irrelevant to the core task of answering the multiple-choice question about groups.     *   **Distracting:** The extensive discussion of nuances and definitions could distract from the primary goal.     *   **Inefficient:** Much of the information is unnecessary for selecting the correct answer.     *   **Focus Shift:** The emphasis shifts from answering the question to providing a general explanation of related concepts.  **Comparison and Justification:**  My approach (ROT_Representative) is preferable in *this specific context* because it is the most *efficient* and *direct* way to arrive at the correct answer. The task is a multiple-choice question. The GOT and LOT approaches, while valuable for deeper understanding, provide more information than is strictly required to select ""True, True.""  *   The GOT idea is good, but it spends too much time explaining the canonical projection. The essence of the FHT is enough. *   The LOT idea ventures into irrelevant territory (rings) and gets bogged down in details that don't contribute to answering the question.  My approach prioritizes *effectiveness* in the given scenario. It recognizes that the task is not to write a textbook explanation of the FHT but to quickly and accurately identify the correct answer. The FHT is well known, so simply invoking it is sufficient. While the GOT and LOT ideas offer valuable insights, they are not the most efficient way to solve the problem at hand.  **Overlooked Aspects and Limitations of GOT and LOT:**  *   **GOT:** It overlooks the fact that for a multiple-choice question, a concise justification is often more effective than a detailed proof. *   **LOT:** It overlooks the importance of staying focused on the core task. Exploring related concepts can be beneficial, but not if it detracts from the primary goal of answering the question.  **Conclusion:**  While the GOT and LOT approaches demonstrate a good understanding of the concepts, they are less effective for this particular task. My approach, as ROT_Representative, prioritizes efficiency and directness, making it the most suitable solution in this scenario. The core idea is to *reverse* the thought process from detailed explanation to concise application of the relevant theorem, thereby providing the most effective response."
3,GOT_Representative,"Okay, let's break down the problem, evaluate the provided ideas, and highlight the strengths of my approach (GOT_Representative).  **Core Idea (GOT_Representative): The analysis is correct.**  This core idea is based on the following:  1.  **Statement 1:** The Fundamental Homomorphism Theorem (FHT) directly implies that every homomorphic image of a group G is isomorphic to a factor group of G. The isomorphism is explicitly given by G/ker(phi) isomorphic to im(phi), where phi is the homomorphism.  2.  **Statement 2:** This statement asserts the equivalence (up to isomorphism) of the *set* of all homomorphic images and the *set* of all factor groups. This requires demonstrating two directions: (a) every homomorphic image is isomorphic to a factor group (covered by Statement 1), and (b) every factor group is isomorphic to a homomorphic image. The canonical projection provides the proof for (b). Given a factor group G/N, the map pi: G -> G/N defined by pi(g) = gN is a homomorphism with image G/N.  **Key Strengths:**  *   **Direct Application of FHT:** The solution hinges directly on the FHT, the central tool for this type of problem. *   **Complete Equivalence:** It recognizes that Statement 2 requires proving equivalence in both directions, not just one. *   **Clear Explanation:** The reasoning is presented clearly and concisely, making it easy to understand the logical flow.  **Evaluation of ROT (Reversal Of Thought) Idea:**  *   **Core Idea:** The ROT idea is essentially the same as the GOT idea: both statements are true based on the FHT. *   **Strengths:** Correctly identifies the FHT as the key theorem. *   **Weaknesses/Overlooked Aspects/Limitations:** While correct, it's a bit less explicit about the two directions needed to establish the equivalence in Statement 2. It doesn't explicitly demonstrate how *every* factor group can be seen as a homomorphic image via the canonical projection.  **Why GOT is preferable:** The GOT idea is slightly preferable because it explicitly addresses the two-way implication required by Statement 2. It makes the argument more complete and less open to potential misinterpretations.  **Evaluation of LOT (Layer Of Thoughts) Idea:**  *   **Core Idea:** Both statements are true, supported by the First Isomorphism Theorem. *   **Strengths:**     *   Correctly identifies the First Isomorphism Theorem (which is another name for the Fundamental Homomorphism Theorem).     *   Provides definitions of homomorphic image and factor group.     *   Considers nuances in the phrasing of the statements.     *   Explores the analogous situation for rings. *   **Weaknesses/Overlooked Aspects/Limitations:**     *   The ""Criterion C"" section, while acknowledging a nuance, might be unnecessarily verbose. It overemphasizes a potential (and unlikely) misinterpretation of ""the same.""     *   ""Criterion E,"" while interesting, is beyond the scope of the core problem. Including it adds complexity without directly improving the core answer.     *   The LOT idea has a lot of extra information that is not strictly necessary to answer the question correctly. While this is good for understanding, it also makes the answer less concise.  **Why GOT is preferable:** The GOT idea is preferable because it is more focused and concise. It provides the necessary information to answer the question correctly without adding unnecessary details. The LOT idea, while comprehensive, becomes less clear due to the inclusion of peripheral information. GOT's brevity and directness make it a stronger answer.  **In summary:** All three ideas (GOT, ROT, and LOT) arrive at the correct answer: ""True, True."" However, the GOT idea is the most effective because it directly addresses the core problem, provides a clear and concise explanation, and explicitly covers both directions required to establish the equivalence of homomorphic images and factor groups. The ROT idea is similar but slightly less explicit. The LOT idea, while comprehensive, includes information beyond the scope of the core question, making it less focused. Therefore, the GOT approach is preferable."
