Round,Speaker,Utterance
1,Moderator,"Debate Topic: In-depth discussion based on the mission context and ideas from ROT and LOT. Mission Context (partial): Instruction: Find the generator for the finite field Z_7.  Context: The following are multiple choice options:[1, 2, 3, 4]... Initial Core Idea from ROT (partial): Okay, I understand the task. I need to find a generator for the finite field Z_7 from the given options [1, 2, 3, 4].  A generator is an element that, when raised to successive powers modulo 7, produces all the non-zero elements of Z_7 (which are 1, 2, 3, 4, 5, and 6).  Let's test each option:  *   **1:**  1 raised to any power is always 1. So, 1 cannot be a generator.  *   **2:**     *   2^1 mod 7 = 2     *   2^2 mod 7 = 4     *   2^3 mod 7 = 8 mod 7 = 1     The powers of 2 only generate {1, 2, 4}. So, 2 is not a generator.  *   **3:**     *   3^1 mod 7 = 3     *   3^2 mod 7 = 9 mod 7 = 2     *   3^3 mod 7 = 27 mod 7 = 6     *   3^4 mod 7 = 81 mod 7 = 4     *   3^5 mod 7 = 243 mod 7 = 5     *   3^6 mod 7 = 729 mod 7 = 1     The powers of 3 generate {1, 2, 3, 4, 5, 6}. So, 3 is a generator.  *   **4:**     *   4^1 mod 7 = 4     *   4^2 mod 7 = 16 mod 7 = 2     *   4^3 mod 7 = 64 mod 7 = 1     The powers of 4 only generate {1, 2, 4}. So, 4 is not a generator.  Therefore, the generator for the finite field Z_7 from the given options is 3.  ``` 3 ```... Initial Detailed Plan from LOT (partial): Aggregated result from layer 163 (Concept: 'Generate and present the answer based on the plan...') using strategy 'all_content_ranked': - (Criterion: 'Criterion T: (Level 1) Present the final answer clearly and concisely, stating the generator for Z_7 from the given multiple-choice options.', Level: 1):   The problem asks us to find a generator for the finite field Z_7 from the options [1, 2, 3, 4]. A generator 'g' of Z_7 (where Z_7* represents the multiplicative group of integers modulo 7, i.e., {1, 2, 3, 4, 5, 6}) is an element such that its powers generate all the non-zero elements of Z_7. We need to test each option.  *   **1:** 1^1 = 1, 1^2 = 1, 1^3 = 1, ...  It only generates 1, so it's not a generator.  *   **2:** 2^1 = 2, 2^2 = 4, 2^3 = 8 ≡ 1 (mod 7). It generates {1, 2, 4}, so it's not a generator.  *   **3:** 3^1 = 3, 3^2 = 9 ≡ 2 (mod 7), 3^3 = 27 ≡ 6 (mod 7), 3^4 = 81 ≡ 4 (mod 7), 3^5 = 243 ≡ 5 (mod 7), 3^6 = 729 ≡ 1 (mod 7).  It generates {1, 2, 3, 4, 5, 6}, so it is a generator.  *   **4:** 4^1 = 4, 4^2 = 16 ≡ 2 (mod 7), 4^3 = 64 ≡ 1 (mod 7). It generates {1, 2, 4}, so it's not a generator.  Therefore, the generator for Z_7 from the multiple-choice options is 3.  - (Criterion: 'Criterion U: (Level 2) Explain why the other options are not generators in a single sentence each.', Level: 1):   Okay, here's why the other options (1, 4) are not generators of Z_7:  *   **1:** 1 cannot be a generator because any power of 1 is always 1, and therefore it can't generate all the elements of Z_7. *   **4:** 4 is not a generator because its powers cycle through only {4, 2, 1} modulo 7, and cannot generate all non-zero elements.  - (Criterion: 'Criterion V: (Level 3) Generalize the process of finding generators for Z_p, where p is a prime number, and mention the number of generators that exist.', Level: 1):   Criterion V: (Level 3) Generalize the process of finding generators for Z_p, where p is a prime number, and mention the number of generators that exist.  To find a generator for the multiplicative group of a finite field Z_p (where p is a prime number), we need to find an element 'g' such that its powers modulo p generate all the elements from 1 to p-1.  In other words, the set {g^1 mod p, g^2 mod p, ..., g^(p-1) mod p} should be equal to {1, 2, ..., p-1}.  The key is to check the order of each element in Z_p*. The order of an element 'a' is the smallest positive integer 'k' such that a^k ≡ 1 (mod p). An element 'g' is a generator if its order is p-1.  To efficiently check if an element 'a' is a generator, we can use the following: 1. Find the prime factorization of p-1:  p-1 = q_1^e_1 * q_2^e_2 * ... * q_n^e_n, where q_i are distinct prime factors and e_i are their exponents. 2. For each prime factor q_i of p-1, compute a^((p-1)/q_i) mod p. 3. If a^((p-1)/q_i) mod p is not equal to 1 for all i, then 'a' is a generator of Z_p*.  **Number of Generators:**  The number of generators for Z_p* is given by Euler's totient function, φ(p-1), which counts the number of integers between 1 and p-1 that are relatively prime to p-1.  Therefore, there are φ(p-1) generators for Z_p*.  For example, in Z_7, p=7, so p-1 = 6. The prime factorization of 6 is 2 * 3.  φ(6) = φ(2) * φ(3) = (2-1) * (3-1) = 1 * 2 = 2. So, Z_7 has 2 generators.  - (Criterion: 'Criterion W: (Level 2) Provide an alternative method for verifying that a candidate is a generator by checking if its order divides p-1, where p=7.', Level: 1):   Criterion W suggests an alternative method to verify if a candidate element 'g' is a generator of Z_7*. This involves checking if the order of 'g' divides p-1, where p=7. Since p-1 = 6, we need to verify that the order of 'g' divides 6. The divisors of 6 are 1, 2, 3, and 6. If the order of 'g' is 6, then 'g' is a generator. If the order of 'g' is 1, 2, or 3, then 'g' is not a generator. This method provides a slightly faster way to rule out non-generators compared to calculating all powers up to p-1.  - (Criterion: 'Criterion X: (Level 3) Discuss the connection between the generators of Z_7 and the primitive roots modulo 7.', Level: 1):   The generators of the multiplicative group of the finite field Z_7 (denoted as Z_7*) are precisely the primitive roots modulo 7. A primitive root modulo 7 is an integer 'g' such that its powers generate all the non-zero elements of Z_7. In other words, the set {g^1 mod 7, g^2 mod 7, g^3 mod 7, g^4 mod 7, g^5 mod 7, g^6 mod 7} should be equal to {1, 2, 3, 4, 5, 6}. This connection is crucial because finding a generator for Z_7 is equivalent to finding a primitive root modulo 7. The order of Z_7* is 6 (since it contains all elements except 0). Therefore, we are looking for an element 'g' such that the smallest positive integer 'k' for which g^k ≡ 1 (mod 7) is k=6.  - (Criterion: 'Criterion Y: (Level 1) Verify the answer by listing all the elements generated by the identified generator.', Level: 1):   To verify that a number `g` is a generator for Z_7, we need to compute the powers of `g` modulo 7 and ensure that they generate all the non-zero elements of Z_7 (i.e., {1, 2, 3, 4, 5, 6}). We will test the potential generators given in the options: 1, 2, 3, and 4.  *   **If g = 1:**      *   1^1 mod 7 = 1     *   1^2 mod 7 = 1     *   1^3 mod 7 = 1     *   1^4 mod 7 = 1     *   1^5 mod 7 = 1     *   1^6 mod 7 = 1     Clearly, 1 only generates {1}, and is not a generator.  *   **If g = 2:**      *   2^1 mod 7 = 2     *   2^2 mod 7 = 4     *   2^3 mod 7 = 8 mod 7 = 1     *   2^4 mod 7 = 16 mod 7 = 2     *   2^5 mod 7 = 32 mod 7 = 4     *   2^6 mod 7 = 64 mod 7 = 1     2 generates {1, 2, 4}, and is not a generator.  *   **If g = 3:**      *   3^1 mod 7 = 3     *   3^2 mod 7 = 9 mod 7 = 2     *   3^3 mod 7 = 27 mod 7 = 6     *   3^4 mod 7 = 81 mod 7 = 4     *   3^5 mod 7 = 243 mod 7 = 5     *   3^6 mod 7 = 729 mod 7 = 1     3 generates {1, 2, 3, 4, 5, 6}, and is a generator.  *   **If g = 4:**      *   4^1 mod 7 = 4     *   4^2 mod 7 = 16 mod 7 = 2     *   4^3 mod 7 = 64 mod 7 = 1     *   4^4 mod 7 = 256 mod 7 = 4     *   4^5 mod 7 = 1024 mod 7 = 2     *   4^6 mod 7 = 4096 mod 7 = 1     4 generates {1, 2, 4}, and is not a generator.  Therefore, 3 is a generator for Z_7.  - (Criterion: 'Criterion Z: (Level 2) Discuss the uniqueness of the generator in Z_7 and whether other elements can also be generators.', Level: 1):   In the finite field Z_7 (integers modulo 7), a generator is an element 'g' such that its powers (g^1, g^2, g^3, ..., g^6) produce all the non-zero elements of Z_7. The multiplicative group of Z_7, denoted as Z_7*, consists of the elements {1, 2, 3, 4, 5, 6}. The order of this group is 6 (7-1).  The generator is not unique. If 'g' is a generator, then g^k is also a generator if and only if gcd(k, 6) = 1.  The numbers k such that gcd(k, 6) = 1 are 1 and 5. Therefore, if 'g' is a generator, then g^5 is also a generator.  For example, if 3 is a generator, then 3^5 mod 7 = 5 is also a generator.  In general, there are φ(6) = φ(2*3) = (2-1)(3-1) = 1*2 = 2 generators.  ... The debate will now commence focusing on these ideas."
2,ROT_Representative,"Okay, I will analyze the provided information and respond to the prompt.  **1. Elaboration on the ROT Idea and its Strengths**  My core idea directly addresses the problem by systematically testing each of the multiple-choice options [1, 2, 3, 4] to determine which one is a generator for Z_7. I apply the definition of a generator: an element whose powers modulo 7 produce all the non-zero elements of Z_7 (1, 2, 3, 4, 5, 6).  The key strengths of my approach are:  *   **Directness:** It is a straightforward application of the definition of a generator. *   **Exhaustiveness (within the given options):** It guarantees finding the correct answer because it tests all possibilities. *   **Clarity:** The calculations are simple and easy to follow. *   **Correctness:** The modular arithmetic is accurate, leading to the correct conclusion.  It directly computes the powers of each candidate and checks if the resulting set matches {1, 2, 3, 4, 5, 6}. If it does, that element is a generator.  **2. Critical Evaluation of the LOT Idea**  The LOT idea presents a more comprehensive approach by including various criteria, from basic verification to more advanced concepts like Euler's totient function and primitive roots. However, when focusing on the core task of *finding* the generator from the given options, there are some potential weaknesses in the LOT approach *compared to my ROT idea*:  *   **Criterion T (Level 1): Present the final answer clearly and concisely...:** This criterion accurately identifies the generator as 3 by testing each option. It is essentially the same as my approach. *   **Criterion U (Level 2): Explain why the other options are not generators...:** This elaborates on why 1 and 4 are not generators. While useful, it's not strictly necessary for *finding* the generator; it's more about explaining the *why* after the fact. *   **Criterion V (Level 3): Generalize the process of finding generators for Z_p...:** This is a good generalization, introducing the concept of order and Euler's totient function. However, it's overkill for the initial problem. The prime factorization and Euler's totient function are unnecessary to solve this specific problem with the limited options provided. It adds complexity without directly contributing to the core task. *   **Criterion W (Level 2): Provide an alternative method for verifying...:** This suggests verifying by checking if the order divides p-1. Again, this is a valid method, but it's less direct for the purpose of simply finding the generator from the given options than directly computing the powers. It requires understanding and applying the concept of order. *   **Criterion X (Level 3): Discuss the connection between the generators of Z_7 and the primitive roots...:** This is again a theoretical connection that is not required to solve the problem. *   **Criterion Y (Level 1): Verify the answer by listing all the elements generated...:** This is similar to my approach and is essential to verify that 3 is indeed a generator. *   **Criterion Z (Level 2): Discuss the uniqueness of the generator in Z_7...:** This discusses the uniqueness of generators and is good information but unnecessary for solving the core problem.  **Weaknesses, Overlooked Aspects, and Limitations of the LOT Idea compared to the ROT Idea:**  *   **Over-Complication:** LOT introduces concepts like Euler's totient function, prime factorization, and primitive roots, which, while relevant to the general theory, are unnecessary for the specific task of selecting a generator from a small set of given options. My ROT approach focuses solely on the essential calculation. *   **Efficiency:** LOT's generalized methods, while powerful, are less efficient for this specific problem. My ROT method is more direct and computationally simpler within the constraints of the multiple-choice options. The alternative verification method (Criterion W) is less direct than computing the powers of each candidate. *   **Focus:** LOT is more focused on explaining the *why* and generalizing the concept, while my ROT is focused on *finding* the answer as quickly and directly as possible. *   **Cognitive Load:** LOT requires a higher level of mathematical understanding to implement the more general methods. My approach requires only basic modular arithmetic.  **Why my approach might be preferable:**  My ROT approach is preferable in this specific context because it is:  *   **Simpler:** Easier to understand and implement. *   **More Direct:** Directly addresses the problem of finding a generator from the given options. *   **More Efficient:** Requires fewer calculations and less theoretical knowledge. *   **More Focused:** Avoids unnecessary generalizations and theoretical discussions.  In summary, while the LOT idea provides a more comprehensive understanding of generators in finite fields, my ROT idea is more efficient and direct for solving the given problem. My method is preferable because it is the simplest and most effective way to identify the generator from the provided multiple-choice options."
3,LOT_Representative,"Okay, I will now respond to the prompt as the LOT Representative.  **1. Elaboration on how the LOT Detailed Plan Addresses the Core Problem and its Strengths and Feasibility**  The LOT detailed plan directly addresses the core problem of finding a generator for the finite field Z_7 from the given multiple-choice options [1, 2, 3, 4]. It achieves this through a multi-faceted approach, structured around several criteria that ensure both accuracy and a deeper understanding of the problem.  *   **Criterion T (Level 1):** This criterion is the foundation of the solution. It directly implements the definition of a generator by testing each option (1, 2, 3, and 4) to see if its powers modulo 7 generate all the non-zero elements of Z_7 (1, 2, 3, 4, 5, 6). The calculations are explicit and easy to follow, leading to the identification of 3 as the generator. *   **Criterion U (Level 2):** This criterion reinforces the solution by explaining why the other options (1 and 4) are not generators. This strengthens the understanding of the concept and provides a more complete answer. *   **Criterion Y (Level 1):** This criterion provides explicit verification of the answer found in Criterion T. It walks through each candidate, demonstrating precisely which values are generated and conclusively proving that 3 is a generator while the others are not. *   **Criterion V (Level 3):** While not strictly necessary for solving the immediate problem, Criterion V generalizes the process of finding generators for Z_p (where p is a prime number). This demonstrates a broader understanding of finite fields and provides a more efficient method for finding generators in larger fields. It correctly states the method of prime factorization of p-1 and using Euler's totient function to calculate the number of generators. *   **Criterion W (Level 2):** Introduces an alternative verification method by checking if the order of a candidate divides p-1. This method provides an alternative pathway that could improve efficiency in certain scenarios. *   **Criterion X (Level 3):** Discusses the connection between generators of Z_7 and primitive roots, further enriching the theoretical understanding of the problem. *   **Criterion Z (Level 2):** Discusses the uniqueness of generators and correctly identifies that there are multiple generators (specifically 2) and how to find them.  **Key Strengths:**  *   **Correctness:** The modular arithmetic and logic are accurate, ensuring the correct identification of the generator. *   **Completeness:** It not only identifies the generator but also explains why the other options are not generators, verifies the solution, and discusses related concepts. *   **Versatility:** It provides a general method for finding generators in other finite fields (Z_p). *   **Clarity:** The explanations are clear and easy to understand. *   **Thoroughness:** It covers multiple aspects of the problem, from basic identification to more advanced concepts.  **Feasibility:**  The LOT plan is highly feasible. The calculations are straightforward and can be easily performed manually or with a simple calculator. The theoretical concepts are explained in a clear and accessible manner, making the plan understandable even to someone with a basic understanding of number theory.  **2. Critical Evaluation of the ROT Idea**  The ROT idea is a valid approach to solving the problem. It directly tests each option to see if it is a generator, which is a simple and straightforward method. The calculations are correct, and the conclusion is accurate.  **3. Weaknesses, Overlooked Aspects, and Limitations of the ROT Idea Compared to the LOT Plan, and Why the LOT Approach Might Be Preferable:**  While the ROT idea correctly identifies the generator, it has several weaknesses and limitations compared to the LOT plan:  *   **Lack of Explanation:** The ROT idea only states that 1, 2, and 4 are not generators without providing a clear explanation as to *why* they are not generators (beyond stating that 1 raised to any power is 1). The LOT plan explicitly explains why 1 and 4 fail to be generators. *   **Limited Scope:** The ROT idea is limited to the specific problem of finding a generator for Z_7 from the given options. It does not generalize the process or provide a method for finding generators in other finite fields. The LOT plan provides a general method for finding generators in Z_p. *   **Lack of Verification:** While the ROT idea implicitly verifies the answer by calculating the powers of 3, it does not explicitly state that this is a verification step. The LOT plan includes a specific criterion (Criterion Y) for verifying the answer. *   **Misses other key concepts:** The ROT idea doesn't explore related concepts such as primitive roots or the number of generators. *   **No alternative methods:** The ROT only provides one method, while the LOT provides alternative approaches for verification.  **Why the LOT Approach Might Be Preferable:**  The LOT approach is preferable because it provides:  *   **A more complete understanding:** It explains *why* the other options are not generators and generalizes the process for finding generators in other finite fields. *   **Explicit verification:** It includes a specific step for verifying the answer. *   **Greater versatility:** It provides a general method for finding generators in other finite fields (Z_p). *   **Broader knowledge:** It provides a more complete understanding of the concept of generators and related concepts such as primitive roots.  In summary, while the ROT idea is a valid and straightforward approach to solving the specific problem, the LOT plan provides a more complete, versatile, and theoretically sound solution. The LOT approach offers a deeper understanding of the concept of generators and related concepts, making it a preferable approach. Therefore, the LOT plan is superior because it offers greater depth, breadth, and understanding."
4,Critical_Analyst,"Okay, I will analyze the ROT and LOT ideas to find the generator for the finite field Z_7 from the given multiple-choice options [1, 2, 3, 4].  **ROT Evaluation:**  *   **Strengths:** ROT's approach is direct, simple, and efficient for the given problem. It correctly applies the definition of a generator and tests each option. The calculations are accurate, and the final answer is correct. *   **Weaknesses:** ROT focuses solely on finding the answer and lacks explanation of why the other options fail, limiting the understanding. It doesn't generalize to other finite fields or related concepts. *   **Overlooked Aspects:** ROT doesn't explicitly verify the answer, although the calculations implicitly serve as verification. It does not discuss uniqueness or the number of generators. *   **Improvements:** While effective for this specific problem, ROT could benefit from a brief explanation of why the non-generators fail to satisfy the condition. *   **Correctness and Completeness:** Correct but not complete. It finds the correct answer but doesn't provide a comprehensive understanding.  **LOT Evaluation:**  *   **Strengths:** LOT provides a more comprehensive understanding of the problem. It identifies the generator, explains why other options are not generators, and verifies the solution. It generalizes the process for finding generators in other finite fields (Z_p) and discusses related concepts like Euler's totient function and primitive roots. *   **Weaknesses:** LOT's generalization introduces complexity not strictly required for the problem. While valuable, the additional information can increase cognitive load. *   **Overlooked Aspects:** While thorough, LOT could have explicitly linked Criterion Y back to Criterion T, emphasizing that the verification process reinforces the solution found earlier. *   **Improvements:** Streamline the generalized process for Z_p to emphasize its applicability to larger fields without overshadowing the simplicity required for solving the Z_7 problem. *   **Correctness and Completeness:** Correct and more complete than ROT. It offers a broader perspective and deeper understanding.  **Comparative Analysis:**  ROT provides a quick and efficient solution, perfect for a multiple-choice question. However, LOT's thoroughness offers a better understanding of the underlying concepts. In the context of simply finding the generator from the given options, ROT's directness is valuable. However, LOT's explanation and generalization provide a more robust solution.  **Points of Caution:**  *   **ROT:** Relying solely on ROT might lead to a superficial understanding of generators in finite fields. *   **LOT:** The detailed approach of LOT might be overkill if the only goal is to quickly identify the generator from a limited set of options.  **Balanced Overall Critique:**  Both ROT and LOT have their strengths and weaknesses. ROT is efficient and direct, whereas LOT is thorough and comprehensive. The choice between the two depends on the desired level of understanding and the specific requirements of the task. If the task is solely to find the generator from the given options, ROT is adequate. If the task involves understanding the concept of generators and related topics, LOT is preferable.  ### Synthesized Accurate Answer: 3"
