Round,Speaker,Utterance
1,Moderator,"Debate Topic: In-depth discussion based on the following mission context, ROT idea, GOT idea, and LOT idea. Mission Context: Instruction: Out of the 200 apples in an orchard, 40 percent were rotten. Also, 70 percent of the rotten apples smelled. How many rotten apples in the orchard did not smell? Initial Core Idea from GOT: Okay, I understand. Based on the provided Task Definition, Pseudocode, Logical Pseudocode, Case Examples, and Input-Output Format, I will solve the given problem.  **Problem:**  Input: `""Out of the 200 apples in an orchard, 40 percent were rotten. Also, 70 percent of the rotten apples smelled. How many rotten apples in the orchard did not smell?""`  **Solution:**  Following the steps outlined in the Task Definition:  1.  **Extract Values:**     *   `total_apples = 200`     *   `rotten_percentage = 40`     *   `smell_percentage = 70`  2.  **Calculate Rotten Apples:**     *   `rotten_apples = 200 * (40 / 100) = 200 * 0.4 = 80`  3.  **Calculate Smelly Rotten Apples:**     *   `smelly_rotten_apples = 80 * (70 / 100) = 80 * 0.7 = 56`  4.  **Calculate Non-Smelly Rotten Apples:**     *   `non_smelly_rotten_apples = 80 - 56 = 24`  5.  **Return:** The number of rotten apples that did not smell is 24.  **Answer:**  ``` 24 ``` Initial Core Idea from GOT: 2. **Calculate the number of rotten apples that smelled:**  Next, find out how many of the rotten apples smelled. Multiply the total number of rotten apples (80) by the percentage that smelled (70% or 0.70). This will give you the number of rotten apples that had a smell.  **Find the number of rotten apples that smelled:** 80 rotten apples * 70% = 56 rotten apples that smelled.  Initial Detailed Plan from LOT: Aggregated result from layer 55 (Concept: 'Generate and present the answer...') using strategy 'all_content_ranked': - (Criterion: 'Criterion: Present the final answer in different formats (e.g., sentence, equation, short paragraph)', Level: 1):   Here are different ways to present the final answer:  *   **Sentence:** There were 12 rotten apples in the orchard that did not smell. *   **Equation:** 200 apples * 0.40 (rotten) * 0.30 (no smell) = 24 apples *   **Short Paragraph:** First, we calculated the number of rotten apples: 200 * 0.40 = 80. Then, we found the percentage of rotten apples that did *not* smell: 100% - 70% = 30%. Finally, we calculated the number of rotten apples that didn't smell: 80 * 0.30 = 24. Therefore, 24 rotten apples did not smell. *   **Numerical Answer:** 24  - (Criterion: 'Criterion: Re-state the problem and the answer together for clarity', Level: 1):   The problem is: Out of 200 apples, 40% were rotten. 70% of the rotten apples smelled. How many rotten apples did not smell?  The answer is: 24 rotten apples did not smell.  - (Criterion: 'Criterion: Express the answer with and without units', Level: 1):   Here's the solution expressed with and without units:  **With Units:**  *   Number of rotten apples that did not smell: 12 apples  **Without Units:**  *   12  - (Criterion: 'Criterion: Generate alternative wordings for the final answer (e.g., ""The number of rotten apples that didn't smell was 24"" vs. ""24 rotten apples were not odorous"")', Level: 1):   Here are a few alternative wordings for the final answer, focusing on clarity and potentially different nuances:  *   **""There were 24 rotten apples in the orchard that did not smell.""** (Straightforward and clear) *   **""24 of the rotten apples in the orchard were odorless.""** (Uses a slightly more formal word, ""odorless"") *   **""Of the rotten apples, 24 did not have a smell.""** (Emphasizes that we're only considering the rotten apples) *   **""In the orchard, 24 rotten apples were not odorous.""** (Similar to the original example, but with slightly different phrasing) *   **""A total of 24 rotten apples in the orchard lacked a smell.""** (Uses ""lacked a smell"" for variety)  - (Criterion: 'Criterion: Present the solution with varying levels of verbosity (e.g., very concise vs. more explanatory)', Level: 1):   **Concise Solution:**  1. Rotten apples: 200 * 0.40 = 80 2. Rotten apples that smelled: 80 * 0.70 = 56 3. Rotten apples that did not smell: 80 - 56 = 24  Answer: 24  **More Explanatory Solution:**  1. **Calculate the number of rotten apples:**  The problem states that 40% of the 200 apples are rotten.  To find this number, we multiply the total number of apples by the percentage that are rotten: 200 apples * 0.40 = 80 rotten apples.  2. **Calculate the number of rotten apples that smelled:** We know that 70% of the rotten apples smelled.  To find this number, we multiply the total number of rotten apples (80) by the percentage that smelled: 80 rotten apples * 0.70 = 56 rotten apples that smelled.  3. **Calculate the number of rotten apples that did not smell:**  To find the number of rotten apples that did *not* smell, we subtract the number of rotten apples that smelled from the total number of rotten apples: 80 rotten apples - 56 rotten apples = 24 rotten apples.  Answer: There were 24 rotten apples in the orchard that did not smell.  - (Criterion: 'Criterion: Consider edge cases or potential ambiguities in the problem statement and address them in the answer (e.g., What if the percentage was not a whole number?)', Level: 1):   The problem states that 40% of the 200 apples were rotten, and 70% of the rotten apples smelled. We are asked to find the number of rotten apples that did *not* smell.  While the percentages are whole numbers in this specific case, it's important to understand how to handle non-whole number percentages in general. The calculations remain the same: we multiply the percentage (expressed as a decimal) by the total number. If a percentage resulted in a non-integer number of apples, we would generally round to the nearest whole apple, as you can't have a fraction of an apple.  In this case, 40% of 200 is (0.40 * 200) = 80 rotten apples. 70% of these 80 rotten apples smelled. Therefore, 30% (100% - 70%) of the rotten apples did *not* smell.  So, the number of rotten apples that did not smell is (0.30 * 80) = 24.  - (Criterion: 'Criterion: Highlight the key steps leading to the final answer to emphasize the logic (e.g., bolding key phrases or numbers).', Level: 1):   Here's a breakdown of the key steps, highlighting the crucial information:  1.  **Calculate the total number of rotten apples:** 40% of 200 apples = 0.40 * 200 = **80 rotten apples**. 2.  **Calculate the number of rotten apples that smelled:** 70% of 80 rotten apples = 0.70 * 80 = **56 rotten apples**. 3.  **Calculate the number of rotten apples that did NOT smell:** 80 rotten apples - 56 rotten apples = **24 rotten apples**.  Therefore, **24 rotten apples** in the orchard did not smell.   The debate will now commence."
2,ROT_Representative,"Okay, I understand. Based on the provided Task Definition, Pseudocode, Logical Pseudocode, Case Examples, and Input-Output Format, I will solve the given problem.  My core idea, as the ROT (Reversal Of Thought) Representative, is to demonstrate a clear, step-by-step solution derived directly from the problem statement, ensuring accuracy and ease of understanding. I focus on extracting the relevant numerical information and then applying the correct arithmetic operations in a logical sequence. The primary strength is its straightforwardness and reliability in producing the correct answer. It's about following instructions precisely and executing the necessary calculations without unnecessary complexity.  Now, let's critically evaluate the GOT and LOT ideas in comparison.  **GOT (Graph Of Thoughts) Evaluation:**  The provided GOT excerpt focuses on calculating the number of rotten apples that smelled. While accurate in its calculation (80 * 0.70 = 56), it only addresses *one* step of the problem.  *   **Weaknesses:** The GOT fragment is incomplete. It doesn't address the entire problem, specifically the crucial step of calculating the *number of rotten apples that did NOT smell*. It's a partial solution, not a complete one. *   **Overlooked Aspects:** The GOT overlooks the final subtraction step needed to arrive at the answer. It stops prematurely. *   **Limitations:** It's limited to a single calculation, making it insufficient for solving the problem independently.  **LOT (Layer Of Thoughts) Evaluation:**  The LOT excerpt presents a variety of ways to express the final answer and solution process. While commendable for its thoroughness in presentation, it contains an error in the *initial* answer stated in several of its examples.  *   **Weaknesses:** The LOT *initially* incorrectly states the final answer as ""12"" instead of ""24"" in the sentence and numerical answer examples. Although it corrects itself later, the presence of this error undermines its reliability. Also, while the detailed explanations are helpful, they can also be seen as overkill for a relatively simple problem, potentially obscuring the core logic. *   **Overlooked Aspects:** While it does address edge cases, such as non-whole number percentages, this is beyond the scope of the immediate problem's requirements. The primary focus should be on solving the problem accurately first. *   **Limitations:** The LOT's strength lies in presentation, but its initial inaccuracy is a significant flaw. The excessive verbosity might also confuse users searching for the simplest and most direct solution.  **Why My Approach Is Preferable:**  My approach prioritizes accuracy and clarity in the core calculation. It directly addresses the problem statement in a sequential manner: extract values, calculate rotten apples, calculate smelly rotten apples, calculate non-smelly rotten apples, and return the result.  *   **Strengths:**     *   **Accuracy:** My solution guarantees the correct answer from the outset.     *   **Simplicity:** It avoids unnecessary complexity, focusing on the essential calculations.     *   **Completeness:** It provides a complete solution, addressing all necessary steps.     *   **Directness:** The steps are directly derived from the problem statement, making it easy to follow.  In essence, while the GOT offers a correct partial calculation and the LOT explores various presentation formats (albeit with an initial numerical error), my approach provides a complete, accurate, and straightforward solution that directly answers the problem's question in the most efficient way. My focus is on providing the correct answer first and foremost, which is the primary goal of the task. The other methods add value but are less useful if the underlying calculation or initial answer is flawed or incomplete."
3,GOT_Representative,"Okay, as the GOT Representative, let's analyze the core idea and compare it with the ROT and LOT approaches.  **Core Idea Elaboration:**  My core idea, ""Calculate the number of rotten apples that smelled: Next, find out how many of the rotten apples smelled. Multiply the total number of rotten apples (80) by the percentage that smelled (70% or 0.70). This will give you the number of rotten apples that had a smell. Find the number of rotten apples that smelled: 80 rotten apples * 70% = 56 rotten apples that smelled,"" focuses on a specific, necessary step in solving the problem.  It directly addresses the intermediate calculation required to determine the final answer.  *   **How it Addresses the Core Problem:** The problem asks for the number of *non-smelling* rotten apples. To get there, we *must* first determine the number of *smelling* rotten apples. This idea provides that crucial calculation. It breaks down a larger problem into a manageable, understandable step.  *   **Key Strengths:**     *   **Clarity:** It's a single, focused calculation, making it easy to understand.     *   **Essential Step:** It targets a calculation without which the problem cannot be solved.     *   **Direct Application:**  The calculation is immediately applicable to the problem context.  **Critical Evaluation of ROT (Reversal of Thought):**  The ROT approach correctly solves the problem by extracting values, calculating rotten apples, calculating smelly rotten apples, and then calculating non-smelly rotten apples.  *   **Potential Weaknesses:** While the ROT approach arrives at the correct answer, it lacks explicit justification for *why* each step is being performed. It is a purely procedural breakdown. While useful, it doesn't highlight the *reasoning* behind the calculations to the same degree. It's more of an algorithm than a thought process.  *   **Overlooked Aspects:** The ROT approach doesn't explicitly state the logical connection between finding the number of smelly apples and finding the number of non-smelly apples. It implicitly assumes the reader understands that subtracting the smelly apples from the total rotten apples will yield the desired result.  *   **Limitations:** The ROT approach is a ""black box"" solution. It doesn't invite the user to deeply understand the problem's structure.  **Critical Evaluation of LOT (Layer of Thoughts):**  The LOT approach, with its multiple layers of analysis and presentation, attempts to address many potential needs of the user. It covers various criteria, from presenting the answer in different formats to considering edge cases.  *   **Potential Weaknesses:** The LOT approach can be overwhelming. While comprehensive, the sheer volume of information might distract from the core logic. Some of the layers, like generating alternative wordings, are less critical to the core mathematical understanding of the problem. *   **Overlooked Aspects:** While LOT addresses edge cases *generally*, it doesn't focus on potential misinterpretations of the problem itself. It assumes a correct initial understanding. *   **Limitations:** The LOT approach sacrifices conciseness for comprehensiveness. It might be overkill for someone who simply needs to understand the core mathematical logic. The initial calculation of the number of smelly apples is not explicitly highlighted as a crucial intermediate step.  **Why My Approach is Preferable:**  My GOT approach, focusing on the specific calculation of ""smelly rotten apples,"" is preferable because:  1.  **Focus and Clarity:** It isolates a single, critical step in the problem-solving process, making it easier to understand *why* that calculation is necessary.  2.  **Building Block Approach:** It presents a building block of the solution. By understanding how to calculate the number of smelly apples, the user gains a deeper understanding of the problem's structure and how to arrive at the final answer.  3.  **Targeted Explanation:** It provides a targeted explanation of *why* this specific calculation is being performed.  While the ROT provides the correct answer in a procedural way and the LOT offers a comprehensive overview, my GOT approach provides a more focused and insightful understanding of the problem's structure by highlighting a key intermediate step and justifying its importance. It fosters a deeper understanding of the mathematical reasoning involved. It is not just about getting the answer but understanding *how* and *why* we arrive at it."
4,LOT_Representative,"Okay, as the LOT Representative, let's break down my core idea and compare it to the GOT and ROT approaches.  **Core Idea Elaboration: Aggregated Result from Layer 55 (Concept: ""Generate and present the answer..."") using strategy 'all_content_ranked'**  My core idea focuses on presenting the final answer in a multitude of ways to ensure clarity, address potential ambiguities, and cater to different understanding levels. This involves:  *   **Multiple Formats:** Presenting the answer as a sentence, equation, short paragraph, and numerical value. *   **Problem Restatement:** Clearly restating the problem and the answer together. *   **Units:** Expressing the answer with and without units. *   **Alternative Wordings:** Generating different ways to phrase the final answer. *   **Varying Verbosity:** Providing both concise and explanatory solutions. *   **Edge Case Consideration:** Addressing potential ambiguities or edge cases in the problem statement (e.g., non-integer percentages). *   **Highlighting Key Steps:** Emphasizing the logic by bolding key phrases and numbers.  **How it Addresses the Core Problem:**  The mission is to calculate the number of rotten apples that didn't smell. My approach doesn't just calculate the answer; it *communicates* the answer effectively. It ensures the user not only gets the correct number but also understands *why* it's the correct number and how it relates back to the original problem. The multiple presentations reinforce understanding and cater to diverse learning styles.  **Key Strengths:**  *   **Clarity and Comprehensiveness:** The multiple presentations ensure clarity and cater to various learning styles. *   **Robustness:** The inclusion of edge-case handling shows a deeper understanding of the problem and its potential variations. *   **Educational Value:** The varying levels of verbosity and highlighting key steps enhance the educational value, making it easier for users to learn the underlying principles. *   **Accessibility:** The various formats and alternative wordings make the solution more accessible to a wider audience.  **Critical Evaluation of GOT (Graph Of Thoughts) and ROT (Reversal Of Thought):**  Let's examine the provided GOT and ROT ideas:  **GOT Idea:**  ""2. **Calculate the number of rotten apples that smelled:** Next, find out how many of the rotten apples smelled. Multiply the total number of rotten apples (80) by the percentage that smelled (70% or 0.70). This will give you the number of rotten apples that had a smell.  **Find the number of rotten apples that smelled:** 80 rotten apples * 70% = 56 rotten apples that smelled.""  *   **Weaknesses:** This excerpt from the GOT focuses solely on one calculation step. It lacks the broader context, alternative presentations, and robustness of my approach. It doesn't address potential ambiguities or offer different levels of explanation. It's a single, isolated calculation.  *   **Overlooked Aspects:** It overlooks the need to restate the problem, provide alternative wordings, and address potential edge cases. The focus is purely on the calculation itself, not on effective communication.  *   **Limitations:** It provides a limited understanding and is not as helpful as my approach when it comes to learning and understanding the problem.  **ROT Idea:**  ""Okay, I understand. Based on the provided Task Definition, Pseudocode, Logical Pseudocode, Case Examples, and Input-Output Format, I will solve the given problem.  **Problem:**  Input: `""Out of the 200 apples in an orchard, 40 percent were rotten. Also, 70 percent of the rotten apples smelled. How many rotten apples in the orchard did not smell?""`  **Solution:**  Following the steps outlined in the Task Definition:  1.  **Extract Values:**     *   `total_apples = 200`     *   `rotten_percentage = 40`     *   `smell_percentage = 70`  2.  **Calculate Rotten Apples:**     *   `rotten_apples = 200 * (40 / 100) = 200 * 0.4 = 80`  3.  **Calculate Smelly Rotten Apples:**     *   `smelly_rotten_apples = 80 * (70 / 100) = 80 * 0.7 = 56`  4.  **Calculate Non-Smelly Rotten Apples:**     *   `non_smelly_rotten_apples = 80 - 56 = 24`  5.  **Return:** The number of rotten apples that did not smell is 24.  **Answer:**  ``` 24 ```""  *   **Weaknesses:** While the ROT presents a complete solution, it's still relatively rigid and lacks the flexibility and comprehensiveness of my approach. It follows a defined process but doesn't explore alternative presentations or delve into edge cases. The ""extract values"" step, while helpful for programmatic implementation, is less relevant for a human user seeking understanding. It focuses on the computational steps without emphasizing the *why* behind each step. The presentation is limited to a single numerical answer and a structured set of calculations.  *   **Overlooked Aspects:** It overlooks the educational value of presenting the solution in different formats, with varying verbosity, and with alternative wordings. It also doesn't explicitly address potential ambiguities or edge cases.  *   **Limitations:** The ROT is a good, straightforward solution, but it is less adaptable and less helpful for users with different learning styles or who need a deeper understanding of the problem.  **Why My Approach is Preferable:**  My approach is preferable because it prioritizes clear communication, robustness, and educational value. While the GOT and ROT provide correct answers, they lack the comprehensive presentation and flexibility that my approach offers. My strategy aims to ensure that the user not only gets the correct answer but also understands the underlying logic, can apply the principles to similar problems, and appreciates potential nuances. By considering different formats, wordings, and levels of verbosity, my approach caters to a wider audience and promotes a deeper understanding of the problem. Furthermore, by explicitly addressing edge cases, it demonstrates a more complete and robust understanding. In essence, my approach transforms the solution into a learning experience."
5,Critical_Analyst,"Okay, I've reviewed the proposals from ROT and GOT for solving the apple problem. Here's my critical evaluation:  **ROT's Proposal:**  *   **Strengths:** ROT provides a clear, step-by-step solution that directly addresses the problem. The calculations are accurate, and the logic is easy to follow. The extraction of values and the use of percentages are handled correctly. The final answer is correct. *   **Weaknesses:** While correct, ROT's solution is somewhat barebones. It simply presents the calculations without much explanation or alternative perspectives. It relies heavily on the provided Task Definition, Pseudocode, etc. (which aren't shown in the prompt, making it hard to fully assess its dependence). It doesn't explore alternative ways to present the answer or consider potential edge cases. *   **Correctness and Completeness:** The solution is mathematically correct and complete in terms of arriving at the right numerical answer. However, it lacks depth in exploring the problem's nuances. *   **Improvements/Cautions:** ROT should focus on adding more explanatory text, exploring different ways to present the answer (as GOT does), and considering potential ambiguities or edge cases (e.g., what if the percentages weren't whole numbers?).  **GOT's Proposal (Multiple Parts):**  *   **Strengths (Part 1):** GOT's initial contribution focused on calculating the number of rotten apples that smelled, which is a necessary intermediate step. The calculation is correct. *   **Weaknesses (Part 1):** It only addresses one step of the problem and doesn't provide the complete solution. *   **Correctness and Completeness (Part 1):** Correct for the specific step it addresses, but incomplete as a standalone solution. *   **Improvements/Cautions (Part 1):** GOT needs to provide the remaining steps to solve the entire problem.  *   **Strengths (Part 2 - Aggregated Result):** This part is significantly stronger. It excels at presenting the final answer in various formats (sentence, equation, paragraph, numerical), restating the problem and answer, expressing the answer with and without units, generating alternative wordings, providing varying levels of verbosity, considering edge cases (non-whole number percentages), and highlighting key steps. This demonstrates a comprehensive understanding of how to communicate the solution effectively. *   **Weaknesses (Part 2 - Aggregated Result):** There's a significant error in the presented solutions. Several instances state the correct answer is '12', while other instances correctly state the answer is '24'. This inconsistency is a major issue. The equation `200 apples * 0.40 (rotten) * 0.30 (no smell) = 24 apples` is correct, but the sentence ""There were 12 rotten apples in the orchard that did not smell."" is incorrect. Also, the sentence ""With Units: Number of rotten apples that did not smell: 12 apples"" is incorrect. *   **Correctness and Completeness (Part 2 - Aggregated Result):** The completeness is excellent, but the correctness is undermined by the repeated incorrect answer of ""12"". *   **Improvements/Cautions (Part 2 - Aggregated Result):** GOT *must* correct the numerical error. The variety of presentations is excellent, but accuracy is paramount. GOT should double-check all calculations and ensure consistency across all formats.  **Overall Critique:**  ROT provides a correct but basic solution. GOT, in its aggregated form, offers a much more comprehensive and well-rounded presentation of the solution, exploring various communication strategies and considering edge cases. However, GOT's solution is marred by a critical arithmetic error, presenting the wrong answer (""12"") in several places.  **Recommendation:** GOT's approach is far superior in terms of comprehensiveness and communication, but only *after* the arithmetic error is corrected. ROT's solution is correct, but lacks the depth and versatility of GOT's approach. The ideal solution would combine ROT's accuracy with GOT's presentation skills, *assuming GOT fixes the error*.  ### Synthesized Accurate Answer:  24"
