Round,Speaker,Utterance
1,Moderator,"Debate Topic: In-depth discussion based on the following mission context, ROT idea, GOT idea, and LOT idea. Mission Context: Instruction: Statement 1 | Every ideal in a ring is a subring of the ring. Statement 2 | Every subring of every ring is an ideal of the ring.  Context: The following are multiple choice options:[""True, True"", ""False, False"", ""True, False"","" False, True""] Initial Core Idea from GOT: Here's my reasoning and the final answer:  **Reasoning:**  *   **Statement 1: Every ideal in a ring is a subring of the ring.**  By the definition of an ideal, it *must* be a subring. The ideal inherits the ring operations and satisfies the subring requirements (closure under addition, containing 0, and containing additive inverses). Therefore, Statement 1 is true.  *   **Statement 2: Every subring of every ring is an ideal of the ring.** This is false. A subring doesn't necessarily satisfy the absorption property required of an ideal (i.e., for all r in R and x in I, r*x and x*r must be in I).  The integers (Z) as a subring of the rational numbers (Q) provide a clear counterexample.  **Answer:**  True, False Initial Core Idea from GOT: True, False  Initial Detailed Plan from LOT: Aggregated result from layer 143 (Concept: 'Generate and present the answer...') using strategy 'all_content_ranked': - (Criterion: 'Criterion A (Level 1): Rigorously restate the definition of a subring and an ideal, emphasizing the differences in their defining properties', Level: 1):   Okay, let's rigorously restate the definitions of a subring and an ideal, emphasizing the differences. This will help us evaluate the truth of the given statements.  **Definition of a Subring:**  Let R be a ring (with operations + and *). A subset S of R is a subring of R if S is itself a ring under the same operations + and * restricted to S.  This means:  1.  S is closed under addition: If a, b ∈ S, then a + b ∈ S. 2.  S is closed under multiplication: If a, b ∈ S, then a * b ∈ S. 3.  S contains the additive identity of R (usually denoted as 0): 0 ∈ S. 4.  S is closed under additive inverses: If a ∈ S, then -a ∈ S.  **Definition of an Ideal:**  Let R be a ring. A subset I of R is an ideal of R if:  1.  I is a subring of R.  (This means I satisfies the four conditions above for being a subring). 2.  I is closed under left and right multiplication by elements of R:     *   For all r ∈ R and all a ∈ I, we have r * a ∈ I (left ideal).     *   For all r ∈ R and all a ∈ I, we have a * r ∈ I (right ideal).  If I is both a left ideal and a right ideal, then I is simply called an ideal (or a two-sided ideal).  **Key Differences and Emphasis:**  *   **Subrings only require closure under the ring operations (+ and *) within the subset itself.** You only need to consider elements *within* the subset.  *   **Ideals have an additional absorption property:**  When you multiply an element of the *entire ring* (R) by an element of the ideal (I), the result *must* stay within the ideal (I). This is the critical difference.  Ideals ""absorb"" multiplication from the larger ring.  This rigorous restatement clarifies that an ideal must be a subring, but a subring does not necessarily have to be an ideal. The absorption property is the key requirement for an ideal that a subring doesn't necessarily have.  - (Criterion: 'Criterion B (Level 1): Provide a simple and clear counterexample using the ring of integers and a specific subring to demonstrate that not all subrings are ideals', Level: 1):   Consider the ring of integers $\mathbb{Z}$.  The set of even integers, $2\mathbb{Z} = \{2n \mid n \in \mathbb{Z}\}$, is an ideal of $\mathbb{Z}$.  Since $2\mathbb{Z}$ is closed under addition and subtraction, and contains 0, it is also a subring of $\mathbb{Z}$. This supports the first statement.  Now, consider the subring $\mathbb{Z}$ of the ring of rational numbers $\mathbb{Q}$. $\mathbb{Z}$ is a subring of $\mathbb{Q}$ because it is closed under addition, subtraction, and multiplication, and contains the multiplicative identity 1. However, $\mathbb{Z}$ is not an ideal of $\mathbb{Q}$. To see this, consider the element $1 \in \mathbb{Z}$ and the element $\frac{1}{2} \in \mathbb{Q}$. If $\mathbb{Z}$ were an ideal of $\mathbb{Q}$, then $\frac{1}{2} \cdot 1 = \frac{1}{2}$ would have to be in $\mathbb{Z}$, but $\frac{1}{2} \notin \mathbb{Z}$.  Therefore, $\mathbb{Z}$ is a subring of $\mathbb{Q}$, but not an ideal.  Another example is the subring $\mathbb{Z}$ of the ring $\mathbb{R}$. If $\mathbb{Z}$ were an ideal of $\mathbb{R}$, then for any $r \in \mathbb{R}$ and $z \in \mathbb{Z}$, we would need $rz \in \mathbb{Z}$. Let $z=1 \in \mathbb{Z}$ and $r = \sqrt{2} \in \mathbb{R}$. Then $rz = \sqrt{2} \cdot 1 = \sqrt{2}$, which is not in $\mathbb{Z}$. Thus, $\mathbb{Z}$ is not an ideal of $\mathbb{R}$.  Therefore, the first statement is true, and the second statement is false. Final Answer: The final answer is $\boxed{True, False}$  - (Criterion: 'Criterion C (Level 1): Provide a second, distinct counterexample using a matrix ring to further solidify the understanding that not all subrings are ideals', Level: 1):   Consider the ring of 2x2 matrices with real entries, denoted by $M_2(\mathbb{R})$.  Let $R = M_2(\mathbb{R})$.  Now, let's define a subring $S$ of $R$ as the set of matrices of the form:  $S = \left\{ \begin{pmatrix} a & b \\ 0 & 0 \end{pmatrix} \mid a, b \in \mathbb{R} \right\}$.  It's easy to verify that $S$ is a subring of $R$.  It's closed under subtraction and multiplication:  *   Subtraction: $\begin{pmatrix} a & b \\ 0 & 0 \end{pmatrix} - \begin{pmatrix} c & d \\ 0 & 0 \end{pmatrix} = \begin{pmatrix} a-c & b-d \\ 0 & 0 \end{pmatrix} \in S$ *   Multiplication: $\begin{pmatrix} a & b \\ 0 & 0 \end{pmatrix} \begin{pmatrix} c & d \\ 0 & 0 \end{pmatrix} = \begin{pmatrix} ac & ad \\ 0 & 0 \end{pmatrix} \in S$  Now, let's check if $S$ is an ideal.  For $S$ to be an ideal, it must be closed under multiplication by elements of $R$ on both the left and the right.  Let's consider the matrix $A = \begin{pmatrix} 0 & 0 \\ 1 & 0 \end{pmatrix} \in R$ and the matrix $B = \begin{pmatrix} 1 & 1 \\ 0 & 0 \end{pmatrix} \in S$.  Then, $A \cdot B = \begin{pmatrix} 0 & 0 \\ 1 & 0 \end{pmatrix} \begin{pmatrix} 1 & 1 \\ 0 & 0 \end{pmatrix} = \begin{pmatrix} 0 & 0 \\ 1 & 1 \end{pmatrix}$.  Since $\begin{pmatrix} 0 & 0 \\ 1 & 1 \end{pmatrix} \notin S$, $S$ is not a left ideal.  Also, $B \cdot A = \begin{pmatrix} 1 & 1 \\ 0 & 0 \end{pmatrix} \begin{pmatrix} 0 & 0 \\ 1 & 0 \end{pmatrix} = \begin{pmatrix} 1 & 0 \\ 0 & 0 \end{pmatrix} \in S$. This doesn't violate the ideal property.  Since $S$ is not a left ideal, $S$ is not an ideal. Thus, we have found a subring of $M_2(\mathbb{R})$ that is not an ideal. Final Answer: The final answer is $\boxed{False, False}$  - (Criterion: 'Criterion D (Level 2): Explicitly demonstrate the closure properties required for a subring and how an ideal satisfies those properties (showing why statement 1 is true)', Level: 1):   Okay, let's demonstrate why an ideal is a subring. To be a subring, a subset S of a ring R must satisfy the following:  1.  **Closure under subtraction:** For all a, b in S, a - b must be in S. 2.  **Closure under multiplication:** For all a, b in S, a * b must be in S. 3.  **S must be non-empty:** S must contain at least one element.  Now, let I be an ideal of a ring R. We need to show that I satisfies the three conditions above.  1.  **Closure under subtraction:** By definition of an ideal, I is an additive subgroup of R. This means that if a and b are in I, then a - b is in I.  Therefore, I is closed under subtraction.  2.  **Closure under multiplication:** An ideal I has the property that for any r in R and any a in I, both r*a and a*r are in I. Since I is a subset of R, if a and b are in I, then b is also in R. Therefore, a*b must be in I. Thus, I is closed under multiplication.  3.  **Non-empty:** By definition, an ideal must contain the additive identity 0. Thus, I is non-empty.  Since I satisfies all three conditions, I is a subring of R.  This confirms that Statement 1 is true.  - (Criterion: 'Criterion E (Level 2): Analyze the absorption property of ideals and explain why this property is not inherently guaranteed for all subrings', Level: 1):   An ideal, by definition, must satisfy the absorption property: for an ideal *I* of a ring *R*, and any element *r* in *R*, the product *ri* and *ir* must be in *I* for all *i* in *I*.  A subring, however, only needs to be closed under addition, subtraction, and multiplication of its own elements.  It does *not* need to be closed under multiplication by arbitrary elements from the larger ring *R*.  Consider the ring of integers, **Z**, which is a subring of the ring of rational numbers, **Q**.  **Z** is a subring of **Q**, but it is *not* an ideal of **Q**. For example, 1 is in **Z**, and 1/2 is in **Q**, but (1/2) * 1 = 1/2 is *not* in **Z**. Thus, **Z** does not absorb elements from **Q** and therefore is not an ideal of **Q**. This demonstrates that a subring does not necessarily satisfy the absorption property required to be an ideal.  - (Criterion: 'Criterion F (Level 3): Explore the case of a field and show that in a field, every subring containing a non-zero element is an ideal (and is the field itself), highlighting a specific case where subrings and ideals are ""equivalent""', Level: 1):   Let $F$ be a field. We want to explore the relationship between subrings and ideals in $F$.  Let $S$ be a subring of $F$ such that $S$ contains a non-zero element $a \in S$. We want to show that $S$ must be equal to $F$, and that $S$ is an ideal of $F$.  Since $a \in S$ and $S$ is a subring, $a \neq 0$. Since $F$ is a field, $a$ has a multiplicative inverse $a^{-1} \in F$. We need to show that $a^{-1} \in S$. However, we cannot guarantee that $a^{-1} \in S$ just because $S$ is a subring of $F$.  Therefore, we cannot generally say that any subring containing a non-zero element is an ideal.  However, if we assume $S=F$, then since $F$ is a field, the only ideals are $\{0\}$ and $F$ itself. If $S$ is a subring containing a non-zero element, then $S$ is a subring of $F$. Since $S$ contains a non-zero element $a$, then the ideal generated by $a$ is the whole field, i.e., $(a) = \{ra | r \in F\} = F$. If $S$ is an ideal, then $S$ must be either $\{0\}$ or $F$.  Now let's consider the statement ""Every ideal in a ring is a subring of the ring."" Let $I$ be an ideal of a ring $R$. To show that $I$ is a subring, we need to show that $I$ is closed under subtraction and multiplication. Since $I$ is an ideal, for any $a, b \in I$, we have $a-b \in I$. If $I$ is an ideal, it is not necessarily closed under multiplication. However, since $I \subseteq R$ and $I$ is an ideal, for any $a,b \in I$, $ab \in I$. Thus, $I$ is closed under subtraction and multiplication, and also contains 0, therefore it is a subring. So, the first statement is true.  Now let's consider the statement ""Every subring of every ring is an ideal of the ring."" This is not true in general. For example, consider the ring $R = \mathbb{Z}$ and the subring $S = \mathbb{Z}$. Let $n \in \mathbb{Z}$. Then $n \cdot 1 = n \in \mathbb{Z}$. So $\mathbb{Z}$ is an ideal of itself. However, consider the ring $R = \mathbb{Z}_6 = \{0, 1, 2, 3, 4, 5\}$ and the subring $S = \{0, 2, 4\}$. Then $S$ is a subring of $R$. If $S$ were an ideal, then for any $r \in R$ and $s \in S$, $rs \in S$. Let $r = 1$ and $s = 2$. Then $rs = 1 \cdot 2 = 2 \in S$. Let $r = 3$ and $s = 2$. Then $rs = 3 \cdot 2 = 6 \equiv 0 \pmod{6} \in S$. However, consider the ring $R = \mathbb{Z}$ and the subring $S = 2\mathbb{Z}$. Then $S$ is an ideal. But consider $R = \mathbb{Z}$ and the subring $S = \{0, 1\}$. $S$ is not an ideal, since $2 \cdot 1 = 2 \notin S$.  Therefore, the first statement is True, and the second statement is False.  Final Answer: The final answer is $\boxed{True, False}$  - (Criterion: 'Criterion G (Level 3): Consider a non-commutative ring and a subring that is only closed under multiplication on one side to illustrate why it's not an ideal, emphasizing the importance of two-sided absorption for ideals.', Level: 1):   Let R be the ring of 2x2 matrices with real entries, denoted by M_2(R). This is a non-commutative ring under matrix addition and multiplication.  Consider the subring S of M_2(R) consisting of matrices of the form:  ``` S = {  [a  b]        [0  0]  | a, b ∈ R } ```  S is a subring because it is closed under subtraction and multiplication:  *   **Subtraction:** Let A = \[a b; 0 0] and B = \[c d; 0 0] be elements of S. Then A - B = \[(a-c) (b-d); 0 0], which is also in S.  *   **Multiplication:** Let A = \[a b; 0 0] and B = \[c d; 0 0] be elements of S. Then A * B = \[(ac) (ad); 0 0], which is also in S.  Now, let's check if S is an ideal.  For S to be an ideal, it must satisfy the absorption property: for any r ∈ R and s ∈ S, both rs and sr must be in S.  Let's take a specific example. Let A = \[1 1; 1 1] ∈ M_2(R) and B = \[1 1; 0 0] ∈ S.  Then, A * B = \[1 1; 1 1] * \[1 1; 0 0] = \[1 1; 1 1].  This matrix is NOT in S, because the bottom row is not all zeros.  Therefore, S is not an ideal because it does not satisfy the left ideal property (i.e., A*B is not always in S for A in R and B in S).  In this specific example, A*B is not in S.  This demonstrates that not every subring is an ideal. The key is that ideals must ""absorb"" elements from the entire ring when multiplied on either side.   The debate will now commence."
2,ROT_Representative,"Here's my reasoning and the final answer:  **Reasoning:**  *   **Statement 1: Every ideal in a ring is a subring of the ring.** By the definition of an ideal, it *must* be a subring. The ideal inherits the ring operations and satisfies the subring requirements (closure under addition, containing 0, and containing additive inverses). Therefore, Statement 1 is true.  *   **Statement 2: Every subring of every ring is an ideal of the ring.** This is false. A subring doesn't necessarily satisfy the absorption property required of an ideal (i.e., for all r in R and x in I, r*x and x*r must be in I). The integers (Z) as a subring of the rational numbers (Q) provide a clear counterexample.  **Answer:**  True, False  **How ROT Addresses the Core Problem:**  The core problem is to determine the truth value of two statements about the relationship between ideals and subrings. ROT directly addresses this by:  1.  **Clearly stating the definitions:** It implicitly relies on the understanding of 'ideal' and 'subring'. 2.  **Providing logical deductions:** It provides a direct and concise reason for each statement's truth value based on the definitions. 3.  **Offering a counterexample:** It gives a readily understandable counterexample to disprove the second statement.  The key strength of ROT is its conciseness and directness. It immediately gets to the heart of the matter without unnecessary elaboration.  **Critical Evaluation of GOT (True, False):**  The GOT directly provides the correct answer, ""True, False"". However, it lacks any reasoning or justification.  It offers no insight into why the answer is correct, making it a weak solution on its own. It's simply the answer without any explanation.  **Critical Evaluation of LOT (Layer Of Thoughts):**  The LOT is a much more comprehensive approach. It breaks down the problem into several criteria, including:  *   **Rigorously restating definitions:** This is excellent for clarity. *   **Providing counterexamples:** The LOT provides multiple counterexamples (using integers/rationals and matrix rings), which strengthens the disproof of the second statement. *   **Demonstrating closure properties:** It explicitly shows how an ideal satisfies the subring properties. *   **Analyzing the absorption property:** It highlights the importance of the absorption property. *   **Exploring special cases (fields):** While potentially useful, the field example somewhat complicates the core issue. *   **Non-commutative rings:** The non-commutative ring example is helpful to further illustrate the absorption property.  **Weaknesses of LOT Compared to ROT:**  1.  **Overly verbose:** The LOT is very detailed, which can make it harder to quickly grasp the core argument. While the detail is helpful for a deeper understanding, it's less efficient for simply determining the truth values. 2.  **Complexity:** The LOT explores concepts like non-commutative rings and fields, which, while relevant, might distract from the fundamental difference between ideals and subrings for someone unfamiliar with abstract algebra. 3. **Inconsistent and incorrect final answer:** Criterion C and Criterion F both arrive at an incorrect answer.  **Why ROT is Preferable:**  ROT is preferable because of its:  1.  **Efficiency:** It provides the correct answer with the most concise and direct reasoning. 2.  **Clarity:** It focuses on the essential difference between ideals and subrings (the absorption property) without getting bogged down in unnecessary details. 3.  **Accessibility:** It uses a simple and well-known counterexample (integers within rationals) that is easy to understand. 4. **Correctness:** It consistently arrives at the correct answer.  While the LOT offers a more comprehensive explanation, it is less efficient and potentially more confusing for someone simply trying to determine the truth values of the given statements. The ROT provides the necessary and sufficient information for a correct answer. The LOT approach is more suitable for teaching or in-depth learning, but not necessarily for quickly and accurately answering the specific question. The LOT also suffers from inconsistent and incorrect final answers from some of its criteria."
3,GOT_Representative,"As the GOT Representative, my core idea is 'True, False', which directly addresses the problem of evaluating the two statements about the relationship between ideals and subrings.  Here's how my idea addresses the core problem and its strengths:  *   **Directness:** The 'True, False' approach provides a concise and unambiguous answer, directly addressing the multiple-choice question. There's no ambiguity or room for misinterpretation. *   **Accuracy:** The answer is correct. The first statement (every ideal is a subring) is true, and the second statement (every subring is an ideal) is false. *   **Efficiency:** It's the most efficient way to present the solution. It doesn't involve unnecessary explanations or elaborations, focusing solely on providing the correct answer.  Now, let's critically evaluate the ROT and LOT ideas.  **ROT (Reversal Of Thought):**  *   **Strengths:** The ROT provides a clear and concise explanation of why the first statement is true and the second statement is false. It uses the definition of ideals and subrings effectively and provides a counterexample (Z as a subring of Q) to illustrate why not all subrings are ideals. *   **Weaknesses/Limitations:** While the reasoning is sound, it's more verbose than necessary. The ultimate goal is to select the correct answer from the multiple-choice options. The explanation, while helpful for understanding, is not strictly required. The primary weakness is that, while the reasoning is correct, it doesn't explicitly acknowledge the potential for non-commutative rings, where left and right ideals differ. This is a minor oversight but a potential area for added rigor. *   **Overlooked Aspects:** It could benefit from briefly mentioning the absorption property as the key difference.  **LOT (Layer Of Thoughts):**  *   **Strengths:** The LOT approach is extremely thorough. It rigorously defines subrings and ideals, emphasizing the absorption property. It provides multiple counterexamples (Z in Q, Z in R, and a matrix ring example), showcasing a deep understanding of the concepts. It also attempts to explore edge cases, like fields. *   **Weaknesses/Limitations:** The LOT suffers from ""analysis paralysis"". It provides *too much* information, potentially obscuring the simple answer. While the thoroughness is commendable, it's inefficient in the context of a multiple-choice question. The matrix ring example, while correct, is more complex than necessary to disprove the second statement. It also initially gets the matrix example wrong, stating False, False, before correcting itself. The attempt to explore the field case is somewhat confusing and doesn't clearly lead to a definitive conclusion. *   **Overlooked Aspects:** While it covers many cases, the sheer volume of information could be overwhelming. It initially misses the correct answer in the matrix ring example.  **Why my approach ('True, False') is preferable:**  My approach is preferable because it directly and efficiently answers the question. While the ROT and LOT provide valuable explanations and justifications, they are unnecessary for the specific task. The strength of 'True, False' lies in its conciseness and accuracy. In an exam setting or a situation where a quick answer is needed, providing 'True, False' is far more practical than presenting a detailed explanation. The explanations are beneficial for *understanding* the concepts, but the task is *identifying* the correct answer.  Furthermore, the LOT's initial error highlights a critical point: even with extensive analysis, mistakes can occur. The simpler, direct approach minimizes the opportunity for error.  In summary, while understanding the underlying concepts is crucial, the primary goal in this scenario is to identify the correct answer, which 'True, False' accomplishes most effectively. The other approaches are valuable for learning and teaching but less efficient for answering this specific question."
