Round,Speaker,Utterance
1,Moderator,"Debate Topic: In-depth discussion based on the following mission context, ROT idea, GOT idea, and LOT idea. Mission Context: Instruction: There were 40 kids on Lake Pleasant. A fourth of the kids went tubing, but only half of the tubers went rafting. How many of the kids who joined the rafting excursion were also on the tubing excursion? Initial Core Idea from GOT: Here's how to solve the problem:  1. **Tubing:** A fourth of the 40 kids went tubing, so (1/4) * 40 = 10 kids went tubing.  2. **Rafting:** Half of the tubers went rafting, so (1/2) * 10 = 5 kids went rafting.  3. **Overlap:** Since all the kids who went rafting were also tubers (because only tubers could go rafting), the number of kids who joined the rafting excursion and were also on the tubing excursion is 5.  **Answer:** 5 Initial Core Idea from GOT: **1. Kids who went tubing:**  *   40 kids / 4 = 10 kids  **2. Kids who went rafting:**  *   10 kids / 2 = 5 kids  **Answer:** 5 of the kids who joined the rafting excursion were also on the tubing excursion.  Initial Detailed Plan from LOT: Aggregated result from layer 23 (Concept: 'Generate and present the answer...') using strategy 'all_content_ranked': - (Criterion: 'Present the final answer with the unit ""kids"" in a concise statement', Level: 1):   The final answer is 5 kids.  - (Criterion: 'Recalculate the number of kids who went tubing and rafting to double-check the arithmetic and ensure no calculation errors were made', Level: 1):   Okay, let's double-check the calculations.  *   **Tubing:** A fourth of the 40 kids went tubing.  That's (1/4) * 40 = 10 kids.  *   **Rafting:** Half of the kids who went tubing went rafting. That's (1/2) * 10 = 5 kids.  The question asks: ""How many of the kids who joined the rafting excursion were also on the tubing excursion?"" Since all the kids who went rafting also went tubing, the answer is 5.  The arithmetic checks out.  - (Criterion: 'State the final answer clearly, explicitly addressing the original question about the number of kids who went both tubing and rafting', Level: 1):   The question asks how many kids went rafting *and* tubing. We calculated that 5 kids went rafting. Since *all* the kids who went rafting also went tubing (because only half of the tubers went rafting), then the answer is 5.  **Answer: 5 kids**  - (Criterion: 'Provide a brief explanation of why the number of kids who went rafting is the answer to the question', Level: 1):   The question asks ""How many of the kids who joined the rafting excursion were also on the tubing excursion?"". Since only half of the kids who went tubing also went rafting, *all* the kids who went rafting must have also been part of the tubing group. Therefore, the number of kids who went rafting *is* the answer to the question.  - (Criterion: 'Consider if the problem could be interpreted as asking for the *ratio* of kids who went rafting to those who went tubing, and present that ratio as an alternative answer (even though it's likely not the intended interpretation)', Level: 1):   Okay, let's explore the alternative interpretation: What's the ratio of kids who went rafting to those who went tubing?  We know:  *   A fourth of the kids went tubing: 40 / 4 = 10 kids went tubing. *   Half of the tubers went rafting: 10 / 2 = 5 kids went rafting.  Therefore, the ratio of kids who went rafting to those who went tubing is 5:10.  This can be simplified to 1:2.  So, an alternative answer, representing the ratio, is 1:2 or 1/2.  - (Criterion: 'Acknowledge the assumption that all kids who went rafting also went tubing and explicitly state that this assumption is necessary for the provided solution', Level: 1):   To definitively answer how many kids who joined the rafting excursion were *also* on the tubing excursion, we must assume that all the kids who went rafting were also part of the group that went tubing. Without this assumption, we can only say *at most* half the tubers went rafting, but we can't guarantee any of them did. Therefore, the answer (5 kids) is contingent on the assumption that all rafters were also tubers.  - (Criterion: 'Explore a scenario where the number of kids who went tubing is not divisible by 2, and explain how rounding would affect the final answer', Level: 1):   Okay, let's explore a scenario where the number of kids tubing isn't divisible by 2 and how rounding would affect the final answer.  **Scenario:**  Suppose instead of 40 kids, there were 41 kids on Lake Pleasant.  1. **Tubing:** A fourth of the kids went tubing.  (1/4) * 41 = 10.25 kids.  2. **Rafting:**  Only *half* of the tubers went rafting. (1/2) * 10.25 = 5.125 kids.  **Rounding and its Impact:**  *   **Rounding for Tubing:** We can't have a fraction of a kid tubing. So, we need to round. The question is, do we round up or down?      *   **Rounding Down (10 kids tubing):** If we round down to 10 kids tubing, then half of them rafting would be (1/2) * 10 = 5 kids.  In this case, our final answer would be 5.      *   **Rounding Up (11 kids tubing):** If we round up to 11 kids tubing, then half of them rafting would be (1/2) * 11 = 5.5 kids. Again, we need to round. We'd round to 6 kids rafting.  *   **Rounding for Rafting:** Even if we get a decimal number for the number of kids rafting, like 5.125 or 5.5, we *must* round to a whole number because you can't have a fraction of a kid rafting.  **Conclusion:**  When the intermediate calculations involve fractions of people, rounding is *necessary*. The rounding method (up or down) can affect the final answer. In a real-world scenario, you might choose to round up or down based on the specific context. For example, if the question is about the *maximum* number of kids who *could* have gone rafting, you might round up. If it's about the *minimum*, you might round down. If there is no specific direction requested, it is typically acceptable to round to the nearest whole number.  - (Criterion: 'State the problem and the final answer together in a complete sentence.', Level: 1):   Of the 40 kids on Lake Pleasant, a fourth went tubing, and half of those tubers went rafting, meaning that 5 kids who joined the rafting excursion were also on the tubing excursion.   The debate will now commence."
2,ROT_Representative,"Alright, as the ROT(Reversal Of Thought) Representative, let's break down my core idea and compare it to the GOT and LOT approaches.  **My Core Idea (ROT):**  Here's how to solve the problem:  1.  **Tubing:** A fourth of the 40 kids went tubing, so (1/4) \* 40 = 10 kids went tubing.  2.  **Rafting:** Half of the tubers went rafting, so (1/2) \* 10 = 5 kids went rafting.  3.  **Overlap:** Since all the kids who went rafting were also tubers (because only tubers could go rafting), the number of kids who joined the rafting excursion and were also on the tubing excursion is 5.  **Answer:** 5  **How my idea addresses the core problem and its key strengths:**  My approach directly addresses the problem by:  *   **Direct Calculation:** It breaks down the problem into simple, sequential calculations that are easy to follow. *   **Clarity:** Each step is clearly labeled and explains what is being calculated. *   **Explicit Overlap Explanation:** It explicitly states why the number of rafters is also the number of kids who went both tubing and rafting. This avoids any ambiguity. *   **Conciseness:** It gets to the answer efficiently without unnecessary elaboration.  **Critical Evaluation of GOT (Graph Of Thoughts):**  **GOT Idea:**  **1. Kids who went tubing:**  *   40 kids / 4 = 10 kids  **2. Kids who went rafting:**  *   10 kids / 2 = 5 kids  **Answer:** 5 of the kids who joined the rafting excursion were also on the tubing excursion.  **Weaknesses, Overlooked Aspects, and Limitations:**  *   **Missing Explanation of Overlap:** The GOT simply calculates the number of rafters. It doesn't explicitly state *why* the rafters are also the tubers the question is asking about. This is a critical logical step that's missing. A reader might understand the calculations but not fully grasp the *reasoning* behind the answer. *   **Lack of Context:** The GOT provides the calculations but lacks context. It doesn't explicitly state ""half of the *tubers* went rafting."" This connection is crucial for understanding the problem.  **Why my approach is preferable:**  My approach is preferable because it doesn't just present the calculations; it explains *why* those calculations lead to the answer. The explicit statement about the overlap ensures that the reader understands the underlying logic of the solution.  **Critical Evaluation of LOT (Layer Of Thoughts):**  **LOT Idea:** (Summarized for brevity - it's very long)  The LOT goes through numerous checks, alternative interpretations (ratio), and scenarios (non-divisible numbers and rounding). It ultimately arrives at the answer ""5 kids"".  **Weaknesses, Overlooked Aspects, and Limitations:**  *   **Overly Complex and Inefficient:** The LOT is extremely verbose. While exploring alternative interpretations and edge cases can be valuable in some situations, it's overkill for this relatively simple problem. It significantly increases the cognitive load without providing much added value. *   **Risk of Confusion:** The exploration of alternative interpretations (like the ratio) can potentially confuse the user, especially if they are already struggling with the core concept. *   **Focus on Edge Cases Distracts from Core Problem:** While discussing rounding is relevant in general, it's a distraction in this specific problem. The problem is designed to have clean integer solutions. *   **Redundant Recalculations:** The constant recalculation and re-explanation of the same concepts makes it repetitive.  **Why my approach is preferable:**  My approach is preferable because it is:  *   **Direct and Efficient:** It focuses on the core problem and provides a concise solution. *   **Clear and Unambiguous:** It avoids unnecessary complexity and ensures that the reasoning is easy to follow. *   **Appropriate Level of Detail:** It provides enough explanation to understand the solution without overwhelming the user with irrelevant details.  In summary, while the GOT provides the correct calculations, it lacks the crucial explanation of the overlap. The LOT is excessively detailed and potentially confusing. My ROT approach strikes the right balance between clarity, efficiency, and thoroughness, making it the most effective solution. It uses simple calculations combined with explanations, making it the best option."
3,GOT_Representative,"Okay, as the GOT Representative, let's break down my core idea, its strengths, and critically evaluate the ROT and LOT ideas.  **My Core Idea:**  `1. Kids who went tubing: 40 kids / 4 = 10 kids` `2. Kids who went rafting: 10 kids / 2 = 5 kids` `Answer: 5 of the kids who joined the rafting excursion were also on the tubing excursion.`  **How it Addresses the Problem:**  This approach directly translates the problem statement into mathematical operations. It first identifies the number of kids who went tubing (1/4 of 40) and then calculates the number of those tubers who also went rafting (1/2 of the tubers). The final answer directly answers the question of how many kids participated in *both* activities.  **Key Strengths:**  *   **Simplicity and Clarity:** It's easy to understand and follow. There are no complex assumptions or hidden steps. *   **Direct Translation:** The mathematical operations directly reflect the words in the problem. ""A fourth of the kids went tubing"" becomes ""40 / 4"". ""Half of the tubers went rafting"" becomes ""10 / 2"". *   **Accuracy:** The calculations are straightforward and accurate. *   **Efficiency:** It arrives at the correct answer in the fewest possible steps.  **Critical Evaluation of ROT Idea:**  `Here's how to solve the problem:`  `1. Tubing: A fourth of the 40 kids went tubing, so (1/4) * 40 = 10 kids went tubing.`  `2. Rafting: Half of the tubers went rafting, so (1/2) * 10 = 5 kids went rafting.`  `3. Overlap: Since all the kids who went rafting were also tubers (because only tubers could go rafting), the number of kids who joined the rafting excursion and were also on the tubing excursion is 5.`  `Answer: 5`  **Strengths of ROT:**  *   Clear explanation of each step. *   Explicitly states the overlap.  **Weaknesses of ROT:**  *   While correct, the ""Overlap"" step is a bit redundant. The problem inherently implies that only tubers could go rafting, so calculating the number of rafters directly answers the question. The ""Overlap"" section doesn't add substantial value. It states the implicit assumptions.  **Critical Evaluation of LOT Idea:**  The LOT idea is a multi-layered approach that essentially recalculates and re-explains the problem multiple times, considers edge cases, and explores alternative interpretations.  **Strengths of LOT:**  *   **Extensive Verification:** It rigorously checks the arithmetic and logic. *   **Edge Case Consideration:** It explores scenarios with non-integer values and the impact of rounding. *   **Alternative Interpretation:** It considers the ratio of rafters to tubers. *   **Assumption Explicitness:** It makes the underlying assumption (all rafters were tubers) explicit.  **Weaknesses of LOT:**  *   **Overkill:** For a simple problem, the level of analysis is excessive. It significantly increases the complexity and length of the solution without adding much value to the core problem-solving process. *   **Potential for Confusion:** Introducing alternative interpretations and edge cases (like rounding with non-integer values) might confuse someone who is just trying to understand the basic solution. *   **Inefficiency:** It's a very verbose and inefficient way to solve a simple problem. The core logic is obscured by the excessive analysis.  **Why My Approach is Preferable:**  My GOT approach is preferable because it prioritizes **clarity, simplicity, and efficiency.** The problem is straightforward, and the solution should be equally straightforward. The ROT idea is acceptable, but the added ""Overlap"" step is unnecessary. The LOT idea, while thorough, is an overkill. It introduces unnecessary complexity and potential confusion without significantly improving the core solution. My approach directly addresses the problem with the minimum amount of cognitive load, making it the most effective method. The GOT approach is more concise and easier to understand, especially for someone who is learning or needs a quick solution. It directly translates the problem into simple mathematical steps, avoiding unnecessary explanation and edge-case consideration."
4,LOT_Representative,"Okay, as the LOT Representative, let's break down my core idea and compare it to the GOT and ROT provided.  **Core Idea Elaboration: Aggregated Result from Layer 23**  My core idea, represented by the aggregated result from layer 23, aims to provide a comprehensive understanding of the problem by not only arriving at the correct answer but also exploring alternative interpretations, potential edge cases, and underlying assumptions. It goes beyond a simple calculation to offer a robust and well-reasoned solution.  *   **Addressing the Core Problem:** The primary objective is to answer the question ""How many of the kids who joined the rafting excursion were also on the tubing excursion?"" The initial calculations directly address this. *   **Key Strengths:**     *   **Conciseness:** The final answer is clearly stated.     *   **Verification:** The calculations are double-checked to minimize errors.     *   **Clarity:**  The reasoning behind the answer is clearly explained, explicitly connecting the rafting group to the tubing group.     *   **Alternative Interpretation:** Considers the possibility of the question asking for a ratio instead of a direct number.     *   **Assumption Acknowledgment:** Explicitly states the crucial assumption that all rafters were also tubers.     *   **Edge Case Analysis:** Explores the scenario where the number of kids isn't divisible by two and discusses the impact of rounding.     *   **Complete Sentence Answer:** Provides the answer in a complete and grammatically correct sentence.  **Critical Evaluation of GOT and ROT:**  **GOT (Graph Of Thoughts):**  > **1. Kids who went tubing:** > > *   40 kids / 4 = 10 kids > > **2. Kids who went rafting:** > > *   10 kids / 2 = 5 kids > > **Answer:** 5 of the kids who joined the rafting excursion were also on the tubing excursion.  *   **Weaknesses:**     *   **Lacks Explanation:** It only presents the calculations without explaining *why* the number of kids who went rafting is the answer to the original question. It doesn't explicitly state that all the rafters were also tubers.     *   **No Error Checking:** There's no verification of the calculations.     *   **No Consideration of Alternatives or Edge Cases:** It doesn't explore any other interpretations or potential issues with the problem.     *   **Missing Assumption:** Fails to acknowledge and state the critical assumption that all kids who went rafting also went tubing.  *   **Overlooked Aspects:** The GOT overlooks the importance of clearly articulating the relationship between the rafting and tubing groups and the potential for alternative interpretations.  **ROT (Reversal Of Thought):**  > Here's how to solve the problem: > > 1. **Tubing:** A fourth of the 40 kids went tubing, so (1/4) * 40 = 10 kids went tubing. > > 2. **Rafting:** Half of the tubers went rafting, so (1/2) * 10 = 5 kids went rafting. > > 3. **Overlap:** Since all the kids who went rafting were also tubers (because only tubers could go rafting), the number of kids who joined the rafting excursion and were also on the tubing excursion is 5. > > **Answer:** 5  *   **Weaknesses:**     *   **Limited Exploration:** While it correctly calculates the answer and mentions the overlap, it doesn't explore alternative interpretations (like the ratio) or the impact of rounding if the initial numbers weren't easily divisible.     *   **Lacks Depth:** Doesn't delve into edge cases or fully explore the implications of the assumption that rafters were also tubers.     *   **No Error Checking:** There's no explicit recalculation to confirm the arithmetic.  *   **Overlooked Aspects:** The ROT, while better than the GOT, still misses the opportunity to explore alternative interpretations, edge cases, and a more in-depth discussion of the underlying assumption.  **Why My Approach is Preferable:**  My approach, the aggregated result from Layer 23, is preferable because it offers a significantly more comprehensive and robust understanding of the problem. It goes beyond simply finding the correct answer by:  *   **Providing a clear and concise explanation:** The reasoning behind the solution is meticulously explained. *   **Explicitly stating and acknowledging assumptions:** The core assumption that all rafters were also tubers is stated clearly. *   **Exploring alternative interpretations:** The possibility of a ratio is considered. *   **Analyzing edge cases:** The scenario with non-divisible numbers and the impact of rounding are discussed. *   **Ensuring accuracy:** The calculations are double-checked.  In essence, my approach aims to provide a complete and well-reasoned solution that demonstrates a deep understanding of the problem and its nuances. The GOT and ROT, while arriving at the correct answer, lack the depth, critical analysis, and comprehensive explanation that my approach offers. They provide the *what*, while my approach provides the *what, why, what if, and what else*."
5,Critical_Analyst,"Okay, I will evaluate the solutions from ROT and GOT, identify weaknesses, and suggest improvements, culminating in a synthesized accurate answer.  **Evaluation of ROT's Solution:**  *   **Correctness:** The arithmetic is correct. The logic is sound, given the problem statement. *   **Completeness:** The solution is complete in that it arrives at the correct numerical answer and provides a justification. *   **Weaknesses:** The explanation is relatively brief. It could benefit from more explicit emphasis on the assumption that all rafters were also tubers. *   **Overlooked Aspects:** It doesn't explore alternative interpretations or edge cases (like non-integer results from the initial division). *   **Improvements:** Add a sentence explicitly stating the assumption: ""This solution assumes that all children who went rafting also went tubing.""  **Evaluation of GOT's Initial Solution:**  *   **Correctness:** The arithmetic is correct. *   **Completeness:** The solution is complete. *   **Weaknesses:** The explanation is very brief, similar to ROT. *   **Overlooked Aspects:** Same as ROT - no exploration of alternative interpretations or edge cases. *   **Improvements:** Add a sentence explicitly stating the assumption: ""This solution assumes that all children who went rafting also went tubing.""  **Evaluation of GOT's Aggregated Solution (Layer 23):**  *   **Correctness:** The core calculation and final answer are correct. *   **Completeness:** This version is significantly more complete. It addresses alternative interpretations, edge cases (rounding with non-integer results), and explicitly acknowledges the crucial assumption. *   **Weaknesses:** While comprehensive, some of the explorations (e.g., the ratio calculation) are not strictly necessary to answer the primary question. The exploration of rounding scenarios is helpful but could be more concisely presented. *   **Overlooked Aspects:** None significant. *   **Improvements:** Streamline the exploration of edge cases to focus on the core assumption and its impact. Remove the ratio calculation as it is not relevant.  **Overall Critique:**  Both ROT and GOT initially arrive at the correct answer using similar logic. GOT's aggregated solution is superior due to its thoroughness in considering alternative interpretations, edge cases, and the underlying assumptions. However, the aggregated solution could be more concise by removing the ratio calculation. The primary weakness across all solutions (except GOT's Aggregated solution) is the lack of explicit acknowledgement of the assumption that all rafters were also tubers. This assumption is critical for the solution to be valid.  **Specific Points of Caution:**  *   Always explicitly state assumptions, especially when they are crucial to the logic of the solution. *   Consider alternative interpretations of the problem, even if they seem unlikely. *   Be aware of edge cases, such as non-integer results, and how they might affect the solution. *   Strive for a balance between completeness and conciseness in explanations.  ### Synthesized Accurate Answer: 5 kids"
