Round,Speaker,Utterance
1,Moderator,"Debate Topic: In-depth discussion based on the mission context and ideas from ROT and LOT. Mission Context (partial): Instruction: Find all c in Z_3 such that Z_3[x]/(x^3 + x^2 + c) is a field.  Context: The following are multiple choice options:[0, 2, 1, 3]... Initial Core Idea from ROT (partial): Okay, let's find the values of `c` in Z_3 = {0, 1, 2} for which the polynomial x^3 + x^2 + c is irreducible.  We need to check each value of `c` to see if the polynomial has any roots in Z_3.  *   **c = 0:** The polynomial is x^3 + x^2 = x^2(x + 1).  If x = 0, the polynomial evaluates to 0.  If x = 2 (which is -1 in Z_3), the polynomial evaluates to 2^2(2+1) = 4 * 3 = 0 (mod 3).  So, x^3 + x^2 has roots 0 and 2. Therefore, it's reducible.  *   **c = 1:** The polynomial is x^3 + x^2 + 1.     *   x = 0: 0^3 + 0^2 + 1 = 1 != 0     *   x = 1: 1^3 + 1^2 + 1 = 1 + 1 + 1 = 3 = 0 (mod 3).  So, x = 1 is a root. Therefore, it's reducible.  *   **c = 2:** The polynomial is x^3 + x^2 + 2.     *   x = 0: 0^3 + 0^2 + 2 = 2 != 0     *   x = 1: 1^3 + 1^2 + 2 = 1 + 1 + 2 = 4 = 1 (mod 3) != 0     *   x = 2: 2^3 + 2^2 + 2 = 8 + 4 + 2 = 14 = 2 (mod 3) != 0.  So, there are no roots in Z_3. Therefore, it's irreducible.  Therefore, only c = 2 makes the polynomial irreducible.  The valid values of `c` are {2}.  From the multiple choice options [0, 2, 1, 3], the correct answer is 2.  Final Answer: The final answer is $\boxed{2}$... Initial Detailed Plan from LOT (partial): Aggregated result from layer 143 (Concept: 'Generate and present the answer based on the plan...') using strategy 'all_content_ranked': - (Criterion: 'Criterion A (Level 1): Systematically evaluate x^3 + x^2 + c for each c in Z_3 and each x in Z_3, explicitly stating whether a root is found and the resulting reducibility/irreducibility conclusion', Level: 1):   We need to find $c \in \mathbb{Z}_3$ such that $\mathbb{Z}_3[x]/(x^3 + x^2 + c)$ is a field. This is equivalent to finding $c$ such that $x^3 + x^2 + c$ is irreducible in $\mathbb{Z}_3[x]$. Since $x^3 + x^2 + c$ is a cubic polynomial, it is irreducible if and only if it has no roots in $\mathbb{Z}_3$. We test each $c \in \mathbb{Z}_3 = \{0, 1, 2\}$.  Case 1: $c = 0$.  Then $x^3 + x^2 + 0 = x^2(x+1)$. Since $x=0$ is a root, $x^3 + x^2$ is reducible.  Case 2: $c = 1$.  Let $f(x) = x^3 + x^2 + 1$. $f(0) = 0^3 + 0^2 + 1 = 1 \neq 0$. $f(1) = 1^3 + 1^2 + 1 = 1 + 1 + 1 = 3 \equiv 0 \pmod{3}$. Since $f(1) = 0$, $x=1$ is a root, so $x^3 + x^2 + 1$ is reducible.  Case 3: $c = 2$. Let $f(x) = x^3 + x^2 + 2$. $f(0) = 0^3 + 0^2 + 2 = 2 \neq 0$. $f(1) = 1^3 + 1^2 + 2 = 1 + 1 + 2 = 4 \equiv 1 \pmod{3} \neq 0$. $f(2) = 2^3 + 2^2 + 2 = 8 + 4 + 2 = 14 \equiv 2 \pmod{3} \neq 0$. Since $f(x)$ has no roots in $\mathbb{Z}_3$, $x^3 + x^2 + 2$ is irreducible.  Therefore, $\mathbb{Z}_3[x]/(x^3 + x^2 + c)$ is a field only when $c = 2$.  Final Answer: The final answer is $\boxed{2}$  - (Criterion: 'Criterion B (Level 1): Re-state the core theorem: ""Z_p[x]/(f(x)) is a field if and only if f(x) is irreducible over Z_p"". Then, explain why, for a cubic polynomial, irreducibility is equivalent to having no roots', Level: 1):   Criterion B (Level 1): Re-state the core theorem: ""Z_p[x]/(f(x)) is a field if and only if f(x) is irreducible over Z_p"".  Explanation: This theorem is a fundamental result in field theory. The quotient ring Z_p[x]/(f(x)) is a field if and only if the ideal generated by f(x) in Z_p[x] is a maximal ideal. In the polynomial ring Z_p[x], an ideal generated by a polynomial f(x) is maximal if and only if f(x) is irreducible over Z_p.  Now, explain why, for a cubic polynomial, irreducibility is equivalent to having no roots:  Let f(x) be a cubic polynomial in Z_p[x].  *   **If f(x) has a root 'a' in Z_p:** Then (x - a) is a factor of f(x).  Therefore, f(x) = (x - a) * g(x), where g(x) is a quadratic polynomial.  This means f(x) is reducible.  *   **If f(x) is reducible:**  Since f(x) is a cubic polynomial, if it is reducible, it can be factored into either:      *   A linear factor and a quadratic factor:  f(x) = (x - a) * g(x), where 'a' is in Z_p and g(x) is a quadratic.  In this case, 'a' is a root of f(x).     *   Three linear factors: f(x) = (x - a)(x - b)(x - c), where a, b, and c are in Z_p.  In this case, a, b, and c are roots of f(x).     *   A constant factor and a cubic factor. Since we can divide by the constant factor, this case reduces to just the cubic factor, so f(x) is irreducible.  Therefore, for a cubic polynomial, f(x) is irreducible if and only if it has no roots in Z_p. This is because if it *does* have a root, it must have a linear factor, making it reducible. Conversely, if it is reducible, it must have a factor of degree 1 (a linear factor) and thus a root in Z_p.  - (Criterion: 'Criterion C (Level 2): Consider polynomials of degree 2 in Z_3[x]. Find all irreducible quadratic polynomials. How does the number of irreducible quadratics relate to the number of total quadratics?', Level: 1):   Criterion C is not directly relevant to the main task objective, which is to find the values of `c` that make `Z_3[x]/(x^3 + x^2 + c)` a field. Criterion C discusses irreducible quadratics, while the polynomial in question is a cubic. However, understanding irreducibility is crucial. A polynomial ring modulo an ideal generated by a polynomial is a field if and only if the polynomial is irreducible. Therefore, we need to determine for which values of `c` the cubic polynomial `x^3 + x^2 + c` is irreducible in `Z_3[x]`. A cubic polynomial is irreducible if and only if it has no roots in `Z_3`. Therefore, Criterion C is indirectly relevant as it reinforces the concept of irreducibility.  We need to check if `x^3 + x^2 + c` has any roots in Z_3 = {0, 1, 2} for different values of c.  If x = 0, then 0^3 + 0^2 + c = c.  So, if c = 0, then x = 0 is a root, and the polynomial is reducible.  If x = 1, then 1^3 + 1^2 + c = 1 + 1 + c = 2 + c.  If 2 + c = 0 (mod 3), then c = -2 = 1 (mod 3). So, if c = 1, then x = 1 is a root, and the polynomial is reducible.  If x = 2, then 2^3 + 2^2 + c = 8 + 4 + c = 12 + c = 0 + c = c (mod 3). So, if c = 0, then x = 2 is a root, and the polynomial is reducible.  Therefore, if c = 0 or c = 1, the polynomial has a root and is reducible.  If c = 2, then: If x = 0, then 0^3 + 0^2 + 2 = 2 != 0 (mod 3) If x = 1, then 1^3 + 1^2 + 2 = 1 + 1 + 2 = 4 = 1 != 0 (mod 3) If x = 2, then 2^3 + 2^2 + 2 = 8 + 4 + 2 = 14 = 2 != 0 (mod 3)  So, if c = 2, the polynomial has no roots in Z_3 and is therefore irreducible.  Therefore, the only value of c for which Z_3[x]/(x^3 + x^2 + c) is a field is c = 2. Final Answer: The final answer is $\boxed{2}$  - (Criterion: 'Criterion D (Level 2): Explore the concept of ""splitting fields."" If x^3 + x^2 + c is reducible, what is the smallest field extension of Z_3 in which the polynomial splits completely into linear factors?', Level: 1):   Criterion D (Level 2) asks about splitting fields if the polynomial `x^3 + x^2 + c` is reducible.  If `x^3 + x^2 + c` is reducible in Z_3[x], then it either has a linear factor (and hence a root in Z_3) or it factors into a product of an irreducible quadratic and a linear factor.  If `x^3 + x^2 + c` has a root in Z_3, say `a`, then `a^3 + a^2 + c = 0` in Z_3.  In this case, `x - a` is a factor, and we can perform polynomial division to obtain a quadratic factor.  This quadratic factor might be irreducible or reducible.  If it's irreducible, then we need to extend to Z_3[x]/(quadratic).  If it's reducible, then we can factor the cubic completely over Z_3.  If `x^3 + x^2 + c` factors into an irreducible quadratic and a linear factor, say `(x-a)q(x)` where `q(x)` is an irreducible quadratic in Z_3[x], then the splitting field is Z_3[x]/(q(x)).  This is a field extension of degree 2 over Z_3, i.e., it is isomorphic to GF(3^2) = GF(9).  In either case, if `x^3 + x^2 + c` is reducible, its splitting field is either Z_3 itself (if it splits completely in Z_3), or GF(9) (if it has an irreducible quadratic factor).  The key idea here is that if we have a cubic polynomial over Z_3, its splitting field has degree at most 6 over Z_3 (since the Galois group has order at most 3! = 6). However, if the cubic is reducible, the degree of the splitting field is either 1 or 2.  This exploration is relevant because if `x^3 + x^2 + c` is reducible, then Z_3[x]/(x^3 + x^2 + c) is *not* a field. A field extension of degree 3 would be required if the polynomial was irreducible. If it is reducible, the quotient will have zero divisors and therefore not be a field.  - (Criterion: 'Criterion E (Level 3): Investigate how the choice of the representative polynomial affects the structure of the quotient ring. If we chose a different representative of the same coset, would the ring structure change?', Level: 1):   Criterion E (Level 3): Investigate how the choice of the representative polynomial affects the structure of the quotient ring. If we chose a different representative of the same coset, would the ring structure change?  The structure of the quotient ring Z_3[x]/(x^3 + x^2 + c) is determined by the ideal (x^3 + x^2 + c) generated by the polynomial x^3 + x^2 + c.  Choosing a different representative of the *same* coset doesn't change the ideal, and therefore doesn't change the ring structure.  To elaborate, suppose we have two polynomials f(x) and g(x) such that f(x) = g(x) + h(x)(x^3 + x^2 + c) for some polynomial h(x) in Z_3[x].  Then f(x) and g(x) are in the same coset of the ideal (x^3 + x^2 + c).  However, the ideal generated by f(x) is *not* necessarily the same as the ideal generated by g(x).  Instead, we are interested in the ideal generated by x^3 + x^2 + c.  The coset representatives are polynomials of degree at most 2.  If we choose a different representative of the *same* coset for the polynomial we're modding out by, the quotient ring remains isomorphic. This is because the ideal remains the same.  For instance, suppose we consider the ideal (x^3 + x^2 + c + (x^3 + x^2 + c) * q(x)) where q(x) is any polynomial in Z_3[x]. This ideal simplifies to (x^3 + x^2 + c) since (x^3 + x^2 + c) * q(x) is already in the ideal generated by (x^3 + x^2 + c).  Therefore, the ring structure does *not* change if we choose a different representative of the same coset for x^3 + x^2 + c. The ideal we are factoring out by remains the same, and thus the quotient ring remains the same (up to isomorphism).  This criterion is important because it confirms that the choice of the polynomial x^3 + x^2 + c is sufficient to define the quotient ring, and we don't need to worry about different representations affecting the result. The key is that we are interested in the *ideal* generated by the polynomial, not the polynomial itself.  - (Criterion: 'Criterion F (Level 3): For the case where Z_3[x]/(x^3 + x^2 + c) is not a field, identify specific zero divisors in the ring. Give concrete examples.', Level: 1):   If $Z_3[x]/(x^3 + x^2 + c)$ is not a field, then $x^3 + x^2 + c$ is reducible in $Z_3[x]$. This means it can be factored into polynomials of lower degree. Since it's a cubic polynomial, it must have a linear factor. Thus, $x^3 + x^2 + c$ has a root in $Z_3$.  Let $f(x) = x^3 + x^2 + c$. We check the values of $f(x)$ for $x \in \{0, 1, 2\}$: - If $x = 0$, $f(0) = 0^3 + 0^2 + c = c$. So, $f(0) = 0$ if and only if $c = 0$. - If $x = 1$, $f(1) = 1^3 + 1^2 + c = 1 + 1 + c = 2 + c$. So, $f(1) = 0$ if and only if $c = -2 \equiv 1 \pmod{3}$. - If $x = 2$, $f(2) = 2^3 + 2^2 + c = 8 + 4 + c = 12 + c \equiv 0 + c = c \pmod{3}$. So, $f(2) = 0$ if and only if $c = 0$.  Thus, $f(x)$ has a root in $Z_3$ if $c = 0$ or $c = 1$. If $c = 0$, $f(x) = x^3 + x^2 = x^2(x+1)$. Then $x^2(x+1) = 0$ in $Z_3[x]/(x^3 + x^2)$.  So $x^2$ and $x+1$ are zero divisors. If $c = 1$, $f(x) = x^3 + x^2 + 1 = (x-1)(x^2 + 2x + 2) = (x+2)(x^2+2x+2)$. Then $(x+2)(x^2+2x+2) = 0$ in $Z_3[x]/(x^3 + x^2 + 1)$. So $x+2$ and $x^2+2x+2$ are zero divisors.  If $Z_3[x]/(x^3 + x^2 + c)$ is a field, then $x^3 + x^2 + c$ must be irreducible in $Z_3[x]$.  This occurs when $f(x)$ has no root in $Z_3$.  From the above, we found that $f(x)$ has a root if $c=0$ or $c=1$.  Therefore, $f(x)$ is irreducible only when $c=2$.  If $c=2$, $f(x) = x^3 + x^2 + 2$. Then $f(0) = 2 \neq 0$ $f(1) = 1 + 1 + 2 = 4 \equiv 1 \neq 0$ $f(2) = 8 + 4 + 2 = 14 \equiv 2 \neq 0$ So $x^3 + x^2 + 2$ has no roots in $Z_3$, and since it is a cubic, it is irreducible. Therefore $Z_3[x]/(x^3 + x^2 + 2)$ is a field.  Final Answer: The final answer is $\boxed{2}$  ... The debate will now commence focusing on these ideas."
2,ROT_Representative,"Okay, here's my response as ROT_Representative, addressing the prompt:  **1. Elaboration on the ROT Idea and its Strengths**  My core idea directly addresses the problem by focusing on the fundamental connection between the quotient ring being a field and the irreducibility of the polynomial. Specifically, it leverages the fact that for a cubic polynomial over Z_3, irreducibility is equivalent to having no roots in Z_3.  The key strengths of my approach are:  *   **Directness:** It immediately targets the irreducibility condition, which is the necessary and sufficient condition for the quotient ring to be a field. *   **Simplicity:** It avoids unnecessary theoretical detours and focuses on a practical, computational approach – checking for roots. *   **Efficiency:** For a finite field like Z_3, checking for roots is a straightforward and efficient method to determine irreducibility of a cubic polynomial. *   **Clarity:** The step-by-step evaluation for each possible value of `c` and each element in Z_3 makes the reasoning transparent and easy to follow.  In essence, my method provides a clear, concise, and computationally efficient way to find the value of `c` that satisfies the given condition.  **2. Critical Evaluation of the LOT Idea and Comparison to the ROT Idea**  The LOT idea, represented by the ""Aggregated result from layer 143,"" is generally correct and comprehensive. It correctly identifies the core theorem, the equivalence of irreducibility and absence of roots for cubic polynomials, and systematically checks each value of `c`. However, it also has some potential weaknesses and overlooked aspects compared to my approach:  *   **Overly Theoretical in the beginning:** While Criterion B correctly states the core theorem and explains the link between irreducibility and no roots, this initial theoretical emphasis, while valuable, isn't strictly necessary for *solving* the problem. My approach gets straight to the computational part. *   **Criterion C is irrelevant:** Criterion C discusses irreducible quadratics. While the general concept of irreducibility is relevant, focusing on quadratics is a distraction. The problem is about a cubic polynomial. My approach avoids this tangent. *   **Criterion D (Splitting Fields) is unnecessary:** Exploring splitting fields is an interesting theoretical exercise, but it's not required to determine the correct value of `c`. This adds complexity without contributing to the core task. My approach is more focused. *   **Criterion E (Choice of Representative Polynomial) is overly cautious:** While technically correct, the discussion about the choice of representative polynomial is arguably overthinking the problem. The ideal generated by the polynomial remains unchanged, and the student is unlikely to get confused by this. My approach is more straightforward. *   **Criterion F (Zero Divisors) is useful but comes too late:** The exploration of zero divisors for the reducible cases is a good way to reinforce understanding. However, it comes after the irreducibility condition has been correctly identified. My approach, while not explicitly discussing zero divisors, focuses on the core concept of irreducibility *first*. *   **Potential for Confusion:** The sheer volume of information and the multiple criteria in the LOT idea could potentially overwhelm someone trying to solve the problem, especially if they are not very comfortable with abstract algebra. My approach is more direct and less likely to cause confusion.  **Why my approach is preferable:**  My ROT approach is preferable because it prioritizes clarity, simplicity, and efficiency. It directly addresses the core problem using a straightforward computational method. It avoids unnecessary theoretical detours and extraneous considerations, making it easier to understand and apply. While the LOT approach is more comprehensive, it risks obscuring the solution with excessive information and potentially irrelevant criteria. My approach provides a more focused and accessible path to the correct answer.  In summary, while the LOT approach provides a broader understanding of the underlying concepts, my ROT approach offers a more direct, simpler, and more efficient solution to the specific problem at hand."
3,LOT_Representative,"Okay, here's my response as LOT_Representative, addressing the prompt:  **1. Elaboration on how the LOT Detailed Plan Addresses the Core Problem**  The LOT detailed plan directly addresses the core problem by systematically determining the values of `c` in Z_3 for which Z_3[x]/(x^3 + x^2 + c) is a field. This is achieved by focusing on the fundamental theorem stating that Z_p[x]/(f(x)) is a field if and only if f(x) is irreducible over Z_p. The plan leverages the fact that for a cubic polynomial over Z_3, irreducibility is equivalent to having no roots in Z_3.  The key strengths and feasibility of this approach are:  *   **Systematic Evaluation:** The plan systematically evaluates `x^3 + x^2 + c` for each `c` in Z_3 and each `x` in Z_3. This ensures that all possibilities are considered, leaving no room for error. (Criterion A) *   **Theoretical Foundation:** The plan explicitly states and explains the core theorem connecting fields and irreducible polynomials, providing a solid mathematical justification for the method. (Criterion B) *   **Comprehensive Explanation:** The plan provides detailed explanations for each step, including why irreducibility is equivalent to having no roots for a cubic polynomial. *   **Exploration of Related Concepts:** The plan explores related concepts like irreducible quadratics (Criterion C), splitting fields (Criterion D), the impact of representative polynomial choices (Criterion E) and zero divisors (Criterion F). While these concepts are not strictly necessary for solving the core problem, they provide a broader and deeper understanding of the underlying algebraic structures. *   **Clear Conclusion:** The plan arrives at a clear and correct conclusion, stating that only `c = 2` makes the quotient ring a field. *   **Addresses Potential Reducibility:** The plan also considers the consequences of the polynomial being reducible, linking it to the existence of zero divisors within the quotient ring.  The feasibility of the plan stems from the fact that Z_3 is a small, finite field. This makes it computationally tractable to test all possible values of `c` and `x`.  **2. Critical Evaluation of the ROT Idea**  The ROT idea, while correct, has some limitations compared to the LOT plan:  *   **Lack of Explicit Theoretical Justification:** The ROT idea correctly identifies the irreducibility condition but doesn't explicitly state the underlying theorem (Z_p[x]/(f(x)) is a field iff f(x) is irreducible). The LOT plan provides this crucial theoretical foundation, making the solution more rigorous and understandable. While the ROT idea implicitly uses this theorem, stating it explicitly strengthens the explanation. *   **Limited Scope and Depth:** The ROT idea focuses primarily on the computational aspect of finding the value of `c`. It doesn't explore related concepts like splitting fields or zero divisors, which provide a richer understanding of the algebraic structures involved. The LOT plan, with its multiple criteria, provides a more comprehensive perspective. *   **Potential for Incomplete Understanding:** While the ROT idea is effective for *solving* the problem, it may not foster a deep understanding of the underlying principles. Someone following the ROT idea might be able to find the correct answer without fully grasping the connection between irreducibility, fields, and quotient rings. The LOT plan, with its theoretical emphasis, is more likely to lead to a deeper understanding. *   **Less Robust to Generalizations:** The ROT idea is tailored to the specific problem (finding `c` for a cubic polynomial over Z_3). It might not be easily generalizable to other problems involving different polynomials or different fields. The LOT plan, with its emphasis on fundamental theorems, is more easily adapted to different situations.  **3. Why the LOT Plan Might Be Preferable**  The LOT plan is preferable because it provides a more complete and robust solution. While the ROT idea is simpler and more direct, it sacrifices depth and theoretical understanding. The LOT plan, by explicitly stating the underlying theorem, exploring related concepts, and providing detailed explanations, fosters a deeper and more lasting understanding of the problem. It also provides a more rigorous and justifiable solution.  In particular:  *   **Criterion B:** Stating the core theorem makes the solution more mathematically rigorous and easier to generalize. *   **Criterion F:** Exploring zero divisors in the reducible cases reinforces the connection between irreducibility and the absence of zero divisors in a field. *   **Criterion D & E:** While not strictly necessary to solve the problem, exploring the concept of splitting fields and the choice of polynomial representatives deepens the understanding of the structure and properties of the quotient ring.  The LOT plan provides a stronger foundation for future learning and problem-solving in abstract algebra. While the ROT approach is efficient for this specific problem, the LOT approach promotes a more comprehensive and adaptable understanding. Therefore, the LOT approach is preferable."
4,Critical_Analyst,"Okay, here's my critical analysis of the ROT and LOT ideas, addressing weaknesses, overlooked aspects, inconsistencies, correctness, completeness, and suggesting improvements.  **ROT Analysis:**  *   **Strengths:** ROT provides a direct and efficient solution by focusing on finding the values of 'c' for which the polynomial is irreducible. It correctly uses the fact that a cubic polynomial over Z_3 is irreducible if and only if it has no roots in Z_3. The calculations are accurate, and the conclusion is correct. *   **Weaknesses:** ROT lacks explicit theoretical justification. While the underlying principle is implicitly used, it is not explicitly stated. Furthermore, ROT does not explore the related concepts, such as splitting fields or zero divisors, which provide a deeper understanding of the algebraic structures involved. *   **Overlooked Aspects:** While ROT focuses on the core task, it overlooks the broader context and theoretical underpinnings of the problem. *   **Inconsistencies:** None. *   **Correctness:** Correct. *   **Completeness:** Complete in the sense that it arrives at the correct answer, but incomplete in terms of providing a comprehensive understanding. *   **Improvements/Cautions:** ROT would benefit from explicitly stating the theorem that Z_p[x]/(f(x)) is a field if and only if f(x) is irreducible over Z_p. Also, mentioning the connection between irreducibility and the absence of zero divisors in the quotient ring would strengthen the explanation.  **LOT Analysis:**  *   **Strengths:** LOT provides a comprehensive solution that includes a clear statement of the core theorem, a detailed explanation of the irreducibility condition, and exploration of related concepts. The systematic evaluation ensures that all possibilities are considered. The LOT plan is more rigorous and justifiable than the ROT approach. *   **Weaknesses:** LOT's breadth can be a weakness. Some criteria, like C, D, and E, are not strictly necessary for solving the problem and may distract from the core task. The initial theoretical emphasis, while valuable, is not strictly necessary for solving the problem. *   **Overlooked Aspects:** None significant. *   **Inconsistencies:** None. *   **Correctness:** Correct. *   **Completeness:** More complete than ROT, providing a deeper understanding of the underlying concepts. *   **Improvements/Cautions:** LOT could be more streamlined by focusing on the most relevant criteria and minimizing the discussion of tangential concepts. While exploring related concepts is valuable, it should not overshadow the core task. Criterion C, in particular, is the least helpful.  **Balanced Overall Critique:**  Both ROT and LOT arrive at the correct answer. ROT provides a more direct and efficient solution, while LOT provides a more comprehensive and theoretically grounded solution. ROT is better for someone who wants a quick and easy answer, while LOT is better for someone who wants a deeper understanding. LOT is preferable because it is more robust and provides a stronger foundation for future learning. However, LOT could be more focused.  ### Synthesized Accurate Answer: 2"
