Round,Speaker,Utterance
1,Moderator,"Debate Topic: In-depth discussion based on the following mission context, ROT idea, GOT idea, and LOT idea. Mission Context: Instruction: By the time Anne is two times as old as Emile, Emile will be six times as old as Maude. If Maude will be 8 years old, how old will Anne be? Initial Core Idea from GOT: Okay, based on the task definition and the provided input, I can calculate Anne's age.  The input is Maude's future age, which is 8.  Using the formula derived above:  Anne's future age = 12 * Maude's future age Anne's future age = 12 * 8 Anne's future age = 96  Therefore, Anne will be 96 years old.  **Answer:** 96 Initial Core Idea from GOT: **Emile's age:** Emile will be 6 * 8 = 48 years old.  Initial Detailed Plan from LOT: Aggregated result from layer 43 (Concept: 'Generate and present the answer...') using strategy 'all_content_ranked': - (Criterion: 'State the final answer concisely', Level: 1):   Anne will be 96 years old.  - (Criterion: 'Verify the answer by restating the initial conditions and recalculating', Level: 1):   Okay, let's verify the answer.  The problem states: ""By the time Anne is two times as old as Emile, Emile will be six times as old as Maude. If Maude will be 8 years old, how old will Anne be?""  Our answer is that Anne will be 96 years old.  1. **Maude's age:** Maude will be 8 years old.  2. **Emile's age:** Emile will be six times as old as Maude. So, Emile's age will be 6 * 8 = 48 years old.  3. **Anne's age:** Anne will be two times as old as Emile. So, Anne's age will be 2 * 48 = 96 years old.  The calculation confirms that when Maude is 8, Emile is 48, and Anne is 96.  This matches our initial calculated answer.  - (Criterion: 'Summarize the solution process in a brief paragraph', Level: 1):   First, determine Maude's age (8 years old). Then, calculate Emile's age when he is six times as old as Maude (6 * 8 = 48 years old). Finally, calculate Anne's age when she is twice as old as Emile (2 * 48 = 96 years old). Therefore, Anne will be 96 years old.  - (Criterion: 'Reiterate the logical steps taken to arrive at the solution', Level: 1):   Here's a breakdown of the logical steps leading to the solution:  1. **Maude's future age:** We are given that Maude will be 8 years old.  2. **Emile's future age:** At that time, Emile will be six times as old as Maude. So, Emile's age will be 6 * 8 = 48 years old.  3. **Anne's future age:**  At that same time, Anne will be two times as old as Emile. Therefore, Anne's age will be 2 * 48 = 96 years old.  Therefore, Anne will be 96 years old.  - (Criterion: 'Examine the calculations for potential arithmetic errors', Level: 1):   Okay, let's meticulously examine the calculations to ensure accuracy. The previous steps (not shown, but implied) led to the conclusion that Anne will be 96 years old. We need to verify the logic and arithmetic that resulted in this answer.  Here's a breakdown of the implied reasoning and a check for errors:  1. **Maude's age:** Maude will be 8 years old. This is a given.  2. **Emile's age:** Emile will be six times as old as Maude. So, Emile's age will be 6 * 8 = 48 years old.  3. **Anne's age:** Anne will be two times as old as Emile. So, Anne's age will be 2 * 48 = 96 years old.  **Arithmetic Check:**  * 6 * 8 = 48 (Correct) * 2 * 48 = 96 (Correct)  **Logical Check:**  The problem states: ""By the time Anne is two times as old as Emile, Emile will be six times as old as Maude. If Maude will be 8 years old, how old will Anne be?""  The logic flows as follows:  * We are given Maude's future age. * We use the relationship between Emile and Maude to find Emile's future age. * We use the relationship between Anne and Emile to find Anne's future age.  The logic appears sound.  **Conclusion:**  The calculations and the logic are correct. There are no apparent arithmetic errors. Anne will indeed be 96 years old.  - (Criterion: 'Re-evaluate the problem statement to ensure all data was utilized', Level: 1):   Let's re-examine the problem statement: ""By the time Anne is two times as old as Emile, Emile will be six times as old as Maude. If Maude will be 8 years old, how old will Anne be?""  We need to confirm we used all the information:  1. **""By the time Anne is two times as old as Emile...""**: This establishes a relationship between Anne's age and Emile's age *at a specific point in the future*. 2. **""...Emile will be six times as old as Maude.""**: This establishes a relationship between Emile's age and Maude's age *at the same specific point in the future*. 3. **""If Maude will be 8 years old...""**: This gives us Maude's age *at that same specific point in the future*. 4. **""...how old will Anne be?""**: This is our target question – Anne's age *at that same specific point in the future*.  We used all four pieces of information in the previous steps to deduce the answer. Maude's age (8) allowed us to find Emile's age (6 * 8 = 48). Emile's age then allowed us to find Anne's age (2 * 48 = 96).  Therefore, we have utilized all the given data.  - (Criterion: 'Consider any implicit problem assumptions', Level: 1):   The problem implies the following assumptions:  1.  **Consistent Time Flow:** Time progresses at the same rate for all three individuals (Anne, Emile, and Maude). 2.  **Future Time:** The problem refers to a future point in time when the age relationships hold. We are not concerned with their current ages, only their ages at a specific point in the future. 3.  **Positive Ages:** All ages are positive numbers. This is a natural constraint for age-related problems. 4. **Unique Solution:** The problem assumes that there is a single, unique solution that can be determined from the given information. 5. **Whole Number Ages:** The ages are likely assumed to be whole numbers (integers), as this is typical for age problems. Although not explicitly stated, it's a reasonable assumption.  - (Criterion: 'Explore a different wording of the problem to ensure comprehension', Level: 1):   Okay, let's rephrase the word problem to ensure we understand it correctly.  **Original Problem:** By the time Anne is two times as old as Emile, Emile will be six times as old as Maude. If Maude will be 8 years old, how old will Anne be?  **Rephrased Problem 1 (Focus on timing):**  Imagine a future point in time. At that specific point: * Anne's age will be twice Emile's age. * Emile's age will be six times Maude's age. * Maude's age at that time will be 8. What will Anne's age be at that *same* future point in time?  **Rephrased Problem 2 (Step-by-Step):** 1. We know Maude will be 8 years old at a certain time. 2. At that same time, Emile will be six times Maude's age.  So, how old will Emile be? 3. At that same time, Anne will be twice Emile's age.  So, how old will Anne be?  **Rephrased Problem 3 (Using ""when""):** When Maude is 8 years old, Emile will be six times her age.  Also, at that time, Anne will be twice Emile's age.  What will Anne's age be when Maude is 8?  These rephrased versions highlight the crucial point that we are looking at a specific future point in time, and the relationships between the ages are all at that single point. This helps to prevent misinterpretations about the ages changing independently. They all still lead to the same conclusion: we need to find Emile's age when Maude is 8, and then double that to find Anne's age.  - (Criterion: 'Apply the solution strategy to a similar but simpler problem', Level: 1):   Let's consider a simpler problem:  ""By the time Anne is twice as old as Emile, Emile will be three times as old as Maude. If Maude will be 2 years old, how old will Anne be?""  Following the same logic as the original problem:  1. **Emile's age:** Emile will be 3 * Maude's age = 3 * 2 = 6 years old. 2. **Anne's age:** Anne will be 2 * Emile's age = 2 * 6 = 12 years old.  Therefore, Anne will be 12 years old.  This simpler example reinforces the steps:  1. Find Emile's age based on Maude's age and the given ratio. 2. Find Anne's age based on Emile's age and the given ratio.  This confirms the approach used in the main problem is valid and helps to understand the relationship between the ages more clearly.  - (Criterion: 'Consider the problem from a different mathematical perspective (e.g., ratios).', Level: 1):   Let A, E, and M represent the current ages of Anne, Emile, and Maude, respectively. Let t be the number of years from now when Anne is twice as old as Emile. Then, A + t = 2(E + t) Also, at that time, Emile will be six times as old as Maude: E + t = 6(M + t) We are given that M + t = 8. So, E + t = 6 * 8 = 48. Therefore, A + t = 2 * 48 = 96. We want to find Anne's age at that time, which is A + t. Thus, Anne will be 96 years old.  From a ratio perspective: At time t: Anne's age : Emile's age = 2:1 Emile's age : Maude's age = 6:1 Maude's age = 8 Emile's age = 6 * Maude's age = 6 * 8 = 48 Anne's age = 2 * Emile's age = 2 * 48 = 96  Final Answer: Anne will be 96 years old.   The debate will now commence."
2,ROT_Representative,"Okay, as the ROT (Reversal Of Thought) Representative, my core idea is: ""Okay, based on the task definition and the provided input, I can calculate Anne's age."" This means I recognize the problem is solvable given the information and my focus is on directly calculating the answer without unnecessary detours.  My approach directly addresses the problem's core requirement: to find Anne's age under specific conditions. It emphasizes the possibility of a direct computation given the input.  **Key Strengths:**  *   **Directness:** It cuts to the chase, focusing on the goal of calculating Anne's age. *   **Efficiency:** Aims to minimize unnecessary steps or complex reasoning. *   **Solvability Focus:** Highlights that the problem is solvable with the provided information.  Now, let's analyze the GOT and LOT approaches and compare them to my ROT idea.  **GOT Analysis:**  *   **GOT Idea:** ""Emile's age: Emile will be 6 * 8 = 48 years old.""  **Weaknesses:**  *   **Incomplete:** The GOT only calculates Emile's age. It doesn't complete the problem by calculating Anne's age. *   **Lack of Context:** While correct, it doesn't explicitly state *why* we're calculating Emile's age. The connection to the overall problem is somewhat implicit. *   **Doesn't represent the full solution path:** It's a single step, not a graph of thought representing the entire reasoning process.  **Overlooked Aspects:**  *   The need to then use Emile's age to calculate Anne's age.  **Limitations:**  *   By only focusing on a single calculation, it provides only a partial solution.  **LOT Analysis:**  *   **LOT Idea:** The LOT presents a comprehensive breakdown of the solution, including verification, summarization, reiteration, error checks, re-evaluation of the problem statement, consideration of implicit assumptions, rephrasing, and applying to a simpler problem. The final answer is ""Anne will be 96 years old.""  **Weaknesses:**  *   **Overly Verbose:** The LOT spends a lot of time verifying and justifying the solution. This is helpful for understanding, but isn't strictly necessary for *solving* the problem. *   **Repetitive:** The LOT repeats calculations and explanations in various sections. *   **Not as direct:** LOT is very thorough and verifies every step, however this is only needed for more complex situations.  **Overlooked Aspects:**  *   N/A - the LOT is very comprehensive  **Limitations:**  *   The LOT is a good way of explaining the answer, but it's not a preferable way to solve the problem.  **Why my ROT approach is preferable:**  My ROT idea, ""Okay, based on the task definition and the provided input, I can calculate Anne's age,"" is preferable because it is the most direct and efficient approach to solving the problem. While the GOT provides only a partial answer, and the LOT provides a comprehensive solution, my idea cuts straight to the point, focusing on the calculation of Anne's age.  Here's a breakdown of the comparison:  | Feature          | ROT (My Idea)        | GOT                     | LOT                                                                | | ---------------- | --------------------- | ----------------------- | ------------------------------------------------------------------ | | **Goal Focus**    | Direct calculation    | Partial calculation     | Thorough explanation and justification                              | | **Efficiency**    | High                  | Low                     | Low                                                                | | **Completeness**  | Complete (implicitly) | Incomplete              | Complete (explicitly)                                              | | **Verbosity**     | Minimal               | Minimal               | High                                                                | | **Justification** | Implicit             | Implicit                | Explicit and Extensive                                               |  In essence, the GOT provides only a single step, whereas the LOT over-explains. My ROT idea recognizes the problem's solvability and focuses on the direct calculation, which is the most efficient approach. While the LOT is valuable for pedagogical purposes (explaining the reasoning), it's not the most efficient way to *solve* the problem."
3,GOT_Representative,"Okay, as the GOT Representative, let's break down the core idea, its strengths, and compare it to the ROT and LOT ideas.  **Core Idea:**  *   **Emile's age:** Emile will be 6 * 8 = 48 years old.  **Explanation and Strengths:**  This core idea is the crucial intermediate step to solving the problem. The problem states that Emile will be six times as old as Maude when Maude is 8. Therefore, calculating Emile's age at that future point in time is essential for determining Anne's age. Its strength lies in its directness and its role as a necessary building block for the final solution. It correctly applies the information given about the relationship between Emile's and Maude's ages. Without this calculation, we cannot determine Anne's age.  **Critical Evaluation of ROT Idea:**  The ROT idea, which directly calculates Anne's age as 12 * Maude's age (96), arrives at the correct answer but lacks explicit justification within its provided logic. While it correctly infers the overall relationship (Anne = 12 * Maude), it skips the crucial intermediate step of calculating Emile's age.  *   **Weakness:** The major weakness is the lack of transparency in how the relationship between Anne's and Maude's ages was derived. While the formula itself is correct, the reasoning behind it is not clearly articulated. This makes it difficult to understand *why* Anne's age is 12 times Maude's age. This lack of explicit reasoning makes the solution less robust and harder to verify. *   **Overlooked Aspects:** It overlooks the importance of the intermediate step of calculating Emile's age as a means of verifying the solution and understanding the problem's structure. *   **Limitation:** The ROT idea is limited in its ability to demonstrate a deep understanding of the problem's relationships. It presents a direct calculation without explaining the underlying logic.  **Critical Evaluation of LOT Idea:**  The LOT idea is much more thorough and comprehensive. It arrives at the correct answer (96) and includes detailed explanations, verification steps, and considerations of potential errors, assumptions, and alternative perspectives.  *   **Weakness:** While the LOT idea is very thorough, it can be seen as somewhat verbose and repetitive. Some of the steps, such as re-evaluating the problem statement multiple times and exploring different wordings, might be considered excessive for such a straightforward problem. The multiple levels of verification, while beneficial, could also be streamlined. *   **Overlooked Aspects:** The LOT idea doesn't explicitly highlight the single most crucial step as being the calculation of Emile's age. While it's present within the detailed breakdown, it's not given the same prominence as in the GOT idea. *   **Limitation:** The LOT idea's strength (its thoroughness) can also be a limitation. The sheer volume of information might make it harder to quickly grasp the core logic of the solution.  **Why the GOT Idea is Preferable (in this specific context):**  While the LOT idea provides a more complete solution, the GOT idea focuses on the *essential* element: calculating Emile's age.  *   **Clarity and Focus:** The GOT idea provides a clear and focused starting point. It highlights the most important intermediary calculation needed to proceed. *   **Efficiency:** It is concise and efficient. It gets straight to the core of the problem without unnecessary elaboration. *   **Building Block:** It serves as a critical building block for a more complete solution. The GOT idea is the vital link between Maude's age and Anne's age, and it must be explicitly calculated to fully understand the problem.  In summary, while the ROT idea jumps to the correct answer without sufficient explanation, and the LOT idea is comprehensive but potentially verbose, the GOT idea correctly identifies and emphasizes the crucial intermediate calculation (Emile's age) that makes the entire solution understandable and verifiable. It is the most direct and essential element in solving the problem. The GOT, ROT, and LOT actually form a good chain of reasoning, but the GOT part, if skipped, can cause confusion."
4,LOT_Representative,"Okay, as the LOT Representative, I will elaborate on my core idea, address the problem, highlight strengths, and critically evaluate the GOT and ROT ideas.  **Elaboration on Core Idea:**  My core idea is to systematically break down the word problem into smaller, manageable steps, focusing on the relationships between the ages of Anne, Emile, and Maude at a *specific future point in time*. This involves:  1.  **Identifying the known:** Recognizing that Maude's future age (8 years old) is the starting point. 2.  **Utilizing the relationships:** Using the given relationships (Emile is six times Maude's age, Anne is twice Emile's age) to calculate Emile's and then Anne's future ages. 3.  **Verification:** Rigorously verifying the calculations and the logic to ensure accuracy. 4.  **Comprehensive Review:** Re-evaluating the problem statement, considering implicit assumptions, exploring different wordings, and applying the solution to a simpler problem to ensure a deep understanding and robust solution. 5. **Mathematical Perspective:** Considering the problem from the perspective of ratios.  **How it Addresses the Core Problem:**  The core problem asks us to find Anne's age at a specific future time when certain age relationships hold true. My approach directly tackles this by:  *   Clearly defining the target variable (Anne's age at that future time). *   Providing a step-by-step method to derive the answer from the given information. *   Ensuring the answer is logically sound and arithmetically correct.  **Key Strengths:**  *   **Clarity and Understandability:** The step-by-step approach makes the solution easy to follow and understand. *   **Thorough Verification:** The inclusion of verification steps minimizes the risk of errors. *   **Robustness:** Considering implicit assumptions and exploring different wordings makes the solution robust against misinterpretations. *   **Comprehensive approach:** Addressing the problem from different angles, e.g., ratios, ensures a full grasp of the problem.  **Critical Evaluation of GOT Idea:**  **GOT Idea:** '**Emile's age:** Emile will be 6 * 8 = 48 years old.'  **Weaknesses:**  *   **Incomplete:** The GOT idea only calculates Emile's age. It doesn't provide the final answer (Anne's age) or the justification for the calculation. It's a single step in the overall process but not a complete solution. *   **Lacks Context:** While the calculation is correct, it doesn't explicitly state why this calculation is necessary or how it contributes to solving the overall problem. *   **No Verification:** There's no built-in verification to confirm the calculation is correct in the context of the problem.  **Overlooked Aspects:**  *   The need to relate Emile's age to Anne's age. *   The importance of verifying the calculation and the overall solution. *   The need to state the final answer clearly.  **Why My Approach is Preferable:**  My approach is preferable because it provides a *complete and verified solution*. It doesn't just calculate Emile's age; it uses that information to calculate Anne's age and then verifies the entire process. The GOT idea is a necessary step *within* my more comprehensive approach.  **Critical Evaluation of ROT Idea:**  **ROT Idea:** 'Okay, based on the task definition and the provided input, I can calculate Anne's age.  The input is Maude's future age, which is 8.  Using the formula derived above:  Anne's future age = 12 * Maude's future age Anne's future age = 12 * 8 Anne's future age = 96  Therefore, Anne will be 96 years old.  **Answer:** 96'  **Weaknesses:**  *   **Black Box:** The ""formula derived above"" is not explicitly shown or explained. This makes it difficult to understand *why* Anne's future age is 12 times Maude's future age. It jumps to the conclusion without showing the intermediate steps. *   **Lack of Transparency:** Because the derivation of the formula is hidden, it's hard to verify the solution's correctness. *   **Missing Explanation:** It doesn't explain the reasoning behind multiplying Maude's age by 12. It's a magic number without context.  **Overlooked Aspects:**  *   The individual relationships between Anne, Emile, and Maude's ages. *   The need for a step-by-step explanation to enhance understanding. *   The importance of verification.  **Why My Approach is Preferable:**  My approach is preferable because it's *transparent and explainable*. It breaks down the problem into smaller, understandable steps, showing the reasoning behind each calculation. This makes it easier to verify the solution and understand why it's correct. The ROT idea, while arriving at the correct answer, lacks the crucial explanation and transparency that my approach provides. The 'formula derived above' is essentially an abstraction which hides the logic, making it less useful for learning and problem-solving. My layered approach provides better traceability and verifiability."
5,Critical_Analyst,"Okay, let's critically analyze the solutions provided by ROT and GOT for the age problem.  **ROT's Statement/Idea:**  *   **Core Idea:** ROT directly calculates Anne's age based on the given relationship and Maude's age. *   **Correctness:** The calculation is arithmetically correct (12 \* 8 = 96). The logic is also sound, as it directly uses the derived formula. *   **Completeness:** ROT's solution is concise but lacks detailed explanation. It doesn't explicitly show the intermediate step of calculating Emile's age. While the formula derivation might have been shown previously, its absence here makes it less self-contained. *   **Weaknesses:** The lack of explicit steps might make it slightly harder to follow for someone unfamiliar with the problem. It doesn't include verification or alternative problem representations. *   **Improvements:** Briefly mention Emile's age calculation (Emile = 6 \* Maude = 6 \* 8 = 48) before calculating Anne's age.  **GOT's Statement/Idea:**  *   **Core Idea:** GOT provides a very detailed, multi-faceted approach to solving and verifying the problem. *   **Correctness:** The calculations are arithmetically correct, and the logic is sound. *   **Completeness:** GOT's solution is extremely thorough. It includes verification steps, re-statements of the problem, consideration of assumptions, alternative wording, and a simpler example. It covers almost all possible angles. *   **Weaknesses:** The sheer volume of information can be overwhelming. Some sections, while helpful, might be redundant (e.g., multiple reiterations of the logical steps). The structured format with multiple criteria can feel a bit robotic. *   **Improvements:** While thoroughness is valuable, GOT could benefit from being slightly more concise by eliminating redundant information. The structured format is good, but the writing could be made more natural.  **GOT's Statement/Idea:**  *   **Core Idea:** GOT calculates Emile's age. *   **Correctness:** The calculation is arithmetically correct. *   **Completeness:** It only calculates Emile's age. *   **Weaknesses:** Incomplete solution. *   **Improvements:** Continue to calculate Anne's age.  **Overall Critique:**  ROT provides a correct but somewhat bare-bones solution. GOT offers a highly detailed and verified solution, almost to the point of being verbose. Both arrive at the correct answer. GOT's thoroughness is commendable, but ROT's conciseness might be preferred in some contexts. For the mission, GOT's comprehensive approach is superior, as it minimizes the risk of errors and ensures a deep understanding of the problem. However, streamlining GOT's response would make it even better.  **Specific Points of Caution:**  *   **ROT:** Be careful not to oversimplify to the point of omitting crucial steps. *   **GOT:** Avoid unnecessary redundancy. Focus on clear and concise explanations.  ### Synthesized Accurate Answer: Anne will be 96 years old."
