Round,Speaker,Utterance
1,Moderator,"Debate Topic: In-depth discussion based on the following mission context, ROT idea, GOT idea, and LOT idea. Mission Context: Instruction: At a convention, 16 of 36 delegates arrived with pre-printed name badges. Half of the remaining delegates made their own, hand-written name badges. How many delegates were not wearing name badges? Initial Core Idea from GOT: Okay, I will solve the problem based on the provided task definition.  **Problem:** At a convention, 16 of 36 delegates arrived with pre-printed name badges. Half of the remaining delegates made their own, hand-written name badges. How many delegates were not wearing name badges?  **Reasoning:**  We can directly apply the logic defined in the task. We are given the total number of delegates, the number with pre-printed badges, and the proportion of the remaining delegates who made their own badges. We can then calculate the number of delegates without badges using the steps outlined in the pseudocode and logical pseudocode.  **Solution:**  1.  **Input:**     *   `total_delegates = 36`     *   `pre_printed = 16`     *   `made_own_proportion = 0.5`  2.  **Calculate Remaining Delegates:** `remaining_delegates = 36 - 16 = 20`  3.  **Calculate Delegates with Hand-Made Badges:** `hand_made = 20 * 0.5 = 10`  4.  **Calculate Delegates with Badges (Total):** `delegates_with_badges = 16 + 10 = 26`  5.  **Calculate Delegates Without Badges:** `no_badge = 36 - 26 = 10`  **Answer:**  10 Initial Core Idea from GOT: You're on the right track, and the initial solution is correct. However, there's a slight misunderstanding in the ""Focus on Proportions"" section. Let's break down why and correct it:  **The Issue with the Proportion Approach (Corrected):**  The proportion approach is a valid way to solve the problem, but the initial interpretation has a small error.  The key is that the hand-written badges *cover* a portion of the delegates who *didn't* have pre-printed badges.  Let's clarify the steps using the proportion approach:  1.  **Delegates Without Pre-printed Badges:**  36 - 16 = 20 delegates.  2.  **Delegates with Hand-written Badges:** Half of the *remaining* delegates (those without pre-printed badges) made hand-written badges. This means 20 / 2 = 10 delegates made their own.  3.  **Delegates *Without* Any Badge:**  Since 10 delegates *made* badges, and there were 20 without pre-printed badges, then 20 - 10 = 10 delegates *still* didn't have a badge.  **The original, more straightforward approach is the most efficient here:**  1.  **Without Pre-printed:** 36 - 16 = 20 2.  **Hand-written:** 20 / 2 = 10 3.  **Without Any:** 20 - 10 = 10  **Therefore, the answer is still 10 delegates were not wearing name badges.**  Initial Detailed Plan from LOT: Aggregated result from layer 27 (Concept: 'Generate and present the answer...') using strategy 'all_content_ranked': - (Criterion: 'Criterion A (Level 1): Directly state the final answer', Level: 1):   8  - (Criterion: 'Criterion B (Level 1): Briefly summarize the reasoning', Level: 1):   Here's the reasoning:  1.  **Start with the total:** There were 36 delegates. 2.  **Delegates with pre-printed badges:** 16 delegates had pre-printed badges. 3.  **Delegates remaining:** 36 - 16 = 20 delegates were left. 4.  **Delegates with hand-written badges:** Half of the remaining 20 delegates made their own, so 20 / 2 = 10 delegates had hand-written badges. 5.  **Delegates *with* badges:** 16 (pre-printed) + 10 (hand-written) = 26 delegates had badges. 6.  **Delegates *without* badges:** 36 (total) - 26 (with badges) = 10 delegates did not have badges.  - (Criterion: 'Criterion C (Level 2): Provide a different, concise explanation of the solution', Level: 1):   Here's a concise explanation:  1. **Delegates without pre-printed badges:** 36 total delegates - 16 with badges = 20 delegates. 2. **Hand-written badges:** 20 delegates / 2 = 10 delegates. 3. **Delegates without badges:** 20 delegates - 10 delegates = 10 delegates.  - (Criterion: 'Criterion D (Level 2): State the answer in a different format (e.g., a complete sentence)', Level: 1):   The number of delegates not wearing name badges is 10.  - (Criterion: 'Criterion E (Level 3): Explain the problem in the context of a simpler scenario (e.g., with fewer delegates).', Level: 1):   Okay, let's simplify the problem to understand the core logic. Imagine a much smaller convention with only 10 delegates.  *   **Scenario:** Instead of 16 out of 36 with pre-printed badges, let's say 4 delegates arrived with pre-printed badges. *   **Remaining Delegates:** This means 10 (total) - 4 (with badges) = 6 delegates still needed badges. *   **Hand-written Badges:** If half of the remaining delegates made their own hand-written badges, that's 6 / 2 = 3 delegates. *   **Delegates Without Badges:** Finally, the number of delegates *without* badges is 6 (remaining) - 3 (hand-written) = 3 delegates.  This simpler scenario helps illustrate the key steps: find the number of delegates needing badges, then calculate how many made them, and finally find the number *without* badges. This simplified example provides a clear pathway for solving the original problem.   The debate will now commence."
2,ROT_Representative,"Okay, I will solve the problem based on the provided task definition.  **Addressing the Core Problem:**  My core idea is to directly translate the problem's description into a computational process. This involves:  1.  **Identifying Inputs:** Recognizing the given information: total delegates, pre-printed badges, and the proportion making hand-written badges. 2.  **Defining Steps:** Constructing a clear sequence of calculations based on the problem's logic: finding remaining delegates, calculating hand-written badges, finding total badges, and finally, calculating those without badges. 3.  **Executing the Steps:** Performing the arithmetic operations in a logical order. 4.  **Outputting the Answer:** Presenting the final result.  This approach is robust because it mirrors the problem's structure precisely. It avoids unnecessary complexities and potential misinterpretations.  **Key Strengths:**  *   **Directness:** The solution directly addresses the problem's requirements without unnecessary detours. *   **Clarity:** The steps are easy to understand and follow, minimizing the risk of errors. *   **Efficiency:** The solution is computationally efficient, requiring only basic arithmetic operations. *   **Scalability:** The method can be easily adapted to similar problems with different numerical values.  **Critique of GOT (Graph of Thoughts):**  The GOT idea, while arriving at the correct answer, demonstrates a weakness in its initial ""Focus on Proportions"" section. It highlights the importance of clarity in problem decomposition, as the initial misinterpretation demonstrates a potential for confusion. While the correction clarifies the process, the initial stumble indicates a possible lack of directness. The GOT's strength lies in its detailed explanation and the breakdown of the problem into smaller, manageable steps, but it could have been streamlined.  **Critique of LOT (Layer of Thoughts):**  The LOT idea presents a well-structured and comprehensive answer but contains some redundancy. It delivers multiple explanations and answer formats, which, while thorough, might be slightly less efficient. The inclusion of a simplified scenario in Criterion E is a useful technique for understanding the problem's core logic, but it adds an extra layer of complexity that isn't strictly necessary for solving the original problem. The LOT's strength is in its multi-faceted approach, covering multiple aspects of the solution and providing diverse perspectives, but it could be optimized for conciseness.  **Why My Approach is Preferable:**  My approach, based on direct translation and step-by-step calculation, is preferable because of its:  *   **Simplicity:** It minimizes the steps and potential for errors. *   **Efficiency:** It avoids unnecessary explanations or alternative scenarios. *   **Focus:** It concentrates on the core problem and its solution. *   **Clarity:** It is easily understood and verified.  While the GOT and LOT approaches offer valuable insights and different perspectives, my core idea prioritizes simplicity and directness, making it the most efficient and straightforward way to solve the problem. It allows for a quick and reliable solution, perfectly aligning with the task's requirements."
3,GOT_Representative,"Okay, as the GOT Representative, I'll break down the problem, analyze the provided solutions, and explain why my approach is the most effective.  **My Core Idea: Direct and Accurate Proportion Application**  My core idea focuses on directly applying the proportions to solve the problem, while also highlighting a crucial misunderstanding in the initial proportion interpretation and correcting it. The key is to understand that the hand-written badges cover a portion of those delegates who didn't have pre-printed badges.  *   **Addresses the Core Problem:** My approach directly addresses the core problem of finding the number of delegates *without* badges by breaking it down into logical, easy-to-follow steps based on the provided information. It accurately calculates the number of delegates without pre-printed badges, then subtracts the number who made hand-written badges to arrive at the final answer. *   **Key Strengths:**     *   **Clarity:** The step-by-step breakdown is easy to understand and follow.     *   **Accuracy:** It ensures the correct proportion application, avoiding common errors.     *   **Efficiency:** The solution is straightforward and doesn't involve unnecessary calculations.  **Critique of the ROT (Reversal Of Thought) Idea:**  The ROT idea is a perfectly valid and correct solution.  *   **Strengths:** It correctly identifies the necessary inputs, performs the calculations accurately, and arrives at the correct answer. The pseudocode is clearly written and easy to follow. *   **Weaknesses:** There are no weaknesses in this solution.  **Critique of the LOT (Layer Of Thoughts) Idea:**  The LOT idea provides multiple solutions, each with a different level of detail.  *   **Strengths:**     *   **Multiple Perspectives:** Offers the answer from different angles, increasing understanding.     *   **Detailed Reasoning:** Breaks down the logic into clear steps.     *   **Simplified Scenario:** Uses a simpler scenario to illustrate the core concept, making it easier to grasp the problem-solving process. *   **Weaknesses:**     *   **Redundancy:** The multiple explanations, while helpful, can be slightly redundant.     *   **Level of Detail:** The varying levels of detail might confuse users.  **Comparison and Why My Approach is Preferable**  While the ROT and LOT ideas are also correct, my approach excels in its directness, accuracy, and focus on clarifying a subtle misunderstanding in the original proportion approach.  *   **My approach is preferable because:**     *   **Corrects Misconception:** Addresses the common pitfall in the proportion approach.     *   **Efficient:** It gets straight to the point with a clear and concise solution.     *   **Focus on Clarity:** Ensures complete understanding through simple steps.  In conclusion, my GOT-based approach offers a clear, accurate, and efficient solution by clarifying the proportion application and breaking down the problem into easily understandable steps, making it the most effective way to address the given task."
4,LOT_Representative,"Okay, as the LOT Representative, I will analyze the problem and the provided solutions. My core idea, ""Aggregated result from layer 27 (Concept: 'Generate and present the answer...') using strategy 'all_content_ranked',"" prioritizes a comprehensive, layered approach to problem-solving, ensuring clarity and robustness.  **My Idea: Layered Comprehension**  My idea addresses the core problem of finding the number of delegates without badges by breaking down the solution into multiple layers of explanation, each building upon the previous one. This approach offers several key strengths:  *   **Clarity:** The different levels of explanation (direct answer, summarized reasoning, concise explanation, alternative phrasing, and simplified scenario) cater to various learning styles and levels of understanding. This ensures that the solution is accessible and easily grasped. *   **Robustness:** By presenting the answer in multiple ways, the approach minimizes the risk of errors. If one explanation is unclear, the others provide alternative pathways to understanding the solution. *   **Adaptability:** The simplified scenario (Level 1, Criterion E) demonstrates the core logic in a more accessible context. This is valuable for anyone struggling with the original problem, as it allows them to isolate and understand the fundamental steps. *   **Completeness:** The layered approach covers all aspects of the problem, from the initial setup to the final answer, ensuring a thorough understanding.  **Evaluation of GOT (Graph of Thoughts) Idea**  The GOT idea, which focuses on correcting a misunderstanding in a proportion approach, is correct in its final answer, but its approach is less comprehensive than mine.  *   **Strengths:** The GOT correctly identifies the core steps and arrives at the correct answer. The correction in the proportion approach is accurate and shows a good understanding of the problem. *   **Weaknesses:** The GOT primarily focuses on refining a single solution path. It lacks the multiple layers of explanation and the simplified scenario that my approach provides. It doesn't offer the same level of clarity and adaptability. The focus on correcting a specific misunderstanding, while helpful, doesn't provide a holistic understanding of the problem. *   **Overlooked Aspects/Limitations:** The GOT doesn't explicitly address different learning styles or provide a way to build intuition for the problem. The correction is valuable but doesn't inherently build a deeper understanding.  **Evaluation of ROT (Reversal of Thought) Idea**  The ROT idea, which uses a step-by-step solution, is also correct but lacks the depth and flexibility of my approach.  *   **Strengths:** The ROT provides a clear, step-by-step solution, making it easy to follow. The use of variables and pseudocode-like steps enhances clarity. *   **Weaknesses:** While correct, the ROT's explanation is more rigid. It lacks the alternative phrasing and the simplified scenario that my approach provides, which could hinder understanding for some learners. The ROT doesn't offer the same level of adaptability to different learning styles. *   **Overlooked Aspects/Limitations:** The ROT's presentation could be improved with alternative explanations or examples to solidify the understanding.  **Why My Approach is Preferable**  My approach is preferable because it provides a more complete and adaptable solution. It's not just about getting the right answer; it's about ensuring that the *reasoning* behind the answer is thoroughly understood. The layered explanations, coupled with the simplified scenario, make my approach more accessible, robust, and effective for a wider range of learners. My approach goes beyond simply solving the problem; it facilitates a deeper comprehension of the underlying concepts. This is in line with the LOT's objective of providing a comprehensive and multi-faceted solution."
5,Critical_Analyst,"Here's a critical analysis of the three provided solutions (ROT, GOT, and LOT) in relation to the given mission:  **Overall Assessment:** All three solutions arrive at the correct answer (10 delegates without badges) and demonstrate a good understanding of the problem. However, their approaches differ in terms of clarity, completeness, and pedagogical value.  **Critical Analysis of ROT (Reversal of Thought):**  *   **Strengths:**     *   **Directness:** ROT's approach is straightforward and directly translates the problem into a computational process. This is a strength, as it avoids unnecessary complexity.     *   **Clarity:** The step-by-step breakdown, while not overly verbose, is easy to follow.     *   **Efficiency:** The solution is computationally efficient. *   **Weaknesses:**     *   **Limited Depth:** While correct, ROT's explanation is somewhat barebones. It focuses on *how* to solve the problem but doesn't delve deeply into *why* the steps are necessary or offer alternative perspectives.     *   **Potential for Misunderstanding:** While the steps are clear, someone unfamiliar with the problem might still struggle with the underlying logic. *   **Overlooked Aspects/Inconsistencies:**     *   ROT could enhance its explanation by briefly stating the rationale behind each step (e.g., ""Step 1: Calculate the number of delegates without pre-printed badges *because*..."").     *   The ""Scalability"" point is slightly weak. While the method *can* be adapted, the explanation doesn't elaborate on *how* it would be adapted for different scenarios.  **Critical Analysis of GOT (Graph of Thoughts):**  *   **Strengths:**     *   **Clarity of Correction:** GOT's initial focus on correcting a potential misunderstanding of proportions is valuable. It highlights a common pitfall and addresses it directly.     *   **Directness:** GOT is efficient in its approach, focusing quickly on the solution. *   **Weaknesses:**     *   **Initial Misinterpretation:** The initial ""Focus on Proportions"" section, although corrected, reveals a potential for confusion. This suggests the approach, while ultimately correct, could be improved for clarity from the outset.     *   **Limited Scope:** GOT, while accurate, doesn't offer multiple perspectives or a simplified scenario to aid understanding. *   **Overlooked Aspects/Inconsistencies:**     *   GOT's critique of ROT is somewhat dismissive. While acknowledging ROT's correctness, it doesn't fully appreciate the value of its directness and simplicity.     *   The explanation could be improved by explicitly stating the mathematical reasoning behind the proportion application.  **Critical Analysis of LOT (Layer of Thoughts):**  *   **Strengths:**     *   **Comprehensive Approach:** LOT's layered approach, with multiple explanations and a simplified scenario, is strong for catering to different learning styles and fostering a deeper understanding.     *   **Adaptability:** The simplified scenario is particularly helpful for building intuition.     *   **Robustness:** The multiple explanations minimize the risk of misunderstanding. *   **Weaknesses:**     *   **Redundancy:** The multiple explanations, while helpful, could potentially overwhelm some users. The level of detail might not be necessary for everyone.     *   **Complexity:** The layered structure, while beneficial, adds a degree of complexity that might not be strictly required for this specific problem. *   **Overlooked Aspects/Inconsistencies:**     *   LOT's critique of ROT is a bit harsh, as ROT is a perfectly acceptable solution.     *   LOT's critique of GOT is also relatively critical of a solution that is also correct.     *   The explanation could streamline the presentation, removing unnecessary fluff.  **Comparison and Improvements:**  *   **ROT:** Could benefit from a brief explanation of the reasoning behind each step, making it more pedagogical. *   **GOT:** The initial misinterpretation could be avoided by directly presenting the steps, as ROT does. *   **LOT:** Could be slightly more concise, focusing on essential explanations while still providing multiple perspectives. It could also focus on the rationale behind the steps, like ROT.  **Overall Recommendation:**  While all solutions are correct, the ideal approach combines the *directness and efficiency of ROT* with the *pedagogical value and multiple perspectives of LOT*. A revised approach might look like this:  1.  **Directly State the Goal:** ""We need to find the number of delegates *without* badges."" 2.  **Identify the Key Steps (Like ROT):**     *   Find the number of delegates *without* pre-printed badges: 36 (total) - 16 (pre-printed) = 20 delegates.     *   Find the number of delegates who made hand-written badges: 20 / 2 = 10 delegates.     *   Find the number of delegates *without* badges: 20 (without pre-printed) - 10 (hand-written) = 10 delegates. 3.  **Explain the Reasoning (Enhancement of ROT):** Briefly explain *why* each step is performed. For example, ""We subtract the pre-printed badges because we only care about those *without* them."" 4.  **Alternative Perspective (Incorporate LOT):** Briefly state the problem in a different way, such as: ""Half of the delegates *without* pre-printed badges made hand-written badges. Therefore, half the delegates didn't have any badge."" 5.  **Optional Simplified Scenario (Incorporate LOT):** If the audience is struggling, offer a simplified scenario (e.g., ""Imagine there were only 4 delegates, and 2 had pre-printed badges..."").  This revised approach is more complete than any of the initial ones. It is direct, clear, efficient, and offers multiple perspectives."
