Round,Speaker,Utterance
1,Moderator,"Debate Topic: In-depth discussion based on the following mission context, ROT idea, GOT idea, and LOT idea. Mission Context: Instruction: Jimmy bought 3 pens for school for $1 each, 4 notebooks for $3 each and 2 folders for $5 each. If he paid with a $50 bill, how much change will he get back? Initial Core Idea from GOT: Okay, let's solve the problem using the defined framework.  **Applying the Task Definition and Pseudocode:**  We are given:  *   pens = 3 *   pen\_price = 1 *   notebooks = 4 *   notebook\_price = 3 *   folders = 2 *   folder\_price = 5 *   amount\_paid = 50  Using the pseudocode:  1.  `pen_cost = pens * pen_price = 3 * 1 = 3` 2.  `notebook_cost = notebooks * notebook_price = 4 * 3 = 12` 3.  `folder_cost = folders * folder_price = 2 * 5 = 10` 4.  `total_cost = pen_cost + notebook_cost + folder_cost = 3 + 12 + 10 = 25` 5.  `change = amount_paid - total_cost = 50 - 25 = 25`  **Answer:**  The change Jimmy will get back is $25. Initial Core Idea from GOT: Okay, that's a good refined thought process. Here's the solution based on that:  *   **Pens:** 3 pens * $1/pen = $3 *   **Notebooks:** 4 notebooks * $3/notebook = $12 *   **Folders:** 2 folders * $5/folder = $10 *   **Total Cost:** $3 + $12 + $10 = $25 *   **Change:** $50 - $25 = $25  **Answer:** Jimmy will get $25 back in change.  Initial Detailed Plan from LOT: Aggregated result from layer 3 (Concept: 'Generate and present the answer...') using strategy 'all_content_ranked': - (Criterion: 'Calculate the cost of each item type separately (pens, notebooks, folders)', Level: 1):   *   **Pens:** 3 pens * $1/pen = $3 *   **Notebooks:** 4 notebooks * $3/notebook = $12 *   **Folders:** 2 folders * $5/folder = $10  - (Criterion: 'Calculate the total cost of all items', Level: 1):   Okay, let's break down the cost of each item type:  *   **Pens:** 3 pens * $1/pen = $3 *   **Notebooks:** 4 notebooks * $3/notebook = $12 *   **Folders:** 2 folders * $5/folder = $10  Now, let's add those costs together to find the total cost:  $3 + $12 + $10 = $25  Therefore, the total cost of all the items is $25.  - (Criterion: 'Calculate the change by subtracting the total cost from the amount paid', Level: 1):   Jimmy paid with a $50 bill and the total cost of his purchases was $25. Therefore, his change will be $50 - $25 = $25.  - (Criterion: 'State the final answer with the correct unit (dollars)', Level: 1):   Jimmy will get $19 back in change.  - (Criterion: 'Double-check all calculations for accuracy', Level: 1):   Okay, let's double-check the calculations to ensure accuracy before determining the change.  *   **Pens:** 3 pens * $1/pen = $3 *   **Notebooks:** 4 notebooks * $3/notebook = $12 *   **Folders:** 2 folders * $5/folder = $10 *   **Total Cost:** $3 + $12 + $10 = $25  Now, we can calculate the change:  *   **Change:** $50 - $25 = $25  Therefore, Jimmy will get $25 in change.  - (Criterion: 'Verify that all the information from the problem statement has been correctly used', Level: 1):   Okay, before calculating the change, let's double-check we've used all the information:  *   **Pens:** 3 pens at $1 each.  Used. *   **Notebooks:** 4 notebooks at $3 each. Used. *   **Folders:** 2 folders at $5 each. Used. *   **Payment:** $50 bill. Used.  We've accounted for everything in the problem statement.  - (Criterion: 'Present the solution in a clear and understandable manner (Criterion A (Level 1))', Level: 1):   Okay, let's break down the problem step-by-step so it's easy to follow:  1. **Cost of pens:** 3 pens * $1/pen = $3 2. **Cost of notebooks:** 4 notebooks * $3/notebook = $12 3. **Cost of folders:** 2 folders * $5/folder = $10 4. **Total cost:** $3 + $12 + $10 = $25 5. **Change:** $50 - $25 = $25  **Answer:** Jimmy will get $25 in change.  - (Criterion: 'Consider alternative calculation methods for verification (e.g., adding up to $50)', Level: 1):   Okay, let's verify the total cost and change using an alternative calculation method, working our way *up* to $50 from the individual costs.  *   Pens: 3 pens * $1/pen = $3 *   Notebooks: 4 notebooks * $3/notebook = $12 *   Folders: 2 folders * $5/folder = $10 *   Total cost: $3 + $12 + $10 = $25  Now, let's see how much more is needed to reach $50:  *   $50 - $25 = $25  Therefore, Jimmy's change should be $25. This confirms the previous calculation.  - (Criterion: 'Format the final answer in dollars and cents ($XX.XX) (Criterion B (Level 1))', Level: 1):   Since the change Jimmy receives is $25.00 (as calculated in previous steps), we format this to explicitly show the cents even though they are zero. Therefore, the final answer is $25.00.  - (Criterion: 'Estimate the answer to check for reasonableness (Criterion C (Level 2))', Level: 1):   Okay, let's estimate the change Jimmy should receive. He spent approximately 3 * $1 + 4 * $3 + 2 * $5 = $3 + $12 + $10 = $25. He paid with $50, so his change should be around $50 - $25 = $25. This will help us confirm if our final calculated answer is in the right ballpark.   The debate will now commence."
2,ROT_Representative,"Okay, let's solve the problem using the defined framework. My core idea revolves around systematically applying the information given in the problem to a predefined structure. This framework ensures that all relevant details are considered and processed in a logical sequence to arrive at the correct solution. In this specific problem, the framework involves calculating the individual costs, summing them to find the total cost, and then subtracting the total cost from the amount paid to determine the change.  My approach directly addresses the problem by providing a clear, step-by-step methodology. The key strengths lie in its simplicity, clarity, and reproducibility. It is easy to understand and apply to similar problems with varying input values. By defining the framework explicitly, it reduces ambiguity and minimizes the chance of errors. The pseudocode provided exemplifies this structured approach.  Now, let's critically evaluate the GOT and LOT approaches.  **GOT (Graph of Thoughts) Evaluation:**  The GOT approach is a good, refined thought process. It accurately outlines the steps needed to solve the problem: calculating the cost of each item, finding the total cost, and then calculating the change.  *   **Strengths:** The GOT is clear, concise, and provides the correct answer. It's easy to follow the logic. *   **Weaknesses:** While correct, the GOT lacks the explicit definition of a reusable framework. It's more of a direct application of the steps rather than a template for solving similar problems. It doesn't explicitly state the general principle or the order of operations in a way that can be easily adapted. It relies on implicit understanding rather than a defined framework.  **LOT (Layer of Thoughts) Evaluation:**  The LOT approach is very detailed and comprehensive. It breaks down the problem into granular steps, including double-checking calculations, verifying information usage, considering alternative methods, formatting the answer, and estimating for reasonableness.  *   **Strengths:** LOT offers exceptional rigor and thoroughness. The extensive checks and verification steps minimize the risk of errors. The consideration of alternative methods and reasonableness checks adds further confidence in the result. *   **Weaknesses:** LOT can be overly verbose and inefficient. While thoroughness is valuable, the numerous checks and verifications might be redundant for simple problems like this one. The LOT approach also incorrectly states the answer as $19 at one point before correcting itself, demonstrating a potential for error despite the numerous checks. While the multiple checks are good, the initial mistake shows they are not foolproof. The LOT approach also loses sight of the core problem-solving strategy amidst the verifications. This makes the framework more complex than necessary.  **Comparison and Why My Approach is Preferable:**  While both GOT and LOT arrive at the correct answer, my approach using the defined framework is preferable because:  1.  **Clarity and Simplicity:** My approach emphasizes a clear, concise framework that is easy to understand and apply. It avoids the potential verbosity of LOT and the implicit understanding of GOT. 2.  **Reproducibility:** The explicit framework can be easily reused for similar problems with different input values. The GOT is more specific to this particular instance, and the LOT is too complex to be easily adapted. 3.  **Efficiency:** My approach strikes a balance between thoroughness and efficiency. It ensures that all relevant steps are followed without unnecessary redundancy, unlike the LOT. 4.  **Focus on Structure:** The emphasis on a defined framework makes it easier to identify and correct errors. By breaking down the problem into well-defined steps, it becomes easier to isolate the source of any discrepancy. 5.  **Error Mitigation:** The LOT made an error despite its exhaustive checks. My approach, by focusing on a simple framework, can be easier to debug.  In summary, while GOT provides a good solution and LOT offers extreme thoroughness, my approach using a defined framework provides a balanced combination of clarity, simplicity, reproducibility, and efficiency, making it the most preferable for solving this type of problem. The key is to establish a clear framework that can be consistently applied and easily understood, rather than getting bogged down in unnecessary complexity or relying on implicit understanding."
3,GOT_Representative,"Okay, I, GOT_Representative, will elaborate on my core idea, analyze the ROT and LOT ideas, and explain why my approach is preferable.  **My Core Idea (GOT - Graph of Thoughts):**  'Okay, that's a good refined thought process. Here's the solution based on that:  *   **Pens:** 3 pens * $1/pen = $3 *   **Notebooks:** 4 notebooks * $3/notebook = $12 *   **Folders:** 2 folders * $5/folder = $10 *   **Total Cost:** $3 + $12 + $10 = $25 *   **Change:** $50 - $25 = $25  **Answer:** Jimmy will get $25 back in change.'  This GOT idea represents a direct and efficient approach to solving the problem. It breaks down the calculation into manageable steps: calculating the cost of each item type, summing those costs to find the total, and then subtracting the total cost from the amount paid to determine the change.  **Strengths:**  *   **Clarity:** The steps are explicit and easy to follow. *   **Efficiency:** It avoids unnecessary complexities or abstractions. *   **Accuracy:** Direct calculation minimizes the risk of errors. *   **Readability:** The formatting is clean and presents the solution logically.  **How it addresses the core problem:**  The GOT idea directly addresses the problem by systematically calculating the cost of each purchase, summing them to obtain the total expenditure, and finally subtracting this value from the payment amount to determine the change. It aligns perfectly with the problem's requirements.  **Critical Evaluation of the ROT (Reversal Of Thought) Idea:**  'Okay, let's solve the problem using the defined framework.  **Applying the Task Definition and Pseudocode:**  We are given:  *   pens = 3 *   pen\_price = 1 *   notebooks = 4 *   notebook\_price = 3 *   folders = 2 *   folder\_price = 5 *   amount\_paid = 50  Using the pseudocode:  1.  `pen_cost = pens * pen_price = 3 * 1 = 3` 2.  `notebook_cost = notebooks * notebook_price = 4 * 3 = 12` 3.  `folder_cost = folders * folder_price = 2 * 5 = 10` 4.  `total_cost = pen_cost + notebook_cost + folder_cost = 3 + 12 + 10 = 25` 5.  `change = amount_paid - total_cost = 50 - 25 = 25`  **Answer:**  The change Jimmy will get back is $25.'  **Strengths of ROT:**  *   **Structured approach:** Uses defined variables and pseudocode, making the process more formalized. *   **Explicit variable assignment:** Clearly defines the input values.  **Weaknesses of ROT:**  *   **Overly formal for a simple problem:** The pseudocode and variable assignment add unnecessary complexity for this straightforward calculation. It's like using a sledgehammer to crack a nut. *   **Reduced readability:** While structured, the pseudocode can make the solution slightly less immediately understandable than the GOT approach. *   **Potential for over-engineering:** For more complex problems, this approach might be beneficial, but for this specific problem, it's overkill.  **Critical Evaluation of the LOT (Layer Of Thoughts) Idea:**  'Aggregated result from layer 3 (Concept: 'Generate and present the answer...') using strategy 'all_content_ranked': - (Criterion: 'Calculate the cost of each item type separately (pens, notebooks, folders)', Level: 1):   *   **Pens:** 3 pens * $1/pen = $3 *   **Notebooks:** 4 notebooks * $3/notebook = $12 *   **Folders:** 2 folders * $5/folder = $10  - (Criterion: 'Calculate the total cost of all items', Level: 1):   Okay, let's break down the cost of each item type:  *   **Pens:** 3 pens * $1/pen = $3 *   **Notebooks:** 4 notebooks * $3/notebook = $12 *   **Folders:** 2 folders * $5/folder = $10  Now, let's add those costs together to find the total cost:  $3 + $12 + $10 = $25  Therefore, the total cost of all the items is $25.  - (Criterion: 'Calculate the change by subtracting the total cost from the amount paid', Level: 1):   Jimmy paid with a $50 bill and the total cost of his purchases was $25. Therefore, his change will be $50 - $25 = $25.  - (Criterion: 'State the final answer with the correct unit (dollars)', Level: 1):   Jimmy will get $19 back in change.  - (Criterion: 'Double-check all calculations for accuracy', Level: 1):   Okay, let's double-check the calculations to ensure accuracy before determining the change.  *   **Pens:** 3 pens * $1/pen = $3 *   **Notebooks:** 4 notebooks * $3/notebook = $12 *   **Folders:** 2 folders * $5/folder = $10 *   **Total Cost:** $3 + $12 + $10 = $25  Now, we can calculate the change:  *   **Change:** $50 - $25 = $25  Therefore, Jimmy will get $25 in change.  - (Criterion: 'Verify that all the information from the problem statement has been correctly used', Level: 1):   Okay, before calculating the change, let's double-check we've used all the information:  *   **Pens:** 3 pens at $1 each.  Used. *   **Notebooks:** 4 notebooks at $3 each. Used. *   **Folders:** 2 folders at $5 each. Used. *   **Payment:** $50 bill. Used.  We've accounted for everything in the problem statement.  - (Criterion: 'Present the solution in a clear and understandable manner (Criterion A (Level 1))', Level: 1):   Okay, let's break down the problem step-by-step so it's easy to follow:  1. **Cost of pens:** 3 pens * $1/pen = $3 2. **Cost of notebooks:** 4 notebooks * $3/notebook = $12 3. **Cost of folders:** 2 folders * $5/folder = $10 4. **Total cost:** $3 + $12 + $10 = $25 5. **Change:** $50 - $25 = $25  **Answer:** Jimmy will get $25 in change.  - (Criterion: 'Consider alternative calculation methods for verification (e.g., adding up to $50)', Level: 1):   Okay, let's verify the total cost and change using an alternative calculation method, working our way *up* to $50 from the individual costs.  *   Pens: 3 pens * $1/pen = $3 *   Notebooks: 4 notebooks * $3/notebook = $12 *   Folders: 2 folders * $5/folder = $10 *   Total cost: $3 + $12 + $10 = $25  Now, let's see how much more is needed to reach $50:  *   $50 - $25 = $25  Therefore, Jimmy's change should be $25. This confirms the previous calculation.  - (Criterion: 'Format the final answer in dollars and cents ($XX.XX) (Criterion B (Level 1))', Level: 1):   Since the change Jimmy receives is $25.00 (as calculated in previous steps), we format this to explicitly show the cents even though they are zero. Therefore, the final answer is $25.00.  - (Criterion: 'Estimate the answer to check for reasonableness (Criterion C (Level 2))', Level: 1):   Okay, let's estimate the change Jimmy should receive. He spent approximately 3 * $1 + 4 * $3 + 2 * $5 = $3 + $12 + $10 = $25. He paid with $50, so his change should be around $50 - $25 = $25. This will help us confirm if our final calculated answer is in the right ballpark.  '  **Strengths of LOT:**  *   **Very thorough:** The LOT idea is exceptionally detailed, breaking down the problem into numerous criteria and verification steps. *   **Multiple checks:** Includes double-checking calculations, verifying information usage, and estimating the answer for reasonableness. *   **Focus on clarity:** Explicitly aims to present the solution in an understandable manner.  **Weaknesses of LOT:**  *   **Excessive verbosity:** The extreme level of detail creates a very lengthy and somewhat repetitive solution. This makes it harder to quickly grasp the core logic. *   **Overkill for the problem:** The complexity is significantly disproportionate to the problem's difficulty. *   **Reduced efficiency:** The multiple checks and alternative calculations, while valuable in some contexts, add unnecessary time and effort in this case. *   **Inconsistent Answer:** The initial answer stated is ""$19"", which is incorrect, before being corrected later. This shows that even with the thoroughness, errors can still occur, and the verbose nature can make them harder to spot initially.  **Why My Approach (GOT) is Preferable:**  The GOT approach provides the optimal balance between clarity, efficiency, and accuracy for this specific problem. It avoids the unnecessary overhead of the ROT and the extreme verbosity of the LOT. While the ROT and LOT have their merits in more complex situations, the GOT provides a direct, easily understandable, and accurate solution for this straightforward calculation. The GOT's conciseness makes it easier to quickly understand the solution and verify its correctness. It efficiently answers the question without adding unnecessary steps."
4,LOT_Representative,"Okay, as the LOT Representative, let's break down the core idea and compare it to the GOT and ROT provided.  **Core Idea Explanation:**  The core idea revolves around a structured, multi-faceted approach to solving the problem. It's not just about calculating the answer; it's about ensuring accuracy, clarity, and robustness through a series of checks and balances. The strategy 'all_content_ranked' is implemented by applying multiple criteria, each ranked by relevance and importance, to guarantee a well-vetted solution. Each criterion functions as a specific lens through which the problem is examined, addressing different facets of accuracy, clarity, and completeness. Here's a breakdown of how it addresses the core problem and its strengths:  *   **Addresses the Core Problem:** The primary objective is to calculate the correct change Jimmy receives. This is directly addressed by calculating individual costs, summing them to find the total cost, and then subtracting that total from the amount paid. *   **Key Strengths:**     *   **Comprehensive Verification:** The approach emphasizes double-checking calculations, ensuring all information is used, and even considering alternative calculation methods. This significantly reduces the risk of errors.     *   **Clarity and Understandability:** The solution is presented step-by-step, making it easy to follow and understand the logic behind each calculation.     *   **Robustness:** By considering alternative calculation methods and estimating the answer, the approach ensures the final answer is reasonable and reliable.     *   **Attention to Detail:** The approach focuses on formatting the final answer correctly (dollars and cents) and verifying the use of all information provided in the problem statement.  **Critical Evaluation of GOT (Graph Of Thoughts):**  The GOT presents a correct and concise solution. However, it lacks the depth and rigor of the LOT approach.  *   **Potential Weaknesses:**     *   **Limited Error Detection:** The GOT offers no explicit mechanism for double-checking calculations or verifying the use of all information. This increases the risk of errors going unnoticed.     *   **Lack of Clarity:** While the steps are presented logically, there's no explanation or reasoning behind each calculation. This can make it difficult for someone unfamiliar with the problem to follow the solution.     *   **No Robustness Checks:** There are no attempts to estimate the answer or use alternative calculation methods to verify the result.     *   **Missed Details:** It doesn't explicitly address formatting or verification of information usage. *   **Overlooked Aspects:**     *   The GOT overlooks the importance of explicitly verifying each step and ensuring all information from the problem statement has been used correctly. *   **Limitations:**     *   The GOT is simply a direct calculation without any error-checking or robustness measures. It's suitable for simple problems but less reliable for more complex scenarios.  **Critical Evaluation of ROT (Reversal Of Thought):**  The ROT uses a pseudocode approach, which can be helpful for structuring the solution.  *   **Potential Weaknesses:**     *   **Overly Formal for Simple Problems:** Using pseudocode for this simple problem adds unnecessary complexity.     *   **Limited Explanation:** While pseudocode represents the steps, it doesn't explain the *why* behind each step.     *   **Similar Error Detection Limitations as GOT:** Like the GOT, the ROT lacks explicit error-checking or verification mechanisms beyond the calculations themselves.     *   **Missed Opportunities for Clarity:** While structured, it doesn't emphasize clear presentation or consider alternative calculation methods for verification. *   **Overlooked Aspects:**     *   The ROT overlooks the importance of presenting the solution in a clear and understandable manner for a general audience. *   **Limitations:**     *   While structured, the ROT is still primarily focused on calculation without addressing the broader aspects of solution verification and presentation.  **Why the LOT Approach is Preferable:**  The LOT approach is preferable because it prioritizes accuracy, clarity, and robustness. While the GOT and ROT provide correct answers, they lack the comprehensive verification and explanation that the LOT approach provides.  *   **Superior Error Handling:** The LOT's multi-faceted verification process significantly reduces the risk of errors. *   **Enhanced Understandability:** The step-by-step explanation and reasoning behind each calculation make the solution easier to follow. *   **Increased Confidence:** The use of alternative calculation methods and estimation techniques builds confidence in the final answer. *   **Complete Solution:** The LOT addresses all aspects of the problem, including formatting and information verification.  In summary, while the GOT and ROT provide correct and concise solutions, the LOT approach provides a more robust, reliable, and understandable solution by emphasizing verification, clarity, and attention to detail. The LOT is designed to not only arrive at the correct answer but also to ensure the answer is correct and that the solution is easily understood and trusted."
