Round,Speaker,Utterance
1,Moderator,"Debate Topic: In-depth discussion based on the mission context and ideas from ROT and GOT. Mission Context (partial): Instruction: What external strategies do elites employ?  Context: The following are multiple choice options:[An increasingly popular means of bolstering regime security has been the expulsion of foreign workers and non-ethnic nationals and restricting borders to refugees and migrants., Weak states seek to avoid alliances with powerful states because alliances and assistance frequently are conditional on democratization and risk penalties if they are not met., An increasingly prevalent strategy among weak states has been the employment of private military or security companies and foreign mercenaries as force multipliers to secure the weak state from internal threats., Weak states may sometimes militarily engage in action to bolster their regional position and to mobilize internal support against the construction of an imagined external threat. This frequently coincides with economic or social crises as a policy of distraction.]... Initial Core Idea from ROT (partial): Okay, here's a complete response addressing the prompt, including reasoning, context, and a clear answer:  **Reasoning and Context:**  Elites in weak states often face significant challenges to their power and stability. These challenges can stem from internal factors like economic mismanagement, corruption, ethnic divisions, and lack of legitimacy. However, elites often strategically employ external strategies to deflect attention from these internal problems, garner support, and consolidate their control. These strategies can range from scapegoating foreign actors to actively engaging in external conflicts. The effectiveness of these strategies varies depending on the specific context, the resources available to the elites, and the reactions of both domestic and international actors.  **Answer:**  Elites in weak states employ a variety of external strategies to maintain power and stability. These strategies often function to externalize internal problems or leverage external resources to consolidate power. Here's an analysis of some common strategies:  *   **Expulsion of Foreign Nationals:** This strategy involves expelling foreign nationals, often targeting specific ethnic or economic groups. This can serve to externalize internal problems by blaming foreigners for economic woes, social unrest, or political instability. For example, the expulsion of white farmers in Zimbabwe under Mugabe was used to deflect blame from the government's economic mismanagement and land redistribution policies. By scapegoating foreigners, elites can rally nationalist sentiment and consolidate their support base.  *   **Employing Private Military Companies (PMCs):** Weak states often lack the capacity or legitimacy to effectively suppress internal dissent or combat armed groups. Employing PMCs allows elites to leverage external resources (expertise, manpower, equipment) to maintain control. This can be particularly useful in situations where the military is unreliable or divided. However, reliance on PMCs can also undermine sovereignty and create dependence on external actors, potentially weakening the state in the long run. Examples include various African nations employing PMCs to combat insurgencies.  *   **Avoiding Alliances:** While seemingly counterintuitive, avoiding formal alliances can be a strategy for maintaining power in weak states. By remaining non-aligned, elites can avoid being drawn into conflicts that could destabilize their regime. They can also maintain flexibility in their relationships with external actors, allowing them to leverage support from multiple sources without being beholden to any single power. This strategy is often employed by states seeking to maintain neutrality in regional conflicts.  *   **Military Engagement Against Perceived External Threats:** Engaging in military conflict, even on a limited scale, can be a powerful tool for consolidating power. By portraying an external threat, elites can rally national unity, suppress dissent, and justify authoritarian measures. This strategy can also be used to divert attention from internal problems and create a sense of crisis that allows elites to maintain control. North Korea's periodic military provocations and nuclear brinkmanship serve as a prime example of this strategy. They extract concessions, rally support, and deflect from internal issues.  In summary, elites in weak states strategically utilize external strategies to manipulate the internal political landscape. By externalizing blame, leveraging external resources, or creating external threats, they aim to consolidate their power and maintain stability, often at the expense of long-term state building and democratic development.... Initial Core Idea from GOT (partial): Okay, here's a refinement of the thought regarding transnational elite networks and illicit finance as an external strategy for maintaining power in weak states, focusing on clarity, detail, and actionability:  **3. Cultivating Transnational Elite Networks and Exploiting Illicit Financial Flows to Consolidate Power:**  *   **Advancement (Refined):** This strategy centers on the *intentional* construction and leveraging of cross-border networks by elites in weak states to secure their positions and wealth, often at the expense of the state and its citizens. These networks are not merely accidental outcomes of globalization; they are actively fostered and maintained through a complex web of relationships involving foreign actors, financial institutions, and legal loopholes.  Crucially, this strategy acknowledges the *active agency* of elites in exploiting the international financial system, not just passively benefiting from it. *   **Function (Refined & Expanded):** This strategy functions through a multi-pronged approach:      *   **Asset Shielding and Wealth Accumulation:** Elites use offshore accounts, shell corporations, and opaque legal structures (e.g., trusts in tax havens) to shield their personal wealth from domestic risks like political instability, economic downturns, nationalization, or legal challenges. This involves systematically transferring state resources, often acquired through corruption, rent-seeking, or illicit resource extraction, into foreign jurisdictions.  *Example: A leader granting exclusive mining rights to a company in exchange for a percentage of profits deposited into a secret Swiss bank account.*     *   **Patronage Network Funding and Political Control:** Illicit financial flows provide a readily available source of funds to maintain patronage networks and buy political loyalty. This allows elites to circumvent formal budgetary processes and accountability mechanisms, creating a parallel system of resource allocation that strengthens their personal power base. *Example: Using offshore funds to finance election campaigns, bribe political opponents, or reward loyal supporters with lucrative contracts.*     *   **Leveraging Foreign Influence and Protection:** Significant investments in foreign countries, particularly in strategic sectors or through donations to political campaigns, can provide elites with leverage to influence the policies of their patron states. This can involve seeking diplomatic protection, lobbying against sanctions, or securing favorable trade agreements. *Example: Investing heavily in real estate in a powerful foreign nation and then leveraging those investments to secure political support against international pressure for democratic reforms.*     *   **Evasion of Domestic Regulations and Taxation:** By utilizing offshore accounts and shell corporations, elites can avoid domestic taxes and regulations, further enriching themselves at the expense of the state. This undermines state capacity and reduces the resources available for public services, contributing to social unrest and instability. *Example: Using transfer pricing manipulations to shift profits offshore and avoid paying corporate taxes in the home country.*     *   **Undermining Institutional Capacity and Legitimizing Corruption:** The systematic siphoning of state resources into personal accounts weakens state institutions, reduces public trust, and creates a self-perpetuating cycle of corruption. This erosion of institutional capacity makes it even harder for the state to effectively regulate illicit financial flows and hold elites accountable. *Example: Deliberately underfunding anti-corruption agencies and appointing loyalists to key positions in the financial sector to facilitate illicit financial activities.*  *   **Analysis Focus (Refined & Actionable):**  This requires a multi-faceted approach:      *   **Mapping the Networks:** Identify the key actors involved in these transnational elite networks, including:         *   **Elites:** Political leaders, government officials, business tycoons, and their families.         *   **Facilitators:** Foreign banks, law firms, accounting firms, real estate agents, and shell corporation providers.         *   **Jurisdictions:** Tax havens, financial centers, and countries with weak regulatory frameworks.     *   **Tracing the Flows:**  Investigate the mechanisms and routes through which illicit funds are transferred, using tools like:         *   **Financial intelligence analysis:** Examining transaction records, beneficial ownership information, and other financial data.         *   **Network analysis:** Mapping the relationships between individuals and entities involved in illicit financial flows.         *   **Open-source intelligence (OSINT):** Utilizing publicly available information, such as corporate registries and real estate records.     *   **Assessing the Impact:**  Analyze the consequences of these networks on:         *   **State capacity:** Measuring the impact on revenue collection, public service delivery, and institutional effectiveness.         *   **Inequality:** Assessing the extent to which illicit financial flows exacerbate income inequality and social stratification.         *   **Political stability:** Evaluating the impact on political legitimacy, social unrest, and the risk of conflict.         *   **Governance:** Examining the impact on corruption, transparency, and accountability.     *   **Actionable Research Questions:**         *   What specific legal and regulatory loopholes are exploited by elites to facilitate illicit financial flows?         *   How do international financial institutions (e.g., the World Bank, the IMF) contribute to or hinder these flows?         *   What are the most effective strategies for detecting, preventing, and recovering illicitly acquired assets held abroad?         *   How can civil society organizations and investigative journalists play a role in exposing these networks and holding elites accountable?         *   What are the political and economic conditions that enable the emergence and persistence of these transnational elite networks?     *   **Data Sources:**  Utilize resources such as:         *   The Panama Papers, the Paradise Papers, and other leaks of confidential financial information.         *   Reports from international organizations like the Financial Action Task Force (FATF) and the United Nations Office on Drugs and Crime (UNODC).         *   Country-specific data on corruption, governance, and financial flows.  This refined thought provides a more nuanced and actionable framework for analyzing the role of transnational elite networks and illicit financial flows in maintaining power in weak states. It emphasizes the agency of elites, the complexity of the networks, and the need for a multi-faceted analytical approach that combines qualitative and quantitative data. It also suggests concrete research questions and data sources that can be used to further investigate this phenomenon. ... The debate will now commence focusing on these ideas."
2,ROT_Representative,"Okay, here's my response as the ROT Representative, elaborating on my core idea and critically evaluating the GOT idea:  **1. Elaboration on ROT Idea and its Strengths:**  My core idea addresses the prompt – ""What external strategies do elites employ?"" – by providing a comprehensive overview of several key strategies used by elites in weak states to maintain power. It directly tackles the core problem by:  *   **Identifying multiple distinct strategies:** It goes beyond a single strategy and presents a range of options, including expulsion of foreign nationals, employing PMCs, avoiding alliances, and military engagement. This breadth is crucial because elites rarely rely on a single approach. *   **Explaining the function of each strategy:** It details how each strategy works to externalize internal problems, leverage external resources, or create diversions. This ""how"" is essential for understanding the logic behind these actions. *   **Providing concrete examples:** The use of examples like Zimbabwe and North Korea grounds the strategies in real-world scenarios, making them more understandable and relatable. *   **Highlighting both intended and unintended consequences:** The analysis of PMCs, for example, acknowledges the short-term benefits but also the potential long-term risks to sovereignty. *   **Contextualizing within the broader challenges faced by weak states:** The initial reasoning clearly links these external strategies to internal problems like economic mismanagement and lack of legitimacy. This establishes the ""why"" – the underlying motivations driving elite behavior.  **Key Strengths:**  *   **Broad Applicability:** The strategies identified are relevant across a wide range of weak states, regardless of their specific geopolitical context. *   **Accessibility:** The explanation is straightforward and avoids overly technical jargon, making it accessible to a broad audience. *   **Practical Relevance:** The strategies are observable in the real world, making the analysis practically relevant for understanding current events. *   **Addresses the multiple-choice options directly:** The strategies outlined clearly align with the provided multiple-choice options, demonstrating a strong connection to the given context.  **2. Critical Evaluation of the GOT Idea and Comparison to ROT:**  The GOT idea, focusing on transnational elite networks and illicit finance, is undoubtedly valuable and insightful. It offers a deep dive into a specific and increasingly important external strategy. However, it also has potential weaknesses and overlooked aspects compared to my ROT idea:  *   **Scope Limitation:** The GOT idea focuses *exclusively* on illicit finance and transnational networks. While this is a critical strategy, it doesn't capture the full range of external strategies that elites employ. My ROT idea, by encompassing a wider array of strategies (expulsion, PMCs, alliances, military action), provides a more *holistic* picture. Elites often use *multiple* strategies in conjunction, and the GOT idea, in isolation, might miss these interactions. For instance, illicit finance might be used to fund the employment of PMCs, or to influence foreign governments to turn a blind eye to human rights abuses during the expulsion of foreign nationals. *   **Complexity and Accessibility:** While the GOT idea is refined and actionable, its complexity might make it less accessible to a general audience or someone new to the topic. The detailed mapping, tracing, and assessment frameworks require specialized knowledge of finance, law, and international relations. My ROT idea is more easily understood by a broader audience. *   **Overlooked Aspects in GOT Idea:**     *   **Geopolitical Context:** The GOT idea is less sensitive to the specific geopolitical context of the weak state. My ROT idea's inclusion of strategies like ""avoiding alliances"" and ""military engagement"" explicitly considers the state's position in the international system. Illicit finance operates in a globalized context, but the political strategies for maintaining power are still strongly influenced by regional dynamics.     *   **Legitimacy and Ideology:** The GOT idea primarily focuses on the *material* aspects of power (wealth accumulation). However, elites also maintain power through *ideological* means. Expulsion of foreign nationals, for example, can be justified through nationalist or religious rhetoric, which bolsters the regime's legitimacy. My ROT idea implicitly acknowledges this by highlighting how these strategies are used to ""rally nationalist sentiment."" *   **Potential Weaknesses in GOT Idea:**     *   **Data Availability and Verification:** Tracing illicit financial flows is notoriously difficult due to the opacity of offshore accounts and shell corporations. The reliance on leaks like the Panama Papers is valuable but creates a dependence on sporadic and potentially biased information. This can make it difficult to systematically analyze these networks across different countries and over time.     *   **Causality:** While the GOT idea highlights the *correlation* between illicit finance and state weakness, establishing *causality* is challenging. Does illicit finance *cause* state weakness, or does it simply *exacerbate* pre-existing problems? My ROT idea, by considering a wider range of strategies, allows for a more nuanced understanding of the complex interplay of factors that contribute to state fragility.  **Why ROT Idea is Preferable (In This Context):**  In the context of a broad introductory question about external strategies, my ROT idea is preferable because:  *   **It provides a more comprehensive overview:** It covers a wider range of strategies, offering a more complete picture of how elites maintain power. *   **It's more accessible:** Its straightforward explanation makes it easier to understand for a wider audience. *   **It's more contextually sensitive:** It considers the geopolitical and ideological dimensions of power, which are often overlooked in purely financial analyses.  However, it's important to acknowledge that the GOT idea provides a much more in-depth analysis of a *specific* and increasingly important strategy. Ideally, a complete understanding would integrate both approaches, recognizing that elites often employ a combination of strategies to maintain their power."
