Round,Speaker,Utterance
1,Moderator,"Debate Topic: In-depth discussion based on the mission context and ideas from ROT and GOT. Mission Context (partial): Instruction: Which of the following statements best describes the characteristics of a weak state?  Context: The following are multiple choice options:[The most important characteristics of weak states are their frequent inability to establish and maintain a monopoly of control over the instruments of violence. Even within states with well developed coercive power they do not always retain absolute loyalty and are faced with a real possibility of military intervention. Whilst armed forces are ill-equipped, poorly managed and prone to factional divisions, social actors are powerful enough to resist governance. Therefore, monopoly over the instruments of violence is infrequent., Weak states possess high levels of social-political cohesion which is correlated to the hegemonic enforcement idea of the regime, which in turn becomes accepted to the point of being legitimized as the social norm., Weak states have a monopoly on the instruments of violence and have the coercive capability to force compliance even when social actors attempt to resist. The regimes lack popular legitimacy, the integrity of the regime's survival is consolidated by power resulting in the naturalization of violence within society., Weak states do not utilize coercive capabilities in normal policy. State institutions typically have a developed bureaucracy which legitimizes the regime's ability to rule. Paradoxically, however, the more a weak state exercises its coercive power the more it reinforces its infrastructural power but reduces its ability to rule.]... Initial Core Idea from ROT (partial): The most important characteristics of weak states are their frequent inability to establish and maintain a monopoly of control over the instruments of violence. Even within states with well developed coercive power they do not always retain absolute loyalty and are faced with a real possibility of military intervention. Whilst armed forces are ill-equipped, poorly managed and prone to factional divisions, social actors are powerful enough to resist governance. Therefore, monopoly over the instruments of violence is infrequent.... Initial Core Idea from GOT (partial): Based on the provided context and analysis, the statement that best describes the characteristics of a weak state is:  **""The most important characteristics of weak states are their frequent inability to establish and maintain a monopoly of control over the instruments of violence. Even within states with well developed coercive power they do not always retain absolute loyalty and are faced with a real possibility of military intervention. Whilst armed forces are ill-equipped, poorly managed and prone to factional divisions, social actors are powerful enough to resist governance. Therefore, monopoly over the instruments of violence is infrequent.""**  **Why this is the best answer:**  *   **Monopoly of Violence:** This statement directly addresses the core concept of state weakness - the inability to maintain a monopoly on the legitimate use of force. This is considered a defining characteristic of a functioning state. *   **Internal Challenges:** It highlights the internal challenges that contribute to this weakness, such as disloyal armed forces, the threat of military intervention, and powerful social actors who can resist the state. *   **Specific Examples:** It gives concrete examples of these challenges, such as ill-equipped and poorly managed armed forces prone to factionalism. *   **Comprehensive:** It encompasses several facets of weakness, including both the state's capacity (or lack thereof) and the challenges it faces from non-state actors.  The other options are incorrect because they describe characteristics contradictory to the definition of a weak state. ... The debate will now commence focusing on these ideas."
2,ROT_Representative,"Okay, here's my response as the ROT_Representative, elaborating on my core idea and critically evaluating the GOT idea:  **1. Elaboration on the ROT Idea and its Strengths**  My core idea, ""The most important characteristics of weak states are their frequent inability to establish and maintain a monopoly of control over the instruments of violence. Even within states with well developed coercive power they do not always retain absolute loyalty and are faced with a real possibility of military intervention. Whilst armed forces are ill-equipped, poorly managed and prone to factional divisions, social actors are powerful enough to resist governance. Therefore, monopoly over the instruments of violence is infrequent,"" directly addresses the core problem of defining a weak state by focusing on the *fundamental* attribute that differentiates a strong state from a weak one: the monopoly of violence.  *   **Addresses the Core Problem:** The inability to maintain a monopoly of violence is not just *a* symptom of a weak state, it's arguably *the* defining characteristic. Without this monopoly, the state cannot effectively enforce laws, protect its citizens, or maintain order. Other issues like corruption, lack of legitimacy, or economic instability are often consequences or contributing factors *to* this central failure.  *   **Key Strengths:**     *   **Parsimony:** It focuses on the most critical element. While other factors contribute to state weakness, the inability to control violence is the most direct and impactful.     *   **Explanatory Power:** It explains why weak states struggle with other issues. Lack of control over violence undermines economic development (due to insecurity), erodes legitimacy (as the state fails to provide basic security), and exacerbates corruption (as non-state actors can operate with impunity).     *   **Practical Relevance:** This understanding is crucial for designing effective interventions. Strategies to strengthen weak states must prioritize security sector reform, building effective law enforcement, and addressing the root causes of armed conflict.     *   **Internal Nuance:** It acknowledges that even states with developed coercive power can still be weak if they lack the loyalty of their forces or face credible threats of military intervention. This captures the reality of many fragile states. It also highlights the importance of internal divisions.     *   **Acknowledges Social Actor Power:** The idea recognizes that social actors can be powerful enough to resist governance.  **2. Critical Evaluation of the GOT Idea**  The GOT idea essentially reiterates my core idea, which is a good starting point. However, while it correctly identifies the importance of the monopoly of violence, its justification could be strengthened by addressing potential limitations and overlooked aspects.  *   **Potential Weaknesses/Overlooked Aspects (of the GOT justification, not the core idea itself, which is largely correct):**     *   **Oversimplification:** While the GOT justification correctly points out the importance of the monopoly of violence, it could be argued that it simplifies the issue too much. It doesn't adequately address the *causes* of the inability to maintain this monopoly. Factors like ethnic divisions, resource scarcity, historical grievances, and the influence of external actors can all play a significant role. Simply stating the problem exists doesn't provide a complete picture.     *   **Lack of Dynamic Perspective:** The GOT justification presents a static view. State weakness is often a dynamic process, influenced by internal and external shocks. A state might have a functioning monopoly of violence at one point but lose it due to a sudden crisis (e.g., a natural disaster, economic collapse, or external intervention). The GOT justification doesn't fully capture this dynamic element.     *   **Insufficient Attention to Legitimacy:** While the GOT justification mentions that the other options are incorrect because they describe characteristics contradictory to the definition of a weak state, it doesn't go into depth about the crucial role of legitimacy. A state can *appear* to have a monopoly of violence through coercion, but if it lacks legitimacy, this control is likely to be unstable and unsustainable. The GOT justification could benefit from explicitly linking the monopoly of violence to the state's legitimacy and popular support.     *   **Limited Discussion of Alternative Perspectives:** The GOT justification dismisses the other options as simply ""incorrect."" However, a more nuanced approach would acknowledge that some of those options might represent *symptoms* or *contributing factors* to state weakness, even if they aren't the defining characteristic. For example, a weak state might exhibit bureaucratic inefficiencies or struggle to implement policies effectively. Acknowledging these complexities would strengthen the argument.  *   **Why the ROT Approach Might Be Preferable:**  My approach, as represented by the core idea, is preferable because it provides a more comprehensive and nuanced understanding of state weakness. While the GOT idea correctly identifies the central problem, my approach implicitly encourages a deeper analysis of the *causes,* *dynamics,* and *consequences* of the inability to maintain a monopoly of violence. It promotes a more holistic perspective that considers the interplay of political, economic, and social factors. By emphasizing the fundamental importance of the monopoly of violence while acknowledging the complexity of the issue, my approach offers a more robust foundation for understanding and addressing state weakness. Specifically, it provides a better framework for thinking about *how* to strengthen weak states by focusing on the underlying conditions that undermine their ability to control violence and foster legitimacy."
3,GOT_Representative,"Okay, here's my response as the GOT_Representative, elaborating on my core idea and critically evaluating the ROT idea:  **1. Elaboration on the GOT Idea and its Strengths**  My core idea, which states that ""The most important characteristics of weak states are their frequent inability to establish and maintain a monopoly of control over the instruments of violence…,"" directly and effectively addresses the core problem of defining a weak state. The strength of my statement lies in its comprehensive approach to this central issue.  *   **Addresses the Core Problem Comprehensively:** While ROT correctly identifies the monopoly of violence as crucial, my statement goes further by detailing the *internal* factors that contribute to the *inability* to maintain that monopoly. It doesn't just state the problem; it highlights the specific challenges weak states face, such as:      *   **Disloyal Armed Forces:** Acknowledges that even states with coercive power can be undermined by internal disloyalty.     *   **Threat of Military Intervention:** Recognizes the vulnerability to internal or external actors willing to use force against the state.     *   **Powerful Social Actors:** Highlights the role of non-state actors in challenging state authority.     *   **Specific Examples:** Provides concrete examples like ill-equipped and poorly managed armed forces prone to factionalism.  *   **Key Strengths:**      *   **Specificity:** My statement is more specific than simply stating a lack of monopoly of violence. It paints a clearer picture of *how* this weakness manifests.     *   **Multifaceted:** It acknowledges the interplay between state capacity (or lack thereof) and the challenges posed by non-state actors, providing a more balanced perspective.     *   **Directly Relevant to the Context:** My statement is directly derived from one of the provided multiple-choice options, ensuring its relevance to the specific question being asked. It's not an abstract concept but a concrete statement offered as a potential answer.     *   **Actionable Insights:** By highlighting specific challenges, it implicitly suggests areas where interventions can be targeted (e.g., security sector reform, strengthening governance).  **2. Critical Evaluation of the ROT Idea**  While the ROT idea mirrors my core concept, its elaboration and justification, as presented, have potential weaknesses and overlooked aspects compared to my GOT idea.  *   **Potential Weaknesses/Overlooked Aspects (of the ROT elaboration):**      *   **Overemphasis on the ""Fundamental"" Attribute:** The ROT justification argues that the monopoly of violence is *the* defining characteristic, potentially downplaying the importance of other factors that contribute to state weakness. My GOT idea, while agreeing on its importance, presents a more holistic view by acknowledging the various internal challenges and facets of weakness.     *   **Abstraction from the Provided Options:** The ROT explanation, while insightful, ventures into a more abstract discussion of the causes, dynamics, and consequences of state weakness. My GOT idea remains firmly grounded in the provided multiple-choice options. This adherence to the context is crucial because the task explicitly asks which *statement* best describes a weak state.     *   **Insufficient Focus on Legitimacy (ironically):** While ROT criticizes my initial justification for not going into depth about legitimacy, its own focus remains primarily on the coercive aspects of state power. My GOT idea, through its inclusion of ""disloyal armed forces"" and ""powerful social actors,"" implicitly addresses the issue of legitimacy by highlighting the lack of internal support and the presence of competing power centers.     *   **Risk of Being Too Broad:** ROT's call for a ""deeper analysis of the causes, dynamics, and consequences"" of the inability to maintain a monopoly of violence, while valuable in a broader academic context, risks overcomplicating the task at hand. The mission requires identifying the *best* statement, not conducting an exhaustive analysis.  *   **Why the GOT Approach Might Be Preferable:**  My GOT approach is preferable because it provides a more direct, specific, and contextually relevant answer to the question. While the ROT idea offers a valuable theoretical framework, my GOT idea provides a concrete statement that encapsulates the core characteristics of a weak state while also hinting at the underlying challenges. It strikes a better balance between theoretical understanding and practical applicability within the constraints of the task. By remaining closely aligned with the provided options, my GOT approach ensures that the answer is not only accurate but also directly responsive to the specific question being asked. Furthermore, the GOT approach is more actionable in the immediate context of selecting the best answer from a list of options."
4,Critical_Analyst,"Okay, here's my critical analysis of the ROT and GOT ideas, focusing on their strengths, weaknesses, overlooked aspects, and inconsistencies, relative to the mission of identifying the best statement describing the characteristics of a weak state from the provided options.  **Critical Analysis:**  Both ROT and GOT correctly identify the statement focusing on the ""inability to establish and maintain a monopoly of control over the instruments of violence"" as the most accurate description of a weak state. This alignment is a strong starting point. However, their justifications and elaborations differ in nuance and emphasis, warranting further examination.  **ROT Analysis:**  *   **Strengths:** ROT provides a robust theoretical justification for prioritizing the monopoly of violence. It emphasizes the parsimony and explanatory power of this concept, arguing that it's not just a symptom but *the* defining characteristic of state weakness. ROT also correctly points out that this understanding is crucial for designing effective interventions. The recognition of internal nuance, acknowledging that even states with coercive power can be weak, is a valuable point. Furthermore, ROT's acknowledgement of social actor power adds another layer of depth. *   **Weaknesses:** ROT's critique of GOT, while valid in some respects, veers towards abstraction and potentially overcomplicates the task. Its call for a deeper analysis of the *causes* and *dynamics* of state weakness, while academically sound, moves away from the immediate goal of selecting the *best statement* from the given options. ROT's argument that GOT oversimplifies the issue could be turned back on itself; ROT risks overcomplicating a selection task. Also, while ROT criticizes GOT for insufficient attention to legitimacy, it doesn't fully elaborate on how the monopoly of violence relates to legitimacy in its own explanation. *   **Overlooked Aspects:** ROT could have more explicitly linked the inability to maintain a monopoly of violence to other aspects of state weakness mentioned in the incorrect multiple-choice options, such as bureaucratic inefficiencies or lack of social cohesion. Acknowledging these as potential consequences or contributing factors would strengthen the argument that the monopoly of violence is the *most* important characteristic. *   **Inconsistencies:** None apparent. *   **Improvements:** ROT could benefit from grounding its arguments more firmly in the provided multiple-choice options, explicitly demonstrating why the chosen statement is superior to the others.  **GOT Analysis:**  *   **Strengths:** GOT's strength lies in its directness and adherence to the mission. It focuses on explaining why the selected statement is the *best* description of a weak state within the *specific context* of the provided options. GOT rightly emphasizes the statement's specificity and multifaceted nature, highlighting the internal factors that contribute to the inability to maintain a monopoly of violence. The focus on *internal* factors is a key differentiator. *   **Weaknesses:** GOT's critique of ROT, while valid in its concern about abstraction, might underestimate the value of theoretical grounding. While staying close to the provided options is important, a deeper understanding of the underlying concepts can help to justify the selection. GOT also claims that its statement directly addresses the core problem *comprehensively*, which is debatable. While it details internal factors, it doesn't fully explore external influences or the broader systemic issues that contribute to state weakness. *   **Overlooked Aspects:** GOT could have more explicitly addressed the role of external actors in undermining the monopoly of violence. For example, the statement doesn't account for the influence of transnational criminal organizations or external state support for rebel groups. *   **Inconsistencies:** None apparent. *   **Improvements:** GOT could strengthen its argument by acknowledging the limitations of the selected statement and recognizing that other factors contribute to state weakness, even if they are not as central as the monopoly of violence.  **Overall Critique:**  Both ROT and GOT provide valuable perspectives. ROT offers a more theoretically grounded argument, emphasizing the fundamental importance of the monopoly of violence. GOT provides a more contextually relevant justification, focusing on the specific statement and its internal characteristics. However, ROT risks overcomplicating the task, while GOT might underestimate the value of theoretical grounding. Ultimately, GOT's approach is more directly aligned with the mission of selecting the *best statement* from the provided options.  ### Synthesized Accurate Answer: The most important characteristics of weak states are their frequent inability to establish and maintain a monopoly of control over the instruments of violence. Even within states with well developed coercive power they do not always retain absolute loyalty and are faced with a real possibility of military intervention. Whilst armed forces are ill-equipped, poorly managed and prone to factional divisions, social actors are powerful enough to resist governance. Therefore, monopoly over the instruments of violence is infrequent."
