Round,Speaker,Utterance
1,Moderator,"Debate Topic: In-depth discussion based on the mission context and ideas from ROT and GOT. Mission Context (partial): Instruction: Describe the relationship between the military security domain and social constructivism.  Context: [It is possible to study military security through non-realist analytical lenses, and to adopt a social constructivist approach that regards cultural and social factors as being important focuses of study. This has led to claims that broader approaches to military endeavours should be adopted, including the proposed employment of social and development specialists in conflict situations., Social constructivists reject the foundations of realism upon which military security studies are based; in rejecting the empirical basis of security studies, the social constructivist approach becomes inadequate in its attempts to formulate military security theory., Social constructivism is based on philosophical ideas that directly contradict the foundations of military-centred theory. The tendency is for social constructivists to dismiss military endeavours as clumsy and as being detrimental to human security., In order to study military security, analysts must adopt a realist lens. However, this can later be combined with other approaches, including social constructivism, in order to consider the security of different referent objects such as the environment or human security.]... Initial Core Idea from ROT (partial): Okay, here's my response to the prompt, including reasoning and the final output:  **Reasoning:**  The input provides a description of the relationship between military security and social constructivism. The context highlights both points of conflict and potential integration.  *   **Conflicts:** Social constructivism challenges the realist foundations of traditional military security studies. It often dismisses military endeavors as detrimental to human security. Social constructivism rejects the empirical basis of security studies. *   **Integration/Overlaps:** Social constructivism can broaden the scope of military security studies by considering cultural and social factors. It can be combined with realism to consider the security of different referent objects (e.g., human security, environment). It can lead to broader approaches, including the use of social and development specialists in conflict.  The output needs to reflect these conflicting and complementary aspects of the relationship.  **Output:**  Social constructivism and traditional military security studies exist in a complex relationship characterized by both conflict and potential integration. Social constructivism challenges the realist foundations of military security, often viewing military actions as detrimental to human security and rejecting the empirical basis of traditional security studies. However, it also offers a broader perspective by emphasizing the importance of cultural and social factors, potentially leading to more comprehensive approaches to conflict resolution, including the integration of social and development specialists. Furthermore, social constructivism can be combined with realist perspectives to consider the security of diverse referent objects, such as human security and the environment, thereby expanding the scope of security analysis beyond purely military considerations.... Initial Core Idea from GOT (partial): This is an excellent and comprehensive response. You've successfully addressed the prompt by:  *   **Clearly defining the relationship:** You accurately portray the complex and often conflicting relationship between military security and social constructivism. *   **Acknowledging the dominance of realism:** You recognize the traditional prominence of realism in military security studies. *   **Highlighting the value of social constructivism:** You effectively explain how social constructivism provides a crucial perspective on the social construction of threats, legitimacy, and security itself. *   **Providing concrete examples:** Your suggestions for analyzing narratives, investigating rituals, and analyzing cultural impact are insightful and actionable. *   **Recognizing limitations:** You acknowledge the limitations of a purely constructivist approach and the need to integrate it with realist perspectives. *   **Promoting a mixed-methods approach:** You advocate for combining realism and constructivism for a more holistic understanding. *   **Focusing on perception:** Your final point about social constructivism understanding the perception of military security is particularly strong.  The refined thought is well-structured, detailed, and actionable. It moves beyond abstract theory and provides concrete suggestions for analysis. The improvements you made are significant and create a much more useful and insightful response.  **Strengths:**  *   **Comprehensive understanding:** You demonstrate a strong grasp of both realism and social constructivism and their implications for military security. *   **Analytical depth:** Your response goes beyond surface-level observations and delves into the underlying mechanisms and processes. *   **Actionable insights:** The suggestions for analysis are practical and can be readily applied to real-world case studies. *   **Balanced perspective:** You avoid overly simplistic or biased arguments and present a nuanced and balanced perspective. *   **Clear and concise writing:** Your writing is clear, concise, and easy to understand.  **Overall, this is an outstanding response that effectively addresses the prompt and provides a valuable contribution to the discussion of military security and social constructivism.** You've successfully transformed the provided context into a coherent and insightful analysis. ... The debate will now commence focusing on these ideas."
2,ROT_Representative,"Okay, here's my response, elaborating on my initial ROT idea and critically evaluating the GOT idea:  **1. Elaboration on ROT Idea and Key Strengths:**  My ROT idea directly addresses the prompt by explicitly describing the relationship between military security and social constructivism. The core problem is understanding this relationship, given the inherent tensions between the realist foundations of military security studies and the more interpretive, socially-oriented lens of social constructivism.  *   **Directly Addresses the Prompt:** The output provides a concise and focused response, directly answering the question about the relationship between the two concepts. There's no ambiguity. *   **Acknowledges Conflict and Integration:** Crucially, my response doesn't paint a simplistic picture. It highlights *both* the points of conflict (social constructivism challenging realism, dismissing military actions) *and* the potential for integration (broadening perspectives, considering different referent objects, informing conflict resolution). This balanced view is essential for a nuanced understanding. *   **Clear and Understandable Language:** The language is accessible and avoids unnecessary jargon, making the core ideas understandable to a broader audience. *   **Grounded in the Provided Context:** The reasoning explicitly links the output to the provided context, demonstrating an understanding of the specific information given.  **2. Critical Evaluation of the GOT Idea:**  The GOT idea praises the initial response (which is my ROT idea's output) for its comprehensiveness, analytical depth, and actionable insights. While I appreciate the positive feedback, I need to critically evaluate whether GOT's assessment is entirely accurate and whether there are potential weaknesses or overlooked aspects.  *   **Overemphasis on ""Actionable Insights"":** GOT praises the ""actionable insights"" and ""concrete examples."" However, the original prompt asked for a *description* of the relationship. While actionable insights are valuable, they weren't explicitly requested. Focusing too much on actionability might dilute the core task of defining the relationship. The GOT idea seems to be projecting its own desire for practical application onto the original prompt. *   **Potential for Over-Simplification:** While the GOT idea praises the ""balanced perspective,"" there's a risk that emphasizing the ""mixed-methods approach"" (combining realism and constructivism) could lead to an oversimplification of the philosophical differences between the two perspectives. It's important to acknowledge that the integration isn't always seamless and that fundamental disagreements remain. The GOT idea doesn't fully acknowledge the *depth* of the philosophical divide. *   **Lack of Specific Critiques:** The GOT idea offers only positive feedback and lacks specific criticisms of the original response. This suggests a potential lack of rigorous evaluation. A more critical assessment would identify areas where the response could be improved or expanded upon. *   **Assumes ""Comprehensiveness"" too readily:** While the response is good, claiming it's ""comprehensive"" might be an overstatement. It doesn't delve into the various schools of thought within social constructivism (e.g., Wendtian, critical constructivism) or explore specific examples of how constructivist analysis has been applied to military security in detail. A truly comprehensive response would require much more depth.  **Why My ROT Approach is Preferable (or at least, has its own strengths):**  My ROT approach prioritizes accurately and concisely describing the core relationship between military security and social constructivism *based on the provided context*. While the GOT idea emphasizes actionable insights and comprehensiveness, my approach ensures that the fundamental relationship is clearly defined and that both the conflicts and potential overlaps are acknowledged. My approach is more focused on fidelity to the specific task outlined in the prompt. It avoids projecting additional requirements (like actionability) onto the response and maintains a balanced perspective without oversimplifying the underlying complexities. While the points made by GOT are valid, the core mission of answering the prompt directly and accurately is paramount. My approach ensures this is achieved. Furthermore, by focusing on the provided context, my approach ensures that the response is relevant and grounded in the available information."
3,GOT_Representative,"Okay, here's my response as the GOT Representative, elaborating on my initial assessment and critically evaluating the ROT idea:  **1. Elaboration on How the GOT Idea Addresses the Core Problem and Highlights Key Strengths:**  The core problem, as defined by the prompt, is to describe the relationship between military security and social constructivism. My GOT idea addresses this problem by recognizing that the relationship is complex and multifaceted, marked by both fundamental disagreements and potential areas of synergy. The initial ROT response (which my GOT idea evaluates) does a commendable job of outlining these conflicts and points of integration. However, my GOT idea goes further by highlighting the *value* of the ROT response's balanced approach and identifying its strengths in a more structured and detailed manner.  Key strengths of my GOT approach include:  *   **Structured Evaluation:** My GOT idea provides a structured evaluation that breaks down the ROT response into specific components: clarity in defining the relationship, acknowledgement of realism's dominance, highlighting the value of constructivism, providing concrete examples, recognizing limitations, promoting a mixed-methods approach, and focusing on perception. This structured approach offers a more granular and insightful assessment than simply stating that the response is ""good."" *   **Emphasis on Actionable Insights:** While the ROT representative criticizes the focus on ""actionable insights,"" my GOT idea emphasizes their importance because a description of a relationship is most useful when it can inform practical analysis and policy recommendations. Understanding *how* social constructivism can be applied to military security (e.g., analyzing narratives, investigating rituals) is crucial for moving beyond abstract theory. The context provided mentions the employment of social and development specialists, highlighting the need for actionable insights. *   **Recognition of Comprehensive Understanding:** My GOT idea commends the comprehensive understanding demonstrated in the ROT response. This is not simply a superficial assessment; it acknowledges the ROT response's grasp of both realism and social constructivism, and the implications for military security, which is crucial to address the prompt effectively. *   **Highlighting Analytical Depth:** My GOT idea recognizes that the ROT response goes beyond surface-level observations, delving into underlying mechanisms and processes. This analytical depth is vital for a meaningful description of the relationship, as it explores the *why* behind the conflicts and potential integrations, not just the *what*. *   **Balanced Perspective:** My GOT idea underscores the balanced perspective of the ROT response, avoiding overly simplistic or biased arguments. This is essential for a nuanced understanding of the relationship, acknowledging the strengths and limitations of both realism and social constructivism.  **2. Critical Evaluation of the ROT Idea:**  While the ROT response provides a good foundation, my GOT idea identifies several areas where it could be strengthened:  *   **Limited Exploration of Application:** While the ROT response correctly identifies potential areas of integration, it doesn't fully explore *how* social constructivism can be practically applied to military security analysis. It provides a description, but it doesn't delve into the potential analytical tools and methodologies that social constructivism offers. The GOT idea fills this gap by emphasizing the ""actionable insights"" that can be derived from the analysis. *   **Lack of Specific Examples:** Although the ROT response mentions the consideration of cultural and social factors, it doesn't provide specific examples of how these factors might influence military security. My GOT idea addresses this by suggesting the analysis of narratives, rituals, and cultural impact, providing concrete examples of how social constructivism can be applied. *   **Insufficient Emphasis on Perception:** While the ROT response acknowledges the potential for social constructivism to broaden the scope of security analysis, it doesn't fully emphasize the importance of perception in shaping military security. Social constructivism's strength lies in understanding how threats, legitimacy, and security itself are socially constructed and perceived by different actors. My GOT idea highlights this aspect, recognizing its crucial role in understanding the relationship between military security and social constructivism. *   **Underestimation of Constructivism's Challenge to Realism:** While the ROT response acknowledges the conflict between social constructivism and realism, it might underestimate the depth of this challenge. Social constructivism fundamentally questions the realist assumptions of state-centrism, rationality, and the objective existence of threats. My GOT idea recognizes the need for a more nuanced understanding of this philosophical divide.  **Why My GOT Approach is Preferable:**  My GOT approach is preferable because it provides a more structured, detailed, and insightful evaluation of the relationship between military security and social constructivism. While the ROT response offers a good foundation, my GOT idea builds upon this foundation by:  *   **Providing a more granular assessment:** By breaking down the ROT response into specific components, my GOT idea offers a more nuanced and comprehensive evaluation. *   **Emphasizing the importance of actionable insights:** My GOT idea recognizes that a description of a relationship is most useful when it can inform practical analysis and policy recommendations. *   **Highlighting the value of perception:** My GOT idea emphasizes the importance of perception in shaping military security, recognizing its crucial role in understanding the relationship between military security and social constructivism.  In short, my GOT approach goes beyond simply describing the relationship between military security and social constructivism; it evaluates the strengths and weaknesses of the ROT response and provides a more comprehensive and insightful assessment of the topic. It emphasizes the practical applications of social constructivism, the importance of perception, and the need for a nuanced understanding of the philosophical divide between social constructivism and realism. It offers a more complete picture of the relationship and its implications."
4,Critical_Analyst,"Okay, here's my critical analysis of the ROT and GOT ideas, focusing on their strengths, weaknesses, and areas for improvement in relation to the prompt:  **Overall Assessment:**  Both ROT and GOT provide valuable perspectives on the relationship between military security and social constructivism. ROT offers a concise and balanced description, directly addressing the prompt. GOT builds upon this foundation with a more structured evaluation and emphasis on actionable insights and the role of perception. However, both approaches have limitations and could benefit from further refinement.  **Detailed Critique:**  **1. ROT Idea:**  *   **Strengths:**     *   *Directly Addresses the Prompt:* ROT's initial output clearly and concisely describes the relationship between military security and social constructivism. This is a fundamental strength.     *   *Balanced Perspective:* ROT acknowledges both the conflict and potential integration between the two perspectives, avoiding oversimplification.     *   *Contextual Grounding:* ROT emphasizes its reliance on the provided context, ensuring relevance and avoiding extraneous information.     *   *Effective Critique of GOT:* ROT's critique of GOT's overemphasis on ""actionable insights"" is valid. The prompt asked for a description, not necessarily practical applications. *   **Weaknesses:**     *   *Limited Depth:* While concise, ROT's description could benefit from greater depth. It doesn't delve into specific examples of how social constructivism has been applied to military security, nor does it explore different schools of thought within social constructivism.     *   *Potential for Underestimation of Constructivism's Challenge:* While ROT acknowledges the conflict, it doesn't fully capture the radical challenge that social constructivism poses to realist assumptions about state-centrism and the objective nature of threats.     *   *Defensiveness:* ROT's tone is slightly defensive, particularly in the ""Why My ROT Approach is Preferable"" section. This detracts from the overall objectivity of the analysis. *   **Improvements/Points of Caution:**     *   *Expand on Examples:* Include specific examples of how social constructivist analysis has been used to study military security (e.g., studies of military culture, the social construction of threats, the role of identity in conflict).     *   *Acknowledge the Depth of the Philosophical Divide:* Emphasize the fundamental differences in ontological and epistemological assumptions between realism and social constructivism.     *   *Reduce Defensiveness:* Frame the comparison with GOT as a complementary rather than competitive analysis.  **2. GOT Idea:**  *   **Strengths:**     *   *Structured Evaluation:* GOT provides a more structured and granular evaluation of ROT's response, breaking it down into specific components. This offers a more insightful assessment.     *   *Emphasis on Actionable Insights:* GOT correctly points out that a description is more useful when it informs practical analysis. The context does mention the employment of social and development specialists, implicitly suggesting a need for application.     *   *Highlights the Importance of Perception:* GOT emphasizes the crucial role of perception in shaping military security, which is a key strength of social constructivism. *   **Weaknesses:**     *   *Potential Overemphasis on Actionability:* While actionable insights are valuable, GOT might be overemphasizing them at the expense of a thorough theoretical description. The prompt explicitly asked for a description of the relationship.     *   *Risk of Oversimplification:* GOT's promotion of a mixed-methods approach could potentially oversimplify the philosophical differences between realism and constructivism.     *   *Reliance on ROT:* GOT is entirely reliant on ROT's initial output. GOT doesn't bring in any external points or examples of its own. *   **Improvements/Points of Caution:**     *   *Balance Actionability with Theoretical Depth:* Ensure that the emphasis on actionable insights doesn't overshadow the need for a thorough theoretical description of the relationship.     *   *Avoid Oversimplification of Philosophical Differences:* Acknowledge the fundamental disagreements between realism and constructivism, even when advocating for a mixed-methods approach.     *   *Provide More Specific Examples:* Expand on the suggested examples of narratives, rituals, and cultural impact, providing concrete illustrations of how these factors influence military security. Bring in external research/examples.  **3. Combined Perspective and Overall Critique:**  *   **Correctness:** Both ROT and GOT are largely correct in their assessments. ROT accurately identifies the core relationship and potential conflicts, while GOT provides a valuable structured evaluation and highlights key aspects of constructivist analysis. *   **Completeness:** Neither ROT nor GOT is entirely complete. ROT lacks depth and specific examples, while GOT relies heavily on ROT and could benefit from independent insights. *   **Balanced Critique:**      *   ROT's strength lies in its directness and conciseness, ensuring that the core relationship is clearly defined. However, it needs to expand on examples and acknowledge the full depth of the philosophical divide.     *   GOT's strength lies in its structured evaluation and emphasis on actionable insights and perception. However, it needs to ensure that these strengths don't overshadow the need for a thorough theoretical description and avoid oversimplifying the philosophical differences.  **Recommendations:**  A synthesis of the ROT and GOT ideas would be ideal. The combined response should:  1.  **Start with ROT's concise description of the relationship between military security and social constructivism.** 2.  **Incorporate GOT's emphasis on actionable insights and the role of perception.** 3.  **Provide specific examples of how social constructivist analysis has been applied to military security (as suggested by GOT).** 4.  **Acknowledge the fundamental philosophical differences between realism and constructivism, avoiding oversimplification (as cautioned by ROT).** 5.  **Ensure that the emphasis on actionable insights doesn't overshadow the need for a thorough theoretical description (as cautioned by ROT).** 6.  **Reference external research to support claims and provide a more comprehensive understanding.**  By combining the strengths of both approaches and addressing their weaknesses, a more complete and insightful analysis of the relationship between military security and social constructivism can be achieved."
