Round,Speaker,Utterance
1,Moderator,"Debate Topic: In-depth discussion based on the mission context and ideas from ROT and GOT. Mission Context (partial): Instruction: Which statement best describes the circumstances that have shaped the emergence of peace studies as a field of research?  Context: [Peace studies developed after the Second World War as a response to the failure of International Relations to prevent global conflict following World War I. Initially, the field was conditioned by the nuclear arms race and East-West divide that characterised the Cold War, but was quick to embrace environmental concerns and the issues surrounding the North-South wealth/poverty divide., Peace studies developed as a discipline following the Cold War when the security studies paradigm shifted to include areas of concern such as environmental, societal and economic security. As a field of research peace studies adopts a Euro-centric approach to security and has thus been defined by developments within the West and wealthier nations., Peace studies emerged as a response to the developing nuclear capability of states during the Cold War. The aim of peace studies is to secure the state as a referent object and does this through the study of weapons accumulation. The approach is particularly focused on the nuclear arms race between East and West., Developed as a response to World War I, peace studies focuses on disparities in wealth and resource allocation that exist within the global system, with the aim of promoting peace through the equal distribution of these resources.]... Initial Core Idea from ROT (partial): Okay, based on the task definition, pseudocode, logical representation, case examples, and the provided input, here's my response:  **Reasoning:**  The instruction asks for the statement that *best* describes the circumstances shaping the emergence of peace studies. This means we need to evaluate each statement based on accuracy, comprehensiveness, and representativeness.  *   **Statement 1:** ""Peace studies developed after the Second World War as a response to the failure of International Relations to prevent global conflict following World War I. Initially, the field was conditioned by the nuclear arms race and East-West divide that characterised the Cold War, but was quick to embrace environmental concerns and the issues surrounding the North-South wealth/poverty divide.""  This statement provides a good historical context (post-WWII, failure of IR), mentions the Cold War influence (nuclear arms race, East-West divide), and also acknowledges the broadening of the field to include environmental and economic concerns. This makes it relatively comprehensive.  *   **Statement 2:** ""Peace studies developed as a discipline following the Cold War when the security studies paradigm shifted to include areas of concern such as environmental, societal and economic security. As a field of research peace studies adopts a Euro-centric approach to security and has thus been defined by developments within the West and wealthier nations."" This statement is less accurate regarding the initial emergence of the field, placing it post-Cold War. While it mentions the shift in security studies and the inclusion of new concerns, it also introduces the idea of a Euro-centric approach, which might be a specific critique rather than a general description of its emergence.  *   **Statement 3:** ""Peace studies emerged as a response to the developing nuclear capability of states during the Cold War. The aim of peace studies is to secure the state as a referent object and does this through the study of weapons accumulation. The approach is particularly focused on the nuclear arms race between East and West."" This statement is too narrow. While the nuclear arms race was a significant factor, it doesn't represent the full scope of the field's development. The focus on securing the state as a referent object is also a specific theoretical perspective, not a general description.  *   **Statement 4:** ""Developed as a response to World War I, peace studies focuses on disparities in wealth and resource allocation that exist within the global system, with the aim of promoting peace through the equal distribution of these resources."" This statement is inaccurate regarding the timing of the field's emergence (post WWI vs. post WWII). While it mentions wealth and resource allocation, it misses the crucial influence of the Cold War and the initial focus on security issues.  Comparing the statements, Statement 1 is the most accurate, comprehensive, and representative of the overall context. It provides a broader historical perspective and acknowledges the evolution of the field.  **Answer:**  Peace studies developed after the Second World War as a response to the failure of International Relations to prevent global conflict following World War I. Initially, the field was conditioned by the nuclear arms race and East-West divide that characterised the Cold War, but was quick to embrace environmental concerns and the issues surrounding the North-South wealth/poverty divide.... Initial Core Idea from GOT (partial): Okay, based on the context and your refined thought process, here's the breakdown of why the first statement is likely the best answer and why the others are less suitable:  *   **Statement 1: ""Peace studies developed after the Second World War as a response to the failure of International Relations to prevent global conflict following World War I. Initially, the field was conditioned by the nuclear arms race and East-West divide that characterised the Cold War, but was quick to embrace environmental concerns and the issues surrounding the North-South wealth/poverty divide.""**      *   **Why it's good:** This statement directly addresses the prompt by describing the *circumstances* that shaped the emergence of peace studies. It correctly identifies:         *   The post-WWII context and the perceived failures of traditional International Relations.         *   The initial influence of the Cold War and the nuclear arms race.         *   The subsequent *broadening* of the field to include environmental and economic (North-South) concerns.  This evolution aligns perfectly with the shift from ""negative peace"" to a more comprehensive ""positive peace.""         *   It implicitly acknowledges the connection between these driving forces (Cold War, environmental problems, economic inequality) and the research agenda of peace studies.  *   **Statement 2: ""Peace studies developed as a discipline following the Cold War when the security studies paradigm shifted to include areas of concern such as environmental, societal and economic security. As a field of research peace studies adopts a Euro-centric approach to security and has thus been defined by developments within the West and wealthier nations.""**      *   **Why it's weaker:** While it mentions the shift in security studies and the inclusion of environmental/economic concerns, it focuses more on the *timing* (after the Cold War) and introduces the idea of a Euro-centric approach, which, while potentially valid, isn't the *primary* shaping circumstance of the field's *emergence*. The ""Euro-centric"" critique is a separate dimension.  It also doesn't emphasize the initial motivation stemming from the failure to prevent major wars.  *   **Statement 3: ""Peace studies emerged as a response to the developing nuclear capability of states during the Cold War. The aim of peace studies is to secure the state as a referent object and does this through the study of weapons accumulation. The approach is particularly focused on the nuclear arms race between East and West.""**      *   **Why it's flawed:** This statement is too narrow. It *only* focuses on the Cold War and the nuclear arms race.  It also incorrectly claims that peace studies aims to ""secure the state as a referent object.""  This is more aligned with traditional security studies, not the broader, more critical perspective of peace studies.  It misses the crucial evolution beyond this narrow focus.  *   **Statement 4: ""Developed as a response to World War I, peace studies focuses on disparities in wealth and resource allocation that exist within the global system, with the aim of promoting peace through the equal distribution of these resources.""**      *   **Why it's partially correct but incomplete:** While it correctly identifies the focus on wealth disparities, it incorrectly states it developed as a response to WWI. The context clearly states it developed after WWII. It also overemphasizes wealth disparities as the *sole* driver and neglects the initial Cold War context and the evolution to include environmental concerns. **In conclusion, based on your refined thought process and the provided context, the first statement is the best answer because it most comprehensively and accurately describes the circumstances that shaped the emergence and development of peace studies as a field of research, including its initial motivations and its subsequent broadening of scope.** ... The debate will now commence focusing on these ideas."
2,ROT_Representative,"Okay, here's my response as the ROT Representative, elaborating on my initial idea and critically evaluating the GOT idea:  **1. Elaboration on the ROT Idea and its Strengths:**  My core idea focuses on selecting the statement that *best* describes the circumstances shaping the emergence of peace studies by evaluating each statement based on accuracy, comprehensiveness, and representativeness. It's not just about finding a true statement but identifying the *most complete* and *accurate* one within the given context.  *   **How it addresses the core problem:** The instruction is to identify the statement that ""best describes"" the circumstances. My approach directly tackles this by:     *   **Explicitly stating the evaluation criteria:** Accuracy, comprehensiveness, and representativeness. This provides a framework for judging each option.     *   **Systematically analyzing each statement:** The reasoning section breaks down each statement, highlighting its strengths and weaknesses against the defined criteria.     *   **Comparing the statements:** The conclusion explicitly compares the statements, justifying why one is superior to the others.  *   **Key Strengths:**     *   **Holistic Perspective:** It recognizes that peace studies is a complex field shaped by multiple factors and that the best description should reflect this complexity.     *   **Clear Evaluation Framework:** The criteria of accuracy, comprehensiveness, and representativeness provide a transparent and logical basis for the selection.     *   **Emphasis on Evolution:** It acknowledges the field's evolution from its initial focus on security during the Cold War to a broader concern with environmental and economic issues.     *   **Directly Addresses the ""Best"" Requirement:** It doesn't just look for a correct statement but actively seeks the *most* descriptive and representative one.  **Potential Weaknesses, Overlooked Aspects, or Limitations:**  *   **Subjectivity in Criteria Application:** While the criteria are defined, applying them in practice can still involve some degree of subjectivity. What one person considers ""comprehensive"" might differ slightly for another. *   **Reliance on Context:** The evaluation is heavily dependent on the provided context. If the context were different, the ""best"" statement might also change. *   **Potentially Overlooks Nuance:** While aiming for comprehensiveness, it might gloss over some nuanced perspectives or debates within the field of peace studies itself. (e.g., different schools of thought within peace studies).  **2. Critical Evaluation of the GOT Idea:**  The GOT idea provides a more detailed breakdown of why statement 1 is the better choice, and it's generally aligned with my own reasoning. However, there are some subtle points of divergence.  *   **Strengths of the GOT Idea:**     *   **Detailed Justification:** GOT provides more in-depth explanations for why each statement is weaker, particularly regarding inaccuracies and omissions.     *   **Emphasis on ""Positive Peace"":** It explicitly connects the broadening of the field to the shift from ""negative peace"" to ""positive peace,"" which is a valuable insight.     *   **Clearer Focus on the Prompt:** It directly connects the ""circumstances"" to the research agenda of peace studies, highlighting the link between driving forces and the field's focus.  *   **Weaknesses, Overlooked Aspects, or Limitations:**     *   **Less Emphasis on Comparative Evaluation:** While GOT explains why each statement is weak, it doesn't explicitly compare them as thoroughly as my initial ROT. My approach forces a more direct comparison, which is crucial for identifying the *best* answer.     *   **Over-Reliance on Negative Critique:** GOT focuses heavily on why the other statements are *wrong*, while my ROT also emphasizes what makes statement 1 *right*. A balanced approach is preferable.     *   **Potential for Over-Justification:** The GOT idea goes into great detail, which can be helpful, but it also risks becoming overly verbose and losing sight of the core evaluation criteria.  **Why My Approach Might Be Preferable:**  While GOT provides a more detailed justification, my initial ROT idea provides a clearer *framework* for evaluating the statements. By explicitly stating the criteria of accuracy, comprehensiveness, and representativeness, it offers a more structured and transparent approach. It also forces a direct comparison between the statements, ensuring that the chosen answer is demonstrably the *best* within the given context. The GOT's approach, while detailed, might get bogged down in justifying the weaknesses of the other options without clearly highlighting the comparative strengths of the chosen one. My approach is more concise and focused on the core task: identifying the *best* statement."
3,GOT_Representative,"Okay, here's my response as the GOT Representative, elaborating on my initial idea and critically evaluating the ROT idea:  **1. Elaboration on the GOT Idea and its Strengths:**  My core idea is to provide a detailed, structured argument for why Statement 1 is the *best* description of the circumstances shaping the emergence of peace studies, while simultaneously explaining why the other statements are less suitable. This involves a nuanced breakdown of each statement's strengths and weaknesses relative to the prompt's requirements.  *   **How it addresses the core problem:** The instruction asks for the *best* statement. My approach directly addresses this by:     *   **Directly focusing on the prompt's core requirement:** The analysis centers on identifying the ""circumstances that shaped the emergence of peace studies.""     *   **Providing a detailed breakdown of each statement:** Each statement is dissected to reveal its accuracy, comprehensiveness, and relevance to the prompt. This goes beyond a simple ""right"" or ""wrong"" assessment.     *   **Explicitly justifying the selection of Statement 1:** The conclusion clearly articulates why Statement 1 is superior, summarizing the key reasons for its selection.     *   **Highlighting the evolutionary aspect:** The approach emphasizes how peace studies evolved from a Cold War focus to broader concerns, which is crucial to understanding its development.  *   **Key Strengths:**     *   **Clarity and Structure:** The organized breakdown of each statement makes the reasoning easy to follow and understand.     *   **Depth of Analysis:** It goes beyond superficial assessments, delving into the nuances of each statement and its connection to the historical context.     *   **Directly Addresses Inaccuracies:** The approach explicitly identifies inaccuracies in the other statements, demonstrating a thorough understanding of the subject matter.     *   **Emphasis on Contextual Accuracy:** It prioritizes selecting a statement that accurately reflects the historical and intellectual context of peace studies' emergence.     *   **Highlights the Evolution of the Field:** It clearly shows how the field expanded its scope beyond its initial Cold War focus.  **Potential Weaknesses, Overlooked Aspects, or Limitations:**  *   **Potential for Redundancy:** The detailed analysis of each statement could lead to some redundancy, as similar points might be raised across different evaluations. *   **Subjectivity in ""Best"" Determination:** While the analysis is objective, the final judgment of which statement is ""best"" still involves some degree of subjective interpretation. *   **Limited Exploration of Internal Debates:** The focus is primarily on the *circumstances* shaping the field, rather than the internal theoretical debates within peace studies itself.  **2. Critical Evaluation of the ROT Idea:**  The ROT idea correctly identifies the need to evaluate each statement based on accuracy, comprehensiveness, and representativeness. However, it has some limitations compared to my GOT approach.  *   **Strengths of the ROT Idea:**     *   **Clear Evaluation Criteria:** The explicit mention of accuracy, comprehensiveness, and representativeness provides a useful framework for analysis.     *   **Emphasis on Comparative Evaluation:** The ROT approach explicitly compares the statements, which is essential for identifying the *best* answer.  *   **Weaknesses, Overlooked Aspects, or Limitations:**     *   **Less Detailed Justification:** ROT provides a more generalized assessment of each statement, lacking the depth and nuance of my GOT approach. It doesn't delve as deeply into *why* each statement is weaker, particularly in terms of inaccuracies or omissions.     *   **Less Emphasis on Contextual Accuracy:** While ROT mentions accuracy, it doesn't explicitly prioritize selecting a statement that accurately reflects the historical and intellectual context of peace studies' emergence to the same degree as my GOT approach.     *   **Potential for Superficiality:** The broader evaluation criteria (accuracy, comprehensiveness, representativeness) could be applied superficially without fully engaging with the complexities of each statement and the historical context. The GOT idea avoids this by providing more substantial justification for each assessment.     *   **Less Focus on Evolution:** While ROT mentions the field's evolution, it doesn't highlight it as prominently as the GOT approach, which specifically points out how peace studies expanded its scope beyond its initial Cold War focus.  **Why My Approach Might Be Preferable:**  My GOT approach provides a more detailed and nuanced analysis of each statement, resulting in a more robust and persuasive justification for selecting Statement 1 as the *best* answer. It goes beyond simply stating that a statement is inaccurate or incomplete; it explains *why* it is inaccurate or incomplete, providing concrete examples and linking the analysis back to the historical context and the prompt's core requirement. Furthermore, it emphasizes the importance of understanding the evolution of peace studies, which is crucial for accurately describing the circumstances that shaped its emergence. While the ROT idea provides a useful framework, the GOT approach provides a more thorough and insightful analysis, ultimately leading to a more compelling and well-supported conclusion. The GOT approach provides greater clarity and a stronger argument by providing a deeper level of critical evaluation, particularly in identifying inaccuracies and highlighting the field's evolution."
4,Critical_Analyst,"Okay, here's a critical evaluation of the ROT and GOT ideas, focusing on their strengths, weaknesses, and potential improvements, relative to the mission of selecting the best statement describing the emergence of peace studies:  **Overall Assessment:**  Both ROT and GOT offer valuable perspectives on how to approach the task. ROT provides a clear and structured framework based on accuracy, comprehensiveness, and representativeness. GOT offers a more detailed and nuanced analysis of each statement, focusing on contextual accuracy and the evolution of the field. Ultimately, GOT's approach is slightly stronger due to its depth, but both can be improved.  **ROT Evaluation:**  *   **Strengths:**     *   **Clear Framework:** The stated criteria (accuracy, comprehensiveness, representativeness) provide a useful and transparent structure for evaluating the options.     *   **Emphasis on Comparison:** ROT explicitly prioritizes comparing the statements to identify the *best* one, directly addressing the prompt's requirement.     *   **Acknowledges Evolution:** ROT correctly identifies the evolution of peace studies beyond its initial Cold War focus.  *   **Weaknesses:**     *   **Subjectivity in Application:** While the criteria are clear, their application remains somewhat subjective. ROT doesn't provide specific, concrete examples of how each criterion is applied to each statement.     *   **Potential for Superficiality:** The broad criteria could lead to a superficial analysis if not applied rigorously. ROT's analysis, while structured, lacks the depth of GOT's.     *   **Limited Exploration of Nuance:** ROT acknowledges this weakness, admitting it might ""gloss over some nuanced perspectives or debates within the field of peace studies."" This is a significant concern.  *   **Potential Improvements:**     *   **Provide Concrete Examples:** For each statement, explicitly demonstrate how it meets or fails to meet each of the three criteria (accuracy, comprehensiveness, representativeness).     *   **Address Specific Nuances:** Acknowledge and address specific debates or perspectives within peace studies relevant to the evaluation. For example, briefly acknowledge different schools of thought within peace studies and how they might view the statements differently.     *   **Strengthen the Comparison:** Go beyond simply stating that one statement is ""better"" and provide a more detailed comparison of their relative strengths and weaknesses across all three criteria.  **GOT Evaluation:**  *   **Strengths:**     *   **Detailed Analysis:** GOT provides a more in-depth and nuanced analysis of each statement, identifying specific inaccuracies and omissions.     *   **Contextual Accuracy:** GOT emphasizes the importance of contextual accuracy, ensuring that the selected statement accurately reflects the historical and intellectual context of peace studies.     *   **Highlights Evolution:** GOT effectively highlights the evolution of peace studies from its initial Cold War focus to broader concerns.     *   **Addresses Inaccuracies Directly:** GOT explicitly identifies and explains inaccuracies in the weaker statements.  *   **Weaknesses:**     *   **Potential for Redundancy:** The detailed analysis could become repetitive, especially when discussing similar weaknesses across different statements.     *   **Subjectivity Remains:** While more detailed than ROT, the final judgment of ""best"" still contains a degree of subjectivity.     *   **Limited Exploration of Internal Debates:** GOT acknowledges this limitation, stating that it primarily focuses on external circumstances rather than internal theoretical debates. This could be a significant oversight.     *   **Less Emphasis on Explicit Comparison:** While GOT implicitly compares statements, it doesn't always provide a direct, side-by-side comparison like ROT attempts.  *   **Potential Improvements:**     *   **Minimize Redundancy:** Streamline the analysis to avoid repeating similar points across different statement evaluations.     *   **Acknowledge and Address Internal Debates:** Briefly acknowledge and address relevant theoretical debates within peace studies. For example, mention different perspectives on the role of the state or the definition of peace.     *   **Incorporate ROT's Framework:** Explicitly incorporate ROT's evaluation framework (accuracy, comprehensiveness, representativeness) to provide a more structured and transparent analysis. Create a table or bulleted list summarizing how each statement performs against each criterion.     *   **Strengthen the Conclusion:** Make the conclusion even more forceful by summarizing the key reasons why Statement 1 is superior and explicitly addressing any potential counterarguments.  **Balanced Overall Critique:**  GOT's approach is slightly stronger due to its greater depth and focus on contextual accuracy. However, it could benefit from incorporating ROT's framework to provide a more structured and transparent analysis. ROT provides a valuable framework but needs to apply it more rigorously and address the potential for superficiality. Both approaches could benefit from explicitly acknowledging and addressing relevant theoretical debates within peace studies.  The key to improvement for both is to move beyond general statements about accuracy and comprehensiveness and provide specific, concrete examples and justifications for their claims. They also need to acknowledge and address the inherent subjectivity in the task and the limitations of their analysis. By combining the strengths of both approaches and addressing their weaknesses, a more robust and persuasive argument can be made for selecting the best statement."
