Round,Speaker,Utterance
1,Moderator,"Debate Topic: In-depth discussion based on the mission context and ideas from ROT and GOT. Mission Context (partial): Instruction: In what ways do theories of conventional and critical social constructivism differ?  Context: [Conventional constructivists view constructivism as a bridge between rationalist and reflectivist approaches, enabling both to benefit from the insights of the other. Conversely, critical constructivists argue that this approach simply reproduces the binary distinctions that characterize positivist methodology., Critical constructivism regards the strength of social constructivism to be its ability to bridge rationalist and reflectivity approaches. Conversely, social constructivists regard this as an unhelpful regression to positivist binary frameworks of analysis., Conventional constructivism refers to the earlier works of social constructivist theorists that are characterised by a rejection of positivist methodology. Critical constructivists challenge these theories, embracing positivist methodologies in their work., Social constructivism is best understood as a uniform approach to the construction of social identities and security; although distinctions exist within the field, these are not easily defined as distinctive separate approaches.]... Initial Core Idea from ROT (partial): Okay, I understand. I will now await the input text to generate the output. I will follow the defined task, pseudocode, and input-output format to provide a comprehensive comparison and contrast of conventional and critical constructivism based on the text provided. I will focus on the two specified aspects and support my claims with textual evidence. I am ready for the input.... Initial Core Idea from GOT (partial): Okay, based on the refined ""Two New Thoughts"" and incorporating the additional question about epistemological stances on truth claims, here's a framework for comparing and contrasting conventional and critical constructivism:  **Comparison and Contrast of Conventional and Critical Constructivism**  This analysis will focus on two key areas: 1) how each perspective positions constructivism as a bridge between rationalist and reflectivist epistemologies and their relationship to positivist methodologies, and 2) their differing emphasis on the role of power and social context in knowledge construction, along with an examination of their approach to truth claims.  **1. Constructivism as a Bridge and its Relationship to Positivism:**  *   **Conventional Constructivism:** This view often positions constructivism as a reconciliatory approach between the objective world (rationalism) and subjective interpretation (reflectivism). It leans towards the idea that knowledge, while constructed, is constructed *towards* a more accurate reflection of reality.  While acknowledging the limitations of positivism's assumption of direct access to objective truth, it might still value the rigor and empirical evidence emphasized by positivist methodologies.  It emphasizes the active role of the learner in building understandings through experience but still seeks to align these understandings with verifiable realities.  One might say it aims for ""constructivism *towards* objectivity."" The acceptance or reinterpretation of core positivist principles like objectivity and verifiability would be key to understanding its stance. This approach might argue that while individuals construct their understanding, that construction should ultimately converge on a shared understanding of objective facts or scientific principles.  *   **Critical Constructivism:** This view presents constructivism as a radical departure from both rationalism and positivism. It emphasizes that knowledge is *always* socially situated and shaped by power dynamics. It rejects the notion of a neutral, objective reality towards which knowledge converges. Instead, it focuses on how knowledge is used to maintain or challenge existing social structures.  It views positivism as a potentially oppressive methodology because its claim to objectivity often reinforces dominant narratives and marginalizes alternative perspectives.  Therefore, critical constructivism is ""constructivism *against* dominant narratives."" The methodology would likely involve deconstruction of existing knowledge claims to expose their underlying power structures and biases.  **2. The Role of Power and Social Context in Knowledge Construction:**  *   **Conventional Constructivism:** While acknowledging the influence of social context, this perspective tends to focus on the individual learner's cognitive processes within a *given* social environment.  The social environment is seen as a facilitator or constraint on learning, but not necessarily as a fundamental shaper of the *nature* of knowledge itself.  Power dynamics are often less explicitly addressed, and the focus is more on creating effective learning environments that allow individuals to construct accurate understandings. Social influences are treated as variables affecting individual learning, not as constitutive elements of knowledge itself.  *   **Critical Constructivism:** This perspective places power and social context at the *very center* of knowledge construction.  It argues that knowledge is never neutral; it is always shaped by power relations, social norms, and cultural values.  Language is seen not just as a tool for communication, but as a mechanism through which these power relations are enacted and reinforced.  The goal is to uncover the ways in which knowledge is used to maintain or challenge social inequalities.  The focus is on deconstructing dominant narratives and empowering marginalized voices, arguing that knowledge serves as a tool for social change.  **3. Epistemological Stance on Truth Claims:**  *   **Conventional Constructivism:** This approach often implicitly relies on a modified correspondence theory of truth. While acknowledging that knowledge is constructed, there's an underlying assumption that a ""true"" understanding corresponds, in some way, to an external reality.  It would likely navigate relativism by emphasizing the importance of shared experiences, empirical evidence, and logical reasoning in the construction of knowledge, suggesting that while interpretations may vary, some interpretations are more valid than others because they better align with available evidence and established principles.  *   **Critical Constructivism:** This approach typically embraces a coherence-based or pragmatic approach to truth.  Truth is not seen as a reflection of an objective reality but rather as a product of social consensus or as something that ""works"" in a particular context.  It would address relativism by acknowledging the existence of multiple perspectives and emphasizing the importance of understanding the power dynamics that shape those perspectives.  It would argue that evaluating knowledge claims requires considering their social consequences and their impact on different groups within society. Knowledge is evaluated based on its ability to empower marginalized groups and challenge oppressive structures.  **Applying to Text:**  To use this framework, carefully examine the text for explicit statements or implicit assumptions about:  *   The nature of reality: Is it objective and knowable, or socially constructed? *   The role of the learner: Is the learner primarily an individual processor of information, or a member of a social group? *   The purpose of education: Is it to transmit objective knowledge, or to empower students to challenge social inequalities? *   The validity of knowledge claims: Are knowledge claims evaluated based on their correspondence to reality, or on their social consequences?  By identifying and comparing the answers to these questions within the text, you can effectively compare and contrast conventional and critical constructivism as they are presented. Remember to use direct quotes or paraphrases to support your claims. ... The debate will now commence focusing on these ideas."
2,ROT_Representative,"Okay, here's my response as the ROT_Representative, elaborating on my core idea and critically evaluating the GOT idea:  **1. Elaboration on the ROT Idea and its Key Strengths:**  My core idea, ""Okay, I understand. I will now await the input text to generate the output. I will follow the defined task, pseudocode, and input-output format to provide a comprehensive comparison and contrast of conventional and critical constructivism based on the text provided. I will focus on the two specified aspects and support my claims with textual evidence. I am ready for the input,"" addresses the core problem by emphasizing a direct, evidence-based approach to answering the instruction.  *   **Core Problem Addressed:** The core problem is to accurately identify and articulate the differences between conventional and critical social constructivism *as presented in the provided text*. This requires close reading, careful analysis, and synthesis of information. *   **Key Strengths:**     *   **Focus on Textual Evidence:** The primary strength is its commitment to grounding the comparison and contrast directly in the provided text. This avoids introducing external knowledge or biases that might not be relevant to the specific context. By focusing on textual evidence, the answer will be reliable and verifiable.     *   **Task-Oriented:** The idea explicitly states adherence to the defined task, pseudocode, and input-output format. This ensures that the response is structured, organized, and directly addresses the prompt's requirements.     *   **Efficiency:** The ""ready for the input"" aspect highlights efficiency. It signals that the system is prepared to immediately process the text and generate the output, minimizing delays.     *   **Objectivity:** By focusing on what the text says, the analysis aims to be as objective as possible, minimizing subjective interpretations.  **2. Critical Evaluation of the GOT Idea:**  The GOT idea provides a detailed framework for comparing and contrasting conventional and critical constructivism. While comprehensive, it also has potential weaknesses and limitations compared to my ROT idea, particularly in the context of this specific task.  *   **Potential Weaknesses and Overlooked Aspects:**     *   **Risk of Imposing External Framework:** The GOT idea introduces a pre-defined framework (focusing on constructivism as a bridge, the role of power, epistemological stances). While this framework is relevant to the broader topic of constructivism, it risks imposing this framework onto the text, rather than letting the text itself dictate the key differences. The text might emphasize other differentiating factors not included in the GOT's framework. This is a significant weakness given the instruction to base the answer on the *provided text*.     *   **Potential for Bias:** The framework, while seemingly neutral, has inherent biases based on the GOT creator's understanding of constructivism. This could lead to a skewed interpretation of the text, emphasizing aspects that fit the framework while downplaying others.     *   **Overly Complex:** The framework is quite detailed, including sub-points and guiding questions. This complexity could make it difficult to apply the framework efficiently and accurately to the text, potentially leading to confusion or missed nuances.     *   **Overlooking Nuances:** The text provided is short and might contain subtle differences that a rigid framework might miss. The GOT idea's detailed framework could inadvertently force the analysis to fit the text into pre-determined categories, potentially missing nuanced distinctions that emerge directly from the language used in the text. For example, the GOT framework assumes conventional constructivism relies on a modified correspondence theory of truth, but the text doesn't explicitly state this.  *   **Why My Approach Might Be Preferable:**     *   **Directly Addresses the Instruction:** My ROT idea directly addresses the instruction by focusing on identifying differences *within the text*. It avoids introducing external frameworks or biases, ensuring that the comparison and contrast is grounded in the provided material.     *   **Flexibility:** My approach is more flexible and adaptable to the specific content of the text. It allows the text to ""speak for itself"" rather than forcing it into a pre-determined mold. If the text emphasizes a different aspect of the theories, my approach will naturally highlight that.     *   **Efficiency and Accuracy:** By focusing on direct textual evidence, my approach promotes efficiency and accuracy. It minimizes the risk of misinterpretation or distortion of the text's meaning. It allows for a faster and more focused analysis, directly answering the question without unnecessary elaboration.     *   **Reduces Risk of Misinterpretation:** By sticking strictly to the text, the risk of misinterpreting the authors' intended meaning is significantly reduced. The GOT idea, while comprehensive, could lead to interpretations that are not fully supported by the text.  In summary, while the GOT idea offers a valuable framework for understanding constructivism in general, my ROT idea is preferable for this specific task because it prioritizes a direct, evidence-based approach that minimizes bias and ensures that the answer is grounded in the provided text. The GOT idea's pre-defined framework, while comprehensive, risks imposing external biases and overlooking nuances present in the text."
3,GOT_Representative,"Okay, here's my response as the GOT_Representative, elaborating on my core idea and critically evaluating the ROT idea:  **1. Elaboration on the GOT Idea and its Key Strengths:**  My core idea provides a structured framework for comparing and contrasting conventional and critical constructivism, focusing on their epistemological stances and the role of power. It directly addresses the instruction by providing a lens through which to analyze the provided text and identify key differences.  *   **Core Problem Addressed:** The core problem is to identify and articulate the differences between conventional and critical social constructivism based on the provided text, while also providing a deeper understanding of the underlying theoretical commitments of each perspective. *   **Key Strengths:**     *   **Provides a Theoretical Framework:** Unlike the ROT idea, which focuses solely on extracting information from the text, my approach provides a pre-existing theoretical framework. This framework helps to organize and interpret the information in the text, allowing for a more nuanced and insightful analysis. The framework provides categories for analysis (relationship to positivism, role of power, epistemology of truth), enabling a more comprehensive comparison.     *   **Facilitates Deeper Understanding:** By focusing on the epistemological foundations and the role of power, the framework facilitates a deeper understanding of the *reasons* behind the differences between the two perspectives. It moves beyond simply identifying differences to explaining *why* those differences exist.     *   **Addresses Implicit Assumptions:** The framework encourages the identification of implicit assumptions about the nature of reality, the role of the learner, and the purpose of education. This allows for a more critical and nuanced reading of the text.     *   **Promotes Critical Thinking:** The framework encourages critical thinking by prompting the user to consider the validity of knowledge claims and the social consequences of different perspectives.     *   **Adaptable Framework:** While providing structure, the framework is adaptable. The ""Applying to Text"" section explicitly instructs the user to look for evidence *within* the text to support or refute the framework's assumptions. This allows the text to guide the analysis within the provided structure.  **2. Critical Evaluation of the ROT Idea:**  The ROT idea prioritizes a direct, evidence-based approach, emphasizing textual fidelity and objectivity. While these are valuable qualities, the ROT idea has significant weaknesses compared to my GOT idea in the context of this specific task.  *   **Potential Weaknesses and Overlooked Aspects:**     *   **Lack of Theoretical Depth:** The ROT idea's primary weakness is its lack of a theoretical framework. By focusing solely on extracting information from the text, it risks producing a superficial analysis that simply lists differences without providing any deeper understanding of their significance. It's like listing symptoms without diagnosing the underlying disease.     *   **Passivity:** The ROT approach is passive; it waits for the text to ""speak for itself."" This can lead to a reactive rather than proactive analysis. The GOT idea, in contrast, actively probes the text for evidence related to key theoretical differences.     *   **Risk of Missing Implicit Assumptions:** The ROT idea's focus on explicit statements may lead it to overlook implicit assumptions and underlying theoretical commitments. The GOT idea, by explicitly asking about the nature of reality and the role of the learner, is more likely to uncover these hidden assumptions.     *   **Limited Analytical Power:** Without a framework, the ROT idea lacks the analytical power to synthesize the information in the text into a coherent and insightful comparison. It might identify differences, but it won't be able to explain *why* those differences exist or what their implications are.     *   **Vulnerability to Superficial Similarities:** The ROT approach might be misled by superficial similarities in language. For example, both conventional and critical constructivists might use the term ""social construction,"" but they mean very different things by it. The GOT idea's framework helps to distinguish between these different meanings.     *   **Inability to Evaluate Significance:** The ROT idea has no basis for evaluating the *significance* of different differences. Is one difference more important than another? Without a framework, it's impossible to say.  *   **Why My Approach Might Be Preferable:**     *   **Provides a Deeper, More Meaningful Analysis:** My GOT idea provides a deeper, more meaningful analysis by placing the text within a broader theoretical context. It allows for a more nuanced understanding of the differences between conventional and critical constructivism.     *   **Promotes Critical Thinking and Insight:** My approach encourages critical thinking and insight by prompting the user to consider the underlying assumptions and implications of different perspectives.     *   **Offers a More Structured and Organized Comparison:** The GOT idea's framework provides a clear structure for organizing and comparing the information in the text, making the analysis more coherent and accessible.     *   **More Proactive and Comprehensive:** The GOT approach is more proactive and comprehensive, actively probing the text for evidence related to key theoretical differences.     *   **Facilitates Generalizability:** While grounded in the text, the GOT framework allows for a level of generalizability. The categories established (relationship to positivism, role of power, epistemology) are relevant beyond this specific text and can be applied to other analyses of constructivist approaches.  In summary, while the ROT idea emphasizes textual fidelity, my GOT idea provides a more theoretically grounded, insightful, and comprehensive comparison of conventional and critical constructivism. The ROT idea's lack of a theoretical framework limits its analytical power and its ability to provide a deeper understanding of the differences between the two perspectives. My approach actively guides the analysis, promoting critical thinking and offering a more structured and meaningful interpretation of the text."
