Round,Speaker,Utterance
1,Moderator,"Debate Topic: In-depth discussion based on the mission context and ideas from ROT and LOT. Mission Context (partial): Instruction: How might the recent global economic crisis be viewed as a challenge to the liberalist perspective?  Context: [Governmental cyberspace restrictions, in the form of censorship and monitoring, are increasing., The crisis has revealed the failure of international cooperation to prevent a global catastrophe, in the form of massive economic collapse and contagion., All of these options., Increasing state involvement in key industrial and financial sectors, including nationalisation and state-funded development.]... Initial Core Idea from ROT (partial): Okay, here's a refined answer addressing the prompt, providing specific examples and explaining the liberal perspective:  **Refined Answer: Failures of Liberal Internationalism and Responses to the Global Economic Crisis**  The 2008 Global Financial Crisis (GFC) and its aftermath exposed several weaknesses in the liberal internationalist framework, particularly concerning international cooperation, cyberspace governance, and the role of the state in the economy.  **1. Failures in International Cooperation and Weaknesses of Liberal Internationalism:**  *   **Example: Limited Coordination on Fiscal Stimulus:**  While there was initial consensus among G20 nations to implement coordinated fiscal stimulus packages to combat the recession, the degree of commitment and the specific measures varied significantly.  Some countries, like Germany, were more hesitant to engage in large-scale stimulus, prioritizing fiscal austerity sooner than others. This lack of uniform action hindered the effectiveness of the global response.      *   **Liberal Internationalist Weakness Highlighted:** This demonstrates the limits of *voluntary cooperation* within a liberal internationalist framework.  Liberalism emphasizes state sovereignty and autonomy. While cooperation is encouraged, there's no overarching enforcement mechanism to ensure all states fully comply with agreed-upon strategies. The G20's reliance on voluntary commitments proved insufficient to achieve optimal global recovery. The crisis revealed that national interests often trumped collective action, even when a coordinated response would have been mutually beneficial.  *   **Example: Inadequate Regulation of Financial Institutions:**  The crisis was triggered by the collapse of Lehman Brothers, a US investment bank, due to its exposure to toxic mortgage-backed securities.  The lack of robust international regulatory standards and enforcement mechanisms allowed financial institutions to engage in risky behavior that ultimately destabilized the global economy.  Cross-border financial flows were largely unregulated, allowing the crisis to spread rapidly.      *   **Liberal Internationalist Weakness Highlighted:** This illustrates the inadequacy of *regulatory mechanisms* within the liberal internationalist system.  While liberal internationalism supports free markets and the free flow of capital, it often struggles to balance this with the need for effective regulation to prevent systemic risk. The crisis demonstrated that the existing international regulatory framework was too weak and fragmented to effectively monitor and control the activities of global financial institutions. The emphasis on deregulation, a hallmark of neoliberal policies often associated with liberal internationalism, arguably contributed to the crisis.  *   **Example: Currency Wars:** Following the crisis, some countries, particularly those with export-oriented economies, engaged in what became known as ""currency wars."" They intervened in foreign exchange markets to devalue their currencies, making their exports more competitive. This beggar-thy-neighbor policy undermined international cooperation and created tensions between nations.      *   **Liberal Internationalist Weakness Highlighted:** This demonstrates the tension between *free trade and national economic interests* within a liberal internationalist framework. While the framework promotes free trade, it struggles to prevent states from pursuing protectionist measures when faced with economic hardship. The currency wars highlighted the fragility of international cooperation when states prioritize their own economic recovery over the stability of the global economy.  **2. Governmental Cyberspace Restrictions and Contradiction of Liberal Principles:**  *   **Example: Increased Surveillance and Censorship:** While not directly *caused* by the GFC, the economic anxieties and social unrest that followed in some countries provided a pretext for governments to increase surveillance and censorship online. Some governments argued that these measures were necessary to maintain social order and prevent the spread of misinformation or dissent. Examples include increased monitoring of social media and the blocking of websites deemed critical of the government.      *   **Contradiction of Liberal Principles:** These actions directly contradict liberal principles of *freedom of speech, freedom of expression, and privacy*. Liberalism emphasizes the importance of individual rights and liberties, including the right to access information and express opinions without fear of government censorship or surveillance. Increased government control over the internet undermines these fundamental rights and creates a chilling effect on free expression.  *   **Example: Data Localization Requirements:** Some countries implemented data localization requirements, mandating that data generated within their borders be stored and processed locally. While often framed as measures to protect national security or privacy, these requirements can also be used to restrict the flow of information and protect domestic industries.      *   **Contradiction of Liberal Principles:** Data localization requirements contradict the liberal principle of *free flow of information* and can be seen as a form of digital protectionism. Liberalism emphasizes the importance of open and unrestricted access to information as essential for economic growth, innovation, and democratic participation. Data localization requirements can stifle innovation, increase costs for businesses, and limit access to information for citizens.  **3. Nationalizations and State-Funded Development Projects and Challenges to Limited Government:**  *   **Example: Bank Bailouts:**  Many governments, including the US and several European countries, nationalized or partially nationalized banks and financial institutions to prevent their collapse and stabilize the financial system.  This involved injecting massive amounts of public funds into failing institutions.      *   **Challenge to Limited Government:** This directly challenges the liberal principle of *limited government intervention in the economy*. Liberalism generally advocates for free markets and minimal state involvement in economic activity. However, the severity of the crisis forced governments to intervene on an unprecedented scale to prevent a complete economic meltdown. While some argue that these interventions were necessary to prevent a greater catastrophe, they represent a significant departure from the liberal ideal of a hands-off government.  *   **Example: Infrastructure Spending and Stimulus Packages:** Governments around the world implemented large-scale infrastructure spending programs and stimulus packages to boost economic growth and create jobs. These projects often involved significant government investment in areas such as transportation, energy, and technology.      *   **Challenge to Limited Government:** These projects challenge the liberal principle of *limited government spending and a balanced budget*. While liberals may support some government investment in infrastructure, they generally favor a smaller role for the state in directing economic activity. The large-scale stimulus packages implemented in response to the crisis involved significant government borrowing and spending, which can be seen as a departure from liberal fiscal principles.  *   **Example: State-Funded Development Banks:** Some countries expanded the role of state-funded development banks to provide financing for infrastructure projects and support strategic industries. These banks often operate with a mandate to promote national economic development, even if it means deviating from market-based principles.      *   **Challenge to Limited Government:** This challenges the liberal principle of *free markets and private sector-led growth*. Liberalism generally favors private sector investment and market-based allocation of resources. The expansion of state-funded development banks can be seen as a form of government intervention in the market that distorts competition and undermines private sector initiative.  **Why These Examples are Problematic from a Liberal Perspective:**  From a liberal perspective, these examples are problematic because they represent a departure from core liberal principles such as:  *   **Individual Liberty:** Increased surveillance and censorship restrict freedom of expression and privacy. *   **Free Markets:** Nationalizations, excessive government spending, and state-funded development projects distort market signals and undermine private sector initiative. *   **Limited Government:** The expansion of government power and intervention in the economy threatens individual freedom and economic efficiency. *   **Free Flow of Information:** Data localization requirements and other restrictions on the internet hinder the free flow of information and stifle innovation. *   **Rule of Law and Predictability:** Ad-hoc interventions and policy changes create uncertainty and undermine the rule of law, making it difficult for businesses to plan and invest.  While some liberals might argue that these interventions were necessary in the short term to prevent a greater catastrophe, they would also emphasize the importance of returning to a more liberal order as soon as possible. The challenge for liberal internationalism is to find a way to balance the need for international cooperation and effective regulation with the preservation of individual liberty, free markets, and limited government. The GFC highlighted the difficulties in achieving this balance and raised questions about the long-term viability of the liberal internationalist project.... Initial Detailed Plan from LOT (partial): Default LOT detailed plan for task: Refine the previous answer by providing specific examples of: 1) failures in international cooperation during the global economic crisis that highlight weaknesses in liberal internationalist frameworks (e.g., the limits of voluntary cooperation, inadequate regulatory mechanisms); 2) governmental cyberspace restrictions implemented during or after the crisis, and how they contradict liberal principles; and 3) nationalizations or state-funded development projects undertaken in response to the crisis, and how they challenge the liberal principle of limited government intervention. Explain why these examples are problematic from a liberal perspective. ...... The debate will now commence focusing on these ideas."
2,ROT_Representative,"Okay, here's my response as the ROT (Reversal of Thought) Representative, addressing the prompt and comparing my core idea to the LOT's detailed plan.  **1. Elaboration on Addressing the Core Problem and Highlighting Key Strengths:**  My core idea directly addresses the prompt – ""How might the recent global economic crisis be viewed as a challenge to the liberalist perspective?"" – by providing a structured analysis of specific events and policy responses to the 2008 Global Financial Crisis (GFC). The response is organized into three key areas:  *   **Failures in International Cooperation:** Demonstrates how the GFC revealed weaknesses in the liberal internationalist framework's ability to foster effective global cooperation, citing examples like limited fiscal stimulus coordination, inadequate financial regulation, and currency wars. *   **Governmental Cyberspace Restrictions:** Highlights how the crisis, or the anxieties it triggered, led to increased government control over the internet, contradicting core liberal principles of freedom of speech and information. *   **Nationalizations and State-Funded Development:** Shows how government interventions like bank bailouts and large-scale stimulus packages challenged the liberal principle of limited government intervention in the economy.  **Key Strengths:**  *   **Specificity:** The response provides concrete examples for each point, making the argument more persuasive and grounded in reality. For instance, instead of simply stating that international cooperation failed, it cites the example of Germany's hesitancy towards fiscal stimulus. *   **Direct Connection to Liberal Principles:** Each example is directly linked to a specific liberal principle (e.g., limited government, free markets, individual liberty, free flow of information). This makes the argument clear and avoids ambiguity. *   **Balanced Perspective:** While highlighting the challenges to liberalism, the response acknowledges that some interventions might have been necessary in the short term, demonstrating a nuanced understanding of the complexities involved. *   **Comprehensive Coverage:** The response covers a range of issues, including international cooperation, cyberspace governance, and economic policy, providing a holistic view of the challenges posed to the liberal perspective. *   **Clear Explanation of Liberal Weaknesses:** Each example clearly points out the specific weakness highlighted in the liberal internationalist system. For example, the currency wars highlight the fragility of international cooperation when states prioritize their own economic recovery over global stability.  **2. Critical Evaluation of the LOT Idea:**  The LOT's detailed plan is strong in that it provides a clear roadmap for structuring the response. It correctly identifies the key areas to be addressed: failures in international cooperation, governmental cyberspace restrictions, and nationalizations/state-funded development. It also correctly focuses on explaining how these examples challenge liberal principles and are problematic from a liberal perspective.  **Potential Weaknesses, Overlooked Aspects, or Limitations of the LOT Idea compared to my ROT idea:**  *   **Lack of Inherent Critical Analysis:** While the LOT plan outlines *what* to discuss, it doesn't inherently guarantee a critical or nuanced analysis. It's possible to follow the LOT's plan and still produce a superficial or descriptive answer. My ROT idea, by framing the response as ""Failures of Liberal Internationalism and Responses to the Global Economic Crisis,"" immediately sets a tone of critical examination. *   **Less Emphasis on Connecting Actions to Core Liberal Principles:** While the LOT mentions explaining how the examples contradict liberal principles, my ROT idea places stronger emphasis on *explicitly* connecting each example to a specific liberal principle. This ensures that the argument is always directly relevant to the prompt. *   **Potential for Oversimplification:** The LOT's plan, while well-structured, could lead to an oversimplified view of the relationship between the GFC and liberalism. My ROT idea, by acknowledging the potential short-term necessity of some interventions, encourages a more nuanced understanding of the complexities involved. *   **Less Proactive in Identifying 'Why Problematic':** While the LOT wants to explain why examples are problematic from a liberal perspective, my ROT plan includes an explicit section that summarizes these arguments in a bulleted list. This approach is more direct and easier to follow, reinforcing the core message. *   **The LOT plan is more of a blueprint, while the ROT is more of a refined answer.** The LOT plan is a set of instructions, while my ROT idea is a concrete example of how to follow those instructions and produce a high-quality response.  **Why My Approach Might Be Preferable:**  My approach is preferable because it goes beyond simply outlining *what* to discuss and provides a clear framework for *how* to analyze the relationship between the GFC and the liberal perspective. By providing specific examples, directly connecting them to liberal principles, and acknowledging the potential complexities involved, my approach produces a more persuasive, nuanced, and comprehensive response. It ensures that the response is not just informative but also critically engaging with the core issues at hand. It proactively identifies the problematic aspects from a liberal perspective, making the argument clearer and more impactful. My approach provides a complete, ready-to-use response, whereas the LOT plan is more of a starting point."
3,LOT_Representative,"Okay, here's my response as the LOT Representative, addressing the prompt and critically evaluating the ROT idea in relation to my detailed plan.  **1. Elaboration on Addressing the Core Problem and Highlighting Key Strengths and Feasibility:**  My detailed plan directly and effectively addresses the core problem posed by the prompt: ""How might the recent global economic crisis be viewed as a challenge to the liberalist perspective?"" It does so by providing a structured framework for analyzing the crisis's impact on key tenets of liberalism.  **Key Strengths:**  *   **Direct Alignment with the Prompt:** The plan explicitly outlines the need to identify specific examples related to failures in international cooperation, cyberspace restrictions, and state intervention, all areas directly relevant to evaluating the challenges to the liberalist perspective. This ensures that the response remains focused and avoids tangential discussions. *   **Comprehensive Coverage:** The plan covers the major domains where the GFC challenged liberal principles: international relations (cooperation), domestic policy (cybersecurity), and economic policy (state intervention). This provides a holistic and well-rounded perspective. *   **Emphasis on Specific Examples:** The plan mandates the use of ""specific examples,"" ensuring that the response is grounded in real-world events and policies, rather than abstract generalizations. This makes the argument more persuasive and credible. *   **Focus on Explaining Contradictions:** A core element of the plan is to ""explain how these examples contradict liberal principles."" This guarantees that the response directly addresses the prompt's central question by highlighting the tension between the crisis response and liberal ideology. *   **Clarity and Structure:** The plan provides a clear and logical structure for the response, making it easy to understand and follow. This enhances the overall effectiveness of the communication. *   **Feasibility:** The plan is highly feasible. It breaks down the complex task into manageable components. Identifying examples and explaining contradictions are tasks that can be readily executed given sufficient knowledge of the GFC and liberal theory.  **Feasibility:**  The plan's feasibility is enhanced by its clear structure and specific requirements. It's a roadmap that can be easily followed by someone with a decent understanding of the 2008 financial crisis and the basic tenets of liberalism. The search for examples within each category (international cooperation, cyberspace, state intervention) is a well-defined task, and explaining the contradictions between these examples and liberal principles is a straightforward analytical exercise. The plan doesn't require any leaps of imagination or complex theoretical constructs; it simply requires a systematic application of knowledge and analytical skills.  **2. Critical Evaluation of the ROT Idea:**  While the ROT idea provides a strong initial answer, it also has potential weaknesses and limitations compared to my LOT plan.  **Potential Weaknesses, Overlooked Aspects, or Limitations of the ROT Idea compared to my LOT idea:**  *   **Potential for Being Overly Descriptive Rather Than Analytical:** The ROT idea, while providing examples, might lean towards simply describing events rather than deeply analyzing *why* they pose a challenge to liberalism. My LOT plan specifically emphasizes *explaining* the contradictions, pushing for a more analytical approach. The ROT answer *shows* the contradictions, but the LOT plan mandates *explaining* them, forcing a deeper level of engagement. *   **Risk of Confirmation Bias:** The ROT answer, presented as a ""refined answer,"" might be prone to confirmation bias. It already has a pre-determined conclusion (failures of liberal internationalism) and might selectively focus on examples that support this conclusion, while overlooking counter-arguments or alternative interpretations. My LOT plan, as a more open-ended framework, encourages a more balanced and objective assessment of the evidence. *   **Limited Scope for Original Thought:** The ROT idea, by providing a complete answer, might stifle original thought and prevent the exploration of alternative perspectives. My LOT plan, as a more flexible framework, allows for greater creativity and the incorporation of new insights. The ROT answer is a finished product, while the LOT plan is an invitation to further exploration. *   **Lack of Adaptability:** The ROT answer is a static document that cannot be easily adapted to new information or changing circumstances. My LOT plan, as a more flexible framework, can be readily updated and modified as needed. *   **Over-Reliance on Pre-Selected Examples:** The ROT idea relies on a limited set of pre-selected examples. My LOT plan encourages a broader search for examples, potentially uncovering more compelling or nuanced cases that better illustrate the challenges to liberalism. The ROT answer is limited by its initial choice of examples, while the LOT plan allows for a more comprehensive and representative selection. *   **Less Emphasis on the 'Why Problematic' aspect in the examples themselves:** While the ROT idea does provide a summary of why these examples are problematic, it does not necessarily explicitly state this in each example. The LOT plan intends for each example to be explicitly linked to a liberal principle being challenged *within the example itself*.  **Why My Approach Might Be Preferable:**  My LOT plan is preferable because it provides a more structured, analytical, objective, and adaptable approach to addressing the prompt. While the ROT idea offers a good starting point, my plan ensures a more rigorous and comprehensive examination of the challenges posed by the GFC to the liberalist perspective. It encourages deeper analysis, reduces the risk of bias, promotes original thought, and allows for greater flexibility in responding to new information. My plan focuses more on the process of answering the question, which leads to a more robust and well-supported answer. My plan is a more effective method for ensuring that the prompt is answered thoroughly, accurately, and persuasively."
