Round,Speaker,Utterance
1,Moderator,"Debate Topic: In-depth discussion based on the mission context and ideas from ROT and GOT. Mission Context (partial): Instruction: How can the origins of weak state insecurity be explained?  Context: The following are multiple choice options:[Weak state insecurity in a historical framework of analysis represents an abnormal state in the long term state-building process. Bloody and violent conflict between social forces is not consistent with the presence of the centralizing force with the capacity to attain monopoly of control over violence., The utility of explaining weak state insecurity with a comparison to the historical conditions of state consolidation in Europe does not stand in the contemporary context of global society because of the pervasion of international norms to prevent violent conflict from manifesting in the consolidation process., The contemporary state-building condition is constrained by the shortened time-frame operating within the established guidelines of international norms, a particular problematic rule of which is sovereignty. Thus, unlike some European entities which could not complete the state-building process and were absorbed into more viable units, weak states will remain quasi entities., Weak state insecurity originated from the denial of sovereignty as the norm and the corresponding extension of the right to inviolability of statehood. Without protection under international laws the possibility of its national status being revoked and its territory being subsumed into another state threatens the consolidation of the state-building process.]... Initial Core Idea from ROT (partial): Okay, here's the breakdown and solution to the problem, following the defined framework:  **Analysis of the Options:**  *   **Option 1: ""Weak state insecurity in a historical framework of analysis represents an abnormal state in the long term state-building process. Bloody and violent conflict between social forces is not consistent with the presence of the centralizing force with the capacity to attain monopoly of control over violence.""** This option highlights the historical perspective, suggesting that weak states are abnormal in the context of long-term state-building. It emphasizes the absence of a centralizing force capable of monopolizing violence.  This is a valid point, but it doesn't fully capture the *origins* in the contemporary context.  *   **Option 2: ""The utility of explaining weak state insecurity with a comparison to the historical conditions of state consolidation in Europe does not stand in the contemporary context of global society because of the pervasion of international norms to prevent violent conflict from manifesting in the consolidation process.""** This option argues against directly comparing contemporary weak states to historical European state-building, citing the influence of international norms that supposedly prevent violent consolidation.  This is partially true; international norms do play a role, but they don't always prevent conflict, and they can also *constrain* state-building in other ways.  *   **Option 3: ""The contemporary state-building condition is constrained by the shortened time-frame operating within the established guidelines of international norms, a particular problematic rule of which is sovereignty. Thus, unlike some European entities which could not complete the state-building process and were absorbed into more viable units, weak states will remain quasi entities.""** This option is crucial. It points out that contemporary state-building is constrained by shorter timeframes and international norms, particularly the principle of sovereignty.  It suggests that weak states are prevented from consolidating through violent means (as some European states did historically) and are instead kept as ""quasi entities."" This option directly addresses the *origins* of weak state insecurity in the contemporary context.  *   **Option 4: ""Weak state insecurity originated from the denial of sovereignty as the norm and the corresponding extension of the right to inviolability of statehood. Without protection under international laws the possibility of its national status being revoked and its territory being subsumed into another state threatens the consolidation of the state-building process.""** This option is also strong. It argues that the *denial* of sovereignty (or, more accurately, the *conditional* nature of sovereignty) and the lack of protection under international law contribute to weak state insecurity. It highlights the vulnerability of these states to external threats and internal instability.  **Identifying the Best Explanation:**  Options 3 and 4 are the strongest. Option 3 focuses on the *constraints* imposed by international norms, particularly sovereignty, which prevent weak states from consolidating in the same way as historical European states. Option 4 focuses on the *conditional* nature of sovereignty and the lack of protection under international law.  Option 3 is slightly better because it more directly addresses the *origins* in the contemporary context. The international system, with its norms and constraints, plays a significant role in shaping the trajectory of weak states. While the lack of protection under international law (Option 4) is a consequence of this, the underlying constraint is the key.  **Output:**  Weak state insecurity originates from the constraints imposed by contemporary international norms, particularly the principle of sovereignty, which prevents weak states from consolidating through means historically available to stronger states, resulting in their continued existence as quasi-entities vulnerable to internal and external pressures.... Initial Core Idea from GOT (partial): Based on the instructions, context, and the need to identify the most accurate explanation for the origins of weak state insecurity from the provided options, here's a breakdown of why each option is more or less suitable and the final answer:  **Analysis of Options:**  *   **Option 1: Weak state insecurity in a historical framework of analysis represents an abnormal state in the long term state-building process. Bloody and violent conflict between social forces is not consistent with the presence of the centralizing force with the capacity to attain monopoly of control over violence.**     *   *Strengths:*  This touches on a key aspect: the state's failure to establish a monopoly of violence, a core characteristic of statehood.     *   *Weaknesses:*  It presents weak statehood as an ""abnormal"" state, which isn't always accurate. It also oversimplifies the causes, implying it's solely about internal violence.  *   **Option 2: The utility of explaining weak state insecurity with a comparison to the historical conditions of state consolidation in Europe does not stand in the contemporary context of global society because of the pervasion of international norms to prevent violent conflict from manifesting in the consolidation process.**     *   *Strengths:* Acknowledges the difference between historical European state-building and contemporary challenges. Highlights the role of international norms.     *   *Weaknesses:*  Overstates the effectiveness of international norms in preventing violent conflict.  It doesn't directly address the *origins* of weak state insecurity, but rather argues against a particular comparative approach. It also incorrectly assumes that international norms are effective at preventing violent conflict.  *   **Option 3: The contemporary state-building condition is constrained by the shortened time-frame operating within the established guidelines of international norms, a particular problematic rule of which is sovereignty. Thus, unlike some European entities which could not complete the state-building process and were absorbed into more viable units, weak states will remain quasi entities.**     *   *Strengths:*  Points out the time constraints and the impact of international norms, particularly sovereignty, on state-building. Acknowledges how these constraints prevent natural consolidation.     *   *Weaknesses:*  Focuses more on the *continuation* of weak statehood rather than its *origins.* Also doesn't touch on internal dynamics.  *   **Option 4: Weak state insecurity originated from the denial of sovereignty as the norm and the corresponding extension of the right to inviolability of statehood. Without protection under international laws the possibility of its national status being revoked and its territory being subsumed into another state threatens the consolidation of the state-building process.**     *   *Strengths:* Highlights the critical role of sovereignty and international recognition (or lack thereof) in state security. Directly addresses the origins.     *   *Weaknesses:*  Focuses primarily on external threats and doesn't fully account for internal factors contributing to insecurity. It also assumes a denial of sovereignty which is not often the case.  **Synthesis and Justification:**  Option 3 is the best answer because it most accurately captures the origins of weak state insecurity, with consideration of the other options. It correctly identifies the contemporary state-building condition as constrained by the shortened time-frame operating within the established guidelines of international norms, a particular problematic rule of which is sovereignty.  **Final Answer:**  The best answer is **Option 3**. ... The debate will now commence focusing on these ideas."
2,ROT_Representative,"Okay, here's my response as the ROT_Representative, elaborating on my core idea and critically evaluating the GOT idea:  **1. Elaboration on the ROT Idea and its Strengths**  My core idea pinpoints the *origins* of weak state insecurity in the contemporary international system. It argues that the constraints imposed by international norms, specifically the principle of sovereignty, are paramount. This is because:  *   **It directly addresses the prompt:** The instruction asks for the *origins* of weak state insecurity. My analysis focuses on the contemporary context where international norms exert significant influence, making it highly relevant. *   **It acknowledges the altered state-building landscape:** Unlike historical state-building processes in Europe (often violent and prolonged), contemporary state-building is subject to a different set of rules and expectations. Weak states are often prevented from consolidating through traditional means (e.g., internal warfare leading to a dominant power) due to international pressure and the principle of sovereignty. *   **It highlights the ""quasi-entity"" status:** This status is crucial. Weak states are often kept alive, even if dysfunctional, due to the international norm of sovereignty, preventing them from being absorbed or collapsing entirely. This creates a situation where they remain vulnerable and insecure. *   **It identifies the root cause of vulnerability:** While internal factors (e.g., lack of a monopoly of violence) are important, the *reason* these factors persist is often linked to the constraints imposed by the international system. Sovereignty, while intended to protect, can also trap weak states in a cycle of dependence and instability.  **Key Strengths:**  *   **Focus on Contemporary Origins:** It emphasizes the *contemporary* origins of weak state insecurity, which is crucial for understanding current challenges. *   **Systemic Perspective:** It considers the international system and its norms as key drivers, providing a broader perspective than solely focusing on internal dynamics. *   **Addresses the Constraint of Sovereignty:** It highlights the problematic aspect of sovereignty as a constraint on state consolidation. *   **Explains the Persistence of Weak States:** It explains why weak states persist as ""quasi entities"" instead of being absorbed or collapsing.  **2. Critical Evaluation of the GOT Idea**  The GOT idea correctly identifies Option 3 as the best answer. However, its analysis and justification have some weaknesses and overlook certain aspects:  *   **GOT's Analysis of Option 1:** GOT accurately states that Option 1 presents weak statehood as an ""abnormal"" state, which isn't always accurate. However, it doesn't fully acknowledge that the option's focus is primarily historical, making it less relevant to the *origins* of *contemporary* weak state insecurity. *   **GOT's Analysis of Option 2:** GOT overstates the effectiveness of international norms in *preventing* violent conflict. While international norms aim to prevent conflict, they often fail, and focusing solely on this aspect overlooks the *constraining* role of these norms on state consolidation. *   **GOT's Analysis of Option 3:** GOT claims that Option 3 focuses more on the *continuation* of weak statehood rather than its *origins.* I disagree. Option 3 directly links the *origins* of weak state insecurity to the constraints imposed by international norms. The *continuation* is a consequence of those origins. GOT also states it doesn't touch on internal dynamics. While the option itself doesn't explicitly mention internal dynamics, the analysis should acknowledge that these dynamics are indirectly affected by the constraints. *   **GOT's Analysis of Option 4:** GOT claims that option 4 assumes a *denial* of sovereignty which is not often the case. This is a valid point. It's more accurate to describe the situation as a *conditional* sovereignty. *   **Overlooked Aspect: Conditional Sovereignty:** The GOT analysis doesn't fully explore the concept of *conditional sovereignty*. Many weak states are granted sovereignty but are heavily reliant on international aid and support, making their sovereignty conditional. This dependence can perpetuate insecurity. *   **Limited Focus on the Interplay of Internal and External Factors:** While GOT mentions both internal and external factors, it doesn't fully explore the interplay between them. The constraints imposed by the international system can exacerbate internal problems, creating a vicious cycle of insecurity.  **Why the ROT Approach is Preferable:**  My approach is preferable because it offers a more nuanced and comprehensive understanding of the *origins* of weak state insecurity in the contemporary context. It emphasizes the constraining role of international norms, particularly sovereignty, and how these constraints shape the trajectory of weak states. It also acknowledges the complexity of the issue by recognizing the interplay between internal and external factors. The GOT analysis, while correct in identifying the best answer, lacks the depth and nuance needed to fully understand the underlying dynamics. By focusing on the *constraints* rather than just the *prevention* of conflict, my approach provides a more accurate and insightful explanation."
3,GOT_Representative,"Okay, here's my response as the GOT_Representative, elaborating on my core idea and critically evaluating the ROT idea:  **1. Elaboration on the GOT Idea and its Strengths**  My core idea, as the GOT representative, emphasizes a structured analysis of the provided options to determine the most accurate explanation for the origins of weak state insecurity. This approach focuses on dissecting each option's strengths and weaknesses to arrive at the optimal choice. This is achieved through:  *   **Directly addressing the prompt:** The instruction asks for the *origins* of weak state insecurity, and my analysis directly evaluates how each option addresses this question. *   **Providing a balanced assessment:** Each option is evaluated for its strengths and weaknesses, acknowledging the valid points each makes while highlighting their limitations. This is important because it avoids dismissing potentially relevant factors. *   **Identifying the most comprehensive explanation:** By weighing the strengths and weaknesses of each option, the analysis identifies Option 3 as the most comprehensive explanation, acknowledging its focus on contemporary constraints imposed by international norms and sovereignty. *   **Synthesizing information:** The analysis doesn't simply pick an option; it synthesizes the information to provide a justification for the final answer. The justification explains *why* Option 3 is superior, demonstrating a deeper understanding of the nuances involved.  **Key Strengths:**  *   **Structured Approach:** The analysis provides a clear and structured method for evaluating complex information and arriving at a reasoned conclusion. *   **Balanced Assessment:** It avoids oversimplification by acknowledging the strengths and weaknesses of each option. *   **Comprehensive Justification:** The justification provides a clear rationale for selecting Option 3, demonstrating a deeper understanding of the underlying dynamics. *   **Focus on Identifying the *Most* Accurate Explanation:** The approach is geared toward finding the *best* explanation from the provided options, rather than simply finding a *good* explanation.  **Potential Weaknesses & Overlooked Aspects:**  The primary weakness of my initial GOT response is that while it correctly identifies the best answer and provides a structured analysis, it could be accused of being *too* focused on the *process* of selection rather than the *substance* of the issue. It lays out a framework for evaluation, but it could benefit from a deeper dive into the complexities of state-building and the nuances of international norms.  The initial GOT response also overlooks the potential for a more nuanced understanding of the interplay between internal and external factors. While it acknowledges that Option 4 focuses primarily on external threats, it doesn't fully explore how these external threats can exacerbate internal vulnerabilities, leading to a vicious cycle of insecurity. It also doesn't fully address the conditional nature of sovereignty, which is a critical aspect of weak state insecurity.  **2. Critical Evaluation of the ROT Idea**  The ROT idea provides a more substantive analysis of the issue, elaborating on the constraints imposed by international norms and sovereignty. However, it also has weaknesses and overlooks certain aspects compared to a refined version of the GOT idea:  *   **ROT's Focus on Constraints vs. Origins:** While ROT emphasizes that it addresses the *origins* of weak state insecurity, its analysis leans heavily on the *constraints* imposed by international norms. While these constraints *contribute* to the origins, they are not the sole cause. The GOT approach, by considering a broader range of factors (even if briefly) in its analysis of each option, is more attuned to a multi-causal explanation. *   **ROT's Dismissal of Option 1:** ROT correctly notes that Option 1 is primarily historical. However, the historical context *does* matter. Ignoring the historical trajectory of state-building processes can lead to an incomplete understanding of contemporary challenges. The GOT approach, by acknowledging the strengths of Option 1 (its focus on the monopoly of violence), avoids completely dismissing this historical perspective. *   **ROT's Overemphasis on International Norms:** While international norms are undoubtedly important, ROT's analysis risks overemphasizing their role and understating the significance of internal factors. The GOT approach, by considering the internal factors mentioned in Option 1 (failure to establish a monopoly of violence) and Option 4 (internal instability), provides a more balanced perspective. *   **ROT's Analysis of Sovereignty:** While ROT acknowledges the *conditional* nature of sovereignty, it doesn't fully explore the implications of this conditionality. Many weak states are heavily reliant on international aid and support, making their sovereignty contingent upon maintaining good relations with donor countries. This dependence can create vulnerabilities that undermine their security.  **Why a Refined GOT Approach is Preferable:**  A refined GOT approach, incorporating a deeper understanding of the substantive issues and a more nuanced analysis of the interplay between internal and external factors, is preferable because it provides a more comprehensive and balanced explanation for the origins of weak state insecurity. While ROT offers a valuable analysis of the constraints imposed by international norms, it risks oversimplifying the issue by focusing too heavily on this one factor. The GOT approach, with its structured evaluation of multiple perspectives, is better equipped to capture the complexity of the issue and arrive at a more nuanced and accurate explanation. The key is to combine the structured approach of GOT with the deeper substantive knowledge demonstrated by ROT. This allows for both a rigorous analysis of the available information and a thorough understanding of the underlying dynamics."
