Round,Speaker,Utterance
1,Moderator,"Debate Topic: In-depth discussion based on the following mission context, ROT idea, GOT idea, and LOT idea. Mission Context: Instruction: Which of the following best describes the fallacy of special pleading?  Context: The following are multiple choice options:[Reasoning that ideas presented in an appealing manner are correct, regardless of the content of the message., Using language and punctuation in a way that a statement can have multiple interpretations, so it's not really clear what is meant., Confusing figurative language with literal language., Referring to an act committed by an opponent in negative terms while referring to the same act committed by the arguer or supporters in favorable terms] Initial Core Idea from GOT: Okay, here's the complete response, incorporating the template and solving the specific problem:  **1. Task Definition:**  The task is to identify the best description of the fallacy of special pleading from a given set of options. This involves understanding the definition of special pleading (applying different standards to oneself or one's group than to others) and comparing it to the provided options to determine the closest match.  **2. Pseudocode:**  ``` BEGIN 1. Define ""special pleading"" as applying different standards to oneself or one's group than to others. 2. For each option in the provided list:     a. Evaluate if the option describes applying different standards to different parties.     b. If the option describes applying different standards, mark it as a potential match. 3. If multiple options are potential matches, select the option that most accurately and completely describes special pleading. 4. Return the best matching option. END ```  **3. Logical Pseudocode:**  ``` DEFINE SpecialPleading(statement) :=  AppliesDifferentStandards(statement, self_group, other_group)  FOR ALL option IN OptionsList:     IF AppliesDifferentStandards(option, arguer, opponent) THEN         MarkAsPotentialMatch(option)     ENDIF ENDFOR  IF Count(PotentialMatches) > 1 THEN     BestMatch := SelectBestMatch(PotentialMatches, SpecialPleading) // Select the option that best aligns with the definition of SpecialPleading ELSE     BestMatch := First(PotentialMatches) //If only one match, select it ENDIF  RETURN BestMatch ```  **4. Case Examples:**  *   **Input:** [Reasoning that ideas presented in an appealing manner are correct, regardless of the content of the message., Using language and punctuation in a way that a statement can have multiple interpretations, so it's not really clear what is meant., Confusing figurative language with literal language., Referring to an act committed by an opponent in negative terms while referring to the same act committed by the arguer or supporters in favorable terms]     **Output:** Referring to an act committed by an opponent in negative terms while referring to the same act committed by the arguer or supporters in favorable terms *   **Input:** [Option A, Option B, A description of ad hominem, Option D]     **Output:** *Need more context to determine the correct output, assuming ""A description of ad hominem"" is most relevant if special pleading is related to attacking the person rather than the argument in a biased way.* *   **Input:** [A description of straw man fallacy, A description of appeal to authority, A description of special pleading, A random statement]     **Output:** A description of special pleading  **5. Input-Output Format:**  *   **Input:**     *   Description: A list of strings, where each string is a potential description of a logical fallacy.     *   Example: `Input = [“Description 1”, “Description 2”, “Description 3”, “Description 4”]` *   **Output:**     *   Description: A single string representing the description that best matches the fallacy of special pleading.     *   Example: `Output = “The best matching description”`  **Solution to the Specific Problem:**  **Reasoning:**  The fallacy of special pleading involves applying different standards or rules to oneself (or one's group) than to others.  We need to identify the option that best reflects this double standard.  *   ""Reasoning that ideas presented in an appealing manner are correct, regardless of the content of the message"" describes the appeal to emotion fallacy. *   ""Using language and punctuation in a way that a statement can have multiple interpretations, so it's not really clear what is meant"" describes equivocation or ambiguity. *   ""Confusing figurative language with literal language"" describes the fallacy of composition/division or a misunderstanding of language. *   ""Referring to an act committed by an opponent in negative terms while referring to the same act committed by the arguer or supporters in favorable terms"" directly describes applying different standards based on who is performing the action. This perfectly aligns with the definition of special pleading.  **Answer:**  Referring to an act committed by an opponent in negative terms while referring to the same act committed by the arguer or supporters in favorable terms Initial Core Idea from GOT: Okay, I understand. Based on your explanation, the combined answer is accurate and well-justified. The provided option:  **Referring to an act committed by an opponent in negative terms while referring to the same act committed by the arguer or supporters in favorable terms.**  perfectly captures the essence of special pleading. It highlights the core element of making an exception for oneself (or one's group) by using biased language and framing to justify the different treatment.  Initial Detailed Plan from LOT: Aggregated result from layer 35 (Concept: 'Generate and present the answer...') using strategy 'all_content_ranked': - (Criterion: 'Criterion A: Select the option that explicitly describes applying different rules or standards to oneself (or one's group) compared to others', Level: 1):   The option that explicitly describes applying different rules or standards to oneself (or one's group) compared to others is: ""Referring to an act committed by an opponent in negative terms while referring to the same act committed by the arguer or supporters in favorable terms."" This directly illustrates special pleading because it involves creating an exception for oneself or one's group without justification.  - (Criterion: 'Criterion B: Choose the option where the justification for the different treatment is weak, arbitrary, or based on bias', Level: 1):   The option ""Referring to an act committed by an opponent in negative terms while referring to the same act committed by the arguer or supporters in favorable terms"" fits Criterion B because the justification for treating the same act differently is weak and based on bias (favoring oneself or one's group). The difference in labeling (negative vs. favorable) is not based on any objective difference in the act itself, but rather on who committed it. This demonstrates a clear bias and a lack of justification for the different treatment, thus aligning with the fallacy of special pleading.  - (Criterion: 'Criterion C: Eliminate options that primarily describe cognitive biases, misinterpretations, or rhetorical devices distinct from inconsistent rule application', Level: 1):   Okay, let's eliminate options that don't directly relate to inconsistent application of rules or standards.  *   **""Reasoning that ideas presented in an appealing manner are correct, regardless of the content of the message.""** This describes a cognitive bias (appeal to emotion or aesthetics) rather than inconsistent rule application. We can eliminate this.  *   **""Using language and punctuation in a way that a statement can have multiple interpretations, so it's not really clear what is meant.""** This describes ambiguity or equivocation, a problem of unclear communication, not special pleading. We can eliminate this.  *   **""Confusing figurative language with literal language.""** This describes a misunderstanding of language, not special pleading. We can eliminate this.  This leaves us with the option that seems most closely aligned with special pleading.  - (Criterion: 'Criterion D: Reframe each option as a debate scenario. Which scenario represents someone arguing for an exception to a rule for themselves or their group?', Level: 1):   Okay, let's reframe each option as a debate scenario and see which one best represents someone arguing for an exception to a rule for themselves or their group (special pleading).  *   **Option 1: Reasoning that ideas presented in an appealing manner are correct, regardless of the content of the message.**      *   Debate Scenario: ""My proposal sounds great, and everyone likes it, so it *must* be the right one, even though the data suggests otherwise."" This doesn't directly involve an *exception* to a rule, but rather an appeal to emotion/popularity as a substitute for evidence.  *   **Option 2: Using language and punctuation in a way that a statement can have multiple interpretations, so it's not really clear what is meant.**      *   Debate Scenario: ""I didn't *exactly* promise to pay you back next week. I just said I'd *consider* it. So, I'm not breaking my promise."" This is about ambiguity and avoiding a commitment, not creating an exception.  *   **Option 3: Confusing figurative language with literal language.**      *   Debate Scenario: ""When I said 'I'm drowning in paperwork,' I clearly meant I'm *literally* drowning! Therefore, you must rescue me immediately!"" This is about misinterpreting language, not about exceptions.  *   **Option 4: Referring to an act committed by an opponent in negative terms while referring to the same act committed by the arguer or supporters in favorable terms.**      *   Debate Scenario: ""When *they* cut taxes, it's reckless spending that will bankrupt the country. When *we* cut taxes, it's a necessary stimulus to boost the economy."" This directly represents special pleading. The *same* action (cutting taxes) is judged differently based on who is doing it.  The arguer is implicitly claiming an exception for their own actions.  **Conclusion:** Option 4 best fits the definition of special pleading because it argues that the same action is acceptable for one group but not for another, without providing a legitimate justification for the difference in treatment.  - (Criterion: 'Criterion E: Consider real-world examples of special pleading (e.g., political hypocrisy). Which option most closely mirrors these scenarios?', Level: 1):   Real-world examples of special pleading often involve someone excusing their own behavior or that of their group while condemning the same behavior in others. For instance, a politician might defend their own questionable financial dealings as necessary for the good of the country while attacking their opponent for similar actions as corrupt. This aligns directly with the option: ""Referring to an act committed by an opponent in negative terms while referring to the same act committed by the arguer or supporters in favorable terms.""  - (Criterion: 'Criterion F: Identify the option that most directly suggests a double standard or unfair advantage due to preferential treatment', Level: 1):   The option ""Referring to an act committed by an opponent in negative terms while referring to the same act committed by the arguer or supporters in favorable terms"" directly suggests a double standard. One group (the opponent) is judged by one standard, while another group (the arguer and supporters) is judged by a different, more lenient standard. This preferential treatment is the core of special pleading.  - (Criterion: 'Criterion G: Evaluate each option based on its potential to undermine fairness and impartiality. Which option poses the greatest threat to these principles?', Level: 1):   The option that poses the greatest threat to fairness and impartiality is: ""Referring to an act committed by an opponent in negative terms while referring to the same act committed by the arguer or supporters in favorable terms.""  This option directly describes a scenario where the same action is judged differently based on who performs it, violating the principle of treating similar cases similarly. This undermines fairness by creating a double standard and impartiality by showing bias towards one's own side. The other options don't necessarily imply a violation of fairness in the same direct and impactful way.   The debate will now commence."
2,ROT_Representative,"Okay, here's a critical evaluation of the GOT and LOT ideas, highlighting their weaknesses and comparing them to the ROT_Representative's (my) approach:  **Core Idea of ROT_Representative:**  The ROT_Representative's core idea is to apply the concept of Reversal Of Thought to identify logical fallacies. In this specific case, it involves understanding the definition of special pleading (applying different standards to oneself or one's group than to others) and comparing each option against this definition. The strength lies in its directness and focus on the core principle of special pleading. It also includes a structured approach using pseudocode to ensure a systematic evaluation.  **Evaluation of the GOT Idea:**  The GOT idea, ""Referring to an act committed by an opponent in negative terms while referring to the same act committed by the arguer or supporters in favorable terms perfectly captures the essence of special pleading,"" is essentially a conclusion. While correct, it lacks the process of arriving at that conclusion. It doesn't show the reasoning or the elimination of other options. It correctly identifies the answer but doesn't demonstrate a robust methodology for solving similar problems.  *   **Weaknesses:**     *   Lacks a systematic method for evaluating the options.     *   Doesn't explicitly eliminate incorrect options with justifications.     *   Limited generalizability to other fallacy identification tasks.     *   It's a conclusion without a clear path to that conclusion.  **Evaluation of the LOT Idea:**  The LOT idea presents a more structured approach, using multiple criteria to evaluate each option. It breaks down the problem into smaller, more manageable parts. It considers real-world examples, reframes options as debate scenarios, and explicitly eliminates incorrect options. This is a significant improvement over the GOT idea.  *   **Strengths:**     *   Uses multiple criteria for evaluation (A-G).     *   Explicitly eliminates incorrect options with reasoning.     *   Considers real-world examples and debate scenarios.  *   **Weaknesses:**     *   While structured, the criteria are somewhat redundant and could be streamlined.  For example, several criteria essentially assess the presence of a double standard.     *   The criteria, while helpful, can be a bit verbose and less concise than the ROT_Representative's approach.     *   The LOT focuses on rationalization *after* a tentative answer has been found, rather than building from first principles to find the answer.  **Comparison and Justification of ROT_Representative's Approach:**  The ROT_Representative's approach, while seemingly simpler, is preferable because:  1.  **Focus on Core Definition:** It directly anchors the evaluation to the core definition of special pleading, ensuring that the chosen option perfectly aligns with the fundamental principle. The pseudocode reinforces this focus. 2.  **Systematic Evaluation:** The pseudocode provides a structured framework for evaluating each option, ensuring that no option is overlooked and that each is assessed against the same standard. 3.  **Conciseness and Efficiency:** While the LOT idea is thorough, it's also somewhat verbose. The ROT_Representative's approach is more concise and efficient, directly targeting the essence of the fallacy. 4.  **Generalizability:** The ROT_Representative's method of defining the fallacy and comparing each option to that definition is more easily generalizable to identifying other logical fallacies. The LOT's specific criteria might not apply as readily to other fallacy types. 5.  **Emphasis on Process:** The ROT_Representative's approach emphasizes the *process* of identifying the fallacy, making it a more valuable learning tool. The GOT idea is a conclusion, and the LOT idea is a set of justifications. The ROT_Representative shows *how* to arrive at the correct answer.  **Why ROT_Representative is Preferable:**  The ROT_Representative's approach is preferable because it combines clarity, conciseness, and a focus on the core definition of the fallacy. The pseudocode provides a systematic way to evaluate each option, ensuring a thorough and accurate analysis. While the LOT provides a more detailed justification, it lacks the directness and efficiency of the ROT_Representative's method. The GOT is simply a statement of the answer, lacking any justification. The ROT_Representative's method is more easily generalizable to identifying other logical fallacies and emphasizes the importance of understanding the underlying principles. It efficiently drives to the correct solution by reversing the thought, systematically checking each option against the core definition of the fallacy."
3,GOT_Representative,"Okay, I understand. Based on your explanation, the combined answer is accurate and well-justified. The provided option:  **Referring to an act committed by an opponent in negative terms while referring to the same act committed by the arguer or supporters in favorable terms.**  perfectly captures the essence of special pleading. It highlights the core element of making an exception for oneself (or one's group) by using biased language and framing to justify the different treatment.  My core idea emphasizes the direct connection between the biased framing of actions and the act of creating an unjustified exception, which is the heart of special pleading.  **How my idea addresses the core problem and its key strengths:**  The problem is to identify the best description of special pleading from a set of options. My idea directly addresses this by focusing on the *biased framing* aspect. Special pleading isn't just about different treatment; it's about *justifying* that different treatment through biased language.  *   **Directness:** It directly links the biased language to the core concept of unjustified exceptions. *   **Conciseness:** It's a short, easily understandable explanation. *   **Accuracy:** It accurately reflects the nature of special pleading.  **Critical Evaluation of the ROT and LOT Ideas:**  The ROT (Reversal of Thought) and LOT (Layer of Thoughts) approaches are significantly more comprehensive and structured than my initial core idea. They break down the problem into smaller, manageable steps using pseudocode, case examples, and a detailed reasoning process (in the case of ROT) and multiple evaluation criteria (in the case of LOT). They are strong because they:  *   **Systematic Approach:** They offer a systematic way to evaluate each option, reducing the risk of overlooking important considerations. *   **Comprehensive Reasoning:** They provide detailed explanations for why the selected option is the best fit and why the others are not. *   **Real-World Connection:** The LOT approach, in particular, uses real-world examples and reframing as debate scenarios, making the abstract concept more concrete.  **However, here are potential weaknesses, overlooked aspects, or limitations compared to my core idea:**  1.  **Complexity:** The ROT and LOT frameworks, while thorough, are arguably *overly complex* for this specific problem. The pseudocode, input-output formats, and multiple criteria might be overkill for a relatively straightforward identification task. This added complexity could obscure the core concept for someone unfamiliar with formal logic or algorithm design. My core idea is simpler and more accessible.  2.  **Abstraction from Language:** While the pseudocode in the ROT is helpful for a logical breakdown, it abstracts away from the critical element of *language* that defines special pleading. The core of special pleading lies in *how* things are described, not just that different standards are applied. The LOT approach addresses this better with its debate scenarios, but the initial pseudocode focus might still dilute the emphasis on language.  3.  **Overthinking the Problem:** The exhaustive nature of the ROT and LOT approaches could lead to ""analysis paralysis"". By focusing on numerous criteria and hypothetical scenarios, one might lose sight of the most direct and obvious connection between the option and the definition of special pleading.  4.  **Redundancy:** In LOT, some of the criteria are redundant. For example, identifying a double standard (Criterion F) is closely related to undermining fairness and impartiality (Criterion G).  5.  **Limited Focus on Framing:** While LOT's debate scenarios partially address this, neither ROT nor LOT explicitly emphasizes the *framing* aspect as strongly as my core idea. The act of ""referring to an act in negative terms"" versus ""referring to the same act in favorable terms"" is all about framing. This linguistic framing is the key to making the special pleading argument sound plausible.  **Why my approach is preferable (in this specific context):**  For this specific task – identifying the *best description* of special pleading from a given set of options – my core idea's conciseness and direct focus on the biased framing aspect make it preferable. It directly captures the essence of the fallacy without unnecessary complexity. While the ROT and LOT approaches provide a robust framework for analyzing arguments and fallacies in general, they might be too heavyweight for this particular identification task. The added complexity doesn't necessarily lead to a more accurate answer and could even obscure the core concept. In essence, my approach provides a laser-like focus on the defining characteristic of special pleading: the use of biased language to justify unequal treatment."
