Round,Speaker,Utterance
1,Moderator,"Debate Topic: In-depth discussion based on the mission context and ideas from ROT and GOT. Mission Context (partial): Instruction: The argument against the person consists of  Context: [ignoring another person's arguments and attacking her character instead, asserting an opposing arguer has taken an easily defeated position, which she has not really taken, causing confusion during an argument by a lack of ability to engage in refutation, using threats of harm instead of reasoning to gain agreement]... Initial Core Idea from ROT (partial): Okay, here's the analysis of the given argument context for the specified fallacies, following the defined format:  **Input:**  *   Context: ""The argument against the person consists of [ignoring another person's arguments and attacking her character instead, asserting an opposing arguer has taken an easily defeated position, which she has not really taken, causing confusion during an argument by a lack of ability to engage in refutation, using threats of harm instead of reasoning to gain agreement]."" *   Fallacies: *ad hominem*, straw man, creating confusion to hinder refutation, appeal to force.  **Output:**  **1. *Ad Hominem***  *   Phrase: ""ignoring another person's arguments and attacking her character instead"" *   Relationship: This phrase directly exemplifies *ad hominem* because it describes attacking the person making the argument rather than addressing the argument itself. The focus shifts from the validity of the argument to the perceived flaws or characteristics of the arguer. *   Explanation: *Ad hominem* is a fallacy where an argument is rejected based on irrelevant facts about the person presenting the argument, rather than the argument itself. This undermines logical discourse because it distracts from the actual issue and focuses on personal attacks, which are not relevant to the truth or validity of the argument. It creates a hostile environment and prevents constructive dialogue.  **2. Straw Man**  *   Phrase: ""asserting an opposing arguer has taken an easily defeated position, which she has not really taken"" *   Relationship: This phrase describes the core of the straw man fallacy. It involves misrepresenting an opponent's argument to make it easier to attack. The ""easily defeated position"" is a fabricated or distorted version of the original argument. *   Explanation: The straw man fallacy involves misrepresenting an opponent's argument to make it easier to attack. Instead of engaging with the actual argument, the attacker creates a weaker, simplified, or exaggerated version (the ""straw man"") and then refutes that. This undermines logical discourse because it avoids addressing the real issue and instead attacks a distorted representation. It misleads the audience into thinking the original argument has been refuted when it hasn't.  **3. Creating Confusion to Hinder Refutation**  *   Phrase: ""causing confusion during an argument by a lack of ability to engage in refutation"" *   Relationship: This phrase directly describes the act of creating confusion to prevent effective refutation. The lack of ability to engage in refutation is used as a tool to obscure the argument and make it difficult for others to understand and respond to it logically. *   Explanation: This fallacy involves intentionally using confusing language, irrelevant information, or complex arguments to obfuscate the issue and make it difficult for others to understand and refute the claims being made. This can be achieved through jargon, ambiguous phrasing, or presenting information in a disorganized and convoluted manner. This undermines logical discourse by preventing clear communication and making it impossible to have a productive exchange of ideas. It essentially shuts down the possibility of meaningful debate.  **4. Appeal to Force**  *   Phrase: ""using threats of harm instead of reasoning to gain agreement"" *   Relationship: This phrase perfectly illustrates the appeal to force (argumentum ad baculum). It involves using threats or coercion to force someone to accept a conclusion, rather than providing logical reasons or evidence. *   Explanation: Appeal to force (argumentum ad baculum) is a fallacy where one attempts to persuade someone to accept a conclusion by using threats or intimidation. Instead of providing logical reasons or evidence, the arguer resorts to force or the threat of force to compel agreement. This undermines logical discourse because it replaces rational argumentation with coercion, effectively silencing dissent and preventing the free exchange of ideas. The truth or validity of the argument becomes irrelevant; compliance is achieved through fear.... Initial Core Idea from GOT (partial): Excellent and thorough! Your explanation clearly and accurately connects each fallacy to the provided context, explains the fallacy itself, and details how it undermines logical discourse. The inclusion of the intent behind creating confusion and the broader implications of appeal to force further strengthens your response.  The added section on the interconnectedness of fallacies is a crucial and insightful addition. It highlights that these fallacies rarely occur in isolation and that recognizing patterns of fallacious reasoning is essential for effective critical thinking.  Here are a few minor suggestions for even further refinement, though your answer is already excellent:  *   **Nuance in Ad Hominem:** While you correctly identify the different forms of *ad hominem* (abusive and circumstantial), you could briefly mention the *tu quoque* fallacy (pointing out the arguer's hypocrisy) as another common variation. This would provide an even more comprehensive understanding of *ad hominem*.  *   **Elaborate on ""Creating Confusion"":** You mention *ignoratio elenchi*, which is helpful. You could also mention related tactics such as *equivocation* (using a word with multiple meanings in different ways within the same argument to create ambiguity) or simply overwhelming the opponent with irrelevant data (""Gish Gallop"").  *   **Specificity in Appeal to Force:** You mention threats to reputation and career. You could also include economic threats (e.g., boycotts) or social ostracism as examples of *ad baculum* beyond physical harm.  **Incorporating the suggestions:**  Okay, here's a breakdown of each fallacy, relating it to the provided context, and explaining how it undermines logical discourse, refined for clarity and detail:  **1. *Ad Hominem***  *   **Contextual Phrase:** ""ignoring another person's arguments and attacking her character instead"" *   **Explanation:** *Ad hominem* (Latin for ""to the person"") is a fallacy where, instead of addressing the argument being presented, you attack the person making the argument. This attack can be on their character, their motives, their circumstances, or any other irrelevant personal attribute. There are different forms of *ad hominem*, including abusive (direct insults), circumstantial (pointing out inconsistencies between the person's argument and their circumstances), and *tu quoque* (pointing out the arguer's hypocrisy, suggesting their argument is invalid because they don't practice what they preach). *   **How it Undermines Discourse:** It diverts attention from the actual issue at hand. By focusing on the person instead of the argument, it avoids any genuine engagement with the evidence or reasoning. This makes it impossible to have a productive discussion and reach a logical conclusion. It poisons the well, making it difficult for the audience to fairly evaluate the argument, even if it has merit. It also creates a hostile environment, discouraging people from expressing their views for fear of personal attacks.  **2. Straw Man**  *   **Contextual Phrase:** ""asserting an opposing arguer has taken an easily defeated position, which she has not really taken"" *   **Explanation:** The straw man fallacy involves misrepresenting your opponent's argument to make it easier to attack. You create a distorted, exaggerated, or simplified version of their position (the ""straw man"") and then refute *that* instead of their actual claim. This makes it appear as though you've defeated their argument, when in reality, you've only defeated a fabricated version of it. *   **How it Undermines Discourse:** It prevents genuine understanding and engagement. Instead of grappling with the nuances of the opponent's position, the straw man fallacy attacks a caricature. This leads to miscommunication and prevents any possibility of finding common ground or reaching a valid conclusion. It deceives the audience by falsely suggesting that the original argument has been refuted. It also wastes time and energy addressing a point that the opponent never actually made. It promotes intellectual dishonesty and hinders the pursuit of truth.  **3. Creating Confusion to Hinder Refutation**  *   **Contextual Phrase:** ""causing confusion during an argument by a lack of ability to engage in refutation"" *   **Explanation:** This fallacy involves deliberately making an argument unclear, convoluted, or ambiguous to prevent the opponent from effectively refuting it. This can involve using jargon, intentionally vague language, introducing irrelevant information (red herrings), shifting the goalposts of the argument, *equivocation* (using a word with multiple meanings in different ways to create ambiguity), or even overwhelming the opponent with a large volume of weak or irrelevant arguments (""Gish Gallop""). The *intention* is to obfuscate the issue and wear down the opponent's ability to respond. This is related to the *ignoratio elenchi* fallacy, which is presenting an argument that may be valid in itself but does not address the issue in question. *   **How it Undermines Discourse:** It obstructs clear communication and prevents a fair evaluation of the arguments. By making it difficult to understand the position being presented, it becomes impossible to engage in meaningful debate. It wastes time and resources as the opponent struggles to decipher the argument. It can lead to frustration and discouragement, ultimately silencing dissenting voices. It allows the person creating the confusion to avoid scrutiny of their own position.  **4. Appeal to Force (Argumentum ad Baculum)**  *   **Contextual Phrase:** ""using threats of harm instead of reasoning to gain agreement"" *   **Explanation:** *Argumentum ad baculum* (Latin for ""argument to the stick"") is a fallacy where force, coercion, or the threat of force is used to persuade someone to accept a conclusion. Instead of providing evidence or logical reasoning, the arguer relies on fear and intimidation to get their way. The ""harm"" doesn't have to be physical; it can also be threats to reputation, career, economic threats (e.g., boycotts), social ostracism, or other forms of well-being. *   **How it Undermines Discourse:** It completely abandons rational argumentation. It replaces logic with brute power, making any possibility of genuine dialogue or mutual understanding impossible. It suppresses free thought and expression, as people are afraid to disagree with those who hold power. It is morally reprehensible as it uses fear to manipulate and control others. It prevents the discovery of truth, as conclusions are reached based on coercion rather than evidence or reason.  **Interconnectedness of Fallacies:** Expand on how these fallacies can often occur together in a real-world argument. For example, someone might use *ad hominem* to discredit an opponent, then construct a straw man of their position, making it easier to ""defeat"" them, and ultimately resort to threats if the opponent still refuses to concede. Recognizing these patterns can help identify and counter these fallacies more effectively. ... The debate will now commence focusing on these ideas."
2,ROT_Representative,"Okay, here's my response as the ROT Representative, addressing the core problem, highlighting my idea's strengths, and critically evaluating the GOT idea:  **1. Elaboration on ROT Idea's Core Problem and Strengths:**  My core idea directly addresses the problem of identifying and understanding fallacies in arguments, specifically focusing on *ad hominem*, straw man, creating confusion to hinder refutation, and appeal to force, as they are presented in the given context. It aims to dissect the argument ""against the person"" by explicitly linking each fallacy to a specific phrase within the provided context. This structured approach offers clarity and facilitates the identification of these fallacies in real-world scenarios.  **Key Strengths of the ROT Idea:**  *   **Direct Mapping:** The most significant strength is the direct mapping between the given context and each fallacy. This provides a concrete example for learners to understand how these fallacies manifest in arguments. *   **Structured Format:** The consistent format (Phrase, Relationship, Explanation) ensures that each fallacy is analyzed in a comprehensive and easily digestible manner. This structure promotes clarity and aids in retention. *   **Focus on Undermining Discourse:** The emphasis on how each fallacy undermines logical discourse is crucial. It highlights the negative impact of these fallacies on productive communication and critical thinking. *   **Accessibility:** The language used is clear and accessible, making it suitable for a wide audience, including those new to the study of logical fallacies.  **2. Critical Evaluation of the GOT Idea:**  The GOT idea offers valuable enhancements, particularly in detailing nuances and interconnectedness. However, my ROT approach offers some distinct advantages in its initial presentation:  *   **GOT's Strength: Nuance in *Ad Hominem***: GOT suggests mentioning the *tu quoque* fallacy. This is a valid point, and expanding on the types of *ad hominem* strengthens the understanding of the fallacy.     *   **ROT's Perspective:** While *tu quoque* is important, the initial focus should remain on the core definition of *ad hominem*. Overloading the initial explanation with too many sub-types might dilute the primary understanding. The initial ROT idea prioritizes a clear foundation.  *   **GOT's Strength: Elaborating on ""Creating Confusion""**: GOT suggests mentioning *equivocation* and the ""Gish Gallop."" These are excellent examples of tactics used to create confusion.     *   **ROT's Perspective:** Again, these are valuable additions, but the ROT idea prioritizes simplicity in the initial explanation. Introducing too many tactics at once could overwhelm the learner. The core idea of intentionally creating confusion to hinder refutation is paramount, and additional tactics can be introduced later.  *   **GOT's Strength: Specificity in Appeal to Force**: GOT suggests including economic threats and social ostracism. This provides a more comprehensive understanding of *ad baculum*.     *   **ROT's Perspective:** This is a good refinement. However, the ROT idea's initial focus on ""threats of harm"" provides a more direct and easily grasped understanding of the fallacy. The additional examples can be incorporated as elaborations.  *   **GOT's Strength: Interconnectedness of Fallacies**: Highlighting how fallacies occur together is a crucial insight for critical thinking.     *   **ROT's Perspective:** While the interconnectedness is vital, it's a higher-level concept. The ROT idea prioritizes establishing a solid understanding of each fallacy *individually* before exploring their interrelationships. This is a more pedagogical approach, building from simple to complex.  **Potential Weaknesses and Overlooked Aspects of GOT Compared to ROT:**  *   **Risk of Overwhelm:** GOT's immediate inclusion of nuances (e.g., *tu quoque*, *equivocation*, Gish Gallop) could potentially overwhelm a beginner. The ROT idea prioritizes establishing a strong foundational understanding of each fallacy before introducing complexities. *   **Loss of Direct Contextual Link:** While elaborating on each fallacy is valuable, GOT's refinements could slightly dilute the direct connection to the initial provided context. The ROT idea's strength is its explicit and immediate application of each fallacy to the given argument. *   **Pedagogical Approach:** The ROT idea adopts a more pedagogical approach by breaking down the analysis into smaller, more manageable chunks. This makes it easier for learners to grasp the core concepts before moving on to more nuanced aspects.  **Why ROT's Approach Might Be Preferable (Initially):**  The ROT idea's approach is preferable as an *initial* teaching tool because it prioritizes clarity, direct application, and a structured format. It provides a solid foundation for understanding these fallacies before delving into more complex nuances and interrelationships. The GOT's refinements are valuable, but they are best introduced *after* the learner has a firm grasp of the core concepts, as provided by the ROT idea. The ROT idea focuses on first establishing a strong understanding of what each fallacy IS, before exploring the many ways it can manifest. This makes it more accessible and less intimidating for beginners."
3,GOT_Representative,"Okay, here's my response as the GOT Representative, addressing the core problem, highlighting my idea's strengths, and critically evaluating the ROT idea:  **1. Elaboration on GOT Idea's Core Problem and Strengths:**  The GOT idea directly addresses the core problem of comprehensively understanding and identifying fallacies in arguments, specifically focusing on *ad hominem*, straw man, creating confusion to hinder refutation, and appeal to force, as presented in the given context. It builds upon the ROT's initial analysis by adding crucial nuances and expanding the scope of understanding of each fallacy. Furthermore, it emphasizes the *interconnectedness* of these fallacies, a vital aspect often overlooked in introductory discussions.  **Key Strengths of the GOT Idea:**  *   **Comprehensive Understanding:** The GOT idea provides a more comprehensive understanding of each fallacy by including variations and related tactics. For example, it expands on *ad hominem* by mentioning *tu quoque*, elaborates on ""creating confusion"" by mentioning *equivocation* and the ""Gish Gallop,"" and adds specificity to ""appeal to force"" by including economic threats and social ostracism. This provides a fuller picture of how these fallacies manifest in real-world arguments. *   **Emphasis on Interconnectedness:** A key strength is the explicit focus on how these fallacies often occur together. This highlights that recognizing patterns of fallacious reasoning is crucial for effective critical thinking and countering manipulative arguments. *   **Building Upon a Solid Foundation:** The GOT idea doesn't discard the ROT's foundational work; instead, it enhances it. It acknowledges the value of the direct mapping and structured format while adding layers of complexity and nuance. *   **Practical Application:** By providing a more detailed and nuanced understanding, the GOT idea equips individuals with better tools for identifying and responding to fallacies in real-time conversations and debates. The added specifics make the recognition of these fallacies more practical.  **2. Critical Evaluation of the ROT Idea:**  While the ROT idea provides a valuable starting point, it has some limitations compared to the GOT idea:  *   **ROT's Potential Weakness: Oversimplification:** While the ROT idea prioritizes simplicity, this can lead to oversimplification. By focusing solely on the core definition of each fallacy, it risks neglecting important nuances and variations that are crucial for real-world application. For instance, failing to mention *tu quoque* in the context of *ad hominem* might lead someone to miss this common form of personal attack.     *   **GOT's Perspective:** The GOT idea addresses this by providing a more comprehensive overview, including common variations and related tactics. This ensures a more complete understanding of each fallacy. The refinements are not intended to overwhelm the learner, but to provide a fuller picture of how each fallacy can manifest.  *   **ROT's Potential Weakness: Lack of Depth in ""Creating Confusion"":** The ROT idea's explanation of ""creating confusion"" is somewhat limited. While it identifies the core concept, it doesn't provide enough specific examples of how this is achieved.     *   **GOT's Perspective:** The GOT idea addresses this by including examples like *equivocation* and the ""Gish Gallop,"" which provide concrete illustrations of how arguments can be deliberately obfuscated. This helps individuals to recognize and counter these tactics more effectively.  *   **ROT's Potential Weakness: Limited Scope of ""Appeal to Force"":** The ROT idea's focus on ""threats of harm"" may be too narrow. It primarily focuses on physical harm.     *   **GOT's Perspective:** The GOT idea broadens the scope of ""appeal to force"" by including economic threats, social ostracism, and threats to reputation/career. This recognizes that coercion can take many forms and that these non-physical threats can be just as effective in silencing dissent.  *   **ROT's Overlooked Aspect: Interconnectedness:** The ROT idea treats each fallacy in isolation.     *   **GOT's Perspective:** The GOT idea explicitly addresses the interconnectedness of fallacies. It highlights how fallacies often occur together in real-world arguments, creating complex patterns of manipulation. This recognition is crucial for effective critical thinking. Recognizing that an *ad hominem* attack might be followed by a straw man argument, and then ultimately by an appeal to force, allows a person to anticipate and counter these tactics more effectively.  **Why GOT's Approach Might Be Preferable:**  While the ROT idea provides a solid foundation, the GOT idea is preferable because it provides a more comprehensive, nuanced, and practically applicable understanding of fallacies. By including variations, related tactics, and emphasizing the interconnectedness of fallacies, the GOT idea equips individuals with better tools for identifying and responding to these flawed arguments in real-world situations. The risk of ""overwhelming"" beginners is mitigated by the fact that the GOT improvements *build* on the sound foundation of the ROT analysis. The GOT approach is not intended to be introduced *instead* of the ROT approach, but *after* a basic understanding has been established. The GOT approach prepares individuals to recognize and counter more subtle and complex forms of fallacious reasoning."
