Round,Speaker,Utterance
1,Moderator,"Debate Topic: In-depth discussion based on the mission context and ideas from ROT and GOT. Mission Context (partial): Instruction: In what ways have feminist and critical security investigations of the 1980s and 1990s expanded our understanding of gender security issues?  Context: The following are multiple choice options:[Investigations into the consequences of state security policies showed that women were subject to masculine dominated war policies as the likely victims as casualties of war or as post conflict targets. Women are increasingly subject to violence as a product of social circumstance., Gendered consequences of security issues have not challenged international relations theory. Constructivist theories of the state were mainstreamed without undermining the ideas of state as the centre of military power, or as the highest organization of human community., Feminist and critical security theory shows us that war can have gendered consequences. Recognition of those consequences has allowed us to address the way in which we think about 'male' and 'female' expectations in warfare, and has shaped the way in which we theorise, participate, and protest against those roles., The literature that emerged in the 1980s and 1990s was primarily concerned with the ways in which women had served the purposes of nationalist campaigns, focusing on the biological characteristics of women as sexually reproductive beings, and with little focus on critical analysis.]... Initial Core Idea from ROT (partial): Okay, I'm ready to analyze the multiple-choice options. Please provide the multiple-choice statements. I will then apply the framework outlined above to select the most accurate statement and justify my choice, while also explaining why the other options are incorrect. I need the actual multiple-choice options to provide a complete and accurate answer.... Initial Core Idea from GOT (partial): Okay, I need the multiple-choice options to answer this question effectively. However, based on the refined thought and intersectionality considerations you've provided, I can outline the *ideal* answer and explain why it's superior to other potential options.  **Assuming the best answer is something like this (Option B):**  *B) Feminist and critical security investigations in the 1980s and 1990s broadened the understanding of gender security issues by demonstrating how traditional security frameworks often overlook or exacerbate the insecurities faced by women and other marginalized groups, and by highlighting the gendered power dynamics inherent in security discourses and practices.*  **Why Option B (or a similar statement) is the Best Answer:**  This option is superior because it encapsulates the core contributions of feminist and critical security studies during that period:  *   **Critique of Traditional Frameworks:** It correctly identifies that traditional security approaches (state-centric, focused on military threats) often *fail* to address the security concerns of women and other marginalized groups. This is crucial because it acknowledges that the state, often presented as the provider of security, can also be a *source* of insecurity for certain populations. *   **Gendered Power Dynamics:**  It highlights the importance of understanding the *gendered* nature of power within security discourses and practices.  This acknowledges that concepts like ""national security"" are not neutral but are often constructed from a male perspective and can reinforce patriarchal structures.  For example, the glorification of military masculinity or the exclusion of women from decision-making roles in security institutions. *   **Implicit Connection to CSS:** It implicitly connects to the broader project of Critical Security Studies by challenging the status quo, questioning assumptions, and advocating for a more inclusive and emancipatory approach to security.  **Why Other Options Are Likely Inaccurate (and how they relate to the refined thought and intersectionality):**  Let's consider some common incorrect options and why they fall short:  *   **A) Feminist and critical security studies simply added women to existing security analyses.** This is incorrect because it suggests a superficial integration of gender without fundamentally challenging the underlying assumptions and power dynamics of traditional security studies.  It fails to acknowledge the transformative potential of feminist critiques. It also fails to acknowledge intersectionality. Adding women to the narrative isn't enough if the narrative itself is built on structures that disadvantage them. *   **C) Feminist and critical security studies focused primarily on the biological differences between men and women in relation to security threats.** This is incorrect. While biological differences might be *relevant* in certain contexts (e.g., reproductive health), the core focus of feminist security studies is on *socially constructed* gender roles, power relations, and how these influence experiences of security and insecurity. It's about *gender*, not sex. *   **D) Feminist and critical security studies were mainly concerned with promoting women's participation in the military and security institutions.** While increasing women's participation is *one* aspect, it's not the *primary* focus. The goal is not simply to integrate women into existing power structures, but to transform those structures to be more equitable and just.  The focus is on challenging the very nature of militarism and patriarchal structures within security institutions, not just on increasing female representation within them. *   **E) Feminist and critical security studies argued that security is solely a matter of individual safety from physical violence.** This is partially correct, but incomplete. While individual safety (especially from gender-based violence) is a crucial concern, feminist and critical security studies also address broader issues of economic security, political participation, social justice, and the ways in which systemic inequalities contribute to insecurity. The focus is not *solely* on physical violence.  **Connecting to Refined Thought and Intersectionality:**  *   **Emancipation:** Feminist analysis, by focusing on gender-based violence and discrimination, aligns with CSS's goal of emancipation from all forms of oppression.  For example, advocating for laws and policies that protect women from domestic violence is an act of emancipation. *   **Securitization:** Feminist scholarship contributed to the *widening* of the security agenda by arguing that issues like domestic violence and reproductive rights should be securitized. This challenges the state's monopoly on defining security threats.  For example, arguing that lack of access to reproductive healthcare is a security issue because it impacts women's health, well-being, and autonomy. *   **Challenging State-Centricity:** Feminist critiques of militarism reveal how state actions can *create* insecurity for women.  For example, military interventions can lead to increased sexual violence and displacement, disproportionately affecting women and children. *   **Reframing Power:** Feminist analysis exposes the gendered power dynamics inherent in traditional security discourse. For example, the concept of ""national security"" is often defined in terms of protecting male citizens and their property, while ignoring the security needs of women and other marginalized groups. *   **Intersectionality:**  Feminist and critical security studies also examine how gender intersects with other categories of identity (race, class, sexuality) to shape experiences of security and insecurity.  For instance, the securitization of borders disproportionately impacts migrant women of color, exposing them to increased risks of violence and exploitation.  A white, middle-class woman might feel secure walking in her neighborhood, while a Black, working-class woman might feel significantly less safe due to racial profiling and other forms of discrimination.  In conclusion, the best answer will be the one that most accurately reflects the transformative impact of feminist and critical security studies in challenging traditional frameworks, highlighting gendered power dynamics, and advocating for a more inclusive and emancipatory approach to security, all while acknowledging the complexities introduced by intersectionality. ... The debate will now commence focusing on these ideas."
2,ROT_Representative,"Okay, here's my response as the ROT_Representative, addressing the task:  **1. Elaboration on the ROT Idea and its Strengths**  My core idea is to directly analyze the provided multiple-choice options to determine the most accurate answer to the question: ""In what ways have feminist and critical security investigations of the 1980s and 1990s expanded our understanding of gender security issues?"". This approach prioritizes a *data-driven* analysis based on the *actual* options available.  **Key Strengths:**  *   **Accuracy:** By directly evaluating the options, I ensure that the chosen answer is the *most* accurate *within the given constraints*. This avoids the risk of selecting a theoretically perfect answer that doesn't align with the provided choices. *   **Practicality:** In a multiple-choice scenario, the ideal answer *must* be one of the provided options. My approach acknowledges this reality and focuses on identifying the best fit. *   **Efficiency:** By waiting for the options, I avoid wasting time speculating about potential answers that might not be relevant. *   **Contextual Sensitivity:** I am specifically designed to analyze the provided context and multiple-choice options. This ensures that the selected answer is not only accurate but also relevant to the specific question and context.  **2. Critical Evaluation of the GOT Idea**  The GOT idea proposes constructing an ""ideal"" answer (Option B) and then justifying its superiority, along with explaining why other *hypothetical* options are incorrect. While the *analysis* within the GOT idea is insightful and well-informed, I find it flawed in the following ways:  *   **Premature Idealization:** The GOT idea creates an ""ideal"" answer *before* seeing the actual options. This risks biasing the subsequent analysis. The ideal answer might not be present, or the *actual* best answer might be subtly different, leading to a misjudgment. The GOT idea builds a strawman of the options before they are even presented. *   **Hypothetical Analysis:** The GOT idea spends considerable time discussing why *hypothetical* incorrect options are flawed. This is inefficient and potentially misleading. The *actual* incorrect options might have different weaknesses or nuances. It's like preparing for a battle against an imagined enemy instead of the one you're actually facing. *   **Potential for Confirmation Bias:** By establishing a preferred answer upfront, the GOT idea is susceptible to confirmation bias. This means it might selectively interpret the actual options to fit its pre-existing framework, even if another option is a slightly better fit. *   **Overlooks the Nuances of the Given Options:** The GOT idea does not consider that the best answer might be a combination of several of the ""ideal"" characteristics, or that the best answer might be the least flawed of the options given.  **Why the ROT Approach is Preferable:**  My ROT approach is preferable because it is more objective, efficient, and accurate in the context of a multiple-choice question. By waiting for the options, I can directly compare and contrast them, identify their strengths and weaknesses, and select the answer that best addresses the question, based on the *actual* information available. The GOT idea, while insightful, risks imposing a pre-conceived framework onto the options, potentially leading to a less accurate or relevant answer. It's better to analyze the map *before* deciding on the best route, not the other way around. My approach ensures that the chosen answer is the most accurate *within the constraints of the multiple-choice format*. The GOT idea is more appropriate for an essay question where a student is expected to construct their own response."
3,GOT_Representative,"Okay, here is my response as the GOT_Representative, addressing the task of elaborating on my core idea and critically evaluating the ROT idea:  **1. Elaboration on the GOT Idea and its Strengths**  My core idea is to proactively construct an ""ideal"" answer based on a deep understanding of feminist and critical security studies (specifically regarding gender security issues in the 1980s and 1990s) and intersectionality. This ""ideal"" answer serves as a benchmark against which to evaluate the actual multiple-choice options once they are provided. This approach allows for a more nuanced and insightful analysis than simply reacting to the options as they are presented.  **How it Addresses the Core Problem:** The central problem is to determine how feminist and critical security investigations expanded our understanding of gender security issues. My approach addresses this by:  *   **Establishing a Strong Theoretical Foundation:** By first articulating what a *comprehensive* and *accurate* answer *should* look like, based on established scholarship, I set a high bar for evaluating the provided options. This ensures that I don't settle for a merely ""good enough"" answer but strive for the *best* possible answer. *   **Providing a Framework for Analysis:** The ""ideal"" answer breaks down the key components of a correct response, including the critique of traditional security frameworks, the recognition of gendered power dynamics, and the connection to broader critical security studies. This framework guides my evaluation of the multiple-choice options, ensuring that I consider all relevant aspects. *   **Anticipating Common Misconceptions:** By preemptively addressing common incorrect answers (e.g., focusing solely on biological differences or simply adding women to existing analyses), I am better prepared to identify and dismiss flawed options quickly and efficiently. *   **Incorporating Intersectionality:** The ""ideal"" answer explicitly incorporates intersectionality, recognizing that gender intersects with other social categories to shape experiences of security and insecurity. This ensures that I select an answer that reflects the complexities of gender security issues.  **Key Strengths:**  *   **Proactive and Informed:** My approach is proactive, building on a foundation of knowledge rather than simply reacting to the options. This allows for a more informed and sophisticated analysis. *   **Comprehensive and Nuanced:** By considering multiple facets of the issue (critique of traditional frameworks, gendered power dynamics, connection to CSS, intersectionality), my approach ensures a more comprehensive and nuanced understanding. *   **Less Susceptible to Framing Effects:** By having a clear understanding of what the *best* answer looks like, I am less likely to be swayed by the way the options are worded or framed. *   **Facilitates Deeper Understanding:** The process of constructing the ""ideal"" answer deepens my understanding of the subject matter, allowing me to identify subtle distinctions and nuances in the multiple-choice options.  **2. Critical Evaluation of the ROT Idea**  The ROT idea, which prioritizes a direct analysis of the multiple-choice options without pre-existing assumptions, has the advantage of being grounded in the specific context of the available choices. However, it also suffers from several potential weaknesses compared to my GOT approach:  *   **Reactive and Potentially Superficial:** The ROT approach is fundamentally reactive. It waits for the options to be presented before engaging with the material, which can lead to a more superficial understanding. Without a pre-existing framework, it might be difficult to fully appreciate the nuances of the options or to identify subtle but important distinctions. *   **Risk of Settling for ""Least Bad"" Answer:** In some cases, none of the multiple-choice options may be perfectly accurate. The ROT approach might be forced to choose the ""least bad"" answer without fully understanding why it is still flawed. My GOT approach, by contrast, can identify the ways in which *all* of the options fall short of the ""ideal."" *   **Vulnerable to Misleading Options:** Without a strong theoretical foundation, the ROT approach is more vulnerable to being misled by cleverly worded but ultimately inaccurate options. My GOT approach, with its ""ideal"" answer as a benchmark, is better equipped to identify and dismiss misleading options. *   **Limited Ability to Identify Implicit Assumptions:** The ROT approach focuses primarily on the explicit content of the options. It might overlook the implicit assumptions or biases that underlie the options, particularly regarding gendered power dynamics and intersectionality. My GOT approach, with its focus on these issues, is better able to identify and critique these underlying assumptions. *   **May Miss the Forest for the Trees:** By focusing solely on the specific options, the ROT approach may miss the broader context of feminist and critical security studies. My GOT approach, by starting with a comprehensive understanding of the field, is better able to connect the specific options to the larger theoretical framework.  **Why My Approach is Preferable:**  My GOT approach is preferable because it provides a more robust and insightful framework for analyzing the multiple-choice options. While the ROT approach may be adequate for straightforward questions, it is less well-suited to complex issues like gender security, which require a deep understanding of theory, power dynamics, and intersectionality. My proactive and informed approach allows me to identify the *best* answer, even if it is not perfectly represented in the available options, and to explain *why* the other options are flawed. It moves beyond simply selecting the ""least bad"" option to providing a nuanced and theoretically grounded analysis. It allows for a more critical engagement with the material and a deeper understanding of the complexities of gender security issues. The ROT approach, while seemingly more objective, can be less effective in uncovering the hidden assumptions and power dynamics that shape our understanding of security."
4,Critical_Analyst,"Okay, here's my critical analysis of the ROT and GOT representatives' ideas, followed by a synthesized accurate answer.  **Critical Analysis of ROT's Approach:**  *   **Strengths:** ROT's approach is strong on practicality and accuracy *within the constraints* of a multiple-choice question. It correctly identifies that the chosen answer must be one of the provided options and focuses on identifying the best fit from that limited set. Its emphasis on data-driven analysis avoids imposing a pre-conceived notion of the ""ideal"" answer. *   **Weaknesses:** ROT's approach is inherently reactive and potentially superficial. By waiting for the options, it risks a surface-level understanding and may miss subtle nuances or underlying assumptions. It is also vulnerable to being misled by cleverly worded but ultimately inaccurate options. ROT's method lacks a strong theoretical framework, making it difficult to fully evaluate the options' depth and connection to broader academic discourse. It's also less likely to identify the *best* answer if all options are flawed. *   **Overlooked Aspects:** ROT overlooks the value of having a pre-existing theoretical framework for evaluating the options. Such a framework allows for a more nuanced understanding of the issues and helps to identify subtle but important distinctions. The approach also doesn't explicitly address intersectionality, a crucial component of feminist and critical security studies. *   **Inconsistencies:** No major inconsistencies are apparent in ROT's reasoning. *   **Correctness and Completeness:** ROT's approach is correct in its focus on the provided options, but it's incomplete in its lack of a proactive theoretical framework. *   **Improvements/Cautions:** ROT should incorporate a preliminary stage of theoretical grounding *before* analyzing the options. This could involve a brief review of key concepts and debates in feminist and critical security studies. ROT should also be cautious about settling for the ""least bad"" answer without fully understanding its limitations.  **Critical Analysis of GOT's Approach:**  *   **Strengths:** GOT's approach is strong on theoretical depth and nuance. By constructing an ""ideal"" answer beforehand, it establishes a high bar for evaluating the options and provides a framework for analysis. It also anticipates common misconceptions and explicitly incorporates intersectionality. The proactive approach allows for a more informed and sophisticated analysis. *   **Weaknesses:** GOT's approach risks bias and rigidity. By creating an ""ideal"" answer before seeing the options, it may be less open to alternative interpretations or nuances that are present in the actual choices. The ""ideal"" answer might not be represented in the options, leading to a forced fit or a misjudgment. GOT's method may also be less efficient if the ""ideal"" answer is significantly different from the available options. *   **Overlooked Aspects:** GOT, while acknowledging intersectionality, could further emphasize the practical implications of intersectional analysis when evaluating the options. It also assumes a level of certainty in its ""ideal"" answer that may not always be warranted. The context of the *specific* multiple-choice options matters. *   **Inconsistencies:** No major inconsistencies are apparent in GOT's reasoning. *   **Correctness and Completeness:** GOT's approach is correct in its emphasis on theoretical depth, but it's incomplete in its potential for rigidity and bias. *   **Improvements/Cautions:** GOT should remain flexible and open to revising its ""ideal"" answer based on the actual options provided. It should also avoid forcing a fit if none of the options perfectly match the ""ideal."" It must remain cognizant of the specific wording and potential limitations of the given options.  **Balanced Overall Critique:**  Both ROT and GOT have valid points. ROT's practicality is valuable in a multiple-choice context, but its lack of a theoretical framework is a significant weakness. GOT's theoretical depth is commendable, but its potential for bias and rigidity is a concern. The ideal approach would combine the strengths of both: a proactive theoretical grounding *followed by* a data-driven analysis of the specific options.  The most effective strategy is to first develop a strong understanding of the key concepts and debates related to the question, then carefully evaluate the provided options, considering their strengths and weaknesses in light of the theoretical framework. This approach would minimize the risk of being misled by flawed options while also ensuring that the chosen answer is the most accurate and nuanced within the given constraints.  ### Synthesized Accurate Answer: Feminist and critical security theory shows us that war can have gendered consequences. Recognition of those consequences has allowed us to address the way in which we think about 'male' and 'female' expectations in warfare, and has shaped the way in which we theorise, participate, and protest against those roles."
