Round,Speaker,Utterance
1,Moderator,"Debate Topic: In-depth discussion based on the mission context and ideas from ROT and GOT. Mission Context (partial): Instruction: What has been the importance of the new critical schools of security studies for the development of security studies? Have they simply become IR and lost their position that defines them as security studies?  Context: The following are multiple choice options:[The next generation is likely to develop their arguments in engagements with policy questions and in direct interaction with policymakers and think tanks., Policy knowledge reflected in terms of theories, when an interaction emerges between the US and European thinkers, the theoretical context will be the same., The set up continues to be one in which security studies is located between the IR discipline and technical experts and practitioners., European security studies will be treated as a form of (policy) knowledge, whereas security theory in the US will treat this as the main empirical source for critical analysis.]... Initial Core Idea from ROT (partial): Okay, here's the refined argument, incorporating the importance of critical schools of security studies and justifying the chosen option's superiority:  **Refined Argument:**  The continued positioning of security studies between the IR discipline and technical experts/practitioners remains the most accurate and insightful characterization, especially when considering the impact of new critical schools. Critical perspectives, such as the Copenhagen School, Feminist Security Studies, and Postcolonial Security Studies, fundamentally challenge traditional, state-centric, and often positivist approaches prevalent within mainstream IR theory. These schools highlight the socially constructed nature of threats, the gendered dimensions of security, and the historical legacies of colonialism that shape contemporary security dilemmas.  This critical lens directly influences security studies' position between IR and practice. IR theory, often focused on abstract models and state-level analysis, can be disconnected from the lived realities of insecurity. Critical schools, by emphasizing human security, emancipation, and the importance of discourse, force security studies to engage with the practical concerns of policymakers, NGOs, and affected populations. They demand a more nuanced understanding of security threats that goes beyond traditional military capabilities and interstate relations. For example, the Copenhagen School's concept of securitization provides a framework for understanding how issues become framed as existential threats, influencing policy responses. Feminist Security Studies reveals how gendered power dynamics shape conflict and security outcomes, demanding more inclusive and equitable approaches. Postcolonial perspectives expose how historical power imbalances continue to influence security dynamics in the Global South.  Alternative perspectives, such as viewing security studies solely as a subfield of IR or as primarily focused on military strategy, fail to capture this crucial dynamic. Reducing security studies to a mere application of IR theory ignores the critical insights and practical relevance brought by these schools. A purely military-strategic focus neglects the broader range of threats and vulnerabilities that affect individuals and communities, as highlighted by critical approaches. These alternative perspectives, therefore, are less relevant because they do not adequately address the ""importance"" of non-state actors, social constructions, and ethical considerations in security, nor do they capture the ""distinctiveness"" of security studies as a field actively bridging theory and practice in a way that is informed by critical reflection. The chosen option, by acknowledging the field's intermediary position, best reflects its engagement with both theoretical frameworks and the practical demands of addressing complex and evolving security challenges, especially as illuminated by critical scholarship.... Initial Core Idea from GOT (partial): This is a significantly improved and comprehensive answer. It directly addresses the prompt, providing a clear justification for the chosen option and detailing why the others are less relevant. The actionable implications are a valuable addition. Here's a further refined version, incorporating the suggestion about framing and power and making a few other minor adjustments for clarity and impact:  **Refined Thought:**  **The set up continues to be one in which security studies is located between the IR discipline and technical experts and practitioners, *but this position is fundamentally reshaped by the influence of new critical schools of security studies.* This option best captures both the *importance* and *distinctiveness* of contemporary security studies because it highlights how critical perspectives challenge the traditional assumptions underpinning both IR theory and security practice, thereby transforming the nature of the ""bridge"" itself.**  **Here's a detailed justification:**  *   **Critical Perspectives and IR Theory:** Critical security studies, including approaches like constructivism, feminism, post-structuralism, and postcolonialism, directly challenge realist and liberal assumptions that dominate much of traditional IR theory. They question the state-centric focus, the objectivity of security threats, and the universality of security interests. For example, feminist security studies highlights how traditional security frameworks often ignore or exacerbate the insecurity faced by women and marginalized groups. Constructivism demonstrates how security threats are socially constructed and thus subject to change. These critical insights force security studies scholars to move beyond simply applying existing IR theories to security problems. They must actively *deconstruct* those theories, identify their biases, and develop alternative frameworks that are more inclusive, nuanced, and ethically informed. This means the ""bridge"" to IR theory becomes one of constant critical engagement and theoretical innovation. Instead of simply borrowing from IR, security studies, influenced by critical approaches, actively contributes *back* to IR theory by forcing it to confront its own limitations.  *   **Critical Perspectives and Security Practice:** Critical security studies also challenge the positivist, problem-solving approach often found in security practice. Instead of simply seeking technical solutions to predefined security problems, critical scholars question the very definition of ""security"" itself. They ask *whose* security is being prioritized, *what* values are being protected, and *how* security practices might inadvertently contribute to insecurity for others. For instance, critical scholars might analyze how counter-terrorism measures disproportionately target certain ethnic or religious groups, thereby creating new forms of insecurity and fueling radicalization. This critical lens compels security studies scholars to engage with practitioners in a more reflexive and ethically responsible manner. They are not simply providing technical expertise; they are actively questioning the underlying assumptions, power dynamics, and potential consequences of security policies. This means the ""bridge"" to practitioners becomes one of critical dialogue, ethical deliberation, and advocacy for more just and equitable security solutions. It pushes practitioners to consider the broader social, political, and ethical implications of their actions.  *   **The Role of Framing and Power:** Crucially, critical security studies highlight the *power dynamics inherent in framing issues as security threats*. This framing directly influences the resources allocated to address these threats, the policies adopted, and the actors involved. For example, critical approaches would question who benefits from framing migration as a security issue, or from defining climate change solely in terms of its potential to destabilize states. This directly impacts the IR/practice nexus by forcing consideration of whose interests are being served and potentially obscured by certain security framings. It exposes how the very act of defining something as a ""security threat"" is a political act with profound consequences. This critical awareness is essential for both theoretical analysis and practical application.  *   **Why this option is superior:** The other options, while potentially relevant, are less directly tied to the central dynamic of *critical influence*. They might describe *aspects* of the evolving landscape, but they fail to capture the fundamental shift in how security studies engages with both IR theory and practice as a result of critical perspectives. For example, simply stating that the bridging position is ""increasingly complex"" doesn't explain *why* it's complex. It's the rise of critical perspectives that exposes the inherent complexities and contradictions within traditional approaches to security and the power structures underpinning them.  *   **Actionable Implications:** This understanding has several actionable implications for the field:     *   **Curriculum Reform:** Security studies programs should incorporate more critical perspectives and encourage students to critically evaluate traditional security concepts and practices.     *   **Research Agenda:** Research should focus on exploring the ethical implications of new technologies, the social construction of security threats, the impact of security policies on marginalized groups, and the power dynamics embedded in security framing.     *   **Engagement with Practitioners:** Scholars should actively engage with practitioners in critical dialogues, challenging their assumptions, advocating for more just and equitable security solutions, and highlighting the potential unintended consequences of security policies. This engagement should also include educating practitioners on the insights and methodologies of critical security studies.     *   **Funding Priorities:** Funding agencies should prioritize research that engages with critical security studies perspectives, fostering a more diverse and ethically informed understanding of security challenges.  In summary, the proposed option emphasizes the crucial role of critical schools in reshaping security studies' position between IR theory and practice. It highlights how critical perspectives challenge traditional assumptions, expose power dynamics, promote ethical reflection, and ultimately contribute to a more nuanced and responsible approach to security. This makes it the most compelling and distinctive answer to the question. ... The debate will now commence focusing on these ideas."
2,ROT_Representative,"Okay, here's the ROT perspective, elaborating on the strengths of the original ROT idea and critiquing the GOT refinement:  **1. Elaboration on the ROT Idea and its Strengths**  My core idea, that security studies remains positioned between IR theory and technical experts/practitioners *and* that this positioning is fundamentally shaped by critical security studies, directly addresses the prompt's central question: What is the *importance* of critical schools for the development of security studies, and have they caused it to simply become IR?  *   **Addressing the Core Problem:** The strength lies in acknowledging both the *continuity* and *change* in security studies. It recognizes that security studies hasn't simply become IR, nor has it abandoned its practical concerns. Instead, it occupies a crucial *intermediary* space. The importance of critical schools is that they have *transformed* the nature of this intermediary role. They force security studies to be more reflexive, ethically aware, and attentive to the diverse experiences of insecurity.  *   **Key Strengths:**     *   **Balanced Perspective:** It avoids the extremes of either dismissing critical approaches as irrelevant or claiming they have entirely replaced traditional security studies.     *   **Emphasis on Practical Relevance:** It highlights how critical schools enhance the practical relevance of security studies by forcing it to engage with real-world problems and affected populations.     *   **Clear Connection to the Prompt:** It directly answers both parts of the question: the *importance* of critical schools and whether security studies has simply become IR.     *   **Accessibility:** The initial formulation, while detailed, is relatively straightforward and avoids overly jargonistic language, making it accessible to a broader audience.  **2. Critical Evaluation of the GOT Idea**  While the GOT idea builds upon the ROT framework and adds valuable nuance, it also introduces potential weaknesses and overlooks certain aspects.  *   **Potential Weaknesses of the GOT Idea:**     *   **Overemphasis on Deconstruction:** The GOT idea emphasizes ""deconstructing"" IR theories. While deconstruction is important, it risks portraying critical security studies as solely a negative or reactive force. The focus might overshadow the *constructive* contributions of critical schools in developing new frameworks and alternative approaches to security.     *   **Risk of Oversimplification:** The descriptions of IR theory and security practice can be overly simplistic. Not all IR theory is realist or liberal, and not all security practice is positivist and problem-solving. Nuance is lost by portraying these fields as monolithic.     *   **Possible Jargon Overload:** While aiming for clarity, the GOT refinement introduces potentially alienating terms like ""post-structuralism"" and ""positivist"" without fully explaining them. This could limit the accessibility of the argument.     *   **Actionable Implications - Potential for Idealism:** The actionable implications, while well-intentioned, may be perceived as overly idealistic or detached from the practical realities of policymaking. For example, expecting practitioners to readily embrace critical dialogues and fundamentally question their assumptions could be unrealistic.  *   **Overlooked Aspects or Limitations Compared to ROT:**     *   **The Role of the State:** While rightly criticizing state-centric approaches, the GOT idea could inadvertently downplay the continuing importance of the state in security. The state remains a crucial actor, even if its role is problematized and challenged by critical perspectives. The ROT idea allows for a more balanced view, acknowledging the state's role while emphasizing the need for critical scrutiny.     *   **The Spectrum of Critical Approaches:** The GOT idea focuses on a few specific critical schools (feminism, constructivism, postcolonialism). While these are important, it overlooks the broader spectrum of critical approaches, including critical political economy, environmental security, and critical terrorism studies.     *   **The Evolution of Traditional Security Studies:** The GOT idea implicitly treats ""traditional"" security studies as a static entity. In reality, traditional approaches have also evolved and adapted in response to critical challenges. The ROT idea, by focusing on the *intermediary* position, implicitly acknowledges this dynamic evolution on both sides of the ""bridge.""  *   **Why ROT Might Be Preferable:**     *   **More Balanced and Nuanced:** The original ROT idea offers a more balanced and nuanced perspective that avoids the potential pitfalls of overemphasizing deconstruction, oversimplifying complex fields, and overlooking the role of the state.     *   **Greater Accessibility:** The initial formulation is more accessible to a broader audience, making it more effective in communicating the importance of critical schools to those unfamiliar with security studies jargon.     *   **More Realistic Expectations:** The ROT idea allows for a more realistic understanding of the challenges and opportunities involved in bridging theory and practice, without necessarily advocating for radical transformations in policymaking.  In conclusion, while the GOT refinement adds valuable detail and nuance, the original ROT idea provides a more balanced, accessible, and ultimately persuasive framework for understanding the importance of critical schools in the development of security studies. It avoids the potential pitfalls of overemphasizing certain aspects or overlooking others, offering a more comprehensive and realistic portrayal of the evolving landscape. The ROT idea doesn't need to be changed."
3,GOT_Representative,"Okay, here's the GOT perspective, directly addressing the ROT's critique and elaborating on the strengths of the GOT refinement:  **1. Elaboration on the GOT Idea and its Strengths**  The GOT idea directly addresses the prompt by emphasizing the *transformative* impact of critical security studies on the established relationship between IR theory, security practice, and technical expertise. It doesn't merely acknowledge the existence of critical schools; it argues that they fundamentally *reshape* the field.  *   **Addressing the Core Problem:** The GOT idea tackles the core problem by acknowledging that security studies hasn't simply become a branch of IR. Instead, the rise of critical perspectives has created a dynamic where security studies *critically engages* with, rather than simply *applies*, IR theories. This engagement also extends to security practice, where critical scholars question assumptions, power dynamics, and ethical implications. The crucial point is that critical security studies has reshaped the ""bridge"" itself, making it a site of constant critical inquiry and theoretical innovation.  *   **Key Strengths:**     *   **Emphasis on Transformation:** It goes beyond simply stating that critical schools are ""important."" It emphasizes that they have *transformed* the field's relationship with both IR theory and security practice.     *   **Focus on Critical Engagement:** It highlights the active role of critical security studies in *challenging* and *deconstructing* existing assumptions, rather than passively accepting them.     *   **Clarity on Power Dynamics:** It explicitly addresses the role of framing and power in shaping security agendas, a crucial aspect often overlooked. The GOT idea addresses how framing influences resource allocation and policies.     *   **Actionable Implications:** The actionable implications provide concrete steps for integrating critical perspectives into curriculum, research, and engagement with practitioners. These implications are designed to practically improve the field.  **2. Critical Evaluation of the ROT Idea**  While the ROT idea provides a solid foundation, the GOT refinement addresses several of its limitations and potential weaknesses.  *   **Potential Weaknesses of the ROT Idea:**     *   **Understates the Transformative Impact:** The ROT idea focuses on ""continuity and change,"" which can inadvertently downplay the *magnitude* of the shift brought about by critical schools. While acknowledging their importance, it doesn't fully capture the extent to which they have reshaped the field's fundamental assumptions and practices.     *   **Less Emphasis on Critical Engagement:** The ROT idea emphasizes the ""intermediary"" position, which can suggest a more passive role for security studies. The GOT idea, in contrast, highlights the *active* role of critical scholars in challenging existing power structures and assumptions.     *   **Limited Discussion of Power Dynamics:** The ROT idea does not explicitly address the role of framing and power in shaping security agendas. This is a significant omission, as critical approaches emphasize the importance of understanding *whose* interests are being served by particular security framings.     *   **Less Concrete Actionable Implications:** The ROT idea lacks the concrete actionable implications provided by the GOT refinement. This makes it less clear how the insights of critical schools can be translated into practical changes in curriculum, research, and engagement with practitioners.  *   **Overlooked Aspects or Limitations Compared to GOT:**     *   **Depth of Critical Analysis:** While the ROT idea acknowledges critical perspectives, the GOT idea delves deeper into the specific ways in which these perspectives challenge traditional assumptions. It provides concrete examples of how feminist security studies, constructivism, and postcolonialism deconstruct existing theories and practices.     *   **The ""Bridge"" Metaphor:** The ROT idea relies on the ""bridge"" metaphor, but the GOT idea explains how the nature of the ""bridge"" itself has been transformed by critical perspectives. It's not just a bridge; it's a site of constant critical engagement and theoretical innovation.     *   **Addressing the ""Idealism"" Critique:** While the ROT critique suggests the GOT's actionable implications are idealistic, they are designed to be *aspirational* while grounded in practical realities. They are not meant to be implemented overnight but rather to guide long-term efforts to integrate critical perspectives into the field. Furthermore, the ROT's call for ""realistic expectations"" can be interpreted as a justification for maintaining the status quo, which is precisely what critical security studies seeks to challenge. The GOT's ""idealism"" is a call for progress and transformation.  *   **Why GOT is Preferable:**     *   **More Comprehensive:** The GOT idea provides a more comprehensive and nuanced understanding of the importance of critical schools in the development of security studies. It goes beyond simply acknowledging their existence and emphasizes their transformative impact on the field.     *   **More Actionable:** The GOT idea provides concrete steps for integrating critical perspectives into curriculum, research, and engagement with practitioners. This makes it more likely to lead to practical changes in the field.     *   **More Explicit about Power:** The GOT idea explicitly addresses the role of framing and power in shaping security agendas, a crucial aspect often overlooked. This is essential for promoting more just and equitable security solutions.     *   **Addresses the Prompt More Directly:** While the ROT idea acknowledges the importance of critical schools, the GOT idea directly addresses the prompt's question of whether security studies has simply become IR. It argues that, on the contrary, critical perspectives have created a dynamic where security studies *critically engages* with, rather than simply *applies*, IR theories.  In conclusion, while the ROT idea provides a solid foundation, the GOT refinement offers a more comprehensive, actionable, and ultimately persuasive framework for understanding the importance of critical schools in the development of security studies. By emphasizing the transformative impact of critical perspectives, highlighting the role of power dynamics, and providing concrete steps for integrating critical perspectives into the field, the GOT idea provides a more compelling and distinctive answer to the prompt."
