Round,Speaker,Utterance
1,Moderator,"Debate Topic: In-depth discussion based on the mission context and ideas from ROT and GOT. Mission Context (partial): Instruction: How might the period of academic institutionalization be assessed?  Context: [The distinct phenomenon of strategic studies emerged as an imported American specialty. It emerged in the US and was exported to Europe. European security studies was ""theory has already been done"" kind of work., The think tanks became routine producers of narrow technical problem-solving succumbing to 'hectic empiricism': the internal logic of its key contribution (deterrence) broke down., Peace research developed on a parallel but separate track, and particularly the distinct critical branch was seen neither by its representatives nor by security studies as part of the latter., All of these options.]... Initial Core Idea from ROT (partial): Okay, here's my complete response, including reasoning and the final output:  **Reasoning:**  The provided context describes the development and evolution of strategic studies, focusing on its institutionalization. To assess the period of institutionalization, we need to identify key indicators within the text. These indicators include:  1.  **Geographical Spread:** The field's emergence in the US and subsequent export to Europe suggests a diffusion of the discipline. 2.  **Specialization and Professionalization:** The rise of think tanks engaged in routine problem-solving indicates a move towards professionalization and practical application. 3.  **Fragmentation:** The development of peace research as a separate and distinct track highlights a fragmentation of the field. 4.  **Empirical Focus:** The mention of ""hectic empiricism"" suggests a strong emphasis on empirical research, potentially at the expense of theoretical development. 5.  **Theoretical Evolution:** The breakdown of the internal logic of deterrence suggests a critical examination and potential evolution of core theoretical frameworks.  Based on these indicators, we can formulate a description of how the period of academic institutionalization can be assessed.  **Output:**  The period of academic institutionalization can be assessed by examining the field's geographical expansion (e.g., from the US to Europe), the rise of specialized institutions like think tanks focused on practical problem-solving and empirical research, the fragmentation into distinct sub-fields like peace research operating independently from mainstream security studies, and the evolution or breakdown of core theoretical frameworks, such as deterrence. The shift towards ""hectic empiricism"" and the perceived lack of theoretical innovation in some regions (e.g., European security studies) also serve as indicators of the stage and characteristics of institutionalization.... Initial Core Idea from GOT (partial): This is a very strong and comprehensive answer. You've taken the limited context and built a robust framework for assessing the academic institutionalization of strategic studies. Here's a breakdown of why it's effective and a few minor suggestions:  **Strengths:**  *   **Focus on Funding Ecosystem:**  This is an excellent central organizing principle. Funding is a tangible and traceable element that reveals a lot about priorities, influence, and sustainability. *   **Detailed Breakdown of Funding Sources:** The categorization of funding sources (Government, Foundation, Private Sector, Internal) is crucial.  Each source carries different implications for the field's autonomy and direction. *   **Types of Funding Mechanisms:**  Distinguishing between project-based grants, endowed chairs, and dedicated centers is critical for understanding the depth and longevity of institutionalization. *   **Emphasis on Intellectual Independence:** You rightly highlight the potential for funding to compromise academic freedom and critical thinking. This is a core concern when analyzing fields with close ties to government or the military-industrial complex. *   **Comparative Analysis:**  Comparing funding patterns with related fields provides valuable context and helps determine the relative prominence of strategic studies. *   **Curriculum and Degree Program Analysis:** This section adds another important dimension to the assessment, focusing on the formal integration of strategic studies into academic structures. *   **Actionable Steps:** The suggestions are clear and actionable, making it easy to translate the framework into a research project. *   **Addresses Context:** You directly address the points raised in the context, such as ""hectic empiricism"" and the separation of peace research.  **Minor Suggestions for Further Refinement:**  *   **Quantifiable Metrics:** While you focus on qualitative analysis, consider adding specific quantifiable metrics where possible. For example:     *   ""Number of strategic studies programs established per decade.""     *   ""Total funding allocated to strategic studies research as a percentage of overall social science research funding.""     *   ""Number of publications in strategic studies journals compared to publications in peace research journals."" *   **Geographic Variations:**  Given the context's mention of the American origin of strategic studies, consider explicitly addressing geographic variations in institutionalization.  How did the process differ in Europe compared to the US? Were there distinct national schools of thought or funding patterns? *   **Role of Key Individuals:**  While focusing on institutions, acknowledge the role of key individuals in driving the institutionalization process.  Were there influential figures who championed strategic studies within universities or government agencies?  Their personal networks and advocacy efforts could be significant. *   **Evolving Definition of ""Strategic"":** Acknowledge that the definition of ""strategic"" itself might evolve over time.  Did the field broaden its scope to include non-military threats like climate change, pandemics, or economic security?  This evolution could be reflected in curriculum changes and funding priorities.  **Incorporating Suggestions (Example):**  Here's how you might incorporate some of the suggestions:  ""...To assess the period of academic institutionalization of strategic studies, **focus on the evolution and nature of its funding ecosystem.** This approach allows for a quantifiable and qualitative analysis of the field's establishment within academic institutions. Consider the following actions and points of analysis:  *   **Track funding sources over time:** Compile a timeline of funding sources for strategic studies programs, departments, and research centers. Differentiate between: [Existing text]      *   **Include quantifiable metrics:** Track the *number of strategic studies programs established per decade* and the *total funding allocated to strategic studies research as a percentage of overall social science research funding.*  *   **Analyze the types of funding mechanisms:** Differentiate between: [Existing text]  *   **Examine funding agreements and institutional reports:** [Existing text]  *   **Compare funding patterns with those of related fields (e.g., political science, international relations, peace research):** [Existing text] Track the *number of publications in strategic studies journals compared to publications in peace research journals* to gauge relative influence.  *   **Assess the impact of funding on the field's intellectual independence:** [Existing text]  *   **Consider Geographic Variations:** Analyze how the institutionalization of strategic studies differed geographically.  In Europe, did it face more resistance due to existing traditions of peace research?  Did different European countries adopt distinct approaches based on their national security priorities?  *   **Acknowledge the Role of Key Individuals:** Research the influential figures who championed strategic studies within universities and government agencies.  Document their personal networks and advocacy efforts.  *   **Analyze the Evolution of the Definition of ""Strategic"":**  Examine how the definition of ""strategic"" evolved over time.  Did the field broaden its scope to include non-military threats like climate change, pandemics, or economic security?  This evolution should be reflected in curriculum changes and funding priorities.  By systematically analyzing these aspects of the funding ecosystem, a more nuanced and comprehensive assessment of the period of academic institutionalization of strategic studies can be achieved...""  **In Conclusion:**  Your response is excellent. By adding a few quantifiable metrics and considering geographic variations, key individuals, and the evolving definition of ""strategic,"" you can further strengthen your framework and make it even more comprehensive. This is a well-reasoned and insightful approach to a complex topic. ... The debate will now commence focusing on these ideas."
2,ROT_Representative,"Okay, here's my response as the ROT_Representative, elaborating on my initial idea and critically evaluating the GOT idea:  **1. Elaboration on ROT Idea and its Strengths:**  My ROT idea directly addresses the core problem of assessing the period of academic institutionalization by focusing on observable and interpretable indicators derived directly from the provided context. Its key strengths lie in its:  *   **Direct Relevance to the Text:** My approach is firmly grounded in the specific details mentioned in the context: the US-Europe transfer, the rise of think tanks, the fragmentation with peace research, ""hectic empiricism,"" and the breakdown of deterrence theory. This ensures that the assessment is tailored to the specific evolution of strategic studies being discussed. *   **Multi-faceted Assessment:** It considers multiple dimensions of institutionalization, including geographical spread, professionalization, fragmentation, empirical focus, and theoretical development. This allows for a more holistic understanding of the process. *   **Simplicity and Clarity:** The indicators are easily understandable and can be applied using readily available information. For example, tracking the growth of think tanks or analyzing the content of strategic studies journals can provide valuable insights. *   **Emphasis on Intellectual Trajectory:** The focus on the breakdown of deterrence theory and the shift to ""hectic empiricism"" highlights the intellectual evolution (or stagnation) of the field, which is crucial for understanding its impact and relevance. This acknowledges the importance of internal theoretical development, not just external markers of institutional success.  My approach suggests that the assessment of institutionalization isn't just about counting programs and funding, but also about evaluating the *quality* and *impact* of the intellectual work being produced. The ""hectic empiricism"" point is particularly relevant here. Institutionalization can lead to a focus on producing research that is easily fundable and policy-relevant, potentially sacrificing theoretical depth and critical analysis.  **2. Critical Evaluation of the GOT Idea (Funding Ecosystem):**  While the GOT idea's focus on the ""funding ecosystem"" is a valuable perspective, it has several potential weaknesses and limitations compared to my ROT approach:  *   **Overemphasis on External Factors:** The GOT idea prioritizes funding sources and mechanisms. While funding is undoubtedly important, it can overshadow the intellectual and academic aspects of institutionalization. Focusing *solely* on funding risks reducing the assessment to a purely economic analysis of academic activity, missing the nuanced dynamics of intellectual development, curriculum design, and theoretical debates within the field. *   **Potential for Correlation vs. Causation Fallacy:** Increased funding doesn't automatically equate to successful or meaningful institutionalization. A field might attract substantial funding due to political trends or perceived relevance, even if its intellectual contributions are limited or its impact is questionable. ROT idea avoids this by focusing on the actual outputs and intellectual shifts within the field. *   **Indirect Relationship to the Context:** While the GOT response commendably attempts to link its idea back to the original context, the connection feels somewhat forced. For instance, while ""hectic empiricism"" *might* be driven by funding pressures, my ROT approach makes a more direct connection by interpreting it as an indicator of a specific phase in the intellectual development of the field. *   **Ignoring the ""Demand"" Side:** The GOT approach focuses primarily on the ""supply"" side of institutionalization (i.e., funding). It pays less attention to the ""demand"" side: the intellectual needs and interests of students and researchers, the debates shaping the field, and the evolving nature of strategic challenges. My ROT approach, by focusing on theoretical evolution and fragmentation, acknowledges the importance of these internal dynamics. *   **Risk of Teleological Bias:** The emphasis on ""institutionalization"" as a uniformly positive process can lead to a teleological bias, assuming that more institutionalization is always better. In reality, institutionalization can stifle creativity, promote conformity, and lead to the marginalization of dissenting voices (as suggested by the separation of peace research). My approach, by acknowledging fragmentation and theoretical breakdown, allows for a more critical assessment of the consequences of institutionalization.  **Why my ROT approach is preferable:**  My ROT approach is preferable because it:  *   **Starts with the Intellectual Core:** It prioritizes understanding the intellectual development and dynamics of strategic studies, rather than simply focusing on external markers of success. *   **Is More Context-Sensitive:** It is more directly linked to the specific details and nuances of the provided text. *   **Allows for a More Critical Assessment:** It does not assume that institutionalization is inherently positive and acknowledges the potential downsides of professionalization and empirical focus. *   **Provides a More Holistic View:** By considering multiple dimensions of institutionalization, it offers a more comprehensive understanding of the process.  While funding is undeniably an important factor, it should be considered within a broader framework that also accounts for the intellectual evolution, internal dynamics, and potential limitations of academic institutionalization. My ROT approach provides such a framework."
3,GOT_Representative,"Okay, here's my response as the GOT_Representative, elaborating on my initial idea and critically evaluating the ROT idea:  **1. Elaboration on the GOT Idea and its Strengths:**  The core of the GOT idea is that analyzing the *funding ecosystem* provides the most robust and comprehensive method for assessing the academic institutionalization of strategic studies. This approach is strong because:  *   **It's a Tangible and Traceable Proxy for Institutionalization:** Funding represents a concrete commitment to strategic studies. Tracing where the money comes from, how it's allocated, and what it supports offers a direct line of sight into the field's priorities, influence, and long-term sustainability. Unlike abstract intellectual trends, funding is documented and can be analyzed systematically. *   **Reveals Power Dynamics and Influence:** The source of funding (government, private sector, foundations) reveals the power dynamics shaping the field. Heavy reliance on government funding might indicate a field closely aligned with state interests, potentially limiting critical perspectives. Foundation funding might signal a broader intellectual agenda. Understanding these influences is crucial for assessing the field's autonomy and intellectual independence. *   **Provides a Holistic View of Institutionalization:** The funding ecosystem encompasses various aspects of institutionalization: the establishment of academic programs, the creation of research centers, the funding of individual researchers, and the dissemination of research findings. By analyzing the funding flows, we can get a holistic picture of how strategic studies is being integrated into the academic landscape. *   **Enables Comparative Analysis:** Funding patterns can be compared across institutions, countries, and even related fields (e.g., political science, international relations, peace research). This allows us to assess the relative prominence and influence of strategic studies and identify unique characteristics of its institutionalization. *   **Addresses Long-Term Viability:** Endowments, dedicated research centers, and long-term grants are indicators of a field's long-term viability and institutional entrenchment. Project-based grants, while valuable, provide a less certain foundation for sustained academic activity. *   **Actionable and Researchable:** Focusing on the funding ecosystem provides a concrete and actionable research agenda. Researchers can identify funding sources, analyze grant proposals, examine institutional budgets, and track the career paths of funded researchers. This makes the GOT idea practical and empirically verifiable.  **2. Critical Evaluation of the ROT Idea:**  While the ROT idea of assessing institutionalization through geographical spread, specialization, fragmentation, empirical focus, and theoretical evolution has merit, it suffers from several limitations compared to the GOT approach:  *   **Difficulty in Measurement and Quantification:** The ROT idea relies heavily on qualitative assessments of intellectual trends. While important, concepts like ""hectic empiricism"" or ""breakdown of deterrence theory"" are difficult to measure objectively and consistently. This makes it challenging to compare across institutions or time periods. The GOT idea, by focusing on funding, offers a more quantifiable and comparable metric. *   **Potential for Subjectivity and Bias:** Interpreting intellectual trends is inherently subjective. Different researchers might have different interpretations of what constitutes ""hectic empiricism"" or whether deterrence theory has truly ""broken down."" The GOT idea, by focusing on funding data, reduces the potential for subjective bias. *   **Limited Explanatory Power:** While the ROT idea can describe the characteristics of institutionalization (e.g., fragmentation, empirical focus), it doesn't necessarily explain *why* these characteristics emerged. The GOT idea, by focusing on funding sources and mechanisms, can shed light on the underlying drivers of these trends. For example, a heavy reliance on government funding might explain the emphasis on policy-relevant research and the neglect of critical perspectives. *   **Overlooks the ""Supply"" Side of Ideas:** The ROT idea focuses primarily on the ""demand"" side of intellectual development – the internal debates and theoretical evolution of the field. However, it overlooks the ""supply"" side: the resources and incentives that shape the production and dissemination of ideas. Funding plays a crucial role in shaping the supply of ideas by determining which research projects get funded, which scholars get hired, and which journals get published. *   **Less Directly Linked to Institutionalization:** While intellectual trends are undoubtedly important, they don't necessarily equate to institutionalization. A field might have a vibrant intellectual community without being formally integrated into academic institutions. The GOT idea, by focusing on funding flows within academic institutions, provides a more direct measure of institutionalization. *   **Less Actionable Research Agenda:** The ROT idea provides a less actionable research agenda. While researchers can analyze the content of strategic studies journals, it's difficult to systematically track the evolution of intellectual trends or assess the impact of ""hectic empiricism."" The GOT idea, by contrast, provides a clear and concrete set of research questions that can be addressed using readily available data. *   **Less Sensitive to Power Dynamics:** The ROT idea doesn't explicitly address the power dynamics that shape the field. The GOT idea, by analyzing funding sources, can reveal the influence of government agencies, private foundations, and other actors on the direction of strategic studies.  **Why the GOT Approach is Preferable:**  The GOT approach is preferable because it provides a more tangible, quantifiable, and explanatory framework for assessing the academic institutionalization of strategic studies. While intellectual trends are undoubtedly important, they should be considered within the context of the funding ecosystem that shapes the production and dissemination of knowledge. The GOT idea offers a more systematic and actionable way to understand how strategic studies has been integrated into the academic landscape and what factors have shaped its development. It is also more attuned to the power dynamics inherent in the funding process, offering a more critical perspective on the field's evolution."
