Round,Speaker,Utterance
1,Moderator,"Debate Topic: In-depth discussion based on the mission context and ideas from ROT and LOT. Mission Context (partial): Instruction: Arguing that someone couldn't have done something good because he is incapable of doing good commits the fallacy of  Context: The following are multiple choice options:[Begging the question, False dilemma, Accident, False dichotomy]... Initial Core Idea from ROT (partial): The fallacy described is **Begging the question**.  **Reasoning:**  Begging the question (also known as circular reasoning) occurs when an argument's premise assumes the truth of the conclusion. In this case, arguing that someone *couldn't* have done something good *because* they are incapable of doing good is circular. It assumes the very thing it's trying to prove: that the person is incapable of doing good. The premise relies on the conclusion, making it a fallacious argument.  The other options are not applicable:  *   **False dilemma:** Presents only two options when more exist. *   **Accident:** Applying a general rule to a specific case it was not intended to cover. *   **False dichotomy:** Similar to false dilemma, presenting a situation as having only two mutually exclusive options when other possibilities exist.... Initial Detailed Plan from LOT (partial): Aggregated result from layer 11 (Concept: 'Generate and present the answer based on the plan...') using strategy 'all_content_ranked': - (Criterion: 'Refine the definition of ""Accident"" fallacy to explicitly address misapplication of general rules about character or inherent traits, and re-evaluate its fit to the prompt', Level: 1):   The fallacy of Accident occurs when a general rule is applied to a specific case it was not intended to cover. While the general rule might be valid in most situations, applying it rigidly to an exceptional case leads to an incorrect conclusion.  In the context of the prompt, the argument claims someone is *incapable* of doing good, implying a general rule about their character or inherent traits. The fallacy lies in assuming this general negative assessment of their character *necessarily* precludes them from performing a good action in a specific instance. It's an accidental misapplication of the general rule about their character to a specific act. Perhaps the person acted out of self-interest, or was coerced, or simply had a moment of unexpected altruism. The general rule about their character doesn't *automatically* invalidate any potential good deed they might do.  - (Criterion: 'Research and define the ""Ad Hominem"" fallacy and its variations (e.g., circumstantial, abusive), assessing if attacking the person's character directly better explains the argument's flaw than ""Accident""', Level: 1):   Okay, let's research and define the *Ad Hominem* fallacy and its variations to see if it's a better fit than ""Accident"" for the prompt's scenario:  **Ad Hominem Fallacy:**  The *ad hominem* fallacy (Latin for ""to the person"") is a type of informal fallacy in which an argument is rejected based on irrelevant facts about the person presenting the argument, rather than on the merits of the argument itself. Essentially, it's an attack on the person making the argument, rather than the argument itself.  **Variations of Ad Hominem:**  *   **Abusive Ad Hominem:** This is the most direct form of the fallacy. It involves attacking the person's character, intelligence, morals, etc., to discredit their argument. Example: ""You can't trust John's opinion on climate change because he's a convicted criminal.""  *   **Circumstantial Ad Hominem:** This form suggests that the person's circumstances or affiliations make their argument invalid. It implies that the person is biased or has ulterior motives. Example: ""Of course, the CEO of the oil company supports drilling in the Arctic; he's just trying to protect his profits.""  *   **Tu Quoque (You Also):** This variation attempts to discredit an argument by pointing out that the person making the argument is hypocritical or has acted inconsistently with their claim. Example: ""You can't tell me to quit smoking; you used to smoke too!""  **Relevance to the Prompt:**  The prompt states: ""Arguing that someone couldn't have done something good because he is incapable of doing good commits the fallacy of...""  This scenario *strongly* suggests an *ad hominem* fallacy. The argument isn't addressing the *action* of doing something good; instead, it's attacking the *person's character* by asserting their inherent inability to do good. This is a direct attack on their character, and it dismisses the possibility of the good deed solely based on a negative assessment of the person. This aligns perfectly with the *abusive ad hominem* variation.  **Why Ad Hominem is better than Accident:**  The ""Accident"" fallacy occurs when a general rule is applied to a specific case where it doesn't fit. For example: ""Cutting people with knives is a crime. Surgeons cut people with knives. Therefore, surgeons are criminals."" The prompt doesn't involve misapplying a general rule. It focuses on attacking the person's character to dismiss the possibility of a good deed.  **Conclusion:**  The *Ad Hominem* fallacy, specifically the *abusive* variation, is a far better explanation for the argument's flaw than ""Accident."" The argument directly attacks the person's character, claiming they are incapable of doing good, rather than addressing the action itself.  - (Criterion: 'Explore the ""Appeal to Pity"" fallacy', Level: 1):   The ""Appeal to Pity"" fallacy attempts to persuade an audience by evoking feelings of pity or sympathy, even when those feelings are irrelevant to the argument. It argues that someone should be believed or supported because of their unfortunate circumstances, rather than based on the merits of their argument or actions. This is irrelevant to the main task objective, which asks about a fallacy where someone is deemed incapable of doing good.  - (Criterion: 'Examine the ""Appeal to Authority"" fallacy to see if the argument relies on an assumed authority on someone's character', Level: 1):   The argument in question states that someone is inherently incapable of doing good, therefore they couldn't have done a specific good deed. This doesn't necessarily rely on an *appeal* to authority. It's not claiming an authority figure *said* the person is incapable. Instead, it's presenting the *person's character* as the (flawed) ""evidence"" of their inability. Therefore, exploring ""Appeal to Authority"" isn't directly relevant to identifying the fallacy in this argument. The fallacy lies in the assumption about the person's inherent character and its impact on their actions, not in citing an authority.  - (Criterion: 'Analyze the prompt in the context of ""confirmation bias"" - does the arguer selectively ignore evidence of good deeds to confirm their negative view?', Level: 1):   While the prompt doesn't explicitly mention confirmation bias, the underlying reasoning *could* be influenced by it. The arguer might be selectively ignoring or downplaying any evidence of the person's good deeds, focusing only on information that supports their pre-existing belief that the person is incapable of doing good. However, the fallacy itself is not *defined* by confirmation bias, but rather by the assumption of inherent incapability. Therefore, while confirmation bias might contribute to the faulty reasoning, it's not the core fallacy being described in the prompt. This reinforces the need to focus on the core logical fallacy rather than potential psychological biases that might be present.  - (Criterion: 'Investigate ""burden of proof"" - does the argument unfairly shift the burden of proof onto someone to *prove* they did a good deed, given the presumption of their incapability?', Level: 1):   The argument doesn't inherently shift the burden of proof in the sense of requiring someone to *prove* they did a good deed. The fallacy lies in the initial assumption of incapability. The problem isn't *proving* the good deed happened, but the *reasoning* for dismissing the possibility in the first place. It's a preemptive dismissal based on a flawed premise about the person's character or nature. While related to assumptions, the core issue isn't about who has to prove what, but about the unjustified claim of inherent inability. Therefore, while ""burden of proof"" is a related concept in argumentation, it doesn't directly address the core logical fallacy at play here. The fallacy is more about the flawed *reason* for disbelief.  - (Criterion: 'Research and define the ""No True Scotsman"" fallacy and see if it applies', Level: 1):   The ""No True Scotsman"" fallacy is a form of ad hoc reasoning used to deflect criticisms of a group. It involves changing the definition of the group to exclude the person who is doing something undesirable, thereby preserving the claim that *all* members of the group are virtuous or incapable of wrongdoing.  For example:  Person A: ""No Scotsman puts sugar on his porridge."" Person B: ""But my uncle Angus is a Scotsman, and he puts sugar on his porridge."" Person A: ""Ah, but no *true* Scotsman puts sugar on his porridge.""  While the initial statement makes a generalization about Scotsmen, the response attempts to preserve the generalization by redefining what it means to be a ""true"" Scotsman, rather than acknowledging a counterexample.  This fallacy doesn't directly relate to arguing that someone is *incapable* of doing good. It focuses on excluding individuals from a group based on their actions not aligning with a pre-conceived (and often arbitrary) notion of what that group should be like. Therefore, ""No True Scotsman"" is not the correct fallacy for the main task objective.  - (Criterion: 'Consider the role of prejudice and stereotype in the argument's structure, and whether that constitutes a specific fallacy', Level: 1):   The argument ""someone couldn't have done something good because he is incapable of doing good"" often relies on a pre-existing negative assessment of the person's character or abilities. This assessment might be based on prejudice or a stereotype. While prejudice and stereotypes contribute to the *reasoning* behind the argument, they don't, in themselves, define a specific fallacy that fits the multiple-choice options. The problem isn't primarily *how* the negative assessment was formed (e.g., through prejudice), but rather *how* that assessment is used to dismiss the possibility of the good deed. The fallacy lies in assuming the conclusion (incapability of doing good) without sufficient evidence. Prejudice might *inform* the assumption, but it's the *unsubstantiated assumption* that is the logical flaw.  - (Criterion: 'Re-evaluate ""Begging the Question"" in light of the other fallacies considered, to determine if the assumption of inherent incapability is, in fact, a form of circular reasoning.', Level: 1):   Let's analyze if the ""incapability"" argument fits ""Begging the Question"". Begging the question occurs when the conclusion is assumed in the premise. In our case, the argument is: ""X couldn't have done good (conclusion) because X is incapable of doing good (premise)."" The premise *is* the conclusion, just rephrased. The argument assumes X's inherent incapability *as the reason* they couldn't have done good, which is a circular argument.  Now, consider the other fallacies:  *   **False Dilemma/Dichotomy:** This presents only two options when more exist. Our argument doesn't limit options. *   **Accident:** This applies a general rule to a specific case where it's inappropriate. Our argument doesn't involve a general rule.  Therefore, the argument that someone couldn't have done something good because they are incapable of doing good *is* a form of begging the question because it assumes the very thing it's trying to prove. The assumption of inherent incapability *is* the core of the argument, and it's not supported by any independent evidence.  ... The debate will now commence focusing on these ideas."
2,ROT_Representative,"Okay, here's my response as the ROT Representative, elaborating on my core idea (""Begging the Question"") and critically evaluating the LOT's analysis, especially its consideration of ""Ad Hominem"" and ""Accident.""  **1. Elaboration on ""Begging the Question"" and its Strengths**  My core idea is that the fallacy described in the prompt – ""Arguing that someone couldn't have done something good because he is incapable of doing good"" – commits the fallacy of **Begging the Question**.  *   **Core Problem Addressed:** The core problem is identifying the logical flaw in an argument that dismisses a possible good deed based solely on an assertion of someone's inherent inability to do good. This is a problem of flawed reasoning and identifying the specific category of fallacy.  *   **How it Addresses the Problem:** ""Begging the Question"" directly addresses this flaw by highlighting the circularity of the argument. The argument essentially says: ""They couldn't have done good *because* they can't do good."" The premise (they can't do good) is simply a restatement of the conclusion (they couldn't have done good), offering no independent evidence or justification. It *assumes* the very point it's trying to prove.  *   **Key Strengths:**      *   **Direct Fit:** The definition of ""Begging the Question"" aligns perfectly with the structure of the argument presented in the prompt. The premise and conclusion are logically equivalent.     *   **Simplicity and Clarity:** It provides a clear and concise explanation of the fallacy, avoiding unnecessary complexity.     *   **Focus on the Core Logical Flaw:** It pinpoints the fundamental problem: the lack of independent support for the claim of inherent incapability.  **2. Critical Evaluation of the LOT's Analysis**  The LOT analysis explores several other fallacies, including ""Accident,"" ""Ad Hominem,"" ""Appeal to Pity,"" ""Appeal to Authority,"" ""No True Scotsman,"" and also touches on related concepts like confirmation bias and burden of proof. While this thoroughness is valuable, I believe the LOT overcomplicates the issue and ultimately distracts from the most accurate answer: ""Begging the Question."" I'll focus my critique on ""Accident"" and ""Ad Hominem,"" as these are the most seriously considered alternatives in the LOT output.  *   **""Accident"" Fallacy:** The LOT attempts to connect the argument to the ""Accident"" fallacy by suggesting that the claim of inherent incapability acts as a general rule that is misapplied to a specific instance. However, this is a strained interpretation. The ""Accident"" fallacy usually involves misapplying a *legitimate* general rule. For example, ""Freedom of speech is a right. Therefore, you can yell 'fire' in a crowded theater."" The problem in the prompt isn't the misapplication of a valid general rule, but the *unsubstantiated assertion* of a general rule of incapability in the first place. There is no pre-existing, widely accepted rule about this person's inability to do good. This is a crucial distinction.      *   **Weakness:** The ""Accident"" explanation requires forcing the argument into a mold that doesn't quite fit. It's not a naturally occurring instance of the ""Accident"" fallacy.  *   **""Ad Hominem"" Fallacy:** The LOT argues that the argument is an *ad hominem* attack because it attacks the person's character rather than addressing the action. While it's true the argument involves a negative assessment of the person's character, it's *not* an *ad hominem* in the strict sense. An *ad hominem* fallacy occurs when someone *rejects an argument or claim* based on irrelevant information about the person making the argument. In our case, the argument isn't rejecting *someone else's* argument; it's making a claim about the person's actions (or lack thereof) based on their perceived character. The focus isn't on discrediting *an argument* made *by* the person, but on precluding a possible action *of* the person.      *   **Weakness:** While there's a character attack involved, the purpose is to preemptively dismiss a potential good deed, not to refute an argument presented by that person. *Ad Hominem* is about discrediting *arguments*, not denying *actions*.  *   **Overlooked Aspect:** The LOT analysis, in its attempt to explore other fallacies, loses sight of the core, simple, and direct fit of ""Begging the Question."" The circular nature of the argument is the most prominent and defining characteristic, and the LOT's exploration of other fallacies distracts from this central point.  *   **Why My Approach is Preferable:** My approach is preferable because it directly addresses the core logical flaw with a single, well-defined fallacy: ""Begging the Question."" It avoids the need to force the argument into a less fitting category, and it provides a clearer and more concise explanation of why the argument is fallacious. The other fallacies, while potentially related in some tangential way, do not capture the *essence* of the flawed reasoning as accurately as ""Begging the Question"" does. The essence is the circularity, the assumption baked into the premise."
3,LOT_Representative,"Okay, here's my response as the LOT Representative, addressing the task by elaborating on my detailed plan, critically evaluating the ROT idea, and highlighting why my approach is preferable.  **1. Elaboration on How the Detailed Plan Addresses the Core Problem, Highlighting Key Strengths and Feasibility**  The core problem is to identify the logical fallacy committed when arguing that someone couldn't have done something good because they are incapable of doing good, given the options: Begging the Question, False Dilemma, Accident, and False Dichotomy.  My detailed plan addresses this problem through a multi-faceted approach:  *   **Comprehensive Fallacy Exploration:** Instead of prematurely committing to a single answer, the plan systematically explores each plausible fallacy, including ""Accident,"" ""Ad Hominem,"" ""Appeal to Pity,"" ""Appeal to Authority,"" and ""No True Scotsman,"" along with related concepts like confirmation bias and burden of proof. This ensures that no potential angle is overlooked. *   **Precise Definitions and Examples:** Each fallacy is rigorously defined, with clear examples to facilitate understanding. This allows for a more accurate application of the fallacies to the prompt's specific scenario. *   **Comparative Analysis:** The plan explicitly compares and contrasts the different fallacies, assessing their relative fit to the prompt. For instance, it directly compares ""Ad Hominem"" and ""Accident"" to determine which provides a better explanation of the argument's flaw. *   **Re-evaluation of Initial Hypothesis:** The plan includes a critical re-evaluation of ""Begging the Question"" in light of the other fallacies considered. This ensures that the initial hypothesis is not accepted without thorough scrutiny. *   **Focus on Nuance:** The plan delves into the nuances of each fallacy, considering variations like the different types of ""Ad Hominem"" arguments (abusive, circumstantial, tu quoque). This allows for a more precise diagnosis of the logical flaw.  **Key Strengths:**  *   **Thoroughness:** The plan's comprehensive approach minimizes the risk of overlooking the correct fallacy. *   **Accuracy:** The precise definitions and comparative analysis ensure a high degree of accuracy in identifying the fallacy. *   **Objectivity:** The plan avoids premature commitment to a single answer, allowing for a more objective assessment of the different options. *   **Flexibility:** The plan's exploration of multiple fallacies makes it adaptable to variations of the prompt. *   **Feasibility:** The plan is feasible within a reasonable timeframe, as it focuses on readily available information about logical fallacies.  **2. Critical Evaluation of the ROT Idea: ""Begging the Question""**  The ROT idea identifies the fallacy as ""Begging the Question,"" arguing that the premise (they are incapable of doing good) is simply a restatement of the conclusion (they couldn't have done good).  While the ROT idea has merit, it also has potential weaknesses:  *   **Oversimplification:** The ""Begging the Question"" explanation might oversimplify the argument's flaw. While there is a degree of circularity, it might not capture the *entire* problem. The argument also relies on an *unsubstantiated assumption* about the person's character, which isn't explicitly addressed by simply labeling it as ""Begging the Question."" *   **Lack of Nuance:** The ROT explanation doesn't explore the potential role of prejudice or stereotypes in the argument's reasoning. The assumption of inherent incapability might be rooted in deeper biases that are not captured by the ""Begging the Question"" label. *   **Potential for Misinterpretation:** The ""Begging the Question"" fallacy is sometimes confused with simply asking a question. A more detailed explanation might be needed to avoid this misinterpretation.  **3. Limitations of the ROT Idea Compared to the LOT Plan and Why the LOT Approach is Preferable**  The LOT plan addresses the limitations of the ROT idea through its comprehensive and nuanced approach. Here's why the LOT approach is preferable:  *   **Addresses the Root Cause:** The LOT plan, by considering ""Ad Hominem,"" gets closer to the underlying issue: the attack on the person's character as the *basis* for dismissing the possibility of a good deed. ""Begging the Question"" only describes the *structure* of the argument, not the *source* of the flawed reasoning. *   **Acknowledges Implicit Assumptions:** The LOT plan explicitly acknowledges the role of prejudice and stereotypes in the argument's reasoning, even if they don't constitute a specific fallacy within the multiple-choice options. This provides a more complete understanding of the argument's flaw. *   **Provides a More Comprehensive Explanation:** The LOT plan, through its exploration of multiple fallacies, provides a more comprehensive explanation of the argument's flaw. It acknowledges that the argument might have elements of different fallacies, even if one is more dominant than the others. *   **Reduces Risk of Misinterpretation:** The LOT plan, by providing precise definitions and examples of each fallacy, reduces the risk of misinterpretation.  In summary, while ""Begging the Question"" captures a *part* of the problem, the LOT plan's comprehensive and nuanced approach provides a more complete and accurate understanding of the argument's flaw. By exploring other fallacies, particularly ""Ad Hominem,"" the LOT plan gets closer to the root cause of the flawed reasoning and offers a more robust and defensible analysis. Therefore, the LOT approach is preferable because it minimizes the risk of oversimplification and provides a more comprehensive and nuanced understanding of the argument's flaw. Ultimately the most accurate answer from the choices provided is *Ad Hominem*."
