Round,Speaker,Utterance
1,Moderator,"Debate Topic: In-depth discussion based on the following mission context, ROT idea, GOT idea, and LOT idea. Mission Context: Instruction: The argument against the person consists of  Context: The following are multiple choice options:[ignoring another person's arguments and attacking her character instead, asserting an opposing arguer has taken an easily defeated position, which she has not really taken, causing confusion during an argument by a lack of ability to engage in refutation, using threats of harm instead of reasoning to gain agreement] Initial Core Idea from GOT: Okay, based on the provided task definition, pseudocode, case examples, and input-output format, and given the specific input:  *   `argument_description = ""ignoring another person's arguments and attacking her character instead""` *   `possible_definitions = [""ignoring another person's arguments and attacking her character instead"", ""asserting an opposing arguer has taken an easily defeated position, which she has not really taken"", ""causing confusion during an argument by a lack of ability to engage in refutation"", ""using threats of harm instead of reasoning to gain agreement""]`  The `is_ad_hominem` function should return `TRUE` because the `argument_description` is exactly the same as the defined `ad_hom_def` (""ignoring another person's arguments and attacking her character instead"").  **Answer:**  TRUE Initial Core Idea from GOT: The argument against the person (ad hominem fallacy) consists of **ignoring another person's arguments and attacking her character instead**.  Attacking her character can take many forms. This includes, but is not limited to: making irrelevant accusations of hypocrisy (e.g., ""You can't tell me not to smoke, you used to smoke!""), questioning their motives without evidence (e.g., ""You only support this policy because you'll personally benefit from it.""), or making ad hominem attacks based on their personal life or affiliations that are unrelated to the argument (e.g., ""You can't trust his opinion on healthcare, he's a member of that political party.""). These attacks are irrelevant to the validity of the argument itself and instead focus on discrediting the person making the argument.  Initial Detailed Plan from LOT: Aggregated result from layer 51 (Concept: 'Generate and present the answer...') using strategy 'all_content_ranked': - (Criterion: 'Criterion A (Level 1): State the answer directly, selecting the option that best defines ""argument against the person"" (ad hominem)', Level: 1):   The argument against the person consists of ignoring another person's arguments and attacking her character instead.  - (Criterion: 'Criterion B (Level 1): Justify the selection of the chosen option, explaining why it accurately represents the ad hominem fallacy', Level: 1):   The ad hominem fallacy, also known as ""argument against the person,"" is a type of fallacy where, instead of addressing the argument or claim being made, the person making the argument is attacked. This attack can take many forms, such as criticizing their character, motives, personal traits, or circumstances. The key is that the attack is irrelevant to the validity of the argument itself.  The option ""ignoring another person's arguments and attacking her character instead"" directly embodies this definition. It describes a scenario where the focus shifts from the merits of the argument to a personal attack on the individual presenting it. This is precisely what the ad hominem fallacy entails. The other options describe different fallacies: straw man, red herring, and appeal to force, respectively. Therefore, this option is the most accurate representation of the ad hominem fallacy.  - (Criterion: 'Criterion C (Level 2): Explain why the other options are incorrect, clarifying their respective fallacies or argumentative flaws', Level: 1):   Okay, let's break down why the other options are incorrect in the context of the ""argument against the person"" (ad hominem) fallacy:  *   **Asserting an opposing arguer has taken an easily defeated position, which she has not really taken (Straw Man Fallacy):** This describes the *straw man fallacy*. Instead of attacking the actual argument, you misrepresent it to make it easier to refute. It's about distorting the argument, not attacking the person making it.  *   **Causing confusion during an argument by a lack of ability to engage in refutation (General Incompetence/Unclear Argument):** This describes a situation where someone is simply bad at arguing or is presenting their argument poorly. While frustrating, it's not necessarily a specific fallacy. It's more about a lack of clarity or argumentative skill. It doesn't inherently involve attacking the person.  *   **Using threats of harm instead of reasoning to gain agreement (Argument from Force/Appeal to Force):** This is the *argument from force* (argumentum ad baculum). It relies on coercion or threats to win an argument, rather than logic or evidence. Again, it's a separate fallacy from attacking the person's character. It is the threat itself that is the (fallacious) argument.  - (Criterion: 'Criterion D (Level 2): Provide a simple, original example illustrating the ad hominem fallacy in action', Level: 1):   ""You can't trust Sarah's opinion on tax policy; she's a terrible mother who neglects her children.""  - (Criterion: 'Criterion E (Level 3): Discuss different types of ad hominem attacks (e.g., abusive, circumstantial, tu quoque) and how the chosen option encompasses them', Level: 1):   The argument against the person, also known as ad hominem, avoids engaging with the actual argument being presented and instead attacks the person making the argument. This attack can take several forms:  *   **Abusive ad hominem:** Directly insults or denigrates the person's character, intelligence, or appearance. For example, ""You can't trust anything John says; he's a known liar."" *   **Circumstantial ad hominem:** Argues that the person's circumstances or motivations invalidate their argument. For example, ""Of course the CEO supports this tax cut; he'll benefit from it."" *   **Tu quoque (you also):** Attempts to discredit the argument by pointing out the person's hypocrisy or inconsistency. For example, ""You can't tell me to quit smoking when you used to smoke yourself!""  The option ""ignoring another person's arguments and attacking her character instead"" perfectly encompasses all these types of ad hominem attacks. It is the core definition of the fallacy, regardless of whether the attack is abusive, based on circumstances, or a ""you also"" type of response. The other options describe different fallacies or argumentative failures.  - (Criterion: 'Criterion F (Level 3): Briefly contrast ad hominem with other fallacies that might be confused with it (e.g., straw man, appeal to authority)', Level: 1):   Ad hominem attacks the person making the argument, ignoring the argument itself. A straw man fallacy misrepresents the opponent's argument to make it easier to attack. An appeal to authority relies on an authority figure's opinion rather than providing evidence or reasoning. Thus, ad hominem focuses on the arguer, straw man on misrepresenting the argument, and appeal to authority on misplaced reliance.  - (Criterion: 'Criterion G (Level 4): Analyze the effectiveness (or lack thereof) of ad hominem arguments in persuasion, considering psychological factors', Level: 1):   Ad hominem arguments, while logically fallacious, can be surprisingly effective in persuasion, particularly in emotionally charged contexts. Psychologically, they exploit several biases.  1. **Confirmation Bias:** People tend to favor information that confirms their existing beliefs. If someone already dislikes or distrusts the person being attacked, the ad hominem argument reinforces that negative perception, making them more likely to dismiss the target's actual arguments.  2. **Halo Effect (and its inverse):** The halo effect describes how a positive impression in one area influences opinions in other areas. Ad hominem leverages the inverse. By creating a negative impression of the person (e.g., portraying them as dishonest or incompetent), the argument taints all their statements, even if those statements are logically sound.  3. **Emotional Reasoning:** Ad hominem attacks often trigger emotional responses, such as anger, disgust, or contempt. When people are in an emotional state, they are less likely to engage in rational, critical thinking. The emotional reaction overwhelms their ability to evaluate the argument's merits.  4. **Source Credibility:** People are more likely to be persuaded by sources they perceive as credible. Ad hominem attacks aim to undermine the source's credibility, making their arguments seem less trustworthy, even if the arguments themselves are valid.  5. **Social Identity Theory:** People identify with various social groups. If an ad hominem attack targets someone perceived as belonging to an ""out-group,"" individuals may be more receptive to the attack, reinforcing their own group identity and biases.  However, the effectiveness of ad hominem arguments depends on several factors:  *   **Audience:** A more educated and critical audience is less likely to be swayed by ad hominem attacks. *   **Context:** In formal debates or legal settings, ad hominem arguments are more likely to be recognized and rejected. *   **Severity of the Attack:** A mild character attack might be overlooked, while a severe and personal attack could backfire, making the attacker appear malicious and undermining their own credibility.  In conclusion, while logically flawed, ad hominem arguments can be persuasive due to psychological biases that influence how people process information and form opinions. Their effectiveness varies depending on the audience, context, and severity of the attack.  - (Criterion: 'Criterion H (Level 4): Discuss the historical use of ad hominem arguments in political or social contexts and their impact', Level: 1):   The argument against the person consists of **ignoring another person's arguments and attacking her character instead.**  - (Criterion: 'Criterion I (Level 5): Explore the legal implications of ad hominem attacks, particularly in cases of defamation or libel', Level: 1):   The main task is to identify the correct definition of an ""argument against the person"" (ad hominem). Exploring the legal implications of ad hominem attacks, while interesting, is irrelevant to the core task. The task asks for a definition, not a legal analysis. Therefore, I will skip this exploration and focus on providing the correct answer to the multiple-choice question.  **Answer:** ignoring another person's arguments and attacking her character instead  - (Criterion: 'Criterion J (Level 5): Consider the role of intent in determining whether an argument qualifies as ad hominem.', Level: 1):   An ad hominem argument, at its core, aims to discredit an argument by attacking the person making it, rather than addressing the substance of the argument itself. While the presence of personal attacks is a strong indicator, intent plays a nuanced role in definitively classifying an argument as ad hominem.  Consider these scenarios:  1. **Genuine Character Relevance:** If a person's character or past actions are directly relevant to the credibility of their argument, it might not be an ad hominem fallacy. For example, questioning the testimony of a known perjurer in a court case isn't necessarily ad hominem, as their past actions directly impact their reliability as a witness. The intent here isn't simply to insult, but to highlight a legitimate reason to doubt their claims.  2. **Accidental Character Attacks:** Sometimes, a statement might incidentally touch upon a person's character without the explicit intent of undermining their argument. For instance, pointing out a politician's lack of experience in a specific field might be relevant to their proposed policy, even if it also implies a lack of competence. The key is whether the focus remains on the policy's merit or degenerates into a purely personal attack.  3. **Malicious Intent:** The clearest cases of ad hominem involve deliberate and irrelevant attacks on a person's character with the explicit goal of discrediting their argument. This is often done to distract from the actual issue or to manipulate the audience's perception. For example, dismissing a scientist's climate change research solely because they are ""a tree-hugging liberal"" is a clear case of ad hominem based on malicious intent.  Therefore, while the presence of personal attacks is a critical factor, evaluating the speaker's intent – whether it's to discredit the argument through irrelevant personal attacks, or to highlight a relevant aspect of the person's character that impacts the argument's credibility – is essential for accurately identifying ad hominem fallacies. A genuine attempt to assess credibility, even if it involves discussing personal characteristics, is not necessarily ad hominem, while a deliberate attempt to undermine an argument through irrelevant personal attacks always is.   The debate will now commence."
2,ROT_Representative,"Okay, as the ROT (Reversal Of Thought) Representative, my core idea is that when presented with a specific input (argument description and possible definitions), the `is_ad_hominem` function should accurately identify whether the argument description matches the definition of ad hominem. In this specific case, the `argument_description` is an exact match to one of the `possible_definitions` (specifically, the ad_hom_def), so the function should return `TRUE`. This approach directly addresses the problem by focusing on precise matching and accurate identification based on the provided information. The key strength lies in its simplicity and directness: it relies on a straightforward comparison, ensuring accurate classification when a clear match exists.  Now, let's critically evaluate the GOT and LOT ideas.  **GOT Evaluation:**  The GOT idea, which defines ad hominem as ""ignoring another person's arguments and attacking her character instead"" and provides examples, is a good *explanation* of the fallacy. However, it's not directly implementable as a decision-making process for classifying an argument *as* ad hominem. It lacks a clear, operationalizable rule. While the examples are helpful for understanding, they don't provide a rigid framework for deciding whether a given argument *is* an ad hominem. The weakness here is that it's descriptive rather than prescriptive. It provides background knowledge but not a concrete algorithm. It also doesn't address the specific task of selecting from a provided list of definitions.  **LOT Evaluation:**  The LOT idea, which aggregates results from multiple layers, including defining ad hominem, justifying the selected option, explaining why other options are incorrect, and providing examples, is a more comprehensive approach. It attempts to provide a complete understanding of the ad hominem fallacy. However, it's overly complex for the simple task at hand.  *   **Weakness 1: Over-Engineering:** The LOT approach includes elements like discussing the psychological effectiveness of ad hominem arguments, historical uses, and legal implications. While these are interesting, they are irrelevant to the core task of identifying the correct definition from a given list. This adds unnecessary computational overhead. *   **Weakness 2: Redundancy:** Many of the criteria (e.g., explaining why other options are incorrect, providing examples, discussing different types of ad hominem attacks) provide redundant information for the specific task. The primary goal is to identify the correct definition, and the justifications, while helpful for understanding, are not strictly necessary for the function to operate correctly. *   **Weakness 3: Potential for Inconsistency:** Because it is built on multiple layers of reasoning, there is a risk of inconsistencies between the different layers. For instance, the explanation of intent could conflict with the primary definition if not carefully managed. *   **Weakness 4: Complexity in implementation:** Aggregating results from multiple layers, each with its own criteria and ranking system, adds complexity to the implementation. My approach, based on direct comparison, is much simpler to implement.  **Why my ROT approach is preferable:**  My ROT approach is preferable because of its:  *   **Simplicity:** It directly addresses the core task with a simple comparison, avoiding unnecessary complexity. *   **Efficiency:** It requires minimal computational resources, making it faster and more efficient. *   **Accuracy:** When there's an exact match, it guarantees accurate classification. *   **Direct applicability:** It is explicitly designed to select the correct definition from a list, which is the core task.  The GOT and LOT approaches are valuable for understanding the ad hominem fallacy in greater depth, but they are not the most efficient or effective solutions for the specific problem of identifying the correct definition from a given set of options. My ROT approach focuses on the core requirement, offering a simpler, faster, and more accurate solution in this context. The other approaches suffer from over-engineering and a lack of direct applicability to the task."
3,GOT_Representative,"Okay, as the GOT Representative, let's break down the ad hominem fallacy and evaluate the ROT and LOT ideas.  **My Core Idea (GOT):**  The argument against the person (ad hominem fallacy) consists of **ignoring another person's arguments and attacking her character instead**. Attacking her character can take many forms. This includes, but is not limited to: making irrelevant accusations of hypocrisy (e.g., ""You can't tell me not to smoke, you used to smoke!""), questioning their motives without evidence (e.g., ""You only support this policy because you'll personally benefit from it.""), or making ad hominem attacks based on their personal life or affiliations that are unrelated to the argument (e.g., ""You can't trust his opinion on healthcare, he's a member of that political party.""). These attacks are irrelevant to the validity of the argument itself and instead focus on discrediting the person making the argument.  **Strengths of my idea:**  *   **Concise and accurate:** Directly addresses the core of the fallacy. *   **Comprehensive:** Highlights various forms that ad hominem attacks can take. *   **Emphasis on Irrelevance:** Clearly states that the attack is irrelevant to the argument's validity. *   **Focus on Discrediting:** Emphasizes the attacker's goal of discrediting the person.  **Evaluation of ROT Idea:**  The ROT idea correctly identifies the definition of ad hominem based on the given input. However, it lacks depth and doesn't provide any explanation or context. It simply states ""TRUE"" because the `argument_description` matches the `ad_hom_def`.  **Weaknesses of ROT:**  *   **Lack of Explanation:** Provides no understanding of *why* it's the correct definition. *   **No Context:** Doesn't explain the different types of ad hominem or the impact of such arguments. *   **Oversimplification:** Reduces a complex fallacy to a simple boolean value. *   **No Practical Application:** Doesn't demonstrate how to identify ad hominem in real-world scenarios.  **Evaluation of LOT Idea:**  The LOT idea is much more comprehensive than the ROT. It provides a detailed breakdown of the ad hominem fallacy, including justifications, examples, and comparisons to other fallacies. It also delves into psychological factors and even touches upon historical context (though briefly).  **Strengths of LOT:**  *   **Detailed Explanation:** Offers a thorough understanding of the ad hominem fallacy. *   **Comparative Analysis:** Distinguishes ad hominem from other fallacies like straw man and appeal to authority. *   **Practical Examples:** Provides clear and relevant examples. *   **Psychological Insight:** Explores the persuasive power of ad hominem through psychological biases. *   **Addresses Different Types:** Covers abusive, circumstantial, and *tu quoque* ad hominem attacks. *   **Considers Relevance:** Acknowledges that character may sometimes be relevant (Criterion J).  **Weaknesses of LOT:**  *   **Overly Detailed for the Initial Task:** While comprehensive, some of the details (legal implications, Criterion I) are not directly relevant to the initial task of simply defining ad hominem. It tries to do too much. *   **Potential for Information Overload:** The sheer amount of information might be overwhelming for someone just trying to understand the basic definition. *   **Risk of Losing Focus:** The expansive approach could lead to losing sight of the core concept. *   **Not as Immediately Accessible:** The length and complexity make it less accessible than a concise definition.  **Why My Approach (GOT) is Preferable:**  My approach strikes a balance between conciseness and comprehensiveness. It provides a clear and accurate definition of the ad hominem fallacy while also highlighting its key characteristics and different forms. It avoids getting bogged down in excessive details that might distract from the core concept. Here's a specific comparison:  *   **Compared to ROT:** My approach provides *explanation* and *understanding*, which the ROT completely lacks. *   **Compared to LOT:** While the LOT is incredibly thorough, my approach is more *immediately accessible* and *focused*. It provides the essential information without overwhelming the user. It's a more efficient way to convey the core concept of the ad hominem fallacy. The LOT attempts to be exhaustive, which is admirable, but not necessarily ideal for initial understanding.  In summary, while the ROT is too simplistic and the LOT is overly detailed, my approach offers the best balance of clarity, accuracy, and comprehensiveness, making it the most effective way to explain the ad hominem fallacy."
