Round,Speaker,Utterance
1,Moderator,"Debate Topic: In-depth discussion based on the mission context and ideas from ROT and LOT. Mission Context (partial): Instruction: The natural law fallacy is  Context: The following are multiple choice options:[arguing that something is necessarily bad because it doesn't cost very much, substituting individual stories for a larger sample when supporting a generalization, arguing that what is true in nature must be true about humans, the same thing as the  post hoc  fallacy]... Initial Core Idea from ROT (partial): The natural law fallacy argues that what is natural is inherently good or right, and that what is unnatural is inherently bad or wrong. It's a fallacy because ""naturalness"" is not a reliable guide to morality or ethics.  Therefore, the correct answer is:  arguing that what is true in nature must be true about humans... Initial Detailed Plan from LOT (partial): Aggregated result from layer 267 (Concept: 'Generate and present the answer based on the plan...') using strategy 'all_content_ranked': - (Criterion: 'Criterion A (Level 1): Define the natural law fallacy in clear, concise language, suitable for someone unfamiliar with the concept', Level: 1):   The natural law fallacy is the error in reasoning that assumes because something occurs in nature, it is therefore good, right, or morally justifiable for humans. Conversely, it can also incorrectly assume that something unnatural is inherently bad. It's a fallacy because ""natural"" doesn't automatically equate to ""good"" or ""right"" in a moral or ethical sense.  - (Criterion: 'Criterion B (Level 1): Provide a real-world example of the natural law fallacy, illustrating its application in a specific argument or situation', Level: 1):   Okay, here's a real-world example of the natural law fallacy:  **Example:** ""Homosexuality is unnatural because it's not observed frequently in the animal kingdom. Therefore, it is morally wrong.""  **Explanation:** This argument commits the natural law fallacy because it assumes that what is ""natural"" (i.e., frequently observed in nature) dictates what is morally acceptable or right for humans. The premise that homosexuality is infrequent in the animal kingdom (which is debatable in itself) is used to justify the conclusion that it is morally wrong. This leap relies on the flawed assumption that nature is a moral guide for human behavior. Nature simply *is*; it doesn't prescribe what *ought* to be. Many things exist in nature that we would consider morally reprehensible if humans did them (e.g., infanticide in some species). This example highlights how the natural law fallacy can lead to problematic and discriminatory conclusions.  - (Criterion: 'Criterion C (Level 1): Explain why the natural law fallacy is a fallacy, highlighting the logical flaw in its reasoning', Level: 1):   The natural law fallacy is a fallacy because it assumes that what occurs in the natural world is inherently good or right, and therefore should be mirrored in human behavior or morality. The logical flaw lies in equating ""is"" with ""ought."" Just because something *is* observed in nature doesn't mean it *ought* to be the standard for human conduct. Nature is amoral; it simply *exists*. Processes like predation, disease, and death are natural, but we don't consider them morally desirable for humans to replicate. Therefore, deriving moral or ethical principles directly from natural observations is a flawed and illogical jump.  - (Criterion: 'Criterion D (Level 2): Discuss the historical context of the natural law fallacy and its origins in philosophical thought', Level: 1):   The natural law fallacy, also known as the appeal to nature, has roots in ancient philosophical thought. The core idea, that what is natural is inherently good and right, can be traced back to Stoic philosophy. Stoics believed in living in accordance with nature, seeing the natural order as divinely ordained and therefore morally correct. This idea was later adopted and adapted by Christian philosophers, who saw God's design in nature and used it as a basis for moral law.  However, the fallacy arises when one assumes that *everything* found in nature is inherently good and should be emulated by humans. This ignores the fact that nature also contains things like disease, violence, and scarcity, which are generally considered undesirable. The fallacy lies in the unjustified leap from ""it is natural"" to ""it is good"" or ""it is how things should be."" The historical context helps understand how the concept of ""natural law"" developed, but also highlights the potential for misinterpretation and the fallacious reasoning that can arise from it.  - (Criterion: 'Criterion E (Level 2): Compare and contrast the natural law fallacy with other common fallacies, such as the appeal to nature or the is-ought problem', Level: 1):   The natural law fallacy is closely related to the appeal to nature fallacy, but they are not identical. The appeal to nature fallacy argues that something is good because it is natural or bad because it is unnatural. The natural law fallacy goes further, asserting that what *is* found in nature *ought* to be true about humans, often implying a moral imperative. It's also connected to the is-ought problem, which points out the difficulty of deriving ""ought"" statements (moral claims) from ""is"" statements (factual observations). One can observe something in nature, but that observation alone doesn't dictate how humans *should* behave. For example, observing hierarchical social structures in animal populations doesn't automatically justify social inequality in human societies. This distinguishes it from the other options, which describe different fallacies like the post hoc fallacy (confusing correlation with causation) or hasty generalization (using insufficient evidence).  - (Criterion: 'Criterion F (Level 2): Analyze the psychological factors that contribute to the acceptance of the natural law fallacy', Level: 1):   The psychological factors contributing to the acceptance of the natural law fallacy often stem from a desire for simplicity and justification of existing beliefs or behaviors. People are drawn to the idea that ""natural"" equates to ""good"" because it provides a seemingly objective and authoritative basis for moral judgments. This avoids the complexities of ethical reasoning and potential conflicts with deeply held values.  Specifically:  *   **Appeal to Authority (Nature as Authority):** Nature is often perceived as powerful and beyond human control. Attributing moral authority to nature leverages this perceived power, making the argument feel more compelling.  *   **Confirmation Bias:** People tend to seek out and interpret information that confirms their pre-existing beliefs. If someone already believes a certain behavior is moral, they may be more likely to accept arguments that frame it as ""natural.""  *   **Desire for Social Order:** The natural law fallacy can be used to justify social hierarchies or norms by claiming they are ""natural"" and therefore inevitable or desirable. This can provide a sense of stability and order.  *   **Moral Intuition:** Some moral intuitions are based on evolutionary or biological predispositions. These intuitions can be mistakenly interpreted as evidence of a natural moral law.  *   **Emotional Reasoning:** The idea of aligning with nature can be emotionally appealing, especially in contexts where there is a distrust of artificiality or technology. This emotional appeal can override rational analysis of the argument.  Therefore, the natural law fallacy is appealing because it provides a seemingly objective, simple, and emotionally satisfying way to justify moral beliefs and social structures, often bypassing the need for complex ethical reasoning.  - (Criterion: 'Criterion G (Level 3): Explore the potential consequences of accepting the natural law fallacy in various domains, such as ethics, politics, and science', Level: 1):   Accepting the natural law fallacy – believing that what occurs in nature *ought* to be the standard for human behavior and law – can have significant and detrimental consequences across various domains:  *   **Ethics:** It could justify harmful behaviors based on their prevalence in the animal kingdom. For example, arguing that infidelity is acceptable because it occurs in some animal species, or that aggression is justified because it's present in nature. This hinders the development of moral codes that transcend instinctual drives. It can also lead to stagnation in ethical thinking, preventing us from striving for more just and compassionate societies.  *   **Politics:** It could be used to justify social hierarchies and inequalities. For example, arguing that a 'natural' hierarchy exists in society based on perceived biological differences (e.g., gender, race) and that therefore, certain groups are naturally entitled to more power or resources. This can lead to discriminatory policies and practices. It can also undermine efforts to create more equitable and democratic systems.  *   **Science:** It can lead to misinterpretations of scientific findings. For example, using evolutionary arguments to justify social policies without considering the complexities of human culture and agency. This can result in the application of scientific knowledge in ways that are harmful or unethical. It can also hinder scientific progress by limiting the scope of inquiry to what is considered ""natural"" or ""normal.""  In essence, accepting the natural law fallacy can lead to a justification of the status quo, even if that status quo is unjust or harmful. It hinders progress, promotes inequality, and can lead to the misuse of scientific knowledge. It's crucial to recognize that nature is descriptive, not prescriptive. What *is* in nature doesn't dictate what *ought* to be in human society.  - (Criterion: 'Criterion H (Level 3): Investigate the relationship between the natural law fallacy and cultural norms or values.', Level: 1):   The natural law fallacy often clashes with cultural norms and values because what is considered ""natural"" can be heavily influenced by cultural perspectives. For example, some cultures might view certain social hierarchies as natural and therefore justified, while others may see them as socially constructed and unjust. Similarly, views on gender roles, family structures, or dietary practices can be presented as ""natural"" within a specific cultural context, even if they are not universally accepted or biologically determined. The fallacy arises when these culturally specific ""natural"" beliefs are used to argue for the moral or social correctness of certain behaviors or institutions, ignoring the possibility of alternative perspectives and ethical considerations. This can lead to the justification of harmful practices or the suppression of marginalized groups under the guise of adhering to a ""natural order.""  ... The debate will now commence focusing on these ideas."
2,ROT_Representative,"Okay, here's my response as the ROT_Representative, addressing the task of elaborating on my core idea and critically evaluating the LOT idea.  **1. Elaboration on the ROT Idea and its Strengths**  My core idea is: ""The natural law fallacy argues that what is natural is inherently good or right, and that what is unnatural is inherently bad or wrong. It's a fallacy because 'naturalness' is not a reliable guide to morality or ethics. Therefore, the correct answer is: arguing that what is true in nature must be true about humans.""  This idea directly addresses the core problem presented in the mission context, which is to identify the correct definition of the natural law fallacy from a set of multiple-choice options. My core idea encapsulates the essence of the fallacy, highlighting the faulty reasoning that underpins it.  **Key Strengths:**  *   **Directly Answers the Question:** The ROT idea is laser-focused on answering the prompt. It doesn't get bogged down in extraneous details, making it effective for a multiple-choice question. *   **Concise and Accurate:** It provides a clear and accurate definition of the fallacy in a single sentence. *   **Highlights the Flaw:** It immediately points out why the reasoning is fallacious, emphasizing that ""naturalness"" is not a reliable indicator of morality. *   **Testable:** The ROT provides a clear definition to evaluate the answer to the multiple choice option.  **2. Critical Evaluation of the LOT Idea**  The LOT idea presents a comprehensive analysis of the natural law fallacy, covering its definition, examples, historical context, related fallacies, psychological factors, consequences, and relationship to cultural norms. While the LOT idea is thorough and insightful, it has several potential weaknesses and limitations compared to my ROT idea, especially in the context of the given mission.  **Weaknesses and Overlooked Aspects:**  *   **Overly Detailed for the Task:** The LOT idea provides far more information than is necessary to answer the multiple-choice question. While the depth of analysis is valuable in a broader context, it is inefficient and potentially distracting for the specific task at hand. The mission's context is a multiple choice, the answer should be concise. *   **Indirectly Answers the Question:** While the LOT idea defines the fallacy, it doesn't explicitly state which of the multiple-choice options is the correct answer. The user would still need to synthesize the information provided to arrive at the answer. *   **Potential for Cognitive Overload:** The sheer volume of information presented in the LOT idea could overwhelm the user, making it more difficult to identify the core concept of the natural law fallacy. *   **Delayed Gratification:** The LOT idea has to cover a lot of information before it gets to the answer, and in a time-constrained scenario, the user might not have time to read through all of that.  **Why the ROT Approach Might Be Preferable:**  My ROT idea is preferable in this specific context because it is:  *   **Efficient:** It provides the essential information needed to answer the question quickly and directly. *   **Focused:** It avoids unnecessary details, ensuring that the user focuses on the core concept of the fallacy. *   **Actionable:** It explicitly identifies the correct answer from the multiple-choice options. *   **Optimal for the Task:** Given the constraint of a multiple-choice question, the ROT idea provides a more effective and time-efficient solution.  The LOT idea is valuable as a comprehensive explanation of the natural law fallacy. However, for the specific task of identifying the correct definition from a set of multiple-choice options, my ROT idea is more efficient, focused, and actionable, making it a preferable approach. The LOT idea is suited for a more in-depth learning scenario, not a quick identification task."
3,LOT_Representative,"Okay, here's my response as the LOT_Representative, addressing the task of elaborating on my detailed plan and critically evaluating the ROT idea.  **1. Elaboration on the LOT Plan and its Strengths & Feasibility**  My detailed plan, derived from aggregated results using the 'all_content_ranked' strategy, directly addresses the core problem by providing a comprehensive understanding of the natural law fallacy. The instruction asks for the definition of the natural law fallacy, and the context provides multiple-choice options. My plan aims to equip the user with enough knowledge to confidently select the correct option.  **How it Addresses the Core Problem:**  *   **Comprehensive Definition (Criterion A):** It starts with a clear and concise definition, suitable for someone unfamiliar with the concept. This lays the foundation for understanding the fallacy. *   **Real-World Example (Criterion B):** It provides a concrete example (homosexuality) to illustrate how the fallacy is applied in real-world arguments. This makes the abstract concept more tangible. *   **Logical Flaw Explanation (Criterion C):** It explains the underlying logical flaw, highlighting the ""is-ought"" problem, making it clear *why* it's a fallacy. *   **Historical Context (Criterion D):** It delves into the historical roots of the fallacy in Stoic and Christian philosophy, providing a deeper understanding of its origins and evolution. *   **Comparison with Other Fallacies (Criterion E):** It distinguishes the natural law fallacy from related fallacies like the appeal to nature and connects it to the is-ought problem, clarifying its unique characteristics. *   **Psychological Factors (Criterion F):** It explores the psychological reasons why people might accept the fallacy, such as the appeal to authority and confirmation bias. This provides insights into its persuasive power. *   **Consequences of Acceptance (Criterion G):** It examines the potential detrimental consequences of accepting the fallacy in various domains like ethics, politics, and science, highlighting its real-world impact. *   **Relationship with Cultural Norms (Criterion H):** It explores the interplay between the natural law fallacy and cultural norms, showing how the concept of ""natural"" can be culturally relative and misused.  **Key Strengths:**  *   **Depth of Understanding:** The plan provides a deep and nuanced understanding of the natural law fallacy, going beyond a simple definition. *   **Practical Application:** The example and the discussion of consequences demonstrate the real-world relevance of the fallacy. *   **Critical Thinking:** The plan encourages critical thinking by exploring the underlying logical flaws, psychological factors, and potential consequences. *   **Contextual Awareness:** The historical and cultural context sections provide a broader perspective on the fallacy.  **Feasibility:**  While the plan is comprehensive, it is also feasible within the context of understanding the fallacy. Each criterion builds upon the previous one, creating a logical flow of information. The use of examples and clear explanations makes the complex concepts accessible. The ranking of the criteria also ensures that the most fundamental aspects of the fallacy are addressed first (Level 1 criteria), before moving on to more nuanced considerations (Level 2 and 3 criteria).  **2. Critical Evaluation of the ROT Idea**  The ROT idea states: ""The natural law fallacy argues that what is natural is inherently good or right, and that what is unnatural is inherently bad or wrong. It's a fallacy because 'naturalness' is not a reliable guide to morality or ethics. Therefore, the correct answer is: arguing that what is true in nature must be true about humans.""  While the ROT idea identifies the correct answer, it suffers from several limitations compared to the LOT plan:  **Weaknesses and Overlooked Aspects:**  *   **Lack of Depth:** The ROT idea provides a very basic definition without exploring the nuances and complexities of the fallacy. It doesn't explain *why* people are drawn to it, *how* it's used in practice, or what the *consequences* of accepting it are. *   **Insufficient Context:** The ROT idea lacks historical, psychological, and cultural context, limiting the user's overall understanding. *   **Limited Practical Application:** The ROT idea doesn't provide concrete examples of how the fallacy is used in real-world arguments, making it difficult for the user to identify it in practice. *   **Oversimplification:** By focusing solely on the definition, the ROT idea oversimplifies a complex issue and fails to address the underlying logical flaws and assumptions. *   **Doesn't address the ""is-ought"" problem"":** The ROT idea doesn't explicitly mention the ""is-ought"" problem, which is at the heart of the fallacy.  **3. Why the LOT Approach Might Be Preferable**  My LOT plan is preferable because:  *   **It provides a more complete and nuanced understanding of the natural law fallacy.** By exploring its historical roots, psychological factors, and potential consequences, it equips the user with a deeper and more critical perspective. *   **It enhances the user's ability to identify the fallacy in real-world arguments.** The concrete examples and the discussion of practical applications make the concept more tangible and relevant. *   **It promotes critical thinking.** By exploring the underlying logical flaws and assumptions, it encourages the user to question the validity of arguments based on ""naturalness."" *   **It addresses the ""is-ought"" problem directly.** The LOT plan explicitly addresses the ""is-ought"" problem, which is crucial for understanding the fallacy. *   **It is more resilient to variations in the multiple-choice options.** Even if the multiple-choice options are worded differently or present more complex scenarios, the user with a deeper understanding of the fallacy will be better equipped to select the correct answer.  While the ROT idea offers a quick and direct answer to the question, the LOT plan provides a more comprehensive and valuable learning experience. In the long run, the deeper understanding provided by the LOT plan will be more beneficial for identifying and avoiding the natural law fallacy in various contexts. The ROT approach is akin to memorizing a definition, while the LOT approach is akin to understanding the concept. While memorization can help answer a specific question, understanding allows for broader application and critical thinking. In this case, understanding is more preferable."
4,Critical_Analyst,"Okay, here's my response as the Critical_Analyst, evaluating the ROT and LOT ideas, identifying weaknesses, suggesting improvements, and providing a synthesized accurate answer.  **Evaluation of ROT's Idea:**  *   **Strengths:** ROT's idea is concise, direct, and identifies the correct answer to the multiple-choice question. It focuses on the core definition of the fallacy and why it's flawed. *   **Weaknesses:** ROT's explanation is very basic. It lacks depth and doesn't provide context, examples, or an understanding of the underlying ""is-ought"" problem. It provides a correct answer but doesn't foster a deeper understanding. It doesn't explain *why* the other options are incorrect. *   **Overlooked Aspects:** The ROT idea overlooks the historical context, psychological factors, and potential consequences of accepting the fallacy. It misses the opportunity to explain the relationship between the natural law fallacy and the appeal to nature. *   **Correctness and Completeness:** ROT is correct in identifying the core definition and the correct answer to the multiple-choice, but it is incomplete in providing a full understanding of the fallacy. *   **Improvements/Cautions:** ROT should expand its explanation to include a brief example and highlight the ""is-ought"" problem. While conciseness is good, it shouldn't sacrifice clarity and understanding.  **Evaluation of LOT's Idea:**  *   **Strengths:** LOT's idea provides a comprehensive and nuanced understanding of the natural law fallacy. It covers the definition, examples, historical context, related fallacies, psychological factors, consequences, and relationship to cultural norms. LOT provides a good foundation for understanding the fallacy and distinguishing it from other fallacies. *   **Weaknesses:** LOT's response is overly detailed for the specific task of answering a multiple-choice question. While the depth of analysis is valuable, it may be overwhelming and time-consuming. It doesn't explicitly state the answer to the multiple choice question, requiring the user to synthesize the information. *   **Overlooked Aspects:** While comprehensive, LOT could benefit from a stronger emphasis on *how* the fallacy is used in real-world arguments and *why* it's persuasive. *   **Correctness and Completeness:** LOT is correct and complete in its explanation of the natural law fallacy, but it is not optimized for answering the multiple-choice question efficiently. *   **Improvements/Cautions:** LOT should prioritize the most relevant information for answering the multiple-choice question and present it more concisely. It should explicitly state the correct answer based on its analysis.  **Balanced Overall Critique:**  Both ROT and LOT have their strengths and weaknesses. ROT is efficient and directly answers the question, but lacks depth. LOT is comprehensive but potentially overwhelming for the task at hand. The ideal solution would combine the conciseness of ROT with the depth of understanding provided by LOT.  The key is to provide enough information to understand the *essence* of the fallacy and why it's wrong, without getting bogged down in excessive detail. The focus should be on enabling the user to confidently identify the correct answer from the multiple-choice options.  ### Synthesized Accurate Answer: arguing that what is true in nature must be true about humans"
