Round,Speaker,Utterance
1,Moderator,"Debate Topic: In-depth discussion based on the following mission context, ROT idea, GOT idea, and LOT idea. Mission Context: Instruction: Which of the following describes the fallacy of appeal to popularity?  Context: [saying someone should do something because he or she dislikes someone else, saying someone should do something to be better liked by others, saying someone should do something because it will make him or her feel good, saying someone should accept an idea because of the source of the idea] Initial Core Idea from GOT: Here's the breakdown and solution to the problem:  **Reasoning:**  The core of the appeal to popularity fallacy is using the popularity or widespread belief in something as the *sole* justification for its truth or validity. We need to identify the option in the context that directly links an action or belief to its acceptance due to its popularity or the desire for social acceptance.  **Analysis of Context Options:**  *   ""saying someone should do something because he or she dislikes someone else"": This relates to personal feelings (dislike) and is not about popularity. *   ""saying someone should do something to be better liked by others"": This directly links an action to the *desire for popularity* and social acceptance. Doing something to be liked is a direct appeal to the popularity of the action or the person performing it. *   ""saying someone should do something because it will make him or her feel good"": This is about personal feelings and well-being, not popularity. *   ""saying someone should accept an idea because of the source of the idea"": This relates to the source's credibility, not the idea's popularity.  **Answer:**  The description from the ""Context"" that best represents the fallacy of appeal to popularity is:  saying someone should do something to be better liked by others Initial Core Idea from GOT: Okay, let's break this down using the refined approach.  1.  **Define the Appeal to Popularity:** The appeal to popularity (bandwagon fallacy) is the fallacy of arguing that something is true or good simply because it is popular, widely believed, or accepted by a large group of people. The popularity of an idea or action is presented as sufficient justification for its truth or value, *without* providing any other supporting evidence or sound reasoning.  2.  **Analyze the Given Context:** ""[saying someone should do something because he or she dislikes someone else, saying someone should do something to be better liked by others, saying someone should do something because it will make him or her feel good, saying someone should accept an idea because of the source of the idea]"". Let's analyze each phrase:      *   ""Saying someone should do something because he or she dislikes someone else"": This is an example of an *argumentum ad hominem* (attacking the person/their motives rather than the idea itself) or possibly a *poisoning the well* fallacy.     *   ""Saying someone should do something to be better liked by others"": This is an *appeal to the desire for social acceptance* (or *appeal to peer pressure*). It's related to the appeal to popularity, but focuses on the individual's desire for approval rather than the general belief.     *   ""Saying someone should do something because it will make him or her feel good"": This is an *appeal to emotion* (specifically, pleasure or gratification) and could be a *hedonistic fallacy*.     *   ""Saying someone should accept an idea because of the source of the idea"": This can be an *appeal to authority* if the source is presented as an authority on the topic. If the source is simply a celebrity or a person without relevant expertise, it could be a *false authority*.  3.  **Identify Other Potential Fallacies in the Context:** As detailed above, we've identified *argumentum ad hominem*, *poisoning the well*, *appeal to the desire for social acceptance*, *appeal to emotion*, *hedonistic fallacy*, *appeal to authority*, and *false authority*.  4.  **Compare and Contrast:** We need to identify which of these phrases or a related concept directly represents the appeal to popularity. The key is the *popularity* aspect - the idea that something is true or good *because* many people believe it. None of the original options directly state this, but one is closely related.  5.  **Choose the Correct Answer:** The closest option to the appeal to popularity from the original context is ""saying someone should do something to be better liked by others"". While not a perfect fit, this is an example of leveraging social pressure to get someone to do something, and to do that, you may have to go along with what the majority are doing, which is an appeal to popularity in a roundabout way.  **Enhancement (Based on the expanded thought):**  To improve the answer, we can add an option that directly represents the core of the appeal to popularity:  **Revised Context Options (with an added option):**  *   Saying someone should do something because he or she dislikes someone else. *   Saying someone should do something to be better liked by others. *   Saying something is true because many people believe it. *   Saying someone should do something because it will make him or her feel good. *   Saying someone should accept an idea because of the source of the idea.  In this revised scenario, the correct answer would be: **Saying something is true because many people believe it.** This option directly reflects the core of the appeal to popularity fallacy.  Initial Detailed Plan from LOT: Aggregated result from layer 159 (Concept: 'Generate and present the answer...') using strategy 'all_content_ranked': - (Criterion: 'Criterion A (Level 1): Define ""appeal to popularity"" in a single, concise sentence', Level: 1):   Appeal to popularity is the fallacy of arguing that something is true or good simply because it is popular.  - (Criterion: 'Criterion B (Level 1): Provide a direct example of the ""appeal to popularity"" fallacy', Level: 1):   Here's a direct example of the ""appeal to popularity"" fallacy:  ""Everyone is buying this new phone, so you should too. It's the most popular model!""  - (Criterion: 'Criterion C (Level 2): Identify the key words or phrases commonly associated with the ""appeal to popularity"" fallacy', Level: 1):   The ""appeal to popularity"" fallacy is strongly associated with phrases like:  *   ""Everyone else is doing it."" *   ""Most people believe..."" *   ""It's the popular thing to do."" *   ""Everyone likes..."" *   ""The majority agrees..."" *   ""It's what's trending."" *   ""Because it's popular...""  - (Criterion: 'Criterion D (Level 2): Contrast ""appeal to popularity"" with another fallacy (e.g., appeal to emotion) focusing on their differences', Level: 1):   Appeal to popularity, also known as *argumentum ad populum*, hinges on the belief that something is true or good simply because it is popular or widely accepted. This differs from an appeal to emotion, which attempts to persuade by manipulating the audience's feelings rather than relying on logic or evidence. While an appeal to popularity uses the *number* of people who believe something as justification, an appeal to emotion uses the *strength* of feelings (fear, pity, joy, etc.) as justification. For example, ""Everyone is buying this product, so it must be good"" is an appeal to popularity. Conversely, ""If you don't donate to this charity, innocent children will suffer"" is an appeal to emotion. Both are fallacies, but they employ different tactics to sway an audience.  - (Criterion: 'Criterion E (Level 2): Describe a scenario where the ""appeal to popularity"" is used to persuade someone', Level: 1):   Here's a scenario demonstrating the fallacy of appeal to popularity:  Sarah is trying to convince her friend, Mark, to start vaping. She says, ""Everyone at school is vaping these days, Mark! If you don't start, you're going to be left out and no one will want to hang out with you. All the cool kids are doing it!""  This illustrates the appeal to popularity because Sarah is urging Mark to vape *solely* because it's a popular behavior among his peers, and he risks social exclusion if he doesn't conform. The argument doesn't address the health risks or any other valid reasons for or against vaping; instead, it focuses on the desire to be accepted and belong to a group.  - (Criterion: 'Criterion F (Level 3): Explain how the ""appeal to popularity"" relates to social media trends and influence', Level: 1):   The fallacy of appeal to popularity is strongly connected to social media trends and influence. Social media platforms thrive on popularity metrics like likes, shares, and followers. This creates an environment where ideas, products, or behaviors can gain traction simply because they are popular, even if they lack merit or are potentially harmful.  For example, a diet fad might gain popularity on TikTok due to influencers promoting it, regardless of scientific evidence supporting its effectiveness or safety. People might adopt the diet simply because ""everyone else is doing it"" and they want to fit in or gain social approval (likes, comments). This is a clear example of the appeal to popularity fallacy driving behavior within the social media landscape. The pressure to conform to trending behaviors, fueled by the desire for social validation, makes individuals susceptible to this fallacy.  - (Criterion: 'Criterion G (Level 3): Develop a ""test yourself"" question to identify the ""appeal to popularity"" fallacy', Level: 1):   Which of the following statements BEST exemplifies the appeal to popularity fallacy?  a) ""You should vote for Sarah because she's the most popular candidate."" b) ""You should study hard because it will make you feel good about yourself."" c) ""You should trust this doctor because he has years of experience."" d) ""You should take this medicine because your friend recommended it.""  - (Criterion: 'Criterion H (Level 3): Analyze the potential for misinformation to be spread through the ""appeal to popularity"" fallacy.', Level: 1):   The appeal to popularity fallacy is particularly susceptible to spreading misinformation. Because this fallacy relies on the idea that something is true or good simply because many people believe it, it bypasses critical thinking and evidence-based reasoning. This creates fertile ground for false information to flourish. If a false claim gains traction and becomes popular, the appeal to popularity fallacy can then be used to reinforce the belief, even in the face of contradictory evidence. This is because individuals might be pressured to accept the false claim to fit in, be liked, or avoid social ostracism. This can lead to the rapid and widespread dissemination of misinformation, making it difficult to correct and potentially causing significant harm.   The debate will now commence."
2,ROT_Representative,"Okay, as the ROT Representative, I'll provide an analysis of the problem, my approach, and then critically evaluate the GOT and LOT ideas.  **My Core Idea: Reversal of Thought (ROT) for Fallacy Identification**  My core idea, as the ROT Representative, is to *reverse* the typical thought process. Instead of simply identifying the ""appeal to popularity"" based on its surface-level characteristics (which is what the GOT and LOT primarily do), I focus on the *underlying logic* and *motivation* that drives the fallacy. This involves a deeper understanding of the psychological factors at play, the desire for social acceptance, and the avoidance of social rejection. My approach emphasizes the *reasoning* behind the fallacy, not just its superficial features.  In this specific case, I would approach the problem by:  1.  **Deconstructing the Core of the Appeal to Popularity:** Recognizing that it's about *substituting* widespread belief for sound reasoning. It's about saying something is *true or good solely because many people believe it*. 2.  **Identifying the Underlying Motivation:** The motivation is often the desire to conform, to be liked, or to avoid being ostracized. 3.  **Analyzing the Given Options through the ROT Lens:** Evaluating each option not just based on keywords but on whether it reflects this underlying logic and motivation. Does it highlight the substitution of popularity for evidence? Does it leverage the desire for social acceptance? 4.  **Focusing on the ""Why"":** The ROT approach emphasizes *why* the fallacy works – the psychological manipulation at play.  **Key Strengths of My Approach:**  *   **Deeper Understanding:** The ROT approach promotes a deeper understanding of the fallacy's root causes. *   **More Robust Identification:** It's less susceptible to being fooled by superficially similar but logically different statements. *   **Focus on the ""Human Element"":** It acknowledges the psychological drivers behind logical fallacies. *   **Generalizability:** The ROT principle can be applied to other fallacies, fostering a more complete understanding of critical thinking.  **Critique of the GOT Idea:**  The GOT (Graph Of Thoughts) approach, while detailed and comprehensive, has some limitations when compared to the ROT methodology:  *   **Surface-Level Analysis:** The GOT relies heavily on identifying keywords and providing examples. It's good at *describing* the fallacy but may not fully grasp the *underlying reasoning*. *   **Lack of Emphasis on Motivation:** The GOT touches on the social aspects, but it doesn't make the *desire for social acceptance* the central focus of the analysis. This is a crucial element in understanding why the appeal to popularity is so effective. *   **Potential for Oversimplification:** The GOT's step-by-step breakdown, while helpful, can sometimes lead to a checklist approach rather than a truly critical analysis. *   **Less Adaptive:** The GOT's structure might struggle with more subtle or nuanced examples of the fallacy.  **Critique of the LOT Idea:**  The LOT (Layer Of Thoughts) idea, which aggregates information, suffers from similar drawbacks as the GOT:  *   **Reliance on Pre-defined Criteria:** The LOT is based on a set of predefined criteria, and may be limited by the criteria's scope. *   **Focus on Features, Not Motivation:** The LOT's criteria tend to focus on the *features* of the fallacy (e.g., keywords, examples) rather than the underlying *motivation* and the *reasoning*. *   **Lack of a Holistic View:** The LOT may not provide a truly *holistic* understanding of the fallacy. *   **Potential for Missing Nuance:** The LOT's reliance on criteria might lead to overlooking the subtle nuances of the fallacy.  **Why My Approach is Preferable:**  The ROT approach is preferable because it offers a more fundamental and insightful understanding of the appeal to popularity. By focusing on the underlying *reasoning* and the *psychological drivers*, the ROT method provides:  *   **A More Robust and Reliable Method:** It is less susceptible to being misled by superficial similarities. *   **A Deeper Level of Comprehension:** It fosters a more comprehensive understanding of *why* the fallacy is persuasive. *   **Greater Adaptability:** It can be applied to more complex and subtle examples of the fallacy. *   **A Foundation for Critical Thinking:** It builds a stronger foundation for identifying and resisting other logical fallacies.  In short, while the GOT and LOT approaches offer valuable information, my ROT approach aims to provide a more profound and insightful understanding of the appeal to popularity by focusing on its underlying logic and the psychological factors that make it so effective."
3,GOT_Representative,"Okay, let's break this down using the refined approach.  1.  **Define the Appeal to Popularity:** The appeal to popularity (bandwagon fallacy) is the fallacy of arguing that something is true or good simply because it is popular, widely believed, or accepted by a large group of people. The popularity of an idea or action is presented as sufficient justification for its truth or value, *without* providing any other supporting evidence or sound reasoning.  2.  **Analyze the Given Context:** ""[saying someone should do something because he or she dislikes someone else, saying someone should do something to be better liked by others, saying someone should do something because it will make him or her feel good, saying someone should accept an idea because of the source of the idea]"". Let's analyze each phrase:      *   ""Saying someone should do something because he or she dislikes someone else"": This is an example of an *argumentum ad hominem* (attacking the person/their motives rather than the idea itself) or possibly a *poisoning the well* fallacy.     *   ""Saying someone should do something to be better liked by others"": This is an *appeal to the desire for social acceptance* (or *appeal to peer pressure*). It's related to the appeal to popularity, but focuses on the individual's desire for approval rather than the general belief.     *   ""Saying someone should do something because it will make him or her feel good"": This is an *appeal to emotion* (specifically, pleasure or gratification) and could be a *hedonistic fallacy*.     *   ""Saying someone should accept an idea because of the source of the idea"": This can be an *appeal to authority* if the source is presented as an authority on the topic. If the source is simply a celebrity or a person without relevant expertise, it could be a *false authority*.  3.  **Identify Other Potential Fallacies in the Context:** As detailed above, we've identified *argumentum ad hominem*, *poisoning the well*, *appeal to the desire for social acceptance*, *appeal to emotion*, *hedonistic fallacy*, *appeal to authority*, and *false authority*.  4.  **Compare and Contrast:** We need to identify which of these phrases or a related concept directly represents the appeal to popularity. The key is the *popularity* aspect - the idea that something is true or good *because* many people believe it. None of the original options directly state this, but one is closely related.  5.  **Choose the Correct Answer:** The closest option to the appeal to popularity from the original context is ""saying someone should do something to be better liked by others"". While not a perfect fit, this is an example of leveraging social pressure to get someone to do something, and to do that, you may have to go along with what the majority are doing, which is an appeal to popularity in a roundabout way.  **Enhancement (Based on the expanded thought):**  To improve the answer, we can add an option that directly represents the core of the appeal to popularity:  **Revised Context Options (with an added option):**  *   Saying someone should do something because he or she dislikes someone else. *   Saying someone should do something to be better liked by others. *   Saying something is true because many people believe it. *   Saying someone should do something because it will make him or her feel good. *   Saying someone should accept an idea because of the source of the idea.  In this revised scenario, the correct answer would be: **Saying something is true because many people believe it.** This option directly reflects the core of the appeal to popularity fallacy.  ---  **Addressing the Core Problem and Highlighting Key Strengths:**  My approach directly addresses the core problem of identifying the appeal to popularity fallacy within the provided context. The key strengths are:  *   **Systematic Breakdown:** I use a structured, step-by-step approach (GOT - Graph of Thoughts) to deconstruct the problem. This ensures a logical and thorough analysis. *   **Precise Definitions:** I start with a clear and concise definition of the appeal to popularity, establishing a solid foundation for understanding. *   **Contextual Analysis:** I meticulously analyze each phrase in the given context, identifying potential fallacies. *   **Comparative Evaluation:** I compare and contrast the options, highlighting which one best aligns with the definition of the fallacy. *   **Iterative Refinement:** I recognize limitations and proactively enhance the answer by suggesting a revised context with a more direct representation of the fallacy. This demonstrates a critical understanding of the problem and a commitment to accuracy. *   **Comprehensive Fallacy Identification:** The approach identifies other related fallacies, providing a broader understanding of the landscape of logical fallacies and demonstrating expertise.  My approach is preferable because it's methodical, accurate, and adaptable. It prioritizes understanding the underlying principles of the fallacy and applying them to the specific context.  **Critically Evaluating the ROT (Reversal Of Thought) Idea:**  The ROT idea provides a reasonable analysis, but has weaknesses compared to my approach:  *   **Focus on Examples, Not Core Principles:** The ROT heavily relies on examples and scenarios (e.g., phone purchase, vaping) to illustrate the fallacy. While examples are helpful, they don't necessarily deepen the understanding of the *core principle*. My approach prioritizes the definition and the application of that definition. *   **Less Emphasis on Contextual Analysis:** The ROT doesn't explicitly break down and analyze *each* option in the original context as meticulously as my approach. This means it might miss subtle nuances or alternative interpretations. *   **Overly Broad Scope (LOT):** The LOT (Layer of Thoughts) section presents a wide array of information (definitions, examples, contrasts, scenarios, social media connections, test questions, and misinformation potential). While informative, this broad scope dilutes the focus on the *specific task* of identifying the appeal to popularity in the provided context. It moves from the original mission. *   **Limited Iteration:** The ROT doesn't demonstrate the same level of iterative refinement. My approach actively seeks to improve the answer based on the initial analysis.  **Specific Weaknesses of the ROT in Relation to the Task:**  *   **The ROT's initial analysis of the context doesn't directly address the given options, but instead focuses on providing a general understanding of the fallacy.** The analysis of the phrases in the original context is more crucial than the ROT's general discussion. *   **The ROT's answer is implicit, not explicit.** It correctly identifies the correct answer, but the reasoning is not as clearly articulated as in my breakdown. The ROT’s answer hinges on the ""desire for social acceptance,"" but doesn't clearly explain how that is the ""best fit"" from the initial options, which is the key requirement.  **Why My Approach is Preferable:**  My approach is preferable because it directly targets the core problem by systematically dissecting the provided context and applying the definition of the fallacy. It prioritizes analytical rigor, clarity, and adaptability, leading to a more accurate and nuanced understanding of the appeal to popularity within the specific constraints of the task. The ROT, while providing a good overview, sacrifices precision and contextual analysis for a broader, less focused explanation."
