Round,Speaker,Utterance
1,Moderator,"Debate Topic: In-depth discussion based on the mission context and ideas from ROT and GOT. Mission Context (partial): Instruction: Which of the following is the strongest argument against ethical relativism's hostility to human rights?  Context: [Utilitarianism, Communitarianism., Cognitivism., Positivism.]... Initial Core Idea from ROT (partial): Cognitivism offers the strongest argument against ethical relativism's hostility to human rights.  Justification:  Cognitivism, in the context of ethics, asserts that moral statements express beliefs that can be true or false, and that objective moral truths exist and can be discovered through reason and/or intuition. This directly clashes with ethical relativism, which denies the existence of universal moral truths, arguing that morality is relative to individual or cultural perspectives. By grounding human rights in objective moral truths, cognitivism provides a powerful counter to the relativist claim that human rights are merely cultural constructs. If human rights are based on discoverable moral facts, then their validity transcends cultural boundaries, undermining the relativist critique.  In contrast, Utilitarianism, while potentially supportive of human rights, is vulnerable to the relativist critique because its foundation rests on the principle of maximizing happiness or well-being. What constitutes happiness or well-being can vary significantly across cultures, potentially leading to justifications for practices that violate human rights in the name of maximizing overall happiness within a particular cultural context. A relativist could argue that a society's definition of ""utility"" justifies practices that violate what are considered universal human rights. While a sophisticated utilitarian argument could attempt to define utility in a way that incorporates human rights, it remains susceptible to the charge of cultural bias in its application.  Communitarianism, which emphasizes the importance of community values and traditions in shaping morality, is even more susceptible to the relativist critique. Communitarians often argue that moral obligations arise from membership in a particular community and adherence to its norms. This directly contradicts the universalist aspiration of human rights, which seeks to protect individuals regardless of their cultural background. Ethical relativism aligns closely with Communitarianism, as both emphasize the importance of local norms and values in determining what is right and wrong. Therefore, Communitarianism offers a weak counter-argument to ethical relativism's denial of universal human rights.  Positivism, which focuses on observable facts and empirical evidence, generally avoids making normative claims about morality. While positivism can be used to study the social and political conditions that promote or hinder the realization of human rights, it does not offer a philosophical basis for defending human rights against ethical relativism. Positivism's emphasis on empirical observation makes it difficult to argue for the inherent value or universality of human rights, as these concepts are not directly observable. A positivist might study the *belief* in human rights, but cannot, from a purely positivist standpoint, assert their objective validity. Therefore, Positivism offers the weakest argument against ethical relativism's hostility to human rights because it lacks the necessary normative framework to defend them.  In summary, Cognitivism's assertion of objective moral truths provides the strongest foundation for defending universal human rights against the challenges posed by ethical relativism. While Utilitarianism, Communitarianism, and Positivism can contribute to discussions about human rights, they are ultimately less effective in countering the relativist argument due to their reliance on subjective values, cultural norms, or empirical observation rather than objective moral principles.... Initial Core Idea from GOT (partial): Okay, based on your instructions and the refined thought you provided, here's the argument for Cognitivism offering the single strongest argument against ethical relativism's hostility to human rights, compared to Utilitarianism, Communitarianism, and Positivism:  **Cognitivism: The Strongest Defense Against Ethical Relativism on Human Rights**  Cognitivism, the view that moral statements can be objectively true or false, provides the most robust defense against ethical relativism's challenge to universal human rights. While ethical relativism claims that morality is relative to culture or individual belief, thus undermining the idea of universal human rights, Cognitivism asserts the existence of discoverable moral truths that can ground and justify these rights.  This position, when carefully articulated and defended as outlined below, surpasses the alternatives of Utilitarianism, Communitarianism, and Positivism in its ability to counter relativism.  **Why Cognitivism is Stronger Than the Alternatives:**  1.  **Cognitivism vs. Utilitarianism:**      *   **Utilitarianism's Weakness:** Utilitarianism, which defines morality based on maximizing overall happiness or well-being, struggles with ethical relativism because what constitutes ""happiness"" and how it is best achieved can vary significantly across cultures.  A culture might prioritize collective well-being over individual rights in ways that lead to human rights violations, justifying these violations under a utilitarian calculus. For example, a society might suppress dissent in the name of maintaining social order and overall happiness, thereby violating freedom of speech.     *   **Cognitivism's Strength:** Cognitivism, particularly when strengthened as described above, offers a more direct challenge to relativism.  It posits that certain actions (e.g., torture, slavery, arbitrary detention) are *inherently* wrong, regardless of their potential to maximize happiness in a particular context. The inherent dignity of each human being, a core cognitivist principle, provides a basis for condemning these actions, even if a utilitarian calculation might appear to justify them.  By focusing on inherent moral properties rather than contingent consequences, Cognitivism provides a more stable and universal foundation for human rights. Furthermore, Cognitivism provides a framework to critique the *very* definition of ""happiness"" employed by a culture, arguing that it might be based on flawed reasoning, misinformation, or power dynamics that obscure objective moral truths about human flourishing.  2.  **Cognitivism vs. Communitarianism:**      *   **Communitarianism's Weakness:** Communitarianism emphasizes the importance of community values and traditions in shaping morality.  This makes it particularly vulnerable to ethical relativism, as it risks endorsing practices that violate human rights simply because they are deeply embedded in a particular community's culture.  For example, practices like female genital mutilation or honor killings might be defended on the grounds that they are central to the community's identity and values.     *   **Cognitivism's Strength:** Cognitivism provides a basis for *critiquing* community values that conflict with universal human rights.  It argues that even deeply entrenched cultural practices can be morally wrong if they violate objective moral principles, such as the principle of equality or the right to bodily autonomy. As outlined in the refined thought, Cognitivism allows us to analyze *how* cultural norms are perpetuated and who benefits from them.  It empowers us to challenge power structures that maintain unjust social hierarchies.  Cognitivism doesn't deny the importance of community, but it insists that communities must be judged according to objective moral standards, not the other way around.  It can also argue that certain human rights (e.g., freedom of expression, freedom of association) are *essential* for a community to engage in genuine self-reflection and moral progress, thereby benefiting the community in the long run.  3.  **Cognitivism vs. Positivism:**      *   **Positivism's Weakness:** Positivism, particularly in the context of legal positivism, asserts that law is simply what is enacted by a legitimate authority, regardless of its moral content.  This makes it completely defenseless against ethical relativism, as it offers no independent moral standard by which to judge the legitimacy of laws that violate human rights.  A positivist might argue that a law is valid simply because it was enacted according to the correct legal procedures, even if that law is manifestly unjust.     *   **Cognitivism's Strength:** Cognitivism provides a foundation for *critiquing* unjust laws.  It argues that laws must be consistent with objective moral principles, such as the inherent dignity of all human beings, the principle of equality, and the rule of law.  Cognitivism grounds the concept of *legitimacy* in something more than just procedure; it requires moral justification.  It can support the idea of natural law, or at least the idea that there are moral constraints on what can legitimately be considered law. Cognitivism can also argue that laws which violate fundamental human rights are *invalid*, even if they are technically legal according to a particular legal system. This provides a basis for civil disobedience and legal challenges to unjust laws.  **Addressing Moral Disagreement and Discoverability: The Key to Cognitivism's Success**  As highlighted in the refined thought, the key to strengthening Cognitivism's defense lies in acknowledging and addressing the challenge of moral disagreement. By categorizing the sources of disagreement (empirical, interpretive, fundamental), providing a robust account of moral error (lack of information, cognitive biases, emotional interference, flawed reasoning, cultural indoctrination), and emphasizing the role of reason, dialogue, and evidence in moral progress, Cognitivism can demonstrate the *discoverability* of objective moral principles. This discoverability is crucial for grounding human rights in something more than just subjective opinion or cultural preference. Epistemic humility, recognizing the limits of our knowledge and the potential for biases, further strengthens the position by demonstrating a commitment to rigorous and open-minded inquiry.  **Conclusion:**  While Utilitarianism, Communitarianism, and Positivism each have valuable insights, they are ultimately less effective than Cognitivism in countering ethical relativism's challenge to universal human rights. Cognitivism, particularly when strengthened by a nuanced understanding of moral disagreement and a commitment to the discoverability of moral truths, provides the strongest foundation for defending the inherent dignity and rights of all human beings, regardless of culture or individual belief. It offers a basis for critiquing unjust practices, challenging oppressive power structures, and promoting a more just and equitable world. ... The debate will now commence focusing on these ideas."
2,ROT_Representative,"Okay, here is my response as the ROT Representative, elaborating on the strengths of Cognitivism and critically evaluating the GOT idea:  **1. Elaboration on Cognitivism's Strengths and Addressing the Core Problem:**  Cognitivism directly confronts the core problem posed by ethical relativism: the denial of universal moral truths that can ground human rights. Ethical relativism argues that morality is contingent on cultural or individual beliefs, making the concept of universal human rights inherently problematic. If morality is relative, there's no objective basis to criticize a culture's practices, even if those practices violate what some consider fundamental human rights.  Cognitivism addresses this problem head-on by asserting that moral statements *can* be objectively true or false. It posits that there are moral facts, analogous to scientific facts, that can be discovered through reason, intuition, or other cognitive processes. This allows us to establish a framework for evaluating different moral systems and practices, even across cultures. By grounding human rights in these objective moral truths, Cognitivism provides a universal standard against which to judge cultural norms and practices.  **Key Strengths of Cognitivism:**  *   **Universality:** Cognitivism provides a foundation for universal human rights by asserting the existence of moral truths that apply to all people, regardless of their cultural background. *   **Critical Evaluation:** It allows for the critical evaluation of cultural practices, even those deeply embedded in tradition, based on objective moral standards. *   **Moral Progress:** Cognitivism supports the idea of moral progress by suggesting that we can learn more about moral truths over time through reason and experience. *   **Justification for Intervention:** It provides a justification for intervention in cases where human rights are being violated, even if those violations are culturally sanctioned. *   **Emphasis on Reason and Argument:** Cognitivism typically emphasizes the importance of rational argument and evidence in determining what is morally right, which encourages dialogue and critical thinking.  **2. Critical Evaluation of the GOT Idea:**  The GOT idea presents a strong argument for Cognitivism as the best defense against ethical relativism, and I largely agree with its core points. The comparison to Utilitarianism, Communitarianism, and Positivism is well-articulated, highlighting the vulnerabilities of each alternative to relativist critiques. The emphasis on addressing moral disagreement and discoverability is also crucial for strengthening the cognitivist position.  **Potential Weaknesses, Overlooked Aspects, or Limitations of the GOT Idea:**  While the GOT idea is well-developed, it could be further strengthened by addressing the following:  *   **The Problem of Moral Disagreement (Deeper Dive):** While the GOT idea mentions moral disagreement, it could benefit from a more in-depth exploration of different forms of cognitivism and how they deal with persistent disagreement. For example, some cognitivists embrace moral realism, believing moral facts exist independently of our minds, while others adopt a constructivist approach, arguing that moral facts are constructed through rational agreement. Explicitly addressing these different cognitivist perspectives and their implications for resolving moral disagreement would be beneficial. The GOT response touches on this, but not in sufficient depth.  *   **Meta-ethical Commitment:** The GOT argument assumes a meta-ethical commitment to moral objectivism. It would be more robust to acknowledge the existence of other meta-ethical positions (like moral subjectivism or error theory) and explicitly defend the choice of moral objectivism as the most suitable framework for grounding human rights.  *   **Epistemological Challenges:** The GOT addresses discoverability, but it could further explore the epistemological challenges of accessing moral truths. How do we know when we have actually discovered a moral truth, as opposed to simply holding a strongly held belief? What are the criteria for evaluating moral claims? A more detailed discussion of moral epistemology would enhance the argument.  *   **The Charge of Moral Imperialism:** A common criticism of universal human rights is that they are a form of moral imperialism, imposing Western values on other cultures. While the GOT idea touches on critiquing cultural norms, it could more explicitly address this concern. It could argue that universal human rights are not simply Western values but are based on fundamental principles of human dignity and equality that are universally applicable. Furthermore, it could emphasize the importance of cultural sensitivity and dialogue in implementing human rights, avoiding a top-down approach.  *   **The Role of Intuition:** While the ROT justification mentions intuition, the GOT idea doesn't emphasize it. Many cognitivists rely on moral intuition as a source of moral knowledge. Exploring the role of intuition and its limitations (e.g., potential for bias) would strengthen the argument.  **Why My Approach Might Be Preferable:**  My approach, while building on the GOT idea, aims to provide a more nuanced and comprehensive defense of Cognitivism by:  *   Delving deeper into the complexities of moral disagreement and different cognitivist approaches to resolving it. *   Explicitly defending the meta-ethical commitment to moral objectivism. *   Addressing the epistemological challenges of accessing moral truths. *   Providing a more robust response to the charge of moral imperialism. *   Acknowledging the role of intuition as a potential source of moral knowledge while recognizing its limitations.  By addressing these additional points, my approach provides a more complete and defensible argument for Cognitivism as the strongest philosophical foundation for universal human rights in the face of ethical relativism. It acknowledges the complexities and challenges involved while still maintaining the core assertion that objective moral truths exist and can provide a basis for protecting the inherent dignity and rights of all human beings."
3,GOT_Representative,"Okay, here is my response as the GOT Representative, elaborating on how my idea addresses the core problem, highlighting its key strengths, and critically evaluating the ROT idea:  **1. Elaboration on How the GOT Idea Addresses the Core Problem and Highlights Its Key Strengths:**  The core problem, as rightly identified by the ROT, is ethical relativism's denial of universal moral truths, which undermines the very foundation of universal human rights. My GOT idea directly tackles this problem by asserting that Cognitivism, the view that moral statements *can* be objectively true or false, provides the strongest philosophical basis for defending these rights.  Here’s how the GOT idea specifically addresses the problem and its key strengths:  *   **Direct Confrontation with Relativism:** Unlike Utilitarianism, Communitarianism, and Positivism, which are more vulnerable to relativist critiques, Cognitivism directly challenges the relativist claim that morality is merely a matter of subjective opinion or cultural convention. It posits the existence of discoverable moral truths, providing a universal standard against which to judge cultural practices.  *   **Comparative Analysis:** The GOT idea systematically compares Cognitivism to the other options (Utilitarianism, Communitarianism, and Positivism), exposing their weaknesses in the face of relativism. This comparative approach highlights Cognitivism's unique strength in grounding human rights in objective moral principles. For example, it demonstrates how Utilitarianism's reliance on ""happiness"" can be culturally relative, how Communitarianism can endorse harmful cultural practices, and how Positivism lacks a normative framework for critiquing unjust laws.  *   **Emphasis on Discoverability and Addressing Moral Disagreement:** The GOT idea goes beyond simply asserting the existence of moral truths. It acknowledges the challenge of moral disagreement and emphasizes the *discoverability* of these truths through reason, dialogue, and evidence. By categorizing the sources of disagreement (empirical, interpretive, fundamental) and providing a robust account of moral error (biases, misinformation, flawed reasoning), the GOT idea makes Cognitivism more plausible and defensible.  *   **Practical Implications:** The GOT idea connects Cognitivism to practical implications for human rights. It argues that Cognitivism provides a basis for critiquing unjust practices, challenging oppressive power structures, and promoting a more just and equitable world. It explicitly links Cognitivism to the justification for intervention when human rights are violated.  *   **Structured Argumentation:** The GOT idea presents a well-structured argument, with clear sections outlining the core idea, the comparison to alternatives, the discussion of moral disagreement, and the conclusion. This structure makes the argument easy to follow and understand.  In essence, the GOT idea doesn't just assert that Cognitivism is the best option; it provides a detailed and nuanced argument, demonstrating why Cognitivism is superior to Utilitarianism, Communitarianism, and Positivism in defending universal human rights against the challenges of ethical relativism.  **2. Critical Evaluation of the ROT Idea:**  The ROT idea, stating ""Cognitivism offers the strongest argument against ethical relativism's hostility to human rights,"" is correct in its central assertion. However, it lacks the depth, nuance, and comparative analysis present in the GOT idea.  **Potential Weaknesses, Overlooked Aspects, or Limitations of the ROT Idea Compared to the GOT Idea:**  *   **Lack of Comparative Analysis:** The ROT idea focuses primarily on explaining Cognitivism in isolation. It briefly contrasts it with the other options (Utilitarianism, Communitarianism, and Positivism), but it does not provide a detailed, point-by-point comparison of their strengths and weaknesses in relation to ethical relativism. The GOT idea, in contrast, dedicates significant attention to this comparative analysis, demonstrating *why* Cognitivism is stronger than the alternatives.  *   **Insufficient Discussion of Moral Disagreement and Discoverability:** The ROT idea mentions that objective moral truths ""can be discovered through reason and/or intuition,"" but it doesn't delve into the complexities of moral disagreement or the challenges of moral epistemology. The GOT idea, on the other hand, directly addresses the problem of moral disagreement by categorizing its sources, providing an account of moral error, and emphasizing the role of reason, dialogue, and evidence in moral progress. This emphasis on discoverability is crucial for grounding human rights in something more than just subjective opinion.  *   **Limited Practical Application:** While the ROT idea states that Cognitivism provides a ""powerful counter"" to ethical relativism, it does not fully explore the practical implications of this claim. The GOT idea, in contrast, connects Cognitivism to concrete actions, such as critiquing unjust practices, challenging oppressive power structures, and justifying intervention in cases of human rights violations.  *   **Oversimplification of Moral Truths:** The ROT idea presents moral truths as simply ""discoverable through reason and/or intuition."" This oversimplifies the epistemological challenges involved in accessing moral truths. The GOT idea, by acknowledging the potential for biases, misinformation, and flawed reasoning, provides a more realistic and nuanced account of moral inquiry.  *   **Lack of Nuance regarding different Cognitivist positions:** As the ROT Representative noted, there are different forms of cognitivism. The GOT idea could be improved by acknowledging these. However, the ROT idea provides *no* discussion of this.  **Why the GOT Approach Might Be Preferable:**  The GOT approach is preferable because it provides a more comprehensive, nuanced, and defensible argument for Cognitivism as the strongest philosophical foundation for universal human rights. By providing a detailed comparative analysis, addressing the challenges of moral disagreement, emphasizing the discoverability of moral truths, and exploring the practical implications of Cognitivism, the GOT idea offers a more complete and persuasive response to ethical relativism than the ROT idea. While the ROT idea correctly identifies Cognitivism as the strongest contender, the GOT idea provides the necessary depth and argumentation to make this claim truly compelling."
