Round,Speaker,Utterance
1,Moderator,"Debate Topic: In-depth discussion based on the following mission context, ROT idea, GOT idea, and LOT idea. Mission Context: Instruction: Which of the following statements best describes the postmodernist project?  Context: The following are multiple choice options:[It attempts to demonstrate the relationship between law and literature., It seeks to defend Enlightenment values., It is preoccupied with the rise of bureaucratic government., It rejects the Kantian concern with individual rights, equality, and justice.] Initial Core Idea from GOT: Okay, based on the provided task definition, case examples, and the specific input, here's my response:  **Reasoning:**  The task is to identify the statement that best describes the postmodernist project.  Postmodernism is generally characterized by skepticism towards grand narratives, a focus on relativism, deconstruction of established norms, and a critique of Enlightenment values.  *   Option 1 (""It attempts to demonstrate the relationship between law and literature."") is a valid area of study, but not a central tenet of postmodernism itself. It's more of an application of postmodern thought. *   Option 2 (""It seeks to defend Enlightenment values."") is the opposite of postmodernism, which critiques Enlightenment ideals. *   Option 3 (""It is preoccupied with the rise of bureaucratic government."") is related to postmodernism's concern with power structures, but it's not the core defining characteristic. *   Option 4 (""It rejects the Kantian concern with individual rights, equality, and justice."") aligns with postmodernism's rejection of universal, foundational principles and its emphasis on the social construction of concepts like rights and justice.  Therefore, option 4 is the most accurate description.  **Answer:**  4 Initial Core Idea from GOT: It rejects the Kantian concern with individual rights, equality, and justice.  Initial Detailed Plan from LOT: Aggregated result from layer 75 (Concept: 'Generate and present the answer...') using strategy 'all_content_ranked': - (Criterion: 'Revisit the definition of ""rejection"" in the context of postmodernism', Level: 1):   Postmodernism doesn't simply ""dislike"" Enlightenment values. Its ""rejection"" is more nuanced. It critically examines, deconstructs, and challenges the universal claims, inherent assumptions, and totalizing narratives associated with Enlightenment ideals like reason, objectivity, and universal truth. It questions whether these ideals are truly neutral and universally applicable, often arguing they serve to reinforce existing power structures and marginalize certain groups. So, ""rejection"" means a critical dismantling and questioning rather than outright dismissal of all aspects.  - (Criterion: 'Explore the ethical implications of rejecting Kantian principles', Level: 1):   Rejecting Kantian principles, such as the emphasis on individual rights, equality, and justice, has significant ethical implications. Kant's categorical imperative provides a framework for universal moral principles that apply to all rational beings. To reject this framework opens the door to ethical relativism, where morality is subjective and dependent on context or individual perspective. This could lead to:  *   **Erosion of universal human rights:** Without a grounding in principles like Kant's, the concept of universal human rights becomes vulnerable to cultural or political interpretations, potentially justifying discriminatory practices.  *   **Justification of power imbalances:** If equality is not a fundamental principle, those in positions of power may feel justified in exploiting or oppressing those with less power.  *   **Difficulty in establishing a common ground for justice:** If justice is not based on universal principles, it becomes difficult to resolve conflicts or create fair legal systems. Different groups may have conflicting ideas about what is just, with no objective way to reconcile them.  *   **Moral ambiguity and uncertainty:** Without a clear framework for ethical decision-making, individuals and societies may struggle to determine the right course of action in complex situations.  Therefore, rejecting Kantian principles requires a robust alternative ethical framework to avoid the pitfalls of moral relativism and ensure the protection of individual rights, equality, and justice. Postmodernism, in its rejection of grand narratives and universal truths, often struggles to provide such a framework, leading to criticisms about its potential for ethical nihilism. This exploration helps determine if the statement accusing postmodernism of rejecting Kantian ideals is accurate.  - (Criterion: 'Consider the potential for misinterpreting postmodernism's nuanced critique as outright rejection', Level: 1):   Okay, let's consider the potential for misinterpreting postmodernism's nuanced critique as outright rejection, specifically in relation to the multiple-choice options.  Postmodernism doesn't necessarily *outright reject* concepts like individual rights, equality, and justice. Instead, it critically examines the *foundations* upon which these concepts are built, particularly the Enlightenment's claims of universal reason and objective truth. Postmodern thinkers often argue that these concepts are historically and culturally contingent, shaped by power dynamics, and susceptible to being used to justify oppression.  Therefore, while a postmodernist might critique the *way* these values have been historically implemented or the *assumptions* underlying them, it's an oversimplification to say they entirely reject them. They might, for example, deconstruct the notion of ""universal"" rights, arguing that such claims often mask the interests of dominant groups. They might also point out the inherent contradictions and power imbalances embedded within systems that claim to uphold equality and justice.  This nuance is important because a simple ""rejection"" framing misses the complexity of the postmodernist project, which often involves questioning, deconstructing, and re-evaluating, rather than simply negating.  This consideration helps us refine our assessment of the multiple-choice options, making us more sensitive to the difference between a critical examination and an outright dismissal.  - (Criterion: 'Analyze the language used in the multiple-choice options for potential biases or oversimplifications', Level: 1):   Let's analyze the language of each option for potential biases or oversimplifications, keeping in mind the core tenets of postmodernism (rejection of grand narratives, skepticism of objective truth, focus on power dynamics, deconstruction of language, etc.).  *   **""It attempts to demonstrate the relationship between law and literature.""** While postmodernism might *include* analyzing the relationship between law and literature, it's far too narrow to be the *best* description of the entire postmodernist project. This option presents a specific application as a general definition. It's also potentially biased by framing postmodernism as simply an academic exercise, rather than a broader cultural and philosophical movement.  *   **""It seeks to defend Enlightenment values.""** This is almost certainly incorrect. Postmodernism is largely a *critique* of Enlightenment values like universal reason, objective truth, and progress. The language here is biased towards a positive view of the Enlightenment, implicitly contrasting it with a negative view of postmodernism.  *   **""It is preoccupied with the rise of bureaucratic government.""** Again, this is too specific. While postmodern thinkers might analyze bureaucracy, it's not a central defining characteristic of the entire project. The language suggests a singular focus that doesn't reflect the breadth of postmodern thought. It also implies a potentially negative connotation of ""preoccupation.""  *   **""It rejects the Kantian concern with individual rights, equality, and justice.""** This is the most plausible option. Kant's philosophy heavily influenced Enlightenment thought, and postmodernism often critiques these foundational assumptions. The language is more neutral, presenting a straightforward rejection rather than a biased portrayal. However, it could be argued that ""rejects"" is too strong; postmodernism might deconstruct or problematize these concepts rather than outright dismissing them.  In summary, the language of the options reveals potential biases and oversimplifications. Options 1 and 3 are too specific, option 2 is likely incorrect, and option 4, while the most plausible, could be refined. This analysis helps in selecting the best answer by highlighting the weaknesses of the other choices.  - (Criterion: 'Examine how postmodernism addresses issues of power and oppression differently from Kantianism', Level: 1):   Postmodernism, unlike Kantianism, often views power as diffused and pervasive, operating through discourse and social structures rather than solely through centralized authority. Kantianism, with its emphasis on universal rights and reason, tends to assume a level playing field where individuals can exercise their autonomy. Postmodernism, however, critiques this assumption, arguing that power imbalances and systemic biases embedded in language, institutions, and cultural narratives undermine the possibility of truly neutral or objective judgment. Therefore, postmodernism analyzes how seemingly neutral concepts like ""reason,"" ""justice,"" and ""equality"" can be used to perpetuate oppression by masking underlying power dynamics. It focuses on deconstructing these concepts to reveal the interests they serve and the voices they silence. This contrasts with Kantianism's focus on establishing universal principles applicable to all individuals regardless of their social context.  - (Criterion: 'Investigate specific examples of postmodernist critiques of legal or political systems', Level: 1):   Postmodernist critiques often target the idea of universal justice and objective truth within legal and political systems. For example, they might analyze how legal language, seemingly neutral, is actually constructed to favor certain power structures and marginalize others. Derrida's deconstruction could be applied to legal texts to reveal inherent contradictions and biases. Foucault's work on power/knowledge could be used to demonstrate how legal definitions of crime and punishment are not objective but are shaped by historical and social forces. Lyotard's concept of the ""incredulity toward metanarratives"" suggests a rejection of grand narratives of justice and progress that underpin many legal systems, exposing their claims to universality as inherently flawed. These critiques aim to show that legal and political systems are not neutral arbiters but are deeply implicated in the construction and maintenance of power relations.  - (Criterion: 'Consider the role of subjectivity and interpretation in postmodernism's understanding of rights and justice.', Level: 1):   Postmodernism emphasizes that concepts like ""rights"" and ""justice"" are not objective, universal truths discoverable through reason (as Kant argued). Instead, they are social constructs, products of specific historical and cultural contexts, and shaped by power dynamics. Their meaning is therefore subject to interpretation and debate, influenced by individual perspectives and lived experiences. This challenges the Enlightenment ideal of universally applicable and rationally derived principles of justice.   The debate will now commence."
2,ROT_Representative,"Okay, based on the provided task definition, case examples, and the specific input, here's my response:  **Reasoning:**  The task is to identify the statement that best describes the postmodernist project. Postmodernism is generally characterized by skepticism towards grand narratives, a focus on relativism, deconstruction of established norms, and a critique of Enlightenment values.  *   Option 1 (""It attempts to demonstrate the relationship between law and literature."") is a valid area of study, but not a central tenet of postmodernism itself. It's more of an application of postmodern thought. *   Option 2 (""It seeks to defend Enlightenment values."") is the opposite of postmodernism, which critiques Enlightenment ideals. *   Option 3 (""It is preoccupied with the rise of bureaucratic government."") is related to postmodernism's concern with power structures, but it's not the core defining characteristic. *   Option 4 (""It rejects the Kantian concern with individual rights, equality, and justice."") aligns with postmodernism's rejection of universal, foundational principles and its emphasis on the social construction of concepts like rights and justice.  Therefore, option 4 is the most accurate description.  **Answer:**  4  My core idea, as the ROT Representative, focuses on identifying the statement that *most accurately* encapsulates the core tenets of postmodernism. This means looking for the statement that best reflects postmodernism's critical stance towards universal truths, grand narratives, and Enlightenment values. My strength lies in directly addressing the core of postmodern thought: skepticism, deconstruction, and relativism.  **Critical Evaluation of GOT and LOT Ideas:**  The GOT idea, ""It rejects the Kantian concern with individual rights, equality, and justice,"" is the same as my answer, which is a good sign. The LOT provides a very detailed and nuanced exploration of why this answer is plausible and what its limitations are. The LOT's strengths are in its detailed breakdown of:  *   The nuances of ""rejection"" in postmodern thought (it's not outright dismissal, but critical deconstruction). *   The ethical implications of rejecting Kantian principles (the risk of ethical relativism). *   The potential for misinterpreting postmodernism's critique as outright rejection. *   The analysis of language used in the multiple-choice options. *   The differences in how postmodernism and Kantianism address power and oppression. *   Specific examples of postmodern critiques of legal/political systems. *   The role of subjectivity and interpretation.  **Weaknesses and Overlooked Aspects of the LOT:**  Despite its comprehensive analysis, the LOT suffers from the following potential weaknesses:  1.  **Overly nuanced for a multiple-choice question:** The LOT delves into complex philosophical arguments. In a multiple-choice scenario, the *best* answer needs to be comparatively straightforward. While nuance is important, it can also lead to overthinking and missing the most direct and generally accepted characterization. 2.  **Potential for paralysis by analysis:** The LOT explores so many facets that it could make choosing an answer more difficult. The sheer volume of considerations might obscure the most salient point. 3.  **Risk of misinterpreting ""rejection"":** The LOT spends considerable time discussing the nuances of ""rejection,"" which is valuable, but it might lead one to incorrectly dismiss option 4. While postmodernism doesn't *literally* reject *everything* Kant stood for, its core project fundamentally challenges the foundations upon which Kantian ethics are built. 4.  **Overemphasis on ethical implications:** While the ethical implications of rejecting Kantian principles are important, they are not necessarily the *most* defining characteristic of postmodernism. The LOT risks prioritizing a specific consequence over the core philosophical stance. 5.  **Lack of focus on grand narratives:** The provided LOT doesn't explicitly connect the rejection of Kantian principles to postmodernism's rejection of grand narratives. Kantianism, with its universal moral principles, is a kind of grand narrative that postmodernism generally critiques.  **Why My Approach is Preferable:**  My approach is preferable because it directly addresses the core of the task: identifying the statement that *best* describes the postmodernist project. It prioritizes the most fundamental and widely accepted characterizations of postmodernism: skepticism towards universal truths, deconstruction, and relativism. While the LOT provides a valuable deep dive, its complexity and focus on specific implications could obscure the core issue in a multiple-choice scenario. My ROT approach aims for clarity, conciseness, and direct relevance to the task, making it more effective in identifying the *best* answer. It acknowledges the nuances explored in the LOT but avoids getting bogged down in them at the expense of identifying the most accurate overall description."
3,GOT_Representative,"As the GOT Representative, my core idea, ""It rejects the Kantian concern with individual rights, equality, and justice,"" directly addresses the core problem of identifying the statement that best describes the postmodernist project. This statement resonates with the postmodernist skepticism toward grand narratives and universal principles, including those championed by Kant and the Enlightenment.  **Strengths of my Idea:**  *   **Direct Relevance:** It directly addresses a central tenet of postmodernism: the critique of universal, foundational principles. *   **Conciseness:** It's a succinct and easily understandable summary of a complex philosophical stance. *   **Discrimination:** It effectively distinguishes postmodernism from Enlightenment ideals, making it a strong candidate in a multiple-choice scenario.  **Critical Evaluation of ROT and LOT Ideas:**  The ROT and LOT ideas provide a more nuanced examination of postmodernism's relationship with Kantian principles. They correctly point out that the ""rejection"" isn't always an outright dismissal but rather a critical deconstruction and re-evaluation. They explore ethical implications and the potential for misinterpretation. However, these ideas suffer from several weaknesses in the context of the given task:  *   **Over-Nuance:** While the nuance is philosophically valuable, it weakens the effectiveness of the statement as the *best* description in a multiple-choice question. The other options are less nuanced, and the most accurate answer needs to be clear and easily identifiable. *   **Length and Complexity:** The extensive reasoning provided by the ROT and LOT is unnecessary for the core task. The instructions ask for the *best* description, not an exhaustive analysis. *   **Potential for Confusion:** The exploration of ethical implications and potential misinterpretations, while insightful, could lead to second-guessing the correct answer. Someone might overthink the question and dismiss the statement due to its potential for misinterpretation. *   **Missed the FOREST for the TREES:** The ROT and LOT spend too much time exploring the nuances of rejection, ethical implications, and potential misinterpretations. These are useful in a full philosophical discussion, but are not necessary for selecting the best answer from a limited set of options.  **Why My Approach is Preferable:**  My approach prioritizes clarity and direct relevance to the task. While acknowledging the validity of the nuanced points raised in the ROT and LOT, my core idea is preferable because:  1.  **It's the most accurate *general* description.** In the context of a multiple-choice question, the goal is to identify the statement that most accurately captures the *essence* of postmodernism. The statement ""It rejects the Kantian concern with individual rights, equality, and justice"" does this effectively. 2.  **It's the most *discriminating* statement.** It clearly distinguishes postmodernism from Enlightenment thought, making it the most likely correct answer when presented with options that are either unrelated or directly opposed to postmodernism. 3.  **It avoids over-complication.** By focusing on the core critique of universal principles, my idea avoids getting bogged down in nuanced debates that, while important, are not necessary for answering the question.  In essence, my approach acknowledges that while postmodernism's critique is nuanced, the *best* description for the purpose of the task is one that highlights its fundamental rejection of Enlightenment and Kantian ideals. The ROT and LOT provide valuable philosophical insights, but they are less effective as concise and accurate summaries of the postmodernist project. They are too detailed for the specific task at hand."
