Round,Speaker,Utterance
1,Moderator,"Debate Topic: In-depth discussion based on the mission context and ideas from ROT and LOT. Mission Context (partial): Instruction: Cicero's conception of natural law is 'based on the idea that 'true law is right reason in agreement with Nature.' Reason is a key element because:  Context: [It is a sin for humans not to apply reason., The principles of natural law are discoverable by reason., Natural law does not apply without good reason., The law of nature is the basis of all positive law.]... Initial Core Idea from ROT (partial): Okay, here's the refined explanation of Cicero's conception of natural law, focusing on the role of reason and addressing each statement individually:  **Cicero's Natural Law and the Centrality of Reason**  Cicero's natural law is defined as ""right reason in agreement with Nature."" While ""agreement with Nature"" is important, the ""right reason"" component is paramount. The following statements directly illustrate the centrality of reason in Cicero's conception:  *   **""It is a sin for humans not to apply reason.""** This statement highlights reason as a moral imperative. In Cicero's view, failing to exercise reason is a transgression against natural law itself. It directly links reason to ethical conduct, suggesting that moral failings stem from a deficiency in rational thought.  Without reason, humans cannot discern right from wrong, thus violating the fundamental principles of natural law and committing a ""sin.""  *   **""The principles of natural law are discoverable by reason.""** This statement establishes reason as the primary means of understanding natural law. Natural law isn't passively received; it's actively discovered through rational inquiry.  Cicero believed that humans, through their capacity for reason, could uncover the inherent moral order of the universe.  Therefore, reason is not merely helpful, but absolutely essential for grasping the principles of natural law.  *   **""Natural law does not apply without good reason.""** This statement emphasizes the need for rational justification in the application of natural law. It implies that natural law is not a rigid set of rules but a framework that demands reasoned interpretation and application.  Each application of natural law must be supported by sound reasoning, ensuring that it aligns with the principles of justice and fairness.  Without ""good reason,"" the application of natural law becomes arbitrary and potentially unjust.  *   **""The law of nature is the basis of all positive law.""** This statement establishes natural law as the rational foundation for all just human laws. Positive laws (laws enacted by governments) derive their legitimacy from their alignment with the rational principles of natural law.  Just laws are not simply arbitrary decrees; they are rooted in reason and designed to promote the common good, as understood through rational deliberation.  Therefore, positive law must be grounded in the rational principles derived from natural law to be considered just.... Initial Detailed Plan from LOT (partial): Default LOT detailed plan for task: Refine the following explanation of Cicero's conception of natural law, focusing on the role of reason:  Cicero's conception of natural law is fundamentally based on the idea that ""true law is right reason in agreement with Nature,"" making reason a key element. Explicitly and concisely explain how each of the following statements from the context directly supports the centrality of reason in Cicero's natural law conception:  *   It is a sin for humans not to apply reason. *   The principles of natural law are discoverable by reason. *   Natural law does not apply without good reason. *   The law of nature is the basis of all positive law.  For each statement, directly link it to a specific aspect of Cicero's conception, demonstrating how neglecting reason leads to moral failures, how reason is essential for understanding natural law, how rational justification is required for natural law's application, and how just laws must be rooted in rational principles. While acknowledging Cicero's emphasis on ""agreement with Nature"", maintain focus on elaborating reason's indispensable role. ...... The debate will now commence focusing on these ideas."
2,ROT_Representative,"Okay, here's my response as the ROT_Representative, elaborating on my core idea, critically evaluating the LOT idea, and explaining why my approach is preferable.  **1. Elaboration on the ROT Idea and its Strengths**  My core idea directly addresses the problem by explicitly and concisely explaining how each of the four given statements supports the centrality of reason in Cicero's conception of natural law. It's structured to:  *   **Acknowledge the Foundation:** Start with the core definition of Cicero's natural law as ""right reason in agreement with Nature,"" immediately highlighting the importance of both elements. *   **Prioritize Reason:** Explicitly state that while ""agreement with Nature"" is important, ""right reason"" is paramount, setting the focus for the subsequent explanations. *   **Directly Address Each Statement:** Systematically address each statement, providing a clear explanation of its implications for Cicero's view of reason. *   **Connect to Cicero's Thought:** Each explanation connects the statement directly to Cicero's ethical and legal philosophy. For example, the explanation for ""It is a sin for humans not to apply reason"" explicitly states it is a ""transgression against natural law itself."" *   **Provide Justification:** Each explanation provides a justification for why the statement highlights the centrality of reason.  **Key Strengths:**  *   **Clarity and Conciseness:** The explanations are clear, concise, and avoid unnecessary jargon. *   **Direct Connection to Cicero:** The explanations explicitly link the statements to Cicero's philosophical framework. *   **Comprehensive Coverage:** All four statements are addressed in detail. *   **Emphasis on Practical Implications:** It highlights the practical implications of neglecting reason, such as moral failings and unjust laws.  **2. Critical Evaluation of the LOT Idea**  The LOT idea, ""Default LOT detailed plan for task: Refine the following explanation of Cicero's conception of natural law, focusing on the role of reason...Explicitly and concisely explain how each of the following statements from the context directly supports the centrality of reason in Cicero's natural law conception,"" is a sound plan in principle. It sets a clear objective and outlines the steps needed to achieve it, which align with the initial prompt's instructions. It also emphasizes the importance of connecting each statement to Cicero's conception, acknowledging ""agreement with Nature,"" and elaborating on reason's role.  **Potential Weaknesses, Overlooked Aspects, and Limitations of the LOT Idea:**  *   **Lack of a Central Thesis:** The LOT idea is more of a procedural guideline than a substantive argument. It lacks a clear central thesis, such as the explicit statement that ""right reason"" is paramount, which my ROT idea provides. This makes the LOT plan less persuasive and potentially less focused. *   **Risk of Redundancy:** Without a strong guiding thesis, the individual explanations for each statement could become somewhat repetitive, simply reiterating that reason is important without providing deeper insights. *   **Missed Opportunity for Emphasis:** The LOT plan acknowledges ""agreement with Nature"" but doesn't explicitly prioritize the ""right reason"" component. This missed opportunity weakens the overall argument for the centrality of reason. By not explicitly stating reason's paramount importance, the explanation might not fully capture the nuances of Cicero's thought. *   **Potentially Too Abstract:** The LOT plan, while logical, might result in explanations that are too abstract and lack concrete examples of how neglecting reason leads to specific moral or legal failings.  **Why the ROT Approach is Preferable:**  My ROT approach is preferable because it:  *   **Provides a Clear Argumentative Focus:** The explicit prioritization of ""right reason"" provides a clear argumentative focus that guides the entire explanation. This makes the explanation more persuasive and memorable. *   **Offers Deeper Insights:** By emphasizing the moral imperative of reason and the potential for injustice when reason is absent, my approach offers deeper insights into Cicero's philosophy. *   **Reduces Redundancy:** The central thesis helps to prevent redundancy by providing a framework for each explanation, ensuring that each statement is addressed in a unique and insightful way. *   **Is More Engaging:** The explicit focus on the consequences of neglecting reason makes the explanation more engaging and relevant to contemporary readers.  In summary, while the LOT idea provides a sound procedural framework, my ROT idea offers a more compelling and insightful explanation of Cicero's conception of natural law by explicitly prioritizing the role of ""right reason"" and demonstrating its centrality through clear, concise, and impactful explanations of the given statements."
3,LOT_Representative,"Okay, here's my response as the LOT_Representative, elaborating on my detailed plan, critically evaluating the ROT idea, and explaining why my approach is preferable.  **1. Elaboration on the LOT Idea and its Strengths**  My detailed plan directly addresses the core problem of explaining how the given statements from the context support the centrality of reason in Cicero's conception of natural law. It's structured to provide a clear and focused approach:  *   **Directly Addresses the Task:** The plan explicitly states the objective: to refine the explanation of Cicero's conception of natural law, emphasizing the role of reason. This ensures that all subsequent steps are aligned with the core mission. *   **Maintains the Foundation:** It grounds the explanation in Cicero's definition of natural law as ""true law is right reason in agreement with Nature,"" acknowledging the importance of both reason and nature. This provides a balanced perspective. *   **Provides Specific Guidance:** The plan provides specific guidance on how to approach each statement. For each statement, it requires a direct link to a specific aspect of Cicero's conception, demonstrating how neglecting reason leads to negative consequences (moral failures, misunderstandings of natural law, unjust application, or flawed positive laws). *   **Explicitly Focuses on Reason:** While acknowledging ""agreement with Nature,"" the plan explicitly instructs to maintain focus on elaborating reason's indispensable role. This ensures that the explanation remains centered on the designated theme. *   **Actionable and Feasible:** The plan is highly actionable and feasible. It breaks down the task into manageable steps, providing a clear roadmap for developing a comprehensive and insightful explanation. It avoids abstract pronouncements and instead focuses on concrete connections between statements and Cicero's philosophy.  **Key Strengths:**  *   **Clarity and Focus:** The plan provides a clear and focused framework for developing the explanation. *   **Comprehensive Coverage:** It ensures that all four statements are addressed in a systematic and thorough manner. *   **Balanced Perspective:** It acknowledges the importance of both reason and nature in Cicero's conception of natural law. *   **Actionable Guidance:** It provides specific and actionable guidance on how to approach each statement. *   **Mitigates Bias:** By instructing a direct, linked explanation for each statement, it reduces the risk of injecting personal biases into the interpretation.  **2. Critical Evaluation of the ROT Idea**  The ROT idea, while providing a good starting point, suffers from several potential weaknesses and limitations compared to my LOT plan:  *   **Overselling of Reason's Primacy:** The ROT idea explicitly states that ""right reason"" is ""paramount,"" potentially overstating the case and neglecting the crucial interplay between reason and nature in Cicero's philosophy. While reason is central, Cicero's natural law is explicitly defined as ""right reason *in agreement with Nature*."" Separating them in importance risks misrepresenting Cicero's actual view. My LOT plan avoids this by acknowledging both elements from the outset and *then* guiding the focus towards reason in the explanation. *   **Risk of Bias and Misinterpretation:** The ROT idea's emphasis on reason being ""paramount"" may lead to a biased interpretation of the statements, forcing them to fit a pre-conceived notion rather than allowing the evidence to speak for itself. My LOT plan, by contrast, encourages a more objective analysis by directly linking each statement to Cicero's conception without imposing a strong prior belief about the relative importance of reason versus nature. *   **Potential for Redundancy, despite claim to reduce it:** While the ROT claims to reduce redundancy, its central thesis *could* lead to redundant explanations, as each statement might be forced to reiterate the same point about reason's paramount importance. The LOT plan mitigates this by encouraging diverse connections between each statement and different aspects of Cicero's overall philosophy. *   **Less Actionable and Feasible:** The ROT idea is more of a general outline than a detailed plan. It lacks the specific, actionable guidance provided by my LOT plan, making it potentially more difficult to execute effectively. For example, the LOT plan explicitly states to ""demonstrate how neglecting reason leads to moral failures, how reason is essential for understanding natural law, how rational justification is required for natural law's application, and how just laws must be rooted in rational principles."" The ROT plan doesn't provide this granular level of instruction.  **3. Why the LOT Approach is Preferable**  My LOT approach is preferable because it provides a more balanced, objective, and actionable framework for explaining the centrality of reason in Cicero's conception of natural law. It avoids the potential pitfalls of the ROT idea, such as overstating the importance of reason, introducing bias, and lacking specific guidance.  Specifically, the LOT plan:  *   **Maintains a Balanced Perspective:** By acknowledging the importance of both reason and nature, it provides a more accurate representation of Cicero's philosophy. *   **Encourages Objective Analysis:** By focusing on direct connections between the statements and Cicero's conception, it minimizes the risk of bias and misinterpretation. *   **Provides Actionable Guidance:** By breaking down the task into manageable steps and providing specific instructions, it makes the explanation easier to develop and more effective. *   **Promotes Deeper Understanding:** By encouraging diverse connections between each statement and different aspects of Cicero's philosophy, it promotes a deeper and more nuanced understanding of Cicero's thought.  In summary, while the ROT idea provides a good starting point, my LOT plan offers a more comprehensive, objective, and actionable framework for explaining the centrality of reason in Cicero's conception of natural law. It is a more robust and reliable approach that is less likely to lead to misinterpretations or biased explanations."
4,Critical_Analyst,"Okay, here's my critical evaluation of the ROT and LOT representatives' ideas regarding Cicero's conception of natural law, focusing on the role of reason.  **Overall Assessment:**  Both ROT and LOT offer valuable perspectives, but LOT's approach is ultimately more robust and defensible. ROT's emphasis on the primacy of reason, while aiming for a strong thesis, risks oversimplification and potential misrepresentation of Cicero's nuanced view. LOT's focus on a balanced perspective, actionable guidance, and objective analysis provides a more solid foundation for a comprehensive and accurate explanation.  **Detailed Critique:**  **ROT Evaluation:**  *   **Strengths:**     *   **Clear Argumentative Focus:** ROT's explicit prioritization of ""right reason"" provides a clear argumentative focus.     *   **Emphasis on Practical Implications:** Highlighting the consequences of neglecting reason makes the explanation engaging. *   **Weaknesses:**     *   **Overselling Reason's Primacy:** The claim that ""right reason is paramount"" is a potential oversimplification. Cicero's definition explicitly includes ""agreement with Nature,"" suggesting a necessary interplay between the two. Discounting ""agreement with Nature"" could lead to a misinterpretation.     *   **Potential for Bias:** The strong emphasis on reason *could* lead to a biased interpretation of the source material, forcing the statements to fit the pre-determined conclusion.     *   **Risk of Redundancy:** The central thesis might lead to repetitive explanations, as each statement is forced to reiterate the same point about reason's paramount importance. *   **Overlooked Aspects:**     *   **Nuance of ""Nature"":** ROT doesn't fully explore the complexities of what Cicero meant by ""Nature."" Is it simply the physical world, or something more? This lack of exploration weakens the overall argument. *   **Improvements/Cautions:**     *   **Re-evaluate ""Paramount"":** Instead of stating reason is *paramount*, rephrase to emphasize its *central* and *indispensable* role, while still acknowledging the essential contribution of ""agreement with Nature.""     *   **Address the Interplay:** Explicitly address how reason and nature work together in Cicero's conception. Give examples of how both are necessary for a complete understanding of natural law.     *   **Provide Counterarguments:** Acknowledge and refute potential counterarguments to the idea that reason is central. This will strengthen the overall argument.  **LOT Evaluation:**  *   **Strengths:**     *   **Balanced Perspective:** Acknowledging the importance of both reason and nature provides a more accurate representation of Cicero's philosophy.     *   **Objective Analysis:** Focusing on direct connections between statements and Cicero's conception minimizes bias.     *   **Actionable Guidance:** Breaking down the task into manageable steps and providing specific instructions makes the explanation easier to develop and more effective.     *   **Mitigates Bias:** The plan reduces the risk of injecting personal biases into the interpretation. *   **Weaknesses:**     *   **Potentially Less Engaging:** The focus on objectivity and balance *could* result in a less engaging explanation compared to ROT's more assertive approach.     *   **Risk of Lacking a Strong Thesis:** While aiming for balance, LOT needs to ensure it still effectively conveys the *centrality* of reason, rather than just treating it as one of two equal components. *   **Overlooked Aspects:**     *   **Defining ""Centrality"":** LOT could benefit from explicitly defining what it means for reason to be ""central"" without being ""paramount."" This would provide clearer criteria for evaluating the statements. *   **Improvements/Cautions:**     *   **Strengthen the Thesis:** While maintaining balance, ensure the explanation clearly demonstrates the *indispensable* role of reason in *discovering*, *interpreting*, and *applying* natural law.     *   **Provide Concrete Examples:** Include specific examples of how Cicero used reason to derive principles of natural law.     *   **Address Potential Objections:** Acknowledge and address potential objections to Cicero's conception of natural law, such as the difficulty of universally applying rational principles.  **Inconsistencies:**  *   The primary inconsistency lies in the interpretation of Cicero's phrase ""right reason in agreement with Nature."" ROT interprets this as reason being paramount, while LOT sees it as a balanced interplay. This difference in interpretation significantly impacts the approaches taken by each representative.  **Correctness and Completeness:**  *   Neither approach is *incorrect*, but LOT's approach is *more complete* in its consideration of all aspects of Cicero's definition and its mitigation of potential biases. ROT's completeness is hindered by its potentially biased interpretation.  **Balanced Overall Critique:**  LOT's approach is the more defensible and robust framework for addressing the mission. While ROT's assertive focus on reason might initially seem more compelling, it risks oversimplification and potential misrepresentation of Cicero's nuanced philosophy. LOT's commitment to balance, objectivity, and actionable guidance provides a more solid foundation for a comprehensive and accurate explanation that is less prone to bias. However, LOT must ensure that its focus on balance does not dilute the central argument that reason plays an indispensable role in Cicero's natural law conception. ROT could improve by tempering its assertion of reason's primacy and more fully exploring the interplay between reason and nature."
