Round,Speaker,Utterance
1,Moderator,"Debate Topic: In-depth discussion based on the mission context and ideas from ROT and GOT. Mission Context (partial): Instruction: The focus of liberal feminists on equality is denounced by radical feminists as mistaken because:  Context: [It treats women as objects., It makes women into men., It reduces feminism to a political movement., It overlooks the historical struggle of women for justice.]... Initial Core Idea from ROT (partial): Radical feminists fundamentally critique liberal feminism's pursuit of equality, arguing that its approach is not only insufficient but actively detrimental to women's liberation. They believe that seeking equality within a patriarchal system, rather than dismantling it, ultimately reinforces the very structures that oppress women. This critique centers on several key points:  **1. It treats women as objects:** Radical feminists argue that liberal feminism, in its quest for equality within existing societal structures, often reinforces the objectification of women. The pursuit of equality becomes a competition to meet male-defined standards of success, beauty, and behavior. For example, striving for equal representation in traditionally male-dominated fields without challenging the inherent sexism within those fields can lead to women being valued for their ability to ""perform"" masculinity or conform to male expectations. This reinforces the idea that women's worth is contingent on their ability to meet male approval, perpetuating their status as objects of male gaze and desire. The focus on achieving equality in areas like career advancement or political power can inadvertently prioritize women who conform to patriarchal norms, further marginalizing those who challenge or deviate from these norms. This is a fundamental flaw because it accepts the patriarchal framework as a given, rather than challenging its very foundation.  **2. It makes women into men:** Radical feminists criticize liberal feminism for implicitly promoting the idea that women must adopt masculine traits and behaviors to achieve equality. This ""becoming men"" involves suppressing traditionally feminine qualities and embracing traditionally masculine ones to succeed in a male-dominated world. This, they argue, devalues femininity and reinforces the notion that masculinity is the ideal standard. It pressures women to conform to a male-dominated world rather than challenging the patriarchal values that underpin it. This is a flaw because it suggests that women's liberation lies in assimilation, rather than in challenging and transforming the patriarchal system itself. It also ignores the unique experiences and perspectives that women bring to the table, potentially leading to a homogenization of thought and action.  **3. It reduces feminism to a political movement:** Radical feminists believe that liberal feminism's primary focus on political and legal reforms neglects the deeper, more fundamental cultural and societal changes needed to truly liberate women. By focusing solely on achieving political equality, liberal feminism overlooks the pervasive sexism and patriarchal power structures that operate on a personal and interpersonal level. These structures manifest in everyday interactions, cultural norms, and internalized beliefs, and they cannot be addressed solely through legal or political means. Radical feminists argue that true liberation requires a fundamental shift in consciousness and a dismantling of patriarchal power structures at all levels of society, not just in the political sphere. This is a flaw because it limits the scope of feminist action and fails to address the root causes of women's oppression.  **4. It overlooks the historical struggle of women for justice:** Radical feminists contend that liberal feminism often ignores or downplays the long and arduous history of women's struggle against oppression. By focusing on achieving equality within the existing system, it fails to acknowledge and address the systemic injustices and historical power imbalances that have shaped women's experiences. This lack of historical awareness can lead to a superficial understanding of the challenges women face and a failure to address the root causes of inequality. Radical feminists emphasize the importance of understanding the historical context of women's oppression in order to develop effective strategies for liberation. This historical context reveals the deep-seated nature of patriarchal power and the need for radical transformation, not just incremental reforms. Ignoring this history is a fundamental flaw because it prevents a full understanding of the problem and limits the potential for truly transformative change.  In summary, radical feminists view liberal feminism's focus on equality as fundamentally flawed because it seeks to integrate women into a patriarchal system without challenging the system itself. This approach, they argue, reinforces objectification, encourages assimilation, neglects the importance of cultural and societal change, and overlooks the historical roots of women's oppression. They advocate for a more radical approach that seeks to dismantle patriarchal power structures and create a truly just and equitable society for all.... Initial Core Idea from GOT (partial): This is an excellent and thorough response! It directly addresses all the points, clearly explains the radical feminist perspective, and provides concrete examples to illustrate the arguments. The addition of the ""Illusion of Choice"" paragraph at the end is a particularly insightful way to summarize the radical feminist critique.  Here are a few minor suggestions for improvement (though the response is already very strong):  *   **Strengthen the ""Historical Struggle"" point further:** While you mention the importance of honoring past struggles, you could make this section even more impactful by briefly naming a specific example or two of radical feminist historical figures or movements that liberal feminism might overlook. For example, mentioning the Combahee River Collective or the early lesbian separatist movements would add weight to this point.  *   **Clarify the distinction between ""equality"" and ""liberation"":** Emphasize that radical feminists aren't *against* the idea of equality in a general sense, but rather that they see it as insufficient and potentially misleading if it's pursued *within* a fundamentally unequal system. They prioritize *liberation*, which involves dismantling the system itself.  *   **Consider adding a very brief counterpoint:** While the focus is on the radical feminist critique, briefly acknowledging (even in a single sentence) a potential strength or positive outcome of liberal feminism could add nuance. For example, ""While radical feminists critique the limitations of liberal feminism, they acknowledge that its focus on legal and political reforms has undeniably improved the lives of many women."" This isn't strictly necessary, but it can make the analysis feel more balanced.  Here's an example of how you could incorporate the first two suggestions:  ""**It Overlooks the Historical Struggle of Women for Justice"":** Radical feminists argue that liberal feminism often overlooks or downplays the historical struggles and contributions of women who challenged the patriarchal system more fundamentally, like the women of the Combahee River Collective, who centered the experiences of Black lesbian women in their feminist analysis. They believe that liberal feminism's focus on integration into the existing system ignores the radical roots of the feminist movement, which sought to dismantle patriarchal structures altogether. By prioritizing assimilation over transformation, liberal feminism risks losing sight of the original goals of the movement and the sacrifices made by women who fought for more than just equal rights within a fundamentally unjust system. Radical feminists emphasize the importance of honoring and learning from these historical struggles, recognizing that *equality within a patriarchal system is distinct from true liberation, which requires dismantling that system entirely.*""  Overall, this is a very well-written and insightful response that effectively captures the radical feminist critique of liberal feminism. The clarity of your explanations and the use of examples make the complex ideas accessible and engaging. ... The debate will now commence focusing on these ideas."
2,ROT_Representative,"Okay, here is my response as the ROT_Representative, addressing the prompt and the GOT's evaluation:  **1. Elaboration on how the ROT idea addresses the core problem and highlights its key strengths:**  The core problem, as defined by the mission context, is *why radical feminists denounce liberal feminists' focus on equality as mistaken.* The ROT idea directly tackles this by presenting the radical feminist perspective that equality within a patriarchal system is not only insufficient but *detrimental* to women's liberation.  **Key Strengths:**  *   **Systemic Critique:** The ROT idea goes beyond surface-level disagreements and highlights the fundamental difference in approach between the two feminist schools of thought. It emphasizes that radical feminists see the *system itself* as the problem, not just the lack of women within it. *   **Multifaceted Explanation:** It breaks down the critique into four distinct but interconnected points: objectification, assimilation (""making women into men""), the reduction of feminism to politics, and the neglect of historical struggles. This provides a comprehensive understanding of the radical feminist perspective. *   **Concrete Examples:** Each point is illustrated with examples, making the abstract concepts more accessible and understandable. For instance, the ""making women into men"" point uses the example of suppressing feminine qualities to succeed in male-dominated fields. *   **Emphasis on Liberation vs. Equality:** The ROT idea clearly differentiates between equality within a patriarchal framework and true liberation, which involves dismantling that framework. This is crucial for understanding the radical feminist position. *   **Focus on Power Structures:** The ROT idea consistently emphasizes the importance of understanding and dismantling patriarchal power structures at all levels of society, from the political to the personal.  **2. Critical Evaluation of the GOT idea:**  The GOT idea provides valuable suggestions for improving the initial response, and its assessment is largely accurate. However, there are some nuances and potential limitations to consider:  *   **Strengthening the ""Historical Struggle"" point:** The GOT's suggestion to include specific examples like the Combahee River Collective is excellent. However, it's crucial to ensure that these examples are presented in a way that highlights the *radical* nature of their challenges to the system. Simply mentioning them without context might not fully convey the depth of the radical feminist critique. A potential weakness is that simply listing historical figures or movements does not necessarily explain *why* liberal feminism overlooks them or the *consequences* of doing so. My ROT idea addresses this by directly stating that ignoring historical context limits the understanding of the problem and the potential for transformative change.  *   **Clarifying the distinction between ""equality"" and ""liberation"":** The GOT's suggestion to emphasize this distinction is also very important. However, it is important to note that the ROT idea already emphasizes this distinction, and the GOT's suggestion to add this emphasis within the ""Historical Struggle"" section is a good idea.  *   **Adding a counterpoint:** While the GOT suggests adding a brief counterpoint acknowledging potential benefits of liberal feminism, this could dilute the radical feminist argument. The purpose here is to understand *why* radical feminists denounce liberal feminism, not to provide a balanced assessment of both. Introducing a counterpoint might create confusion or suggest that the radical feminist critique is less valid than it is. The ROT idea maintains a clear and consistent focus on the radical feminist perspective, which is essential for understanding their critique. This is not to say that liberal feminism has no value, but that introducing that value in this context could be confusing and would distract from the task.  **Why the ROT approach might be preferable:**  The ROT approach is preferable because it provides a clear, comprehensive, and unwavering presentation of the radical feminist critique of liberal feminism. While the GOT's suggestions are helpful for refining the presentation, they should be implemented carefully to avoid diluting the core message. The ROT idea is strong because it:  *   **Maintains Focus:** It avoids unnecessary diversions into the potential merits of liberal feminism, ensuring that the focus remains on understanding the radical feminist perspective. *   **Emphasizes Systemic Change:** It consistently highlights the radical feminist emphasis on dismantling patriarchal power structures, rather than simply seeking equality within those structures. *   **Connects Theory to Practice:** It uses concrete examples to illustrate the theoretical concepts, making the argument more accessible and persuasive. *   **Provides Context:** It situates the critique within the broader historical context of women's struggle for liberation.  In conclusion, the ROT idea effectively addresses the core problem by providing a detailed and nuanced explanation of the radical feminist critique of liberal feminism. While the GOT's suggestions are valuable for refining the presentation, it is important to maintain a clear and consistent focus on the radical feminist perspective to avoid diluting the message. The strength of the ROT idea lies in its emphasis on systemic change, its use of concrete examples, and its connection to the historical context of women's struggle for liberation."
3,GOT_Representative,"Okay, here is my response as the GOT_Representative, addressing the prompt and the ROT's evaluation:  **1. Elaboration on how the GOT idea addresses the core problem and highlights its key strengths:**  The core problem, as defined by the mission context, is *why radical feminists denounce liberal feminists' focus on equality as mistaken.* My GOT idea, at its core, recognizes the ROT idea as a ""very well-written and insightful response that effectively captures the radical feminist critique of liberal feminism."" It directly acknowledges the ROT's success in addressing all points, clearly explaining the radical feminist perspective, and providing concrete examples.  **Key Strengths:**  *   **Validation of Core Argument:** My primary strength lies in validating the ROT's core argument as sound and effective in addressing the prompt. This provides a solid foundation for further refinement. *   **Targeted Refinement:** Rather than suggesting wholesale changes, my idea focuses on *minor* suggestions for improvement, acknowledging the existing strength of the response. This ensures that the core message remains intact while addressing potential areas for enhancement. *   **Actionable Suggestions:** The suggestions provided are concrete and actionable, offering specific examples of how to strengthen the argument. The example provided for strengthening the ""Historical Struggle"" point is a direct illustration of this. *   **Nuanced Understanding:** The GOT demonstrates a nuanced understanding of the radical feminist critique and identifies areas where the ROT could be even more impactful. This demonstrates a deeper level of engagement with the subject matter.  **2. Critical Evaluation of the ROT idea:**  While the ROT idea is strong, as acknowledged in my initial assessment, there are a few potential weaknesses, overlooked aspects, or limitations compared to my GOT idea:  *   **Missed Opportunities for Amplification:** While the ROT covers the key arguments, it could benefit from further amplification of certain points to make them even more persuasive. My GOT idea identifies specific areas where this could be achieved, such as strengthening the ""Historical Struggle"" point with concrete examples of overlooked radical feminist figures or movements. The ROT focuses on the general importance of historical context, but my GOT idea pinpoints the *specific* impact of mentioning, for instance, the Combahee River Collective. *   **Subtle Nuances in Defining ""Equality"":** The ROT does a good job of distinguishing between equality and liberation. However, my GOT idea emphasizes the importance of clarifying that radical feminists aren't inherently *against* equality but view its pursuit within a patriarchal system as insufficient and potentially misleading. This nuanced understanding is crucial for avoiding misinterpretations of the radical feminist position. The ROT correctly identifies the distinction, but my GOT suggestion highlights that the distinction *itself* needs further clarification to avoid potential misunderstandings. *   **Lack of Acknowledgment of Liberal Feminism's Positive Impact (Optional):** The ROT rightfully prioritizes presenting the radical feminist critique without dilution. However, my GOT idea suggests (as an *optional* point) that briefly acknowledging a positive outcome of liberal feminism could add nuance and potentially strengthen the overall argument by demonstrating a comprehensive understanding of the broader feminist landscape. This is not to diminish the radical feminist critique, but to contextualize it within the larger feminist discourse. The ROT argues that this could dilute the message, but my GOT suggests it could *enhance* the message by showcasing a sophisticated understanding.  **Why the GOT approach might be preferable:**  The GOT approach is preferable because it builds upon the strong foundation of the ROT idea by offering targeted suggestions for refinement and amplification. While the ROT provides a comprehensive overview of the radical feminist critique, the GOT identifies specific areas where the argument could be made even more persuasive and impactful. The GOT's strength lies in:  *   **Precision and Focus:** It avoids broad generalizations and focuses on specific, actionable suggestions for improvement. *   **Nuanced Understanding:** It demonstrates a deeper understanding of the nuances of the radical feminist critique and identifies potential areas for clarification and amplification. *   **Strategic Enhancement:** It aims to enhance the overall impact of the argument without diluting its core message. *   **Constructive Criticism:** It provides constructive criticism that is designed to improve the quality of the response and strengthen its persuasive power.  In conclusion, the GOT idea effectively builds upon the strong foundation of the ROT idea by offering targeted suggestions for refinement and amplification. While the ROT provides a comprehensive overview of the radical feminist critique, the GOT identifies specific areas where the argument could be made even more persuasive and impactful. The GOT's strength lies in its precision, nuanced understanding, strategic enhancement, and constructive criticism."
4,Critical_Analyst,"Okay, here's my critical analysis of the ROT and GOT ideas, focusing on their effectiveness in addressing the prompt and their respective strengths and weaknesses:  **Overall Assessment:**  Both the ROT and GOT ideas are strong and demonstrate a good understanding of the radical feminist critique of liberal feminism. The ROT provides a solid, comprehensive foundation, while the GOT offers valuable suggestions for refinement and amplification. The key point of divergence is whether or not to include a brief acknowledgement of the positive impacts of liberal feminism.  **Detailed Critique:**  **1. ROT Idea:**  *   **Strengths:**     *   **Comprehensive and Clear:** The ROT effectively addresses the prompt by providing a detailed explanation of why radical feminists denounce liberal feminism's focus on equality. It clearly articulates the core arguments and provides concrete examples.     *   **Strong Focus:** The ROT maintains a consistent focus on the radical feminist perspective, avoiding any potential dilution of the argument. This ensures that the user gains a clear understanding of the radical feminist critique.     *   **Emphasis on Systemic Change:** The ROT effectively highlights the radical feminist emphasis on dismantling patriarchal power structures, which is crucial for understanding their critique.     *   **Addresses Potential Weaknesses of GOT:** The ROT proactively addresses potential weaknesses in the GOT's suggestions, particularly regarding the inclusion of a counterpoint and the need for context when mentioning historical figures. This demonstrates a critical and thoughtful approach.  *   **Weaknesses:**     *   **Potential for Rigidity:** The strong focus on the radical feminist perspective, while a strength, could also be perceived as somewhat rigid. While the prompt *asks* for the radical feminist perspective, acknowledging, even briefly, the other side of the coin, could strengthen the argument *if done well.*     *   **Missed Opportunity for Deeper Dive into Historical Context:** While the ROT emphasizes the importance of historical context, it could benefit from providing more specific examples of how liberal feminism overlooks or downplays the contributions of radical feminist figures or movements, as suggested by the GOT.  *   **Correctness and Completeness:** The ROT is largely correct and complete in its presentation of the radical feminist critique. *   **Suggested Improvements/Points of Caution:**     *   **Implement GOT's suggestion re: historical figures, but with caution:** Incorporate GOT's suggestion to include specific examples of radical feminist figures or movements, but ensure that these examples are presented in a way that highlights their radical nature and the reasons why they might be overlooked by liberal feminists. Provide sufficient context to avoid superficiality.     *   **Consider a *very* brief concession (optional):** If the user is sophisticated, consider adding a single sentence acknowledging a potential benefit of liberal feminism, but only if it can be done without diluting the radical feminist argument. For example: ""While radical feminists critique liberal feminism's focus on equality, they acknowledge that its efforts have led to some tangible improvements in women's lives, though these are ultimately insufficient without systemic change.""  **2. GOT Idea:**  *   **Strengths:**     *   **Targeted Refinement:** The GOT provides valuable suggestions for refining and amplifying the ROT's argument, focusing on specific areas for improvement.     *   **Nuanced Understanding:** The GOT demonstrates a nuanced understanding of the radical feminist critique and identifies potential areas for clarification and amplification.     *   **Actionable Suggestions:** The suggestions provided are concrete and actionable, offering specific examples of how to strengthen the argument.  *   **Weaknesses:**     *   **Overemphasis on Nuance:** The GOT's emphasis on nuance, while valuable, could potentially dilute the core message of the radical feminist critique. The suggestion to include a counterpoint, in particular, could be misconstrued as a softening of the radical feminist position.     *   **Potential for Misinterpretation:** The GOT's suggestion to clarify that radical feminists aren't inherently *against* equality could be misinterpreted as suggesting that radical feminists are simply seeking a different path to the same goal, rather than advocating for a fundamentally different approach.  *   **Correctness and Completeness:** The GOT's assessment of the ROT is largely correct and complete. *   **Suggested Improvements/Points of Caution:**     *   **Prioritize Clarity and Focus:** When implementing the GOT's suggestions, prioritize clarity and focus to avoid diluting the radical feminist argument.     *   **Be Careful with the Counterpoint:** If including a counterpoint, ensure that it is presented in a way that does not diminish the radical feminist critique or suggest that liberal feminism is a viable alternative. Frame it as a *limited* success within a flawed system.     *   **Contextualize the Equality/Liberation Distinction:** When clarifying the distinction between equality and liberation, emphasize that radical feminists view the pursuit of equality within a patriarchal system as fundamentally flawed and potentially counterproductive.  **Balanced Overall Critique:**  The ROT provides a strong and comprehensive foundation for understanding the radical feminist critique of liberal feminism. The GOT offers valuable suggestions for refinement and amplification, but these suggestions should be implemented carefully to avoid diluting the core message. The key is to strike a balance between providing a nuanced understanding of the issues and maintaining a clear and consistent focus on the radical feminist perspective. The ROT's caution about including a counterpoint is well-taken; while it *could* strengthen the argument, it also carries the risk of creating confusion or undermining the radical feminist position. The GOT's suggestion to add more specific historical examples is a solid one, as long as sufficient context is provided to highlight the radical nature of those examples and why they are often overlooked. Ultimately, the ROT's initial framework, with careful incorporation of the GOT's suggestions (especially regarding historical examples), offers the most promising approach."
