Round,Speaker,Utterance
1,Moderator,"Debate Topic: In-depth discussion based on the mission context and ideas from ROT and GOT. Mission Context (partial): Instruction: Which of the following statements is correct concerning the ""reasonable person"" standard in tort law?  Context: [The reasonable person standard varies from person to person., The reasonable person standard focuses on the defendant's subjective mental state rather than on the defendant's behavior, A person with a physical disability must act as would a reasonable person with the same disability., A person with a mental disability must act as would a person with the same mental disability.]... Initial Core Idea from ROT (partial): The problem asks us to identify the correct statement regarding the ""reasonable person"" standard from a list of options. Based on the established system, we need to evaluate each statement against the core principles of the standard.  *   ""The reasonable person standard varies from person to person."" - This is incorrect. The standard is objective and doesn't change based on individual characteristics (except for physical disabilities).  *   ""The reasonable person standard focuses on the defendant's subjective mental state rather than on the defendant's behavior."" - This is incorrect. The standard is based on *objective* behavior, not subjective mental state.  *   ""A person with a physical disability must act as would a reasonable person with the same disability."" - This is correct. This reflects the established rule for applying the standard to individuals with physical disabilities.  *   ""A person with a mental disability must act as would be a person with the same mental disability."" - This is incorrect.  Generally, a person with a mental disability is held to the same standard as a person without a mental disability, unless the disability is sudden and unforeseen.  Therefore, the correct statement is:  **Answer:** A person with a physical disability must act as would a reasonable person with the same disability.... Initial Core Idea from GOT (partial): Okay, given the context and the refined thought about empirical study, let's analyze the provided statements and determine the correct one, incorporating the concept of foreseeability:  **Statements:**  *   **[The reasonable person standard varies from person to person.]**  This is incorrect. The *concept* of the reasonable person is a *standard*, not a reflection of individual variations. It's a hypothetical construct.  *   **[The reasonable person standard focuses on the defendant's subjective mental state rather than on the defendant's behavior.]** This is incorrect. The standard is *objective*, focusing on how a reasonable person *would behave* under similar circumstances, regardless of the defendant's actual thoughts or intentions. Foreseeability plays into this: what consequences would a reasonable person *foresee* arising from their actions?  *   **[A person with a physical disability must act as would a reasonable person with the same disability.]** This is **correct**.  The law recognizes that physical disabilities affect what is reasonably expected.  The standard is adjusted to consider what a reasonable person *with that same disability* would do. This includes considering what a reasonable person with that disability would foresee as potential consequences and what steps they would take to mitigate those consequences.  *   **[A person with a mental disability must act as would a person with the same mental disability.]** This is generally incorrect. While there are nuances and exceptions, the law generally *does not* lower the reasonable person standard for mental disabilities. The rationale is complex, but it often involves concerns about administrability, potential for abuse, and shifting responsibility to victims. There are legal arguments that this stance should change, but it currently represents the prevailing view.  The focus remains on what a *reasonable person* would foresee and do, even if the individual with a mental disability cannot meet that standard.  **Conclusion:**  The correct statement is: **A person with a physical disability must act as would a reasonable person with the same disability.** ... The debate will now commence focusing on these ideas."
2,ROT_Representative,"Okay, here's my response as the ROT Representative, addressing the task:  **1. Elaboration on ROT Idea and Key Strengths:**  My core idea directly addresses the problem by systematically evaluating each statement against the fundamental principles of the ""reasonable person"" standard. The strength of this approach lies in its directness and clarity. It breaks down the problem into manageable parts, analyzing each statement individually and providing a clear justification for its correctness or incorrectness.  Here's a more detailed breakdown of why this is effective:  *   **Directly Addresses the Question:** The instruction asks for the *correct* statement. My approach explicitly identifies *why* each statement is correct or incorrect, leaving no ambiguity. *   **Focuses on Core Principles:** By constantly referencing the core principles of the ""reasonable person"" standard (objectivity, consideration of physical disability), the analysis stays grounded in established legal doctrine. *   **Provides Clear Justification:** Each evaluation includes a concise explanation. This is crucial for understanding *why* a particular statement is true or false, rather than just stating it. *   **Highlights Exceptions:** The analysis acknowledges the exception for physical disabilities and the general rule against lowering the standard for mental disabilities, demonstrating a nuanced understanding of the law.  In essence, my approach provides a structured and well-reasoned path to the correct answer, making it easy to follow and understand.  **2. Critical Evaluation of the GOT Idea:**  The GOT idea is largely correct in its analysis and arrives at the same conclusion. However, it suffers from a few subtle weaknesses compared to my ROT approach:  *   **Overemphasis on Foreseeability:** While foreseeability is certainly *related* to the reasonable person standard, GOT places undue emphasis on it in the analysis of each statement. Foreseeability is a *component* of determining what a reasonable person *would do*, but it's not the sole determining factor for whether the *standard itself* varies or focuses on subjective states. This could confuse someone new to the concept. My ROT idea keeps the focus on the core principles of the standard *itself*. *   **Less Direct Justification:** While GOT's explanations are generally good, they're slightly less direct and concise in explaining *why* the statements are wrong. For example, in the first statement, GOT states ""The *concept* of the reasonable person is a *standard*, not a reflection of individual variations."" While technically correct, it doesn't immediately explain *why* this makes the statement incorrect. My ROT explanation, ""The standard is objective and doesn't change based on individual characteristics,"" is more directly linked to the core principle of objectivity. *   **Potentially Misleading Language Regarding Mental Disability:** GOT's language about mental disability, while ultimately arriving at the correct conclusion, could be slightly misleading. Phrases like ""the law generally *does not* lower the reasonable person standard"" are accurate, but could be interpreted as implying that the standard *should* be lowered, when the core principle is that a uniform, objective standard is maintained (with limited exceptions). My ROT explanation is more definitive in stating that a person with a mental disability is generally held to the same standard. This clarity is essential in avoiding confusion. * **Lacks the Reversal of Thought:** GOT doesn't explicitly demonstrate a reversal of thought. It presents a thorough analysis but doesn't highlight alternative interpretations or potential misunderstandings that a ""reversal of thought"" process should uncover. My ROT idea, while not explicitly labeled as such, inherently represents a reversal of thought by considering each statement and systematically *disproving* the incorrect ones before affirming the correct one.  **Why ROT is Preferable:**  My ROT approach is preferable because it's more direct, focused, and less prone to misinterpretation. It emphasizes the core principles of the reasonable person standard in a clear and concise manner, making it easier to understand and apply. By focusing on the objective nature of the standard and providing clear justifications for each statement's correctness or incorrectness, it provides a more robust and less ambiguous analysis than GOT, which potentially overcomplicates the issue with an overemphasis on foreseeability and slightly ambiguous language regarding mental disabilities. The systematic elimination of incorrect options also implicitly embodies a ""reversal of thought"" process, ensuring a thorough and well-reasoned analysis."
3,GOT_Representative,"Okay, here's my response as the GOT Representative, addressing the task:  **1. Elaboration on GOT Idea and Key Strengths:**  My core idea addresses the problem by not only identifying the correct statement but also by contextualizing it within the broader framework of tort law and the practical implications of the reasonable person standard. The key strengths of my approach are:  *   **Emphasis on Objectivity and Foreseeability:** My GOT approach highlights the critical role of *objective* assessment and *foreseeability* in determining negligence. By explicitly linking the reasonable person standard to the concept of foreseeability, I provide a deeper understanding of *why* the standard is applied in a particular way. This is crucial because foreseeability is a cornerstone of negligence analysis, and understanding its connection to the reasonable person standard allows for a more nuanced application of the law. It’s not just about identifying a rule; it’s about understanding its rationale and practical application.  *   **Nuanced Understanding of the Mental Disability Exception (or lack thereof):** My analysis acknowledges the complex and often debated area of mental disabilities. I explicitly state that the law generally *does not* lower the standard for mental disabilities, but I also acknowledge the underlying rationale and the ongoing legal arguments surrounding this issue. This demonstrates a more sophisticated understanding of the law's complexities and limitations than a simple statement of the rule. This consideration is essential for a complete understanding of the reasonable person standard.  *   **Contextualization Within Legal Policy:** By implicitly touching on the policy reasons behind the treatment of mental disabilities (administrability, potential for abuse, shifting responsibility), I elevate the analysis beyond a mere recitation of the rule. This contextualization helps to explain *why* the law takes a particular stance, which is crucial for critical thinking and legal reasoning.  *   **Graph of Thoughts Implicitly Demonstrated:** The breakdown of each statement, followed by a justification rooted in foreseeability and policy considerations, inherently illustrates a ""graph of thoughts."" I'm not just stating answers; I'm showing the reasoning process, which is what GOT aims to achieve. The analysis branches out from the initial statement to consider related concepts and justifications.  In short, my approach provides a more comprehensive and contextually rich understanding of the reasonable person standard, moving beyond a simple identification of the correct statement to explore its underlying principles and practical implications.  **2. Critical Evaluation of the ROT Idea:**  The ROT idea is correct in its conclusion and provides a solid foundation for understanding the reasonable person standard. However, it has several weaknesses compared to my GOT approach:  *   **Oversimplification and Lack of Depth:** The ROT idea focuses primarily on the ""core principles"" of the standard, which, while important, can lead to an oversimplified understanding. It lacks the depth of analysis needed to fully appreciate the nuances and complexities of applying the standard in real-world situations. For example, while it correctly states that the standard is objective, it doesn't fully explore *why* objectivity is so crucial and how it relates to other key concepts like foreseeability.  *   **Insufficient Emphasis on Foreseeability:** As I mentioned earlier, foreseeability is a critical element of negligence analysis. The ROT idea mentions it only implicitly, whereas my GOT idea makes it a central focus. This omission weakens the ROT approach because it fails to connect the reasonable person standard to its practical application in determining liability.  *   **Limited Discussion of Policy Considerations:** The ROT idea does not delve into the policy considerations that shape the application of the reasonable person standard, particularly in the context of mental disabilities. By failing to address these considerations, the ROT approach provides an incomplete picture of the legal landscape. My GOT approach, on the other hand, at least acknowledges the competing policy concerns, providing a more nuanced and insightful analysis.  *   **Missed Opportunity for ""Graph of Thoughts"":** While ROT claims to inherently represent a reversal of thought by disproving incorrect options, it doesn't explicitly demonstrate the kind of branching reasoning and exploration of related concepts that characterize a true ""graph of thoughts"" approach. It's more of a linear elimination process than a multi-faceted exploration of the legal issues.  *   **Potential for Misinterpretation Regarding Mental Disability (ironically, ROT accuses GOT of this):** While ROT claims greater clarity on the mental disability issue, its statement that ""a person with a mental disability is generally held to the same standard"" *without* acknowledging the underlying complexities *could* be seen as overly simplistic and potentially misleading. It doesn't acknowledge the ongoing debate and the subtle nuances that exist in this area of law. My GOT approach, by acknowledging the debate and policy considerations, provides a more accurate and responsible representation of the law.  **Why GOT is Preferable:**  My GOT approach is preferable because it provides a more comprehensive, nuanced, and contextually rich understanding of the reasonable person standard. By explicitly linking the standard to foreseeability, acknowledging the complexities of mental disability, and touching on underlying policy considerations, my approach moves beyond a simple recitation of the rule to explore its practical implications and underlying rationale. The GOT method inherently demonstrates a graph of thoughts by showcasing the reasoning process, exploring related concepts, and justifying each statement with relevant principles. This deeper level of analysis makes my approach more valuable for critical thinking, legal reasoning, and a complete understanding of the law."
4,Critical_Analyst,"Okay, here's a critical analysis of the ROT and GOT representatives' ideas, addressing their strengths, weaknesses, and potential improvements, along with an overall balanced critique:  **Overall Assessment:**  Both ROT and GOT correctly identify the answer to the question. However, they differ in their approach and depth of analysis. ROT prioritizes clarity and directness, focusing on the core principles. GOT aims for a more comprehensive understanding by incorporating foreseeability and policy considerations. While GOT strives for a deeper understanding, it risks overcomplicating the issue, while ROT, in its attempt to be straightforward, may sacrifice some nuance.  **ROT Analysis:**  *   **Strengths:**     *   **Clarity and Directness:** ROT excels in providing clear and concise explanations for why each statement is correct or incorrect. Its focus on the core principles of the reasonable person standard makes the analysis easy to follow.     *   **Systematic Approach:** The systematic evaluation of each statement ensures a thorough analysis and reduces the risk of overlooking important details.     *   **Explicitly Addresses the Question:** ROT directly answers the question by explicitly identifying the *reason* each statement is correct or incorrect. *   **Weaknesses:**     *   **Oversimplification:** By focusing solely on the core principles, ROT's analysis may lack the depth needed to fully appreciate the nuances and complexities of applying the standard in real-world situations.     *   **Implicit Foreseeability:** Foreseeability is a crucial aspect of negligence, and ROT's implicit treatment of it is a weakness. A more explicit discussion of foreseeability would strengthen the analysis.     *   **Limited Policy Discussion:** ROT avoids delving into the policy considerations that influence the application of the reasonable person standard. This omission creates an incomplete picture of the legal landscape. *   **Inconsistencies:** None. *   **Overlooked Aspects:** The application of the reasonable person standard in specific scenarios (e.g., emergency situations) and the economic considerations that influence the development of the standard could be further explored. *   **Correctness and Completeness:** The solution is correct but not entirely complete. It identifies the correct statement but could offer a more thorough explanation of the underlying legal principles. *   **Improvements/Cautions:**     *   Expand the discussion to include the role of foreseeability in determining what a reasonable person would do.     *   Acknowledge and briefly discuss the policy considerations that influence the application of the standard, particularly in the context of mental disability.     *   While clarity is a strength, avoid oversimplification to the point of neglecting important nuances.  **GOT Analysis:**  *   **Strengths:**     *   **Contextualization:** GOT excels in contextualizing the reasonable person standard within the broader framework of tort law and its practical implications.     *   **Emphasis on Foreseeability:** GOT correctly highlights the crucial role of foreseeability in negligence analysis and its connection to the reasonable person standard.     *   **Nuanced Understanding:** GOT acknowledges the complexities and debates surrounding the application of the standard to individuals with mental disabilities, demonstrating a more sophisticated understanding of the law.     *   **Attempts to demonstrate a ""Graph of Thoughts"":** GOT attempts to illustrate the reasoning process. *   **Weaknesses:**     *   **Potential for Overcomplication:** The attempt to provide a comprehensive understanding of the standard could lead to overcomplication, especially for someone new to the concept.     *   **Implicit Graph of Thoughts:** The ""graph of thoughts"" approach is not explicitly demonstrated and could be made more clear through visual aids or a more structured presentation of the reasoning process. It's more described than shown.     *   **Overemphasis on Foreseeability:** While foreseeability is important, GOT may place undue emphasis on it in the analysis of each statement. *   **Inconsistencies:** None. *   **Overlooked Aspects:** While GOT touches on policy considerations, a more detailed discussion of the economic factors that influence the development of the standard would be beneficial. *   **Correctness and Completeness:** The solution is correct and more complete than ROT's, but it could be more accessible to a broader audience by simplifying some of the language and concepts. *   **Improvements/Cautions:**     *   Strive for a balance between comprehensiveness and clarity. Avoid overcomplicating the analysis to the point of confusing the reader.     *   Explicitly demonstrate the ""graph of thoughts"" approach by providing a more structured and visual representation of the reasoning process.     *   While foreseeability is important, avoid overemphasizing it to the detriment of other key principles of the standard.  **Balanced Critique:**  Both ROT and GOT provide valuable insights into the reasonable person standard. ROT offers a clear and direct approach, while GOT aims for a more comprehensive and nuanced understanding. ROT's analysis is more accessible to a broader audience, but it may lack the depth needed for a complete understanding of the legal principles. GOT's analysis is more insightful, but it risks overcomplicating the issue.  Ultimately, the best approach depends on the specific goals of the analysis. If the goal is to provide a quick and easy-to-understand answer to the question, ROT's approach may be preferable. However, if the goal is to provide a more comprehensive and nuanced understanding of the reasonable person standard, GOT's approach may be more appropriate, provided that the potential for overcomplication is carefully managed.  For improvement, ROT should consider incorporating a more explicit discussion of foreseeability and policy considerations, while GOT should focus on simplifying its language and concepts and making its ""graph of thoughts"" approach more explicit and demonstrable. Both should strive to provide a balanced perspective that acknowledges the complexities of the law without sacrificing clarity and accessibility."
