Round,Speaker,Utterance
1,Moderator,"Debate Topic: In-depth discussion based on the following mission context, ROT idea, GOT idea, and LOT idea. Mission Context: Instruction: Arguing that someone couldn't have done something good because she holds a particular position commits the fallacy of  Context: The following are multiple choice options:[Guilt by association, False dilemma, Reprehensible personality, False dichotomy] Initial Core Idea from GOT: The fallacy being described is **Reprehensible personality**.  **Reasoning:**  The argument presented states that someone's position (or, more accurately, a negative perception of that position) inherently prevents them from doing something good. This focuses on a perceived flaw in the *person* making the action, rather than the action itself. This aligns with the definition of attacking the person's character or personality instead of addressing the argument or action itself.  *   **Guilt by association:** This fallacy argues that someone is guilty or wrong because of their association with a particular group or person. While there might be an implied association with the position, the core argument is about the person holding the position.  *   **False dilemma/dichotomy:** This fallacy presents a situation as having only two options when more exist. This doesn't fit the structure of the argument.  Therefore, the most accurate answer is **Reprehensible personality**. Output: Reprehensible personality Initial Core Idea from GOT: The best answer is **reprehensible personality**. Here's why:  *   **Reprehensible personality:** This aligns with the idea that someone's inherent character, based on their position, prevents them from doing good. It's assuming their position makes them a bad person, incapable of positive actions.  Let's look at why the other options are less suitable:  *   **Guilt by association:** This is about associating someone with a negative group or person to discredit them. While there might be an element of association involved (the position itself), the core argument is about the person *in* that position being inherently incapable of good. *   **False dilemma/False dichotomy:** This presents only two options when more exist. It doesn't fit the scenario of arguing against someone's ability to do good based on their position. Initial Detailed Plan from LOT: Aggregated result from layer 139 (Concept: 'Generate and present the answer...') using strategy 'all_content_ranked': - (Criterion: 'Criterion G (Level 1): Directly apply each fallacy definition to the prompt. For each fallacy, explain *why* or *why not* it directly addresses the scenario of discrediting someone's good deed based on their position', Level: 1):   Okay, let's apply each fallacy definition to the prompt and see which one best fits the scenario:  *   **Guilt by association:** This fallacy argues that someone is guilty or bad because of their association with a person or group that is guilty or bad. This doesn't directly fit. The prompt isn't about associating the person with a bad group; it's about discrediting their good deed based on the position *they* hold, not who they associate with.  *   **False dilemma (or False dichotomy):** This fallacy presents only two options when more exist. This is irrelevant to the prompt. The prompt doesn't present a limited set of choices.  *   **Reprehensible personality:** While a reprehensible personality *might* lead someone to do bad things, the fallacy in the prompt isn't about their overall character. The argument is specifically about *discrediting a good deed solely based on their position*, implying that someone in that position is inherently incapable of doing something good. This is close but not quite a named fallacy.  *   **False dichotomy:** (Same as False dilemma) This fallacy presents only two options when more exist. This is irrelevant to the prompt. The prompt doesn't present a limited set of choices.  Based on these explanations, none of the options perfectly capture the fallacy described in the prompt. However, ""Guilt by association"" is the closest, as it involves discrediting someone based on something related to them (association vs. position). The core issue is that the person's position is being used to unfairly dismiss their action, similar to how an association is used to unfairly judge someone.  Final Answer: Guilt by association  - (Criterion: 'Criterion H (Level 2): Imagine the ""position"" in the argument is a specific, controversial role, like ""politician"" or ""lobbyist"". Does substituting these specific roles make one fallacy more clearly applicable than others?', Level: 1):   Okay, let's consider how specific controversial roles might highlight one fallacy over others.  If the position is ""politician,"" the argument might look like this: ""She's a politician, so she couldn't have genuinely helped that community."" This sounds like **Guilt by Association**. The negative connotations associated with the general idea of ""politician"" are being used to discredit the specific act of helping the community. The implication is that because she's a politician, she *must* have ulterior motives or be insincere, thus making the good deed inherently suspect.  Let's analyze why the other options are less fitting:  *   **False Dilemma/False Dichotomy:** This fallacy presents only two options when more exist. The argument doesn't force a choice between two limited options. *   **Reprehensible Personality:** While a politician *could* have a reprehensible personality, the argument focuses on the position itself, not inherent character flaws. It's not saying ""she's a *bad person*, therefore she couldn't have done a good thing,"" but rather ""she's a *politician*, therefore she couldn't have done a good thing.""  Therefore, substituting ""politician"" as the position more strongly suggests **Guilt by Association**. The inherent biases and negative perceptions attached to the role are used to invalidate the person's actions.  - (Criterion: 'Criterion I (Level 2): Contrast the given scenario with a scenario where the person's position is irrelevant. For example, what if the argument was ""She couldn't have done something good because she's clumsy""? How does this comparison highlight the relevant fallacy in the original scenario?', Level: 1):   The original scenario argues against someone's good deed based on their position (e.g., ""She's a politician, so she couldn't have genuinely helped that homeless person""). The fallacy hinges on the idea that the position inherently taints the action.  Contrast this with ""She couldn't have done something good because she's clumsy."" Clumsiness is a personal characteristic, not a position or association. While her clumsiness *might* make it *difficult* for her to do something requiring fine motor skills, it doesn't automatically invalidate the possibility of her doing something good. The argument is weak, but it doesn't rely on the *source* of the action being inherently suspect.  The politician example is suspect because it implies all politicians are incapable of genuine good deeds due to their role. This is similar to saying ""He hangs out with criminals, so he must be a criminal himself,"" which is guilt by association. The clumsiness example, however, doesn't suggest that clumsiness inherently prevents good deeds; it merely introduces a potentially mitigating factor.  - (Criterion: 'Criterion J (Level 3): Research real-world examples of arguments that resemble the prompt. Identify which fallacy is most commonly used to describe these arguments in academic or journalistic analyses', Level: 1):   Okay, let's research real-world examples of arguments that resemble the prompt ""Arguing that someone couldn't have done something good because she holds a particular position"" and identify the fallacy most commonly used to describe them.  Here's a breakdown with examples and analysis:  **Examples and Fallacy Identification:**  *   **Example 1: Political Affiliation and Charitable Acts:** ""She's a Republican, so there's no way she genuinely donated to that homeless shelter. It's just a PR stunt.""      *   **Analysis:** This argument asserts that someone's political affiliation (Republican) inherently disqualifies them from performing a genuinely altruistic act. The underlying assumption is that Republicans, by virtue of their political position, are incapable of genuine charity. This aligns strongly with **Guilt by Association**. The person is being judged not on their actions (the donation), but on their association with a political group. The implication is that all Republicans are inherently insincere or selfish.  *   **Example 2: Corporate Position and Environmental Advocacy:** ""The CEO of an oil company can't possibly care about the environment. He's just saying that to appease the public.""      *   **Analysis:** This argument suggests that someone's position as CEO of an oil company makes it impossible for them to genuinely care about environmental issues. It assumes an inherent conflict of interest and denies the possibility of genuine concern or a desire for change within the industry. Again, this points to **Guilt by Association**. The CEO is being judged based on their association with a company perceived as environmentally damaging. The argument implies that all CEOs of oil companies are inherently environmentally irresponsible.  *   **Example 3: Religious Belief and Scientific Contribution:** ""He's a devout Christian, so his scientific research must be biased and unreliable.""      *   **Analysis:** This argument claims that someone's religious beliefs automatically invalidate their scientific work. It assumes that religious belief and scientific objectivity are mutually exclusive. This is another clear example of **Guilt by Association**. The person's scientific work is being discredited based on their association with a religious group. The argument implies that all devout Christians are incapable of objective scientific inquiry.  **Why Guilt by Association is the Best Fit:**  In each of these examples, the core issue is that the person's *position* (political affiliation, corporate role, religious belief) is being used to discredit their actions or character. The argument doesn't focus on the *specifics* of their actions, but rather on the perceived negative associations linked to their position. This is the essence of Guilt by Association. The person is being judged and condemned because of who they associate with or what group they belong to.  **Why the Other Options are Less Suitable:**  *   **False Dilemma/False Dichotomy:** These fallacies present a situation as having only two options when more exist. The prompt doesn't inherently involve limiting choices. *   **Reprehensible Personality:** While the position someone holds might be considered by some to be held by reprehensible people, the fallacy is not that they have a bad personality, but that their position itself taints any good action.  **Conclusion:**  Based on real-world examples and academic analysis, the fallacy that best describes the prompt ""Arguing that someone couldn't have done something good because she holds a particular position"" is **Guilt by Association**.  - (Criterion: 'Criterion K (Level 3): Consider counter-arguments. What arguments could be made *against* the idea that the scenario represents the most appropriate fallacy? This could involve identifying edge cases or alternative interpretations.', Level: 1):   Okay, let's consider counter-arguments against the idea that the scenario represents a specific fallacy, focusing on why it *might not* be the most appropriate choice, and potentially favoring one of the other options.  **Counter-arguments against the scenario representing ""Guilt by Association"":**  *   **Guilt by Association relies on shared connections, not inherent positions:** Guilt by association argues that someone is bad *because of their association* with other bad people or ideas. The scenario describes someone being discredited solely based on their *position* (e.g., ""She's a CEO, so she couldn't have done something altruistic""). This isn't necessarily about who they associate with; it's about the perceived inherent nature of the position itself. For example, someone *might* argue that ""all CEOs are greedy, therefore she couldn't have done something good."" In this case, the *position* is the issue, not the associations. *   **The argument is more direct:** Guilt by association is often indirect (""You know X, and X is bad, therefore you're probably bad too""). The scenario's argument is more direct: ""She's a [position], therefore she couldn't have done [good thing]."" This directness pushes it away from the subtlety usually associated with guilt by association.  **Counter-arguments against the scenario representing ""False Dilemma"" or ""False Dichotomy"":**  *   **No limited choices are presented:** A false dilemma presents a limited number of options (often two) as the only possibilities when more exist. The scenario doesn't force a choice between alternatives. There's no ""either/or"" being presented. It's a statement of supposed impossibility based on position, not a constrained choice.  **Counter-arguments against the scenario representing ""Reprehensible Personality"":**  *   **Focus is on the *position*, not the person's inherent character:** While a reprehensible personality could explain *why* someone might not do something good, the scenario emphasizes the position as the *reason* for the supposed impossibility. The argument isn't necessarily that the person is inherently bad, but that the position they hold makes the good deed incompatible with that position. For example, it is not about the person's character flaws but rather the perceived characteristics of the position.  **Therefore:** These counter-arguments suggest that the scenario doesn't neatly fit ""Guilt by Association"", ""False Dilemma"", or ""Reprehensible Personality"". It's about a perceived incompatibility between a *position* and a good action, not necessarily about indirect associations, limited choices, or inherent character flaws. This reinforces that a different fallacy might be more appropriate.   The debate will now commence."
2,ROT_Representative,"Okay, here's an analysis of the given ideas and a defense of my core idea, ""Reprehensible personality,"" in the context of the prompt.  **My Core Idea: Reprehensible Personality**  As the ROT Representative, my core idea is that the fallacy being described is **Reprehensible personality**. The argument presented states that someone's position (or, more accurately, a negative perception of that position) inherently prevents them from doing something good. This focuses on a perceived flaw in the *person* making the action, rather than the action itself. This aligns with the definition of attacking the person's character or personality instead of addressing the argument or action itself.  *   **Guilt by association:** This fallacy argues that someone is guilty or wrong because of their association with a particular group or person. While there might be an implied association with the position, the core argument is about the person holding the position.  *   **False dilemma/dichotomy:** This fallacy presents a situation as having only two options when more exist. This doesn't fit the structure of the argument.  Therefore, the most accurate answer is **Reprehensible personality**.  **Evaluation of the GOT Idea**  The GOT idea correctly identifies that ""Reprehensible personality"" aligns with the idea of someone's character, based on their position, preventing them from doing good. It also acknowledges that the other options are less suitable because ""Guilt by association"" is more about negative associations, and ""False dilemma/dichotomy"" doesn't fit the scenario.  *   **Strengths:** The GOT accurately assesses each option and provides logical reasoning for why ""Reprehensible personality"" is the *closest* fit among the choices. *   **Weaknesses:** The GOT ultimately doesn't fully commit to ""Reprehensible personality,"" likely because it's not a formally named fallacy. This is a significant weakness, as the goal is to identify the *most accurate* fallacy, even if it's a descriptive term rather than a specifically defined one.  **Evaluation of the LOT Idea**  The LOT idea explores the prompt from multiple angles (applying fallacy definitions, substituting specific roles, contrasting scenarios, researching real-world examples, and considering counter-arguments). This is a thorough approach. However, it makes a crucial error in ultimately settling on ""Guilt by Association.""  *   **Strengths:** The LOT's exploration of real-world examples is valuable. The analysis of the politician, CEO, and religious belief examples is insightful. The counter-arguments section is also strong, as it acknowledges the limitations of ""Guilt by Association."" *   **Weaknesses:** Despite the thorough analysis, the LOT misinterprets the core of the fallacy. It focuses too much on the *association* aspect and not enough on the *inherent character judgment* based on the position. For example, while the CEO of an oil company *is* associated with a potentially negative industry, the argument is that *being* a CEO of that company *makes* them incapable of caring about the environment. It's an attack on their character/personality based on their role, not just an association. By prioritizing ""Guilt by Association,"" it overlooks the direct character judgment implied in the prompt. The other weakness is the over reliance on named fallacies, even if a descriptive term is more appropriate.  **Why My Approach is Preferable**  My approach, focusing on ""Reprehensible personality,"" directly addresses the core problem:  1.  **Focus on character:** The prompt is fundamentally about judging someone's *character* based on their position. The argument implies that holding a particular position inherently makes a person incapable of good actions. This is a direct attack on their perceived character traits. 2.  **Distinction from Guilt by Association:** While there might be an *implied* association, the argument is not primarily about the *association itself*. It's about the *inherent nature* of someone *in* that position. For example, the argument isn't ""politicians associate with corrupt individuals, so she must be corrupt."" It's ""she's a politician, therefore she *can't* be genuine."" 3.  **Accuracy:** It is the most accurate description of the flawed reasoning process.  My approach is preferable because it correctly identifies the core element of the fallacy: the judgment of someone's character or personality based on their position, leading to the assumption that they are incapable of doing something good."
3,GOT_Representative,"The core idea I presented, that the best answer is ""Reprehensible personality,"" directly addresses the prompt's scenario by highlighting how the position itself is used to discredit the person's ability to do good. It assumes that the inherent nature of the position makes the individual incapable of positive actions.  The ROT idea, while landing on ""Reprehensible personality,"" reasons that the argument focuses on a perceived flaw in the *person* making the action, rather than the action itself, aligning with attacking the person's character. This is a valid interpretation, and it strengthens the case for ""Reprehensible personality"". However, it could be strengthened by emphasizing that the ""flaw"" is perceived *because* of the position they hold.  Now, let's dissect the LOT ideas and their weaknesses compared to the ""Reprehensible personality"" choice:  The LOT uses multiple criteria to evaluate the options, eventually leaning towards ""Guilt by Association."" This is where the analysis falters. While ""Guilt by Association"" might seem related due to the negative connotations associated with the position, it fundamentally misses the mark. ""Guilt by Association"" requires an *association* with a negative group or idea. The prompt focuses on the *inherent nature* of the position itself, regardless of external associations. The LOT acknowledges this weakness in its counter-argument section, admitting that the scenario doesn't neatly fit ""Guilt by Association.""  The LOT also considers specific roles like ""politician"" or ""CEO"" to illustrate the argument. This is a useful approach, but it still leads to the incorrect conclusion of ""Guilt by Association"" because it gets caught up in the negative *perceptions* associated with those roles, rather than recognizing that the argument is about the position *making* the good deed impossible.  The LOT also contrasts the scenario with one where the position is irrelevant (""She's clumsy""). This comparison is useful, but it doesn't fully solidify the rejection of ""Guilt by Association"". It correctly identifies that clumsiness is a personal characteristic, not a position, but fails to see that the original scenario attacks the inherent nature of the position, making it incompatible with good deeds.  The LOT's research into real-world examples is helpful, but again, the analysis misinterprets the core fallacy. While it correctly identifies the arguments as discrediting actions based on the person's position, it still interprets this as ""Guilt by Association"" by focusing on the negative associations linked to the position.  **Why ""Reprehensible Personality"" is preferable:**  My approach, centering on ""Reprehensible personality,"" is preferable because it directly addresses the underlying assumption that the person is incapable of doing good *because* of the inherent characteristics of their position. The LOT's focus on ""Guilt by Association"" introduces an unnecessary element of association with external groups or ideas.  *   **Direct relevance:** ""Reprehensible personality"" speaks directly to the idea that the position itself taints the person, making good deeds seem inherently contradictory or impossible. *   **Avoids misdirection:** It avoids the misdirection of ""Guilt by Association,"" which requires a connection to external negative entities. *   **Focus on inherent nature:** It keeps the focus on the perceived inherent qualities of the position, which is the core of the argument.  In conclusion, while the LOT explores various facets of the argument, its ultimate conclusion of ""Guilt by Association"" is flawed. The ""Reprehensible personality"" directly addresses the prompt by highlighting the assumption that the position itself prevents the person from doing good."
