Round,Speaker,Utterance
1,Moderator,"Debate Topic: In-depth discussion based on the mission context and ideas from ROT and LOT. Mission Context (partial): Instruction: Which statement best describes one of Dworkin's central arguments in Justice for Hedgehogs?  Context: The following are multiple choice options:[Morality plays no role in the concept of law., Moral arguments operate only in hard cases., The law dictates what moral values should affect our ethical behaviour., Moral values are both independent and objective.]... Initial Core Idea from ROT (partial): Okay, let's analyze the options in relation to Ronald Dworkin's *Justice for Hedgehogs* and his broader philosophical views:  *   **""Morality plays no role in the concept of law.""** This is directly contrary to Dworkin's position. He is a strong proponent of the idea that law and morality are deeply intertwined. He rejects legal positivism's separation thesis.  *   **""Moral arguments operate only in hard cases.""** While Dworkin discusses hard cases, he doesn't limit the relevance of moral arguments to only those situations. His theory of law as integrity suggests that moral principles are always relevant in interpreting and applying the law, not just when the legal rules are unclear.  *   **""The law dictates what moral values should affect our ethical behaviour.""** This statement gets the relationship backward. Dworkin argues that moral values *inform* and *justify* the law, not the other way around. The law should be interpreted in a way that is consistent with the best understanding of moral principles.  *   **""Moral values are both independent and objective.""** This option aligns with Dworkin's overall project in *Justice for Hedgehogs*. He argues for the unity of value, meaning that ethical, moral, and political values are interconnected and that there are objective standards of correctness in these domains. He defends a form of moral realism, suggesting that moral truths exist independently of our beliefs or opinions.  Therefore, the best answer is:  **Moral values are both independent and objective.**... Initial Detailed Plan from LOT (partial): Aggregated result from layer 155 (Concept: 'Generate and present the answer based on the plan...') using strategy 'all_content_ranked': - (Criterion: 'Criterion A (Level 1): Re-evaluate each multiple-choice option, explicitly linking it (or its negation) to Dworkin's concept of 'integrity' as described in previous steps. Which option, if true, would most undermine the possibility of legal integrity?', Level: 1):   Okay, let's re-evaluate each option in light of Dworkin's concept of integrity, focusing on how each would undermine (or support) the possibility of integrity in law:  *   **Option 1: ""Morality plays no role in the concept of law.""**  If morality played *no* role in law, then law could be entirely arbitrary and based solely on power or expediency. There would be no basis for arguing that the law should be coherent with a consistent set of principles (integrity). This would *directly* undermine integrity. A legal system divorced from morality would be a system where judges could not strive to interpret laws in a way that makes the law the best it can be, morally speaking.  *   **Option 2: ""Moral arguments operate only in hard cases.""** This suggests that morality is *only* relevant when the law is unclear. While Dworkin acknowledges the importance of moral reasoning in hard cases, he argues that moral principles are always implicated in legal reasoning, even in seemingly straightforward cases. Integrity requires consistency across *all* legal interpretations, not just the difficult ones. This option weakens, but doesn't entirely negate, integrity, as it allows for moral considerations, but only in limited circumstances.  *   **Option 3: ""The law dictates what moral values should affect our ethical behaviour.""** This implies that law is *prior* to morality, defining it rather than being informed by it. Dworkin argues that law and morality are intertwined and that legal interpretation should strive to find the best interpretation that fits the existing legal materials *and* is morally justified.  If the law solely dictated morality, it could potentially lead to unjust laws that are consistently applied, thus fulfilling a kind of formal integrity, but at the expense of true justice and moral integrity. This is less directly opposed to Dworkin's view than Option 1.  *   **Option 4: ""Moral values are both independent and objective.""** This aligns with Dworkin's view that there are objective moral truths that are discoverable through reason and argument, and that these values are not simply products of personal preference or social convention.  If moral values are independent and objective, then law can be evaluated against these independent standards and interpreted in a way that reflects them. This supports the possibility of integrity, as it provides a basis for arguing that the law should be coherent with a consistent set of objective moral principles. This option *supports* integrity.  **Conclusion:** Option 1 (""Morality plays no role in the concept of law"") most directly undermines the possibility of legal integrity as Dworkin conceives it. If morality is irrelevant to law, there is no basis for striving for coherence with moral principles, which is central to Dworkin's concept of integrity.  - (Criterion: 'Criterion B (Level 1): Consider Dworkin's holistic approach to value. How does he argue that ethics, morality, and politics are interconnected? Which of the multiple-choice options best reflects this interconnectedness?', Level: 1):   Dworkin argues against compartmentalizing ethics, morality, and politics. He believes they are interconnected and form a seamless web of value. His ""one big thing"" thesis suggests that these domains are mutually supportive and interpretive. The option ""Moral values are both independent and objective"" *seems* counterintuitive to this interconnectedness at first glance, but Dworkin argues that the objectivity of value allows for a coherent and consistent framework across these domains. The seeming independence is not isolation, but rather that moral values aren't *derived* from law or politics, but exist in their own right, contributing to and being interpreted within the broader ethical and political context. Other options like ""Morality plays no role in the concept of law"" and ""The law dictates what moral values should affect our ethical behaviour"" are directly contrary to Dworkin's view. ""Moral arguments operate only in hard cases"" is also incorrect, as Dworkin believes moral reasoning is central to *all* legal interpretation. Thus, the option that best reflects his interconnectedness is that moral values are both independent and objective, because this independence allows them to be a stable foundation for ethical and political considerations.  - (Criterion: 'Criterion C (Level 2): Explore potential counterarguments to the 'independent and objective' option. What are the most common criticisms of moral objectivism, and how might Dworkin respond to them within his framework?', Level: 1):   Dworkin anticipates and addresses common criticisms of moral objectivism. One frequent objection is the problem of moral disagreement: If morality is objective, why do people disagree so profoundly about it? Dworkin argues that disagreement, even persistent disagreement, doesn't necessarily undermine objectivity. People disagree about science, history, and aesthetics, but that doesn't make those domains subjective. He suggests that moral disagreement often stems from different interpretations of fundamental moral concepts or from differing factual beliefs about the consequences of actions.  Another criticism is the is-ought problem: How can we derive moral 'oughts' from factual 'is' statements? Dworkin doesn't believe in deriving morality from brute facts. Instead, he grounds morality in interpretation and justification. Moral values are not discovered 'out there' but are constructed through reasoned argument and reflection within a framework of fundamental moral principles. He sees moral reasoning as a process of striving for coherence between our beliefs, values, and actions, rather than a process of deducing moral conclusions from objective facts.  A third challenge is the charge of moral imperialism or cultural relativism. If morality is objective, does that mean one culture's values are inherently superior to others? Dworkin rejects the idea of a single, universally applicable moral code. He emphasizes the importance of interpretation and context in applying moral principles. While he believes some moral principles are fundamental (like equality and dignity), their specific application may vary across cultures and situations. He advocates for a form of moral universalism that respects cultural diversity while upholding basic human rights. He argues that genuine disagreements about moral principles should be resolved through reasoned argument and mutual understanding, not through imposing one culture's values on another.  - (Criterion: 'Criterion D (Level 2): Analyze the role of 'interpretation' in Dworkin's theory. Does the act of interpreting moral values necessarily undermine their objectivity, or does it provide a pathway to discovering objective truths?', Level: 1):   Dworkin's theory hinges on interpretation, particularly in law and morality. He argues that interpretation isn't a subjective free-for-all, but a process of striving for the ""best light"" understanding of a practice or concept. This means finding the interpretation that both fits the existing data (legal precedents, moral intuitions) and justifies it in the most morally compelling way. Crucially, Dworkin believes this interpretive process, when done correctly, *reveals* objective moral truths rather than creating them subjectively. The interpreter isn't simply imposing their personal values, but rather engaging in a reasoned argument to discover the most coherent and morally sound understanding. So, interpretation, in Dworkin's view, is not a threat to objectivity, but a necessary method for accessing it. This relates to the main task because it explains how Dworkin can argue for both the independence and objectivity of moral values, even when acknowledging the role of human interpretation in understanding them.  - (Criterion: 'Criterion E (Level 3): Imagine Dworkin debating a legal positivist (e.g., Hart or Kelsen). Which multiple-choice option would Dworkin most likely use to differentiate his position from legal positivism? How would he frame his argument in opposition to their views?', Level: 1):   Dworkin, debating a legal positivist like Hart, would strongly disagree with the statement ""Morality plays no role in the concept of law."" Legal positivists, at least in Hart's soft positivism, allow for morality to *influence* law through the rule of recognition. However, Dworkin goes further, arguing that legal interpretation *necessarily* involves moral interpretation. He would argue against the positivist separation of law and morality, emphasizing that judges constantly make moral judgments when deciding what the law *is*, not just when filling gaps in the law. He'd likely frame his argument by pointing to hard cases where legal rules are unclear or conflicting, demonstrating how judges inevitably rely on moral principles to reach a decision that best fits and justifies the legal system as a whole. He would use the idea of ""integrity"" to show how legal interpretation is not just about following rules, but about ensuring the law expresses a coherent and morally justifiable set of principles.  ... The debate will now commence focusing on these ideas."
2,ROT_Representative,"Okay, here's my response as ROT_Representative, addressing the task of elaborating on my core idea and critically evaluating the LOT idea:  **1. Elaboration on the ROT Core Idea and its Strengths**  My core idea focuses on analyzing each multiple-choice option in relation to Ronald Dworkin's *Justice for Hedgehogs* and his broader philosophical commitments, specifically to the ""unity of value"" and his defense of moral objectivism. It directly addresses the mission by systematically examining how each option aligns (or clashes) with Dworkin's central arguments.  The key strengths of this approach are:  *   **Directness:** It directly tackles the question by evaluating each option based on Dworkin's known positions. *   **Comprehensiveness:** It considers all options, ensuring a thorough examination of the possibilities. *   **Accuracy:** It accurately reflects Dworkin's stance on the relationship between law and morality, his rejection of legal positivism's separation thesis, and his advocacy for objective moral values. *   **Clarity:** It provides clear explanations for why each option is either consistent or inconsistent with Dworkin's philosophy. *   **Efficiency:** It quickly identifies the most plausible answer without getting bogged down in unnecessary details.  The core problem is identifying the statement that *best* describes one of Dworkin's *central* arguments in *Justice for Hedgehogs*. My approach solves this by (1) establishing Dworkin's core commitments (unity of value, moral objectivism), and (2) then using those commitments as a litmus test for each option. The option that survives this test most robustly is the best answer.  **2. Critical Evaluation of the LOT Idea**  The LOT idea is a multi-faceted approach that analyzes the options through several criteria, including:  *   **Criterion A:** Linking options to Dworkin's concept of integrity and assessing whether each option undermines or supports it. *   **Criterion B:** Considering Dworkin's holistic approach to value and assessing which option best reflects the interconnectedness of ethics, morality, and politics. *   **Criterion C:** Exploring potential counterarguments to the 'independent and objective' option. *   **Criterion D:** Analyzing the role of 'interpretation' in Dworkin's theory. *   **Criterion E:** Imagining Dworkin debating a legal positivist.  While the LOT idea is commendable for its depth and thoroughness, it has several potential weaknesses and limitations compared to my ROT approach:  *   **Overemphasis on ""Integrity"" (Criterion A):** While integrity is a crucial concept in Dworkin's work, focusing *primarily* on whether an option undermines integrity might obscure the broader picture of his moral objectivism and the ""unity of value."" Integrity is a *consequence* of his moral realism, not the other way around. The LOT analysis concludes that Option 1 most undermines integrity, but this doesn't necessarily make Option 4 the *best* description of Dworkin's *central* argument in Justice for Hedgehogs. *   **Potential for Misinterpretation (Criterion B):** LOT claims that the option ""Moral values are both independent and objective"" *seems* counterintuitive to this interconnectedness at first glance. The ROT argument is that the seeming independence is not isolation, but rather that moral values aren't *derived* from law or politics, but exist in their own right, contributing to and being interpreted within the broader ethical and political context. LOT's initial hesitation introduces unnecessary complexity and could lead to downplaying the importance of moral objectivism. *   **Risk of Getting Lost in Details (Criteria C & D):** Exploring counterarguments to moral objectivism and analyzing the role of interpretation are valuable exercises, but they could distract from the core task of identifying the *best* statement describing Dworkin's central argument. These criteria delve into nuanced debates that, while relevant, aren't essential for answering the specific question. A simpler, more direct approach is preferable for this task. *   **Conflation with Legal Positivism (Criterion E):** While comparing Dworkin to legal positivists is useful, it risks framing the question as solely about the relationship between law and morality. Dworkin's *Justice for Hedgehogs* is a broader defense of value, and the best answer should reflect this wider scope. The ROT idea directly addresses this wider scope. *   **Less Efficient:** The LOT approach, with its multiple criteria and layers of analysis, is inherently more time-consuming and complex than the ROT approach, which focuses on directly comparing each option to Dworkin's core commitments.  **Why the ROT approach is preferable:**  The ROT approach is preferable because it is more direct, efficient, and accurately reflects the *central* focus of *Justice for Hedgehogs*. While the LOT approach offers a comprehensive analysis, its complexity and potential for digression make it less suitable for quickly and accurately identifying the best answer to the specific question. The ROT focuses like a laser beam on the core philosophical commitments that underpin Dworkin's arguments, providing a clearer path to the correct answer."
3,LOT_Representative,"Okay, here's my response as LOT_Representative, addressing the task of elaborating on my detailed plan and critically evaluating the ROT idea:  **1. Elaboration on the LOT Detailed Plan and its Strengths**  My detailed plan, derived from the aggregated results of layer 155, directly addresses the core problem of identifying the statement that best describes one of Dworkin's central arguments in *Justice for Hedgehogs*. It achieves this through a multi-faceted approach, applying several criteria to each multiple-choice option.  The plan's core strength lies in its **holistic and layered analysis**. It doesn't simply rely on a surface-level understanding of Dworkin; instead, it delves into the nuances of his philosophy, considering different facets of his work and addressing potential counterarguments.  Here's how each criterion contributes to solving the problem:  *   **Criterion A (Integrity):** This criterion directly links each option to Dworkin's concept of integrity. By evaluating which option, if true, would most undermine legal integrity, we gain a strong negative filter. This helps us eliminate options that are fundamentally incompatible with Dworkin's legal theory. *   **Criterion B (Holistic Value):** This criterion focuses on Dworkin's ""one big thing"" thesis and the interconnectedness of ethics, morality, and politics. It ensures that the chosen option aligns with Dworkin's broader philosophical project, preventing us from selecting an answer that might be true in isolation but doesn't fit within his overall framework. This also addresses the ROT's concern about overemphasizing ""integrity"" by expanding the scope to his entire value system. *   **Criterion C (Counterarguments):** This criterion explores potential counterarguments to moral objectivism. By anticipating and addressing these criticisms, we demonstrate a deeper understanding of Dworkin's position and its potential weaknesses. This strengthens our confidence in the chosen option by showing that it can withstand scrutiny. *   **Criterion D (Interpretation):** This criterion analyzes the role of interpretation in Dworkin's theory. Understanding how Dworkin views interpretation is crucial for grasping his argument for objective moral truths. It clarifies how he reconciles the subjective act of interpretation with the possibility of discovering objective values. *   **Criterion E (Legal Positivism):** This criterion frames Dworkin's argument in opposition to legal positivism. This provides a crucial context for understanding the significance of his claims about the relationship between law and morality. It highlights how Dworkin's position challenges the traditional separation of law and morality advocated by legal positivists.  The **feasibility** of this plan is ensured by its structured approach. Each criterion provides a specific lens through which to analyze the options, making the evaluation process systematic and manageable. The layered approach allows for progressive refinement, starting with broad considerations and moving towards more nuanced arguments.  **2. Critical Evaluation of the ROT Idea**  While the ROT idea correctly identifies the importance of Dworkin's commitment to moral objectivism, it suffers from several weaknesses compared to the LOT plan:  *   **Oversimplification:** The ROT idea is based on a rather simplistic ""litmus test"" approach. While efficient, this approach risks overlooking the complexities and nuances of Dworkin's arguments. It treats his philosophy as a set of fixed principles, rather than a dynamic and evolving framework of interpretation. The LOT plan, with its multiple criteria, allows for a more nuanced and comprehensive understanding of Dworkin's position. *   **Lack of Depth:** The ROT idea doesn't delve into the potential challenges to Dworkin's moral objectivism. It simply asserts that moral objectivism is a core commitment, without exploring the counterarguments or the ways in which Dworkin addresses them. The LOT plan, through Criterion C, directly confronts these challenges, strengthening the overall argument. *   **Limited Scope:** The ROT idea primarily focuses on the relationship between law and morality, potentially neglecting the broader scope of *Justice for Hedgehogs*, which aims to defend the unity of value across ethics, morality, and politics. The LOT plan, especially through Criterion B, explicitly addresses this broader scope, ensuring that the chosen option aligns with Dworkin's overall philosophical project. *   **Insufficient Justification:** The ROT idea provides relatively little justification for its conclusions. It simply states that certain options are consistent or inconsistent with Dworkin's philosophy, without providing detailed arguments or evidence. The LOT plan, with its detailed analysis of each option through multiple criteria, offers a more robust and well-supported argument. *   **Misinterpretation of Interconnectedness:** As pointed out in the ROT critique, Criterion B of the LOT initially ""seems"" counterintuitive. However, the LOT plan then *corrects* this initial hesitation, explaining how the independence and objectivity of moral values are *essential* for a coherent and consistent framework across ethics, morality, and politics. The ROT critique misses this correction and the deeper understanding it reveals.  **3. Why the LOT Plan is Preferable**  The LOT plan is preferable because it offers a more comprehensive, nuanced, and robust analysis of the multiple-choice options. While the ROT idea is efficient and directly addresses the question, it risks oversimplifying Dworkin's philosophy and overlooking potential challenges. The LOT plan's layered approach, with its multiple criteria and detailed arguments, ensures a deeper understanding of Dworkin's position and strengthens the confidence in the chosen option. The LOT plan also explicitly addresses and corrects its own initial hesitations, demonstrating a more rigorous and self-aware analytical process. The ROT plan's focus on efficiency comes at the cost of thoroughness, making it less likely to identify the *best* answer, as opposed to simply a *plausible* one. The LOT plan is therefore the more effective approach for accurately and thoroughly answering the question."
