Round,Speaker,Utterance
1,Moderator,"Debate Topic: In-depth discussion based on the mission context and ideas from ROT and LOT. Mission Context (partial): Instruction: An arguer who threatens another to gain agreement commits the fallacy of  Context: The following are multiple choice options:[appeal to force, tu quoque, ignorance of refutation, straw person]... Initial Core Idea from ROT (partial): The problem describes a situation where an arguer uses threats to force agreement. This directly corresponds to the fallacy known as ""appeal to force."" The other options are not relevant: ""tu quoque"" is about hypocrisy, ""ignorance of refutation"" is about failing to disprove something, and ""straw person"" is about misrepresenting an opponent's argument.  Therefore, the correct answer is:  appeal to force... Initial Detailed Plan from LOT (partial): Aggregated result from layer 191 (Concept: 'Generate and present the answer based on the plan...') using strategy 'all_content_ranked': - (Criterion: 'Confirm that the provided definition of 'appeal to force' aligns with standard textbook definitions and online resources', Level: 1):   The definition ""An arguer who threatens another to gain agreement commits the fallacy of"" aligns perfectly with the standard definition of ""appeal to force"" (also known as argumentum ad baculum). This fallacy occurs when someone uses threats or intimidation to try to get another person to accept a conclusion. The threat replaces logical reasoning.  - (Criterion: 'For each of the other options (tu quoque, ignorance of refutation, straw person), provide a brief definition and example to illustrate why they are *not* the correct answer', Level: 1):   Okay, here are brief definitions and examples for the incorrect answer options, demonstrating why they don't fit the scenario of threatening someone to gain agreement:  *   **Tu Quoque:** This fallacy argues that someone's argument is invalid because the person making the argument is hypocritical or doesn't act consistently with their argument. It's essentially an ""appeal to hypocrisy.""      *   **Example:** ""You can't tell me to stop smoking, you used to smoke too!""  This deflects from the argument about the dangers of smoking by attacking the person's past behavior, not addressing the validity of the claim itself. It's not about threats or forced agreement.  *   **Ignorance of Refutation (Ignoratio Elenchi) / Missing the Point:** This fallacy presents an argument that, while possibly valid in itself, doesn't actually address the issue at hand. It's a failure to prove the specific conclusion that's supposed to be proven.      *   **Example:** ""We need to support the new housing project because we need to improve the local economy."" While improving the local economy might be a good goal, it doesn't necessarily mean the housing project is the *best* or *only* way to achieve that goal, or that the housing project will *actually* improve the economy. This argument doesn't directly refute arguments *against* the housing project. Again, no threats are involved.  *   **Straw Person:** This fallacy misrepresents an opponent's argument to make it easier to attack. The arguer creates a ""straw man"" version of the argument, knocks it down, and then claims to have defeated the *real* argument.      *   **Example:** ""My opponent wants to cut military spending. Clearly, they want to leave our country defenseless!"" This misrepresents the opponent's position (they might just want to reduce wasteful spending, not eliminate defense entirely) to make it easier to attack. It's about misrepresenting arguments, not threatening people.  - (Criterion: 'Formulate a specific example of an 'appeal to force' argument, different from the examples already provided, and analyze its structure to highlight the fallacy', Level: 1):   Okay, here's a specific example of an appeal to force, along with an analysis of its structure:  **Example:**  Boss to Employee: ""I know you disagree with my decision to cut your department's budget, but if you want to keep your job, you'll publicly support it. Otherwise, things might 'get difficult' for you here.""  **Analysis of the Structure and Fallacy:**  1. **Premise (Implicit):** The employee disagrees with the budget cut. 2. **Threat:** ""If you want to keep your job...things might 'get difficult' for you here."" This is a veiled, but clear, threat of negative consequences (job loss, harassment, etc.). 3. **Conclusion (Implicit):** Therefore, the employee should publicly support the budget cut (even though they disagree).  **Why it's an Appeal to Force:**  The argument doesn't provide any logical reasons why the budget cut is a good idea or why the employee should support it. Instead, it relies entirely on the threat of negative consequences to coerce agreement. The boss is not trying to persuade the employee through reason or evidence; they are attempting to force compliance through fear.  The *truth* or *validity* of the budget cut is irrelevant. The only motivation for agreement is to avoid the threatened harm. This is a classic example of *argumentum ad baculum* (argument to the stick).  - (Criterion: 'Discuss the ethical implications of using the 'appeal to force' fallacy in argumentation and debate', Level: 1):   The ethical implications of using the ""appeal to force"" fallacy are significant. It fundamentally undermines the principles of rational discourse and replaces reasoned argument with coercion. Instead of seeking understanding and agreement through logic and evidence, it relies on fear and intimidation. This not only stifles open debate and the free exchange of ideas but also violates the autonomy and dignity of the person being threatened. It's a form of intellectual bullying that can have a chilling effect on participation and the pursuit of truth. Using this fallacy prioritizes power dynamics over genuine engagement with the merits of an argument.  - (Criterion: 'Research and compare the 'appeal to force' fallacy with other related fallacies, such as 'appeal to pity' or 'appeal to authority', highlighting the key differences', Level: 1):   The appeal to force (argumentum ad baculum) is distinct from other fallacies that might seem similar. While all aim to persuade, they do so through different means.  *   **Appeal to Force (Argumentum ad Baculum):** Uses threats or intimidation to coerce acceptance of a conclusion. The arguer implies negative consequences if the listener doesn't agree. The focus is on the *consequences* of disagreement, not the merits of the argument itself.  *   **Appeal to Pity (Argumentum ad Misericordiam):** Attempts to persuade by evoking feelings of pity or sympathy, rather than providing logical reasons. While emotions are involved, there's no explicit or implicit threat. The focus is on eliciting *compassion* to sway the listener.  *   **Appeal to Authority (Argumentum ad Verecundiam):** Argues that a conclusion is true simply because an authority figure says so. The problem is that the authority might not be an expert on the specific topic, or the authority might be biased. There are no threats involved; the focus is on the *credibility* of the source.  In summary, the key difference is the element of coercion or threat present in the appeal to force, which is absent in the other fallacies. The appeal to force doesn't attempt to provide evidence or reason; it simply leverages power or the threat of negative consequences to gain agreement.  - (Criterion: 'Analyze how the 'appeal to force' fallacy can be used subtly or disguised in real-world scenarios, such as political campaigns or advertising.', Level: 1):   The appeal to force, or argumentum ad baculum, isn't always a blatant threat. Sometimes it's presented as a subtle warning or a prediction of negative consequences disguised as objective analysis.  In political campaigns, a candidate might say, ""If my opponent's policies are enacted, businesses will leave the state and jobs will be lost."" While seemingly a statement about economic impact, it can function as a veiled threat: Vote for my opponent, and you'll suffer financially. The force implied isn't direct violence, but economic hardship.  In advertising, a company might state, ""Our competitor's product may be cheaper, but it's made with inferior materials and prone to failure."" The implied threat is the inconvenience and expense of a product breaking down, subtly pushing consumers towards the more expensive (and presumably more reliable) option. The ""force"" here is the potential negative experience of using a substandard product.  The key is that the argument relies on the *fear* of negative consequences rather than logical reasoning or evidence. The arguer is essentially saying, ""Agree with me, or something bad will happen to you (or to others)."" This contrasts with a legitimate argument that uses evidence to demonstrate a likely negative outcome based on a given course of action. The fallacy occurs when the ""bad thing"" is irrelevant to the truth of the conclusion.  ... The debate will now commence focusing on these ideas."
2,ROT_Representative,"Okay, here's my response as the ROT_Representative, addressing the prompt and comparing my core idea to the LOT-generated plan.  **1. Elaboration on the ROT Core Idea and its Strengths**  My core idea is that the provided scenario, where an arguer uses threats to gain agreement, directly exemplifies the ""appeal to force"" fallacy. The alternative options (tu quoque, ignorance of refutation, and straw person) are simply irrelevant because they describe entirely different fallacies.  **Key Strengths:**  *   **Directness and Simplicity:** It directly addresses the prompt's core issue without overcomplicating the explanation. The definition given in the problem statement is a straightforward example of the fallacy. *   **Accuracy:** It correctly identifies the fallacy based on the given definition. *   **Efficiency:** It cuts to the chase, immediately pointing out the correct answer and dismissing the irrelevant options.  **2. Critical Evaluation of the LOT Idea**  The LOT-generated plan is comprehensive and well-researched, covering multiple angles of the ""appeal to force"" fallacy. However, its complexity is a potential weakness in the context of a simple multiple-choice question. While the detailed explanations are valuable for a deeper understanding, they are unnecessary for simply identifying the correct answer.  Here's a breakdown of my evaluation of each criterion:  *   **Criterion 1 (Definition Alignment):** This is a strong point of the LOT plan. Confirming the alignment of the provided definition with standard definitions is crucial for ensuring accuracy. No real weaknesses here.  *   **Criterion 2 (Explanation of Incorrect Options):** This is also a good approach. Providing definitions and examples of the incorrect options helps eliminate confusion and reinforces understanding. However, the LOT explanation is a bit lengthy for the problem's context. A briefer explanation would suffice.  *   **Criterion 3 (Formulating an Example and Analysis):** While the example (Boss to Employee) is excellent and the analysis is spot-on, it's overkill for answering the multiple-choice question. This level of detail is more appropriate for a longer essay or a classroom discussion.  *   **Criterion 4 (Ethical Implications):** Discussing the ethical implications adds value, but it's not directly relevant to identifying the fallacy in the given scenario. It shifts the focus from logical reasoning to ethical considerations.  *   **Criterion 5 (Comparison with Related Fallacies):** This is a beneficial comparison for understanding the nuances of different fallacies, but again, it's not strictly necessary for answering the multiple-choice question.  *   **Criterion 6 (Subtle Uses of Appeal to Force):** Analyzing subtle uses is insightful, but adds an unnecessary layer of complexity for this particular question.  **Weaknesses, Overlooked Aspects, or Limitations of the LOT Idea:**  *   **Overly Comprehensive:** The LOT plan aims for a deep dive into the ""appeal to force"" fallacy, which is commendable for educational purposes but inefficient for answering a straightforward multiple-choice question. *   **Lack of Focus on Efficiency:** The plan doesn't prioritize getting to the correct answer quickly and efficiently. It spends time exploring related concepts and scenarios that, while interesting, are not essential for solving the problem. *   **Potential for Confusion:** The sheer volume of information in the LOT plan could potentially confuse someone who is simply trying to identify the fallacy.  **Why the ROT Approach is Preferable:**  My ROT approach is preferable because it's:  *   **Direct:** It directly addresses the core problem without unnecessary detours. *   **Efficient:** It quickly identifies the correct answer and dismisses the irrelevant options. *   **Clear:** It provides a concise and easy-to-understand explanation. *   **Contextually Appropriate:** It's tailored to the specific requirements of the multiple-choice question.  The LOT approach is valuable for a comprehensive understanding of the ""appeal to force"" fallacy, but my ROT approach is more effective for quickly and accurately answering the question presented. In essence, LOT provides a detailed lecture on the fallacy, while ROT provides the correct answer and a brief justification. For this particular task, the latter is more desirable."
3,LOT_Representative,"Okay, here's my response as the LOT Representative, defending my plan and critiquing the ROT idea:  **1. Elaboration on the LOT Plan and its Strengths & Feasibility**  My LOT plan addresses the core problem – identifying the fallacy committed when someone threatens another to gain agreement – with a multi-faceted approach designed to ensure not only the correct answer but also a comprehensive understanding of the fallacy itself.  **Key Strengths:**  *   **Comprehensive Understanding:** The plan goes beyond simply identifying ""appeal to force"" as the answer. It provides a deep dive into the nature of the fallacy, its variations, ethical implications, and how it differs from other similar fallacies. This fosters a more robust and lasting understanding. *   **Contextualization:** By defining and providing examples of the incorrect options (tu quoque, ignorance of refutation, straw person), the plan actively eliminates potential confusion and reinforces the unique characteristics of ""appeal to force."" This strengthens the user's ability to differentiate between fallacies in various contexts. *   **Real-World Application:** The plan includes an analysis of how ""appeal to force"" can be subtly used in political campaigns and advertising. This demonstrates the relevance of the fallacy to real-world situations and enhances the user's ability to recognize it in everyday arguments. *   **Ethical Awareness:** The discussion of ethical implications adds a crucial dimension, highlighting the dangers of using threats and intimidation in argumentation and promoting a more responsible approach to discourse. *   **Thoroughness and Accuracy:** The plan ensures accuracy by confirming the alignment of the provided definition with standard textbook definitions and online resources. This builds confidence in the correctness of the answer.  **Feasibility:**  While the plan appears lengthy, each criterion is designed to be concise and easily digestible. The use of bullet points, clear examples, and straightforward language makes the information accessible and prevents it from becoming overwhelming. Each section can be understood independently, allowing for flexible engagement with the material.  **2. Critical Evaluation of the ROT Idea**  The ROT idea correctly identifies ""appeal to force"" as the answer. However, it suffers from significant limitations in terms of depth, scope, and long-term learning.  **Potential Weaknesses, Overlooked Aspects, or Limitations of the ROT Idea:**  *   **Superficial Understanding:** The ROT idea provides only a basic identification of the fallacy without exploring its nuances, variations, or ethical implications. This leaves the user with a superficial understanding that may not be transferable to more complex scenarios. *   **Lack of Context:** The ROT idea dismisses the incorrect options without providing sufficient explanation. This fails to address potential confusion and limits the user's ability to differentiate between fallacies effectively. *   **Limited Real-World Application:** The ROT idea does not connect the fallacy to real-world examples or demonstrate its relevance to everyday arguments. This makes the learning experience less engaging and practical. *   **Missed Ethical Dimension:** The ROT idea ignores the ethical implications of using ""appeal to force,"" failing to highlight the dangers of coercion and intimidation in argumentation. *   **Reliance on a Single Definition:** The ROT idea relies solely on the provided definition without confirming its alignment with standard definitions or exploring alternative formulations. This raises concerns about accuracy and completeness.  **3. Why the LOT Approach is Preferable**  The LOT approach is preferable because it prioritizes a deeper, more comprehensive, and ethically aware understanding of the ""appeal to force"" fallacy.  *   **Enhanced Learning:** By providing context, real-world examples, and ethical considerations, the LOT plan fosters a more robust and lasting learning experience compared to the ROT idea's superficial identification. *   **Improved Critical Thinking:** The LOT plan encourages critical thinking by prompting the user to differentiate between fallacies, analyze subtle uses of ""appeal to force,"" and evaluate its ethical implications. *   **Greater Practical Relevance:** The LOT plan demonstrates the relevance of the fallacy to real-world situations, enhancing the user's ability to recognize and respond to it effectively in everyday arguments. *   **Ethical Awareness:** The LOT plan raises awareness of the ethical dangers of using ""appeal to force,"" promoting a more responsible and constructive approach to discourse.  In essence, while the ROT idea provides a quick answer, the LOT plan provides a valuable education. For a simple multiple-choice question, ROT might seem sufficient. However, for truly understanding the fallacy and being able to apply that knowledge in a variety of situations, the LOT approach is far superior. The goal isn't just to answer a question correctly, but to understand the underlying concept thoroughly."
4,Critical_Analyst,"Okay, here's my analysis as the Critical_Analyst, evaluating the ROT and LOT ideas for the given mission.  **Evaluation of ROT's Idea:**  *   **Strengths:** ROT's idea is direct, efficient, and accurate. It correctly identifies the ""appeal to force"" fallacy and explains why the other options are irrelevant. It's perfectly suited for quickly answering the multiple-choice question. *   **Weaknesses:** ROT's approach is superficial. It provides a minimal explanation and doesn't explore the nuances, ethical implications, or real-world applications of the fallacy. It's solely focused on getting the right answer, neglecting deeper understanding. *   **Overlooked Aspects:** ROT overlooks the opportunity to reinforce the understanding of other fallacies and to demonstrate the practical relevance of recognizing the ""appeal to force"" in various contexts. *   **Inconsistencies:** No inconsistencies are present. *   **Correctness:** The answer is correct. *   **Completeness:** The answer is incomplete in terms of providing a thorough understanding of the topic. *   **Improvements:** ROT could benefit from briefly explaining *why* each of the incorrect options is a fallacy, thereby solidifying the understanding of logical fallacies in general.  **Evaluation of LOT's Idea:**  *   **Strengths:** LOT's idea is comprehensive, well-researched, and ethically aware. It provides a deep dive into the ""appeal to force"" fallacy, explores its variations, and differentiates it from other similar fallacies. It also highlights the ethical implications of using threats and intimidation in argumentation. *   **Weaknesses:** LOT's approach is overly comprehensive for a simple multiple-choice question. The level of detail is unnecessary and could potentially confuse someone who is simply trying to identify the correct answer. It prioritizes breadth over efficiency. *   **Overlooked Aspects:** It doesn't particularly overlook any aspects of the fallacy itself, but it could be argued that the *context* of a multiple-choice question necessitates a more streamlined approach. *   **Inconsistencies:** No inconsistencies are present. *   **Correctness:** The identification of the correct answer is accurate, as it is embedded within the comprehensive explanation. *   **Completeness:** The answer is complete in terms of providing a thorough understanding of the topic. *   **Improvements:** LOT could benefit from prioritizing the core identification of the fallacy and then presenting the additional information in a more structured and hierarchical manner. This would make it easier for the user to quickly find the answer and then delve deeper if desired.  **Balanced Overall Critique:**  Both ROT and LOT have their strengths and weaknesses. ROT is efficient and accurate but lacks depth. LOT is comprehensive and ethically aware but overly complex for the given task. The ideal solution would strike a balance between these two approaches, providing a clear and concise answer while also offering additional context and explanation for those who want to learn more.  ROT is suitable for someone who just wants the answer. LOT is suitable for someone who wants to learn everything about the fallacy.  The best approach is to give the answer directly (ROT's strength), then briefly explain why the other options are wrong (LOT's strength), and then perhaps provide a short example (also from LOT).  ### Synthesized Accurate Answer: appeal to force"
