Round,Speaker,Utterance
1,Moderator,"Debate Topic: In-depth discussion based on the mission context and ideas from ROT and GOT. Mission Context (partial): Instruction: Why does Parfit oppose equality?  Context: [He argues than an unequal society is inevitable., He claims that by giving priority to the needs of the poor, we can increase equality., He asserts that we are each responsible for our poverty., He rejects the idea of equality altogether.]... Initial Core Idea from ROT (partial): Parfit opposes strict egalitarianism, the view that equality of outcome should be the primary goal of social policy, because he believes it can be detrimental to overall well-being and, crucially, to the well-being of the worst-off. His opposition stems from his commitment to prioritarianism and his belief that inequality can sometimes be justified if it demonstrably benefits the least advantaged members of society. Strict egalitarianism, in its pursuit of absolute equality, might require ""leveling down,"" a scenario where resources are redistributed in a way that makes everyone worse off without improving anyone's relative position. Parfit finds this objectionable because it prioritizes equality over actual well-being.  Prioritarianism, which gives extra weight to improving the well-being of those who are worse off, directly clashes with strict egalitarianism. A prioritarian would favor policies that significantly improve the lives of the poorest, even if those policies slightly increase inequality. For example, a policy that creates jobs and raises the living standards of the poor, even if it also allows some individuals to become wealthier, would be preferable to a policy that enforces strict equality but provides minimal benefit to the worst-off. Parfit's reasoning is that focusing solely on equality can be counterproductive if it prevents improvements in the absolute well-being of those who need it most.  Furthermore, Parfit argues that inequality can be a necessary condition for improving the lives of the worst-off. He believes that allowing some individuals to accumulate more wealth can incentivize innovation, investment, and economic growth, which can ultimately lead to job creation, higher wages, and improved living standards for everyone, including the poorest members of society. In this view, inequality is not inherently bad; it is only bad if it fails to benefit the least advantaged. Therefore, Parfit rejects strict egalitarianism because it could prevent policies that, while creating some inequality, ultimately lead to a better life for the worst-off. He prioritizes improving the absolute well-being of the least advantaged, even if it means accepting some degree of inequality.... Initial Core Idea from GOT (partial): Parfit opposes strict egalitarianism (equality of outcome) because he believes it can lead to morally repugnant outcomes where overall well-being is unnecessarily sacrificed in the name of equality. His opposition stems from two core principles: prioritarianism and the belief that inequality can sometimes benefit the worst-off.  Parfit is a prioritarian, meaning he believes that benefiting the worst-off is morally more important than benefiting those who are already better off. He doesn't advocate for strict equality, but rather for giving extra weight to improvements in the well-being of those who are at the bottom. Strict egalitarianism, in contrast, focuses solely on equality, even if achieving it makes everyone worse off, including the very people prioritarianism seeks to help most. This is because prioritarianism prioritizes improving the lives of the worst-off, even if it means accepting some level of inequality, whereas strict egalitarianism prioritizes equal outcomes above all else.  Parfit also recognizes that in certain situations, allowing some degree of inequality can actually improve the lives of the least advantaged. This is often because incentives and innovation require some level of differential reward. Suppressing all inequality, even when it would lead to overall improvements, is counterproductive. He would object to ""leveling down,"" where equality is achieved by making everyone equally worse off.  The potential for inequality to benefit the worst-off is exemplified by the ""Medical Innovation Dilemma,"" where a society with some inequality invests in advanced medical research, leading to cures for diseases that disproportionately affect the poor. A strictly egalitarian society, by spreading resources equally, might not have the resources for such research, ultimately harming the worst-off. This illustrates Parfit's belief that while helping the worst-off is paramount, achieving this goal may sometimes require accepting some level of inequality. Therefore, Parfit opposes strict egalitarianism because it can be detrimental to overall well-being and, paradoxically, to the long-term prospects of the least advantaged. He favors a prioritarian approach that recognizes the importance of helping the worst-off, but also acknowledges that inequality can sometimes be a necessary means to that end. ... The debate will now commence focusing on these ideas."
2,ROT_Representative,"Okay, here's my response as the ROT Representative, elaborating on my core idea and critically evaluating the GOT idea:  **1. Elaboration on the ROT Idea and its Strengths:**  My core idea directly addresses the question of why Parfit opposes equality by focusing on his rejection of *strict egalitarianism* and his commitment to *prioritarianism*.  *   **Addressing the Core Problem:** It explains that Parfit doesn't oppose equality in all forms, but rather the rigid pursuit of equal outcomes, which he believes can be counterproductive. It highlights the core conflict: the potential for strict egalitarianism to harm overall well-being and, paradoxically, the well-being of the worst-off. *   **Key Strengths:**     *   **Clarity of Focus:** It clearly defines ""strict egalitarianism"" as the target of Parfit's opposition.     *   **Emphasis on Prioritarianism:** It underscores the importance of prioritarianism as the driving force behind Parfit's views, clarifying that Parfit prioritizes improving the lives of the worst-off.     *   **The ""Leveling Down"" Argument:** It introduces the powerful ""leveling down"" objection, which succinctly captures Parfit's concern that strict equality can lead to outcomes where everyone is worse off.     *   **Justification of Inequality:** It explains Parfit's belief that inequality can sometimes be justified if it demonstrably benefits the least advantaged, providing a nuanced understanding of his position.     *   **Practical Implications:** It illustrates how Parfit's views translate into policy preferences, favoring policies that improve the lives of the poor even if they increase inequality.  **2. Critical Evaluation of the GOT Idea:**  The GOT idea is very similar to mine, and in many ways equally strong. It also correctly identifies Parfit's opposition to *strict egalitarianism* and his commitment to *prioritarianism*. However, there are some subtle differences worth noting:  *   **Potential Weaknesses & Overlooked Aspects:**     *   **Moral Repugnance:** The GOT idea uses the phrase ""morally repugnant outcomes."" While accurate, this framing might be seen as slightly hyperbolic and less precise than focusing on the concrete concern of reducing overall well-being. It's a stronger claim to say ""detrimental to overall well-being"" than ""morally repugnant outcomes.""     *   **Emphasis on Incentives:** While it mentions incentives, the GOT idea doesn't fully elaborate on the mechanisms by which inequality can benefit the worst-off, beyond a general statement about ""incentives and innovation."" My ROT idea more explicitly connects inequality to investment, economic growth, job creation, and higher wages.     *   **Medical Innovation Dilemma:** The GOT idea introduces the ""Medical Innovation Dilemma."" This is a useful illustration, but it is just one example, and could be seen as slightly less general than the broader argument about investment and economic growth. Also, relying on a single example might make the argument seem less robust.     *   **Less Direct Connection to Context:** The GOT idea, in its introduction, doesn't directly address the context provided (""He argues than an unequal society is inevitable., He claims that by giving priority to the needs of the poor, we can increase equality., He asserts that we are each responsible for our poverty., He rejects the idea of equality altogether.""). The ROT idea implicitly addresses the idea that ""He rejects the idea of equality altogether"" by focusing on how he only rejects the *strict* version of it, and claims that inequality is inevitable.  *   **Why the ROT Approach Might Be Preferable:**     *   **Greater Precision:** The ROT idea's focus on ""detrimental to overall well-being"" is arguably more precise and less potentially inflammatory than ""morally repugnant outcomes.""     *   **More Detailed Explanation of Mechanisms:** The ROT idea provides a more detailed explanation of how inequality can benefit the worst-off (investment, economic growth, job creation, higher wages).     *   **Broader Applicability:** The ROT idea's argument about investment and economic growth is more generally applicable than the specific ""Medical Innovation Dilemma"" example.     *   **Better integration with the context:** The ROT idea better contextualizes the initial prompt.  In summary, while the GOT idea is largely correct and well-reasoned, the ROT idea offers a slightly more precise, detailed, and broadly applicable explanation of Parfit's opposition to strict egalitarianism, and it does a slightly better job of integrating the context provided. The difference is subtle, but the ROT idea's emphasis on the concrete mechanisms by which inequality can benefit the worst-off, and its avoidance of potentially inflammatory language, make it a slightly stronger approach."
3,GOT_Representative,"Okay, here is my response as the GOT Representative:  **1. Elaboration on the GOT Idea and its Strengths:**  My core idea directly answers the question of why Parfit opposes equality by highlighting his rejection of strict egalitarianism and grounding that rejection in his commitment to prioritarianism *and* the potential benefits of inequality for the worst-off. It argues that Parfit's opposition isn't simply about abstract philosophical principles, but about the concrete, and potentially ""morally repugnant,"" consequences of prioritizing equality above all else.  *   **Addressing the Core Problem:** It explains that Parfit's opposition to equality is nuanced. He doesn't reject all forms of equality, but rather the pursuit of strict equality of outcome, which he believes can lead to situations where everyone, including the worst-off, are made worse off. *   **Key Strengths:**     *   **Emphasis on ""Morally Repugnant Outcomes"":** Framing the potential consequences of strict egalitarianism as ""morally repugnant"" immediately grabs attention and underscores the high stakes of the debate. It highlights the potential for strict egalitarianism to lead to outcomes that are intuitively unacceptable.     *   **Explicit Connection to Prioritarianism and Benefits of Inequality:** It clearly articulates the two pillars of Parfit's opposition: his prioritarianism and his belief that inequality can, under certain circumstances, benefit the least advantaged.     *   **Practical Illustration with the Medical Innovation Dilemma:** The ""Medical Innovation Dilemma"" provides a concrete and memorable example of how inequality can lead to advancements that disproportionately benefit the poor, illustrating Parfit's argument in a relatable way.     *   **Emphasis on Incentives and Innovation:** It highlights the role of incentives and innovation as key mechanisms through which inequality can benefit the worst-off.     *   **Comprehensive Explanation:** It offers a comprehensive explanation of Parfit's position, connecting his philosophical commitments to practical considerations.     *   **Directly Addresses the Context:** The GOT idea tackles the context by showing how Parfit's opposition addresses the statement that ""He rejects the idea of equality altogether"" by clarifying he rejects *strict* equality, and that his prioritarianism attempts to address the needs of the poor, and that while he may think an unequal society is inevitable, that inequality can be used to improve equality.  **2. Critical Evaluation of the ROT Idea:**  While the ROT idea is strong and largely aligns with my own, there are some key differences that make the GOT approach potentially preferable.  *   **Potential Weaknesses & Overlooked Aspects of the ROT Idea:**     *   **Downplaying the Moral Dimension:** The ROT idea's focus on ""detrimental to overall well-being"" is arguably too clinical and downplays the *moral* dimension of Parfit's concerns. Parfit's opposition to strict egalitarianism isn't simply about efficiency; it's about justice and fairness. The phrase ""morally repugnant outcomes"" better captures the intuitive sense of injustice that Parfit identifies in certain egalitarian scenarios. While ""detrimental to overall well-being"" is accurate, it is also easily co-opted by arguments that accept such detriments in exchange for other things.     *   **Less Memorable Framing:** While the ROT idea's language is precise, it is also less memorable and less likely to resonate with a general audience. The ""leveling down"" argument is strong, but it lacks the immediate impact of the ""Medical Innovation Dilemma"" or the phrase ""morally repugnant outcomes.""     *   **Implicit vs. Explicit Connection to Incentives:** While the ROT idea mentions investment and economic growth, it doesn't explicitly highlight the crucial role of *incentives* in driving innovation and productivity. The GOT idea makes this connection more explicit.     *   **Limited Scope of ""Leveling Down"":** The ROT idea focuses primarily on the ""leveling down"" objection. While important, this is just one way in which strict egalitarianism can be problematic. The GOT idea, with its emphasis on the broader concept of ""morally repugnant outcomes"" and the ""Medical Innovation Dilemma,"" provides a more comprehensive critique.     *   **Contextual Integration:** While both ideas address the context, the GOT idea's emphasis on the moral dimension and the potential benefits of inequality for the worst-off more directly engages with the implicit assumptions and potential counterarguments suggested by the context.  *   **Why the GOT Approach Might Be Preferable:**     *   **Stronger Moral Framing:** The GOT idea's framing of the issue in terms of ""morally repugnant outcomes"" makes it more compelling and more likely to resonate with a wider audience.     *   **More Memorable and Engaging:** The ""Medical Innovation Dilemma"" provides a concrete and memorable example that illustrates Parfit's argument in a relatable way. The ROT idea's language is more academic and less likely to stick in the reader's mind.     *   **Greater Emphasis on Incentives:** The GOT idea's explicit connection to incentives highlights a crucial mechanism through which inequality can benefit the worst-off.     *   **More Comprehensive Critique:** The GOT idea offers a more comprehensive critique of strict egalitarianism, going beyond the ""leveling down"" objection to address the broader range of potential problems.     *   **Better Integration with the Context:** The GOT idea's stronger moral framing and emphasis on the potential benefits of inequality for the worst-off allows it to more directly engage with the underlying assumptions and potential counterarguments suggested by the initial context.  In summary, while the ROT idea is a solid explanation of Parfit's opposition to strict egalitarianism, the GOT idea offers a more compelling, memorable, and comprehensive critique, making it a potentially more persuasive and impactful approach. The framing in terms of morally repugnant outcomes, coupled with the Medical Innovation Dilemma, provides a stronger foundation for understanding Parfit's nuanced position."
4,Critical_Analyst,"Okay, here's my critical analysis of the ROT and GOT ideas regarding Parfit's opposition to equality, focusing on their strengths, weaknesses, and potential improvements, relative to the mission context:  **Overall Assessment:**  Both ROT and GOT correctly identify the core of Parfit's argument: his opposition to *strict egalitarianism* driven by *prioritarianism* and the belief that *inequality can sometimes benefit the worst-off*. Both understand that Parfit does not reject equality altogether, but rather a rigid adherence to equality of outcome. However, they differ in their emphasis and framing, leading to slightly different strengths and weaknesses. I find GOT to be marginally stronger due to its more memorable framing and comprehensive critique.  **ROT Analysis:**  *   **Strengths:**     *   **Clarity and Precision:** ROT clearly defines ""strict egalitarianism"" and emphasizes the importance of prioritarianism.     *   **Detailed Explanation of Mechanisms:** ROT provides a more detailed explanation of how inequality can benefit the worst-off (investment, economic growth, job creation, higher wages). This is a significant strength.     *   **Broader Applicability of Argument:** The argument about investment and economic growth is more generally applicable than the ""Medical Innovation Dilemma"".     *   **Contextual Integration:** ROT connects better to the initial prompt by focusing on his rejection of the *strict* version of equality, and claims that inequality is inevitable. *   **Weaknesses:**     *   **Downplaying the Moral Dimension:** Framing the issue solely in terms of ""detrimental to overall well-being"" can be seen as too clinical and misses the moral dimension of Parfit's argument.     *   **Less Memorable Framing:** The language is precise but less engaging and memorable than GOT's approach.     *   **Limited Scope of ""Leveling Down"":** While ""leveling down"" is a valid concern, focusing primarily on it might limit the scope of the critique.     *   **Implicit connection to incentives:** While ROT mentions investment and economic growth, it doesn't explicitly highlight the crucial role of *incentives* in driving innovation and productivity. *   **Correctness and Completeness:** ROT is largely correct and reasonably complete. It captures the key elements of Parfit's argument. *   **Suggested Improvements:**     *   Acknowledge the moral dimension more explicitly. Even briefly mentioning concerns about fairness or justice would strengthen the argument.     *   While investment and economic growth are important, explicitly mentioning *incentives* would further clarify the mechanism by which inequality can benefit the worst-off.     *   Expand beyond the ""leveling down"" objection by briefly mentioning other potential drawbacks of strict egalitarianism.  **GOT Analysis:**  *   **Strengths:**     *   **Strong Moral Framing:** The ""morally repugnant outcomes"" framing is compelling and resonates with a wider audience.     *   **Memorable and Engaging:** The ""Medical Innovation Dilemma"" provides a concrete and relatable example.     *   **Emphasis on Incentives:** GOT explicitly connects inequality to incentives and innovation.     *   **Comprehensive Critique:** GOT offers a more comprehensive critique of strict egalitarianism.     *   **Directly Addresses the Context:** The GOT idea tackles the context by showing how Parfit's opposition addresses the statement that ""He rejects the idea of equality altogether"" by clarifying he rejects *strict* equality, and that his prioritarianism attempts to address the needs of the poor, and that while he may think an unequal society is inevitable, that inequality can be used to improve equality. *   **Weaknesses:**     *   **Potential for Hyperbole:** The ""morally repugnant outcomes"" framing, while effective, could be seen as hyperbolic by some.     *   **Over-reliance on a Single Example:** The ""Medical Innovation Dilemma,"" while memorable, is just one example and could be seen as less general than ROT's argument about investment and economic growth. *   **Correctness and Completeness:** GOT is also largely correct and reasonably complete. It captures the key elements of Parfit's argument. *   **Suggested Improvements:**     *   While the ""Medical Innovation Dilemma"" is effective, consider including a brief mention of other ways inequality can benefit the worst-off (e.g., investment, economic growth, job creation). This would broaden the argument and make it less reliant on a single example.     *   Acknowledge the potential for the ""morally repugnant outcomes"" framing to be seen as hyperbolic, and perhaps qualify it slightly.  **Balanced Overall Critique:**  Both ROT and GOT provide good explanations of Parfit's opposition to strict egalitarianism. ROT offers a more detailed and broadly applicable explanation of the mechanisms by which inequality can benefit the worst-off, while GOT offers a more compelling and memorable framing of the issue.  GOT's framing is arguably more effective in capturing the moral dimension of Parfit's concerns, and the ""Medical Innovation Dilemma"" provides a concrete and relatable example that helps to illustrate Parfit's argument. However, ROT's emphasis on investment, economic growth, job creation, and higher wages provides a more robust and generally applicable explanation of how inequality can benefit the worst-off.  The best approach might be to combine the strengths of both ideas. A compelling explanation of Parfit's opposition to strict egalitarianism would:  1.  Clearly define ""strict egalitarianism."" 2.  Emphasize the importance of prioritarianism. 3.  Acknowledge the moral dimension of Parfit's concerns (perhaps using a slightly less hyperbolic phrase than ""morally repugnant outcomes""). 4.  Provide a concrete and relatable example (like the ""Medical Innovation Dilemma""). 5.  Offer a robust and generally applicable explanation of how inequality can benefit the worst-off (including investment, economic growth, job creation, higher wages, *and incentives*). 6. Address the context in the prompt.  Given the current presentations, GOT is marginally stronger due to its framing and memorability, but could benefit from incorporating some of ROT's more detailed explanations."
